sentence,sentence_preprocessed,sentence_length,word_freq,high_low_freq,word_level,long_word_count,is_complete_sentence,is_complete_context,is_blacklist,is_greylist
在一切混沌未明之際，工研院在民國六十五年三月與RCA簽訂技轉合約，授權費為三百五十萬美元，至於技轉的項目，則包括電路設計、光罩製作、晶圓製作、包裝測試、應用與生產管理，RCA提供三百三十人次的訓練名額，前往美國各廠直接受訓。,在 一切 混沌 未 明 之 際 工研院 在 民國 六十五年 三月 與 RCA 簽訂 技轉 合約 授權費 為 三百五十萬 美元 至於 技轉 的 項目 則 包括 電路 設計 光罩 製作 晶圓 製作 包裝 測試 應用 與 生產 管理 RCA 提供 三百三十 人次 的 訓練 名額 前往 美國 各 廠 直接 受訓,52,在(3284238) 一切(95523) 混沌(1956) 未(101927) 明(21507) 之(875481) 際(14344) 工研院(829) 在(3284238) 民國(16130) 六十五年(114) 三月(16043) 與(968432) RCA(479) 簽訂(3196) 技轉(31) 合約(4647) 授權費(18) 為(761341) 三百五十萬(89) 美元(27307) 至於(39363) 技轉(31) 的(16029838) 項目(12387) 則(254096) 包括(74410) 電路(1098) 設計(59326) 光罩(152) 製作(26135) 晶圓(442) 製作(26135) 包裝(5682) 測試(10686) 應用(17149) 與(968432) 生產(36079) 管理(54484) RCA(479) 提供(73097) 三百三十(67) 人次(848) 的(16029838) 訓練(39436) 名額(820) 前往(27321) 美國(148299) 各(243023) 廠(4599) 直接(54798) 受訓(1398),"{'High': 47, 'Low': 5}","{'第1*級': 2, '第3*級': 2, '第7級': 2, '第5級': 11, 'Unknown': 17, '第6級': 4, '第4*級': 7, '第4級': 2, '第1級': 3, '第2級': 1, '第3級': 1}",7,Y,Y,N,N
赴美受訓總領隊、現任華邦電子副董事長楊丁元表示，RCA技術移轉案的重點是在建立示範工廠，因此幾乎是以滴水不漏的方式，要求全部受訓成員「全都學」，廠務、會計、生產作業，甚至簡單到工作簿記也要記得，「以今天的眼光來看，這是一項正確而重要的決策」。,赴 美 受訓 總領隊 現任 華邦 電子 副 董事長 楊丁元 表示 RCA 技術 移轉案 的 重點 是 在 建立 示範 工廠 因此 幾乎 是 以 滴水不漏 的 方式 要求 全部 受訓 成員 全 都 學 廠務 會計 生產 作業 甚至 簡單 到 工作 簿記 也 要 記得 以 今天 的 眼光 來 看 這 是 一 項 正確 而 重要 的 決策,62,赴(12878) 美(53380) 受訓(1398) 總領隊(24) 現任(3412) 華邦(64) 電子(17642) 副(21458) 董事長(8106) 楊丁元(55) 表示(74452) RCA(479) 技術(47691) 移轉案(13) 的(16029838) 重點(22761) 是(4642407) 在(3284238) 建立(52946) 示範(5441) 工廠(16192) 因此(184606) 幾乎(74298) 是(4642407) 以(547785) 滴水不漏(261) 的(16029838) 方式(133407) 要求(71192) 全部(34039) 受訓(1398) 成員(25071) 全(178642) 都(1125846) 學(48982) 廠務(45) 會計(4887) 生產(36079) 作業(16954) 甚至(122502) 簡單(52683) 到(546906) 工作(220164) 簿記(293) 也(1590760) 要(851264) 記得(47506) 以(547785) 今天(73277) 的(16029838) 眼光(13910) 來(742183) 看(444691) 這(2114032) 是(4642407) 一(3701681) 項(88887) 正確(36593) 而(937923) 重要(154863) 的(16029838) 決策(16052),"{'High': 57, 'Low': 5}","{'第6級': 5, '第1*級': 2, 'Unknown': 10, '第4級': 6, '第5級': 9, '第4*級': 6, '第1級': 17, '第3*級': 1, '第2級': 6}",6,Y,Y,N,Y
適切人才的匯集，註定此項超級任務的成功。,適切 人才 的 匯集 註定 此 項 超級 任務 的 成功,11,適切(1570) 人才(17220) 的(16029838) 匯集(1360) 註定(1720) 此(288458) 項(88887) 超級(6869) 任務(25232) 的(16029838) 成功(80266),{'High': 11},"{'Unknown': 1, '第4級': 2, '第1級': 2, '第7級': 1, '第6級': 1, '第5級': 2, '第4*級': 1, '第3*級': 1}",0,Y,N,N,N
方賢齊就說，潘文淵應居RCA計畫的大半功勞，而從RCA計畫招考進來的工程師們，熱切學習的能力與情緒，則是促成技轉成功的「四分之一」因素。,方賢齊 就 說 潘文淵 應 居 RCA 計畫 的 大半 功勞 而 從 RCA 計畫 招考 進來 的 工程師 們 熱切 學習 的 能力 與 情緒 則 是 促成 技轉 成功 的 四分之一 因素,34,方賢齊(25) 就(1737544) 說(1285247) 潘文淵(100) 應(82417) 居(11675) RCA(479) 計畫(54820) 的(16029838) 大半(4191) 功勞(4554) 而(937923) 從(496546) RCA(479) 計畫(54820) 招考(185) 進來(16019) 的(16029838) 工程師(6469) 們(140794) 熱切(2584) 學習(105345) 的(16029838) 能力(93399) 與(968432) 情緒(66126) 則(254096) 是(4642407) 促成(4737) 技轉(31) 成功(80266) 的(16029838) 四分之一(2159) 因素(34409),"{'Low': 3, 'High': 31}","{'Unknown': 10, '第1級': 8, '第2級': 4, '第5級': 5, '第1*級': 1, '第4*級': 3, '第6級': 2, '第3*級': 1}",6,Y,Y,N,Y
總數約四十名的赴美受訓成員，有專為計畫而招募，如黃顯雄、許金榮，有工研院既有人才臨時編組，如許健、曹興誠，有來自電信總局的工程師，如王國肇、林衡，也有在美國聽聞而返國投入，如蔡明介等人。,總數 約 四十 名 的 赴 美 受訓 成員 有 專 為 計畫 而 招募 如 黃顯雄 許金榮 有 工研院 既有 人才 臨時 編組 如 許健 曹興誠 有 來自 電信 總局 的 工程師 如 王國肇 林衡 也 有 在 美國 聽聞 而 返國 投入 如 蔡明介 等 人,48,總數(2415) 約(47731) 四十(15256) 名(136287) 的(16029838) 赴(12878) 美(53380) 受訓(1398) 成員(25071) 有(2217079) 專(7355) 為(761341) 計畫(54820) 而(937923) 招募(2210) 如(195069) 黃顯雄(5) 許金榮(2) 有(2217079) 工研院(829) 既有(6158) 人才(17220) 臨時(7386) 編組(435) 如(195069) 許健(3) 曹興誠(57) 有(2217079) 來自(41811) 電信(1755) 總局(842) 的(16029838) 工程師(6469) 如(195069) 王國肇(3) 林衡(2) 也(1590760) 有(2217079) 在(3284238) 美國(148299) 聽聞(1906) 而(937923) 返國(1214) 投入(18783) 如(195069) 蔡明介(21) 等(327380) 人(1550512),"{'High': 41, 'Low': 7}","{'Unknown': 19, '第3*級': 2, '第2級': 2, '第1級': 9, '第6級': 5, '第1*級': 2, '第5級': 6, '第4級': 2, '第4*級': 1}",7,Y,Y,N,Y
當年領隊之一、現任工研院院長史欽泰說，這一群懷抱熱忱、理想投入科技發展團隊的奉獻，不啻為今日的成功播下了最關鍵的種子。,當年 領隊 之 一 現任 工研院 院長 史欽泰 說 這 一 群 懷抱 熱忱 理想 投入 科技 發展 團隊 的 奉獻 不啻 為 今日 的 成功 播下 了 最 關鍵 的 種子,32,當年(25091) 領隊(947) 之(875481) 一(3701681) 現任(3412) 工研院(829) 院長(5857) 史欽泰(66) 說(1285247) 這(2114032) 一(3701681) 群(39283) 懷抱(4344) 熱忱(2619) 理想(27021) 投入(18783) 科技(30630) 發展(117494) 團隊(16971) 的(16029838) 奉獻(3784) 不啻(785) 為(761341) 今日(20291) 的(16029838) 成功(80266) 播下(451) 了(3199291) 最(421680) 關鍵(25952) 的(16029838) 種子(8015),"{'High': 31, 'Low': 1}","{'第4*級': 4, '第6級': 5, '第5級': 4, '第1級': 7, 'Unknown': 6, '第4級': 3, '第7級': 1, '第3*級': 1, '第1*級': 1}",2,Y,N,N,Y
而今，當年的成員多已是台灣半導體產業的檯面人物，把當年在美國學習的技術，紮實地在本土生根，編織出綿密的上、中、下游產業生態。,而今 當年 的 成員 多 已 是 台灣 半導體 產業 的 檯面 人物 把 當年 在 美國 學習 的 技術 紮實 地 在 本土 生根 編織出 綿密 的 上 中 下游 產業 生態,33,而今(3331) 當年(25091) 的(16029838) 成員(25071) 多(318992) 已(215610) 是(4642407) 台灣(130718) 半導體(2346) 產業(29756) 的(16029838) 檯面(1269) 人物(52614) 把(617773) 當年(25091) 在(3284238) 美國(148299) 學習(105345) 的(16029838) 技術(47691) 紮實(1311) 地(754998) 在(3284238) 本土(8025) 生根(944) 編織出(127) 綿密(739) 的(16029838) 上(1233218) 中(1011729) 下游(2287) 產業(29756) 生態(9124),{'High': 33},"{'Unknown': 7, '第4*級': 2, '第1級': 9, '第5級': 5, '第3級': 1, '第7級': 3, '第2級': 2, '第1*級': 2, '第4級': 1, '第6級': 1}",2,Y,N,N,N
民國六十五年四月底，出發赴美受訓前的一個禮拜，經濟部長孫運璿在福州街的經濟部大禮堂，接見第一批十三位學員與胡定華等人，「部長將一面國旗授給隊員，由胡定華代表接受，感覺好像國家體育代表隊一樣，就此承接了榮譽與責任」，當年成員之一、現任太欣半導體董事長的王國肇感觸深刻，至今，和當年同伴的革命情感仍舊堅定不移。,民國 六十五年 四月 底 出發 赴 美 受訓 前 的 一 個 禮拜 經濟部長 孫運璿 在 福州街 的 經濟部 大禮堂 接見 第一 批 十三 位 學員 與 胡定華 等 人 部長 將 一 面 國旗 授給 隊員 由 胡定華 代表 接受 感覺 好像 國家 體育 代表隊 一樣 就 此 承接 了 榮譽 與 責任 當年 成員 之 一 現任 太欣 半導體 董事長 的 王國肇 感觸 深刻 至今 和 當年 同伴 的 革命 情感 仍舊 堅定 不移,76,民國(16130) 六十五年(114) 四月(14996) 底(37174) 出發(17257) 赴(12878) 美(53380) 受訓(1398) 前(272709) 的(16029838) 一(3701681) 個(2296574) 禮拜(8255) 經濟部長(162) 孫運璿(233) 在(3284238) 福州街(12) 的(16029838) 經濟部(1640) 大禮堂(294) 接見(2516) 第一(172544) 批(22121) 十三(9810) 位(284809) 學員(4618) 與(968432) 胡定華(95) 等(327380) 人(1550512) 部長(6226) 將(448374) 一(3701681) 面(39563) 國旗(1659) 授給(212) 隊員(3040) 由(208604) 胡定華(95) 代表(58333) 接受(84729) 感覺(91265) 好像(67024) 國家(109166) 體育(3580) 代表隊(324) 一樣(188109) 就(1737544) 此(288458) 承接(1121) 了(3199291) 榮譽(4479) 與(968432) 責任(29747) 當年(25091) 成員(25071) 之(875481) 一(3701681) 現任(3412) 太欣(Unknown) 半導體(2346) 董事長(8106) 的(16029838) 王國肇(3) 感觸(1587) 深刻(16783) 至今(14540) 和(1338337) 當年(25091) 同伴(5579) 的(16029838) 革命(22713) 情感(23819) 仍舊(5748) 堅定(9407) 不移(517),"{'High': 71, 'Low': 5}","{'Unknown': 24, '第3*級': 3, '第4級': 4, '第6級': 5, '第1*級': 4, '第1級': 12, '第2*級': 1, '第2級': 2, '第5級': 12, '第4*級': 7, '第7級': 2}",12,Y,Y,N,Y
胡定華說，「若以二十年為新興產業發展的觀察期限，以RCA為源起的半導體技術引進行動，這一路走來整個組合都非常完美」。,胡定華 說 若 以 二十 年 為 新興 產業 發展 的 觀察 期限 以 RCA 為 源起 的 半導體 技術 引進 行動 這 一路 走來 整個 組合 都 非常 完美,30,胡定華(95) 說(1285247) 若(92766) 以(547785) 二十(32739) 年(514736) 為(761341) 新興(4357) 產業(29756) 發展(117494) 的(16029838) 觀察(44358) 期限(3403) 以(547785) RCA(479) 為(761341) 源起(593) 的(16029838) 半導體(2346) 技術(47691) 引進(6742) 行動(69326) 這(2114032) 一路(14840) 走來(5182) 整個(Unknown) 組合(14334) 都(1125846) 非常(152032) 完美(18408),"{'Low': 2, 'High': 28}","{'Unknown': 10, '第1級': 6, '第5級': 6, '第6級': 3, '第4級': 2, '第4*級': 2, '第1*級': 1}",3,Y,Y,N,Y
技術處長黃重球表示，雖然今天的局勢，已經不可能讓RCA計畫重頭來過一次，但其間人才承傳的佳話，至少應在台灣產業發展上綿延不絕。,技術 處長 黃重球 表示 雖然 今天 的 局勢 已經 不 可能 讓 RCA 計畫 重頭 來過 一 次 但 其間 人才 承傳 的 佳話 至少 應 在 台灣 產業 發展 上 綿延不絕,32,技術(47691) 處長(1328) 黃重球(Unknown) 表示(74452) 雖然(152988) 今天(73277) 的(16029838) 局勢(4418) 已經(245160) 不(2282521) 可能(271025) 讓(526314) RCA(479) 計畫(54820) 重頭(301) 來過(59) 一(3701681) 次(331701) 但(597124) 其間(2995) 人才(17220) 承傳(193) 的(16029838) 佳話(575) 至少(41964) 應(82417) 在(3284238) 台灣(130718) 產業(29756) 發展(117494) 上(1233218) 綿延不絕(Unknown),"{'High': 29, 'Low': 3}","{'第4級': 4, 'Unknown': 8, '第4*級': 1, '第2級': 6, '第1級': 8, '第6級': 2, '第7級': 1, '第1*級': 1, '第5級': 1}",3,Y,Y,N,Y
至少應在台灣產業發展上綿延不絕。,至少 應 在 台灣 產業 發展 上 綿延 不絕,9,至少(41964) 應(82417) 在(3284238) 台灣(130718) 產業(29756) 發展(117494) 上(1233218) 綿延(1560) 不絕(1189),{'High': 9},"{'第4級': 2, 'Unknown': 1, '第1*級': 1, '第1級': 2, '第5級': 1, '第7級': 2}",0,Y,N,N,N
新興產業的技術來源，注定產業往後發展的圖像，其中，技術的類別選擇和引進對象，則攸關技術引進的成功與否。,新興 產業 的 技術 來源 注定 產業 往後 發展 的 圖像 其中 技術 的 類別 選擇 和 引進 對象 則 攸關 技術 引進 的 成功 與否,26,新興(4357) 產業(29756) 的(16029838) 技術(47691) 來源(18177) 注定(4243) 產業(29756) 往後(6939) 發展(117494) 的(16029838) 圖像(6658) 其中(95627) 技術(47691) 的(16029838) 類別(5364) 選擇(75178) 和(1338337) 引進(6742) 對象(28123) 則(254096) 攸關(1870) 技術(47691) 引進(6742) 的(16029838) 成功(80266) 與否(4610),{'High': 26},"{'第6級': 4, '第5級': 6, '第1級': 4, '第4級': 5, '第4*級': 1, '第3*級': 3, 'Unknown': 2, '第7級': 1}",0,Y,Y,N,N
民國六十四年間由當時經濟部長孫運璿親自赴美成立的「技術顧問委員會」(TechnologyAdvisorsCommittee，TAC)，匯集海外傑出學人心智投入RCA計畫，也自此相伴台灣電子工業的發展至今。,民國 六十四年 間 由 當時 經濟部長 孫運璿 親自 赴 美 成立 的 技術 顧問 委員會 TechnologyAdvisorsCommittee TAC 匯集 海外 傑出 學人 心智 投入 RCA 計畫 也 自此 相伴 台灣 電子 工業 的 發展 至 今,35,民國(16130) 六十四年(150) 間(115638) 由(208604) 當時(126214) 經濟部長(162) 孫運璿(233) 親自(19554) 赴(12878) 美(53380) 成立(28506) 的(16029838) 技術(47691) 顧問(9723) 委員會(19419) TechnologyAdvisorsCommittee(Unknown) TAC(Unknown) 匯集(1360) 海外(10798) 傑出(8102) 學人(1317) 心智(13894) 投入(18783) RCA(479) 計畫(54820) 也(1590760) 自此(3932) 相伴(1210) 台灣(130718) 電子(17642) 工業(20144) 的(16029838) 發展(117494) 至(101530) 今(33635),"{'High': 33, 'Low': 2}","{'Unknown': 13, '第4*級': 2, '第3*級': 1, '第5級': 4, '第6級': 4, '第1*級': 1, '第1級': 4, '第4級': 4, '第7級': 1, '第2級': 1}",7,Y,N,N,Y
在RCA技引計畫中，TAC的角色扮演相當成功。,在 RCA 技引 計畫 中 TAC 的 角色 扮演 相當 成功,11,在(3284238) RCA(479) 技引(Unknown) 計畫(54820) 中(1011729) TAC(Unknown) 的(16029838) 角色(52422) 扮演(20021) 相當(66293) 成功(80266),"{'High': 9, 'Low': 2}","{'第1*級': 1, 'Unknown': 4, '第2級': 1, '第1級': 1, '第4*級': 2, '第3級': 1, '第3*級': 1}",2,Y,N,N,N
前工研院院長方賢齊，也是當年協調政府部會在積體電路工業發展計畫取得共識的關鍵人物。,前 工研院 院長 方賢齊 也 是 當年 協調 政府 部會 在 積體電路 工業 發展 計畫 取得 共識 的 關鍵 人物,20,前(272709) 工研院(829) 院長(5857) 方賢齊(25) 也(1590760) 是(4642407) 當年(25091) 協調(8656) 政府(92663) 部會(779) 在(3284238) 積體電路(1248) 工業(20144) 發展(117494) 計畫(54820) 取得(25649) 共識(6750) 的(16029838) 關鍵(25952) 人物(52614),"{'High': 19, 'Low': 1}","{'第1級': 4, 'Unknown': 7, '第4*級': 1, '第6級': 2, '第4級': 2, '第1*級': 1, '第2級': 1, '第5級': 2}",3,Y,N,N,Y
他用輕鬆的語調，形容TAC對他部會協調的有力背書，「其他部會首長也不懂IC技術，真有人提出疑問，我就把潘顧問找回來，不久大家就放手讓我們去做」。,他 用 輕鬆 的 語調 形容 TAC 對 他 部會 協調 的 有力 背書 其他 部會 首長 也 不 懂 IC 技術 真 有 人 提出 疑問 我 就 把 潘 顧問 找 回來 不久 大家 就 放手 讓 我們 去 做,42,他(2487930) 用(377038) 輕鬆(17407) 的(16029838) 語調(3224) 形容(25604) TAC(Unknown) 對(897964) 他(2487930) 部會(779) 協調(8656) 的(16029838) 有力(7920) 背書(990) 其他(189445) 部會(779) 首長(2156) 也(1590760) 不(2282521) 懂(32301) IC(821) 技術(47691) 真(137497) 有(2217079) 人(1550512) 提出(63073) 疑問(10304) 我(3033032) 就(1737544) 把(617773) 潘(1527) 顧問(9723) 找(108128) 回來(45286) 不久(34049) 大家(109692) 就(1737544) 放手(3810) 讓(526314) 我們(979260) 去(479993) 做(411649),"{'High': 41, 'Low': 1}","{'第1級': 18, '第3級': 1, '第6級': 2, '第4*級': 1, 'Unknown': 9, '第5級': 4, '第7級': 1, '第2級': 3, '第1*級': 2, '第4級': 1}",1,Y,N,N,Y
這是事實。,這 是 事實,3,這(2114032) 是(4642407) 事實(84995),{'High': 3},"{'第1級': 2, '第4級': 1}",0,N,N,N,N
養病中的總統府資政孫運璿，至今仍感念潘文淵對國家的貢獻。,養病 中 的 總統府 資政 孫運璿 至今 仍 感念 潘文淵 對 國家 的 貢獻,14,養病(656) 中(1011729) 的(16029838) 總統府(1378) 資政(218) 孫運璿(233) 至今(14540) 仍(92056) 感念(996) 潘文淵(100) 對(897964) 國家(109166) 的(16029838) 貢獻(15759),"{'High': 13, 'Low': 1}","{'第7級': 2, 'Unknown': 5, '第1級': 3, '第4*級': 1, '第4級': 1, '第1*級': 1, '第5級': 1}",3,Y,N,N,Y
中日戰爭前從大陸赴美深造、一九五○年代就已獲得IEEEfellow(國際電機工程師學會院士)榮銜的潘文淵，在台灣高層與他接觸之前，與這塊土地完全沒有情感關連。,中 日 戰爭 前 從 大陸 赴 美 深造 一九五年代 就 已 獲得 IEEEfellow 國際 電機 工程師 學會 院士 榮銜 的 潘文淵 在 台灣 高層 與 他 接觸 之前 與 這 塊 土地 完全 沒有 情感 關連,37,中(1011729) 日(94041) 戰爭(42758) 前(272709) 從(496546) 大陸(27031) 赴(12878) 美(53380) 深造(821) 一九五年代(241) 就(1737544) 已(215610) 獲得(54809) IEEEfellow(Unknown) 國際(40846) 電機(1107) 工程師(6469) 學會(25720) 院士(1252) 榮銜(173) 的(16029838) 潘文淵(100) 在(3284238) 台灣(130718) 高層(6030) 與(968432) 他(2487930) 接觸(22727) 之前(79748) 與(968432) 這(2114032) 塊(54148) 土地(32151) 完全(115744) 沒有(594280) 情感(23819) 關連(3113),"{'High': 35, 'Low': 2}","{'Unknown': 6, '第1級': 9, '第4級': 4, '第1*級': 3, '第3*級': 2, '第6級': 2, '第7級': 2, '第3級': 1, '第5級': 3, '第4*級': 5}",4,Y,N,N,Y
「當時中國大陸大門已關閉，海外學人能夠投效的祖國，當然是自由中國台灣」，早年也在紐澤西大學任教的潘夫人，認為當年是被孫運璿等人所感動，才毅然放棄美國的名位，返國成就台灣的電子工業。,當時 中國 大陸 大門 已 關閉 海外 學人 能夠 投效 的 祖國 當然 是 自由 中國 台灣 早年 也 在 紐澤西 大學 任教 的 潘 夫人 認為 當年 是 被 孫運璿 等 人 所 感動 才 毅然 放棄 美國 的 名位 返國 成就 台灣 的 電子 工業,47,當時(126214) 中國(214840) 大陸(27031) 大門(13597) 已(215610) 關閉(3783) 海外(10798) 學人(1317) 能夠(96422) 投效(394) 的(16029838) 祖國(3402) 當然(113971) 是(4642407) 自由(56360) 中國(214840) 台灣(130718) 早年(5061) 也(1590760) 在(3284238) 紐澤西(468) 大學(83893) 任教(3172) 的(16029838) 潘(1527) 夫人(45792) 認為(192030) 當年(25091) 是(4642407) 被(540683) 孫運璿(233) 等(327380) 人(1550512) 所(527327) 感動(15132) 才(394539) 毅然(2136) 放棄(27664) 美國(148299) 的(16029838) 名位(355) 返國(1214) 成就(25263) 台灣(130718) 的(16029838) 電子(17642) 工業(20144),{'High': 47},"{'第3*級': 4, '第1級': 14, '第2*級': 1, '第3級': 1, '第5級': 3, '第4級': 4, 'Unknown': 8, '第6級': 3, '第2級': 5, '第1*級': 1, '第4*級': 2, '第7級': 1}",2,Y,Y,N,Y
由潘文淵帶領的TAC，在成立之初就確定自我使命，要透過此一計畫讓台灣建立起積體電路技術的研發能力，以技術生根方式培育台灣的產業經濟。,由 潘文淵 帶領 的 TAC 在 成立 之初 就 確定 自我 使命 要 透過 此 一 計畫 讓 台灣 建立起 積體電路 技術 的 研發 能力 以 技術 生根 方式 培育 台灣 的 產業 經濟,34,由(208604) 潘文淵(100) 帶領(10447) 的(16029838) TAC(Unknown) 在(3284238) 成立(28506) 之初(4037) 就(1737544) 確定(40181) 自我(74037) 使命(5540) 要(851264) 透過(63117) 此(288458) 一(3701681) 計畫(54820) 讓(526314) 台灣(130718) 建立起(3895) 積體電路(1248) 技術(47691) 的(16029838) 研發(7366) 能力(93399) 以(547785) 技術(47691) 生根(944) 方式(133407) 培育(3504) 台灣(130718) 的(16029838) 產業(29756) 經濟(83046),"{'High': 32, 'Low': 2}","{'第4*級': 3, 'Unknown': 5, '第5級': 6, '第1級': 8, '第1*級': 1, '第4級': 5, '第6級': 2, '第2級': 3, '第7級': 1}",4,Y,N,N,Y
故此，包括凌鴻章(馬利蘭大學教授，最早撰寫半導體教科書之作者，民國八十九年獲選中研院士)、葛文勳(CasewesternReserve大學教授)、羅旡念(普林斯頓大學教授)、厲鼎毅與李天培(均為貝爾實驗室研究員)、趙曾玨(美洲中國工程師學會會員)等人，在潘文淵號召下成為TAC的第一批成員。,故此 包括 凌鴻章 馬利蘭 大學 教授 最早 撰寫 半導體 教科書 之 作者 民國 八十九年 獲選 中研 院士 葛文勳 CasewesternReserve 大學 教授 羅旡念 普林斯頓 大學 教授 厲鼎毅 與 李天培 均 為 貝爾 實驗室 研究員 趙曾玨 美洲 中國 工程師 學會 會員 等 人 在 潘文淵 號召 下 成為 TAC 的 第一 批 成員,51,故此(786) 包括(74410) 凌鴻章(Unknown) 馬利蘭(16) 大學(83893) 教授(39068) 最早(9441) 撰寫(7324) 半導體(2346) 教科書(3622) 之(875481) 作者(37498) 民國(16130) 八十九年(180) 獲選(401) 中研(7) 院士(1252) 葛文勳(1) CasewesternReserve(Unknown) 大學(83893) 教授(39068) 羅旡念(5) 普林斯頓(912) 大學(83893) 教授(39068) 厲鼎毅(1) 與(968432) 李天培(3) 均(27783) 為(761341) 貝爾(1738) 實驗室(12027) 研究員(2609) 趙曾玨(1) 美洲(2718) 中國(214840) 工程師(6469) 學會(25720) 會員(5850) 等(327380) 人(1550512) 在(3284238) 潘文淵(100) 號召(2588) 下(329549) 成為(143834) TAC(Unknown) 的(16029838) 第一(172544) 批(22121) 成員(25071),"{'High': 40, 'Low': 11}","{'Unknown': 24, '第3*級': 6, '第1級': 6, '第6級': 4, '第5級': 4, '第4級': 1, '第4*級': 3, '第1*級': 2, '第2級': 1}",17,Y,Y,N,Y
他們為工研院草擬史上第一份積體電路發展的藍圖，詳細地把設備規畫、實驗室建立、製程技術、CAD配合、成本及品質控制、設計及光罩工程、人員訓練等鋪陳開來。,他們 為 工研院 草擬 史 上 第一 份 積體電路 發展 的 藍圖 詳細 地 把 設備 規畫 實驗室 建立 製程 技術 CAD 配合 成本 及 品質 控制 設計 及 光罩 工程 人員 訓練 等 鋪陳 開來,36,他們(716752) 為(761341) 工研院(829) 草擬(708) 史(6356) 上(1233218) 第一(172544) 份(53198) 積體電路(1248) 發展(117494) 的(16029838) 藍圖(2053) 詳細(13379) 地(754998) 把(617773) 設備(12866) 規畫(2553) 實驗室(12027) 建立(52946) 製程(1963) 技術(47691) CAD(50) 配合(17173) 成本(20612) 及(304586) 品質(19388) 控制(47642) 設計(59326) 及(304586) 光罩(152) 工程(14284) 人員(49261) 訓練(39436) 等(327380) 鋪陳(1170) 開來(757),"{'High': 35, 'Low': 1}","{'第1級': 3, 'Unknown': 10, '第7級': 2, '第2級': 3, '第4級': 5, '第6級': 2, '第4*級': 3, '第5級': 7, '第3*級': 1}",4,Y,Y,N,N
有人認為，若不是這些當年聲赫美國的科學家，有心為國做事、本身卻無法成行，才毅然把國家新興產業的開拓重責，交給史欽泰、曾繁誠這批年輕小夥子，凸顯此一計畫機會與風險的相隨相伴。,有 人 認為 若 不 是 這些 當年 聲赫 美國 的 科學家 有心 為 國 做 事 本身 卻 無法 成行 才 毅然 把 國家 新興 產業 的 開拓 重責 交給 史欽泰 曾繁誠 這 批 年輕 小夥子 凸顯 此 一 計畫 機會 與 風險 的 相隨 相伴,47,有(2217079) 人(1550512) 認為(192030) 若(92766) 不(2282521) 是(4642407) 這些(315113) 當年(25091) 聲赫(Unknown) 美國(148299) 的(16029838) 科學家(18346) 有心(3762) 為(761341) 國(73377) 做(411649) 事(385949) 本身(44138) 卻(333007) 無法(150606) 成行(701) 才(394539) 毅然(2136) 把(617773) 國家(109166) 新興(4357) 產業(29756) 的(16029838) 開拓(3638) 重責(273) 交給(17334) 史欽泰(66) 曾繁誠(2) 這(2114032) 批(22121) 年輕(48853) 小夥子(910) 凸顯(2676) 此(288458) 一(3701681) 計畫(54820) 機會(81244) 與(968432) 風險(19287) 的(16029838) 相隨(574) 相伴(1210),"{'High': 44, 'Low': 3}","{'第1級': 12, '第2級': 6, 'Unknown': 11, '第4*級': 2, '第5級': 8, '第1*級': 2, '第4級': 1, '第7級': 2, '第6級': 3}",4,Y,Y,N,Y
