sentence,sentence_preprocessed,sentence_length,word_freq,high_low_freq,word_level,long_word_count,is_complete_sentence,is_complete_context,is_blacklist,is_greylist
他可以對父親的責罵麻木，但卻受不了言子夜的斥責。,他 可以 對 父親 的 責罵 麻木 但 卻 受不了 言子夜 的 斥責,13,他(2487930) 可以(560531) 對(897964) 父親(86472) 的(16029838) 責罵(1689) 麻木(1658) 但(597124) 卻(333007) 受不了(6124) 言子夜(Unknown) 的(16029838) 斥責(2792),"{'High': 12, 'Low': 1}","{'第1級': 5, '第3級': 1, '第6級': 3, '第2級': 1, '第4級': 2, 'Unknown': 1}",2,Y,Y,N,Y
言子夜不曾站在傳慶的立場設想，這一下斷絕了傳慶對他的幻想甚至希冀，坐使傳慶連一個可供慰藉、想像中的桃花源也歸於破滅，這位孤苦的青年至此已是全然無助。,言子夜 不 曾 站 在 傳慶 的 立場 設想 這 一 下 斷絕 了 傳慶 對 他 的 幻想 甚至 希冀 坐使 傳慶 連 一 個 可 供 慰藉 想像 中 的 桃花源 也 歸於 破滅 這 位 孤苦 的 青年 至 此 已 是 全然 無助,47,言子夜(Unknown) 不(2282521) 曾(132981) 站(68488) 在(3284238) 傳慶(Unknown) 的(16029838) 立場(17198) 設想(3517) 這(2114032) 一(3701681) 下(329549) 斷絕(2914) 了(3199291) 傳慶(Unknown) 對(897964) 他(2487930) 的(16029838) 幻想(10417) 甚至(122502) 希冀(614) 坐使(Unknown) 傳慶(Unknown) 連(91153) 一(3701681) 個(2296574) 可(307359) 供(17109) 慰藉(1495) 想像(45673) 中(1011729) 的(16029838) 桃花源(491) 也(1590760) 歸於(2076) 破滅(1246) 這(2114032) 位(284809) 孤苦(399) 的(16029838) 青年(18436) 至(101530) 此(288458) 已(215610) 是(4642407) 全然(8303) 無助(4402),"{'Low': 5, 'High': 42}","{'Unknown': 11, '第1級': 15, '第4級': 2, '第1*級': 3, '第5級': 6, '第6級': 2, '第4*級': 3, '第3*級': 1, '第7級': 3, '第3級': 1}",2,Y,Y,N,Y
這位孤苦的青年至此已是全然無助。,這 位 孤苦 的 青年 至 此 已 是 全然 無助,11,這(2114032) 位(284809) 孤苦(399) 的(16029838) 青年(18436) 至(101530) 此(288458) 已(215610) 是(4642407) 全然(8303) 無助(4402),{'High': 11},"{'第1級': 4, '第7級': 1, '第4*級': 1, '第5級': 4, '第3級': 1}",0,Y,N,N,N
三、畸型心態形成為傳慶畸型心態的是：先天性亡母幽怨的遺傳；以及後天冷漠家庭所賦予的壓力。,三 畸型 心態 形成 為 傳慶 畸型 心態 的 是 先天性 亡母 幽怨 的 遺傳 以及 後天 冷漠 家庭 所 賦予 的 壓力,23,三(313861) 畸型(133) 心態(12966) 形成(47486) 為(761341) 傳慶(Unknown) 畸型(133) 心態(12966) 的(16029838) 是(4642407) 先天性(540) 亡母(49) 幽怨(173) 的(16029838) 遺傳(6619) 以及(155624) 後天(3279) 冷漠(4138) 家庭(60608) 所(527327) 賦予(8248) 的(16029838) 壓力(40408),"{'High': 21, 'Low': 2}","{'第1級': 5, 'Unknown': 7, '第6級': 4, '第5級': 3, '第1*級': 1, '第2級': 2, '第4級': 1}",1,Y,Y,N,Y
和張愛玲筆下眾多女角相同，他也是嚴重地缺乏安全感，嚴重得甚至敏感、疑慮而不能接受正常的關愛。,和 張愛玲 筆下 眾多 女角 相同 他 也 是 嚴重 地 缺乏 安全感 嚴重 得 甚至 敏感 疑慮 而 不能 接受 正常 的 關愛,24,和(1338337) 張愛玲(805) 筆下(3840) 眾多(11350) 女角(88) 相同(33311) 他(2487930) 也(1590760) 是(4642407) 嚴重(39284) 地(754998) 缺乏(27750) 安全感(5455) 嚴重(39284) 得(573721) 甚至(122502) 敏感(12359) 疑慮(3628) 而(937923) 不能(162852) 接受(84729) 正常(28865) 的(16029838) 關愛(2744),"{'High': 23, 'Low': 1}","{'Unknown': 7, '第6級': 3, '第5級': 4, '第4級': 2, '第1級': 4, '第3*級': 3, '第4*級': 1}",2,Y,Y,N,Y
在家裡，惟一真心維護他的是亡母所留的陪嫁女傭劉媽。,在 家 裡 惟一 真心 維護 他 的 是 亡母 所 留 的 陪嫁 女傭 劉媽,16,在(3284238) 家(236822) 裡(520435) 惟一(776) 真心(5771) 維護(8695) 他(2487930) 的(16029838) 是(4642407) 亡母(49) 所(527327) 留(26377) 的(16029838) 陪嫁(250) 女傭(3037) 劉媽(17),"{'High': 14, 'Low': 2}","{'第1*級': 2, '第1級': 5, 'Unknown': 5, '第5級': 2, '第2級': 1, '第3級': 1}",0,Y,N,N,Y
但「他憎厭劉媽，正如在學校憎厭言丹朱一般，寒天裡，人凍得木木的，倒也罷了，一點點微溫，便使他覺得冷得澈骨酸心」。,但 他 憎厭 劉媽 正 如 在 學校 憎厭 言丹朱 一般 寒天 裡 人 凍 得 木木 的 倒 也 罷 了 一點點 微 溫 便 使 他 覺得 冷 得 澈骨 酸心,33,但(597124) 他(2487930) 憎厭(108) 劉媽(17) 正(179334) 如(195069) 在(3284238) 學校(74782) 憎厭(108) 言丹朱(Unknown) 一般(80732) 寒天(66) 裡(520435) 人(1550512) 凍(1697) 得(573721) 木木(61) 的(16029838) 倒(40381) 也(1590760) 罷(6268) 了(3199291) 一點點(6524) 微(11479) 溫(3581) 便(220860) 使(197544) 他(2487930) 覺得(183034) 冷(17629) 得(573721) 澈骨(6) 酸心(4),"{'High': 27, 'Low': 6}","{'第2級': 1, '第1級': 7, 'Unknown': 15, '第3*級': 2, '第1*級': 4, '第5級': 2, '第4*級': 1, '第6級': 1}",2,Y,Y,N,Y
這種心態看似反常其實正常。,這 種 心態 看似 反常 其實 正常,7,這(2114032) 種(701563) 心態(12966) 看似(8698) 反常(1107) 其實(109290) 正常(28865),{'High': 7},"{'第1級': 1, 'Unknown': 2, '第6級': 2, '第3*級': 2}",0,Y,N,N,N
沒有安全感，不平衡的人，通常不能正常地接受友誼或情愛，人家對他好，反被他誤以為是對他尊嚴有損的憐憫。,沒有 安全感 不 平衡 的 人 通常 不能 正常 地 接受 友誼 或 情愛 人家 對 他 好 反 被 他 誤以為 是 對 他 尊嚴 有損 的 憐憫,29,沒有(594280) 安全感(5455) 不(2282521) 平衡(18456) 的(16029838) 人(1550512) 通常(56445) 不能(162852) 正常(28865) 地(754998) 接受(84729) 友誼(6141) 或(478077) 情愛(1256) 人家(25372) 對(897964) 他(2487930) 好(448428) 反(44292) 被(540683) 他(2487930) 誤以為(2491) 是(4642407) 對(897964) 他(2487930) 尊嚴(5963) 有損(854) 的(16029838) 憐憫(2807),{'High': 29},"{'第1級': 11, 'Unknown': 8, '第5級': 2, '第4級': 2, '第3*級': 1, '第3級': 1, '第4*級': 1, '第2級': 1, '第6級': 2}",2,Y,Y,N,N
誠如前述，言丹朱與他之間就是這樣的格格不入。,誠如 前述 言丹朱 與 他 之間 就是 這樣 的 格格不入,10,誠如(2767) 前述(4204) 言丹朱(Unknown) 與(968432) 他(2487930) 之間(117932) 就是(2943) 這樣(288344) 的(16029838) 格格不入(1188),"{'High': 9, 'Low': 1}","{'第6級': 2, 'Unknown': 2, '第4*級': 1, '第1級': 2, '第4級': 1, '第3級': 1, '第7級': 1}",2,Y,Y,N,Y
這位漂亮的女同學「總是找著他」、「在學校裡，誰都不理他。,這 位 漂亮 的 女 同學 總是 找著 他 在 學校 裡 誰 都 不理 他,16,這(2114032) 位(284809) 漂亮(19609) 的(16029838) 女(51944) 同學(30250) 總是(62757) 找著(92) 他(2487930) 在(3284238) 學校(74782) 裡(520435) 誰(110452) 都(1125846) 不理(1126) 他(2487930),"{'High': 15, 'Low': 1}","{'第1級': 9, '第1*級': 4, '第2級': 1, 'Unknown': 2}",0,Y,N,N,N
他自己覺得不得人心，越發的避著人，可是他躲不了丹朱。」,他 自己 覺得 不 得 人心 越發 的 避 著 人 可是 他 躲不了 丹朱,15,他(2487930) 自己(744739) 覺得(183034) 不(2282521) 得(573721) 人心(11229) 越發(1732) 的(16029838) 避(5865) 著(1004687) 人(1550512) 可是(125487) 他(2487930) 躲不了(40) 丹朱(2),"{'High': 13, 'Low': 2}","{'第1級': 5, '第1*級': 3, 'Unknown': 5, '第5級': 1, '第6級': 1}",1,Y,Y,N,Y
她主動來親近，孤僻的傳慶卻總是疑慮：「他不懂她的存心，她並不短少朋友，雖然才在南華大學讀了半年書，已經在校花隊裡有了相當的地位，憑什麼她願意和他接近？,她 主動 來 親近 孤僻 的 傳慶 卻 總是 疑慮 他 不 懂 她 的 存心 她 並 不 短少 朋友 雖然 才 在 南華 大學 讀 了 半 年 書 已經 在 校花隊 裡 有 了 相當 的 地位 憑 什麼 她 願意 和 他 接近,47,她(1052913) 主動(18624) 來(742183) 親近(7508) 孤僻(727) 的(16029838) 傳慶(Unknown) 卻(333007) 總是(62757) 疑慮(3628) 他(2487930) 不(2282521) 懂(32301) 她(1052913) 的(16029838) 存心(1244) 她(1052913) 並(442790) 不(2282521) 短少(210) 朋友(101331) 雖然(152988) 才(394539) 在(3284238) 南華(176) 大學(83893) 讀(46218) 了(3199291) 半(80813) 年(514736) 書(174356) 已經(245160) 在(3284238) 校花隊(Unknown) 裡(520435) 有(2217079) 了(3199291) 相當(66293) 的(16029838) 地位(36831) 憑(14790) 什麼(431321) 她(1052913) 願意(48894) 和(1338337) 他(2487930) 接近(24049),"{'High': 45, 'Low': 2}","{'第1級': 19, '第4*級': 3, '第5級': 2, '第7級': 1, 'Unknown': 7, '第4級': 2, '第2級': 5, '第6級': 2, '第1*級': 5, '第3級': 1}",1,Y,Y,N,Y
他不愛看見女孩子，尤其是健全美麗的女孩子，因為她們使他對於自己分外感到不滿意」。,他 不 愛 看見 女孩子 尤其 是 健全 美麗 的 女孩子 因為 她們 使 他 對於 自己 分外 感到 不 滿意,21,他(2487930) 不(2282521) 愛(124337) 看見(56420) 女孩子(6198) 尤其(50700) 是(4642407) 健全(4060) 美麗(24889) 的(16029838) 女孩子(6198) 因為(425061) 她們(52188) 使(197544) 他(2487930) 對於(99570) 自己(744739) 分外(878) 感到(74094) 不(2282521) 滿意(16756),{'High': 21},"{'第1級': 7, '第1*級': 3, 'Unknown': 3, '第3*級': 2, '第5級': 3, '第7級': 1, '第4級': 2}",2,Y,Y,N,N
至此點明了男女友誼與情愛運作的相當性，不健全的沒法子跟健全的相配，便何況聶傳慶又是個特別不健全的。,至 此 點明 了 男女 友誼 與 情愛 運作 的 相當性 不 健全 的 沒法子 跟 健全 的 相配 便 何況 聶傳慶 又 是 個 特別 不 健全 的,29,至(101530) 此(288458) 點明(357) 了(3199291) 男女(14723) 友誼(6141) 與(968432) 情愛(1256) 運作(23209) 的(16029838) 相當性(3) 不(2282521) 健全(4060) 的(16029838) 沒法子(520) 跟(260280) 健全(4060) 的(16029838) 相配(793) 便(220860) 何況(10179) 聶傳慶(Unknown) 又(535555) 是(4642407) 個(2296574) 特別(91212) 不(2282521) 健全(4060) 的(16029838),"{'High': 27, 'Low': 2}","{'第5級': 7, 'Unknown': 8, '第4*級': 1, '第6級': 2, '第1級': 8, '第1*級': 2, '第2級': 1}",3,Y,Y,N,Y
猶然天真的丹朱，愛和許多人做朋友，但卻不願涉及情愛。,猶然 天真 的 丹朱 愛 和 許多 人 做 朋友 但 卻 不 願 涉及 情愛,16,猶然(86) 天真(6040) 的(16029838) 丹朱(2) 愛(124337) 和(1338337) 許多(159791) 人(1550512) 做(411649) 朋友(101331) 但(597124) 卻(333007) 不(2282521) 願(30213) 涉及(9123) 情愛(1256),"{'Low': 2, 'High': 14}","{'Unknown': 4, '第5級': 2, '第1級': 6, '第3*級': 1, '第2級': 1, '第4級': 1, '第6級': 1}",0,Y,Y,N,Y
理由是：「至於其他的問題，我們的年紀太小了，根本談不到。」,理由 是 至於 其他 的 問題 我們 的 年紀 太 小 了 根本 談 不 到,16,理由(32460) 是(4642407) 至於(39363) 其他(189445) 的(16029838) 問題(280782) 我們(979260) 的(16029838) 年紀(21116) 太(181732) 小(318835) 了(3199291) 根本(66330) 談(44043) 不(2282521) 到(546906),{'High': 16},"{'第4級': 1, '第1級': 9, '第5級': 1, '第2級': 1, '第3級': 1, 'Unknown': 1, '第4*級': 1, '第3*級': 1}",0,Y,N,N,N
她把「德荃」寫給她情書的事告訴傳慶，不是誇耀，而是怕「被愛」，要求有人能為她擔一些難題。,她 把 德荃 寫給 她 情書 的 事 告訴 傳慶 不 是 誇耀 而是 怕 被 愛 要求 有 人 能 為 她 擔 一些 難題,26,她(1052913) 把(617773) 德荃(Unknown) 寫給(3432) 她(1052913) 情書(980) 的(16029838) 事(385949) 告訴(122898) 傳慶(Unknown) 不(2282521) 是(4642407) 誇耀(974) 而是(74258) 怕(46704) 被(540683) 愛(124337) 要求(71192) 有(2217079) 人(1550512) 能(582260) 為(761341) 她(1052913) 擔(2441) 一些(156929) 難題(6647),"{'High': 24, 'Low': 2}","{'第1級': 9, '第2級': 2, 'Unknown': 7, '第6級': 1, '第1*級': 4, '第7級': 1, '第3*級': 1, '第5級': 1}",0,Y,Y,N,Y
又是因為「把你(傳慶)當做一個女孩子看待」。,又 是 因為 把 你 傳慶 當做 一 個 女孩子 看待,11,又(535555) 是(4642407) 因為(425061) 把(617773) 你(1414837) 傳慶(Unknown) 當做(6939) 一(3701681) 個(2296574) 女孩子(6198) 看待(11392),"{'High': 10, 'Low': 1}","{'第1*級': 2, '第1級': 4, '第2級': 1, 'Unknown': 2, '第4級': 1, '第6級': 1}",1,Y,Y,N,Y
(可能是傳慶的沉靜不得人緣；或是傳慶不像別的男生那樣來追她，傳慶的與眾不同使她誤認為像個女孩)。,可能 是 傳慶 的 沉靜 不 得 人緣 或是 傳慶 不 像 別的 男生 那樣 來 追 她 傳慶 的 與眾不同 使 她 誤認為 像 個 女孩,27,可能(271025) 是(4642407) 傳慶(Unknown) 的(16029838) 沉靜(1353) 不(2282521) 得(573721) 人緣(1337) 或是(75906) 傳慶(Unknown) 不(2282521) 像(289494) 別的(13116) 男生(10314) 那樣(45633) 來(742183) 追(11524) 她(1052913) 傳慶(Unknown) 的(16029838) 與眾不同(2944) 使(197544) 她(1052913) 誤認為(985) 像(289494) 個(2296574) 女孩(36600),"{'High': 24, 'Low': 3}","{'第1級': 10, 'Unknown': 6, '第7級': 1, '第5級': 2, '第2級': 1, '第1*級': 2, '第2*級': 2, '第3級': 1, '第4級': 1, '第6級': 1}",2,Y,Y,N,Y
跟著出現的是雞同鴨講的扦格：「傳慶酸酸的笑了一聲道：『是嗎？,跟著 出現 的 是 雞同鴨講 的 扦格 傳慶 酸酸 的 笑 了 一 聲 道 是 嗎,17,跟著(84) 出現(124694) 的(16029838) 是(4642407) 雞同鴨講(Unknown) 的(16029838) 扦格(Unknown) 傳慶(Unknown) 酸酸(305) 的(16029838) 笑(68493) 了(3199291) 一(3701681) 聲(54182) 道(141723) 是(4642407) 嗎(248249),"{'Low': 4, 'High': 13}","{'Unknown': 8, '第4級': 1, '第1級': 7, '第2級': 1}",1,Y,Y,N,Y
你的女朋友也多得很，怎麼單揀中了我呢？,你 的 女朋友 也 多 得 很 怎麼 單 揀中 了 我 呢,13,你(1414837) 的(16029838) 女朋友(3248) 也(1590760) 多(318992) 得(573721) 很(715675) 怎麼(143418) 單(10648) 揀中(Unknown) 了(3199291) 我(3033032) 呢(204566),"{'High': 12, 'Low': 1}","{'第1級': 8, 'Unknown': 4, '第5級': 1}",1,Y,N,N,N
』丹朱道：『因為只有你能夠守祕密』。,丹朱 道 因為 只有 你 能夠 守 祕密,8,丹朱(2) 道(141723) 因為(425061) 只有(43745) 你(1414837) 能夠(96422) 守(14737) 祕密(12045),"{'Low': 1, 'High': 7}","{'Unknown': 5, '第1*級': 1, '第1級': 1, '第5級': 1}",0,Y,Y,N,Y
傳慶倒抽了一口冷氣道：『是的，因為我沒有朋友，沒有人可告訴』。,傳慶 倒 抽 了 一 口 冷氣 道 是 的 因為 我 沒有 朋友 沒有 人 可 告訴,18,傳慶(Unknown) 倒(40381) 抽(7800) 了(3199291) 一(3701681) 口(83854) 冷氣(1402) 道(141723) 是(4642407) 的(16029838) 因為(425061) 我(3033032) 沒有(594280) 朋友(101331) 沒有(594280) 人(1550512) 可(307359) 告訴(122898),"{'Low': 1, 'High': 17}","{'Unknown': 5, '第5級': 1, '第1級': 8, '第3級': 1, '第2*級': 1, '第1*級': 1, '第4*級': 1}",0,Y,Y,N,Y
丹朱忙道：『你又誤會了我的意思』」這男子自卑、過敏如此，或許讀者們會替篇中的丹朱大嘆一聲：「真累！」,丹朱 忙 道 你 又 誤會 了 我 的 意思 這 男子 自卑 過敏 如此 或許 讀者 們 會 替 篇 中 的 丹朱 大嘆 一 聲 真 累,29,丹朱(2) 忙(26342) 道(141723) 你(1414837) 又(535555) 誤會(4554) 了(3199291) 我(3033032) 的(16029838) 意思(50961) 這(2114032) 男子(17448) 自卑(2627) 過敏(3600) 如此(133083) 或許(60077) 讀者(34316) 們(140794) 會(1014977) 替(34886) 篇(46368) 中(1011729) 的(16029838) 丹朱(2) 大嘆(196) 一(3701681) 聲(54182) 真(137497) 累(12878),"{'Low': 2, 'High': 27}","{'Unknown': 8, '第1*級': 5, '第1級': 7, '第5級': 2, '第4*級': 3, '第6級': 1, '第4級': 2, '第2級': 1}",0,Y,N,N,Y
善良的丹朱，終於淒哽地質問道：「你...你老是使我覺得我犯了法...彷彿我沒有權利這麼快樂，其實，我快樂，又不礙著你什麼」！,善良 的 丹朱 終於 淒哽 地 質問 道 你 你 老是 使 我 覺得 我 犯 了 法 彷彿 我 沒有 權利 這麼 快樂 其實 我 快樂 又 不 礙 著 你 什麼,33,善良(6489) 的(16029838) 丹朱(2) 終於(59622) 淒哽(Unknown) 地(754998) 質問(2913) 道(141723) 你(1414837) 你(1414837) 老是(9134) 使(197544) 我(3033032) 覺得(183034) 我(3033032) 犯(13312) 了(3199291) 法(40998) 彷彿(35009) 我(3033032) 沒有(594280) 權利(15625) 這麼(116973) 快樂(45366) 其實(109290) 我(3033032) 快樂(45366) 又(535555) 不(2282521) 礙(235) 著(1004687) 你(1414837) 什麼(431321),"{'High': 31, 'Low': 2}","{'第5級': 2, '第1級': 11, 'Unknown': 8, '第4級': 3, '第6級': 2, '第1*級': 4, '第4*級': 1, '第2級': 1, '第3*級': 1}",0,Y,N,N,Y
這一節表現深刻，想使自己的快樂與人分享，使人也快樂，那很難；反倒是抒發自己的不樂、悲苦，有可能會引來相濡以沫的同聲一哭，人性的殘缺如此，曷其可嘆！,這 一 節 表現 深刻 想 使 自己 的 快樂 與 人 分享 使 人 也 快樂 那 很 難 反倒 是 抒發 自己 的 不 樂 悲苦 有 可能 會 引來 相濡以沫 的 同聲一哭 人性 的 殘缺 如此 曷其 可嘆,41,這(2114032) 一(3701681) 節(14936) 表現(67272) 深刻(16783) 想(449884) 使(197544) 自己(744739) 的(16029838) 快樂(45366) 與(968432) 人(1550512) 分享(19471) 使(197544) 人(1550512) 也(1590760) 快樂(45366) 那(754138) 很(715675) 難(75701) 反倒(4974) 是(4642407) 抒發(1216) 自己(744739) 的(16029838) 不(2282521) 樂(12194) 悲苦(654) 有(2217079) 可能(271025) 會(1014977) 引來(2555) 相濡以沫(204) 的(16029838) 同聲一哭(Unknown) 人性(12806) 的(16029838) 殘缺(1085) 如此(133083) 曷其(Unknown) 可嘆(282),"{'High': 39, 'Low': 2}","{'第1級': 16, '第4級': 3, '第4*級': 2, '第5級': 4, '第1*級': 5, 'Unknown': 7, '第6級': 1, '第7級': 3}",2,Y,Y,N,N
言子夜在課堂上怒斥聶傳慶，熱心的丹朱鍥而不捨來安慰鼓勵他：舞會之後，趕上來要傳慶送她回家。,言子夜 在 課堂 上 怒斥 聶傳慶 熱心 的 丹朱 鍥而不捨 來 安慰 鼓勵 他 舞會 之後 趕上來 要 傳慶 送 她 回家,22,言子夜(Unknown) 在(3284238) 課堂(5905) 上(1233218) 怒斥(471) 聶傳慶(Unknown) 熱心(4357) 的(16029838) 丹朱(2) 鍥而不捨(703) 來(742183) 安慰(11587) 鼓勵(27004) 他(2487930) 舞會(2344) 之後(190467) 趕上來(146) 要(851264) 傳慶(Unknown) 送(32804) 她(1052913) 回家(35375),"{'Low': 4, 'High': 18}","{'Unknown': 8, '第1*級': 1, '第4*級': 1, '第1級': 6, '第4級': 3, '第7級': 1, '第5級': 1, '第2級': 1}",4,Y,N,N,Y
跟他說言子夜這是看重他：「只有你一個人，國文的根基比誰都強，你又使他失望」。,跟 他 說 言子夜 這 是 看重 他 只有 你 一 個 人 國文 的 根基 比 誰 都 強 你 又 使 他 失望,25,跟(260280) 他(2487930) 說(1285247) 言子夜(Unknown) 這(2114032) 是(4642407) 看重(2810) 他(2487930) 只有(43745) 你(1414837) 一(3701681) 個(2296574) 人(1550512) 國文(957) 的(16029838) 根基(2068) 比(170486) 誰(110452) 都(1125846) 強(34876) 你(1414837) 又(535555) 使(197544) 他(2487930) 失望(12334),"{'High': 24, 'Low': 1}","{'第1*級': 3, '第1級': 14, 'Unknown': 4, '第6級': 2, '第5級': 1, '第4*級': 1}",1,Y,Y,N,Y
要傳慶向她父親解釋為什麼近來這樣失常：「你知道我爸爸是個熱心人，我相信他一定肯儘他的能力來幫助你。,要 傳慶 向 她 父親 解釋 為什麼 近來 這樣 失常 你 知道 我 爸爸 是 個 熱心 人 我 相信 他 一定 肯 儘 他 的 能力 來 幫助 你,30,要(851264) 傳慶(Unknown) 向(231672) 她(1052913) 父親(86472) 解釋(59761) 為什麼(106142) 近來(3822) 這樣(288344) 失常(2334) 你(1414837) 知道(343214) 我(3033032) 爸爸(43983) 是(4642407) 個(2296574) 熱心(4357) 人(1550512) 我(3033032) 相信(82200) 他(2487930) 一定(138695) 肯(21145) 儘(1226) 他(2487930) 的(16029838) 能力(93399) 來(742183) 幫助(62744) 你(1414837),"{'High': 29, 'Low': 1}","{'第1級': 15, 'Unknown': 1, '第2級': 4, '第3級': 2, '第4級': 2, '第1*級': 2, '第5級': 2, '第6級': 1, '第4*級': 1}",1,Y,N,N,Y
你告訴我，讓我來轉告他，行不行？」,你 告訴 我 讓 我 來 轉告 他 行不行,9,你(1414837) 告訴(122898) 我(3033032) 讓(526314) 我(3033032) 來(742183) 轉告(1208) 他(2487930) 行不行(285),{'High': 9},"{'第1級': 5, 'Unknown': 2, '第2級': 1, '第5級': 1}",1,Y,N,N,N
而傳慶卻不如我們想像那樣的獲得慰藉，篇中交代的是：「只覺胸頭充塞了吐不出來的冤悒」。,而 傳慶 卻 不如 我們 想像 那樣 的 獲得 慰藉 篇 中 交代 的 是 只 覺 胸頭 充塞 了 吐 不 出來 的 冤悒,25,而(937923) 傳慶(Unknown) 卻(333007) 不如(21722) 我們(979260) 想像(45673) 那樣(45633) 的(16029838) 獲得(54809) 慰藉(1495) 篇(46368) 中(1011729) 交代(6923) 的(16029838) 是(4642407) 只(436725) 覺(12294) 胸頭(Unknown) 充塞(517) 了(3199291) 吐(11307) 不(2282521) 出來(50336) 的(16029838) 冤悒(Unknown),"{'High': 22, 'Low': 3}","{'第5級': 3, 'Unknown': 9, '第4級': 4, '第1級': 6, '第3級': 1, '第7級': 1, '第1*級': 1}",0,Y,Y,N,Y
丹朱試著來了解他，想知他失常的原因，問他「是你家裡的事麼」？,丹朱 試 著 來 了解 他 想 知 他 失常 的 原因 問 他 是 你 家 裡 的 事 麼,21,丹朱(2) 試(40277) 著(1004687) 來(742183) 了解(82970) 他(2487930) 想(449884) 知(108500) 他(2487930) 失常(2334) 的(16029838) 原因(67404) 問(165473) 他(2487930) 是(4642407) 你(1414837) 家(236822) 裡(520435) 的(16029838) 事(385949) 麼(5967),"{'Low': 1, 'High': 20}","{'Unknown': 4, '第2級': 1, '第1級': 11, '第3*級': 2, '第6級': 1, '第1*級': 2}",0,Y,N,N,Y
(這一猜倒是八九不離十)。,這 一 猜 倒是 八九不離十,5,這(2114032) 一(3701681) 猜(11427) 倒是(12415) 八九不離十(155),{'High': 5},"{'第1級': 2, '第4級': 1, '第4*級': 1, 'Unknown': 1}",1,Y,N,N,N
沒想到傳慶的反應卻是淡笑：「你也太好管閒事了」！,沒想到 傳慶 的 反應 卻 是 淡笑 你 也 太 好管閒事 了,12,沒想到(13287) 傳慶(Unknown) 的(16029838) 反應(53196) 卻(333007) 是(4642407) 淡笑(3) 你(1414837) 也(1590760) 太(181732) 好管閒事(29) 了(3199291),"{'High': 9, 'Low': 3}","{'第3*級': 1, 'Unknown': 4, '第1級': 5, '第4級': 2}",2,Y,N,N,Y
丹朱「絕對想不到傳慶當真是在那裡憎嫌她，因為誰都喜歡她」。,丹朱 絕對 想不到 傳慶 當真 是 在 那裡 憎嫌 她 因為 誰 都 喜歡 她,15,丹朱(2) 絕對(42446) 想不到(2804) 傳慶(Unknown) 當真(3012) 是(4642407) 在(3284238) 那裡(55755) 憎嫌(1) 她(1052913) 因為(425061) 誰(110452) 都(1125846) 喜歡(113753) 她(1052913),"{'Low': 3, 'High': 12}","{'Unknown': 4, '第4*級': 1, '第6級': 1, '第1級': 7, '第1*級': 2}",1,Y,Y,N,Y
男女之間的吊詭就在於此，誰都喜歡她，她偏就不喜歡誰！,男女 之間 的 吊詭 就 在於 此 誰 都 喜歡 她 她 偏 就 不 喜歡 誰,17,男女(14723) 之間(117932) 的(16029838) 吊詭(56) 就(1737544) 在於(37953) 此(288458) 誰(110452) 都(1125846) 喜歡(113753) 她(1052913) 她(1052913) 偏(7313) 就(1737544) 不(2282521) 喜歡(113753) 誰(110452),"{'High': 16, 'Low': 1}","{'Unknown': 2, '第4級': 1, '第1級': 11, '第6級': 1, '第5級': 2}",0,Y,N,N,N
就這個「憎嫌」她的人，反倒能引起她渴望了解的親近。,就 這 個 憎嫌 她 的 人 反倒 能 引起 她 渴望 了解 的 親近,15,就(1737544) 這(2114032) 個(2296574) 憎嫌(1) 她(1052913) 的(16029838) 人(1550512) 反倒(4974) 能(582260) 引起(36729) 她(1052913) 渴望(14437) 了解(82970) 的(16029838) 親近(7508),"{'High': 14, 'Low': 1}","{'第1級': 8, 'Unknown': 1, '第6級': 2, '第1*級': 1, '第4*級': 1, '第3*級': 1, '第5級': 1}",0,Y,Y,N,N
是反常，也是正常。,是 反常 也 是 正常,5,是(4642407) 反常(1107) 也(1590760) 是(4642407) 正常(28865),{'High': 5},"{'第1級': 3, '第6級': 1, '第3*級': 1}",0,Y,N,N,N
骨子裡的人性原型是「物以稀為貴」。,骨子裡 的 人性 原型 是 物 以 稀 為 貴,10,骨子裡(908) 的(16029838) 人性(12806) 原型(3469) 是(4642407) 物(16930) 以(547785) 稀(1026) 為(761341) 貴(14034),{'High': 10},"{'Unknown': 3, '第1級': 2, '第5級': 2, '第6級': 1, '第7級': 1, '第1*級': 1}",1,Y,N,N,N
傳慶一無是處，偏就有這一點與眾不同，而這也正是他與丹朱相剋相生的關鍵之所在。,傳慶 一無是處 偏 就 有 這 一 點 與眾不同 而 這 也 正 是 他 與 丹朱 相剋 相生 的 關鍵 之 所在,23,傳慶(Unknown) 一無是處(729) 偏(7313) 就(1737544) 有(2217079) 這(2114032) 一(3701681) 點(118735) 與眾不同(2944) 而(937923) 這(2114032) 也(1590760) 正(179334) 是(4642407) 他(2487930) 與(968432) 丹朱(2) 相剋(312) 相生(538) 的(16029838) 關鍵(25952) 之(875481) 所在(13079),"{'Low': 2, 'High': 21}","{'Unknown': 4, '第7級': 1, '第5級': 4, '第1級': 10, '第6級': 2, '第3*級': 1, '第4*級': 1}",2,Y,Y,N,Y
風刮松枝打到了她，趁勢挽住傳慶的臂，仍是溫柔的問：「到底為什麼？」,風 刮 松枝 打到 了 她 趁勢 挽住 傳慶 的 臂 仍 是 溫柔 的 問 到底 為什麼,18,風(30613) 刮(2972) 松枝(119) 打到(3314) 了(3199291) 她(1052913) 趁勢(553) 挽住(177) 傳慶(Unknown) 的(16029838) 臂(3474) 仍(92056) 是(4642407) 溫柔(9695) 的(16029838) 問(165473) 到底(41946) 為什麼(106142),"{'High': 17, 'Low': 1}","{'第1*級': 2, '第5級': 2, 'Unknown': 6, '第1級': 5, '第7級': 1, '第4級': 1, '第4*級': 1}",1,Y,N,N,Y
