sentence,sentence_preprocessed,sentence_length,word_freq,high_low_freq,word_level,long_word_count,is_complete_sentence,is_complete_context,is_blacklist,is_greylist
奧斯卡男星詹姆斯伍德、提摩西赫頓、詹姆斯克隆威爾，還有漂亮女星麥德琳史道威，個個各顯神通，各懷鬼胎，各有所求，組成一幅令人心情複雜的軍中大審判。,奧斯卡 男星 詹姆斯 伍德 提摩西 赫頓 詹姆斯 克隆威爾 還有 漂亮 女星 麥德琳 史道威 個個 各顯神通 各懷鬼胎 各 有 所 求 組成 一 幅 令 人 心情 複雜 的 軍 中 大 審判,32,奧斯卡(3876) 男星(85) 詹姆斯(4722) 伍德(1092) 提摩西(46) 赫頓(62) 詹姆斯(4722) 克隆威爾(14) 還有(534) 漂亮(19609) 女星(610) 麥德琳(6) 史道威(4) 個個(5022) 各顯神通(106) 各懷鬼胎(Unknown) 各(243023) 有(2217079) 所(527327) 求(30359) 組成(20095) 一(3701681) 幅(22056) 令(128742) 人(1550512) 心情(33611) 複雜(29761) 的(16029838) 軍(18300) 中(1011729) 大(525780) 審判(5764),"{'High': 25, 'Low': 7}","{'Unknown': 17, '第1*級': 1, '第2級': 2, '第1級': 5, '第4*級': 2, '第5級': 2, '第3*級': 1, '第4級': 1, '第6級': 1}",9,Y,Y,N,Y
完整、清新、對白精采，看完仍不知兇手是誰，這是「將軍的女兒」成功之處，該片截至目前為止全美票房破億美元大關，下這盤棋的參與演員，彷若參加了一場大型心理遊戲，其中的靈魂人物約翰屈伏塔，更面臨了體重危機。,完整 清新 對白 精采 看完 仍 不 知 兇手 是 誰 這 是 將軍 的 女兒 成功 之 處 該 片 截至 目前 為止 全 美 票房 破 億 美元 大關 下 這 盤 棋 的 參與 演員 彷若 參加 了 一 場 大型 心理 遊戲 其中 的 靈魂人物 約翰屈伏塔 更 面臨 了 體重 危機,55,完整(19201) 清新(2258) 對白(2531) 精采(4673) 看完(4613) 仍(92056) 不(2282521) 知(108500) 兇手(5855) 是(4642407) 誰(110452) 這(2114032) 是(4642407) 將軍(38302) 的(16029838) 女兒(46072) 成功(80266) 之(875481) 處(84410) 該(148369) 片(71870) 截至(1476) 目前(48695) 為止(17781) 全(178642) 美(53380) 票房(2221) 破(13962) 億(550) 美元(27307) 大關(303) 下(329549) 這(2114032) 盤(10086) 棋(4800) 的(16029838) 參與(40595) 演員(18584) 彷若(423) 參加(42962) 了(3199291) 一(3701681) 場(68915) 大型(12588) 心理(59538) 遊戲(31463) 其中(95627) 的(16029838) 靈魂人物(Unknown) 約翰屈伏塔(12) 更(361676) 面臨(16531) 了(3199291) 體重(9285) 危機(20200),"{'High': 53, 'Low': 2}","{'第4*級': 4, '第6級': 5, '第5級': 8, 'Unknown': 12, '第4級': 4, '第1級': 11, '第3*級': 2, '第2級': 4, '第1*級': 2, '第3級': 2, '第2*級': 1}",2,Y,N,N,Y
約翰屈伏塔的中廣身材是美食主義的結果，不要以為屈伏塔會像別的明星一般為戲減肥，他一點也不想減肥，所以，導演賽門威斯特就比較累啦，運鏡角度刻意小心，迴避屈伏塔的贅肉不說，還得保持他的中年帥哥形象。,約翰屈伏塔 的 中廣 身材 是 美食 主義 的 結果 不要 以為 屈伏塔 會 像 別的 明星 一般 為 戲 減肥 他 一點 也 不 想 減肥 所以 導演 賽門威斯特 就 比較 累 啦 運鏡 角度 刻意 小心 迴避 屈伏塔 的 贅肉 不 說 還 得 保持 他 的 中年 帥哥 形象,51,約翰屈伏塔(12) 的(16029838) 中廣(400) 身材(8302) 是(4642407) 美食(3573) 主義(82852) 的(16029838) 結果(114008) 不要(101931) 以為(58719) 屈伏塔(50) 會(1014977) 像(289494) 別的(13116) 明星(8215) 一般(80732) 為(761341) 戲(17584) 減肥(2616) 他(2487930) 一點(90745) 也(1590760) 不(2282521) 想(449884) 減肥(2616) 所以(239080) 導演(24296) 賽門威斯特(Unknown) 就(1737544) 比較(112212) 累(12878) 啦(51335) 運鏡(119) 角度(26690) 刻意(11267) 小心(24226) 迴避(3163) 屈伏塔(50) 的(16029838) 贅肉(218) 不(2282521) 說(1285247) 還(625086) 得(573721) 保持(39415) 他(2487930) 的(16029838) 中年(7043) 帥哥(806) 形象(20430),"{'Low': 4, 'High': 47}","{'Unknown': 13, '第1級': 13, '第4*級': 7, '第4級': 2, '第5級': 3, '第3*級': 2, '第2級': 4, '第1*級': 4, '第2*級': 1, '第6級': 2}",4,Y,Y,N,Y
還得保持他的中年帥哥形象。,還 得 保持 他 的 中年 帥哥 形象,8,還(625086) 得(573721) 保持(39415) 他(2487930) 的(16029838) 中年(7043) 帥哥(806) 形象(20430),{'High': 8},"{'Unknown': 2, '第4*級': 3, '第1級': 2, '第5級': 1}",0,Y,N,N,N
咦......是什麼東西？,咦 是 什麼 東西,4,咦(2946) 是(4642407) 什麼(431321) 東西(139472),{'High': 4},"{'第5級': 1, '第1級': 3}",0,N,N,N,N
大多數人聽到「女書」這個名詞的第一個反應，就是連串的問號，事實上她是全世界唯一由女性創作出來的文字，只有女性會讀會寫，在男性眼中是一串串神秘的菱形花紋，卻紀錄著許多女性的一生故事。,大多數 人 聽到 女書 這 個 名詞 的 第一 個 反應 就 是 連串 的 問號 事實 上 她 是 全 世界 唯一 由 女性 創作 出來 的 文字 只有 女性 會 讀 會 寫 在 男性 眼 中 是 一串串 神秘 的 菱形 花紋 卻 紀錄 著 許多 女性 的 一生 故事,53,大多數(21212) 人(1550512) 聽到(61809) 女書(45) 這(2114032) 個(2296574) 名詞(9820) 的(16029838) 第一(172544) 個(2296574) 反應(53196) 就(1737544) 是(4642407) 連串(420) 的(16029838) 問號(988) 事實(84995) 上(1233218) 她(1052913) 是(4642407) 全(178642) 世界(165235) 唯一(39149) 由(208604) 女性(59364) 創作(30713) 出來(50336) 的(16029838) 文字(31407) 只有(43745) 女性(59364) 會(1014977) 讀(46218) 會(1014977) 寫(113933) 在(3284238) 男性(24379) 眼(71964) 中(1011729) 是(4642407) 一串串(314) 神秘(7052) 的(16029838) 菱形(475) 花紋(1525) 卻(333007) 紀錄(14233) 著(1004687) 許多(159791) 女性(59364) 的(16029838) 一生(25444) 故事(101316),"{'High': 52, 'Low': 1}","{'Unknown': 9, '第1級': 16, '第2級': 5, '第4級': 10, '第4*級': 3, '第5級': 3, '第1*級': 4, '第3*級': 2, '第6級': 1}",2,Y,Y,N,N
在中國湖南的上江墟鄉和新東鄉，流傳著古老的女書，她的歷史可遠溯到宋朝，當時的女性是不被允許讀書的，女子無才便是德，但上江墟鄉聰明的婦女，為了彼此溝通情誼，創造出世界獨一無二的女書，以600多個簡單的菱形花紋、圖案、符號，表示不同的音調，就像注音符號一樣，成為女用文字。,在 中國 湖南 的 上江墟鄉 和 新東鄉 流傳 著 古老 的 女書 她 的 歷史 可 遠溯 到 宋朝 當時 的 女性 是 不 被 允許 讀書 的 女子 無 才 便是 德 但 上江墟鄉 聰明 的 婦女 為了 彼此 溝通 情誼 創造出 世界 獨一無二 的 女書 以 600多 個 簡單 的 菱形 花紋 圖案 符號 表示 不同 的 音調 就 像 注音 符號 一樣 成為 女用 文字,68,在(3284238) 中國(214840) 湖南(3980) 的(16029838) 上江墟鄉(Unknown) 和(1338337) 新東鄉(Unknown) 流傳(7352) 著(1004687) 古老(10197) 的(16029838) 女書(45) 她(1052913) 的(16029838) 歷史(96060) 可(307359) 遠溯(61) 到(546906) 宋朝(2523) 當時(126214) 的(16029838) 女性(59364) 是(4642407) 不(2282521) 被(540683) 允許(13099) 讀書(19269) 的(16029838) 女子(23797) 無(157858) 才(394539) 便是(6111) 德(11250) 但(597124) 上江墟鄉(Unknown) 聰明(27161) 的(16029838) 婦女(17834) 為了(Unknown) 彼此(39449) 溝通(31533) 情誼(2208) 創造出(7307) 世界(165235) 獨一無二(2568) 的(16029838) 女書(45) 以(547785) 600多(Unknown) 個(2296574) 簡單(52683) 的(16029838) 菱形(475) 花紋(1525) 圖案(6460) 符號(11491) 表示(74452) 不同(159432) 的(16029838) 音調(1573) 就(1737544) 像(289494) 注音(534) 符號(11491) 一樣(188109) 成為(143834) 女用(237) 文字(31407),"{'High': 60, 'Low': 8}","{'第1*級': 3, '第1級': 16, 'Unknown': 18, '第5級': 10, '第3級': 3, '第4*級': 3, '第7級': 1, '第3*級': 1, '第4級': 4, '第2級': 5, '第2*級': 1, '第6級': 3}",6,Y,Y,N,N
女書的特色是筆劃纖細，字字傾斜，每個字都呈菱形，左上右下，和現在你所看、所寫字正方圓的漢字大不相同。,女書 的 特色 是 筆劃 纖細 字字 傾斜 每 個 字 都 呈 菱形 左 上 右 下 和 現在 你 所 看 所 寫 字 正 方圓 的 漢字 大不相同,31,女書(45) 的(16029838) 特色(16060) 是(4642407) 筆劃(486) 纖細(1576) 字字(448) 傾斜(2769) 每(333357) 個(2296574) 字(75654) 都(1125846) 呈(11604) 菱形(475) 左(29440) 上(1233218) 右(25674) 下(329549) 和(1338337) 現在(218744) 你(1414837) 所(527327) 看(444691) 所(527327) 寫(113933) 字(75654) 正(179334) 方圓(968) 的(16029838) 漢字(2598) 大不相同(2257),"{'Low': 1, 'High': 30}","{'Unknown': 7, '第1級': 11, '第4級': 1, '第7級': 2, '第6級': 2, '第1*級': 4, '第2級': 2, '第3*級': 1, '第3級': 1}",1,Y,N,N,N
女書最流行的上江墟鄉，以前有許多女性使用這種表音文字寫信，藉由母傳女、長教幼的方式代代相傳，直到近代女權伸張，女人也能上學讀書以後，才慢慢地被時代所遺忘，而在中國文革時期，又認為女書是妖文邪字，大量毀壞女書，使得這個珍貴的文化資產備受傷害，直至今日才重新被重視，少女們才慢慢地學會一點女書。,女書 最 流行 的 上江墟鄉 以前 有 許多 女性 使用 這 種 表音 文字 寫信 藉由 母 傳 女 長 教 幼 的 方式 代代 相傳 直到 近代 女權 伸張 女人 也 能 上學 讀書 以後 才 慢慢 地 被 時代 所 遺忘 而 在 中國 文革 時期 又 認為 女書 是 妖文 邪 字 大量 毀壞 女書 使得 這 個 珍貴 的 文化 資產 備受 傷害 直至 今日 才 重新 被 重視 少女 們 才 慢慢 地 學會 一點 女書,81,女書(45) 最(421680) 流行(16740) 的(16029838) 上江墟鄉(Unknown) 以前(59453) 有(2217079) 許多(159791) 女性(59364) 使用(99640) 這(2114032) 種(701563) 表音(59) 文字(31407) 寫信(8272) 藉由(15664) 母(15177) 傳(17862) 女(51944) 長(107092) 教(42322) 幼(3065) 的(16029838) 方式(133407) 代代(1416) 相傳(4515) 直到(41624) 近代(7878) 女權(789) 伸張(744) 女人(71948) 也(1590760) 能(582260) 上學(7825) 讀書(19269) 以後(71883) 才(394539) 慢慢(36056) 地(754998) 被(540683) 時代(74034) 所(527327) 遺忘(5223) 而(937923) 在(3284238) 中國(214840) 文革(3076) 時期(47839) 又(535555) 認為(192030) 女書(45) 是(4642407) 妖文(Unknown) 邪(4076) 字(75654) 大量(28414) 毀壞(1447) 女書(45) 使得(30960) 這(2114032) 個(2296574) 珍貴(7380) 的(16029838) 文化(115697) 資產(14148) 備受(3188) 傷害(22978) 直至(3708) 今日(20291) 才(394539) 重新(44668) 被(540683) 重視(23501) 少女(9457) 們(140794) 才(394539) 慢慢(36056) 地(754998) 學會(25720) 一點(90745) 女書(45),"{'Low': 7, 'High': 74}","{'Unknown': 22, '第1*級': 8, '第3級': 2, '第1級': 12, '第3*級': 2, '第4級': 4, '第6級': 4, '第4*級': 9, '第5級': 7, '第7級': 2, '第2*級': 1, '第2級': 8}",1,Y,Y,N,N
為什麼要發明女書？,為什麼 要 發明 女書,4,為什麼(106142) 要(851264) 發明(14496) 女書(45),"{'High': 3, 'Low': 1}","{'第1*級': 1, '第1級': 1, '第4級': 1, 'Unknown': 1}",1,Y,N,N,N
女書的少數傳人之一朱雲娣說：「寫女書的人大都命苦又聰明，人有苦就得訴，但是女人話說多了就有人罵妳是多嘴婆，如果寫出來，認得女書的人能看，不認得的人就沒法子批評妳了。」,女書 的 少數 傳人 之 一 朱雲娣 說 寫 女書 的 人 大都 命苦 又 聰明 人 有 苦 就 得 訴 但是 女人 話 說 多 了 就 有 人 罵 妳 是 多嘴婆 如果 寫出來 認得 女書 的 人 能 看 不 認得 的 人 就 沒法子 批評 妳 了,52,女書(45) 的(16029838) 少數(17629) 傳人(573) 之(875481) 一(3701681) 朱雲娣(Unknown) 說(1285247) 寫(113933) 女書(45) 的(16029838) 人(1550512) 大都(6626) 命苦(268) 又(535555) 聰明(27161) 人(1550512) 有(2217079) 苦(19101) 就(1737544) 得(573721) 訴(838) 但是(247988) 女人(71948) 話(148020) 說(1285247) 多(318992) 了(3199291) 就(1737544) 有(2217079) 人(1550512) 罵(13508) 妳(141217) 是(4642407) 多嘴婆(3) 如果(322121) 寫出來(1842) 認得(4385) 女書(45) 的(16029838) 人(1550512) 能(582260) 看(444691) 不(2282521) 認得(4385) 的(16029838) 人(1550512) 就(1737544) 沒法子(520) 批評(24490) 妳(141217) 了(3199291),"{'Low': 5, 'High': 47}","{'Unknown': 15, '第1級': 24, '第4級': 2, '第7級': 1, '第5級': 1, '第1*級': 2, '第2*級': 1, '第2級': 3, '第4*級': 3}",4,Y,Y,N,Y
沒有學過女書的人，只看字形，是絕對無法猜出內容的。,沒有 學 過 女書 的 人 只 看 字形 是 絕對 無法 猜出 內容 的,15,沒有(594280) 學(48982) 過(412878) 女書(45) 的(16029838) 人(1550512) 只(436725) 看(444691) 字形(1241) 是(4642407) 絕對(42446) 無法(150606) 猜出(729) 內容(55074) 的(16029838),"{'High': 14, 'Low': 1}","{'第1級': 6, '第1*級': 2, 'Unknown': 3, '第7級': 1, '第4*級': 1, '第5級': 1, '第4級': 1}",0,Y,N,N,N
另一個讓女書盛行的原因是，湖南地區自古流行結拜姐妹的風氣，在趕集時認識、親友介紹甚至是左鄰右舍的女性，看對眼兒了，就會寫一封女書，交由其他女性轉達，表示義結金蘭，如果對方也覺得妳很不錯，也會回寫一封女書表示肯定，雙方一旦結為姐妹，常是至死不渝的好朋友，甚至比親姐妹還要親。,另 一 個 讓 女書 盛行 的 原因 是 湖南 地區 自古 流行 結拜 姐妹 的 風氣 在 趕集 時 認識 親友 介紹 甚至 是 左鄰右舍 的 女性 看對眼兒 了 就 會 寫 一 封 女書 交由 其他 女性 轉達 表示 義結金蘭 如果 對方 也 覺得 妳 很 不錯 也 會 回 寫 一 封 女書 表示 肯定 雙方 一旦 結為 姐妹 常 是 至死不渝 的 好朋友 甚至 比 親 姐妹 還要 親,73,另(138369) 一(3701681) 個(2296574) 讓(526314) 女書(45) 盛行(3489) 的(16029838) 原因(67404) 是(4642407) 湖南(3980) 地區(40339) 自古(2252) 流行(16740) 結拜(541) 姐妹(3400) 的(16029838) 風氣(4497) 在(3284238) 趕集(200) 時(623734) 認識(51425) 親友(4546) 介紹(26468) 甚至(122502) 是(4642407) 左鄰右舍(581) 的(16029838) 女性(59364) 看對眼兒(Unknown) 了(3199291) 就(1737544) 會(1014977) 寫(113933) 一(3701681) 封(32905) 女書(45) 交由(1728) 其他(189445) 女性(59364) 轉達(709) 表示(74452) 義結金蘭(42) 如果(322121) 對方(62393) 也(1590760) 覺得(183034) 妳(141217) 很(715675) 不錯(23297) 也(1590760) 會(1014977) 回(92620) 寫(113933) 一(3701681) 封(32905) 女書(45) 表示(74452) 肯定(34303) 雙方(22984) 一旦(37557) 結為(1546) 姐妹(3400) 常(86207) 是(4642407) 至死不渝(10) 的(16029838) 好朋友(5372) 甚至(122502) 比(170486) 親(15194) 姐妹(3400) 還要(6725) 親(15194),"{'High': 67, 'Low': 6}","{'第3級': 4, '第1級': 18, '第2級': 5, 'Unknown': 18, '第6級': 1, '第3*級': 2, '第4級': 4, '第5級': 5, '第1*級': 8, '第4*級': 6, '第7級': 2}",5,Y,Y,N,N
女書的功能很多，能夠解憂消愁，作魚雁往來，記載當時的史事，甚至把自己的生命故事寫下來，為自己作傳，女性之間代代流傳，還成為團體活動，作為宗教祭祀和團康娛樂之用，在沒有電話的時代裏，不用請人代筆寫信，能說出自己想說的話又不會被不相干的男人知道，女書實在是當時女性生活的良伴。,女書 的 功能 很多 能夠 解憂 消愁 作 魚雁往來 記載 當時 的 史事 甚至 把 自己 的 生命 故事 寫下來 為 自己 作 傳 女性 之間 代代 流傳 還 成為 團體 活動 作為 宗教 祭祀 和 團康 娛樂 之 用 在 沒有 電話 的 時代 裏 不用 請 人 代筆 寫信 能 說出 自己 想 說 的 話 又 不會 被 不相干 的 男人 知道 女書 實在 是 當時 女性 生活 的 良伴,73,女書(45) 的(16029838) 功能(38600) 很多(113128) 能夠(96422) 解憂(169) 消愁(58) 作(78184) 魚雁往來(Unknown) 記載(18376) 當時(126214) 的(16029838) 史事(509) 甚至(122502) 把(617773) 自己(744739) 的(16029838) 生命(92595) 故事(101316) 寫下來(2180) 為(761341) 自己(744739) 作(78184) 傳(17862) 女性(59364) 之間(117932) 代代(1416) 流傳(7352) 還(625086) 成為(143834) 團體(30852) 活動(85743) 作為(58009) 宗教(31336) 祭祀(5334) 和(1338337) 團康(64) 娛樂(8783) 之(875481) 用(377038) 在(3284238) 沒有(594280) 電話(38698) 的(16029838) 時代(74034) 裏(41895) 不用(23091) 請(120629) 人(1550512) 代筆(255) 寫信(8272) 能(582260) 說出(19111) 自己(744739) 想(449884) 說(1285247) 的(16029838) 話(148020) 又(535555) 不會(173045) 被(540683) 不相干(1674) 的(16029838) 男人(56333) 知道(343214) 女書(45) 實在(51634) 是(4642407) 當時(126214) 女性(59364) 生活(213189) 的(16029838) 良伴(145),"{'Low': 5, 'High': 68}","{'Unknown': 22, '第1級': 17, '第4級': 7, '第5級': 7, '第3*級': 3, '第4*級': 3, '第2級': 4, '第1*級': 7, '第6級': 1, '第3級': 2}",3,Y,Y,N,N
女書的內容多半是朋友間交流感情的一般書信，已婚者訴苦說丈夫有什麼不好，或是某位姐妹的一生辛苦故事，還有祝英台唱本、某姐與某妹的結交書、思鄉書等等，甚至有太平天國過永明、中日戰爭紀實歌等史實紀錄。,女書 的 內容 多半 是 朋友 間 交流 感情 的 一般 書信 已婚 者 訴苦 說 丈夫 有 什麼 不 好 或是 某 位 姐妹 的 一生 辛苦 故事 還 有 祝英台 唱本 某 姐 與 某 妹 的 結交 書 思鄉 書 等等 甚至 有 太平天國 過永明 中 日 戰爭 紀實 歌 等 史實 紀錄,56,女書(45) 的(16029838) 內容(55074) 多半(11983) 是(4642407) 朋友(101331) 間(115638) 交流(10657) 感情(27553) 的(16029838) 一般(80732) 書信(3293) 已婚(1738) 者(423504) 訴苦(943) 說(1285247) 丈夫(31006) 有(2217079) 什麼(431321) 不(2282521) 好(448428) 或是(75906) 某(119862) 位(284809) 姐妹(3400) 的(16029838) 一生(25444) 辛苦(13451) 故事(101316) 還(625086) 有(2217079) 祝英台(315) 唱本(45) 某(119862) 姐(4813) 與(968432) 某(119862) 妹(4119) 的(16029838) 結交(2632) 書(174356) 思鄉(496) 書(174356) 等等(38274) 甚至(122502) 有(2217079) 太平天國(1269) 過永明(Unknown) 中(1011729) 日(94041) 戰爭(42758) 紀實(821) 歌(18438) 等(327380) 史實(1903) 紀錄(14233),"{'Low': 3, 'High': 53}","{'Unknown': 13, '第1級': 18, '第4級': 5, '第4*級': 5, '第3*級': 3, '第5級': 6, '第2級': 3, '第6級': 2, '第1*級': 1}",3,Y,Y,N,Y
除了當成一般文字使用以外，女書還有當成歌本的功能，女性能夠用唱的，自娛娛人，在迷信當道的時代，女書也能當成乞願神明的祭禱文章，這些特殊的符號表示各種音，就好比現在的盲人點字課本，幾個點組合成不同的注音符號，單字不能代表意思，但組合成句子就有意義了。,除了 當成 一般 文字 使用 以外 女書 還 有 當成 歌本 的 功能 女性 能夠 用 唱 的 自娛娛人 在 迷信 當道 的 時代 女書 也 能 當成 乞願 神明 的 祭禱 文章 這些 特殊 的 符號 表示 各 種 音 就 好比 現在 的 盲人 點字 課本 幾 個 點 組合成 不同 的 注音 符號 單字 不能 代表 意思 但 組合成 句子 就 有 意義 了,67,除了(75964) 當成(15280) 一般(80732) 文字(31407) 使用(99640) 以外(13444) 女書(45) 還(625086) 有(2217079) 當成(15280) 歌本(48) 的(16029838) 功能(38600) 女性(59364) 能夠(96422) 用(377038) 唱(18607) 的(16029838) 自娛娛人(72) 在(3284238) 迷信(3917) 當道(537) 的(16029838) 時代(74034) 女書(45) 也(1590760) 能(582260) 當成(15280) 乞願(1) 神明(3749) 的(16029838) 祭禱(14) 文章(36137) 這些(315113) 特殊(28606) 的(16029838) 符號(11491) 表示(74452) 各(243023) 種(701563) 音(14215) 就(1737544) 好比(5236) 現在(218744) 的(16029838) 盲人(1876) 點字(257) 課本(2908) 幾(229415) 個(2296574) 點(118735) 組合成(620) 不同(159432) 的(16029838) 注音(534) 符號(11491) 單字(1705) 不能(162852) 代表(58333) 意思(50961) 但(597124) 組合成(620) 句子(7190) 就(1737544) 有(2217079) 意義(71714) 了(3199291),"{'High': 61, 'Low': 6}","{'第3*級': 2, '第4級': 9, 'Unknown': 21, '第1級': 17, '第1*級': 5, '第5級': 6, '第4*級': 2, '第6級': 1, '第2級': 2, '第2*級': 1, '第3級': 1}",3,Y,Y,N,N
當然，在中國開放後，女書也不再被視為妖文邪字了，中國和歐美的學者也紛紛到湖南去尋訪女書，台灣也出版了「女書」一書，介紹這種神秘的文字，現在已不限制只有女性才能學了，你也想學一學嗎？,當然 在 中國 開放 後 女書 也 不再 被 視為 妖文 邪 字 了 中國 和 歐美 的 學者 也 紛紛 到 湖南 去 尋訪 女書 台灣 也 出版 了 女書 一 書 介紹 這 種 神秘 的 文字 現在 已 不 限制 只有 女性 才 能 學 了 你 也 想 學 一 學 嗎,56,當然(113971) 在(3284238) 中國(214840) 開放(17546) 後(422857) 女書(45) 也(1590760) 不再(51754) 被(540683) 視為(26535) 妖文(Unknown) 邪(4076) 字(75654) 了(3199291) 中國(214840) 和(1338337) 歐美(4148) 的(16029838) 學者(28981) 也(1590760) 紛紛(14617) 到(546906) 湖南(3980) 去(479993) 尋訪(661) 女書(45) 台灣(130718) 也(1590760) 出版(37283) 了(3199291) 女書(45) 一(3701681) 書(174356) 介紹(26468) 這(2114032) 種(701563) 神秘(7052) 的(16029838) 文字(31407) 現在(218744) 已(215610) 不(2282521) 限制(23094) 只有(43745) 女性(59364) 才(394539) 能(582260) 學(48982) 了(3199291) 你(1414837) 也(1590760) 想(449884) 學(48982) 一(3701681) 學(48982) 嗎(248249),"{'High': 52, 'Low': 4}","{'第2級': 3, '第1*級': 3, '第1級': 25, '第4級': 3, 'Unknown': 13, '第5級': 3, '第6級': 1, '第4*級': 3, '第7級': 1, '第3級': 1}",0,Y,Y,N,N
你也想學一學嗎？,你 也 想 學 一 學 嗎,7,你(1414837) 也(1590760) 想(449884) 學(48982) 一(3701681) 學(48982) 嗎(248249),{'High': 7},{'第1級': 7},0,Y,N,N,N
上午凱悅飯店一下子出現好多對雙胞胎，原來是台北市衛生局和雙胞胎協會向全國男女老少雙胞胎發出召集令，一起向美國締造的2900對金氏世界紀錄挑戰，往3500對的目標努力！,上午 凱悅 飯店 一下子 出現 好多 對 雙胞胎 原來 是 台北市 衛生局 和 雙胞胎 協會 向 全 國 男女 老少 雙胞胎 發出 召集令 一起 向 美國 締造 的 2900 對 金氏 世界 紀錄 挑戰 往 3500 對 的 目標 努力,40,上午(6241) 凱悅(102) 飯店(9669) 一下子(10066) 出現(124694) 好多(8124) 對(897964) 雙胞胎(2554) 原來(49649) 是(4642407) 台北市(4393) 衛生局(198) 和(1338337) 雙胞胎(2554) 協會(13492) 向(231672) 全(178642) 國(73377) 男女(14723) 老少(1027) 雙胞胎(2554) 發出(29993) 召集令(38) 一起(79297) 向(231672) 美國(148299) 締造(1027) 的(16029838) 2900(12) 對(897964) 金氏(248) 世界(165235) 紀錄(14233) 挑戰(27513) 往(95775) 3500(69) 對(897964) 的(16029838) 目標(62638) 努力(62566),"{'High': 37, 'Low': 3}","{'第1級': 10, 'Unknown': 11, '第2*級': 1, '第2級': 7, '第4級': 3, '第5級': 4, '第3*級': 1, '第4*級': 2, '第7級': 1}",9,Y,Y,N,Y
80歲的阿柔和阿順姐妹與演藝圈中的雙胞胎李志希、志奇兄弟和ME2姐妹一同以「雙倍愛心，無限延伸」為口號，除了要為因震災受創的台灣民眾加油打氣之外，也要向全世界宣傳台灣並沒有被地震震垮！,80 歲 的 阿柔 和 阿順 姐妹 與 演藝圈 中 的 雙胞胎 李志希 志奇 兄弟 和 ME2 姐妹 一同 以 雙倍 愛心 無限 延伸 為 口號 除了 要 為 因 震災 受創 的 台灣 民眾 加油 打氣 之外 也 要 向 全 世界 宣傳 台灣 並 沒有 被 地震 震垮,50,80(3277) 歲(130085) 的(16029838) 阿柔(2) 和(1338337) 阿順(69) 姐妹(3400) 與(968432) 演藝圈(209) 中(1011729) 的(16029838) 雙胞胎(2554) 李志希(2) 志奇(Unknown) 兄弟(28517) 和(1338337) ME2(Unknown) 姐妹(3400) 一同(8982) 以(547785) 雙倍(5) 愛心(3575) 無限(10299) 延伸(6444) 為(761341) 口號(4008) 除了(75964) 要(851264) 為(761341) 因(119364) 震災(288) 受創(544) 的(16029838) 台灣(130718) 民眾(17097) 加油(3235) 打氣(1310) 之外(45757) 也(1590760) 要(851264) 向(231672) 全(178642) 世界(165235) 宣傳(11837) 台灣(130718) 並(442790) 沒有(594280) 被(540683) 地震(4869) 震垮(59),"{'High': 43, 'Low': 7}","{'Unknown': 19, '第1級': 10, '第4*級': 3, '第5級': 6, '第3級': 1, '第4級': 3, '第6級': 1, '第3*級': 1, '第7級': 1, '第2*級': 1, '第2級': 4}",4,Y,Y,N,Y
「你家也有雙胞胎或多胞胎嗎？」,你 家 也 有 雙胞胎 或 多胞胎 嗎,8,你(1414837) 家(236822) 也(1590760) 有(2217079) 雙胞胎(2554) 或(478077) 多胞胎(7) 嗎(248249),"{'High': 7, 'Low': 1}","{'第1級': 5, '第5級': 1, '第3級': 1, 'Unknown': 1}",2,Y,Y,N,N
金氏世界紀錄博物館館長戴勝益請民眾立即向台北市雙胞胎協會聯絡。,金氏 世界 紀錄 博物館 館長 戴勝益 請 民眾 立即 向 台北市 雙胞胎 協會 聯絡,14,金氏(248) 世界(165235) 紀錄(14233) 博物館(9905) 館長(1234) 戴勝益(85) 請(120629) 民眾(17097) 立即(28594) 向(231672) 台北市(4393) 雙胞胎(2554) 協會(13492) 聯絡(7975),"{'High': 13, 'Low': 1}","{'Unknown': 4, '第2級': 2, '第4級': 3, '第1級': 1, '第4*級': 1, '第5級': 3}",4,Y,N,N,Y
