sentence,sentence_preprocessed,sentence_length,word_freq,high_low_freq,word_level,long_word_count,is_complete_sentence,is_complete_context,is_blacklist,is_greylist
不久，莫勇卻變了，雖然他照樣勤奮的工作，可是眉宇間總似乎有一抹憂鬱與焦急；夜晚時，他常常坐在床沿上，面孔承受著從窗口射進來的月光，腦海痴痴的想著什麼心事。,不久 莫勇 卻 變 了 雖然 他 照樣 勤奮 的 工作 可是 眉宇 間 總 似乎 有 一 抹 憂鬱 與 焦急 夜晚 時 他 常常 坐 在 床沿 上 面孔 承受 著 從 窗口 射進來 的 月光 腦海 痴痴 的 想 著 什麼 心事,45,不久(34049) 莫勇(1) 卻(333007) 變(80345) 了(3199291) 雖然(152988) 他(2487930) 照樣(3183) 勤奮(2955) 的(16029838) 工作(220164) 可是(125487) 眉宇(343) 間(115638) 總(46750) 似乎(85481) 有(2217079) 一(3701681) 抹(6877) 憂鬱(9291) 與(968432) 焦急(2918) 夜晚(9758) 時(623734) 他(2487930) 常常(38706) 坐(93873) 在(3284238) 床沿(106) 上(1233218) 面孔(4093) 承受(9524) 著(1004687) 從(496546) 窗口(3937) 射進來(173) 的(16029838) 月光(4319) 腦海(8150) 痴痴(118) 的(16029838) 想(449884) 著(1004687) 什麼(431321) 心事(3365),"{'High': 44, 'Low': 1}","{'Unknown': 10, '第4級': 1, '第2級': 3, '第1級': 12, '第5級': 5, '第6級': 5, '第1*級': 4, '第4*級': 3, '第3*級': 2}",1,Y,Y,N,Y
舊曆八月十四日，地方做平安戲；老闆送他一套牛仔衣褲，又帶他到廟裡看戲；晚上，老闆家裡宴了三桌客人，忙得團團轉；他遙望好美好清麗的月亮，獨自走在柏油路上；一會兒，他轉往山坡疾走，菅草葉割破了臉皮，灌木枝劃破了腿肌，他卻一無感覺！,舊曆 八月 十四日 地方 做 平安戲 老闆 送 他 一 套 牛仔 衣褲 又 帶 他 到 廟 裡 看戲 晚上 老闆 家 裡 宴 了 三 桌 客人 忙 得 團團轉 他 遙望 好 美好 清麗 的 月亮 獨自 走 在 柏油路 上 一會兒 他 轉往 山坡 疾走 菅草葉 割破 了 臉皮 灌木枝 劃破 了 腿肌 他 卻 一 無 感覺,62,舊曆(201) 八月(15534) 十四日(2977) 地方(139164) 做(411649) 平安戲(7) 老闆(24988) 送(32804) 他(2487930) 一(3701681) 套(37180) 牛仔(964) 衣褲(509) 又(535555) 帶(105786) 他(2487930) 到(546906) 廟(9842) 裡(520435) 看戲(1216) 晚上(42206) 老闆(24988) 家(236822) 裡(520435) 宴(677) 了(3199291) 三(313861) 桌(20146) 客人(18662) 忙(26342) 得(573721) 團團轉(772) 他(2487930) 遙望(647) 好(448428) 美好(17327) 清麗(246) 的(16029838) 月亮(6917) 獨自(10863) 走(128453) 在(3284238) 柏油路(405) 上(1233218) 一會兒(19662) 他(2487930) 轉往(1086) 山坡(4314) 疾走(65) 菅草葉(Unknown) 割破(239) 了(3199291) 臉皮(922) 灌木枝(Unknown) 劃破(814) 了(3199291) 腿肌(41) 他(2487930) 卻(333007) 一(3701681) 無(157858) 感覺(91265),"{'High': 57, 'Low': 5}","{'Unknown': 23, '第1*級': 7, '第1級': 16, '第2級': 4, '第3級': 1, '第5級': 4, '第6級': 2, '第4*級': 1, '第3*級': 2, '第2*級': 1, '第4級': 1}",7,Y,N,N,N
閱讀這本書，可以了解鍾肇政先生是一個情感敏銳的人；他代表的是戰爭結束後，背負著被殖民的創傷、戰後臺灣現代文學的拓荒者；他是處在愛、恨交迸，既感傷而又生機無限的世代，因此，對外來的文化有一些期待，也有一些惶恐。,閱讀 這 本 書 可以 了解 鍾肇政 先生 是 一 個 情感 敏銳 的 人 他 代表 的 是 戰爭 結束 後 背負 著 被 殖民 的 創傷 戰後 臺灣 現代 文學 的 拓荒者 他 是 處在 愛 恨 交迸 既 感傷 而 又 生機 無限 的 世代 因此 對 外來 的 文化 有 一些 期待 也 有 一些 惶恐,60,閱讀(30622) 這(2114032) 本(197156) 書(174356) 可以(560531) 了解(82970) 鍾肇政(111) 先生(159645) 是(4642407) 一(3701681) 個(2296574) 情感(23819) 敏銳(5400) 的(16029838) 人(1550512) 他(2487930) 代表(58333) 的(16029838) 是(4642407) 戰爭(42758) 結束(40669) 後(422857) 背負(2165) 著(1004687) 被(540683) 殖民(7531) 的(16029838) 創傷(6239) 戰後(7107) 臺灣(36443) 現代(40344) 文學(33345) 的(16029838) 拓荒者(248) 他(2487930) 是(4642407) 處在(6082) 愛(124337) 恨(12971) 交迸(17) 既(43838) 感傷(1884) 而(937923) 又(535555) 生機(2426) 無限(10299) 的(16029838) 世代(8592) 因此(184606) 對(897964) 外來(5029) 的(16029838) 文化(115697) 有(2217079) 一些(156929) 期待(21616) 也(1590760) 有(2217079) 一些(156929) 惶恐(1998),"{'High': 59, 'Low': 1}","{'第4級': 3, '第1級': 26, '第3*級': 3, 'Unknown': 7, '第5級': 7, '第6級': 4, '第2級': 2, '第4*級': 4, '第1*級': 3, '第7級': 1}",2,Y,Y,N,Y
他寫作的特色是以面對歷史的劫難出發，咀嚼苦難，進而穿過整個族群的現實、精神層面，以鄉土之愛做為他創作靈魂的最後依歸。,他 寫作 的 特色 是以 面對 歷史 的 劫難 出發 咀嚼 苦難 進而 穿過 整個 族群 的 現實 精神 層面 以 鄉土 之 愛 做為 他 創作 靈魂 的 最後 依歸,31,他(2487930) 寫作(18435) 的(16029838) 特色(16060) 是以(149) 面對(62914) 歷史(96060) 的(16029838) 劫難(492) 出發(17257) 咀嚼(2108) 苦難(5101) 進而(11043) 穿過(11952) 整個(Unknown) 族群(11192) 的(16029838) 現實(34782) 精神(79222) 層面(14492) 以(547785) 鄉土(2662) 之(875481) 愛(124337) 做為(19421) 他(2487930) 創作(30713) 靈魂(20244) 的(16029838) 最後(142102) 依歸(675),"{'High': 30, 'Low': 1}","{'第1級': 7, '第4*級': 3, '第4級': 2, 'Unknown': 6, '第3級': 1, '第6級': 6, '第5級': 4, '第3*級': 1, '第2級': 1}",0,Y,Y,N,N
鍾肇政先生可以說是文學的傳燈者，想研究臺灣文學的讀者，應該深入的閱讀他的作品，藉以了解新文學運動的來龍去脈。,鍾肇政 先生 可以 說 是 文學 的 傳燈者 想 研究 臺灣 文學 的 讀者 應該 深入 的 閱讀 他 的 作品 藉以 了解 新文學 運動 的 來龍去脈,27,鍾肇政(111) 先生(159645) 可以(560531) 說(1285247) 是(4642407) 文學(33345) 的(16029838) 傳燈者(Unknown) 想(449884) 研究(182500) 臺灣(36443) 文學(33345) 的(16029838) 讀者(34316) 應該(165478) 深入(18074) 的(16029838) 閱讀(30622) 他(2487930) 的(16029838) 作品(79492) 藉以(2797) 了解(82970) 新文學(Unknown) 運動(63153) 的(16029838) 來龍去脈(1376),"{'High': 25, 'Low': 2}","{'Unknown': 5, '第1級': 12, '第4*級': 3, '第3級': 1, '第1*級': 2, '第5級': 1, '第4級': 1, '第3*級': 1, '第7級': 1}",4,Y,Y,N,Y
繁華旖旎的城市裡，我們對愛情毫無免疫力。,繁華 旖旎 的 城市 裡 我們 對 愛情 毫無 免疫力,10,繁華(2328) 旖旎(173) 的(16029838) 城市(32018) 裡(520435) 我們(979260) 對(897964) 愛情(22826) 毫無(32086) 免疫力(1183),{'High': 10},"{'第6級': 1, 'Unknown': 3, '第1級': 3, '第3級': 1, '第1*級': 1, '第4級': 1}",1,Y,N,N,N
一直以為和她分手後，我能夠徹底地忘了曾有的依戀，卻沒想到仍然斷不了綿長的淡淡思念。,一直 以為 和 她 分手 後 我 能夠 徹底 地 忘 了 曾 有 的 依戀 卻 沒想到 仍然 斷不了 綿長 的 淡淡 思念,24,一直(119877) 以為(58719) 和(1338337) 她(1052913) 分手(4597) 後(422857) 我(3033032) 能夠(96422) 徹底(17782) 地(754998) 忘(24299) 了(3199291) 曾(132981) 有(2217079) 的(16029838) 依戀(884) 卻(333007) 沒想到(13287) 仍然(46200) 斷不了(40) 綿長(302) 的(16029838) 淡淡(4166) 思念(3284),"{'High': 23, 'Low': 1}","{'第2級': 2, 'Unknown': 7, '第1級': 6, '第4*級': 1, '第5級': 2, '第2*級': 1, '第4級': 3, '第7級': 1, '第3*級': 1}",2,Y,N,N,N
深夜輪迴裡，寂寞充斥著整個房裡，不知道為什麼？,深夜 輪迴 裡 寂寞 充斥 著 整個 房 裡 不 知道 為什麼,12,深夜(4741) 輪迴(3203) 裡(520435) 寂寞(8212) 充斥(3208) 著(1004687) 整個(Unknown) 房(17530) 裡(520435) 不(2282521) 知道(343214) 為什麼(106142),"{'High': 11, 'Low': 1}","{'第4*級': 1, '第7級': 1, '第1*級': 3, '第5級': 1, '第6級': 1, 'Unknown': 2, '第3*級': 1, '第1級': 2}",1,Y,N,N,N
還是撥了通電話給她，沒有接，寂寞仍然存在著。,還是 撥 了 通 電話 給 她 沒有 接 寂寞 仍然 存在 著,13,還是(155231) 撥(4728) 了(3199291) 通(19493) 電話(38698) 給(240485) 她(1052913) 沒有(594280) 接(19549) 寂寞(8212) 仍然(46200) 存在(75197) 著(1004687),{'High': 13},"{'第1*級': 1, '第5級': 3, 'Unknown': 2, '第4*級': 1, '第1級': 4, '第2級': 1, '第4級': 1}",0,Y,Y,N,N
第二天，她突然打電話到公司，問我要一起去香港走走嗎？,第二 天 她 突然 打電話 到 公司 問 我 要 一起 去 香港 走走 嗎,15,第二(98741) 天(330413) 她(1052913) 突然(69636) 打電話(17221) 到(546906) 公司(168500) 問(165473) 我(3033032) 要(851264) 一起(79297) 去(479993) 香港(46937) 走走(2459) 嗎(248249),{'High': 15},"{'Unknown': 4, '第1級': 9, '第4級': 1, '第2級': 1}",1,Y,N,N,N
我猶豫了一下。,我 猶豫 了 一下,4,我(3033032) 猶豫(8770) 了(3199291) 一下(81077),{'High': 4},"{'第1級': 1, '第5級': 1, 'Unknown': 1, '第2級': 1}",0,Y,N,N,N
也好，也許在旅行的過程中，也許在異鄉的城市裡，我們的感情，能回到最初。,也 好 也許 在 旅行 的 過程 中 也許 在 異鄉 的 城市 裡 我們 的 感情 能 回到 最初,20,也(1590760) 好(448428) 也許(68286) 在(3284238) 旅行(18643) 的(16029838) 過程(87889) 中(1011729) 也許(68286) 在(3284238) 異鄉(1010) 的(16029838) 城市(32018) 裡(520435) 我們(979260) 的(16029838) 感情(27553) 能(582260) 回到(60084) 最初(13367),{'High': 20},"{'第1級': 5, 'Unknown': 2, '第3*級': 2, '第1*級': 4, '第2級': 2, '第5級': 1, '第7級': 1, '第3級': 1, '第4級': 1, '第4*級': 1}",0,Y,N,N,N
自從她到日本之後，愛的感覺就空盪盪的，說不上來，身旁少了個人，連吃個飯、看個電影，想偽裝幸福的感覺，都顯得遙不可及。,自從 她 到 日本 之後 愛 的 感覺 就 空盪盪 的 說不上來 身旁 少 了 個 人 連 吃 個 飯 看 個 電影 想 偽裝 幸福 的 感覺 都 顯得 遙不可及,32,自從(13186) 她(1052913) 到(546906) 日本(105587) 之後(190467) 愛(124337) 的(16029838) 感覺(91265) 就(1737544) 空盪盪(166) 的(16029838) 說不上來(665) 身旁(7813) 少(50762) 了(3199291) 個(2296574) 人(1550512) 連(91153) 吃(141660) 個(2296574) 飯(16473) 看(444691) 個(2296574) 電影(115295) 想(449884) 偽裝(2517) 幸福(27449) 的(16029838) 感覺(91265) 都(1125846) 顯得(23201) 遙不可及(756),{'High': 32},"{'第4*級': 2, '第1級': 16, '第4級': 1, '第3*級': 3, 'Unknown': 4, '第5級': 2, '第1*級': 2, '第6級': 1, '第7級': 1}",3,Y,Y,N,N
但是不曉得為什麼，總是一而再、再而三的想起她。,但是 不 曉得 為什麼 總是 一而再 再而三 的 想起 她,10,但是(247988) 不(2282521) 曉得(15380) 為什麼(106142) 總是(62757) 一而再(846) 再而三(667) 的(16029838) 想起(25243) 她(1052913),{'High': 10},"{'第2級': 2, '第1級': 3, '第4*級': 1, '第1*級': 1, 'Unknown': 2, '第4級': 1}",3,Y,Y,N,N
買了機票，我從台北飛到香港；她則從東京起飛。,買 了 機票 我 從 台北 飛到 香港 她 則 從 東京 起飛,13,買(59736) 了(3199291) 機票(1174) 我(3033032) 從(496546) 台北(22242) 飛到(3806) 香港(46937) 她(1052913) 則(254096) 從(496546) 東京(13670) 起飛(3036),{'High': 13},"{'第1級': 3, 'Unknown': 6, '第1*級': 2, '第5級': 1, '第4級': 1}",0,Y,N,N,N
起飛時，還帶著我的愛，她起飛時，卻不曉得帶著愛還是依賴。,起飛 時 還 帶 著 我 的 愛 她 起飛 時 卻 不 曉得 帶 著 愛 還是 依賴,19,起飛(3036) 時(623734) 還(625086) 帶(105786) 著(1004687) 我(3033032) 的(16029838) 愛(124337) 她(1052913) 起飛(3036) 時(623734) 卻(333007) 不(2282521) 曉得(15380) 帶(105786) 著(1004687) 愛(124337) 還是(155231) 依賴(13548),{'High': 19},"{'第4級': 3, '第3*級': 2, 'Unknown': 3, '第1級': 8, '第4*級': 1, '第1*級': 1, '第5級': 1}",0,Y,Y,N,N
到了香港，第一天我們逛街，上館子，跳Disco。,到 了 香港 第一 天 我們 逛街 上 館子 跳 Disco,11,到(546906) 了(3199291) 香港(46937) 第一(172544) 天(330413) 我們(979260) 逛街(1267) 上(1233218) 館子(512) 跳(21391) Disco(Unknown),"{'High': 10, 'Low': 1}","{'第1級': 4, 'Unknown': 4, '第2級': 1, '第3級': 1, '第1*級': 1}",1,Y,N,N,N
愛，似乎回來了。,愛 似乎 回來 了,4,愛(124337) 似乎(85481) 回來(45286) 了(3199291),{'High': 4},"{'第1級': 1, '第5級': 1, 'Unknown': 2}",0,Y,N,N,N
心，開始悸動了。,心 開始 悸動 了,4,心(180243) 開始(245562) 悸動(669) 了(3199291),{'High': 4},"{'第2級': 2, '第7級': 1, 'Unknown': 1}",0,Y,N,N,N
第二天晚上，回飯店後，她接到電話，說了幾句日文，我聽不懂，但是看到她臉部表情的變化。,第二 天 晚上 回 飯店 後 她 接到 電話 說 了 幾 句 日文 我 聽 不 懂 但是 看到 她 臉部 表情 的 變化,25,第二(98741) 天(330413) 晚上(42206) 回(92620) 飯店(9669) 後(422857) 她(1052913) 接到(9575) 電話(38698) 說(1285247) 了(3199291) 幾(229415) 句(87396) 日文(2636) 我(3033032) 聽(138052) 不(2282521) 懂(32301) 但是(247988) 看到(159419) 她(1052913) 臉部(3213) 表情(25210) 的(16029838) 變化(42502),{'High': 25},"{'Unknown': 4, '第1級': 12, '第2級': 3, '第2*級': 2, '第1*級': 2, '第4級': 2}",0,Y,Y,N,N
她似乎有點心虛。,她 似乎 有點 心虛,4,她(1052913) 似乎(85481) 有點(43275) 心虛(1202),{'High': 4},"{'第1級': 1, '第5級': 1, '第1*級': 1, '第6級': 1}",0,Y,N,N,N
我刻意進浴室洗澡，禮貌性地迴避了些尷尬。,我 刻意 進 浴室 洗澡 禮貌性 地 迴避 了 些 尷尬,11,我(3033032) 刻意(11267) 進(40005) 浴室(4500) 洗澡(4561) 禮貌性(299) 地(754998) 迴避(3163) 了(3199291) 些(159879) 尷尬(7232),{'High': 11},"{'第1級': 1, '第6級': 2, '第1*級': 1, '第3級': 1, '第2*級': 1, 'Unknown': 4, '第5級': 1}",1,Y,N,N,N
我還是忍不住，問了那是誰？,我 還是 忍不住 問 了 那 是 誰,8,我(3033032) 還是(155231) 忍不住(14239) 問(165473) 了(3199291) 那(754138) 是(4642407) 誰(110452),{'High': 8},"{'第1級': 5, '第1*級': 1, 'Unknown': 2}",1,Y,N,N,N
沉默。,沉默,1,沉默(13662),{'High': 1},{'第5級': 1},0,Y,N,N,N
突然間，她哭了。,突然間 她 哭 了,4,突然間(4491) 她(1052913) 哭(28445) 了(3199291),{'High': 4},"{'Unknown': 2, '第1級': 1, '第2級': 1}",1,Y,N,N,N
突然間，我疼了。,突然間 我 疼 了,4,突然間(4491) 我(3033032) 疼(3633) 了(3199291),{'High': 4},"{'Unknown': 2, '第1級': 1, '第4*級': 1}",1,Y,N,N,N
她向我說對不起，那是她未婚夫，下個月結婚。,她 向 我 說 對不起 那 是 她 未婚夫 下 個 月 結婚,13,她(1052913) 向(231672) 我(3033032) 說(1285247) 對不起(9459) 那(754138) 是(4642407) 她(1052913) 未婚夫(595) 下(329549) 個(2296574) 月(148997) 結婚(22719),{'High': 13},"{'第1級': 9, '第2級': 1, '第7級': 1, '第1*級': 1, '第3級': 1}",2,Y,N,N,N
我苦笑，卻感覺空氣凝結在整個空間裡。,我 苦笑 卻 感覺 空氣 凝結 在 整個 空間 裡,10,我(3033032) 苦笑(2577) 卻(333007) 感覺(91265) 空氣(18137) 凝結(1179) 在(3284238) 整個(Unknown) 空間(52519) 裡(520435),"{'High': 9, 'Low': 1}","{'第1級': 1, 'Unknown': 2, '第4級': 2, '第3*級': 1, '第1*級': 3, '第7級': 1}",0,Y,N,N,N
那為什麼要找我來香港。,那 為什麼 要 找 我 來 香港,7,那(754138) 為什麼(106142) 要(851264) 找(108128) 我(3033032) 來(742183) 香港(46937),{'High': 7},"{'第1級': 5, '第1*級': 1, 'Unknown': 1}",1,Y,N,N,N
她說，還記得去年情人節，我們說好了要到香港，卻因為她出了點小車禍，而取消了行程。,她 說 還 記得 去年 情人節 我們 說好 了 要 到 香港 卻 因為 她 出 了 點 小 車禍 而 取消 了 行程,24,她(1052913) 說(1285247) 還(625086) 記得(47506) 去年(9462) 情人節(582) 我們(979260) 說好(758) 了(3199291) 要(851264) 到(546906) 香港(46937) 卻(333007) 因為(425061) 她(1052913) 出(84457) 了(3199291) 點(118735) 小(318835) 車禍(3541) 而(937923) 取消(5437) 了(3199291) 行程(5276),{'High': 24},"{'第1級': 9, 'Unknown': 7, '第2級': 1, '第4級': 2, '第1*級': 2, '第5級': 3}",1,Y,Y,N,N
她想在結婚前，完成這個心願。,她 想 在 結婚 前 完成 這 個 心願,9,她(1052913) 想(449884) 在(3284238) 結婚(22719) 前(272709) 完成(60471) 這(2114032) 個(2296574) 心願(3025),{'High': 9},"{'第1級': 5, '第1*級': 1, '第3級': 1, '第4*級': 1, '第6級': 1}",0,Y,N,N,N
我不知道該說什麼，強忍著心中的百感交集，勉強地吐出這幾個字││那為何還要嫁給他？,我 不 知道 該 說 什麼 強忍 著 心 中 的 百感交集 勉強 地 吐出 這 幾 個 字 那 為 何 還 要 嫁給 他,26,我(3033032) 不(2282521) 知道(343214) 該(148369) 說(1285247) 什麼(431321) 強忍(844) 著(1004687) 心(180243) 中(1011729) 的(16029838) 百感交集(332) 勉強(10442) 地(754998) 吐出(2917) 這(2114032) 幾(229415) 個(2296574) 字(75654) 那(754138) 為(761341) 何(46992) 還(625086) 要(851264) 嫁給(7400) 他(2487930),{'High': 26},"{'第1級': 13, '第4*級': 1, 'Unknown': 10, '第2級': 1, '第5級': 1}",1,Y,N,N,N
她說因為寂寞，因為他對她很好，因為那是她的上司，因為她懷了他的孩子。,她 說 因為 寂寞 因為 他 對 她 很 好 因為 那 是 她 的 上司 因為 她 懷 了 他 的 孩子,23,她(1052913) 說(1285247) 因為(425061) 寂寞(8212) 因為(425061) 他(2487930) 對(897964) 她(1052913) 很(715675) 好(448428) 因為(425061) 那(754138) 是(4642407) 她(1052913) 的(16029838) 上司(7237) 因為(425061) 她(1052913) 懷(8207) 了(3199291) 他(2487930) 的(16029838) 孩子(242092),{'High': 23},"{'第1級': 14, '第1*級': 4, '第5級': 2, 'Unknown': 3}",0,Y,Y,N,N
連祝福兩個字，我都還故做堅強。,連 祝福 兩 個 字 我 都 還 故 做 堅強,11,連(91153) 祝福(5030) 兩(526190) 個(2296574) 字(75654) 我(3033032) 都(1125846) 還(625086) 故(28882) 做(411649) 堅強(6720),{'High': 11},"{'第3*級': 1, '第5級': 2, '第1級': 6, 'Unknown': 1, '第6級': 1}",0,Y,Y,N,N
一大早，窗外的陽光將我喚醒，她不在身邊，行李也不見了。,一大早 窗 外 的 陽光 將 我 喚醒 她 不 在 身邊 行李 也 不見了,15,一大早(2070) 窗(19038) 外(109310) 的(16029838) 陽光(17239) 將(448374) 我(3033032) 喚醒(3271) 她(1052913) 不(2282521) 在(3284238) 身邊(33516) 行李(6234) 也(1590760) 不見了(7528),{'High': 15},"{'Unknown': 1, '第2*級': 2, '第1級': 6, '第4*級': 1, '第5級': 1, '第6級': 1, '第1*級': 1, '第3*級': 1, '第3級': 1}",2,Y,N,N,N
只留下了一封信。,只 留下 了 一 封 信,6,只(436725) 留下(29992) 了(3199291) 一(3701681) 封(32905) 信(57591),{'High': 6},"{'第1*級': 1, '第3*級': 1, 'Unknown': 1, '第1級': 1, '第3級': 1, '第2級': 1}",0,Y,N,N,N
人走了，愛走了。,人 走 了 愛 走 了,6,人(1550512) 走(128453) 了(3199291) 愛(124337) 走(128453) 了(3199291),{'High': 6},"{'第1級': 4, 'Unknown': 2}",0,Y,N,N,N
寂寞留下來了，傷心也留下來了。,寂寞 留下來 了 傷心 也 留下來 了,7,寂寞(8212) 留下來(6479) 了(3199291) 傷心(7986) 也(1590760) 留下來(6479) 了(3199291),{'High': 7},"{'第5級': 1, 'Unknown': 4, '第4*級': 1, '第1級': 1}",2,Y,N,N,N
我一個人在傷心地下鐵穿梭，愛卻過站不停。,我 一 個 人 在 傷心 地下鐵 穿梭 愛 卻 過 站 不停,13,我(3033032) 一(3701681) 個(2296574) 人(1550512) 在(3284238) 傷心(7986) 地下鐵(551) 穿梭(3269) 愛(124337) 卻(333007) 過(412878) 站(68488) 不停(20176),{'High': 13},"{'第1級': 5, '第1*級': 3, '第4*級': 1, 'Unknown': 1, '第7級': 1, '第4級': 1, '第3*級': 1}",1,Y,N,N,N
城市律動裡，來回穿梭的陌生臉孔，有誰看到我的心？,城市 律動 裡 來回 穿梭 的 陌生 臉孔 有 誰 看到 我 的 心,14,城市(32018) 律動(754) 裡(520435) 來回(5129) 穿梭(3269) 的(16029838) 陌生(7928) 臉孔(3845) 有(2217079) 誰(110452) 看到(159419) 我(3033032) 的(16029838) 心(180243),{'High': 14},"{'第3級': 1, '第7級': 2, '第1*級': 2, '第4*級': 1, '第1級': 5, '第5級': 2, '第2級': 1}",0,Y,N,N,N
中環天星碼頭，浪漫的天星小輪上，不知載滿多少情愛故事，我卻將思念灑在維多利亞港灣......也好，這也許是她的幸福；也好，這也許是我該有的旅途。,中環 天星 碼頭 浪漫 的 天星 小輪 上 不 知 載滿 多少 情愛 故事 我 卻 將 思念 灑 在 維多利亞 港灣 也 好 這 也許 是 她 的 幸福 也 好 這 也許 是 我 該 有 的 旅途,40,中環(393) 天星(118) 碼頭(4901) 浪漫(9865) 的(16029838) 天星(118) 小輪(57) 上(1233218) 不(2282521) 知(108500) 載滿(334) 多少(50265) 情愛(1256) 故事(101316) 我(3033032) 卻(333007) 將(448374) 思念(3284) 灑(3897) 在(3284238) 維多利亞(3255) 港灣(672) 也(1590760) 好(448428) 這(2114032) 也許(68286) 是(4642407) 她(1052913) 的(16029838) 幸福(27449) 也(1590760) 好(448428) 這(2114032) 也許(68286) 是(4642407) 我(3033032) 該(148369) 有(2217079) 的(16029838) 旅途(3253),"{'High': 39, 'Low': 1}","{'Unknown': 11, '第6級': 2, '第4*級': 3, '第1級': 16, '第2級': 1, '第4級': 1, '第5級': 3, '第1*級': 1, '第3*級': 2}",1,Y,N,N,Y
一個人到佐敦的榮發吃露天大排檔，一個人到銅鑼灣時代廣場瘋狂血拼，一個人在中環蘭桂坊買醉，再一個人回到我的傷心飯店。,一 個 人 到 佐敦 的 榮發 吃 露天 大排檔 一 個 人 到 銅鑼灣 時代 廣場 瘋狂 血拼 一 個 人 在 中環 蘭桂坊 買醉 再 一 個 人 回到 我 的 傷心 飯店,35,一(3701681) 個(2296574) 人(1550512) 到(546906) 佐敦(59) 的(16029838) 榮發(8) 吃(141660) 露天(1305) 大排檔(24) 一(3701681) 個(2296574) 人(1550512) 到(546906) 銅鑼灣(464) 時代(74034) 廣場(8418) 瘋狂(11212) 血拼(45) 一(3701681) 個(2296574) 人(1550512) 在(3284238) 中環(393) 蘭桂坊(35) 買醉(15) 再(326207) 一(3701681) 個(2296574) 人(1550512) 回到(60084) 我(3033032) 的(16029838) 傷心(7986) 飯店(9669),"{'High': 29, 'Low': 6}","{'第1級': 18, 'Unknown': 8, '第6級': 1, '第4*級': 2, '第5級': 2, '第1*級': 2, '第2級': 1, '第2*級': 1}",3,Y,N,N,N
一大早，收拾行李，我想換一間飯店。,一大早 收拾 行李 我 想 換 一 間 飯店,9,一大早(2070) 收拾(6751) 行李(6234) 我(3033032) 想(449884) 換(25907) 一(3701681) 間(115638) 飯店(9669),{'High': 9},"{'Unknown': 2, '第5級': 1, '第3級': 2, '第1級': 3, '第2*級': 1}",1,Y,N,N,N
也許，換個飯店，才能轉換心情。,也許 換 個 飯店 才 能 轉換 心情,8,也許(68286) 換(25907) 個(2296574) 飯店(9669) 才(394539) 能(582260) 轉換(6744) 心情(33611),{'High': 8},"{'第3*級': 2, '第3級': 1, '第1級': 1, '第2*級': 1, '第2級': 1, '第1*級': 1, '第5級': 1}",0,Y,N,N,N
麗晶酒店的大落地窗，才有度假的味道。,麗晶 酒店 的 大 落地窗 才 有 度假 的 味道,10,麗晶(29) 酒店(3875) 的(16029838) 大(525780) 落地窗(701) 才(394539) 有(2217079) 度假(3488) 的(16029838) 味道(14200),"{'Low': 1, 'High': 9}","{'Unknown': 1, '第5級': 1, '第1級': 4, '第6級': 1, '第2級': 2, '第4*級': 1}",1,Y,N,N,Y
麗晶軒的港市飲茶，道地的港式飲茶令人心曠神怡、大快朵頤。,麗晶軒 的 港市 飲茶 道地 的 港式 飲茶 令 人 心曠神怡 大快朵頤,12,麗晶軒(Unknown) 的(16029838) 港市(85) 飲茶(708) 道地(989) 的(16029838) 港式(133) 飲茶(708) 令(128742) 人(1550512) 心曠神怡(484) 大快朵頤(350),"{'Low': 2, 'High': 10}","{'Unknown': 6, '第1級': 3, '第5級': 2, '第7級': 1}",3,Y,N,N,N
夜幕低垂，繁華卻點了上火，夜晚的香港，晶亮迷人，像穿了晚禮服的貴婦，帶滿耀眼的璀璨。,夜幕 低垂 繁華 卻 點 了 上 火 夜晚 的 香港 晶亮 迷人 像 穿 了 晚禮服 的 貴婦 帶滿 耀眼 的 璀璨,23,夜幕(2105) 低垂(1134) 繁華(2328) 卻(333007) 點(118735) 了(3199291) 上(1233218) 火(24391) 夜晚(9758) 的(16029838) 香港(46937) 晶亮(454) 迷人(5647) 像(289494) 穿(46113) 了(3199291) 晚禮服(Unknown) 的(16029838) 貴婦(594) 帶滿(6) 耀眼(2484) 的(16029838) 璀璨(647),"{'High': 21, 'Low': 2}","{'第7級': 3, '第6級': 2, '第4級': 1, '第1級': 5, 'Unknown': 7, '第2級': 1, '第3*級': 1, '第4*級': 1, '第1*級': 2}",1,Y,N,N,N
還是走到天星碼頭，港灣的風有些沁涼，適合把心事晾乾。,還是 走到 天星 碼頭 港灣 的 風 有些 沁涼 適合 把 心事 晾乾,13,還是(155231) 走到(32033) 天星(118) 碼頭(4901) 港灣(672) 的(16029838) 風(30613) 有些(6971) 沁涼(4) 適合(25592) 把(617773) 心事(3365) 晾乾(318),"{'High': 12, 'Low': 1}","{'第1*級': 2, 'Unknown': 6, '第6級': 1, '第1級': 1, '第3級': 1, '第2級': 1, '第5級': 1}",0,Y,N,N,Y
碼頭上，許多遊客嬉笑拍照，許多情侶甜蜜依偎，而我，卻還是一個人寂寞。,碼頭 上 許多 遊客 嬉笑 拍照 許多 情侶 甜蜜 依偎 而 我 卻 還是 一 個 人 寂寞,18,碼頭(4901) 上(1233218) 許多(159791) 遊客(4899) 嬉笑(458) 拍照(2914) 許多(159791) 情侶(2104) 甜蜜(3026) 依偎(831) 而(937923) 我(3033032) 卻(333007) 還是(155231) 一(3701681) 個(2296574) 人(1550512) 寂寞(8212),{'High': 18},"{'第6級': 1, '第1級': 5, '第3*級': 2, 'Unknown': 2, '第3級': 1, '第5級': 4, '第7級': 1, '第4級': 1, '第1*級': 1}",0,Y,Y,N,N
