sentence,sentence_preprocessed,sentence_length,word_freq,high_low_freq,word_level,long_word_count,is_complete_sentence,is_complete_context,is_blacklist,is_greylist
生平所做的第一件善事是發生在大學剛畢業，初到鐵路局擔任列車長時。,生平 所 做 的 第一 件 善事 是 發生 在 大學 剛 畢業 初 到 鐵路局 擔任 列車長 時,19,生平(3589) 所(527327) 做(411649) 的(16029838) 第一(172544) 件(139257) 善事(744) 是(4642407) 發生(129211) 在(3284238) 大學(83893) 剛(55049) 畢業(19764) 初(42087) 到(546906) 鐵路局(304) 擔任(34825) 列車長(82) 時(623734),"{'High': 18, 'Low': 1}","{'第6級': 1, '第2級': 3, '第1級': 5, '第1*級': 2, '第7級': 1, '第3級': 2, '第4級': 1, 'Unknown': 2, '第5級': 1, '第3*級': 1}",2,Y,N,N,N
那天是春節前夕，從台北開出的南下列車，人塞得滿滿的。,那 天 是 春節 前夕 從 台北 開出 的 南下 列車 人 塞 得 滿滿 的,16,那(754138) 天(330413) 是(4642407) 春節(1458) 前夕(2814) 從(496546) 台北(22242) 開出(2147) 的(16029838) 南下(4499) 列車(2658) 人(1550512) 塞(5342) 得(573721) 滿滿(4027) 的(16029838),{'High': 16},"{'第1級': 6, '第3級': 1, '第6級': 2, '第1*級': 1, 'Unknown': 5, '第5級': 1}",0,Y,N,N,N
列車從台北站開出後，我一路忙著查票、補票，注意到車門邊一個理平頭、約國中年齡的男孩。,列車 從 台北站 開出 後 我 一路 忙著 查票 補票 注意到 車門 邊 一 個 理平頭 約 國中 年齡 的 男孩,21,列車(2658) 從(496546) 台北站(10) 開出(2147) 後(422857) 我(3033032) 一路(14840) 忙著(7283) 查票(30) 補票(Unknown) 注意到(20925) 車門(2030) 邊(123152) 一(3701681) 個(2296574) 理平頭(15) 約(47731) 國中(5108) 年齡(17758) 的(16029838) 男孩(22813),"{'High': 17, 'Low': 4}","{'第6級': 2, '第1*級': 2, 'Unknown': 9, '第1級': 5, '第3*級': 1, '第4級': 2}",3,Y,N,N,N
過了台中站，多數旅客下車，我再次巡車，發現男孩逃票。,過 了 台中站 多數 旅客 下車 我 再次 巡 車 發現 男孩 逃票,13,過(412878) 了(3199291) 台中站(19) 多數(13621) 旅客(3355) 下車(4505) 我(3033032) 再次(21282) 巡(1417) 車(47590) 發現(175233) 男孩(22813) 逃票(16),"{'High': 11, 'Low': 2}","{'第1*級': 1, 'Unknown': 8, '第4級': 1, '第1級': 2, '第2級': 1}",1,Y,N,N,N
他說沒錢買票，連飯也沒吃，我便請他到列車長室吃便當。,他 說 沒 錢 買票 連 飯 也 沒 吃 我 便 請 他 到 列車長室 吃 便當,18,他(2487930) 說(1285247) 沒(306167) 錢(89883) 買票(194) 連(91153) 飯(16473) 也(1590760) 沒(306167) 吃(141660) 我(3033032) 便(220860) 請(120629) 他(2487930) 到(546906) 列車長室(Unknown) 吃(141660) 便當(2842),"{'High': 17, 'Low': 1}","{'第1級': 12, 'Unknown': 2, '第3*級': 1, '第1*級': 1, '第6級': 1, '第3級': 1}",1,Y,Y,N,N
聊開來才知道，男孩住嘉義鄉下，還在讀國中，因不愛念書常惹事，被父親責打，憤而偷錢逃家到台北，流浪了幾天，要回家過年，錢不夠，想趁過年搭車人多，越站乘車到嘉義下車爬牆出站，再走路回鄉下，沒想到被查獲。,聊開 來 才 知道 男孩 住 嘉義 鄉下 還 在 讀 國中 因 不 愛 念書 常 惹事 被 父親 責打 憤 而 偷 錢 逃家 到 台北 流浪 了 幾 天 要 回家 過年 錢 不 夠 想 趁 過年 搭 車 人 多 越站 乘車 到 嘉義 下車 爬牆 出 站 再 走路 回 鄉下 沒想到 被 查獲,60,聊開(41) 來(742183) 才(394539) 知道(343214) 男孩(22813) 住(69815) 嘉義(2515) 鄉下(5332) 還(625086) 在(3284238) 讀(46218) 國中(5108) 因(119364) 不(2282521) 愛(124337) 念書(2789) 常(86207) 惹事(274) 被(540683) 父親(86472) 責打(269) 憤(965) 而(937923) 偷(8859) 錢(89883) 逃家(388) 到(546906) 台北(22242) 流浪(4123) 了(3199291) 幾(229415) 天(330413) 要(851264) 回家(35375) 過年(2578) 錢(89883) 不(2282521) 夠(49042) 想(449884) 趁(9845) 過年(2578) 搭(16185) 車(47590) 人(1550512) 多(318992) 越站(Unknown) 乘車(647) 到(546906) 嘉義(2515) 下車(4505) 爬牆(15) 出(84457) 站(68488) 再(326207) 走路(10616) 回(92620) 鄉下(5332) 沒想到(13287) 被(540683) 查獲(259),"{'Low': 3, 'High': 57}","{'Unknown': 17, '第1級': 16, '第2級': 4, '第1*級': 9, '第3*級': 4, '第4級': 2, '第2*級': 3, '第3級': 2, '第5級': 2, '第7級': 1}",1,Y,Y,N,N
男孩一直拜託我不要把他交給警察，說著說著，稚氣未脫的眼裡還閃著淚光。,男孩 一直 拜託 我 不要 把 他 交給 警察 說 著 說 著 稚氣未脫 的 眼 裡 還 閃 著 淚光,21,男孩(22813) 一直(119877) 拜託(7533) 我(3033032) 不要(101931) 把(617773) 他(2487930) 交給(17334) 警察(20613) 說(1285247) 著(1004687) 說(1285247) 著(1004687) 稚氣未脫(46) 的(16029838) 眼(71964) 裡(520435) 還(625086) 閃(6919) 著(1004687) 淚光(515),"{'High': 20, 'Low': 1}","{'Unknown': 9, '第2級': 2, '第5級': 2, '第1級': 5, '第4級': 1, '第3*級': 1, '第1*級': 1}",1,Y,N,N,N
我看他神情憔悴、衣衫不整，想來逃家的日子也吃了不少苦頭，就好言勸他歹路不可行，並編排說自己也曾年少輕狂，使父母傷透了心，在親友的苦勸下才迷途知返、考上大學。,我 看 他 神情 憔悴 衣衫不整 想來 逃家 的 日子 也 吃 了 不少 苦頭 就 好言 勸 他 歹路 不可 行 並 編排 說 自己 也 曾 年少 輕狂 使 父母 傷透 了 心 在 親友 的 苦勸 下 才 迷途知返 考上 大學,44,我(3033032) 看(444691) 他(2487930) 神情(8344) 憔悴(1713) 衣衫不整(124) 想來(1863) 逃家(388) 的(16029838) 日子(28378) 也(1590760) 吃(141660) 了(3199291) 不少(35256) 苦頭(1355) 就(1737544) 好言(191) 勸(11371) 他(2487930) 歹路(9) 不可(50808) 行(63474) 並(442790) 編排(1298) 說(1285247) 自己(744739) 也(1590760) 曾(132981) 年少(2256) 輕狂(273) 使(197544) 父母(78215) 傷透(462) 了(3199291) 心(180243) 在(3284238) 親友(4546) 的(16029838) 苦勸(104) 下(329549) 才(394539) 迷途知返(Unknown) 考上(2408) 大學(83893),"{'High': 42, 'Low': 2}","{'第1級': 11, 'Unknown': 15, '第6級': 4, '第3*級': 1, '第4*級': 2, '第7級': 2, '第1*級': 3, '第4級': 1, '第5級': 2, '第3級': 1, '第2級': 2}",2,Y,Y,N,N
男孩看來好像有點感動，我話鋒一轉，嚴厲地說我可以替他補票、請他吃便當、給他回家的車費，「但你回去一定要做好囝仔，我會依你留下的姓名、地址，請當地派出所警察隨時盯著你，如果再不乖，到時你就知道厲害！」,男孩 看來 好像 有點 感動 我 話鋒 一 轉 嚴厲 地 說 我 可以 替 他 補票 請 他 吃 便當 給 他 回家 的 車費 但 你 回去 一定 要 做 好 囝仔 我 會 依 你 留下 的 姓名 地址 請 當地 派出所 警察 隨時 盯 著 你 如果 再 不 乖 到時 你 就 知道 厲害,59,男孩(22813) 看來(23504) 好像(67024) 有點(43275) 感動(15132) 我(3033032) 話鋒(314) 一(3701681) 轉(20108) 嚴厲(7647) 地(754998) 說(1285247) 我(3033032) 可以(560531) 替(34886) 他(2487930) 補票(Unknown) 請(120629) 他(2487930) 吃(141660) 便當(2842) 給(240485) 他(2487930) 回家(35375) 的(16029838) 車費(139) 但(597124) 你(1414837) 回去(21353) 一定(138695) 要(851264) 做(411649) 好(448428) 囝仔(350) 我(3033032) 會(1014977) 依(37519) 你(1414837) 留下(29992) 的(16029838) 姓名(6384) 地址(5736) 請(120629) 當地(23011) 派出所(646) 警察(20613) 隨時(21195) 盯(15229) 著(1004687) 你(1414837) 如果(322121) 再(326207) 不(2282521) 乖(3965) 到時(1969) 你(1414837) 就(1737544) 知道(343214) 厲害(12727),"{'High': 58, 'Low': 1}","{'Unknown': 14, '第4*級': 2, '第2級': 4, '第1*級': 4, '第4級': 5, '第1級': 25, '第5級': 2, '第3級': 1, '第3*級': 1, '第2*級': 1}",1,Y,Y,N,N
到了嘉義站，他下車，站在月台上低頭不語。,到 了 嘉義站 他 下車 站 在 月台 上 低頭 不 語,12,到(546906) 了(3199291) 嘉義站(10) 他(2487930) 下車(4505) 站(68488) 在(3284238) 月台(1209) 上(1233218) 低頭(7481) 不(2282521) 語(13797),"{'High': 11, 'Low': 1}","{'第1級': 4, 'Unknown': 3, '第1*級': 2, '第3*級': 2, '第2級': 1}",1,Y,N,N,N
等到列車緩緩滑出站時，他猛然抬頭，拖著不方便的左腳，一拐一拐地跟著列車跑，口中喊著：「列車長，謝謝你！,等到 列車 緩緩 滑出 站 時 他 猛然 抬頭 拖 著 不 方便 的 左腳 一 拐 一 拐 地 跟著 列車 跑 口 中 喊 著 列車長 謝謝 你,30,等到(21150) 列車(2658) 緩緩(8879) 滑出(244) 站(68488) 時(623734) 他(2487930) 猛然(3687) 抬頭(8747) 拖(10513) 著(1004687) 不(2282521) 方便(14172) 的(16029838) 左腳(1421) 一(3701681) 拐(2286) 一(3701681) 拐(2286) 地(754998) 跟著(84) 列車(2658) 跑(35326) 口(83854) 中(1011729) 喊(16559) 著(1004687) 列車長(82) 謝謝(16562) 你(1414837),"{'High': 28, 'Low': 2}","{'第3*級': 2, '第6級': 4, 'Unknown': 9, '第1*級': 2, '第1級': 7, '第5級': 3, '第2級': 1, '第3級': 1, '第4級': 1}",1,Y,N,N,N
我一定會做好囝仔，你可以隨時來查。」,我 一定 會 做 好 囝仔 你 可以 隨時 來 查,11,我(3033032) 一定(138695) 會(1014977) 做(411649) 好(448428) 囝仔(350) 你(1414837) 可以(560531) 隨時(21195) 來(742183) 查(8802),{'High': 11},"{'第1級': 5, '第1*級': 2, 'Unknown': 2, '第4級': 1, '第3級': 1}",0,Y,N,N,N
站在車門邊的我，激動地揮手大聲說：「你一定要學好！」,站 在 車門 邊 的 我 激動 地 揮手 大聲 說 你 一定 要 學 好,16,站(68488) 在(3284238) 車門(2030) 邊(123152) 的(16029838) 我(3033032) 激動(9809) 地(754998) 揮手(3567) 大聲(22292) 說(1285247) 你(1414837) 一定(138695) 要(851264) 學(48982) 好(448428),{'High': 16},"{'第1*級': 4, 'Unknown': 5, '第1級': 6, '第5級': 1}",0,Y,N,N,N
那個年，我過得很滿足。,那 個 年 我 過 得 很 滿足,8,那(754138) 個(2296574) 年(514736) 我(3033032) 過(412878) 得(573721) 很(715675) 滿足(29073),{'High': 8},"{'第1級': 5, '第1*級': 1, 'Unknown': 1, '第4級': 1}",0,Y,N,N,N
網壇不朽的長青樹46歲「女金剛」娜拉提諾娃，今天為她增添一個紀錄性的雙打冠軍頭銜！,網壇 不朽 的 長青樹 46 歲 女 金剛 娜拉提諾娃 今天 為 她 增添 一 個 紀錄性 的 雙打 冠軍 頭銜,20,網壇(24) 不朽(1834) 的(16029838) 長青樹(22) 46(1885) 歲(130085) 女(51944) 金剛(3081) 娜拉提諾娃(Unknown) 今天(73277) 為(761341) 她(1052913) 增添(3615) 一(3701681) 個(2296574) 紀錄性(58) 的(16029838) 雙打(67) 冠軍(3670) 頭銜(2676),"{'Low': 5, 'High': 15}","{'Unknown': 7, '第6級': 3, '第1級': 7, '第1*級': 1, '第7級': 1, '第5級': 1}",3,Y,N,N,Y
在杜拜女子網球公開賽中，娜姐與俄羅斯女將庫茲娜索娃搭配，以63、76擊敗對手在女雙封后，拿下生涯第168個冠軍，重大的意義在於，這次雙打冠軍超越她生平167個單打冠軍，這兩項紀錄均是網壇不論男、女的最高紀錄。,在 杜拜 女子 網球 公開賽 中 娜姐 與 俄羅斯 女將 庫茲娜索娃 搭配 以 6 3 7 6 擊敗 對手 在 女雙 封后 拿下 生涯 第168 個 冠軍 重大 的 意義 在於 這 次 雙打 冠軍 超越 她 生平 167 個 單打 冠軍 這 兩 項 紀錄 均 是 網壇 不論 男 女 的 最 高 紀錄,56,在(3284238) 杜拜(159) 女子(23797) 網球(1572) 公開賽(115) 中(1011729) 娜姐(1) 與(968432) 俄羅斯(5951) 女將(135) 庫茲娜索娃(Unknown) 搭配(6314) 以(547785) 6(25671) 3(51223) 7(21969) 6(25671) 擊敗(4544) 對手(14528) 在(3284238) 女雙(3) 封后(28) 拿下(3104) 生涯(11332) 第168(Unknown) 個(2296574) 冠軍(3670) 重大(19228) 的(16029838) 意義(71714) 在於(37953) 這(2114032) 次(331701) 雙打(67) 冠軍(3670) 超越(16080) 她(1052913) 生平(3589) 167(422) 個(2296574) 單打(110) 冠軍(3670) 這(2114032) 兩(526190) 項(88887) 紀錄(14233) 均(27783) 是(4642407) 網壇(24) 不論(28127) 男(23928) 女(51944) 的(16029838) 最(421680) 高(128858) 紀錄(14233),"{'High': 49, 'Low': 7}","{'第1*級': 5, 'Unknown': 18, '第4*級': 4, '第2*級': 1, '第4級': 4, '第5級': 9, '第6級': 4, '第1級': 10, '第2級': 1}",5,Y,Y,N,Y
我的父母都有工作，由於輪班的關係，我常常好幾天看不到他們。,我 的 父母 都 有 工作 由於 輪班 的 關係 我 常常 好幾 天 看 不 到 他們,18,我(3033032) 的(16029838) 父母(78215) 都(1125846) 有(2217079) 工作(220164) 由於(88111) 輪班(383) 的(16029838) 關係(162883) 我(3033032) 常常(38706) 好幾(30650) 天(330413) 看(444691) 不(2282521) 到(546906) 他們(716752),{'High': 18},"{'第1級': 11, '第3級': 2, '第4*級': 1, 'Unknown': 3, '第1*級': 1}",0,Y,Y,N,N
我很羨慕那些和爸媽感情好的同學。,我 很 羨慕 那些 和 爸媽 感情 好 的 同學,10,我(3033032) 很(715675) 羨慕(4511) 那些(113704) 和(1338337) 爸媽(1495) 感情(27553) 好(448428) 的(16029838) 同學(30250),{'High': 10},"{'第1級': 4, '第5級': 1, 'Unknown': 4, '第4級': 1}",0,Y,N,N,N
那天，父親叫我做家事，我躺在沙發上，懶洋洋地說等會兒再去做，沒想到性急的他大發雷霆。,那 天 父親 叫 我 做 家事 我 躺 在 沙發 上 懶洋洋 地 說 等 會兒 再 去 做 沒想到 性急 的 他 大發雷霆,25,那(754138) 天(330413) 父親(86472) 叫(111645) 我(3033032) 做(411649) 家事(4101) 我(3033032) 躺(20016) 在(3284238) 沙發(6874) 上(1233218) 懶洋洋(841) 地(754998) 說(1285247) 等(327380) 會兒(975) 再(326207) 去(479993) 做(411649) 沒想到(13287) 性急(569) 的(16029838) 他(2487930) 大發雷霆(1036),{'High': 25},"{'第1級': 12, '第3級': 2, '第4級': 2, '第1*級': 2, '第7級': 2, 'Unknown': 3, '第3*級': 2}",3,Y,N,N,N
我難過得幾乎要掉下眼淚。,我 難過 得 幾乎 要 掉下 眼淚,7,我(3033032) 難過(11755) 得(573721) 幾乎(74298) 要(851264) 掉下(1046) 眼淚(10567),{'High': 7},"{'第1級': 2, '第2*級': 1, 'Unknown': 2, '第4級': 2}",0,Y,N,N,N
在我看來，早做晚做，只要完成就好，我真不明白大人心裡想什麼。,在 我 看來 早 做 晚 做 只要 完成 就 好 我 真 不 明白 大 人 心 裡 想 什麼,21,在(3284238) 我(3033032) 看來(23504) 早(62038) 做(411649) 晚(24931) 做(411649) 只要(99140) 完成(60471) 就(1737544) 好(448428) 我(3033032) 真(137497) 不(2282521) 明白(50011) 大(525780) 人(1550512) 心(180243) 裡(520435) 想(449884) 什麼(431321),{'High': 21},"{'第1*級': 4, '第1級': 11, '第4*級': 2, '第3級': 1, 'Unknown': 1, '第4級': 1, '第2級': 1}",0,Y,Y,N,N
我知道反抗是不可行的，但是往往想要和父母好好說時，他們卻欠缺耐心與孩子溝通。,我 知道 反抗 是 不 可行 的 但是 往往 想要 和 父母 好好 說 時 他們 卻 欠缺 耐心 與 孩子 溝通,22,我(3033032) 知道(343214) 反抗(8304) 是(4642407) 不(2282521) 可行(4844) 的(16029838) 但是(247988) 往往(41388) 想要(63278) 和(1338337) 父母(78215) 好好(30522) 說(1285247) 時(623734) 他們(716752) 卻(333007) 欠缺(4246) 耐心(8731) 與(968432) 孩子(242092) 溝通(31533),{'High': 22},"{'第1級': 8, '第5級': 1, '第6級': 2, '第2級': 1, '第4*級': 3, 'Unknown': 3, '第3級': 1, '第3*級': 1, '第4級': 2}",0,Y,Y,N,N
又比如，他們在看我的成績單時總是面無表情，不論我進步或退步。,又 比如 他們 在 看 我 的 成績單 時 總是 面 無 表情 不論 我 進步 或 退步,18,又(535555) 比如(13189) 他們(716752) 在(3284238) 看(444691) 我(3033032) 的(16029838) 成績單(1032) 時(623734) 總是(62757) 面(39563) 無(157858) 表情(25210) 不論(28127) 我(3033032) 進步(18064) 或(478077) 退步(820),{'High': 18},"{'第1*級': 2, '第4級': 4, '第1級': 4, 'Unknown': 2, '第3*級': 1, '第2級': 2, '第4*級': 1, '第5級': 1, '第3級': 1}",1,Y,Y,N,N
父母親只有責罵、只有滿足孩子的物質是不行的。,父母親 只 有 責罵 只 有 滿足 孩子 的 物質 是 不行 的,13,父母親(6626) 只(436725) 有(2217079) 責罵(1689) 只(436725) 有(2217079) 滿足(29073) 孩子(242092) 的(16029838) 物質(26384) 是(4642407) 不行(16352) 的(16029838),{'High': 13},"{'Unknown': 1, '第1*級': 2, '第1級': 6, '第6級': 1, '第4級': 2, '第5級': 1}",1,Y,N,N,N
而我要的也不只這些。,而 我 要 的 也 不只 這些,7,而(937923) 我(3033032) 要(851264) 的(16029838) 也(1590760) 不只(20841) 這些(315113),{'High': 7},"{'第5級': 1, '第1級': 4, 'Unknown': 2}",0,Y,Y,N,N
青少年往往因為一句痛觸到內心的話，在意許久，也常為父母一個小動作而耿耿於懷，加上平日與父母極少溝通，很容易造成叛逆的性格。,青少年 往往 因為 一 句 痛 觸到 內心 的 話 在意 許久 也 常 為 父母 一 個 小 動作 而 耿耿於懷 加上 平日 與 父母 極少 溝通 很 容易 造成 叛逆 的 性格,34,青少年(16159) 往往(41388) 因為(425061) 一(3701681) 句(87396) 痛(19678) 觸到(380) 內心(33857) 的(16029838) 話(148020) 在意(9564) 許久(3799) 也(1590760) 常(86207) 為(761341) 父母(78215) 一(3701681) 個(2296574) 小(318835) 動作(43506) 而(937923) 耿耿於懷(811) 加上(38121) 平日(6274) 與(968432) 父母(78215) 極少(2395) 溝通(31533) 很(715675) 容易(80831) 造成(63141) 叛逆(3082) 的(16029838) 性格(21490),{'High': 34},"{'第4級': 4, '第4*級': 5, '第1*級': 3, '第1級': 10, '第2級': 1, 'Unknown': 3, '第5級': 2, '第6級': 2, '第3級': 3, '第7級': 1}",2,Y,Y,N,N
當父母的能否試著說出內心的話，讓孩子能感受得到，我們也才願意袒裎以對。,當 父母 的 能否 試 著 說出 內心 的 話 讓 孩子 能 感受 得 到 我們 也 才 願意 袒裎以對,21,當(294625) 父母(78215) 的(16029838) 能否(7723) 試(40277) 著(1004687) 說出(19111) 內心(33857) 的(16029838) 話(148020) 讓(526314) 孩子(242092) 能(582260) 感受(30399) 得(573721) 到(546906) 我們(979260) 也(1590760) 才(394539) 願意(48894) 袒裎以對(Unknown),"{'High': 20, 'Low': 1}","{'Unknown': 5, '第3級': 1, '第1級': 7, '第2級': 4, '第4級': 1, '第4*級': 1, '第1*級': 1, '第5級': 1}",1,Y,N,N,N
爸媽，讓我們為化解代溝而彼此努力好嗎？,爸媽 讓 我們 為 化解 代溝 而 彼此 努力 好 嗎,11,爸媽(1495) 讓(526314) 我們(979260) 為(761341) 化解(4186) 代溝(330) 而(937923) 彼此(39449) 努力(62566) 好(448428) 嗎(248249),{'High': 11},"{'Unknown': 3, '第2級': 2, '第1級': 2, '第6級': 1, '第5級': 3}",0,Y,Y,N,N
國小英語教學使用「自然發音法」，引發社會重視，但學者昨日表示，英語首重唸法的學習，不宜走回死背音標的老路，自然發音法符合初學英語者使用。,國小 英語 教學 使用 自然 發音法 引發 社會 重視 但 學者 昨日 表示 英語 首重 唸法 的 學習 不宜 走回 死背 音標 的 老路 自然 發音法 符合 初學 英語 者 使用,31,國小(4760) 英語(7012) 教學(28989) 使用(99640) 自然(91995) 發音法(11) 引發(17487) 社會(176660) 重視(23501) 但(597124) 學者(28981) 昨日(2036) 表示(74452) 英語(7012) 首重(309) 唸法(40) 的(16029838) 學習(105345) 不宜(4289) 走回(3599) 死背(250) 音標(81) 的(16029838) 老路(308) 自然(91995) 發音法(11) 符合(19232) 初學(1207) 英語(7012) 者(423504) 使用(99640),"{'High': 27, 'Low': 4}","{'第3*級': 4, '第2*級': 3, '第4級': 4, 'Unknown': 10, '第5級': 3, '第2級': 2, '第4*級': 2, '第1級': 2, '第6級': 1}",2,Y,Y,N,N
學者與國中小英語老師都主張，以自然發音學習兩年英語後再開始教音標。,學者 與 國中小 英語 老師 都 主張 以 自然 發音 學習 兩 年 英語 後 再 開始 教 音標,19,學者(28981) 與(968432) 國中小(131) 英語(7012) 老師(88888) 都(1125846) 主張(23147) 以(547785) 自然(91995) 發音(3885) 學習(105345) 兩(526190) 年(514736) 英語(7012) 後(422857) 再(326207) 開始(245562) 教(42322) 音標(81),"{'High': 18, 'Low': 1}","{'第4*級': 2, 'Unknown': 3, '第2*級': 2, '第1級': 5, '第5級': 2, '第3*級': 1, '第4級': 1, '第2級': 2, '第1*級': 1}",1,Y,Y,N,N
教育部表示，課程綱要訂出小學英語以聽和說為主，以不宜先教音標為原則，目前許多小學以「自然發音法」、即看字發音為主要教學法。,教育部 表示 課程 綱要 訂出 小學 英語 以 聽 和 說 為主 以 不宜 先 教 音標 為 原則 目前 許多 小學 以 自然 發音法 即 看 字 發音 為 主要 教學法,32,教育部(3240) 表示(74452) 課程(30183) 綱要(744) 訂出(700) 小學(11635) 英語(7012) 以(547785) 聽(138052) 和(1338337) 說(1285247) 為主(12900) 以(547785) 不宜(4289) 先(136649) 教(42322) 音標(81) 為(761341) 原則(31148) 目前(48695) 許多(159791) 小學(11635) 以(547785) 自然(91995) 發音法(11) 即(110826) 看(444691) 字(75654) 發音(3885) 為(761341) 主要(78757) 教學法(791),"{'High': 30, 'Low': 2}","{'第5級': 4, '第4*級': 2, '第4級': 4, 'Unknown': 11, '第2*級': 3, '第1級': 3, '第6級': 2, '第1*級': 1, '第3*級': 2}",3,Y,Y,N,N
但近日因有民代指部分學童以注音符號學英語，質疑不教音標的負面影響。,但 近日 因 有 民代 指 部分 學童 以 注音 符號 學 英語 質疑 不 教 音標 的 負面 影響,20,但(597124) 近日(1497) 因(119364) 有(2217079) 民代(162) 指(84264) 部分(82518) 學童(2439) 以(547785) 注音(534) 符號(11491) 學(48982) 英語(7012) 質疑(9842) 不(2282521) 教(42322) 音標(81) 的(16029838) 負面(15336) 影響(95840),"{'High': 19, 'Low': 1}","{'第2級': 2, 'Unknown': 7, '第1級': 4, '第4級': 1, '第5級': 3, '第2*級': 1, '第6級': 1, '第3級': 1}",0,Y,Y,N,N
教育部為澄清外界疑慮，昨日舉辦自然發音法說明會。,教育部 為 澄清 外界 疑慮 昨日 舉辦 自然 發音法 說明會,10,教育部(3240) 為(761341) 澄清(2964) 外界(9618) 疑慮(3628) 昨日(2036) 舉辦(12070) 自然(91995) 發音法(11) 說明會(324),"{'High': 9, 'Low': 1}","{'第5級': 3, 'Unknown': 3, '第6級': 2, '第4級': 1, '第3*級': 1}",3,Y,N,N,N
台灣師範大學英語系教授施玉惠表示，自然發音法的正確名稱應是「字母拼讀法」(phonics)著重字母與發音的自然對應關係。,台灣 師範 大學 英語系 教授 施玉惠 表示 自然 發音法 的 正確 名稱 應 是 字母 拼讀法 phonics 著重 字母 與 發音 的 自然 對應 關係,25,台灣(130718) 師範(3542) 大學(83893) 英語系(171) 教授(39068) 施玉惠(5) 表示(74452) 自然(91995) 發音法(11) 的(16029838) 正確(36593) 名稱(11922) 應(82417) 是(4642407) 字母(7395) 拼讀法(2) phonics(Unknown) 著重(4094) 字母(7395) 與(968432) 發音(3885) 的(16029838) 自然(91995) 對應(5497) 關係(162883),"{'High': 21, 'Low': 4}","{'第1級': 5, '第6級': 3, 'Unknown': 6, '第3*級': 3, '第4*級': 3, '第4級': 2, '第5級': 2, '第3級': 1}",5,Y,Y,N,Y
英語屬拼音文字，八十%的英文字是看字就可發音，初學階段採自然發音，不但能讓學生輕鬆學習，發音自然而然融入日常教學，也避免過早學音標而發生與字母混淆的情形。,英語 屬 拼音 文字 八十 的 英文字 是 看 字 就 可 發音 初學 階段 採 自然 發音 不但 能 讓 學生 輕鬆 學習 發音 自然而然 融入 日常 教學 也 避免 過早 學 音標 而 發生 與 字母 混淆 的 情形,41,英語(7012) 屬(26012) 拼音(1177) 文字(31407) 八十(5124) 的(16029838) 英文字(372) 是(4642407) 看(444691) 字(75654) 就(1737544) 可(307359) 發音(3885) 初學(1207) 階段(35628) 採(8996) 自然(91995) 發音(3885) 不但(40359) 能(582260) 讓(526314) 學生(115846) 輕鬆(17407) 學習(105345) 發音(3885) 自然而然(3310) 融入(5650) 日常(20732) 教學(28989) 也(1590760) 避免(33211) 過早(837) 學(48982) 音標(81) 而(937923) 發生(129211) 與(968432) 字母(7395) 混淆(3581) 的(16029838) 情形(35199),"{'High': 40, 'Low': 1}","{'第2*級': 1, '第5級': 4, '第3*級': 3, '第4級': 5, 'Unknown': 6, '第1級': 8, '第4*級': 6, '第3級': 3, '第1*級': 1, '第2級': 2, '第6級': 2}",2,Y,Y,N,N
台灣師大英語系主任張武昌表示，音標是另一種文字系統，對初學英語學生而言，字母與字音對應關係最重要。,台灣 師大 英語 系主任 張武昌 表示 音標 是 另 一 種 文字 系統 對 初學 英語 學生 而言 字母 與 字音 對應 關係 最 重要,25,台灣(130718) 師大(1087) 英語(7012) 系主任(1209) 張武昌(Unknown) 表示(74452) 音標(81) 是(4642407) 另(138369) 一(3701681) 種(701563) 文字(31407) 系統(67366) 對(897964) 初學(1207) 英語(7012) 學生(115846) 而言(Unknown) 字母(7395) 與(968432) 字音(389) 對應(5497) 關係(162883) 最(421680) 重要(154863),"{'High': 22, 'Low': 3}","{'第1級': 5, 'Unknown': 8, '第2*級': 2, '第4*級': 2, '第3級': 2, '第4級': 1, '第5級': 2, '第6級': 1, '第1*級': 1, '第2級': 1}",2,Y,Y,N,Y
傳統的音標教學應在學生對字母符號、語音和拼讀規則已熟悉時再進行。,傳統 的 音標 教學 應 在 學生 對 字母 符號 語音 和 拼讀 規則 已 熟悉 時 再 進行,19,傳統(60517) 的(16029838) 音標(81) 教學(28989) 應(82417) 在(3284238) 學生(115846) 對(897964) 字母(7395) 符號(11491) 語音(3301) 和(1338337) 拼讀(40) 規則(18168) 已(215610) 熟悉(20265) 時(623734) 再(326207) 進行(100298),"{'High': 17, 'Low': 2}","{'第3級': 2, '第1級': 3, 'Unknown': 4, '第4級': 2, '第1*級': 2, '第5級': 3, '第6級': 1, '第4*級': 1, '第3*級': 1}",0,Y,Y,N,N
