sentence,sentence_preprocessed,sentence_length,word_freq,high_low_freq,word_level,long_word_count,is_complete_sentence,is_complete_context,is_blacklist,is_greylist
這次書展並沒有設定主題，書展期間不進行現場交易，但民眾可到服務台預約，運費郵資須自行負擔；兩岸業者除了可藉此機會洽談版權，也可參與兩岸圖書出版合作研討會，以解決目前採購大陸書籍不便的問題。,這 次 書展 並 沒有 設定 主題 書展 期間 不 進行 現場 交易 但 民眾 可 到 服務台 預約 運費 郵資 須 自行 負擔 兩岸 業者 除了 可 藉 此 機會 洽談 版權 也 可 參與 兩岸 圖書 出版 合作 研討會 以 解決 目前 採購 大陸 書籍 不便 的 問題,50,這(2114032) 次(331701) 書展(907) 並(442790) 沒有(594280) 設定(10564) 主題(28398) 書展(907) 期間(32981) 不(2282521) 進行(100298) 現場(15949) 交易(16930) 但(597124) 民眾(17097) 可(307359) 到(546906) 服務台(168) 預約(1251) 運費(478) 郵資(124) 須(17260) 自行(9833) 負擔(10490) 兩岸(6984) 業者(6857) 除了(75964) 可(307359) 藉(14277) 此(288458) 機會(81244) 洽談(588) 版權(2750) 也(1590760) 可(307359) 參與(40595) 兩岸(6984) 圖書(5455) 出版(37283) 合作(35908) 研討會(5588) 以(547785) 解決(55725) 目前(48695) 採購(3679) 大陸(27031) 書籍(13528) 不便(4361) 的(16029838) 問題(280782),{'High': 50},"{'第1級': 7, '第2級': 3, 'Unknown': 10, '第4*級': 9, '第5級': 12, '第4級': 3, '第3級': 1, '第3*級': 3, '第6級': 2}",2,Y,Y,N,N
主辦單位在將在二十八日下午三點記者會後舉行預展，供出版業者、媒體參觀；於二十九日上午剪綵後，才開放給一般大眾參觀。,主辦 單位 在 將 在 二十八日 下午 三點 記者會 後 舉行 預展 供 出版 業者 媒體 參觀 於 二十九日 上午 剪綵 後 才 開放給 一般 大眾 參觀,27,主辦(2897) 單位(23148) 在(3284238) 將(448374) 在(3284238) 二十八日(2675) 下午(20045) 三點(1500) 記者會(1649) 後(422857) 舉行(17660) 預展(21) 供(17109) 出版(37283) 業者(6857) 媒體(32308) 參觀(9034) 於(327210) 二十九日(2357) 上午(6241) 剪綵(167) 後(422857) 才(394539) 開放給(389) 一般(80732) 大眾(22411) 參觀(9034),"{'High': 26, 'Low': 1}","{'第5級': 5, '第1*級': 2, 'Unknown': 9, '第1級': 4, '第4級': 2, '第4*級': 1, '第3*級': 3, '第2級': 1}",4,Y,N,N,N
書展沒有年齡限制，入場不需門票，開放時間自上午九點至下午五點，在央圖地下一樓大廳舉行。,書展 沒有 年齡 限制 入場 不 需 門票 開放 時間 自 上午 九點 至 下午 五點 在 央圖 地 下 一樓 大廳 舉行,23,書展(907) 沒有(594280) 年齡(17758) 限制(23094) 入場(626) 不(2282521) 需(27999) 門票(1074) 開放(17546) 時間(213595) 自(59676) 上午(6241) 九點(2467) 至(101530) 下午(20045) 五點(1957) 在(3284238) 央圖(Unknown) 地(754998) 下(329549) 一樓(2155) 大廳(7007) 舉行(17660),"{'High': 22, 'Low': 1}","{'Unknown': 7, '第1級': 5, '第4級': 4, '第4*級': 1, '第2級': 1, '第2*級': 1, '第5級': 2, '第1*級': 2}",0,Y,N,N,N
青年學子眼中的外在環境呈現何種面貌？,青年 學子 眼 中 的 外在 環境 呈現 何 種 面貌,11,青年(18436) 學子(1193) 眼(71964) 中(1011729) 的(16029838) 外在(11982) 環境(71054) 呈現(26810) 何(46992) 種(701563) 面貌(5835),{'High': 11},"{'第4*級': 1, '第6級': 2, '第3*級': 1, 'Unknown': 3, '第1級': 1, '第5級': 2, '第3級': 1}",0,Y,N,N,N
第四屆全國學生創意攝影觀摩展的入圍者以影像表達了他們對「窗」、「家」、「水」和「都市」的看法。,第四 屆 全 國 學生 創意 攝影 觀摩展 的 入圍 者 以 影像 表達 了 他們 對 窗 家 水 和 都市 的 看法,24,第四(21065) 屆(10220) 全(178642) 國(73377) 學生(115846) 創意(20243) 攝影(12899) 觀摩展(23) 的(16029838) 入圍(647) 者(423504) 以(547785) 影像(22328) 表達(34582) 了(3199291) 他們(716752) 對(897964) 窗(19038) 家(236822) 水(86260) 和(1338337) 都市(9548) 的(16029838) 看法(30115),"{'High': 23, 'Low': 1}","{'Unknown': 5, '第5級': 3, '第2級': 1, '第1級': 8, '第4*級': 3, '第6級': 1, '第2*級': 1, '第4級': 1, '第3*級': 1}",1,Y,Y,N,N
中華民國攝影教育協會的劉明珠指出，學生的攝影技巧並不是觀摩展要強調的，重要的是作品要有創意，因此手法不拘，商業或報導的角度均可。,中華民國 攝影 教育 協會 的 劉明珠 指出 學生 的 攝影 技巧 並 不 是 觀摩展 要 強調 的 重要 的 是 作品 要 有 創意 因此 手法 不拘 商業 或 報導 的 角度 均 可,35,中華民國(5430) 攝影(12899) 教育(71554) 協會(13492) 的(16029838) 劉明珠(1) 指出(38456) 學生(115846) 的(16029838) 攝影(12899) 技巧(27277) 並(442790) 不(2282521) 是(4642407) 觀摩展(23) 要(851264) 強調(36095) 的(16029838) 重要(154863) 的(16029838) 是(4642407) 作品(79492) 要(851264) 有(2217079) 創意(20243) 因此(184606) 手法(13257) 不拘(1035) 商業(19292) 或(478077) 報導(27311) 的(16029838) 角度(26690) 均(27783) 可(307359),"{'High': 33, 'Low': 2}","{'第5級': 7, '第3級': 2, '第1級': 12, 'Unknown': 5, '第4*級': 5, '第2級': 1, '第6級': 2, '第7級': 1}",3,Y,Y,N,Y
參展者的取材角度不全由主題的原始構成材質切入，也有批判性的作品出現。,參展 者 的 取材 角度 不 全 由 主題 的 原始 構成 材質 切入 也 有 批判性 的 作品 出現,20,參展(779) 者(423504) 的(16029838) 取材(3507) 角度(26690) 不(2282521) 全(178642) 由(208604) 主題(28398) 的(16029838) 原始(11993) 構成(16185) 材質(2299) 切入(2158) 也(1590760) 有(2217079) 批判性(1374) 的(16029838) 作品(79492) 出現(124694),{'High': 20},"{'Unknown': 6, '第1級': 6, '第5級': 4, '第2級': 1, '第4*級': 1, '第4級': 2}",1,Y,N,N,N
評審之一的游本寬認為，今年的作品內容集中，但並無深刻意涵，反流於表像的呈現，可能因為題目較抽象，限制了學生的想像空間。,評審 之 一 的 游本寬 認為 今年 的 作品 內容 集中 但 並 無 深刻 意涵 反 流於 表像 的 呈現 可能 因為 題目 較 抽象 限制 了 學生 的 想像 空間,32,評審(1904) 之(875481) 一(3701681) 的(16029838) 游本寬(20) 認為(192030) 今年(10836) 的(16029838) 作品(79492) 內容(55074) 集中(18277) 但(597124) 並(442790) 無(157858) 深刻(16783) 意涵(4487) 反(44292) 流於(1495) 表像(37) 的(16029838) 呈現(26810) 可能(271025) 因為(425061) 題目(8510) 較(78424) 抽象(9662) 限制(23094) 了(3199291) 學生(115846) 的(16029838) 想像(45673) 空間(52519),"{'High': 30, 'Low': 2}","{'第5級': 4, '第1級': 8, 'Unknown': 4, '第2級': 3, '第4級': 3, '第4*級': 5, '第6級': 2, '第7級': 1, '第1*級': 1, '第3*級': 1}",1,Y,Y,N,Y
吳嘉寶也認為雖有三兩位突出的學生，整體的表現卻不理想，素質有待加強，反而老師進步的較多。,吳嘉寶 也 認為 雖 有 三 兩 位 突出 的 學生 整體 的 表現 卻 不 理想 素質 有待 加強 反而 老師 進步 的 較多,25,吳嘉寶(Unknown) 也(1590760) 認為(192030) 雖(48164) 有(2217079) 三(313861) 兩(526190) 位(284809) 突出(7198) 的(16029838) 學生(115846) 整體(19788) 的(16029838) 表現(67272) 卻(333007) 不(2282521) 理想(27021) 素質(3102) 有待(2538) 加強(13098) 反而(39627) 老師(88888) 進步(18064) 的(16029838) 較多(4872),"{'Low': 1, 'High': 24}","{'Unknown': 3, '第1級': 11, '第2級': 3, '第5級': 2, '第4*級': 3, '第4級': 2, '第6級': 1}",1,Y,Y,N,Y
他指出，學生是從零開始，師資素質提昇後才能帶動學生的水準，但是目前的教育結構不盡完善，國內尚無專門的攝影科系以培養人才，先天不良當然後天失調。,他 指出 學生 是 從 零 開始 師資 素質 提昇 後 才 能 帶動 學生 的 水準 但是 目前 的 教育 結構 不盡 完善 國內 尚 無 專門 的 攝影 科系 以 培養 人才 先天 不良 當然 後天 失調,39,他(2487930) 指出(38456) 學生(115846) 是(4642407) 從(496546) 零(5847) 開始(245562) 師資(1273) 素質(3102) 提昇(3304) 後(422857) 才(394539) 能(582260) 帶動(3810) 學生(115846) 的(16029838) 水準(9940) 但是(247988) 目前(48695) 的(16029838) 教育(71554) 結構(43294) 不盡(3716) 完善(3609) 國內(17537) 尚(26113) 無(157858) 專門(13209) 的(16029838) 攝影(12899) 科系(1361) 以(547785) 培養(17148) 人才(17220) 先天(3311) 不良(10094) 當然(113971) 後天(3279) 失調(2743),{'High': 39},"{'第1級': 8, 'Unknown': 3, '第1*級': 3, '第2*級': 1, '第2級': 4, '第7級': 1, '第6級': 6, '第4級': 4, '第3級': 1, '第5級': 6, '第4*級': 2}",0,Y,Y,N,N
另一位評審胡詔凱則持不同意見，認為學生的創意都不錯。,另 一 位 評審 胡詔凱 則 持 不同 意見 認為 學生 的 創意 都 不錯,15,另(138369) 一(3701681) 位(284809) 評審(1904) 胡詔凱(Unknown) 則(254096) 持(11680) 不同(159432) 意見(34740) 認為(192030) 學生(115846) 的(16029838) 創意(20243) 都(1125846) 不錯(23297),"{'High': 14, 'Low': 1}","{'第3級': 2, '第1級': 5, '第5級': 3, 'Unknown': 1, '第3*級': 1, '第2級': 1, '第4*級': 1, '第1*級': 1}",1,Y,N,N,Y
他說，老師累積的視覺經驗較多，不宜對學生太過苛求，參加者經過推薦，有一定水準，觀摩展本就有獎勵性質，對初學者是項鼓勵。,他 說 老師 累積 的 視覺 經驗 較多 不宜 對 學生 太過 苛求 參加 者 經過 推薦 有 一定 水準 觀摩展 本 就 有 獎勵 性質 對 初學者 是 項 鼓勵,31,他(2487930) 說(1285247) 老師(88888) 累積(13742) 的(16029838) 視覺(16700) 經驗(86997) 較多(4872) 不宜(4289) 對(897964) 學生(115846) 太過(8649) 苛求(743) 參加(42962) 者(423504) 經過(64617) 推薦(11283) 有(2217079) 一定(138695) 水準(9940) 觀摩展(23) 本(197156) 就(1737544) 有(2217079) 獎勵(5345) 性質(11550) 對(897964) 初學者(Unknown) 是(4642407) 項(88887) 鼓勵(27004),"{'High': 29, 'Low': 2}","{'第1級': 12, '第5級': 5, '第2級': 3, 'Unknown': 5, '第6級': 1, '第7級': 1, '第4級': 3, '第1*級': 1}",2,Y,N,N,N
但是學生也該加強美術方面的課程，好好的琢磨一下。,但是 學生 也 該 加強 美術 方面 的 課程 好好 的 琢磨 一下,13,但是(247988) 學生(115846) 也(1590760) 該(148369) 加強(13098) 美術(4253) 方面(75079) 的(16029838) 課程(30183) 好好(30522) 的(16029838) 琢磨(1818) 一下(81077),{'High': 13},"{'第2級': 2, '第1級': 4, '第4*級': 2, '第6級': 2, '第3*級': 1, '第4級': 1, 'Unknown': 1}",0,Y,Y,N,N
相對於去年的主題「自拍照」、「我的攝影老師」及「造型」，今年的參展作品數略減，只有一百五十多件。,相對於 去年 的 主題 自拍照 我 的 攝影 老師 及 造型 今年 的 參展 作品 數 略 減 只 有 一百五十多 件,22,相對於(2410) 去年(9462) 的(16029838) 主題(28398) 自拍照(Unknown) 我(3033032) 的(16029838) 攝影(12899) 老師(88888) 及(304586) 造型(6053) 今年(10836) 的(16029838) 參展(779) 作品(79492) 數(38654) 略(12059) 減(5855) 只(436725) 有(2217079) 一百五十多(148) 件(139257),"{'High': 21, 'Low': 1}","{'Unknown': 5, '第1級': 8, '第4級': 1, '第5級': 3, '第3*級': 2, '第6級': 1, '第1*級': 2}",3,Y,Y,N,N
至於何種主題最受學子青睞？,至於 何 種 主題 最 受 學子 青睞,8,至於(39363) 何(46992) 種(701563) 主題(28398) 最(421680) 受(109982) 學子(1193) 青睞(1855),{'High': 8},"{'第5級': 1, 'Unknown': 2, '第4級': 2, '第1*級': 1, '第6級': 2}",0,Y,N,N,N
今年的作品中以拍攝都市印象最多，拿「家」作攝獵對象的反成少數。,今年 的 作品 中 以 拍攝 都市 印象 最多 拿 家 作 攝獵 對象 的 反 成 少數,18,今年(10836) 的(16029838) 作品(79492) 中(1011729) 以(547785) 拍攝(15537) 都市(9548) 印象(24581) 最多(11485) 拿(69263) 家(236822) 作(78184) 攝獵(2) 對象(28123) 的(16029838) 反(44292) 成(76470) 少數(17629),"{'High': 17, 'Low': 1}","{'第1級': 5, 'Unknown': 5, '第5級': 2, '第4級': 3, '第4*級': 3}",0,Y,N,N,N
不管焦點為何，個人對影像的感覺殊異，作品風格就各有不同。,不管 焦點 為 何 個人 對 影像 的 感覺 殊異 作品 風格 就 各 有 不同,16,不管(41857) 焦點(10000) 為(761341) 何(46992) 個人(76253) 對(897964) 影像(22328) 的(16029838) 感覺(91265) 殊異(189) 作品(79492) 風格(24707) 就(1737544) 各(243023) 有(2217079) 不同(159432),{'High': 16},"{'第3*級': 2, '第5級': 1, 'Unknown': 4, '第4級': 1, '第1級': 4, '第4*級': 1, '第6級': 1, '第2級': 1, '第3級': 1}",0,Y,Y,N,N
入選作品共有六十幅，將於十九日至二十七日在爵士攝影藝廊展出。,入選 作品 共 有 六十 幅 將 於 十九日 至 二十七日 在 爵士 攝影 藝廊 展出,16,入選(888) 作品(79492) 共(32138) 有(2217079) 六十(8771) 幅(22056) 將(448374) 於(327210) 十九日(2863) 至(101530) 二十七日(2612) 在(3284238) 爵士(9225) 攝影(12899) 藝廊(943) 展出(3360),{'High': 16},"{'Unknown': 7, '第1*級': 2, '第1級': 1, '第4*級': 1, '第5級': 4, '第6級': 1}",2,Y,Y,N,N
「自然不是藝術，藝術是自然經過轉化後的極品。」,自然 不 是 藝術 藝術 是 自然 經過 轉化 後 的 極品,12,自然(91995) 不(2282521) 是(4642407) 藝術(80645) 藝術(80645) 是(4642407) 自然(91995) 經過(64617) 轉化(4766) 後(422857) 的(16029838) 極品(460),{'High': 12},"{'第3*級': 2, '第1級': 5, '第4級': 2, '第2級': 1, '第6級': 1, 'Unknown': 1}",0,Y,N,N,N
首度來台舉辦個展的巴西知名華裔畫家方向光說。,首度 來 台 舉辦 個展 的 巴西 知名 華裔 畫家 方向光 說,12,首度(2350) 來(742183) 台(29325) 舉辦(12070) 個展(363) 的(16029838) 巴西(2247) 知名(9697) 華裔(1195) 畫家(16634) 方向光(1) 說(1285247),"{'High': 11, 'Low': 1}","{'Unknown': 3, '第1級': 3, '第2級': 1, '第4級': 1, '第5級': 3, '第3*級': 1}",1,Y,N,N,Y
方向光是旗幟鮮明的表現主義支持者。,方向光 是 旗幟 鮮明 的 表現 主義 支持 者,9,方向光(1) 是(4642407) 旗幟(2905) 鮮明(4781) 的(16029838) 表現(67272) 主義(82852) 支持(42489) 者(423504),"{'Low': 1, 'High': 8}","{'Unknown': 2, '第1級': 2, '第6級': 1, '第5級': 2, '第4級': 2}",1,Y,N,N,Y
他認為太過於寫實、自然與華麗的繪畫表現方式，與照片無異，沒有太大的藝術價值。,他 認為 太過於 寫實 自然 與 華麗 的 繪畫 表現 方式 與 照片 無異 沒有 太 大 的 藝術 價值,20,他(2487930) 認為(192030) 太過於(6) 寫實(7527) 自然(91995) 與(968432) 華麗(4798) 的(16029838) 繪畫(14035) 表現(67272) 方式(133407) 與(968432) 照片(25355) 無異(2298) 沒有(594280) 太(181732) 大(525780) 的(16029838) 藝術(80645) 價值(58784),"{'High': 19, 'Low': 1}","{'第1級': 6, '第2級': 2, 'Unknown': 2, '第6級': 2, '第3*級': 1, '第4*級': 4, '第5級': 1, '第4級': 2}",1,Y,Y,N,N
因此，他治東方哲學精神與西方的表現主義、野獸派和印象派等較抽象的畫風於一爐，使作品散發出更深沉的內涵與光芒，也表現出一種羈霸難馴的性格。,因此 他 治 東方 哲學 精神 與 西方 的 表現 主義 野獸派 和 印象派 等 較 抽象 的 畫風 於 一 爐 使 作品 散發出 更 深沉 的 內涵 與 光芒 也 表現出 一 種 羈霸 難馴 的 性格,39,因此(184606) 他(2487930) 治(15440) 東方(14337) 哲學(19789) 精神(79222) 與(968432) 西方(28701) 的(16029838) 表現(67272) 主義(82852) 野獸派(947) 和(1338337) 印象派(1842) 等(327380) 較(78424) 抽象(9662) 的(16029838) 畫風(629) 於(327210) 一(3701681) 爐(3060) 使(197544) 作品(79492) 散發出(2196) 更(361676) 深沉(2517) 的(16029838) 內涵(6559) 與(968432) 光芒(6405) 也(1590760) 表現出(9953) 一(3701681) 種(701563) 羈霸(Unknown) 難馴(44) 的(16029838) 性格(21490),"{'High': 37, 'Low': 2}","{'第4*級': 5, '第1級': 8, 'Unknown': 13, '第3*級': 3, '第4級': 1, '第5級': 5, '第2級': 1, '第6級': 3}",4,Y,Y,N,N
方向光同時開創新的作畫手法。,方向光 同時 開創 新 的 作畫 手法,7,方向光(1) 同時(115305) 開創(4587) 新(212453) 的(16029838) 作畫(2476) 手法(13257),"{'Low': 1, 'High': 6}","{'Unknown': 1, '第3*級': 1, '第5級': 1, '第1級': 2, '第6級': 2}",1,Y,N,N,Y
他擅於運用「錯覺原理」，將畫面中應等高或垂直的視平線或輪廓線，利用景物和靜物的突出部分，間隔成高低錯落且有助於變化的線條。,他 擅於 運用 錯覺 原理 將 畫面 中 應 等高 或 垂直 的 視平線 或 輪廓線 利用 景物 和 靜物 的 突出 部分 間隔成 高低 錯落 且 有助於 變化 的 線條,31,他(2487930) 擅於(976) 運用(35916) 錯覺(2506) 原理(6939) 將(448374) 畫面(17554) 中(1011729) 應(82417) 等高(14) 或(478077) 垂直(3887) 的(16029838) 視平線(9) 或(478077) 輪廓線(134) 利用(49229) 景物(1930) 和(1338337) 靜物(504) 的(16029838) 突出(7198) 部分(82518) 間隔成(3) 高低(4010) 錯落(455) 且(67015) 有助於(9351) 變化(42502) 的(16029838) 線條(5715),"{'High': 28, 'Low': 3}","{'第1級': 4, '第7級': 1, '第5級': 4, '第6級': 4, '第4*級': 1, 'Unknown': 11, '第3級': 3, '第3*級': 1, '第2級': 1, '第4級': 1}",4,Y,Y,N,N
如此一來，他改變並且豐富了我們習慣性的視覺世界，使我們的視野不拘限於「自然」中的一切「正常」的東西。,如此一來 他 改變 並且 豐富 了 我們 習慣性 的 視覺 世界 使 我們 的 視野 不 拘限 於 自然 中 的 一切 正常 的 東西,25,如此一來(6554) 他(2487930) 改變(92018) 並且(60996) 豐富(24271) 了(3199291) 我們(979260) 習慣性(1529) 的(16029838) 視覺(16700) 世界(165235) 使(197544) 我們(979260) 的(16029838) 視野(7815) 不(2282521) 拘限(155) 於(327210) 自然(91995) 中(1011729) 的(16029838) 一切(95523) 正常(28865) 的(16029838) 東西(139472),{'High': 25},"{'Unknown': 5, '第1級': 9, '第4級': 3, '第5級': 4, '第2級': 1, '第3*級': 3}",2,Y,Y,N,N
在《醜女出浴》一畫中，方向光刻意與傳統古典主義之唯美主張背道而馳，而採用野獸派筆法，創造了一個很醜很醜的女人。,在 醜女 出浴 一 畫 中 方向光 刻意 與 傳統 古典 主義 之 唯美 主張 背道而馳 而 採用 野獸派 筆法 創造 了 一 個 很 醜 很 醜 的 女人,30,在(3284238) 醜女(206) 出浴(73) 一(3701681) 畫(57787) 中(1011729) 方向光(1) 刻意(11267) 與(968432) 傳統(60517) 古典(9876) 主義(82852) 之(875481) 唯美(266) 主張(23147) 背道而馳(906) 而(937923) 採用(20582) 野獸派(947) 筆法(977) 創造(38327) 了(3199291) 一(3701681) 個(2296574) 很(715675) 醜(4315) 很(715675) 醜(4315) 的(16029838) 女人(71948),"{'High': 28, 'Low': 2}","{'第1*級': 2, 'Unknown': 8, '第1級': 6, '第6級': 1, '第4*級': 3, '第3級': 1, '第5級': 5, '第7級': 2, '第4級': 2}",3,Y,Y,N,Y
方向光說：「我想藉此打破藝術自然與美的神話。」,方向光 說 我 想 藉 此 打破 藝術 自然 與 美 的 神話,13,方向光(1) 說(1285247) 我(3033032) 想(449884) 藉(14277) 此(288458) 打破(10218) 藝術(80645) 自然(91995) 與(968432) 美(53380) 的(16029838) 神話(11011),"{'Low': 1, 'High': 12}","{'Unknown': 1, '第1級': 4, '第6級': 1, '第5級': 3, '第4級': 1, '第3*級': 1, '第4*級': 1, '第1*級': 1}",1,Y,Y,N,Y
而在《裸女》中，坐在一面大鏡子前女人的倒影，竟與鏡外原形完全相同，嚴重違反了自然的邏輯和世人的慣性思維，卻也營造了唯有藝術中才能恣意展現的新奇景觀。,而 在 裸女 中 坐 在 一 面 大 鏡子 前 女人 的 倒影 竟 與 鏡 外 原形 完全 相同 嚴重 違反 了 自然 的 邏輯 和 世人 的 慣性 思維 卻 也 營造 了 唯有 藝術 中 才 能 恣意 展現 的 新奇 景觀,46,而(937923) 在(3284238) 裸女(663) 中(1011729) 坐(93873) 在(3284238) 一(3701681) 面(39563) 大(525780) 鏡子(8307) 前(272709) 女人(71948) 的(16029838) 倒影(762) 竟(35425) 與(968432) 鏡(5895) 外(109310) 原形(938) 完全(115744) 相同(33311) 嚴重(39284) 違反(6717) 了(3199291) 自然(91995) 的(16029838) 邏輯(16179) 和(1338337) 世人(7330) 的(16029838) 慣性(1689) 思維(14435) 卻(333007) 也(1590760) 營造(5354) 了(3199291) 唯有(10986) 藝術(80645) 中(1011729) 才(394539) 能(582260) 恣意(1141) 展現(15289) 的(16029838) 新奇(2774) 景觀(4987),{'High': 46},"{'第5級': 3, '第1*級': 3, 'Unknown': 7, '第1級': 10, '第4*級': 3, '第4級': 5, '第7級': 4, '第3*級': 3, '第6級': 7, '第2級': 1}",0,Y,Y,N,N
方向光筆下之靜物，色彩看似平面，卻又有幾分立體，平面而立體，是矛盾衝突的。,方向光 筆 下 之 靜物 色彩 看似 平面 卻 又 有 幾 分 立體 平面 而 立體 是 矛盾 衝突 的,21,方向光(1) 筆(32010) 下(329549) 之(875481) 靜物(504) 色彩(16026) 看似(8698) 平面(4449) 卻(333007) 又(535555) 有(2217079) 幾(229415) 分(62224) 立體(3178) 平面(4449) 而(937923) 立體(3178) 是(4642407) 矛盾(16542) 衝突(27003) 的(16029838),"{'Low': 1, 'High': 20}","{'Unknown': 3, '第1*級': 3, '第5級': 3, '第4*級': 2, '第6級': 4, '第4級': 1, '第1級': 5}",1,Y,Y,N,Y
方向光卻認為「繪畫藝術就是要有矛盾衝突點，才有意義。,方向光 卻 認為 繪畫 藝術 就 是 要 有 矛盾 衝突點 才 有 意義,14,方向光(1) 卻(333007) 認為(192030) 繪畫(14035) 藝術(80645) 就(1737544) 是(4642407) 要(851264) 有(2217079) 矛盾(16542) 衝突點(10) 才(394539) 有(2217079) 意義(71714),"{'Low': 2, 'High': 12}","{'Unknown': 2, '第4級': 2, '第2級': 2, '第5級': 3, '第1級': 5}",2,Y,N,N,Y
這種觀念就如同道家所主張的『空中有，有中無』。,這 種 觀念 就 如同 道家 所 主張 的 空 中 有 有 中 無,15,這(2114032) 種(701563) 觀念(39915) 就(1737544) 如同(24070) 道家(2083) 所(527327) 主張(23147) 的(16029838) 空(15972) 中(1011729) 有(2217079) 有(2217079) 中(1011729) 無(157858),{'High': 15},"{'第1級': 5, 'Unknown': 4, '第4級': 1, '第5級': 3, '第6級': 1, '第2級': 1}",0,Y,N,N,N
而在矛盾衝突中，也嚐試去尋找一種平衡。」,而 在 矛盾 衝突 中 也 嚐試 去 尋找 一 種 平衡,12,而(937923) 在(3284238) 矛盾(16542) 衝突(27003) 中(1011729) 也(1590760) 嚐試(184) 去(479993) 尋找(28381) 一(3701681) 種(701563) 平衡(18456),{'High': 12},"{'第5級': 4, '第1*級': 1, '第4*級': 1, 'Unknown': 3, '第1級': 3}",0,Y,Y,N,N
雖然矛盾卻又要求平衡，看來，方向光並未徹底與講究均衡的古典自然美藝術反其道而行。,雖然 矛盾 卻 又 要求 平衡 看來 方向光 並 未 徹底 與 講究 均衡 的 古典 自然美 藝術 反其道而行,19,雖然(152988) 矛盾(16542) 卻(333007) 又(535555) 要求(71192) 平衡(18456) 看來(23504) 方向光(1) 並(442790) 未(101927) 徹底(17782) 與(968432) 講究(5187) 均衡(3808) 的(16029838) 古典(9876) 自然美(75) 藝術(80645) 反其道而行(146),"{'High': 17, 'Low': 2}","{'第2級': 1, '第5級': 6, '第4級': 2, '第1*級': 1, '第3*級': 1, '第4*級': 3, 'Unknown': 3, '第6級': 1, '第1級': 1}",3,Y,Y,N,Y
「繪畫藝術要自然不做作，常保一顆赤子之心。」,繪畫 藝術 要 自然 不 做作 常 保 一 顆 赤子之心,11,繪畫(14035) 藝術(80645) 要(851264) 自然(91995) 不(2282521) 做作(984) 常(86207) 保(5376) 一(3701681) 顆(32006) 赤子之心(501),{'High': 11},"{'第5級': 1, '第4級': 1, '第1級': 3, '第3*級': 1, '第7級': 1, '第1*級': 1, 'Unknown': 2, '第3級': 1}",1,Y,N,N,N
方向光說。,方向光 說,2,方向光(1) 說(1285247),"{'Low': 1, 'High': 1}","{'Unknown': 1, '第1級': 1}",1,Y,N,N,Y
也因此，看他的作品，彷如觀賞三歲小孩塗鴉般的天真無邪，教人如浴春風，而在童稚的率性中，也隱隱透露出幾分屬於成年人的老練和世故，以及深刻的意涵。,也 因此 看 他 的 作品 彷如 觀賞 三 歲 小孩 塗鴉 般 的 天真 無邪 教 人 如 浴 春風 而 在 童稚 的 率性 中 也 隱隱 透露出 幾 分 屬於 成年人 的 老練 和 世故 以及 深刻 的 意涵,42,也(1590760) 因此(184606) 看(444691) 他(2487930) 的(16029838) 作品(79492) 彷如(398) 觀賞(5617) 三(313861) 歲(130085) 小孩(47282) 塗鴉(1159) 般(44639) 的(16029838) 天真(6040) 無邪(1121) 教(42322) 人(1550512) 如(195069) 浴(1076) 春風(1714) 而(937923) 在(3284238) 童稚(409) 的(16029838) 率性(429) 中(1011729) 也(1590760) 隱隱(1963) 透露出(1801) 幾(229415) 分(62224) 屬於(39478) 成年人(2830) 的(16029838) 老練(749) 和(1338337) 世故(1571) 以及(155624) 深刻(16783) 的(16029838) 意涵(4487),{'High': 42},"{'第1級': 14, '第4*級': 2, 'Unknown': 13, '第5級': 5, '第7級': 4, '第6級': 3, '第1*級': 1}",2,Y,Y,N,N
