sentence,sentence_preprocessed,sentence_length,word_freq,high_low_freq,word_level,long_word_count,is_complete_sentence,is_complete_context,is_blacklist,is_greylist
一時之間，只見紅蕃拉著牛仔、小天使帶著羅馬武士，連社會局替代役男也下海扮成瑪麗蓮夢露，她的舞伴「虎克船長」還引起另一位武士的興趣，硬擠過來換舞伴。,一時之間 只 見 紅蕃 拉 著 牛仔 小 天使 帶 著 羅馬 武士 連 社會局 替代 役男 也 下海 扮成 瑪麗蓮夢露 她 的 舞伴 虎克 船長 還 引起 另 一 位 武士 的 興趣 硬 擠過來 換 舞伴,38,一時之間(1920) 只(436725) 見(179113) 紅蕃(Unknown) 拉(27164) 著(1004687) 牛仔(964) 小(318835) 天使(7140) 帶(105786) 著(1004687) 羅馬(15850) 武士(12049) 連(91153) 社會局(184) 替代(5342) 役男(86) 也(1590760) 下海(881) 扮成(581) 瑪麗蓮夢露(52) 她(1052913) 的(16029838) 舞伴(361) 虎克(126) 船長(3448) 還(625086) 引起(36729) 另(138369) 一(3701681) 位(284809) 武士(12049) 的(16029838) 興趣(34215) 硬(15984) 擠過來(82) 換(25907) 舞伴(361),"{'High': 34, 'Low': 4}","{'Unknown': 16, '第1*級': 2, '第2級': 1, '第1級': 8, '第5級': 2, '第7級': 3, '第3*級': 1, '第4*級': 1, '第3級': 3, '第4級': 1}",4,Y,Y,N,Y
扮成「虹彩妹妹」、七十四歲的許林金巒說，她跳土風舞已經十一年，是大同老人中心的社團學員；今年八十歲同一社團的鄭曾阿色說，她最擅長的是日本舞，昨日則以韓國風裝扮跳一段阿里郎。,扮成 虹彩 妹妹 七十四 歲 的 許林金巒 說 她 跳 土風舞 已經 十一 年 是 大同 老人 中心 的 社團 學員 今年 八十 歲 同 一 社團 的 鄭曾阿色 說 她 最 擅長 的 是 日本舞 昨日 則 以 韓國風 裝扮 跳 一 段 阿里郎,45,扮成(581) 虹彩(94) 妹妹(15695) 七十四(417) 歲(130085) 的(16029838) 許林金巒(Unknown) 說(1285247) 她(1052913) 跳(21391) 土風舞(118) 已經(245160) 十一(9141) 年(514736) 是(4642407) 大同(2367) 老人(23906) 中心(46076) 的(16029838) 社團(3615) 學員(4618) 今年(10836) 八十(5124) 歲(130085) 同(102917) 一(3701681) 社團(3615) 的(16029838) 鄭曾阿色(Unknown) 說(1285247) 她(1052913) 最(421680) 擅長(7376) 的(16029838) 是(4642407) 日本舞(24) 昨日(2036) 則(254096) 以(547785) 韓國風(1) 裝扮(1680) 跳(21391) 一(3701681) 段(95980) 阿里郎(8),"{'High': 39, 'Low': 6}","{'Unknown': 13, '第1級': 17, '第1*級': 3, '第2級': 2, '第7級': 1, '第3級': 1, '第5級': 5, '第6級': 2, '第4級': 1}",7,Y,N,N,Y
她們共同的體會是，跳舞讓她們更年輕。,她們 共同 的 體會 是 跳舞 讓 她們 更 年輕,10,她們(52188) 共同(36636) 的(16029838) 體會(9519) 是(4642407) 跳舞(6124) 讓(526314) 她們(52188) 更(361676) 年輕(48853),{'High': 10},"{'Unknown': 3, '第4級': 1, '第1級': 2, '第5級': 1, '第1*級': 1, '第2級': 2}",0,Y,N,N,N
化裝舞會是系列活動之一。,化裝 舞會 是 系列 活動 之 一,7,化裝(406) 舞會(2344) 是(4642407) 系列(19048) 活動(85743) 之(875481) 一(3701681),{'High': 7},"{'Unknown': 2, '第1級': 2, '第6級': 1, '第2級': 1, '第5級': 1}",0,Y,N,N,N
昨日上午愛心嘉年華會為市府周邊帶來不少人氣。,昨日 上午 愛心 嘉年華會 為 市府 周邊 帶來 不少 人氣,10,昨日(2036) 上午(6241) 愛心(3575) 嘉年華會(318) 為(761341) 市府(433) 周邊(4081) 帶來(40305) 不少(35256) 人氣(1690),{'High': 10},"{'第5級': 2, '第1級': 1, '第4級': 1, 'Unknown': 5, '第3*級': 1}",1,Y,N,N,N
共有約百餘個攤位的美食、遊戲、義診區，社會局安排全市低收入及獨居老人免費享用。,共 有 約 百餘 個 攤位 的 美食 遊戲 義診區 社會局 安排 全 市 低 收入 及 獨居 老人 免費 享用,21,共(32138) 有(2217079) 約(47731) 百餘(1429) 個(2296574) 攤位(1247) 的(16029838) 美食(3573) 遊戲(31463) 義診區(Unknown) 社會局(184) 安排(30105) 全(178642) 市(5149) 低(32663) 收入(15636) 及(304586) 獨居(1026) 老人(23906) 免費(6101) 享用(3152),"{'High': 20, 'Low': 1}","{'第1*級': 2, '第1級': 3, '第3*級': 1, 'Unknown': 3, '第4*級': 1, '第4級': 4, '第3級': 1, '第2級': 2, '第2*級': 1, '第5級': 1, '第7級': 1, '第6級': 1}",2,Y,Y,N,N
副市長白秀雄在園遊會致贈敬老禮品給九位廣慈博愛院的高齡長者代表。,副市長 白秀雄 在 園遊會 致贈 敬老 禮品 給 九 位 廣慈 博愛院 的 高齡 長者 代表,16,副市長(474) 白秀雄(6) 在(3284238) 園遊會(267) 致贈(197) 敬老(119) 禮品(1109) 給(240485) 九(34506) 位(284809) 廣慈(30) 博愛院(10) 的(16029838) 高齡(2125) 長者(2569) 代表(58333),"{'High': 13, 'Low': 3}","{'Unknown': 9, '第1*級': 1, '第1級': 4, '第6級': 1, '第4級': 1}",4,Y,N,N,Y
搭配敬老系列活動，社會局在市府中庭也展出今年度老人長期照護機構評鑑績優單位，同時展出居家照顧、日間照顧、文康休閒、老人中心、緊急救援系統和社會役男愛心專車等老人福利服務項目，展期至今廿二日止。,搭配 敬老 系列 活動 社會局 在 市府 中庭 也 展出 今年度 老人 長期 照護 機構 評鑑 績優 單位 同時 展出 居家 照顧 日間 照顧 文康 休閒 老人 中心 緊急 救援 系統 和 社會 役男 愛心 專車 等 老人 福利 服務 項目 展期 至今 廿二日 止,45,搭配(6314) 敬老(119) 系列(19048) 活動(85743) 社會局(184) 在(3284238) 市府(433) 中庭(1086) 也(1590760) 展出(3360) 今年度(44) 老人(23906) 長期(28592) 照護(2477) 機構(24025) 評鑑(2698) 績優(189) 單位(23148) 同時(115305) 展出(3360) 居家(1606) 照顧(29251) 日間(691) 照顧(29251) 文康(215) 休閒(5416) 老人(23906) 中心(46076) 緊急(8631) 救援(2897) 系統(67366) 和(1338337) 社會(176660) 役男(86) 愛心(3575) 專車(345) 等(327380) 老人(23906) 福利(4311) 服務(38055) 項目(12387) 展期(112) 至今(14540) 廿二日(121) 止(8003),"{'High': 43, 'Low': 2}","{'第5級': 6, 'Unknown': 17, '第6級': 5, '第2級': 4, '第1*級': 1, '第1級': 1, '第7級': 1, '第3*級': 3, '第3級': 4, '第4級': 2, '第4*級': 1}",3,Y,Y,N,N
後續的活動則有廿四日上午九時五十分，在真善美戲院，由天主教失智老人福利基金會招待弱勢長者欣賞「梁山伯與祝英台」；同日下午招待長者聆賞老歌，並致贈千份懷舊老歌精選，地點在懷恩堂，不收門票自由入座。,後續 的 活動 則 有 廿四日 上午 九時 五十分 在 真善美 戲院 由 天主教 失智 老人 福利 基金會 招待 弱勢 長者 欣賞 梁山伯 與 祝英台 同 日 下午 招待 長者 聆賞 老歌 並 致贈 千 份 懷舊 老歌 精選 地點 在 懷恩堂 不 收 門票 自由 入座,47,後續(3723) 的(16029838) 活動(85743) 則(254096) 有(2217079) 廿四日(169) 上午(6241) 九時(372) 五十分(253) 在(3284238) 真善美(431) 戲院(4927) 由(208604) 天主教(3538) 失智(973) 老人(23906) 福利(4311) 基金會(7844) 招待(3920) 弱勢(3282) 長者(2569) 欣賞(17817) 梁山伯(306) 與(968432) 祝英台(315) 同(102917) 日(94041) 下午(20045) 招待(3920) 長者(2569) 聆賞(210) 老歌(Unknown) 並(442790) 致贈(197) 千(19677) 份(53198) 懷舊(1579) 老歌(Unknown) 精選(994) 地點(16808) 在(3284238) 懷恩堂(15) 不(2282521) 收(15831) 門票(1074) 自由(56360) 入座(507),"{'High': 44, 'Low': 3}","{'第6級': 3, '第1級': 7, '第2級': 3, '第5級': 5, 'Unknown': 18, '第1*級': 2, '第4*級': 4, '第7級': 1, '第3*級': 2, '第3級': 1, '第2*級': 1}",8,Y,Y,N,Y
廿五日光復節當天上午九時，市府市政資料館四樓有一場老人家說故事比賽，目前尚有名額可報名，請洽失智老人基金會：二三○四六七一六。,廿五日 光復節 當天 上午 九時 市府 市政 資料館 四樓 有 一 場 老人家 說 故事 比賽 目前 尚 有 名額 可 報名 請洽 失智 老人 基金會 二三四六七一六,27,廿五日(179) 光復節(39) 當天(11728) 上午(6241) 九時(372) 市府(433) 市政(869) 資料館(343) 四樓(650) 有(2217079) 一(3701681) 場(68915) 老人家(6365) 說(1285247) 故事(101316) 比賽(20220) 目前(48695) 尚(26113) 有(2217079) 名額(820) 可(307359) 報名(1789) 請洽(22) 失智(973) 老人(23906) 基金會(7844) 二三四六七一六(Unknown),"{'High': 24, 'Low': 3}","{'Unknown': 11, '第4*級': 2, '第1級': 5, '第2級': 4, '第5級': 1, '第4級': 2, '第6級': 1, '第7級': 1}",6,Y,N,Y,N
台北市文化局為紀念台灣光復五十六周年，廿五日當天在中山堂舉行歷史圖片展及廣場音樂會。,台北市 文化局 為 紀念 台灣 光復 五十六 周年 廿五日 當天 在 中山堂 舉行 歷史 圖片展 及 廣場 音樂會,18,台北市(4393) 文化局(417) 為(761341) 紀念(7956) 台灣(130718) 光復(1971) 五十六(732) 周年(1107) 廿五日(179) 當天(11728) 在(3284238) 中山堂(296) 舉行(17660) 歷史(96060) 圖片展(Unknown) 及(304586) 廣場(8418) 音樂會(3276),"{'High': 17, 'Low': 1}","{'Unknown': 8, '第4級': 2, '第1級': 1, '第7級': 1, '第4*級': 2, '第1*級': 1, '第3級': 1, '第5級': 2}",7,Y,Y,N,N
文化局長龍應台昨日宣布，中山堂在睽違五年後，將在今年底重新開放，內設一千二百席的表演廳，同時有文化聚會和演出。,文化 局長 龍應台 昨日 宣布 中山堂 在 睽違 五 年 後 將 在 今年 底 重新 開放 內 設 一千二百 席 的 表演廳 同時 有 文化 聚會 和 演出,29,文化(115697) 局長(3442) 龍應台(72) 昨日(2036) 宣布(10219) 中山堂(296) 在(3284238) 睽違(148) 五(112649) 年(514736) 後(422857) 將(448374) 在(3284238) 今年(10836) 底(37174) 重新(44668) 開放(17546) 內(183051) 設(17537) 一千二百(426) 席(4534) 的(16029838) 表演廳(86) 同時(115305) 有(2217079) 文化(115697) 聚會(6842) 和(1338337) 演出(20672),"{'High': 27, 'Low': 2}","{'第2級': 2, 'Unknown': 8, '第5級': 4, '第4*級': 2, '第1*級': 2, '第1級': 6, '第3*級': 2, '第4級': 1, '第3級': 1, '第6級': 1}",4,Y,Y,N,Y
蘊含豐富人文意涵的中山堂，將讓市民又有一處品味歷史、貼近生活的好去處。,蘊含 豐富 人文 意涵 的 中山堂 將 讓 市民 又 有 一 處 品味 歷史 貼近 生活 的 好 去處,20,蘊含(1701) 豐富(24271) 人文(6474) 意涵(4487) 的(16029838) 中山堂(296) 將(448374) 讓(526314) 市民(6158) 又(535555) 有(2217079) 一(3701681) 處(84410) 品味(5677) 歷史(96060) 貼近(2679) 生活(213189) 的(16029838) 好(448428) 去處(972),{'High': 20},"{'第7級': 1, '第4級': 1, '第6級': 3, '第1級': 4, 'Unknown': 4, '第5級': 3, '第2級': 1, '第1*級': 1, '第3級': 2}",1,Y,N,N,N
中山堂在台灣歷史上有特別地位。,中山堂 在 台灣 歷史 上 有 特別 地位,8,中山堂(296) 在(3284238) 台灣(130718) 歷史(96060) 上(1233218) 有(2217079) 特別(91212) 地位(36831),{'High': 8},"{'Unknown': 1, '第1*級': 1, '第1級': 3, '第3級': 1, '第2級': 1, '第4級': 1}",1,Y,N,N,N
中山堂光復廳因民國卅四年國民政府在此舉行在台日軍受降典禮而重新命名。,中山堂 光復廳 因 民國 卅四年 國民 政府 在 此 舉行 在 台 日軍 受降 典禮 而 重新 命名,18,中山堂(296) 光復廳(6) 因(119364) 民國(16130) 卅四年(8) 國民(10927) 政府(92663) 在(3284238) 此(288458) 舉行(17660) 在(3284238) 台(29325) 日軍(6230) 受降(121) 典禮(4040) 而(937923) 重新(44668) 命名(4271),"{'High': 16, 'Low': 2}","{'Unknown': 7, '第5級': 5, '第4級': 3, '第1*級': 2, '第2級': 1}",3,Y,Y,N,N
為重現歷史意味深遠的中山堂場景，廿五日光復節當天，文化局在晚間七點鐘於中山堂廣場舉行「星空音樂會」，由台北市立交響樂團擔綱演出，演奏台灣民謠「四季謠」、阿美族民歌「今夜星光夜色多美好」、陳鋼、何占豪「梁山伯與祝英台小提琴協奏曲」、早川正昭編曲「春江花月夜琵琶協奏曲」、德弗札克「斯拉夫進行曲」等曲目，並朗誦台灣作家當年的手稿，引領市民緬懷早年台灣民眾的歷史情懷。,為 重現 歷史 意味 深遠 的 中山堂 場景 廿五日 光復節 當天 文化局 在 晚間 七點鐘 於 中山堂 廣場 舉行 星空 音樂會 由 台北 市立 交響樂團 擔綱 演出 演奏 台灣 民謠 四季謠 阿美族 民歌 今夜星光 夜色 多 美好 陳鋼 何占豪 梁山伯 與 祝英台 小提琴 協奏曲 早川正昭 編曲 春 江 花 月 夜 琵琶 協奏曲 德弗札克 斯拉夫 進行曲 等 曲目 並 朗誦 台灣 作家 當年 的 手稿 引領 市民 緬懷 早年 台灣 民眾 的 歷史 情懷,74,為(761341) 重現(2405) 歷史(96060) 意味(16636) 深遠(4206) 的(16029838) 中山堂(296) 場景(10949) 廿五日(179) 光復節(39) 當天(11728) 文化局(417) 在(3284238) 晚間(1978) 七點鐘(349) 於(327210) 中山堂(296) 廣場(8418) 舉行(17660) 星空(954) 音樂會(3276) 由(208604) 台北(22242) 市立(1688) 交響樂團(1608) 擔綱(866) 演出(20672) 演奏(6625) 台灣(130718) 民謠(1489) 四季謠(6) 阿美族(1292) 民歌(1392) 今夜星光(Unknown) 夜色(2001) 多(318992) 美好(17327) 陳鋼(6) 何占豪(2) 梁山伯(306) 與(968432) 祝英台(315) 小提琴(2720) 協奏曲(1165) 早川正昭(Unknown) 編曲(570) 春(12629) 江(15960) 花(72593) 月(148997) 夜(31283) 琵琶(1574) 協奏曲(1165) 德弗札克(26) 斯拉夫(111) 進行曲(318) 等(327380) 曲目(1107) 並(442790) 朗誦(1184) 台灣(130718) 作家(24304) 當年(25091) 的(16029838) 手稿(2825) 引領(3267) 市民(6158) 緬懷(741) 早年(5061) 台灣(130718) 民眾(17097) 的(16029838) 歷史(96060) 情懷(2124),"{'High': 67, 'Low': 7}","{'Unknown': 31, '第5級': 8, '第3級': 2, '第6級': 4, '第1級': 8, '第4*級': 10, '第1*級': 1, '第4級': 2, '第7級': 5, '第2級': 1, '第3*級': 2}",21,Y,Y,N,Y
龍應台表示，今年文獻會特別挑選了台灣光復有關的圖片，廿五日光復節當天上午十點半起於市府中庭展出，在影像中回憶台灣人民艱苦渡過的日子。,龍應台 表示 今年 文獻會 特別 挑選 了 台灣 光復 有關 的 圖片 廿五日 光復節 當天 上午 十點半 起於 市府 中庭 展出 在 影像 中 回憶 台灣 人民 艱苦 渡過 的 日子,31,龍應台(72) 表示(74452) 今年(10836) 文獻會(38) 特別(91212) 挑選(6979) 了(3199291) 台灣(130718) 光復(1971) 有關(69607) 的(16029838) 圖片(4811) 廿五日(179) 光復節(39) 當天(11728) 上午(6241) 十點半(330) 起於(218) 市府(433) 中庭(1086) 展出(3360) 在(3284238) 影像(22328) 中(1011729) 回憶(17740) 台灣(130718) 人民(36441) 艱苦(3014) 渡過(2757) 的(16029838) 日子(28378),"{'Low': 3, 'High': 28}","{'Unknown': 12, '第4*級': 5, '第1級': 6, '第2級': 1, '第5級': 2, '第7級': 1, '第4級': 1, '第1*級': 1, '第6級': 1, '第3*級': 1}",5,Y,N,N,Y
展期至卅一日止。,展期 至 卅一日 止,4,展期(112) 至(101530) 卅一日(75) 止(8003),"{'High': 3, 'Low': 1}","{'Unknown': 2, '第5級': 1, '第4*級': 1}",1,N,Y,N,N
龍應台昨並宣布暌違五年的中山堂將於年底全館開放。,龍應台 昨 並 宣布 暌違 五 年 的 中山堂 將 於 年底 全 館 開放,15,龍應台(72) 昨(531) 並(442790) 宣布(10219) 暌違(5) 五(112649) 年(514736) 的(16029838) 中山堂(296) 將(448374) 於(327210) 年底(2450) 全(178642) 館(3995) 開放(17546),"{'Low': 2, 'High': 13}","{'Unknown': 6, '第4*級': 2, '第1級': 3, '第5級': 2, '第2級': 1, '第4級': 1}",2,Y,Y,N,Y
整修後的古蹟，重現台北公會堂典雅恢弘的建築原貌，內部設置有一千兩百席的表演廳，以及各種呈現台北傳統藝術文化聚會和演出。,整修 後 的 古蹟 重現 台北 公會堂 典雅 恢弘 的 建築 原貌 內部 設置有 一千兩百 席 的 表演廳 以及 各 種 呈現 台北 傳統 藝術 文化 聚會 和 演出,29,整修(1502) 後(422857) 的(16029838) 古蹟(2555) 重現(2405) 台北(22242) 公會堂(151) 典雅(1080) 恢弘(160) 的(16029838) 建築(31065) 原貌(827) 內部(20578) 設置有(11) 一千兩百(300) 席(4534) 的(16029838) 表演廳(86) 以及(155624) 各(243023) 種(701563) 呈現(26810) 台北(22242) 傳統(60517) 藝術(80645) 文化(115697) 聚會(6842) 和(1338337) 演出(20672),"{'High': 27, 'Low': 2}","{'第6級': 3, '第1級': 4, '第5級': 4, 'Unknown': 11, '第4*級': 2, '第7級': 1, '第2級': 2, '第3級': 1, '第4級': 1}",4,Y,Y,N,N
市民可以在星空下，重登當年蔣中正精神講話的露台，感受中山堂豐富歷史之美。,市民 可以 在 星空 下 重 登 當年 蔣中正 精神 講話 的 露台 感受 中山堂 豐富 歷史 之 美,19,市民(6158) 可以(560531) 在(3284238) 星空(954) 下(329549) 重(31331) 登(6176) 當年(25091) 蔣中正(1080) 精神(79222) 講話(14410) 的(16029838) 露台(791) 感受(30399) 中山堂(296) 豐富(24271) 歷史(96060) 之(875481) 美(53380),{'High': 19},"{'第5級': 3, '第1級': 2, '第1*級': 3, '第7級': 1, 'Unknown': 5, '第4*級': 1, '第3*級': 1, '第4級': 2, '第3級': 1}",2,Y,N,N,Y
文化局表示，中山堂原名「台北公會堂」，是日據時期台灣最重要藝文表演場所，也是日本母國之外在所有殖民地裡興建最繁華的集會場所，包括國宴、日軍受降典禮，都在此舉行。,文化局 表示 中山堂 原名 台北 公會堂 是 日據 時期 台灣 最 重要 藝文 表演 場所 也 是 日本 母國 之外 在 所有 殖民地 裡 興建 最 繁華 的 集會 場所 包括 國宴 日軍 受降 典禮 都 在 此 舉行,39,文化局(417) 表示(74452) 中山堂(296) 原名(1675) 台北(22242) 公會堂(151) 是(4642407) 日據(1340) 時期(47839) 台灣(130718) 最(421680) 重要(154863) 藝文(1483) 表演(20601) 場所(8263) 也(1590760) 是(4642407) 日本(105587) 母國(485) 之外(45757) 在(3284238) 所有(146771) 殖民地(5021) 裡(520435) 興建(5688) 最(421680) 繁華(2328) 的(16029838) 集會(2539) 場所(8263) 包括(74410) 國宴(176) 日軍(6230) 受降(121) 典禮(4040) 都(1125846) 在(3284238) 此(288458) 舉行(17660),{'High': 39},"{'Unknown': 11, '第4*級': 2, '第1級': 7, '第1*級': 5, '第2級': 2, '第7級': 1, '第4級': 3, '第5級': 5, '第6級': 2, '第3*級': 1}",4,Y,N,N,N
國民政府遷台後，國民大會長駐於此，並選出蔣中正、嚴家淦等正副元首，具有相當高的政治象徵意義。,國民 政府 遷 台 後 國民大會 長駐 於 此 並 選出 蔣中正 嚴家淦 等 正副元首 具有 相當 高 的 政治 象徵 意義,22,國民(10927) 政府(92663) 遷(3078) 台(29325) 後(422857) 國民大會(722) 長駐(151) 於(327210) 此(288458) 並(442790) 選出(3069) 蔣中正(1080) 嚴家淦(201) 等(327380) 正副元首(Unknown) 具有(60702) 相當(66293) 高(128858) 的(16029838) 政治(79504) 象徵(18975) 意義(71714),"{'High': 21, 'Low': 1}","{'第5級': 4, '第4級': 2, 'Unknown': 7, '第2級': 1, '第1級': 3, '第4*級': 1, '第3*級': 1, '第6級': 2, '第3級': 1}",4,Y,Y,N,Y
中山堂也是許多藝文前輩首演場所，包括劉鳳學、蔡瑞月、林懷民等舞蹈家當年都是在此首演而名聞藝壇。,中山堂 也 是 許多 藝文 前輩 首演 場所 包括 劉鳳學 蔡瑞月 林懷民 等 舞蹈家 當年 都 是 在 此 首演 而 名聞 藝壇,23,中山堂(296) 也(1590760) 是(4642407) 許多(159791) 藝文(1483) 前輩(3136) 首演(858) 場所(8263) 包括(74410) 劉鳳學(16) 蔡瑞月(550) 林懷民(562) 等(327380) 舞蹈家(364) 當年(25091) 都(1125846) 是(4642407) 在(3284238) 此(288458) 首演(858) 而(937923) 名聞(78) 藝壇(548),"{'High': 21, 'Low': 2}","{'Unknown': 9, '第1級': 4, '第3*級': 3, '第7級': 1, '第5級': 4, '第4*級': 1, '第1*級': 1}",5,Y,Y,N,Y
為迎接中山堂重生，中山堂管理所刻正舉辦老照片徵選活動，舉凡民眾過去在中山內外拍攝的紀念照片、展演活動的紀錄、或是電影放映會的門票、傳單、海報，甚至大食堂的菜單都歡迎民眾踴躍提供。,為 迎接 中山堂 重生 中山堂 管理所 刻正 舉辦 老 照片 徵選 活動 舉凡 民眾 過去 在 中山 內外 拍攝 的 紀念 照片 展演 活動 的 紀錄 或是 電影 放映 會 的 門票 傳單 海報 甚至 大 食堂 的 菜單 都 歡迎 民眾 踴躍 提供,44,為(761341) 迎接(8917) 中山堂(296) 重生(1757) 中山堂(296) 管理所(41) 刻正(84) 舉辦(12070) 老(75373) 照片(25355) 徵選(268) 活動(85743) 舉凡(1430) 民眾(17097) 過去(88758) 在(3284238) 中山(2828) 內外(4887) 拍攝(15537) 的(16029838) 紀念(7956) 照片(25355) 展演(799) 活動(85743) 的(16029838) 紀錄(14233) 或是(75906) 電影(115295) 放映(3543) 會(1014977) 的(16029838) 門票(1074) 傳單(1630) 海報(3744) 甚至(122502) 大(525780) 食堂(651) 的(16029838) 菜單(1854) 都(1125846) 歡迎(19513) 民眾(17097) 踴躍(620) 提供(73097),"{'High': 42, 'Low': 2}","{'Unknown': 11, '第5級': 3, '第4級': 4, '第1級': 7, '第2級': 6, '第7級': 3, '第4*級': 5, '第1*級': 3, '第2*級': 2}",3,Y,Y,N,Y
珍貴罕見的老照片歡迎當事人擇日前來中山堂說說老故事。,珍貴 罕見 的 老 照片 歡迎 當事人 擇日 前 來 中山堂 說說 老 故事,14,珍貴(7380) 罕見(4469) 的(16029838) 老(75373) 照片(25355) 歡迎(19513) 當事人(6612) 擇日(3) 前(272709) 來(742183) 中山堂(296) 說說(3939) 老(75373) 故事(101316),"{'High': 13, 'Low': 1}","{'第5級': 2, '第1級': 5, '第2級': 3, 'Unknown': 4}",2,Y,N,N,N
有意提供者可電：二三八一三一三七。,有意 提供者 可 電 二三八一三一三七,5,有意(7824) 提供者(Unknown) 可(307359) 電(7111) 二三八一三一三七(Unknown),"{'High': 3, 'Low': 2}","{'第5級': 1, 'Unknown': 2, '第4*級': 1, '第2級': 1}",2,Y,N,Y,N
台北市古蹟文化、歷史建築物保存，雖已推動多年，但由執行成果也發現，已面臨相當多瓶頸及盲點，樂山文教基金會執行長丘如華指出，包括陳德星堂、剝皮寮古蹟與校園衝突等，為突破瓶頸，將邀請專家學者舉辦系列論壇共同把脈。,台北市 古蹟 文化 歷史 建築物 保存 雖 已 推動 多 年 但 由 執行 成果 也 發現 已 面臨 相當 多 瓶頸 及 盲點 樂山 文教 基金會 執行長 丘如華 指出 包括 陳德星堂 剝皮寮 古蹟 與 校園 衝突 等 為 突破 瓶頸 將 邀請 專家 學者 舉辦 系列 論壇 共同 把脈,50,台北市(4393) 古蹟(2555) 文化(115697) 歷史(96060) 建築物(6830) 保存(10152) 雖(48164) 已(215610) 推動(14867) 多(318992) 年(514736) 但(597124) 由(208604) 執行(25364) 成果(16253) 也(1590760) 發現(175233) 已(215610) 面臨(16531) 相當(66293) 多(318992) 瓶頸(1343) 及(304586) 盲點(1179) 樂山(138) 文教(1353) 基金會(7844) 執行長(4222) 丘如華(17) 指出(38456) 包括(74410) 陳德星堂(5) 剝皮寮(15) 古蹟(2555) 與(968432) 校園(7406) 衝突(27003) 等(327380) 為(761341) 突破(10583) 瓶頸(1343) 將(448374) 邀請(14342) 專家(26090) 學者(28981) 舉辦(12070) 系列(19048) 論壇(2444) 共同(36636) 把脈(243),"{'High': 47, 'Low': 3}","{'Unknown': 11, '第5級': 8, '第2級': 4, '第3級': 5, '第4*級': 6, '第1級': 4, '第6級': 4, '第7級': 2, '第3*級': 2, '第4級': 4}",7,Y,Y,N,Y
樂山文教基金會執行長丘如華表示，和以往系列論壇不同的是，除了專家學者一起座談，每個議題將前往現地研習、會勘，藉由共同的關懷及參與，提供改造的具體做法。,樂山 文教 基金會 執行長 丘如華 表示 和 以往 系列 論壇 不同 的 是 除了 專家 學者 一起 座談 每 個 議題 將 前往 現地 研習 會勘 藉由 共同 的 關懷 及 參與 提供 改造 的 具體 做法,37,樂山(138) 文教(1353) 基金會(7844) 執行長(4222) 丘如華(17) 表示(74452) 和(1338337) 以往(9935) 系列(19048) 論壇(2444) 不同(159432) 的(16029838) 是(4642407) 除了(75964) 專家(26090) 學者(28981) 一起(79297) 座談(893) 每(333357) 個(2296574) 議題(15856) 將(448374) 前往(27321) 現地(99) 研習(1601) 會勘(53) 藉由(15664) 共同(36636) 的(16029838) 關懷(8683) 及(304586) 參與(40595) 提供(73097) 改造(6226) 的(16029838) 具體(20349) 做法(16990),"{'High': 34, 'Low': 3}","{'Unknown': 7, '第7級': 4, '第4*級': 4, '第5級': 7, '第6級': 3, '第3級': 2, '第1級': 6, '第3*級': 1, '第4級': 2, '第1*級': 1}",3,Y,Y,N,Y
