sentence,sentence_preprocessed,sentence_length,word_freq,high_low_freq,word_level,long_word_count,is_complete_sentence,is_complete_context,is_blacklist,is_greylist
我注意到那位護士小姐默默流著眼淚。,我 注意到 那 位 護士 小姐 默默 流 著 眼淚,10,我(3033032) 注意到(20925) 那(754138) 位(284809) 護士(8285) 小姐(49626) 默默(8445) 流(11907) 著(1004687) 眼淚(10567),{'High': 10},"{'第1級': 4, 'Unknown': 2, '第2*級': 1, '第5級': 1, '第3*級': 1, '第4級': 1}",1,Y,N,N,N
那是一位非常優秀，在加護病房工作多年的護理人員，有一天，我在普通病房遇見她，她看來憂鬱而缺乏自信。,那 是 一 位 非常 優秀 在 加護 病房 工作 多 年 的 護理 人員 有 一 天 我 在 普通 病房 遇見 她 她 看來 憂鬱 而 缺乏 自信,30,那(754138) 是(4642407) 一(3701681) 位(284809) 非常(152032) 優秀(11296) 在(3284238) 加護(721) 病房(4748) 工作(220164) 多(318992) 年(514736) 的(16029838) 護理(2623) 人員(49261) 有(2217079) 一(3701681) 天(330413) 我(3033032) 在(3284238) 普通(12529) 病房(4748) 遇見(7702) 她(1052913) 她(1052913) 看來(23504) 憂鬱(9291) 而(937923) 缺乏(27750) 自信(14578),{'High': 30},"{'第1級': 14, '第1*級': 3, '第5級': 5, 'Unknown': 2, '第4級': 5, '第4*級': 1}",0,Y,Y,N,N
「我知道，這聽來荒謬，但是在加護病房待久了，我害怕面對會自己吃東西、會說話的病人。」,我 知道 這 聽來 荒謬 但是 在 加護 病房 待久 了 我 害怕 面對 會 自己 吃 東西 會 說話 的 病人,22,我(3033032) 知道(343214) 這(2114032) 聽來(3032) 荒謬(5026) 但是(247988) 在(3284238) 加護(721) 病房(4748) 待久(151) 了(3199291) 我(3033032) 害怕(30308) 面對(62914) 會(1014977) 自己(744739) 吃(141660) 東西(139472) 會(1014977) 說話(53027) 的(16029838) 病人(27031),{'High': 22},"{'第1級': 7, 'Unknown': 4, '第6級': 1, '第2級': 2, '第1*級': 5, '第4級': 1, '第3*級': 1, '第4*級': 1}",0,Y,Y,N,N
她苦笑著。,她 苦笑 著,3,她(1052913) 苦笑(2577) 著(1004687),{'High': 3},"{'第1級': 1, 'Unknown': 2}",0,Y,N,N,N
我怔怔地說不出話，只能深深祝福。,我 怔怔 地 說 不 出 話 只 能 深深 祝福,11,我(3033032) 怔怔(334) 地(754998) 說(1285247) 不(2282521) 出(84457) 話(148020) 只(436725) 能(582260) 深深(13764) 祝福(5030),{'High': 11},"{'第1級': 4, 'Unknown': 3, '第1*級': 3, '第5級': 1}",0,Y,N,N,N
加護病房的護理人員，你們為通往「生」者給予最好的照護，為穿越「死」者保有最後的尊嚴，你們是一群守護在生死線上的天使。,加護 病房 的 護理 人員 你們 為 通往 生 者 給予 最好 的 照護 為 穿越 死 者 保有 最後 的 尊嚴 你們 是 一群 守護 在 生死 線上 的 天使,31,加護(721) 病房(4748) 的(16029838) 護理(2623) 人員(49261) 你們(104323) 為(761341) 通往(6681) 生(61638) 者(423504) 給予(18824) 最好(22016) 的(16029838) 照護(2477) 為(761341) 穿越(5408) 死(117075) 者(423504) 保有(4661) 最後(142102) 的(16029838) 尊嚴(5963) 你們(104323) 是(4642407) 一群(Unknown) 守護(5609) 在(3284238) 生死(7032) 線上(1747) 的(16029838) 天使(7140),"{'High': 30, 'Low': 1}","{'Unknown': 9, '第4級': 2, '第1級': 7, '第5級': 5, '第6級': 4, '第3級': 2, '第2級': 1, '第1*級': 1}",0,Y,N,N,N
問：半年來我舌頭周邊發炎，食酸辣則疼痛不堪，一般食品亦覺食之無味，經中西醫診治也不見改善，不知是什麼緣故？,問 半 年 來 我 舌頭 周邊 發炎 食 酸 辣 則 疼痛 不堪 一般 食品 亦 覺 食 之 無味 經 中西醫 診治 也 不見 改善 不 知 是 什麼 緣故,32,問(165473) 半(80813) 年(514736) 來(742183) 我(3033032) 舌頭(5315) 周邊(4081) 發炎(3827) 食(13009) 酸(5603) 辣(3290) 則(254096) 疼痛(11177) 不堪(6676) 一般(80732) 食品(11311) 亦(68507) 覺(12294) 食(13009) 之(875481) 無味(680) 經(38471) 中西醫(111) 診治(872) 也(1590760) 不見(1483) 改善(21559) 不(2282521) 知(108500) 是(4642407) 什麼(431321) 緣故(7005),{'High': 32},"{'第1級': 9, '第5級': 4, 'Unknown': 10, '第4*級': 2, '第2*級': 2, '第4級': 1, '第6級': 3, '第3*級': 1}",1,Y,N,N,N
之前曾服食美製綜合維他命，因怕膠囊有害，故皆咬破吐出，曾懷疑是否為偽藥，因此導致邊潰瘍？,之前 曾 服食 美製 綜合 維他命 因 怕 膠囊 有害 故 皆 咬破 吐出 曾 懷疑 是否 為 偽藥 因此 導致 邊 潰瘍,23,之前(79748) 曾(132981) 服食(280) 美製(47) 綜合(8011) 維他命(3803) 因(119364) 怕(46704) 膠囊(657) 有害(3591) 故(28882) 皆(45736) 咬破(140) 吐出(2917) 曾(132981) 懷疑(29705) 是否(78907) 為(761341) 偽藥(15) 因此(184606) 導致(30222) 邊(123152) 潰瘍(971),"{'High': 21, 'Low': 2}","{'第4級': 3, 'Unknown': 9, '第5級': 4, '第6級': 3, '第1*級': 2, '第4*級': 2}",1,Y,Y,N,N
(老翁葉品祿)答：舌周邊發炎一般稱為口角炎，通常是缺乏維生素B群中的B2引起的，如果讀者食物選擇種類少、飲食不均衡時，更容易引起。,老翁 葉品祿 答 舌 周邊 發炎 一般 稱為 口角炎 通常 是 缺乏 維生素 B群 中 的 B2 引起 的 如果 讀者 食物 選擇 種類 少 飲食 不 均衡 時 更 容易 引起,32,老翁(1019) 葉品祿(Unknown) 答(11720) 舌(3225) 周邊(4081) 發炎(3827) 一般(80732) 稱為(34293) 口角炎(36) 通常(56445) 是(4642407) 缺乏(27750) 維生素(3709) B群(Unknown) 中(1011729) 的(16029838) B2(337) 引起(36729) 的(16029838) 如果(322121) 讀者(34316) 食物(41958) 選擇(75178) 種類(8370) 少(50762) 飲食(17432) 不(2282521) 均衡(3808) 時(623734) 更(361676) 容易(80831) 引起(36729),"{'High': 29, 'Low': 3}","{'Unknown': 8, '第3級': 2, '第5級': 2, '第4*級': 5, '第3*級': 3, '第4級': 3, '第1級': 6, '第6級': 2, '第2級': 1}",3,Y,Y,N,Y
至於維生素B2，多半存在於全米、全麥、胚芽米、動物肝臟、香菇、木耳、瘦肉、魚、牛奶、起士、綠色蔬菜等。,至於 維生素 B2 多半 存在 於 全 米 全 麥 胚芽米 動物 肝臟 香菇 木耳 瘦肉 魚 牛奶 起士 綠色 蔬菜 等,22,至於(39363) 維生素(3709) B2(337) 多半(11983) 存在(75197) 於(327210) 全(178642) 米(25678) 全(178642) 麥(2597) 胚芽米(21) 動物(36835) 肝臟(2186) 香菇(1305) 木耳(584) 瘦肉(269) 魚(34923) 牛奶(6364) 起士(351) 綠色(9303) 蔬菜(7827) 等(327380),"{'High': 21, 'Low': 1}","{'第5級': 3, '第6級': 1, 'Unknown': 8, '第4級': 2, '第2級': 2, '第3*級': 2, '第4*級': 1, '第7級': 1, '第1*級': 2}",2,Y,Y,N,N
有關膠囊的吃法，基本上使用膠囊包裹藥劑是有其原因，包括：1.藥物成分有些因為酸鹼值的因素，會傷害食道，所以使用膠囊包裹來保護；2.易於吞服；3.特殊設計的時效藥劑，藉由膠囊在體內溶化的時間，漸漸將藥劑釋放出來，達到藥效。,有關 膠囊 的 吃法 基本 上 使用 膠囊 包裹 藥劑 是 有 其 原因 包括 1 藥物 成分 有些 因為 酸鹼值 的 因素 會 傷害 食道 所以 使用 膠囊 包裹 來 保護 2 易於 吞服 3 特殊 設計 的 時效 藥劑 藉由 膠囊 在 體 內 溶化 的 時間 漸漸 將 藥劑 釋放 出來 達到 藥效,56,有關(69607) 膠囊(657) 的(16029838) 吃法(501) 基本(52069) 上(1233218) 使用(99640) 膠囊(657) 包裹(3778) 藥劑(1261) 是(4642407) 有(2217079) 其(307905) 原因(67404) 包括(74410) 1(79772) 藥物(14995) 成分(9525) 有些(6971) 因為(425061) 酸鹼值(109) 的(16029838) 因素(34409) 會(1014977) 傷害(22978) 食道(936) 所以(239080) 使用(99640) 膠囊(657) 包裹(3778) 來(742183) 保護(32573) 2(66480) 易於(1808) 吞服(131) 3(51223) 特殊(28606) 設計(59326) 的(16029838) 時效(573) 藥劑(1261) 藉由(15664) 膠囊(657) 在(3284238) 體(15460) 內(183051) 溶化(506) 的(16029838) 時間(213595) 漸漸(20748) 將(448374) 藥劑(1261) 釋放(6788) 出來(50336) 達到(35670) 藥效(786),{'High': 56},"{'第4級': 3, 'Unknown': 20, '第1級': 9, '第5級': 4, '第4*級': 7, '第6級': 4, '第3*級': 3, '第1*級': 4, '第3級': 1, '第7級': 1}",1,Y,Y,N,N
換句話說，以膠囊包裹的藥劑有其必要性，因此不要隨便拆開膠囊，以免影響藥效。,換句話說 以 膠囊 包裹 的 藥劑 有 其 必要性 因此 不要 隨便 拆開 膠囊 以免 影響 藥效,17,換句話說(9327) 以(547785) 膠囊(657) 包裹(3778) 的(16029838) 藥劑(1261) 有(2217079) 其(307905) 必要性(1466) 因此(184606) 不要(101931) 隨便(10857) 拆開(1172) 膠囊(657) 以免(8342) 影響(95840) 藥效(786),{'High': 17},"{'Unknown': 8, '第5級': 2, '第4*級': 2, '第1級': 2, '第6級': 1, '第4級': 1, '第3級': 1}",2,Y,Y,N,N
而膠囊的成分為膠質，分量很少，容易被身體吸收，並不會對身體造成影響。,而 膠囊 的 成分 為 膠質 分量 很少 容易 被 身體 吸收 並 不會 對 身體 造成 影響,18,而(937923) 膠囊(657) 的(16029838) 成分(9525) 為(761341) 膠質(508) 分量(2613) 很少(20291) 容易(80831) 被(540683) 身體(97873) 吸收(9741) 並(442790) 不會(173045) 對(897964) 身體(97873) 造成(63141) 影響(95840),{'High': 18},"{'第5級': 2, 'Unknown': 6, '第1級': 3, '第2級': 1, '第1*級': 2, '第4*級': 3, '第3級': 1}",0,Y,Y,N,N
(北醫附設醫院營養室主任楊淑惠暨藥劑科總藥師陳俊良回答、陳南君採訪整理)泡湯品出爐了！,北醫 附設 醫院 營養室 主任 楊淑惠 暨 藥劑 科總 藥師 陳俊良 回答 陳南君 採訪 整理 泡湯品 出爐 了,18,北醫(24) 附設(732) 醫院(30938) 營養室(Unknown) 主任(13859) 楊淑惠(1) 暨(3829) 藥劑(1261) 科總(Unknown) 藥師(677) 陳俊良(37) 回答(63497) 陳南君(Unknown) 採訪(8722) 整理(16113) 泡湯品(Unknown) 出爐(1030) 了(3199291),"{'Low': 7, 'High': 11}","{'Unknown': 10, '第7級': 1, '第2級': 1, '第4級': 2, '第6級': 2, '第3級': 1, '第5級': 1}",5,Y,Y,N,Y
上百種新貨色都已到貨。,上百 種 新 貨色 都 已 到貨,7,上百(1982) 種(701563) 新(212453) 貨色(479) 都(1125846) 已(215610) 到貨(29),"{'High': 6, 'Low': 1}","{'Unknown': 3, '第1級': 2, '第7級': 1, '第3級': 1}",0,Y,N,N,N
從過去的一段式泡湯，到今年最新的二段式，有些甚至附玩具，種類齊全到連足部專用都有這些泡湯品除了讓你免出門就能泡遍日本名泉，現在連國內四大溫泉也推出泡湯粉，不讓日式泡湯專美於前。,從 過去 的 一段式 泡湯 到 今年 最 新 的 二段式 有些 甚至 附 玩具 種類 齊全 到 連 足部 專用 都 有 這些 泡湯品 除了 讓 你 免 出門 就 能 泡 遍 日本 名泉 現在 連 國內 四 大 溫泉 也 推出 泡湯粉 不 讓 日式 泡湯 專美於前,50,從(496546) 過去(88758) 的(16029838) 一段式(2) 泡湯(570) 到(546906) 今年(10836) 最(421680) 新(212453) 的(16029838) 二段式(8) 有些(6971) 甚至(122502) 附(4103) 玩具(10102) 種類(8370) 齊全(1122) 到(546906) 連(91153) 足部(579) 專用(2795) 都(1125846) 有(2217079) 這些(315113) 泡湯品(Unknown) 除了(75964) 讓(526314) 你(1414837) 免(7314) 出門(12554) 就(1737544) 能(582260) 泡(7148) 遍(20150) 日本(105587) 名泉(21) 現在(218744) 連(91153) 國內(17537) 四(141667) 大(525780) 溫泉(2435) 也(1590760) 推出(10009) 泡湯粉(Unknown) 不(2282521) 讓(526314) 日式(1603) 泡湯(570) 專美於前(77),"{'High': 44, 'Low': 6}","{'第1*級': 3, '第4級': 4, '第1級': 16, 'Unknown': 11, '第7級': 2, '第4*級': 1, '第6級': 2, '第3*級': 3, '第2級': 2, '第5級': 2, '第3級': 4}",5,Y,Y,N,N
林林總總的泡湯料不但讓浴缸像一鍋補品，想泡在酒或咖啡甚至炭裡，也沒問題！,林林總總 的 泡湯料 不但 讓 浴缸 像 一 鍋 補品 想 泡 在 酒 或 咖啡 甚至 炭 裡 也 沒 問題,22,林林總總(454) 的(16029838) 泡湯料(Unknown) 不但(40359) 讓(526314) 浴缸(1407) 像(289494) 一(3701681) 鍋(9371) 補品(335) 想(449884) 泡(7148) 在(3284238) 酒(46479) 或(478077) 咖啡(12867) 甚至(122502) 炭(1230) 裡(520435) 也(1590760) 沒(306167) 問題(280782),"{'High': 21, 'Low': 1}","{'第7級': 1, '第1級': 7, 'Unknown': 3, '第3級': 3, '第2級': 1, '第1*級': 4, '第4級': 1, '第4*級': 1, '第5級': 1}",2,Y,Y,N,N
泡湯新貨到！,泡湯 新貨 到,3,泡湯(570) 新貨(32) 到(546906),"{'High': 2, 'Low': 1}","{'第7級': 1, 'Unknown': 1, '第1級': 1}",0,Y,N,N,N
國內泡湯品最齊全的台隆手創館，至少就引進上百項發燒品，幾乎一舉囊括目前最重要、最新種類；康是美則由711和日本合作，獨家開發國內四種著名溫泉泡湯粉，並引進日本牛乳入浴劑組、和泡湯俱樂部各四種，以上這些產品到年底都能買一送一；博姿則以地中海和峇里島等天然成分和瓜果為主；登琪爾引進著名的高滋養100%浴泥。,國內 泡湯品 最 齊全 的 台隆 手創館 至少 就 引進 上 百 項 發燒品 幾乎 一舉 囊括 目前 最 重要 最 新 種類 康是美 則 由 711 和 日本 合作 獨家 開發 國內 四 種 著名 溫泉 泡湯粉 並 引進 日本 牛乳 入浴 劑 組 和 泡湯 俱樂部 各 四 種 以上 這些 產品 到 年底 都 能 買一送一 博姿 則 以 地中海 和 峇里島 等 天然 成分 和 瓜果 為主 登琪爾 引進 著名 的 高 滋養 100 浴泥,79,國內(17537) 泡湯品(Unknown) 最(421680) 齊全(1122) 的(16029838) 台隆(3) 手創館(20) 至少(41964) 就(1737544) 引進(6742) 上(1233218) 百(24843) 項(88887) 發燒品(Unknown) 幾乎(74298) 一舉(2838) 囊括(771) 目前(48695) 最(421680) 重要(154863) 最(421680) 新(212453) 種類(8370) 康是美(Unknown) 則(254096) 由(208604) 711(21) 和(1338337) 日本(105587) 合作(35908) 獨家(1386) 開發(19196) 國內(17537) 四(141667) 種(701563) 著名(20279) 溫泉(2435) 泡湯粉(Unknown) 並(442790) 引進(6742) 日本(105587) 牛乳(330) 入浴(166) 劑(1595) 組(22075) 和(1338337) 泡湯(570) 俱樂部(6831) 各(243023) 四(141667) 種(701563) 以上(36569) 這些(315113) 產品(51029) 到(546906) 年底(2450) 都(1125846) 能(582260) 買一送一(Unknown) 博姿(4) 則(254096) 以(547785) 地中海(1673) 和(1338337) 峇里島(249) 等(327380) 天然(6103) 成分(9525) 和(1338337) 瓜果(339) 為主(12900) 登琪爾(Unknown) 引進(6742) 著名(20279) 的(16029838) 高(128858) 滋養(1865) 100(5632) 浴泥(Unknown),"{'High': 68, 'Low': 11}","{'第4級': 6, 'Unknown': 27, '第1*級': 4, '第6級': 9, '第1級': 13, '第5級': 8, '第7級': 3, '第2級': 2, '第4*級': 3, '第3*級': 3, '第3級': 1}",12,Y,Y,N,Y
台隆手創館副理翁振益表示，二段式泡澡是最新的名堂，食物與飲料，則有洗澡如飲食的樂趣；連辣椒湯都變得更狂，加上大蒜要強力催汗。,台隆 手創館 副理 翁振益 表示 二段式 泡 澡 是 最 新 的 名堂 食物 與 飲料 則 有 洗澡 如 飲食 的 樂趣 連 辣椒 湯 都 變 得 更 狂 加上 大蒜 要 強力 催 汗,37,台隆(3) 手創館(20) 副理(282) 翁振益(Unknown) 表示(74452) 二段式(8) 泡(7148) 澡(2695) 是(4642407) 最(421680) 新(212453) 的(16029838) 名堂(789) 食物(41958) 與(968432) 飲料(6444) 則(254096) 有(2217079) 洗澡(4561) 如(195069) 飲食(17432) 的(16029838) 樂趣(9412) 連(91153) 辣椒(1847) 湯(20387) 都(1125846) 變(80345) 得(573721) 更(361676) 狂(5223) 加上(38121) 大蒜(1337) 要(851264) 強力(3383) 催(3757) 汗(8555),"{'Low': 4, 'High': 33}","{'Unknown': 10, '第4*級': 3, '第3級': 4, '第1級': 7, '第1*級': 2, '第6級': 2, '第5級': 3, '第2*級': 1, '第4級': 2, '第3*級': 2, '第2級': 1}",3,Y,Y,N,Y
而日劇常見、以保濕成分走紅的尿素泡澡劑，也終於引進台灣；要玩遊戲或享受花瓣浴，今年更有料了，花瓣放大了至少三倍，視覺上更唯美享受。,而 日劇 常見 以 保濕 成分 走紅 的 尿素 泡 澡 劑 也 終於 引進 台灣 要 玩 遊戲 或 享受 花瓣浴 今年 更 有 料 了 花瓣 放大 了 至少 三 倍 視覺 上 更 唯美 享受,38,而(937923) 日劇(266) 常見(13705) 以(547785) 保濕(192) 成分(9525) 走紅(394) 的(16029838) 尿素(123) 泡(7148) 澡(2695) 劑(1595) 也(1590760) 終於(59622) 引進(6742) 台灣(130718) 要(851264) 玩(38177) 遊戲(31463) 或(478077) 享受(21312) 花瓣浴(Unknown) 今年(10836) 更(361676) 有(2217079) 料(4257) 了(3199291) 花瓣(2132) 放大(3383) 了(3199291) 至少(41964) 三(313861) 倍(22818) 視覺(16700) 上(1233218) 更(361676) 唯美(266) 享受(21312),"{'High': 37, 'Low': 1}","{'第5級': 4, 'Unknown': 13, '第4級': 5, '第1級': 8, '第3級': 3, '第6級': 3, '第1*級': 1, '第3*級': 1}",1,Y,Y,N,N
康是美賴文琦則表示，牛奶浴、鹽浴今年有看頭，鹽加上蘆薈或米；或者牛奶再加入膠原蛋白、仙人掌精華等，都是更滋養的複方。,康是美 賴文琦 則 表示 牛奶浴 鹽浴 今年 有 看頭 鹽 加上 蘆薈 或 米 或者 牛奶 再 加入 膠原 蛋白 仙人掌 精華 等 都 是 更 滋養 的 複方,29,康是美(Unknown) 賴文琦(Unknown) 則(254096) 表示(74452) 牛奶浴(2) 鹽浴(Unknown) 今年(10836) 有(2217079) 看頭(323) 鹽(9853) 加上(38121) 蘆薈(143) 或(478077) 米(25678) 或者(63631) 牛奶(6364) 再(326207) 加入(28847) 膠原(275) 蛋白(1905) 仙人掌(492) 精華(2141) 等(327380) 都(1125846) 是(4642407) 更(361676) 滋養(1865) 的(16029838) 複方(139),"{'Low': 4, 'High': 25}","{'Unknown': 11, '第5級': 1, '第4*級': 1, '第1級': 5, '第3級': 4, '第3*級': 2, '第1*級': 2, '第4級': 1, '第6級': 1, '第7級': 1}",4,Y,Y,N,Y
二段浴與局部足浴：足浴(舒緩精NT300，護理包3包NT180/博姿)：另有爽足噴劑泡後使用。,二 段 浴 與 局部 足浴 足浴 舒緩精 NT 300 護理包 3 包 NT 180 博姿 另 有 爽 足 噴劑 泡 後 使用,24,二(152494) 段(95980) 浴(1076) 與(968432) 局部(3067) 足浴(13) 足浴(13) 舒緩精(Unknown) NT(Unknown) 300(1433) 護理包(1) 3(51223) 包(14086) NT(Unknown) 180(1108) 博姿(4) 另(138369) 有(2217079) 爽(3853) 足(8697) 噴劑(84) 泡(7148) 後(422857) 使用(99640),"{'High': 16, 'Low': 8}","{'第1級': 3, '第4級': 2, 'Unknown': 14, '第4*級': 1, '第6級': 1, '第2級': 1, '第3級': 2}",4,Y,Y,N,Y
全身浴(NT190/台隆)：去角質劑+保濕炭酸泉與桑皮滋養精華半身浴(NT190/台隆)：去污垢角質與軟化皮膚的泡澡劑+保濕滋潤的身體化妝水。,全 身 浴 NT 190 台隆 去 角質 劑 保濕 炭酸泉 與 桑皮 滋養 精華 半身 浴 NT 190 台隆 去 污垢 角質 與 軟化 皮膚 的 泡 澡 劑 保濕 滋潤 的 身體 化妝水,35,全(178642) 身(122324) 浴(1076) NT(Unknown) 190(399) 台隆(3) 去(479993) 角質(424) 劑(1595) 保濕(192) 炭酸泉(Unknown) 與(968432) 桑皮(9) 滋養(1865) 精華(2141) 半身(411) 浴(1076) NT(Unknown) 190(399) 台隆(3) 去(479993) 污垢(511) 角質(424) 與(968432) 軟化(1093) 皮膚(13766) 的(16029838) 泡(7148) 澡(2695) 劑(1595) 保濕(192) 滋潤(1252) 的(16029838) 身體(97873) 化妝水(58),"{'High': 28, 'Low': 7}","{'第2級': 1, '第4*級': 3, 'Unknown': 19, '第1級': 4, '第6級': 3, '第7級': 2, '第4級': 1, '第3級': 1, '第1*級': 1}",4,Y,Y,N,Y
飲料浴：享受泡在咖啡和茶香的感覺吧(咖啡包/茶包NT55/包，台隆(。,飲料浴 享受 泡 在 咖啡 和 茶香 的 感覺 吧 咖啡包 茶包 NT 55 包 台隆,16,飲料浴(Unknown) 享受(21312) 泡(7148) 在(3284238) 咖啡(12867) 和(1338337) 茶香(192) 的(16029838) 感覺(91265) 吧(184477) 咖啡包(7) 茶包(150) NT(Unknown) 55(2217) 包(14086) 台隆(3),"{'Low': 4, 'High': 12}","{'Unknown': 8, '第4級': 1, '第3級': 1, '第1*級': 1, '第1級': 3, '第3*級': 1, '第2級': 1}",2,Y,Y,N,Y
綠茶浴可抗氧化、米酒浴保濕又滋養呢(NT180/台隆(；泡在各種著名口味的。,綠茶浴 可 抗氧化 米酒浴 保濕 又 滋養 呢 NT 180 台隆 泡 在 各 種 著名 口味 的,18,綠茶浴(Unknown) 可(307359) 抗氧化(348) 米酒浴(Unknown) 保濕(192) 又(535555) 滋養(1865) 呢(204566) NT(Unknown) 180(1108) 台隆(3) 泡(7148) 在(3284238) 各(243023) 種(701563) 著名(20279) 口味(4548) 的(16029838),"{'Low': 4, 'High': 14}","{'Unknown': 8, '第4*級': 1, '第1*級': 2, '第7級': 1, '第1級': 2, '第3級': 1, '第2級': 1, '第6級': 1, '第4級': 1}",4,Y,Y,N,Y
雞尾酒來場派對吧(NT360/罐，台隆(。,雞尾酒 來 場 派對 吧 NT 360 罐 台隆,9,雞尾酒(969) 來(742183) 場(68915) 派對(3706) 吧(184477) NT(Unknown) 360(377) 罐(3447) 台隆(3),"{'High': 7, 'Low': 2}","{'第7級': 1, '第1級': 2, '第2級': 1, '第3*級': 1, 'Unknown': 3, '第2*級': 1}",2,Y,N,N,Y
竹醋浴和炭浴：竹炭或竹醋液，都是由竹子去燒成的炭，或放置後醋化萃取出的醋液，能殺菌和保濕。,竹醋浴 和 炭浴 竹 炭 或 竹醋液 都 是 由 竹子 去 燒成 的 炭 或 放置 後 醋化 萃取出 的 醋 液 能 殺菌 和 保濕,27,竹醋浴(Unknown) 和(1338337) 炭浴(Unknown) 竹(7253) 炭(1230) 或(478077) 竹醋液(Unknown) 都(1125846) 是(4642407) 由(208604) 竹子(2011) 去(479993) 燒成(846) 的(16029838) 炭(1230) 或(478077) 放置(3585) 後(422857) 醋化(1) 萃取出(127) 的(16029838) 醋(2731) 液(326) 能(582260) 殺菌(541) 和(1338337) 保濕(192),"{'Low': 4, 'High': 23}","{'Unknown': 11, '第4級': 3, '第5級': 2, '第3級': 2, '第1級': 6, '第4*級': 1, '第6級': 1, '第1*級': 1}",3,Y,Y,N,N
竹炭風呂、竹醋液大瓶與單次分量與袋裝包(大瓶NT530，一次試用瓶NT110，當然大瓶划算/台隆(。,竹 炭 風呂 竹醋液 大 瓶 與 單 次 分量 與 袋裝 包 大 瓶 NT 530 一 次 試用 瓶 NT 110 當然 大 瓶 划算 台隆,28,竹(7253) 炭(1230) 風呂(4) 竹醋液(Unknown) 大(525780) 瓶(9509) 與(968432) 單(10648) 次(331701) 分量(2613) 與(968432) 袋裝(162) 包(14086) 大(525780) 瓶(9509) NT(Unknown) 530(65) 一(3701681) 次(331701) 試用(1020) 瓶(9509) NT(Unknown) 110(982) 當然(113971) 大(525780) 瓶(9509) 划算(824) 台隆(3),"{'High': 22, 'Low': 6}","{'第4級': 1, '第5級': 3, 'Unknown': 10, '第1級': 4, '第2*級': 4, '第4*級': 2, '第2級': 4}",3,Y,Y,N,Y
竹炭溫泉、風呂美人、竹炭之力(NT1150；NT560/台隆(與竹炭浴球(NT320/台隆(，使用二、三個月，日曬後便可再用。,竹 炭 溫泉 風呂 美人 竹 炭 之 力 NT 1150 NT 560 台隆 與 竹 炭 浴球 NT 320 台隆 使用 二 三 個 月 日曬 後 便 可 再 用,32,竹(7253) 炭(1230) 溫泉(2435) 風呂(4) 美人(4137) 竹(7253) 炭(1230) 之(875481) 力(13779) NT(Unknown) 1150(19) NT(Unknown) 560(56) 台隆(3) 與(968432) 竹(7253) 炭(1230) 浴球(Unknown) NT(Unknown) 320(206) 台隆(3) 使用(99640) 二(152494) 三(313861) 個(2296574) 月(148997) 日曬(597) 後(422857) 便(220860) 可(307359) 再(326207) 用(377038),"{'High': 23, 'Low': 9}","{'第4級': 4, '第5級': 4, '第3級': 1, 'Unknown': 12, '第4*級': 2, '第1級': 6, '第7級': 1, '第6級': 1, '第1*級': 1}",3,Y,N,N,Y
國內外名湯重現：國內四大溫泉名湯：知本、關仔嶺、陽明山、廬山溫泉的濃縮(NT30/康是美、統一超商(。,國內外 名湯 重現 國內 四 大 溫泉 名湯 知本 關仔嶺 陽明山 廬山 溫泉 的 濃縮 NT 30 康是美 統一 超商,20,國內外(1883) 名湯(2) 重現(2405) 國內(17537) 四(141667) 大(525780) 溫泉(2435) 名湯(2) 知本(197) 關仔嶺(44) 陽明山(687) 廬山(813) 溫泉(2435) 的(16029838) 濃縮(1382) NT(Unknown) 30(11946) 康是美(Unknown) 統一(14407) 超商(805),"{'High': 15, 'Low': 5}","{'Unknown': 10, '第5級': 1, '第4級': 1, '第1級': 3, '第3級': 2, '第6級': 1, '第4*級': 1, '第2*級': 1}",4,Y,N,N,Y
日本名湯：日本溫泉協會推荐的湯之花(NT180/台隆(。,日本 名湯 日本 溫泉 協會 推荐 的 湯 之 花 NT 180 台隆,13,日本(105587) 名湯(2) 日本(105587) 溫泉(2435) 協會(13492) 推荐(101) 的(16029838) 湯(20387) 之(875481) 花(72593) NT(Unknown) 180(1108) 台隆(3),"{'High': 10, 'Low': 3}","{'第1級': 3, 'Unknown': 6, '第3級': 1, '第5級': 2, '第1*級': 1}",1,Y,N,N,Y
食物浴除了水蜜桃、紫蘇之外，百花繚亂絲瓜浴可保濕(NT35(、辣茭則加入大蒜讓發汗更澈底(NT40/台隆(。,食物浴 除了 水蜜桃 紫蘇 之外 百 花 繚亂 絲瓜浴 可 保濕 NT 35 辣茭 則 加入 大蒜 讓 發汗 更 澈底 NT 40 台隆,24,食物浴(Unknown) 除了(75964) 水蜜桃(302) 紫蘇(47) 之外(45757) 百(24843) 花(72593) 繚亂(51) 絲瓜浴(Unknown) 可(307359) 保濕(192) NT(Unknown) 35(3711) 辣茭(Unknown) 則(254096) 加入(28847) 大蒜(1337) 讓(526314) 發汗(198) 更(361676) 澈底(172) NT(Unknown) 40(5313) 台隆(3),"{'Low': 8, 'High': 16}","{'Unknown': 17, '第3*級': 1, '第1級': 1, '第4*級': 1, '第5級': 2, '第4級': 1, '第2級': 1}",3,Y,N,N,Y
地中海的無花果、百里香系列，都含蜂蜜、牛奶等不同的天然滋養成分(NT500/博姿(。,地中海 的 無花果 百里香 系列 都 含 蜂蜜 牛奶 等 不同 的 天然 滋養 成分 NT 500 博姿,18,地中海(1673) 的(16029838) 無花果(448) 百里香(156) 系列(19048) 都(1125846) 含(12321) 蜂蜜(2013) 牛奶(6364) 等(327380) 不同(159432) 的(16029838) 天然(6103) 滋養(1865) 成分(9525) NT(Unknown) 500(1341) 博姿(4),"{'High': 16, 'Low': 2}","{'Unknown': 6, '第1級': 3, '第6級': 1, '第5級': 4, '第1*級': 1, '第3*級': 1, '第3級': 1, '第7級': 1}",4,Y,Y,N,Y
與蕃茄青黃椒等野菜菜(NT35/台隆(。,與 蕃茄 青黃椒 等 野菜 菜 NT 35 台隆,9,與(968432) 蕃茄(558) 青黃椒(Unknown) 等(327380) 野菜(932) 菜(17883) NT(Unknown) 35(3711) 台隆(3),"{'High': 6, 'Low': 3}","{'第4*級': 1, 'Unknown': 6, '第3*級': 1, '第1*級': 1}",1,N,Y,N,Y
