sentence,sentence_preprocessed,sentence_length,word_freq,high_low_freq,word_level,long_word_count,is_complete_sentence,is_complete_context,is_blacklist,is_greylist
在反對聲音漫天價響之際，相信有更多民眾意見遭到漠視，苦無管道表達。,在 反對 聲音 漫天價響 之 際 相信 有 更 多 民眾 意見 遭到 漠視 苦 無 管道 表達,18,在(3284238) 反對(26810) 聲音(85694) 漫天價響(2) 之(875481) 際(14344) 相信(82200) 有(2217079) 更(361676) 多(318992) 民眾(17097) 意見(34740) 遭到(16228) 漠視(1233) 苦(19101) 無(157858) 管道(7455) 表達(34582),"{'High': 17, 'Low': 1}","{'第1*級': 1, '第4級': 1, '第2級': 3, 'Unknown': 3, '第5級': 3, '第6級': 1, '第1級': 2, '第4*級': 2, '第3*級': 1, '第7級': 1}",1,Y,N,N,N
我們至盼高舉反六輕旗幟的民眾，在激情過後，心平氣和地聽取沈默大眾的心聲；我們也期望學界人士貢獻理論基礎後，應該尊重專家的實務經驗，從旁協助，更希望熱衷於政治爭鬥的地方政壇人士放棄一己私心，共同為建設新宜蘭。,我們 至 盼 高舉 反 六輕 旗幟 的 民眾 在 激情 過 後 心平氣和 地 聽取 沈默 大眾 的 心聲 我們 也 期望 學界 人士 貢獻 理論 基礎 後 應該 尊重 專家 的 實務 經驗 從旁 協助 更 希望 熱衷 於 政治 爭鬥 的 地方 政壇 人士 放棄 一己 私心 共同 為 建設 新 宜蘭,55,我們(979260) 至(101530) 盼(2429) 高舉(2405) 反(44292) 六輕(303) 旗幟(2905) 的(16029838) 民眾(17097) 在(3284238) 激情(4019) 過(412878) 後(422857) 心平氣和(1004) 地(754998) 聽取(1680) 沈默(1706) 大眾(22411) 的(16029838) 心聲(2064) 我們(979260) 也(1590760) 期望(13591) 學界(2762) 人士(27666) 貢獻(15759) 理論(62242) 基礎(39682) 後(422857) 應該(165478) 尊重(18394) 專家(26090) 的(16029838) 實務(5596) 經驗(86997) 從旁(1056) 協助(28701) 更(361676) 希望(119975) 熱衷(1706) 於(327210) 政治(79504) 爭鬥(1723) 的(16029838) 地方(139164) 政壇(1881) 人士(27666) 放棄(27664) 一己(1605) 私心(1206) 共同(36636) 為(761341) 建設(11627) 新(212453) 宜蘭(2874),{'High': 55},"{'第1級': 10, '第5級': 10, 'Unknown': 10, '第4*級': 5, '第6級': 7, '第1*級': 4, '第7級': 3, '第4級': 4, '第2級': 2}",1,Y,N,N,N
新台灣而全力以赴。,新 台灣 而 全力以赴,4,新(212453) 台灣(130718) 而(937923) 全力以赴(1555),{'High': 4},"{'第1級': 2, '第5級': 1, '第7級': 1}",1,Y,Y,N,N
至於台塑方面，我們也必須強調，環保是時勢所趨，與其動用龐大公關費用誇稱六輕污染微乎其微，不如以實際行動做好敦親睦鄰，立即改善包括龍德廠在內的關係工業的污染情形，以示六輕建廠的最高誠意，爭取民眾認同，更須恪遵摒棄污染的原則，接受當地民眾督促，如此方能建立一流企業的良好形象，使六輕建廠有其廣大意義，而非停留在企業牟利的階段。,至於 台塑 方面 我們 也 必須 強調 環保 是 時勢 所 趨 與其 動用 龐大 公關 費用 誇稱 六輕 污染 微乎其微 不如 以 實際 行動 做好 敦親睦鄰 立即 改善 包括 龍德廠 在 內 的 關係 工業 的 污染 情形 以 示 六輕 建廠 的 最 高 誠意 爭取 民眾 認同 更 須 恪遵 摒棄 污染 的 原則 接受 當地 民眾 督促 如此 方 能 建立 一流 企業 的 良好 形象 使 六輕 建廠 有 其 廣大 意義 而 非 停留 在 企業 牟利 的 階段,85,至於(39363) 台塑(3456) 方面(75079) 我們(979260) 也(1590760) 必須(170592) 強調(36095) 環保(4082) 是(4642407) 時勢(1213) 所(527327) 趨(3204) 與其(4703) 動用(2504) 龐大(10804) 公關(2537) 費用(10652) 誇稱(59) 六輕(303) 污染(5095) 微乎其微(680) 不如(21722) 以(547785) 實際(52755) 行動(69326) 做好(11572) 敦親睦鄰(84) 立即(28594) 改善(21559) 包括(74410) 龍德廠(Unknown) 在(3284238) 內(183051) 的(16029838) 關係(162883) 工業(20144) 的(16029838) 污染(5095) 情形(35199) 以(547785) 示(6571) 六輕(303) 建廠(575) 的(16029838) 最(421680) 高(128858) 誠意(2239) 爭取(9666) 民眾(17097) 認同(21303) 更(361676) 須(17260) 恪遵(181) 摒棄(1154) 污染(5095) 的(16029838) 原則(31148) 接受(84729) 當地(23011) 民眾(17097) 督促(1317) 如此(133083) 方(33724) 能(582260) 建立(52946) 一流(3474) 企業(65457) 的(16029838) 良好(16069) 形象(20430) 使(197544) 六輕(303) 建廠(575) 有(2217079) 其(307905) 廣大(6565) 意義(71714) 而(937923) 非(112415) 停留(7966) 在(3284238) 企業(65457) 牟利(346) 的(16029838) 階段(35628),"{'High': 82, 'Low': 3}","{'第5級': 18, 'Unknown': 15, '第3*級': 8, '第1級': 11, '第3級': 4, '第6級': 8, '第2級': 1, '第4級': 3, '第7級': 3, '第4*級': 10, '第1*級': 4}",3,Y,Y,N,N
金門地區第一家純民營的觀光旅館金門飯店，定二月二日開幕，正式展開營運。,金門 地區 第一 家 純 民營 的 觀光 旅館 金門 飯店 定 二月 二日 開幕 正式 展開 營運,18,金門(4382) 地區(40339) 第一(172544) 家(236822) 純(8773) 民營(2175) 的(16029838) 觀光(4478) 旅館(12498) 金門(4382) 飯店(9669) 定(18743) 二月(12791) 二日(3130) 開幕(2013) 正式(23229) 展開(17154) 營運(5641),{'High': 18},"{'Unknown': 5, '第4級': 2, '第2級': 1, '第1級': 2, '第5級': 3, '第2*級': 2, '第6級': 2, '第3*級': 1}",0,Y,N,N,N
位於金城鎮民族路一百七十二號的這家旅舍，佔地二百七十平方公尺，為三層樓建築，由金門縣籍人士投資的金門育樂股份有限公司所出資經營。,位於 金城鎮 民族路 一百七十二號 的 這 家 旅舍 佔地 二百七十 平方公尺 為 三 層 樓 建築 由 金門縣籍 人士 投資 的 金門 育樂 股份 有限公司 所 出資 經營,28,位於(19612) 金城鎮(60) 民族路(159) 一百七十二號(Unknown) 的(16029838) 這(2114032) 家(236822) 旅舍(378) 佔地(701) 二百七十(91) 平方公尺(820) 為(761341) 三(313861) 層(36369) 樓(13297) 建築(31065) 由(208604) 金門縣籍(Unknown) 人士(27666) 投資(38191) 的(16029838) 金門(4382) 育樂(180) 股份(4551) 有限公司(618) 所(527327) 出資(1580) 經營(39913),"{'High': 24, 'Low': 4}","{'第6級': 2, 'Unknown': 13, '第1級': 5, '第3*級': 1, '第1*級': 1, '第4*級': 3, '第5級': 2, '第2級': 1}",7,Y,N,N,N
這家旅館規劃為大套房十間。,這 家 旅館 規劃為 大 套房 十 間,8,這(2114032) 家(236822) 旅館(12498) 規劃為(188) 大(525780) 套房(1060) 十(77415) 間(115638),{'High': 8},"{'第1級': 4, '第2*級': 1, 'Unknown': 2, '第5級': 1}",1,Y,N,N,N
小套房十間，最高一次可容納四十位旅客住宿：其收費標準還未訂定。,小 套房 十 間 最 高 一 次 可 容納 四十 位 旅客 住宿 其 收費 標準 還 未 訂定,20,小(318835) 套房(1060) 十(77415) 間(115638) 最(421680) 高(128858) 一(3701681) 次(331701) 可(307359) 容納(2699) 四十(15256) 位(284809) 旅客(3355) 住宿(2271) 其(307905) 收費(1810) 標準(31106) 還(625086) 未(101927) 訂定(2929),{'High': 20},"{'第1級': 5, '第5級': 3, 'Unknown': 4, '第1*級': 1, '第2級': 1, '第4*級': 2, '第6級': 3, '第3*級': 1}",0,Y,N,N,N
這是金門首見的純由民間經營旅舍，在此之前，地區的招待外賓住宿處所，均係非旅館性質的招待所。,這 是 金門 首 見 的 純 由 民間 經營 旅舍 在 此 之前 地區 的 招待 外賓 住宿 處所 均 係 非 旅館 性質 的 招待所,27,這(2114032) 是(4642407) 金門(4382) 首(44848) 見(179113) 的(16029838) 純(8773) 由(208604) 民間(16236) 經營(39913) 旅舍(378) 在(3284238) 此(288458) 之前(79748) 地區(40339) 的(16029838) 招待(3920) 外賓(373) 住宿(2271) 處所(839) 均(27783) 係(9477) 非(112415) 旅館(12498) 性質(11550) 的(16029838) 招待所(533),{'High': 27},"{'第1級': 5, 'Unknown': 4, '第4*級': 3, '第1*級': 2, '第5級': 7, '第4級': 2, '第7級': 1, '第6級': 2, '第2*級': 1}",1,Y,N,N,N
據悉，在金門飯店設立後，另有兩家民間投資的旅館，也將在其後籌劃開設。,據悉 在 金門 飯店 設立 後 另 有 兩 家 民間 投資 的 旅館 也 將 在 其後 籌劃 開設,20,據悉(283) 在(3284238) 金門(4382) 飯店(9669) 設立(12114) 後(422857) 另(138369) 有(2217079) 兩(526190) 家(236822) 民間(16236) 投資(38191) 的(16029838) 旅館(12498) 也(1590760) 將(448374) 在(3284238) 其後(5706) 籌劃(1036) 開設(3274),{'High': 20},"{'第7級': 1, '第1*級': 2, 'Unknown': 1, '第2*級': 2, '第5級': 2, '第1級': 6, '第3級': 1, '第4*級': 2, '第6級': 3}",0,Y,N,N,N
台北市社會福利彩券能否繼續發行？,台北市 社會 福利 彩券 能否 繼續 發行,7,台北市(4393) 社會(176660) 福利(4311) 彩券(597) 能否(7723) 繼續(80649) 發行(12238),{'High': 7},"{'Unknown': 3, '第3*級': 1, '第6級': 1, '第4級': 1, '第5級': 1}",1,Y,N,N,N
情況可能是凶多吉少。,情況 可能 是 凶多吉少,4,情況(92301) 可能(271025) 是(4642407) 凶多吉少(274),{'High': 4},"{'第4級': 1, '第1級': 2, 'Unknown': 1}",1,Y,N,N,N
但財政局長廖正井強調彩券發行增加政府稅收，財政部應該感激才是，因此，呼籲行政院多注意彩券發行的正面影響，讓彩券繼續發行。,但 財政局長 廖正井 強調 彩券 發行 增加 政府 稅收 財政部 應該 感激 才 是 因此 呼籲 行政院 多 注意 彩券 發行 的 正面 影響 讓 彩券 繼續 發行,28,但(597124) 財政局長(13) 廖正井(1) 強調(36095) 彩券(597) 發行(12238) 增加(48296) 政府(92663) 稅收(1835) 財政部(1822) 應該(165478) 感激(9200) 才(394539) 是(4642407) 因此(184606) 呼籲(3515) 行政院(4347) 多(318992) 注意(49591) 彩券(597) 發行(12238) 的(16029838) 正面(16915) 影響(95840) 讓(526314) 彩券(597) 繼續(80649) 發行(12238),"{'High': 26, 'Low': 2}","{'第2級': 4, 'Unknown': 7, '第5級': 6, '第4級': 3, '第6級': 2, '第1*級': 1, '第1級': 3, '第4*級': 1, '第3級': 1}",4,Y,Y,N,Y
昨日第三期社會福利彩券幸運獎開獎，財政局長廖正井表示，這次幸運獎開獎可說愛心彩券最後一期幸運獎開獎，也很可能是最後一期愛心彩券開獎；愛心彩券發行在短時間內，就讓政府增加許多稅收充裕國庫，財政部應該要心存感激，而彩券發行三期，三個半月內創造十八個二千萬元富翁，因此中大獎的也應該要感激市府；他說，彩券發行迄今對社會實在有很多正面的影響，如：很順利的籌措到社會福利金，增加稅收。,昨日 第三 期 社會 福利 彩券 幸運獎 開獎 財政局長 廖正井 表示 這 次 幸運獎 開獎 可 說 愛心 彩券 最後 一 期 幸運獎 開獎 也 很 可能 是 最後 一 期 愛心 彩券 開獎 愛心 彩券 發行 在 短 時間 內 就 讓 政府 增加 許多 稅收 充裕 國庫 財政部 應該 要 心 存 感激 而 彩券 發行 三 期 三 個 半 月 內 創造 十八 個 二千萬 元 富翁 因此 中 大 獎 的 也 應該 要 感激 市府 他 說 彩券 發行 迄 今 對 社會 實在 有 很多 正面 的 影響 如 很 順利 的 籌措到 社會 福利金 增加 稅收,104,昨日(2036) 第三(50320) 期(14058) 社會(176660) 福利(4311) 彩券(597) 幸運獎(Unknown) 開獎(71) 財政局長(13) 廖正井(1) 表示(74452) 這(2114032) 次(331701) 幸運獎(Unknown) 開獎(71) 可(307359) 說(1285247) 愛心(3575) 彩券(597) 最後(142102) 一(3701681) 期(14058) 幸運獎(Unknown) 開獎(71) 也(1590760) 很(715675) 可能(271025) 是(4642407) 最後(142102) 一(3701681) 期(14058) 愛心(3575) 彩券(597) 開獎(71) 愛心(3575) 彩券(597) 發行(12238) 在(3284238) 短(22412) 時間(213595) 內(183051) 就(1737544) 讓(526314) 政府(92663) 增加(48296) 許多(159791) 稅收(1835) 充裕(1386) 國庫(1274) 財政部(1822) 應該(165478) 要(851264) 心(180243) 存(10876) 感激(9200) 而(937923) 彩券(597) 發行(12238) 三(313861) 期(14058) 三(313861) 個(2296574) 半(80813) 月(148997) 內(183051) 創造(38327) 十八(13604) 個(2296574) 二千萬(379) 元(60807) 富翁(1997) 因此(184606) 中(1011729) 大(525780) 獎(6328) 的(16029838) 也(1590760) 應該(165478) 要(851264) 感激(9200) 市府(433) 他(2487930) 說(1285247) 彩券(597) 發行(12238) 迄(3998) 今(33635) 對(897964) 社會(176660) 實在(51634) 有(2217079) 很多(113128) 正面(16915) 的(16029838) 影響(95840) 如(195069) 很(715675) 順利(17708) 的(16029838) 籌措到(4) 社會(176660) 福利金(45) 增加(48296) 稅收(1835),"{'High': 93, 'Low': 11}","{'第5級': 9, 'Unknown': 30, '第3*級': 5, '第6級': 6, '第4*級': 4, '第1級': 29, '第2級': 5, '第4級': 8, '第1*級': 4, '第3級': 3, '第7級': 1}",9,Y,Y,N,Y
就業機會及提供民眾多一種休閒娛樂活動，所以行政院在評估是否讓彩券繼續發行時，應多考慮彩券發行正面的效果。,就業 機會 及 提供 民眾 多 一 種 休閒 娛樂 活動 所以 行政院 在 評估 是否 讓 彩券 繼續 發行 時 應 多 考慮 彩券 發行 正面 的 效果,29,就業(3846) 機會(81244) 及(304586) 提供(73097) 民眾(17097) 多(318992) 一(3701681) 種(701563) 休閒(5416) 娛樂(8783) 活動(85743) 所以(239080) 行政院(4347) 在(3284238) 評估(16292) 是否(78907) 讓(526314) 彩券(597) 繼續(80649) 發行(12238) 時(623734) 應(82417) 多(318992) 考慮(28774) 彩券(597) 發行(12238) 正面(16915) 的(16029838) 效果(38188),{'High': 29},"{'第5級': 8, '第2級': 3, '第4*級': 3, '第1級': 4, 'Unknown': 5, '第4級': 3, '第1*級': 2, '第3*級': 1}",1,Y,Y,N,N
廖正井又指出，愛心彩券發行又創下許多紀錄，愛心彩券幸運獎開獎，是首度邀請法院監督以確保開獎的公正性，愛心彩券發行締造熱烈銷售的紀錄，第一期彩券六百萬張三天內賣光。,廖正井 又 指出 愛心 彩券 發行 又 創下 許多 紀錄 愛心 彩券 幸運獎 開獎 是 首度 邀請 法院 監督 以 確保 開獎 的 公正性 愛心 彩券 發行 締造 熱烈 銷售 的 紀錄 第一 期 彩券 六百萬 張 三 天 內 賣光,41,廖正井(1) 又(535555) 指出(38456) 愛心(3575) 彩券(597) 發行(12238) 又(535555) 創下(1422) 許多(159791) 紀錄(14233) 愛心(3575) 彩券(597) 幸運獎(Unknown) 開獎(71) 是(4642407) 首度(2350) 邀請(14342) 法院(7533) 監督(7162) 以(547785) 確保(9107) 開獎(71) 的(16029838) 公正性(129) 愛心(3575) 彩券(597) 發行(12238) 締造(1027) 熱烈(5597) 銷售(13314) 的(16029838) 紀錄(14233) 第一(172544) 期(14058) 彩券(597) 六百萬(565) 張(99414) 三(313861) 天(330413) 內(183051) 賣光(231),"{'Low': 4, 'High': 37}","{'Unknown': 15, '第1*級': 3, '第4級': 6, '第5級': 8, '第3*級': 1, '第1級': 5, '第7級': 1, '第2級': 1, '第3級': 1}",4,Y,N,N,Y
第二期彩券二千一百萬張九天內售罄，都是空前絕後的，彩券新聞深受新聞界的注目，所有傳播媒體都把彩券消息做重點新聞處理，不是做為市政版的頭條新聞，就是綜合新聞版或頭版新聞，受重視可見一斑。,第二 期 彩券 二千一百萬 張 九 天 內 售罄 都 是 空前絕後 的 彩券 新聞 深受 新聞界 的 注目 所有 傳播 媒體 都 把 彩券 消息 做 重點 新聞 處理 不 是 做為 市政版 的 頭條 新聞 就 是 綜合 新聞 版 或 頭版 新聞 受 重視 可見一斑,48,第二(98741) 期(14058) 彩券(597) 二千一百萬(51) 張(99414) 九(34506) 天(330413) 內(183051) 售罄(64) 都(1125846) 是(4642407) 空前絕後(448) 的(16029838) 彩券(597) 新聞(40430) 深受(5274) 新聞界(1937) 的(16029838) 注目(1754) 所有(146771) 傳播(18106) 媒體(32308) 都(1125846) 把(617773) 彩券(597) 消息(37528) 做(411649) 重點(22761) 新聞(40430) 處理(61797) 不(2282521) 是(4642407) 做為(19421) 市政版(5) 的(16029838) 頭條(961) 新聞(40430) 就(1737544) 是(4642407) 綜合(8011) 新聞(40430) 版(5085) 或(478077) 頭版(847) 新聞(40430) 受(109982) 重視(23501) 可見一斑(537),"{'High': 45, 'Low': 3}","{'Unknown': 13, '第1*級': 1, '第1級': 13, '第3級': 8, '第7級': 2, '第2級': 2, '第5級': 4, '第4級': 4, '第4*級': 1}",5,Y,Y,N,N
在昨日幸運獎開獎的會場，許多券商要求財政局長廖正井讓彩券繼續發行，廖正井無奈的表示，這要由行政院決定，不過，他希望行政院能多評估彩券帶給社會的正面影響，讓彩券繼續發行。,在 昨日 幸運獎 開獎 的 會場 許多 券商 要求 財政局長 廖正井 讓 彩券 繼續 發行 廖正井 無奈 的 表示 這 要 由 行政院 決定 不過 他 希望 行政院 能 多 評估 彩券 帶給 社會 的 正面 影響 讓 彩券 繼續 發行,41,在(3284238) 昨日(2036) 幸運獎(Unknown) 開獎(71) 的(16029838) 會場(3419) 許多(159791) 券商(202) 要求(71192) 財政局長(13) 廖正井(1) 讓(526314) 彩券(597) 繼續(80649) 發行(12238) 廖正井(1) 無奈(8144) 的(16029838) 表示(74452) 這(2114032) 要(851264) 由(208604) 行政院(4347) 決定(101837) 不過(186226) 他(2487930) 希望(119975) 行政院(4347) 能(582260) 多(318992) 評估(16292) 彩券(597) 帶給(9682) 社會(176660) 的(16029838) 正面(16915) 影響(95840) 讓(526314) 彩券(597) 繼續(80649) 發行(12238),"{'High': 36, 'Low': 5}","{'第1*級': 2, '第5級': 5, 'Unknown': 13, '第1級': 7, '第3*級': 3, '第2級': 5, '第4級': 2, '第6級': 1, '第4*級': 2, '第3級': 1}",6,Y,Y,N,Y
另外，原廣電法第二十五條之電台節目(新聞節目除外)，新聞局均得審查之規定，仍原文原字不漏地出現在廣案中。,另外 原 廣電法 第二十五 條 之 電台 節目 新聞 節目 除外 新聞局 均 得 審查 之 規定 仍 原 文 原 字 不 漏 地 出現 在 廣案 中,29,另外(48233) 原(33852) 廣電法(14) 第二十五(417) 條(115362) 之(875481) 電台(4092) 節目(21445) 新聞(40430) 節目(21445) 除外(945) 新聞局(771) 均(27783) 得(573721) 審查(4808) 之(875481) 規定(24592) 仍(92056) 原(33852) 文(28958) 原(33852) 字(75654) 不(2282521) 漏(2907) 地(754998) 出現(124694) 在(3284238) 廣案(Unknown) 中(1011729),"{'High': 27, 'Low': 2}","{'第3級': 2, 'Unknown': 10, '第2級': 1, '第5級': 3, '第6級': 4, '第4級': 6, '第1級': 2, '第1*級': 1}",3,Y,Y,N,Y
同樣糟糕的是，原廣電法第二十一條有關節目內容不得損害國家利益。,同樣 糟糕 的 是 原 廣電法 第二十一 條 有關 節目 內容 不得 損害 國家 利益,15,同樣(63568) 糟糕(7026) 的(16029838) 是(4642407) 原(33852) 廣電法(14) 第二十一(610) 條(115362) 有關(69607) 節目(21445) 內容(55074) 不得(14941) 損害(4340) 國家(109166) 利益(25126),"{'High': 14, 'Low': 1}","{'第3*級': 1, '第5級': 2, '第1級': 2, 'Unknown': 4, '第2級': 1, '第4級': 3, '第6級': 1, '第1*級': 1}",2,Y,N,N,N
違背反共復國國策。,違背 反共 復國 國策,4,違背(4150) 反共(1509) 復國(597) 國策(737),{'High': 4},"{'第6級': 1, 'Unknown': 3}",0,Y,N,N,N
煽惑他人犯罪。,煽惑 他人 犯罪,3,煽惑(154) 他人(35197) 犯罪(11684),{'High': 3},"{'Unknown': 1, '第5級': 1, '第4*級': 1}",0,Y,N,N,N
妨害公共秩序或善良風俗。,妨害 公共 秩序 或 善良 風俗,6,妨害(646) 公共(16088) 秩序(13855) 或(478077) 善良(6489) 風俗(4270),{'High': 6},"{'Unknown': 1, '第4級': 1, '第5級': 3, '第3級': 1}",0,Y,Y,N,N
淆亂視聽等規定，除了違背反共復國國策刪除，改為違反三民主義國策外，其餘均原文原字不漏地移植到廣案中。,淆亂 視聽 等 規定 除了 違背 反共 復國 國策 刪除 改為 違反 三民主義 國策 外 其餘 均 原 文 原 字 不 漏 地 移植到 廣案 中,27,淆亂(43) 視聽(1309) 等(327380) 規定(24592) 除了(75964) 違背(4150) 反共(1509) 復國(597) 國策(737) 刪除(1983) 改為(6294) 違反(6717) 三民主義(711) 國策(737) 外(109310) 其餘(8181) 均(27783) 原(33852) 文(28958) 原(33852) 字(75654) 不(2282521) 漏(2907) 地(754998) 移植到(367) 廣案(Unknown) 中(1011729),"{'Low': 2, 'High': 25}","{'Unknown': 13, '第6級': 6, '第3*級': 2, '第4級': 2, '第1級': 3, '第5級': 1}",2,Y,Y,N,Y
據瞭解，現在修法小組針對新聞局所提之廣案，完成討論修訂之條文已過半。,據 瞭解 現在 修 法 小組 針對 新聞局 所 提 之 廣案 完成 討論 修訂 之 條文 已 過半,19,據(24392) 瞭解(28366) 現在(218744) 修(13968) 法(40998) 小組(12825) 針對(23174) 新聞局(771) 所(527327) 提(33635) 之(875481) 廣案(Unknown) 完成(60471) 討論(59041) 修訂(2313) 之(875481) 條文(1949) 已(215610) 過半(636),"{'High': 18, 'Low': 1}","{'第4*級': 2, '第3*級': 2, '第1級': 1, '第4級': 1, 'Unknown': 4, '第5級': 3, '第6級': 2, '第2級': 1, '第3級': 2, '第7級': 1}",1,Y,N,N,Y
在有關節目內容規範之討論條文時，小組成員雖有歧見，但最終仍以廣案之原文為依歸，修正幅度很小。,在 有關 節目 內容 規範 之 討論 條文 時 小組 成員 雖 有 歧見 但 最終 仍 以 廣案 之 原 文 為 依歸 修正 幅度 很 小,28,在(3284238) 有關(69607) 節目(21445) 內容(55074) 規範(12166) 之(875481) 討論(59041) 條文(1949) 時(623734) 小組(12825) 成員(25071) 雖(48164) 有(2217079) 歧見(620) 但(597124) 最終(18102) 仍(92056) 以(547785) 廣案(Unknown) 之(875481) 原(33852) 文(28958) 為(761341) 依歸(675) 修正(8173) 幅度(1908) 很(715675) 小(318835),"{'High': 27, 'Low': 1}","{'第1*級': 1, '第4級': 5, '第6級': 2, '第5級': 7, '第3*級': 2, '第7級': 2, '第2級': 2, '第1級': 3, 'Unknown': 4}",0,Y,Y,N,Y
由以上說明可知，原廣電法中，將廣電媒體政治工具化，以及侵害箝制媒體表達。,由 以上 說明 可 知 原 廣電法 中 將 廣電 媒體 政治 工具化 以及 侵害 箝制 媒體 表達,18,由(208604) 以上(36569) 說明(52918) 可(307359) 知(108500) 原(33852) 廣電法(14) 中(1011729) 將(448374) 廣電(563) 媒體(32308) 政治(79504) 工具化(77) 以及(155624) 侵害(1865) 箝制(509) 媒體(32308) 表達(34582),"{'High': 16, 'Low': 2}","{'第4*級': 3, '第3*級': 1, '第4級': 4, 'Unknown': 7, '第5級': 2, '第6級': 1}",2,Y,Y,N,N
言論自由之事先審查制與模糊的意識規範限制，仍然繼續在廣案中保留小部分，甚至賦予行政管理機構更大的解釋彈性。,言論 自由 之 事先 審查 制 與 模糊 的 意識 規範 限制 仍然 繼續 在 廣案 中 保留 小 部分 甚至 賦予 行政 管理 機構 更 大 的 解釋 彈性,30,言論(6961) 自由(56360) 之(875481) 事先(9723) 審查(4808) 制(6066) 與(968432) 模糊(11070) 的(16029838) 意識(49648) 規範(12166) 限制(23094) 仍然(46200) 繼續(80649) 在(3284238) 廣案(Unknown) 中(1011729) 保留(11400) 小(318835) 部分(82518) 甚至(122502) 賦予(8248) 行政(15666) 管理(54484) 機構(24025) 更(361676) 大(525780) 的(16029838) 解釋(59761) 彈性(8540),"{'High': 29, 'Low': 1}","{'第5級': 9, '第3*級': 1, '第6級': 3, 'Unknown': 4, '第4*級': 4, '第1級': 4, '第4級': 3, '第1*級': 1, '第2級': 1}",0,Y,Y,N,N
即使讓時光回到民國六十五年或七十一年來檢視初訂或修訂之廣電法，有些有關節目內容之規範，在當時已屬荒謬；現在距解嚴已過三年半，環境不變，印刷媒體在變，而新聞局所提的廣案卻仍在緊要處，以不變應萬變，在原地踏步，直不知今夕是何夕。,即使 讓 時光 回到 民國 六十五年 或 七十一年 來 檢視 初 訂 或 修訂 之 廣電法 有 些 有關 節目 內容 之 規範 在 當時 已 屬 荒謬 現在 距 解嚴 已 過 三 年 半 環境 不變 印刷 媒體 在 變 而 新聞局 所 提 的 廣案 卻 仍 在 緊要 處 以 不變 應 萬變 在 原地 踏步 直 不 知 今夕 是 何 夕,67,即使(68376) 讓(526314) 時光(10444) 回到(60084) 民國(16130) 六十五年(114) 或(478077) 七十一年(135) 來(742183) 檢視(9862) 初(42087) 訂(5702) 或(478077) 修訂(2313) 之(875481) 廣電法(14) 有(2217079) 些(159879) 有關(69607) 節目(21445) 內容(55074) 之(875481) 規範(12166) 在(3284238) 當時(126214) 已(215610) 屬(26012) 荒謬(5026) 現在(218744) 距(4162) 解嚴(692) 已(215610) 過(412878) 三(313861) 年(514736) 半(80813) 環境(71054) 不變(7246) 印刷(5209) 媒體(32308) 在(3284238) 變(80345) 而(937923) 新聞局(771) 所(527327) 提(33635) 的(16029838) 廣案(Unknown) 卻(333007) 仍(92056) 在(3284238) 緊要(1347) 處(84410) 以(547785) 不變(7246) 應(82417) 萬變(279) 在(3284238) 原地(3850) 踏步(994) 直(32801) 不(2282521) 知(108500) 今夕(169) 是(4642407) 何(46992) 夕(2707),"{'High': 65, 'Low': 2}","{'第4*級': 1, '第2級': 4, '第5級': 6, 'Unknown': 17, '第3級': 7, '第1級': 9, '第6級': 8, '第4級': 9, '第1*級': 5, '第3*級': 1}",4,Y,Y,N,N
