sentence,sentence_preprocessed,sentence_length,word_freq,high_low_freq,word_level,long_word_count,is_complete_sentence,is_complete_context,is_blacklist,is_greylist
像身為運送大使的欣航一號輪，船長四十九公尺，寬八公尺餘，吃水量約三點四公尺，恰可容六個貨櫃，目前已改裝為雙殼船。,像 身為 運送 大使 的 欣航 一 號 輪 船 長 四十九 公尺 寬 八 公尺 餘 吃水量 約 三點四 公尺 恰 可 容 六 個 貨櫃 目前 已 改裝為 雙 殼 船,33,像(289494) 身為(18072) 運送(2760) 大使(3149) 的(16029838) 欣航(Unknown) 一(3701681) 號(26108) 輪(7476) 船(45130) 長(107092) 四十九(986) 公尺(19233) 寬(12844) 八(54961) 公尺(19233) 餘(3781) 吃水量(7) 約(47731) 三點四(19) 公尺(19233) 恰(2235) 可(307359) 容(3650) 六(77936) 個(2296574) 貨櫃(732) 目前(48695) 已(215610) 改裝為(22) 雙(19548) 殼(4344) 船(45130),"{'High': 29, 'Low': 4}","{'第1*級': 1, '第6級': 3, '第5級': 3, '第1級': 5, 'Unknown': 10, '第3級': 3, '第4級': 5, '第3*級': 1, '第4*級': 1, '第2級': 1}",4,Y,N,N,N
而六個特製貨櫃均長四點六八公尺。,而 六 個 特製 貨櫃 均 長 四點六八 公尺,9,而(937923) 六(77936) 個(2296574) 特製(1000) 貨櫃(732) 均(27783) 長(107092) 四點六八(Unknown) 公尺(19233),"{'High': 8, 'Low': 1}","{'第5級': 1, '第1級': 2, 'Unknown': 4, '第6級': 1, '第4級': 1}",1,Y,Y,N,N
寬三點二八公尺。,寬 三點二八 公尺,3,寬(12844) 三點二八(Unknown) 公尺(19233),"{'High': 2, 'Low': 1}","{'第4級': 2, 'Unknown': 1}",1,Y,N,N,N
高二點一二公尺，四面鋼板厚卅八公釐，上下底板厚廿五公釐，且經改善，四面及頂部鋼板內再加十八公釐的厚鋼板，必要時還可於外加十八至廿公釐左右的厚鋼板。,高 二點一二 公尺 四 面 鋼板 厚 卅八 公釐 上下 底板 厚 廿五 公釐 且 經 改善 四面 及 頂部 鋼板 內 再 加 十八 公釐 的 厚 鋼板 必要 時 還 可 於 外 加 十八 至 廿 公釐 左右 的 厚 鋼板,44,高(128858) 二點一二(Unknown) 公尺(19233) 四(141667) 面(39563) 鋼板(254) 厚(9144) 卅八(33) 公釐(1034) 上下(11503) 底板(108) 厚(9144) 廿五(244) 公釐(1034) 且(67015) 經(38471) 改善(21559) 四面(2143) 及(304586) 頂部(747) 鋼板(254) 內(183051) 再(326207) 加(28242) 十八(13604) 公釐(1034) 的(16029838) 厚(9144) 鋼板(254) 必要(29889) 時(623734) 還(625086) 可(307359) 於(327210) 外(109310) 加(28242) 十八(13604) 至(101530) 廿(542) 公釐(1034) 左右(33714) 的(16029838) 厚(9144) 鋼板(254),"{'High': 42, 'Low': 2}","{'第1級': 5, 'Unknown': 19, '第4級': 6, '第4*級': 3, '第5級': 4, '第3級': 2, '第1*級': 1, '第2級': 2, '第3*級': 2}",1,Y,Y,N,N
裝櫃後，貨櫃表面暴露率在距離二公尺處為十4801，符合規定。,裝櫃 後 貨櫃 表面 暴露率 在 距離 二 公尺 處 為 十 4801 符合 規定,15,裝櫃(5) 後(422857) 貨櫃(732) 表面(20092) 暴露率(Unknown) 在(3284238) 距離(27644) 二(152494) 公尺(19233) 處(84410) 為(761341) 十(77415) 4801(Unknown) 符合(19232) 規定(24592),"{'Low': 3, 'High': 12}","{'Unknown': 6, '第1級': 3, '第4*級': 1, '第1*級': 1, '第4級': 3, '第5級': 1}",2,Y,N,N,N
核廢料桶表面暴露率亦未超過二千，符合蘭嶼貯存場要求。,核 廢料 桶 表面 暴露率 亦 未 超過 二千 符合 蘭嶼 貯存場 要求,13,核(3479) 廢料(450) 桶(3919) 表面(20092) 暴露率(Unknown) 亦(68507) 未(101927) 超過(30507) 二千(2163) 符合(19232) 蘭嶼(1584) 貯存場(9) 要求(71192),"{'High': 11, 'Low': 2}","{'第6級': 2, 'Unknown': 5, '第5級': 3, '第4*級': 1, '第4級': 1, '第3*級': 1}",2,Y,N,N,N
高雄縣政府配合執行當局嚴禁十八歲以下青少年進入電動遊藝場的政策，連日來會同警方全力視察電動玩具店。,高雄縣 政府 配合 執行 當局 嚴禁 十八 歲 以下 青少年 進入 電動 遊藝場 的 政策 連日 來 會同 警方 全 力 視察 電動 玩具 店,25,高雄縣(866) 政府(92663) 配合(17173) 執行(25364) 當局(8761) 嚴禁(1454) 十八(13604) 歲(130085) 以下(29388) 青少年(16159) 進入(66885) 電動(1893) 遊藝場(19) 的(16029838) 政策(30965) 連日(713) 來(742183) 會同(1413) 警方(8008) 全(178642) 力(13779) 視察(1881) 電動(1893) 玩具(10102) 店(17690),"{'High': 24, 'Low': 1}","{'Unknown': 6, '第4級': 4, '第4*級': 2, '第5級': 4, '第1級': 3, '第3*級': 1, '第7級': 3, '第2級': 1, '第1*級': 1}",3,Y,N,N,N
部份業者事先不知狀況，仍然擺設賭博性電動玩具，都被警方抄獲，高縣警方並決定發動全面性的掃蕩行動。,部份 業者 事先 不 知 狀況 仍然 擺設 賭博性 電動 玩具 都 被 警方 抄獲 高縣 警方 並 決定 發動 全面性 的 掃蕩 行動,24,部份(11022) 業者(6857) 事先(9723) 不(2282521) 知(108500) 狀況(44199) 仍然(46200) 擺設(1977) 賭博性(11) 電動(1893) 玩具(10102) 都(1125846) 被(540683) 警方(8008) 抄獲(6) 高縣(24) 警方(8008) 並(442790) 決定(101837) 發動(12446) 全面性(1171) 的(16029838) 掃蕩(748) 行動(69326),"{'High': 21, 'Low': 3}","{'第2級': 3, 'Unknown': 8, '第5級': 5, '第1級': 3, '第4級': 2, '第6級': 1, '第4*級': 1, '第7級': 1}",2,Y,Y,N,N
教育部規定十八歲以下的青少年，不准進入電動玩具店的政策一訂，部分經營賭博性玩具的業者將鐵門關上，繼續營業，也有一些業者為度過危險時期，暫時將賭博性電動玩具收藏起來，只有少數業者平日不關心當局政策，在毫不知情的狀況下，仍然持續經營。,教育部 規定 十八 歲 以下 的 青少年 不准 進入 電動 玩具 店 的 政策 一 訂 部分 經營 賭博性 玩具 的 業者 將 鐵門 關上 繼續 營業 也 有 一些 業者 為 度過 危險 時期 暫時 將 賭博性 電動 玩具 收藏 起來 只有 少數 業者 平日 不 關心 當局 政策 在 毫不 知情 的 狀況 下 仍然 持續 經營,59,教育部(3240) 規定(24592) 十八(13604) 歲(130085) 以下(29388) 的(16029838) 青少年(16159) 不准(8704) 進入(66885) 電動(1893) 玩具(10102) 店(17690) 的(16029838) 政策(30965) 一(3701681) 訂(5702) 部分(82518) 經營(39913) 賭博性(11) 玩具(10102) 的(16029838) 業者(6857) 將(448374) 鐵門(995) 關上(6449) 繼續(80649) 營業(4800) 也(1590760) 有(2217079) 一些(156929) 業者(6857) 為(761341) 度過(9438) 危險(30190) 時期(47839) 暫時(14976) 將(448374) 賭博性(11) 電動(1893) 玩具(10102) 收藏(6907) 起來(110738) 只有(43745) 少數(17629) 業者(6857) 平日(6274) 不(2282521) 關心(22258) 當局(8761) 政策(30965) 在(3284238) 毫不(14921) 知情(3919) 的(16029838) 狀況(44199) 下(329549) 仍然(46200) 持續(33796) 經營(39913),"{'High': 57, 'Low': 2}","{'第5級': 11, '第4級': 10, 'Unknown': 12, '第1級': 9, '第3*級': 1, '第1*級': 5, '第4*級': 6, '第3級': 3, '第2級': 1, '第6級': 1}",4,Y,N,N,N
最近幾天，高雄縣政府聯合檢查小組在縣警局行政課人員的會同下，一連幾次視察縣內電動玩具店，除發現有十八歲以下青少年涉足遊藝場所外，會同的警方人員則藉機抄獲不少賭博性電動玩具。,最近 幾 天 高雄縣 政府 聯合 檢查 小組 在 縣 警局 行政課 人員 的 會同 下 一連 幾 次 視察 縣 內 電動 玩具 店 除 發現 有 十八 歲 以下 青少年 涉足 遊藝 場所 外 會同 的 警方 人員 則 藉機 抄獲 不少 賭博性 電動 玩具,47,最近(30174) 幾(229415) 天(330413) 高雄縣(866) 政府(92663) 聯合(10911) 檢查(21295) 小組(12825) 在(3284238) 縣(9693) 警局(1366) 行政課(Unknown) 人員(49261) 的(16029838) 會同(1413) 下(329549) 一連(2950) 幾(229415) 次(331701) 視察(1881) 縣(9693) 內(183051) 電動(1893) 玩具(10102) 店(17690) 除(15929) 發現(175233) 有(2217079) 十八(13604) 歲(130085) 以下(29388) 青少年(16159) 涉足(810) 遊藝(125) 場所(8263) 外(109310) 會同(1413) 的(16029838) 警方(8008) 人員(49261) 則(254096) 藉機(1064) 抄獲(6) 不少(35256) 賭博性(11) 電動(1893) 玩具(10102),"{'High': 44, 'Low': 3}","{'第2級': 3, '第1級': 8, 'Unknown': 10, '第4級': 5, '第5級': 11, '第1*級': 3, '第7級': 3, '第3級': 1, '第3*級': 2, '第6級': 1}",4,Y,N,N,N
據了解，最近期間被警方抄獲賭博性電動玩具的情況，以鳳山地區最嚴重，市區中華市場內一家遊藝場，即在教育部政策公佈隔天被查獲一具廿一點與四台麻將等賭博性電動玩具店。,據了解 最近 期間 被 警方 抄獲 賭博性 電動 玩具 的 情況 以 鳳山 地區 最 嚴重 市區 中華 市場 內 一 家 遊藝場 即 在 教育部 政策 公佈 隔天 被 查獲 一 具 廿一點 與 四 台 麻將 等 賭博性 電動 玩具 店,43,據了解(263) 最近(30174) 期間(32981) 被(540683) 警方(8008) 抄獲(6) 賭博性(11) 電動(1893) 玩具(10102) 的(16029838) 情況(92301) 以(547785) 鳳山(1083) 地區(40339) 最(421680) 嚴重(39284) 市區(3749) 中華(8450) 市場(65023) 內(183051) 一(3701681) 家(236822) 遊藝場(19) 即(110826) 在(3284238) 教育部(3240) 政策(30965) 公佈(1798) 隔天(6370) 被(540683) 查獲(259) 一(3701681) 具(41661) 廿一點(1) 與(968432) 四(141667) 台(29325) 麻將(739) 等(327380) 賭博性(11) 電動(1893) 玩具(10102) 店(17690),"{'High': 38, 'Low': 5}","{'Unknown': 11, '第2級': 5, '第4*級': 3, '第5級': 6, '第4級': 4, '第1級': 5, '第1*級': 3, '第3*級': 3, '第3級': 1, '第6級': 2}",6,Y,Y,N,N
曾在緝私任務有過輝煌成果的海獅營區八艘緝私艇，由於自解嚴後，該營區已由隸屬警總改編為海軍，如今已是英雄無用武之地，民眾對有關單位未加以善用而感到可惜。,曾 在 緝私 任務 有 過 輝煌 成果 的 海獅 營區 八 艘 緝私艇 由於 自 解嚴 後 該 營區 已 由 隸屬 警總 改編為 海軍 如今 已 是 英雄 無 用武之地 民眾 對 有關 單位 未 加以 善用 而 感到 可惜,42,曾(132981) 在(3284238) 緝私(44) 任務(25232) 有(2217079) 過(412878) 輝煌(3594) 成果(16253) 的(16029838) 海獅(87) 營區(1825) 八(54961) 艘(13569) 緝私艇(Unknown) 由於(88111) 自(59676) 解嚴(692) 後(422857) 該(148369) 營區(1825) 已(215610) 由(208604) 隸屬(1299) 警總(217) 改編為(329) 海軍(8206) 如今(29812) 已(215610) 是(4642407) 英雄(22678) 無(157858) 用武之地(555) 民眾(17097) 對(897964) 有關(69607) 單位(23148) 未(101927) 加以(25724) 善用(4000) 而(937923) 感到(74094) 可惜(16141),"{'High': 39, 'Low': 3}","{'第4級': 4, '第1*級': 2, 'Unknown': 9, '第4*級': 7, '第1級': 6, '第6級': 4, '第5級': 6, '第3級': 2, '第7級': 1, '第3*級': 1}",3,Y,Y,N,N
原屬於警備總部的海獅營區坐落在布袋鎮嘉義區漁會右側，由於該營區擁有八艘緝私艇，其中兩艘各配有二副二百匹馬力的船外機，速度驚人，因而在各項緝私任務中屢創佳績，也使得私梟聞風喪膽。,原 屬於 警備總部 的 海獅 營區 坐落 在 布袋鎮 嘉義區 漁會 右側 由於 該 營區 擁有 八 艘 緝私艇 其中 兩 艘 各 配有 二 副 二百 匹 馬力 的 船外機 速度 驚人 因而 在 各 項 緝私 任務 中 屢 創 佳績 也 使得 私梟 聞風 喪膽,48,原(33852) 屬於(39478) 警備總部(197) 的(16029838) 海獅(87) 營區(1825) 坐落(1290) 在(3284238) 布袋鎮(7) 嘉義區(2) 漁會(87) 右側(1807) 由於(88111) 該(148369) 營區(1825) 擁有(55809) 八(54961) 艘(13569) 緝私艇(Unknown) 其中(95627) 兩(526190) 艘(13569) 各(243023) 配有(452) 二(152494) 副(21458) 二百(3266) 匹(10062) 馬力(974) 的(16029838) 船外機(Unknown) 速度(26646) 驚人(10649) 因而(29060) 在(3284238) 各(243023) 項(88887) 緝私(44) 任務(25232) 中(1011729) 屢(4066) 創(5368) 佳績(470) 也(1590760) 使得(30960) 私梟(17) 聞風(350) 喪膽(223),"{'High': 40, 'Low': 8}","{'Unknown': 22, '第5級': 9, '第1級': 6, '第6級': 1, '第1*級': 2, '第4*級': 3, '第3*級': 2, '第2級': 2, '第7級': 1}",5,Y,Y,N,N
自戒嚴法解除後，海獅營區改編為海軍，住在該營區的排隊移到附近另一個營區，如今營區人去樓空成為海軍的倉庫，雖然這八艘緝私艇也已完成點交，但迄今仍棄置在營區而無人問津。,自 戒嚴法 解除 後 海獅 營區 改編為 海軍 住 在 該 營區 的 排 隊 移到 附近 另 一 個 營區 如今 營區 人去樓空 成為 海軍 的 倉庫 雖然 這 八 艘 緝私艇 也 已 完成 點交 但 迄 今 仍 棄置 在 營區 而 無 人 問津,48,自(59676) 戒嚴法(102) 解除(6448) 後(422857) 海獅(87) 營區(1825) 改編為(329) 海軍(8206) 住(69815) 在(3284238) 該(148369) 營區(1825) 的(16029838) 排(16810) 隊(7801) 移到(3157) 附近(32204) 另(138369) 一(3701681) 個(2296574) 營區(1825) 如今(29812) 營區(1825) 人去樓空(183) 成為(143834) 海軍(8206) 的(16029838) 倉庫(4239) 雖然(152988) 這(2114032) 八(54961) 艘(13569) 緝私艇(Unknown) 也(1590760) 已(215610) 完成(60471) 點交(15) 但(597124) 迄(3998) 今(33635) 仍(92056) 棄置(733) 在(3284238) 營區(1825) 而(937923) 無(157858) 人(1550512) 問津(260),"{'High': 45, 'Low': 3}","{'第5級': 7, 'Unknown': 15, '第1級': 9, '第6級': 3, '第1*級': 4, '第4*級': 3, '第4級': 3, '第3級': 2, '第2級': 2}",4,Y,Y,N,N
據一位自稱曾服役海獅營區的布袋鎮民表示，這八艘緝私艇因時速奇佳，在海上執行勤務確實是銳不可當的交通工具，雖然目前已飽受風吹雨打，但如經一番整修之後，仍能在緝私任務中展現昔日的雄風。,據 一 位 自稱 曾 服役 海獅 營區 的 布袋 鎮民 表示 這 八 艘 緝私艇 因 時速 奇 佳 在 海 上 執行 勤務 確實 是 銳不可當 的 交通 工具 雖然 目前 已 飽受 風吹雨打 但 如 經 一 番 整修 之後 仍 能 在 緝私 任務 中 展現 昔日 的 雄風,53,據(24392) 一(3701681) 位(284809) 自稱(6297) 曾(132981) 服役(1660) 海獅(87) 營區(1825) 的(16029838) 布袋(1182) 鎮民(604) 表示(74452) 這(2114032) 八(54961) 艘(13569) 緝私艇(Unknown) 因(119364) 時速(1960) 奇(11637) 佳(8331) 在(3284238) 海(33696) 上(1233218) 執行(25364) 勤務(371) 確實(36977) 是(4642407) 銳不可當(148) 的(16029838) 交通(11639) 工具(26319) 雖然(152988) 目前(48695) 已(215610) 飽受(2261) 風吹雨打(237) 但(597124) 如(195069) 經(38471) 一(3701681) 番(30293) 整修(1502) 之後(190467) 仍(92056) 能(582260) 在(3284238) 緝私(44) 任務(25232) 中(1011729) 展現(15289) 昔日(4668) 的(16029838) 雄風(403),"{'High': 50, 'Low': 3}","{'第4*級': 3, '第1級': 10, '第5級': 7, '第4級': 5, '第7級': 1, 'Unknown': 15, '第1*級': 3, '第2級': 3, '第3級': 2, '第6級': 4}",3,Y,Y,N,N
崁頂鄉長王龍興及鄉代會主席謝慶忠等廿餘人，為爭取行經該鄉境的南二高能增設交流道或闢建出引道，昨日上午前往國民黨縣黨部拜訪主委陳泰一，希望能代向上級單位陳情爭取，以利地方發展。,崁頂 鄉長 王龍興 及 鄉代會 主席 謝慶忠 等 廿餘 人 為 爭取 行經 該 鄉 境 的 南二高 能 增設 交流道 或 闢建出 引道 昨日 上午 前往 國民黨 縣 黨部 拜訪 主委 陳泰一 希望 能 代 向 上級 單位 陳情 爭取 以利 地方 發展,44,崁頂(31) 鄉長(353) 王龍興(Unknown) 及(304586) 鄉代會(2) 主席(9526) 謝慶忠(Unknown) 等(327380) 廿餘(34) 人(1550512) 為(761341) 爭取(9666) 行經(1016) 該(148369) 鄉(5809) 境(15223) 的(16029838) 南二高(10) 能(582260) 增設(754) 交流道(913) 或(478077) 闢建出(5) 引道(62) 昨日(2036) 上午(6241) 前往(27321) 國民黨(11621) 縣(9693) 黨部(719) 拜訪(9919) 主委(1067) 陳泰一(2) 希望(119975) 能(582260) 代(39507) 向(231672) 上級(2841) 單位(23148) 陳情(493) 爭取(9666) 以利(1373) 地方(139164) 發展(117494),"{'Low': 9, 'High': 35}","{'Unknown': 20, '第5級': 9, '第3*級': 1, '第1級': 3, '第4*級': 2, '第1*級': 3, '第3級': 1, '第2級': 2, '第4級': 2, '第6級': 1}",8,Y,Y,N,Y
陳泰一要求該鄉先提出具體評估資料，然後將專案轉呈上級單位。,陳泰一 要求 該 鄉 先 提出 具體 評估 資料 然後 將 專案 轉呈 上級 單位,15,陳泰一(2) 要求(71192) 該(148369) 鄉(5809) 先(136649) 提出(63073) 具體(20349) 評估(16292) 資料(52866) 然後(156193) 將(448374) 專案(4937) 轉呈(151) 上級(2841) 單位(23148),"{'Low': 1, 'High': 14}","{'Unknown': 3, '第3*級': 1, '第4*級': 2, '第5級': 4, '第1*級': 2, '第3級': 1, '第6級': 2}",1,Y,N,N,Y
昨日上午九時卅分許，崁頂鄉長王龍興。,昨日 上午 九時 卅分 許 崁頂 鄉長 王龍興,8,昨日(2036) 上午(6241) 九時(372) 卅分(29) 許(6172) 崁頂(31) 鄉長(353) 王龍興(Unknown),"{'High': 5, 'Low': 3}","{'第5級': 1, '第1級': 1, 'Unknown': 5, '第6級': 1}",1,N,N,N,Y
鄉代會主席謝慶忠及鄉農會總幹事王英任等廿餘位鄉民，為爭取已規劃行經該鄉境的南二高，能在鄉內增設交流道或便捷的進出交流引道，前往縣黨部拜會，由主委陳泰一及副主委張河川。,鄉代會 主席 謝慶忠 及 鄉 農會 總幹事 王英任 等 廿餘 位 鄉民 為 爭取 已 規劃 行經 該 鄉 境 的 南二高 能 在 鄉 內 增設 交流道 或 便捷 的 進出 交流 引道 前往 縣 黨部 拜會 由 主委 陳泰一 及 副主委 張河川,44,鄉代會(2) 主席(9526) 謝慶忠(Unknown) 及(304586) 鄉(5809) 農會(494) 總幹事(582) 王英任(Unknown) 等(327380) 廿餘(34) 位(284809) 鄉民(882) 為(761341) 爭取(9666) 已(215610) 規劃(14663) 行經(1016) 該(148369) 鄉(5809) 境(15223) 的(16029838) 南二高(10) 能(582260) 在(3284238) 鄉(5809) 內(183051) 增設(754) 交流道(913) 或(478077) 便捷(519) 的(16029838) 進出(3148) 交流(10657) 引道(62) 前往(27321) 縣(9693) 黨部(719) 拜會(626) 由(208604) 主委(1067) 陳泰一(2) 及(304586) 副主委(253) 張河川(Unknown),"{'Low': 8, 'High': 36}","{'Unknown': 20, '第5級': 9, '第3*級': 1, '第1級': 3, '第6級': 2, '第3級': 3, '第4*級': 3, '第1*級': 2, '第7級': 1}",9,Y,Y,N,Y
曾永權等接見，隨即在黨部內舉行座談會。,曾永權 等 接見 隨即 在 黨部 內 舉行 座談會,9,曾永權(2) 等(327380) 接見(2516) 隨即(10199) 在(3284238) 黨部(719) 內(183051) 舉行(17660) 座談會(1748),"{'Low': 1, 'High': 8}","{'Unknown': 3, '第3*級': 1, '第6級': 2, '第1*級': 1, '第3級': 1, '第4級': 1}",2,Y,Y,N,Y
王龍興鄉長在會中指出，南二高行經崁頂鄉部份，全無規劃交流道或便捷引道，勢將嚴重影響該鄉的繁榮與發展，因此，陳思縣黨部能鼎力協助爭取設立。,王龍興 鄉長 在 會 中 指出 南二高 行經 崁頂鄉 部份 全無 規劃 交流道 或 便捷 引道 勢將 嚴重 影響 該 鄉 的 繁榮 與 發展 因此 陳 思 縣 黨部 能 鼎力 協助 爭取 設立,35,王龍興(Unknown) 鄉長(353) 在(3284238) 會(1014977) 中(1011729) 指出(38456) 南二高(10) 行經(1016) 崁頂鄉(2) 部份(11022) 全無(2172) 規劃(14663) 交流道(913) 或(478077) 便捷(519) 引道(62) 勢將(777) 嚴重(39284) 影響(95840) 該(148369) 鄉(5809) 的(16029838) 繁榮(4568) 與(968432) 發展(117494) 因此(184606) 陳(10579) 思(9444) 縣(9693) 黨部(719) 能(582260) 鼎力(404) 協助(28701) 爭取(9666) 設立(12114),"{'Low': 4, 'High': 31}","{'Unknown': 16, '第1*級': 3, '第2級': 1, '第6級': 1, '第3級': 2, '第3*級': 1, '第4*級': 4, '第5級': 5, '第1級': 1, '第4級': 1}",4,Y,Y,N,Y
而鄉農會總幹事王英任亦表示，規劃中的南州交流道已定案，那麼為了地區的整體發展，希望國道局能採納地方民意，設立便捷進出引道，就如同中山高速公路九如進出引道一樣，以利地方交通與發展。,而 鄉 農會 總幹事 王英任 亦 表示 規劃 中 的 南州 交流道 已 定案 那麼 為 了 地區 的 整體 發展 希望 國道局 能 採納 地方 民意 設立 便捷 進出 引道 就 如同 中山 高速 公路 九如 進出 引道 一樣 以利 地方 交通 與 發展,45,而(937923) 鄉(5809) 農會(494) 總幹事(582) 王英任(Unknown) 亦(68507) 表示(74452) 規劃(14663) 中(1011729) 的(16029838) 南州(45) 交流道(913) 已(215610) 定案(714) 那麼(127785) 為(761341) 了(3199291) 地區(40339) 的(16029838) 整體(19788) 發展(117494) 希望(119975) 國道局(Unknown) 能(582260) 採納(2720) 地方(139164) 民意(4069) 設立(12114) 便捷(519) 進出(3148) 引道(62) 就(1737544) 如同(24070) 中山(2828) 高速(4778) 公路(7300) 九如(26) 進出(3148) 引道(62) 一樣(188109) 以利(1373) 地方(139164) 交通(11639) 與(968432) 發展(117494),"{'High': 39, 'Low': 6}","{'第5級': 4, 'Unknown': 17, '第6級': 4, '第4*級': 4, '第1級': 3, '第3級': 2, '第7級': 1, '第2級': 2, '第4級': 3, '第1*級': 4, '第3*級': 1}",4,Y,Y,N,Y
另，若南州交流道的土地有困難或其他因素，無法設立的話，有關單位就應該考慮設在崁頂鄉，而該鄉亦會當仁不讓地極力爭取配合。,另 若 南州 交流道 的 土地 有 困難 或 其他 因素 無法 設立 的話 有關 單位 就 應該 考慮 設 在 崁頂鄉 而 該 鄉 亦 會 當仁不讓 地 極力 爭取 配合,32,另(138369) 若(92766) 南州(45) 交流道(913) 的(16029838) 土地(32151) 有(2217079) 困難(37504) 或(478077) 其他(189445) 因素(34409) 無法(150606) 設立(12114) 的話(72341) 有關(69607) 單位(23148) 就(1737544) 應該(165478) 考慮(28774) 設(17537) 在(3284238) 崁頂鄉(2) 而(937923) 該(148369) 鄉(5809) 亦(68507) 會(1014977) 當仁不讓(192) 地(754998) 極力(5116) 爭取(9666) 配合(17173),"{'High': 30, 'Low': 2}","{'第3級': 2, 'Unknown': 8, '第1級': 3, '第4級': 3, '第3*級': 1, '第2級': 1, '第4*級': 3, '第5級': 6, '第1*級': 3, '第6級': 2}",3,Y,Y,N,N
縣黨部主委陳泰一總結指出，南二高行經路線目前只是初步規劃，尚未作最後定案，至於經過屏東路線而在南州設立交流道情事，該地區鄰近鄉鎮應考量地區的均衡發展，彼此尋求共同利益之所在，同一目標聯合爭取。,縣 黨部 主委 陳泰一 總結 指出 南二高 行經 路線 目前 只是 初步 規劃 尚未 作 最後 定案 至於 經過 屏東 路線 而 在 南州 設立 交流道 情事 該 地區 鄰近 鄉鎮 應 考量 地區 的 均衡 發展 彼此 尋求 共同 利益 之 所在 同 一 目標 聯合 爭取,48,縣(9693) 黨部(719) 主委(1067) 陳泰一(2) 總結(4512) 指出(38456) 南二高(10) 行經(1016) 路線(9508) 目前(48695) 只是(96536) 初步(3730) 規劃(14663) 尚未(16593) 作(78184) 最後(142102) 定案(714) 至於(39363) 經過(64617) 屏東(1874) 路線(9508) 而(937923) 在(3284238) 南州(45) 設立(12114) 交流道(913) 情事(1210) 該(148369) 地區(40339) 鄰近(3581) 鄉鎮(1654) 應(82417) 考量(9481) 地區(40339) 的(16029838) 均衡(3808) 發展(117494) 彼此(39449) 尋求(14747) 共同(36636) 利益(25126) 之(875481) 所在(13079) 同(102917) 一(3701681) 目標(62638) 聯合(10911) 爭取(9666),"{'High': 45, 'Low': 3}","{'第5級': 12, 'Unknown': 14, '第6級': 5, '第4級': 9, '第2級': 2, '第7級': 2, '第1*級': 1, '第4*級': 1, '第1級': 2}",3,Y,Y,N,Y
同時，為爭取設立交流道或進出引道情事，陳泰一要求崁頂鄉人士先行做詳細評估，提出具體資料，縣黨部將以專案轉呈有關單位處理。,同時 為 爭取 設立 交流道 或 進出 引道 情事 陳泰一 要求 崁頂鄉 人士 先行 做 詳細 評估 提出 具體 資料 縣 黨部 將 以 專案 轉呈 有關 單位 處理,29,同時(115305) 為(761341) 爭取(9666) 設立(12114) 交流道(913) 或(478077) 進出(3148) 引道(62) 情事(1210) 陳泰一(2) 要求(71192) 崁頂鄉(2) 人士(27666) 先行(3452) 做(411649) 詳細(13379) 評估(16292) 提出(63073) 具體(20349) 資料(52866) 縣(9693) 黨部(719) 將(448374) 以(547785) 專案(4937) 轉呈(151) 有關(69607) 單位(23148) 處理(61797),"{'High': 26, 'Low': 3}","{'第3*級': 2, 'Unknown': 9, '第5級': 8, '第3級': 2, '第7級': 1, '第6級': 2, '第1級': 1, '第4*級': 3, '第4級': 1}",3,Y,Y,N,Y
座談會歷時一小時餘後結束，崁頂鄉長等人在離去前，一再懇請縣黨部協助爭取，繁榮地方。,座談會 歷時 一 小時 餘 後 結束 崁頂 鄉長 等 人 在 離去 前 一再 懇請 縣 黨部 協助 爭取 繁榮 地方,22,座談會(1748) 歷時(1599) 一(3701681) 小時(48521) 餘(3781) 後(422857) 結束(40669) 崁頂(31) 鄉長(353) 等(327380) 人(1550512) 在(3284238) 離去(8931) 前(272709) 一再(12315) 懇請(693) 縣(9693) 黨部(719) 協助(28701) 爭取(9666) 繁榮(4568) 地方(139164),"{'High': 21, 'Low': 1}","{'Unknown': 6, '第6級': 1, '第1級': 5, '第5級': 4, '第3*級': 2, '第1*級': 2, '第4*級': 2}",1,Y,Y,N,N
