sentence,sentence_preprocessed,sentence_length,word_freq,high_low_freq,word_level,long_word_count,is_complete_sentence,is_complete_context,is_blacklist,is_greylist
南美洲的亞馬遜河流域，是地球上面積最大的雨林，這片廣袤的熱帶雨林，棲息著種類與數量都非常可觀的動植物，從古至今，它一直是人類採集自然資源的珍貴「基因庫」，在南台灣恒春半島東北方的山區，也有一處這樣洋溢著亞馬遜風味的原始林，它是喜歡探險者從事本土「薩伐旅()」的新去處。,南美洲 的 亞馬遜河 流域 是 地球 上 面積 最 大 的 雨林 這 片 廣袤 的 熱帶 雨林 棲息 著 種類 與 數量 都 非常 可觀 的 動植物 從 古 至 今 它 一直 是 人類 採集 自然 資源 的 珍貴 基因庫 在 南 台灣 恒春 半島 東北方 的 山區 也 有 一 處 這樣 洋溢 著 亞馬遜 風味 的 原始林 它 是 喜歡 探險 者 從事 本土 薩伐旅 的 新 去處,72,南美洲(1065) 的(16029838) 亞馬遜河(196) 流域(1962) 是(4642407) 地球(21533) 上(1233218) 面積(6281) 最(421680) 大(525780) 的(16029838) 雨林(944) 這(2114032) 片(71870) 廣袤(492) 的(16029838) 熱帶(2617) 雨林(944) 棲息(1954) 著(1004687) 種類(8370) 與(968432) 數量(14605) 都(1125846) 非常(152032) 可觀(3091) 的(16029838) 動植物(921) 從(496546) 古(21972) 至(101530) 今(33635) 它(316854) 一直(119877) 是(4642407) 人類(78855) 採集(2779) 自然(91995) 資源(27580) 的(16029838) 珍貴(7380) 基因庫(84) 在(3284238) 南(24203) 台灣(130718) 恒春(6) 半島(1299) 東北方(456) 的(16029838) 山區(4460) 也(1590760) 有(2217079) 一(3701681) 處(84410) 這樣(288344) 洋溢(2387) 著(1004687) 亞馬遜(2125) 風味(3277) 的(16029838) 原始林(57) 它(316854) 是(4642407) 喜歡(113753) 探險(3921) 者(423504) 從事(22774) 本土(8025) 薩伐旅(3) 的(16029838) 新(212453) 去處(972),"{'High': 68, 'Low': 4}","{'Unknown': 20, '第1級': 21, '第6級': 6, '第4級': 4, '第5級': 5, '第1*級': 6, '第2級': 3, '第7級': 2, '第4*級': 3, '第3*級': 1, '第3級': 1}",8,Y,Y,N,Y
這處首度對外公開的「台灣亞馬遜」，行政區屬於屏東縣獅子鄉內文村，但是地理位置卻已進入恒春半島，這是一大片西起台灣海峽、東至太平洋岸、從中央山脈迤邐南下的低矮山區密林，僅有的兩條對外通路，就是楓港、大武間的南迴公路，以及旭海到車城的一九九公路；由於一百多年前的牡丹事件，幾乎殲滅了盤踞這片叢林深處的排灣族「女仍社」，讓這裡有很長的時間內，成為杳無人跡的狀態，因而變成一處原始生態完整的雨林區。,這 處 首度 對 外 公開 的 台灣 亞馬遜 行政區 屬於 屏東縣 獅子鄉 內文村 但是 地理 位置 卻 已 進入 恒春 半島 這 是 一 大 片 西 起 台灣海峽 東 至 太平洋岸 從 中央山脈 迤邐 南下 的 低矮 山區 密林 僅有 的 兩 條 對 外 通路 就是 楓港 大武 間 的 南迴公路 以及 旭海 到 車城 的 一九九 公路 由於 一百多 年 前 的 牡丹 事件 幾乎 殲滅 了 盤踞 這 片 叢林 深處 的 排灣族 女仍社 讓 這裡 有 很 長 的 時間 內 成為 杳無 人跡 的 狀態 因而 變成 一 處 原始 生態 完整 的 雨林區,101,這(2114032) 處(84410) 首度(2350) 對(897964) 外(109310) 公開(19118) 的(16029838) 台灣(130718) 亞馬遜(2125) 行政區(897) 屬於(39478) 屏東縣(721) 獅子鄉(16) 內文村(2) 但是(247988) 地理(7072) 位置(32151) 卻(333007) 已(215610) 進入(66885) 恒春(6) 半島(1299) 這(2114032) 是(4642407) 一(3701681) 大(525780) 片(71870) 西(42024) 起(96746) 台灣海峽(607) 東(28440) 至(101530) 太平洋岸(21) 從(496546) 中央山脈(1171) 迤邐(205) 南下(4499) 的(16029838) 低矮(1060) 山區(4460) 密林(503) 僅有(4494) 的(16029838) 兩(526190) 條(115362) 對(897964) 外(109310) 通路(3062) 就是(2943) 楓港(42) 大武(221) 間(115638) 的(16029838) 南迴公路(Unknown) 以及(155624) 旭海(15) 到(546906) 車城(29) 的(16029838) 一九九(291) 公路(7300) 由於(88111) 一百多(3148) 年(514736) 前(272709) 的(16029838) 牡丹(2140) 事件(59059) 幾乎(74298) 殲滅(1538) 了(3199291) 盤踞(600) 這(2114032) 片(71870) 叢林(2901) 深處(8909) 的(16029838) 排灣族(1139) 女仍社(Unknown) 讓(526314) 這裡(100385) 有(2217079) 很(715675) 長(107092) 的(16029838) 時間(213595) 內(183051) 成為(143834) 杳無(Unknown) 人跡(675) 的(16029838) 狀態(39557) 因而(29060) 變成(73009) 一(3701681) 處(84410) 原始(11993) 生態(9124) 完整(19201) 的(16029838) 雨林區(36),"{'High': 90, 'Low': 11}","{'第1級': 30, 'Unknown': 33, '第4*級': 5, '第5級': 9, '第2級': 6, '第4級': 4, '第3級': 2, '第7級': 5, '第3*級': 2, '第2*級': 1, '第1*級': 1, '第6級': 3}",14,Y,Y,N,Y
由東向西奔流入台灣海峽的楓港溪，是流貫整個山區的水系，尤其它的東南支流從內文部落附近發源，一路西行而下，從內文到「內海」舊社之間是易漲易退的泥底小河，每逢夏季驟雨之後，短短一、兩小時之間，河水可以從腳踝高、漲到深達成人腰際，然後再迅速退回原狀，讓跋涉其中的人，感受到彷彿熱帶河流在雨季氾濫成災的滋味。,由 東 向 西 奔流 入 台灣海峽 的 楓港溪 是 流貫 整個 山區 的 水系 尤其 它 的 東南 支流 從 內文 部落 附近 發源 一路 西行 而 下 從 內文 到 內海 舊社 之間 是 易 漲 易 退 的 泥底 小河 每逢 夏季 驟雨 之後 短短 一 兩 小時 之間 河水 可以 從 腳踝 高 漲到 深達 成人 腰際 然後 再 迅速 退回 原狀 讓 跋涉 其中 的 人 感受到 彷彿 熱帶 河流 在 雨季 氾濫成災 的 滋味,80,由(208604) 東(28440) 向(231672) 西(42024) 奔流(545) 入(30777) 台灣海峽(607) 的(16029838) 楓港溪(18) 是(4642407) 流貫(44) 整個(Unknown) 山區(4460) 的(16029838) 水系(109) 尤其(50700) 它(316854) 的(16029838) 東南(4826) 支流(928) 從(496546) 內文(631) 部落(17699) 附近(32204) 發源(578) 一路(14840) 西行(642) 而(937923) 下(329549) 從(496546) 內文(631) 到(546906) 內海(327) 舊社(80) 之間(117932) 是(4642407) 易(19189) 漲(3422) 易(19189) 退(11673) 的(16029838) 泥底(Unknown) 小河(137) 每逢(2021) 夏季(4260) 驟雨(450) 之後(190467) 短短(6774) 一(3701681) 兩(526190) 小時(48521) 之間(117932) 河水(3679) 可以(560531) 從(496546) 腳踝(2236) 高(128858) 漲到(173) 深達(78) 成人(13253) 腰際(413) 然後(156193) 再(326207) 迅速(19888) 退回(1938) 原狀(1039) 讓(526314) 跋涉(1088) 其中(95627) 的(16029838) 人(1550512) 感受到(14394) 彷彿(35009) 熱帶(2617) 河流(4762) 在(3284238) 雨季(510) 氾濫成災(153) 的(16029838) 滋味(6876),"{'High': 74, 'Low': 6}","{'第4*級': 5, '第2*級': 1, '第2級': 3, '第7級': 3, 'Unknown': 29, '第1級': 15, '第3*級': 2, '第1*級': 9, '第5級': 5, '第6級': 5, '第4級': 3}",4,Y,Y,N,N
從內海盆地沿著河畔的廢棄林道，向西順流而下，河水逐漸湍急，侵蝕出兩旁的岩壁，河床也改為岩磐與石礫，小河已經變成山區常見的小溪，最後在兩座瀑布後，抵達林務局所屬的「雙流森林遊樂區」。,從 內海 盆地 沿著 河畔 的 廢棄 林道 向 西 順流 而 下 河水 逐漸 湍急 侵蝕 出 兩旁 的 岩壁 河床 也 改為 岩磐 與 石礫 小河 已經 變成 山區 常見 的 小溪 最後 在 兩 座 瀑布 後 抵達 林務局 所屬 的 雙流 森林 遊樂區,47,從(496546) 內海(327) 盆地(1204) 沿著(Unknown) 河畔(6) 的(16029838) 廢棄(2274) 林道(328) 向(231672) 西(42024) 順流(569) 而(937923) 下(329549) 河水(3679) 逐漸(38705) 湍急(581) 侵蝕(1589) 出(84457) 兩旁(1552) 的(16029838) 岩壁(880) 河床(822) 也(1590760) 改為(6294) 岩磐(2) 與(968432) 石礫(88) 小河(137) 已經(245160) 變成(73009) 山區(4460) 常見(13705) 的(16029838) 小溪(311) 最後(142102) 在(3284238) 兩(526190) 座(49959) 瀑布(2537) 後(422857) 抵達(16291) 林務局(149) 所屬(4028) 的(16029838) 雙流(24) 森林(14387) 遊樂區(297),"{'High': 42, 'Low': 5}","{'第1*級': 4, 'Unknown': 18, '第7級': 4, '第1級': 7, '第6級': 2, '第2級': 4, '第5級': 3, '第4*級': 1, '第4級': 3, '第3*級': 1}",2,Y,Y,N,Y
這裡面林蔭蔽天、小溪清涼的模樣，和源頭內文的草原、沼澤風情，可說截然不同。,這 裡面 林蔭 蔽天 小溪 清涼 的 模樣 和 源頭 內文 的 草原 沼澤 風情 可 說 截然不同,18,這(2114032) 裡面(40741) 林蔭(196) 蔽天(68) 小溪(311) 清涼(1467) 的(16029838) 模樣(16099) 和(1338337) 源頭(3659) 內文(631) 的(16029838) 草原(5281) 沼澤(1548) 風情(1988) 可(307359) 說(1285247) 截然不同(3749),"{'High': 17, 'Low': 1}","{'第1級': 4, '第1*級': 1, 'Unknown': 5, '第5級': 3, '第6級': 3, '第7級': 1, '第4*級': 1}",1,Y,N,N,N
這一段從沼澤草原，順著溪流、山路跋涉到雙流森林遊樂區的奇特路線，沿途充滿了戲水、自然觀察、雨林漫遊的多重樂趣，一趟路程不過一個小時多，它是民眾模擬亞馬遜河探險「想像之旅」的稀奇路線。,這 一 段 從 沼澤 草原 順著 溪流 山路 跋涉 到 雙流 森林 遊樂區 的 奇特 路線 沿途 充滿 了 戲水 自然 觀察 雨林 漫遊 的 多重 樂趣 一 趟 路程 不過 一 個 小時 多 它 是 民眾 模擬 亞馬遜河 探險 想像 之 旅 的 稀奇 路線,48,這(2114032) 一(3701681) 段(95980) 從(496546) 沼澤(1548) 草原(5281) 順著(Unknown) 溪流(1785) 山路(2459) 跋涉(1088) 到(546906) 雙流(24) 森林(14387) 遊樂區(297) 的(16029838) 奇特(5281) 路線(9508) 沿途(2767) 充滿(43990) 了(3199291) 戲水(343) 自然(91995) 觀察(44358) 雨林(944) 漫遊(2175) 的(16029838) 多重(3608) 樂趣(9412) 一(3701681) 趟(11585) 路程(2648) 不過(186226) 一(3701681) 個(2296574) 小時(48521) 多(318992) 它(316854) 是(4642407) 民眾(17097) 模擬(3988) 亞馬遜河(196) 探險(3921) 想像(45673) 之(875481) 旅(8620) 的(16029838) 稀奇(1506) 路線(9508),"{'High': 46, 'Low': 2}","{'第1級': 12, '第4級': 6, '第1*級': 2, '第7級': 3, '第5級': 4, 'Unknown': 9, '第6級': 7, '第4*級': 3, '第3*級': 1, '第2級': 1}",2,Y,N,N,Y
它是民眾模擬亞馬遜河探險「想像之旅」的稀奇路線。,它 是 民眾 模擬 亞馬遜河 探險 想像 之 旅 的 稀奇 路線,12,它(316854) 是(4642407) 民眾(17097) 模擬(3988) 亞馬遜河(196) 探險(3921) 想像(45673) 之(875481) 旅(8620) 的(16029838) 稀奇(1506) 路線(9508),{'High': 12},"{'第1*級': 1, '第1級': 2, '第4*級': 1, '第6級': 3, 'Unknown': 2, '第4級': 2, '第5級': 1}",1,Y,N,N,N
社區營造協會成員張淑玫最近回到苗栗的婆家時，把一本《獅潭鄉誌》拿出來給婆婆看，婆婆不識字，翻看裡面的照片，不時興奮地指著一張張照片說：「這不是神桌山嗎！」,社區 營造 協會 成員 張淑玫 最近 回到 苗栗 的 婆家 時 把 一 本 獅潭鄉誌 拿出來 給 婆婆 看 婆婆 不 識字 翻看 裡面 的 照片 不時 興奮 地 指 著 一張張 照片 說 這 不 是 神桌山 嗎,39,社區(22407) 營造(5354) 協會(13492) 成員(25071) 張淑玫(Unknown) 最近(30174) 回到(60084) 苗栗(976) 的(16029838) 婆家(435) 時(623734) 把(617773) 一(3701681) 本(197156) 獅潭鄉誌(Unknown) 拿出來(4427) 給(240485) 婆婆(6367) 看(444691) 婆婆(6367) 不(2282521) 識字(2093) 翻看(633) 裡面(40741) 的(16029838) 照片(25355) 不時(10714) 興奮(19005) 地(754998) 指(84264) 著(1004687) 一張張(888) 照片(25355) 說(1285247) 這(2114032) 不(2282521) 是(4642407) 神桌山(Unknown) 嗎(248249),"{'High': 36, 'Low': 3}","{'第4*級': 3, '第6級': 2, '第5級': 3, 'Unknown': 11, '第2級': 5, '第1級': 11, '第3*級': 1, '第1*級': 1, '第4級': 2}",5,Y,N,N,Y
「這是以前的鄉公所！」,這 是 以前 的 鄉公所,5,這(2114032) 是(4642407) 以前(59453) 的(16029838) 鄉公所(322),{'High': 5},"{'第1級': 3, '第1*級': 1, 'Unknown': 1}",1,N,N,N,N
表現得興味十足。,表現 得 興味 十足,4,表現(67272) 得(573721) 興味(1091) 十足(6475),{'High': 4},"{'第4級': 1, 'Unknown': 1, '第7級': 1, '第5級': 1}",0,Y,N,N,N
張淑玫的丈夫楊長鎮是社區營造學會總幹事，他們正在進行一項「大家來寫村史」的計畫，張淑玫說，許多人對自己周遭的事物都沒有自信，往往要看到它們出現在一本書上或是被確認為一種知識後，事物才突然有了意義。,張淑玫 的 丈夫 楊長鎮 是 社區 營造 學會 總幹事 他們 正在 進行 一 項 大家 來 寫 村史 的 計畫 張淑玫 說 許多 人 對 自己 周遭 的 事物 都 沒有 自信 往往 要 看到 它們 出現 在 一 本 書 上 或是 被 確認為 一 種 知識 後 事物 才 突然 有 了 意義,55,張淑玫(Unknown) 的(16029838) 丈夫(31006) 楊長鎮(4) 是(4642407) 社區(22407) 營造(5354) 學會(25720) 總幹事(582) 他們(716752) 正在(54336) 進行(100298) 一(3701681) 項(88887) 大家(109692) 來(742183) 寫(113933) 村史(6) 的(16029838) 計畫(54820) 張淑玫(Unknown) 說(1285247) 許多(159791) 人(1550512) 對(897964) 自己(744739) 周遭(10141) 的(16029838) 事物(32454) 都(1125846) 沒有(594280) 自信(14578) 往往(41388) 要(851264) 看到(159419) 它們(65805) 出現(124694) 在(3284238) 一(3701681) 本(197156) 書(174356) 上(1233218) 或是(75906) 被(540683) 確認為(42) 一(3701681) 種(701563) 知識(63665) 後(422857) 事物(32454) 才(394539) 突然(69636) 有(2217079) 了(3199291) 意義(71714),"{'Low': 5, 'High': 50}","{'Unknown': 12, '第1級': 22, '第4*級': 4, '第6級': 2, '第5級': 3, '第2級': 4, '第3*級': 2, '第1*級': 3, '第4級': 3}",5,Y,Y,N,Y
因此，這項「村史運動」的目的，便是希望尋求「由下而上」的角度，由民眾「自己為自己寫歷史」，有意識地避開傳統的官定志書或菁英寫史，而回歸到生活世界，以「非專業」的、做為生活者的常民關懷與感受為中心，透過社區運動的共同操作過程，使居民發現共同生活史中彼此生命的相互涉入與感通。,因此 這 項 村史 運動 的 目的 便是 希望 尋求 由 下 而 上 的 角度 由 民眾 自己 為 自己 寫 歷史 有意識 地 避開 傳統 的 官定 志書 或 菁英 寫史 而 回歸到 生活 世界 以 非專業 的 做為 生活 者 的 常民 關懷 與 感受 為 中心 透過 社區 運動 的 共同 操作 過程 使 居民 發現 共同 生活史 中 彼此 生命 的 相互 涉入 與 感通,70,因此(184606) 這(2114032) 項(88887) 村史(6) 運動(63153) 的(16029838) 目的(45226) 便是(6111) 希望(119975) 尋求(14747) 由(208604) 下(329549) 而(937923) 上(1233218) 的(16029838) 角度(26690) 由(208604) 民眾(17097) 自己(744739) 為(761341) 自己(744739) 寫(113933) 歷史(96060) 有意識(94) 地(754998) 避開(6425) 傳統(60517) 的(16029838) 官定(96) 志書(84) 或(478077) 菁英(2773) 寫史(59) 而(937923) 回歸到(1038) 生活(213189) 世界(165235) 以(547785) 非專業(44) 的(16029838) 做為(19421) 生活(213189) 者(423504) 的(16029838) 常民(253) 關懷(8683) 與(968432) 感受(30399) 為(761341) 中心(46076) 透過(63117) 社區(22407) 運動(63153) 的(16029838) 共同(36636) 操作(10980) 過程(87889) 使(197544) 居民(13554) 發現(175233) 共同(36636) 生活史(260) 中(1011729) 彼此(39449) 生命(92595) 的(16029838) 相互(21268) 涉入(1441) 與(968432) 感通(76),"{'High': 63, 'Low': 7}","{'第4*級': 9, '第1級': 10, '第5級': 15, 'Unknown': 17, '第1*級': 5, '第3*級': 1, '第2級': 3, '第3級': 6, '第6級': 2, '第4級': 2}",4,Y,Y,N,N
楊長鎮說，這樣的歷史(建構)運動，主要目的並不在滿足歷史學的興趣，而在於人群關係及地方主體性的重建。,楊長鎮 說 這樣 的 歷史 建構 運動 主要 目的 並 不 在 滿足 歷史學 的 興趣 而 在於 人群 關係 及 地方 主體性 的 重建,25,楊長鎮(4) 說(1285247) 這樣(288344) 的(16029838) 歷史(96060) 建構(13771) 運動(63153) 主要(78757) 目的(45226) 並(442790) 不(2282521) 在(3284238) 滿足(29073) 歷史學(536) 的(16029838) 興趣(34215) 而(937923) 在於(37953) 人群(8886) 關係(162883) 及(304586) 地方(139164) 主體性(1503) 的(16029838) 重建(7085),"{'Low': 1, 'High': 24}","{'Unknown': 3, '第1級': 5, '第3級': 4, '第6級': 3, '第1*級': 3, '第4級': 2, '第3*級': 1, '第4*級': 1, '第5級': 3}",3,Y,Y,N,Y
這項計畫由省文化處主辦，社區營造學會與十個種籽村文史團隊承辦，主持人是台大歷史系教授吳密察。,這 項 計畫 由 省 文化處 主辦 社區 營造 學會 與 十 個 種籽村 文史 團隊 承辦 主持人 是 台大 歷史系 教授 吳密察,23,這(2114032) 項(88887) 計畫(54820) 由(208604) 省(17570) 文化處(20) 主辦(2897) 社區(22407) 營造(5354) 學會(25720) 與(968432) 十(77415) 個(2296574) 種籽村(Unknown) 文史(1144) 團隊(16971) 承辦(842) 主持人(4030) 是(4642407) 台大(3363) 歷史系(639) 教授(39068) 吳密察(117),"{'High': 21, 'Low': 2}","{'第1級': 4, '第5級': 2, '第2級': 1, '第4*級': 5, '第4級': 1, 'Unknown': 7, '第6級': 1, '第7級': 1, '第3*級': 1}",5,Y,Y,N,Y
他們邀請了十個種籽村做為這個嘗試性工作的起始，地方文史工作室則扮演協助者的角色。,他們 邀請 了 十 個 種籽村 做為 這 個 嘗試性 工作 的 起始 地方 文史 工作室 則 扮演 協助 者 的 角色,22,他們(716752) 邀請(14342) 了(3199291) 十(77415) 個(2296574) 種籽村(Unknown) 做為(19421) 這(2114032) 個(2296574) 嘗試性(80) 工作(220164) 的(16029838) 起始(1036) 地方(139164) 文史(1144) 工作室(3994) 則(254096) 扮演(20021) 協助(28701) 者(423504) 的(16029838) 角色(52422),"{'High': 20, 'Low': 2}","{'第1級': 8, '第4級': 1, 'Unknown': 8, '第1*級': 1, '第5級': 1, '第4*級': 3}",3,Y,N,N,N
這些種籽村包括：台北縣石碇(地景史的、空間觀點的介入)、中和安邦新村(即將改建的眷村)、新竹五峰花園部落(部落重建、口傳歷史傳統的重建)、竹北中興里(面臨高鐵毀滅的古老聚落)、苗栗獅潭溪流域(被壓抑的族群關係及白色恐怖回憶)、台中龍井東海社區(新社區城鄉移民與大學城的連結)、南投埔里愛蘭社區(多族群層次的歷史考掘)、南投魚池德化社(原住民觀光的回顧)、高雄美濃龍肚(巨型水庫陰影下的客家庄)、花蓮港(漁人與海洋的回憶)。,這些 種籽村 包括 台北縣 石碇 地景史 的 空間 觀點 的 介入 中和 安邦新村 即將 改建 的 眷村 新竹 五峰 花園 部落 部落 重建 口傳 歷史 傳統 的 重建 竹北 中興里 面臨 高鐵 毀滅 的 古老 聚落 苗栗 獅潭溪 流域 被 壓抑 的 族群 關係 及 白色恐怖 回憶 台中 龍井 東海 社區 新 社區 城鄉 移民 與 大學城 的 連結 南投 埔里 愛蘭 社區 多 族群 層次 的 歷史 考掘 南投 魚池 德化社 原住民 觀光 的 回顧 高雄 美濃 龍肚 巨型 水庫 陰影 下 的 客家庄 花蓮港 漁人 與 海洋 的 回憶,91,這些(315113) 種籽村(Unknown) 包括(74410) 台北縣(1048) 石碇(101) 地景史(Unknown) 的(16029838) 空間(52519) 觀點(38495) 的(16029838) 介入(7798) 中和(947) 安邦新村(Unknown) 即將(16780) 改建(1135) 的(16029838) 眷村(625) 新竹(2736) 五峰(99) 花園(11369) 部落(17699) 部落(17699) 重建(7085) 口傳(349) 歷史(96060) 傳統(60517) 的(16029838) 重建(7085) 竹北(71) 中興里(5) 面臨(16531) 高鐵(677) 毀滅(5163) 的(16029838) 古老(10197) 聚落(2111) 苗栗(976) 獅潭溪(8) 流域(1962) 被(540683) 壓抑(10448) 的(16029838) 族群(11192) 關係(162883) 及(304586) 白色恐怖(640) 回憶(17740) 台中(3661) 龍井(224) 東海(2207) 社區(22407) 新(212453) 社區(22407) 城鄉(1118) 移民(8767) 與(968432) 大學城(186) 的(16029838) 連結(15510) 南投(857) 埔里(1277) 愛蘭(46) 社區(22407) 多(318992) 族群(11192) 層次(13487) 的(16029838) 歷史(96060) 考掘(42) 南投(857) 魚池(300) 德化社(8) 原住民(9390) 觀光(4478) 的(16029838) 回顧(6655) 高雄(4674) 美濃(4528) 龍肚(65) 巨型(1386) 水庫(1784) 陰影(7571) 下(329549) 的(16029838) 客家庄(94) 花蓮港(477) 漁人(538) 與(968432) 海洋(8653) 的(16029838) 回憶(17740),"{'High': 79, 'Low': 12}","{'Unknown': 35, '第3*級': 1, '第1級': 13, '第4級': 6, '第5級': 14, '第6級': 8, '第7級': 3, '第3級': 4, '第2級': 1, '第4*級': 5, '第1*級': 1}",12,Y,Y,N,Y
當這個計畫正開始進行時，有些長期經營的社區史也出現成果。,當 這 個 計畫 正 開始 進行 時 有些 長期 經營 的 社區史 也 出現 成果,16,當(294625) 這(2114032) 個(2296574) 計畫(54820) 正(179334) 開始(245562) 進行(100298) 時(623734) 有些(6971) 長期(28592) 經營(39913) 的(16029838) 社區史(Unknown) 也(1590760) 出現(124694) 成果(16253),"{'High': 15, 'Low': 1}","{'Unknown': 4, '第1級': 4, '第2級': 2, '第3*級': 2, '第5級': 2, '第4級': 1, '第4*級': 1}",1,Y,N,N,N
像是台北市名山里里長邱美利最近出版一本《女性里長與名山里的故事》(稻鄉出版)，基隆市仁愛區文安里里長李隆進與妻子張雪華也近以三年的時間，走訪地方耆老，舉辦多次耆老講古、舊照片與舊遺物展，最近將出版《文安里誌》，里誌的時間上溯約百年。,像是 台北市 名山里 里長 邱美利 最近 出版 一 本 女性 里長 與 名山里 的 故事 稻鄉 出版 基隆市 仁愛區 文安里 里長 李隆進 與 妻子 張雪華 也 近 以 三 年 的 時間 走訪 地方 耆老 舉辦 多 次 耆老 講古 舊 照片 與 舊 遺物 展 最近 將 出版 文安里誌 里誌 的 時間 上溯 約 百 年,57,像是(49912) 台北市(4393) 名山里(Unknown) 里長(400) 邱美利(Unknown) 最近(30174) 出版(37283) 一(3701681) 本(197156) 女性(59364) 里長(400) 與(968432) 名山里(Unknown) 的(16029838) 故事(101316) 稻鄉(61) 出版(37283) 基隆市(335) 仁愛區(26) 文安里(Unknown) 里長(400) 李隆進(Unknown) 與(968432) 妻子(33898) 張雪華(Unknown) 也(1590760) 近(43555) 以(547785) 三(313861) 年(514736) 的(16029838) 時間(213595) 走訪(1087) 地方(139164) 耆老(614) 舉辦(12070) 多(318992) 次(331701) 耆老(614) 講古(106) 舊(32022) 照片(25355) 與(968432) 舊(32022) 遺物(1173) 展(2963) 最近(30174) 將(448374) 出版(37283) 文安里誌(Unknown) 里誌(Unknown) 的(16029838) 時間(213595) 上溯(437) 約(47731) 百(24843) 年(514736),"{'High': 47, 'Low': 10}","{'Unknown': 22, '第2級': 6, '第4*級': 7, '第1級': 13, '第4級': 2, '第5級': 2, '第7級': 1, '第1*級': 3, '第3*級': 1}",10,Y,Y,N,Y
厚達一千頁的台南《安平區志》也在最近出版，參與田野調查與寫作的文史工作者鄭水萍說，《安平區志》放棄「大歷史」的觀點，以民眾的眼光看安平區的歷史與發展，他們採訪了上百位包括工人、苦力、做棺材的、造船的人，由實際在此生活的人說自己的歷史。,厚達 一千 頁 的 台南 安平區志 也 在 最近 出版 參與 田野 調查 與 寫作 的 文史 工作者 鄭水萍 說 安平區志 放棄 大 歷史 的 觀點 以 民眾 的 眼光 看 安平區 的 歷史 與 發展 他們 採訪 了 上百 位 包括 工人 苦力 做 棺材 的 造船 的 人 由 實際 在 此 生活 的 人 說 自己 的 歷史,61,厚達(225) 一千(8320) 頁(48734) 的(16029838) 台南(4016) 安平區志(Unknown) 也(1590760) 在(3284238) 最近(30174) 出版(37283) 參與(40595) 田野(4479) 調查(34821) 與(968432) 寫作(18435) 的(16029838) 文史(1144) 工作者(2437) 鄭水萍(2) 說(1285247) 安平區志(Unknown) 放棄(27664) 大(525780) 歷史(96060) 的(16029838) 觀點(38495) 以(547785) 民眾(17097) 的(16029838) 眼光(13910) 看(444691) 安平區(79) 的(16029838) 歷史(96060) 與(968432) 發展(117494) 他們(716752) 採訪(8722) 了(3199291) 上百(1982) 位(284809) 包括(74410) 工人(13089) 苦力(711) 做(411649) 棺材(2560) 的(16029838) 造船(1211) 的(16029838) 人(1550512) 由(208604) 實際(52755) 在(3284238) 此(288458) 生活(213189) 的(16029838) 人(1550512) 說(1285247) 自己(744739) 的(16029838) 歷史(96060),"{'High': 57, 'Low': 4}","{'Unknown': 14, '第4級': 3, '第1級': 18, '第1*級': 3, '第2級': 1, '第4*級': 9, '第5級': 6, '第3級': 4, '第3*級': 2, '第6級': 1}",5,Y,Y,N,Y
