sentence,sentence_preprocessed,sentence_length,word_freq,high_low_freq,word_level,long_word_count,is_complete_sentence,is_complete_context,is_blacklist,is_greylist
連戰表示，將奮發圖強，推動第二次政黨輪替，把台灣帶回正確的方向、軌道。,連戰 表示 將 奮發圖強 推動 第二 次 政黨 輪替 把 台灣 帶回 正確 的 方向 軌道,16,連戰(634) 表示(74452) 將(448374) 奮發圖強(138) 推動(14867) 第二(98741) 次(331701) 政黨(4138) 輪替(632) 把(617773) 台灣(130718) 帶回(6256) 正確(36593) 的(16029838) 方向(39560) 軌道(4714),{'High': 16},"{'Unknown': 5, '第4*級': 2, '第5級': 1, '第2級': 2, '第6級': 2, '第1級': 2, '第4級': 1, '第3*級': 1}",1,Y,N,N,Y
他也強調，台灣不能再摔跤、不能再翻車，這是他們的決心。,他 也 強調 台灣 不能 再 摔跤 不能 再 翻車 這 是 他們 的 決心,15,他(2487930) 也(1590760) 強調(36095) 台灣(130718) 不能(162852) 再(326207) 摔跤(739) 不能(162852) 再(326207) 翻車(169) 這(2114032) 是(4642407) 他們(716752) 的(16029838) 決心(12598),{'High': 15},"{'第1級': 7, '第5級': 2, 'Unknown': 3, '第1*級': 2, '第4*級': 1}",0,Y,N,N,N
連戰說，國民黨雖然和親民黨已經有共識和默契，但是身為民主的政黨，還是必須按照民主的程序和機制，一步一步完成黨的提名。,連戰 說 國民黨 雖然 和 親民黨 已經 有 共識 和 默契 但是 身為 民主 的 政黨 還是 必須 按照 民主 的 程序 和 機制 一 步 一 步 完成 黨 的 提名,32,連戰(634) 說(1285247) 國民黨(11621) 雖然(152988) 和(1338337) 親民黨(141) 已經(245160) 有(2217079) 共識(6750) 和(1338337) 默契(2115) 但是(247988) 身為(18072) 民主(18177) 的(16029838) 政黨(4138) 還是(155231) 必須(170592) 按照(15014) 民主(18177) 的(16029838) 程序(11299) 和(1338337) 機制(13955) 一(3701681) 步(45427) 一(3701681) 步(45427) 完成(60471) 黨(23312) 的(16029838) 提名(1814),{'High': 32},"{'Unknown': 7, '第1級': 7, '第2級': 3, '第6級': 7, '第4級': 3, '第1*級': 1, '第3級': 1, '第3*級': 2, '第4*級': 1}",2,Y,Y,N,Y
他說，今天只是領表，未來還需要至少五萬人連署，並繳交保證金。,他 說 今天 只是 領表 未來 還 需要 至少 五萬 人 連署 並 繳交 保證金,15,他(2487930) 說(1285247) 今天(73277) 只是(96536) 領表(2) 未來(54445) 還(625086) 需要(166793) 至少(41964) 五萬(2821) 人(1550512) 連署(271) 並(442790) 繳交(659) 保證金(471),"{'High': 14, 'Low': 1}","{'第1級': 4, '第4級': 3, 'Unknown': 4, '第2級': 1, '第6級': 1, '第4*級': 1, '第7級': 1}",1,Y,Y,N,N
連戰說，希望獲得黨內的支持。,連戰 說 希望 獲得 黨 內 的 支持,8,連戰(634) 說(1285247) 希望(119975) 獲得(54809) 黨(23312) 內(183051) 的(16029838) 支持(42489),{'High': 8},"{'Unknown': 2, '第1級': 2, '第2級': 1, '第5級': 1, '第3級': 1, '第4級': 1}",0,Y,N,N,Y
連戰也談到決定參選的心路歷程，他說，他心裡有相當的感觸，一方面體認到多數鄉親對國民黨的期待，也了解對國家發展肩負著義無反顧的責任，更重要的是，他是以一種相當愧疚的心情來做這個決定，因為看到國家這幾年的變化，他覺得沒有其他選擇。,連戰 也 談到 決定 參選 的 心路歷程 他 說 他 心 裡 有 相當 的 感觸 一方面 體認到 多數 鄉親 對 國民黨 的 期待 也 了解 對 國家 發展 肩負 著 義無反顧 的 責任 更 重要 的 是 他 是 以 一 種 相當 愧疚 的 心情 來 做 這 個 決定 因為 看到 國家 這 幾 年 的 變化 他 覺得 沒有 其他 選擇,65,連戰(634) 也(1590760) 談到(13817) 決定(101837) 參選(852) 的(16029838) 心路歷程(750) 他(2487930) 說(1285247) 他(2487930) 心(180243) 裡(520435) 有(2217079) 相當(66293) 的(16029838) 感觸(1587) 一方面(15897) 體認到(1472) 多數(13621) 鄉親(2219) 對(897964) 國民黨(11621) 的(16029838) 期待(21616) 也(1590760) 了解(82970) 對(897964) 國家(109166) 發展(117494) 肩負(915) 著(1004687) 義無反顧(618) 的(16029838) 責任(29747) 更(361676) 重要(154863) 的(16029838) 是(4642407) 他(2487930) 是(4642407) 以(547785) 一(3701681) 種(701563) 相當(66293) 愧疚(1310) 的(16029838) 心情(33611) 來(742183) 做(411649) 這(2114032) 個(2296574) 決定(101837) 因為(425061) 看到(159419) 國家(109166) 這(2114032) 幾(229415) 年(514736) 的(16029838) 變化(42502) 他(2487930) 覺得(183034) 沒有(594280) 其他(189445) 選擇(75178),{'High': 65},"{'Unknown': 9, '第1級': 28, '第2級': 5, '第7級': 4, '第1*級': 6, '第3級': 2, '第4*級': 2, '第4級': 4, '第5級': 2, '第3*級': 3}",5,Y,Y,N,Y
連戰說，他是和家人、同事一再商量考慮，得到支持、鼓勵與諒解後，才決定參選。,連戰 說 他 是 和 家人 同事 一再 商量 考慮 得到 支持 鼓勵 與 諒解 後 才 決定 參選,19,連戰(634) 說(1285247) 他(2487930) 是(4642407) 和(1338337) 家人(30861) 同事(18678) 一再(12315) 商量(6426) 考慮(28774) 得到(84614) 支持(42489) 鼓勵(27004) 與(968432) 諒解(2165) 後(422857) 才(394539) 決定(101837) 參選(852),{'High': 19},"{'Unknown': 3, '第1級': 4, '第1*級': 1, '第4級': 5, '第4*級': 2, '第3*級': 1, '第6級': 1, '第2級': 2}",0,Y,N,N,Y
土耳其國會消息人士今天說，由於土耳其政府即將改組，國會至少在兩三周後才會對是否讓美軍在土國境內部署再進行表決。,土耳其 國會 消息 人士 今天 說 由於 土耳其 政府 即將 改組 國會 至少 在 兩 三 周 後 才 會 對 是否 讓 美軍 在 土國 境內 部署 再 進行 表決,31,土耳其(2537) 國會(6466) 消息(37528) 人士(27666) 今天(73277) 說(1285247) 由於(88111) 土耳其(2537) 政府(92663) 即將(16780) 改組(1157) 國會(6466) 至少(41964) 在(3284238) 兩(526190) 三(313861) 周(10111) 後(422857) 才(394539) 會(1014977) 對(897964) 是否(78907) 讓(526314) 美軍(3434) 在(3284238) 土國(17) 境內(6) 部署(2754) 再(326207) 進行(100298) 表決(775),"{'High': 29, 'Low': 2}","{'第5級': 9, '第3級': 1, '第1級': 6, '第4*級': 1, '第4級': 2, '第6級': 3, '第1*級': 4, '第2級': 2, 'Unknown': 3}",2,Y,Y,N,N
一名消息人士說，土國執政黨正義發展黨黨魁厄多岡若能在九日的國會期中選舉中獲勝，政府可望進行改組。,一 名 消息 人士 說 土國 執政黨 正義 發展 黨 黨魁 厄多岡 若 能 在 九日 的 國會 期中 選舉 中 獲勝 政府 可望 進行 改組,26,一(3701681) 名(136287) 消息(37528) 人士(27666) 說(1285247) 土國(17) 執政黨(1043) 正義(6990) 發展(117494) 黨(23312) 黨魁(234) 厄多岡(Unknown) 若(92766) 能(582260) 在(3284238) 九日(3231) 的(16029838) 國會(6466) 期中(225) 選舉(8292) 中(1011729) 獲勝(2586) 政府(92663) 可望(1149) 進行(100298) 改組(1157),"{'High': 24, 'Low': 2}","{'第1級': 3, '第2級': 1, '第3級': 1, '第5級': 5, 'Unknown': 9, '第6級': 2, '第4級': 2, '第1*級': 2, '第7級': 1}",2,Y,Y,N,Y
一般預料，厄多岡若能當選國會議員，將取代古爾出任總理。,一般 預料 厄多岡 若 能 當選 國會 議員 將 取代 古爾 出任 總理,13,一般(80732) 預料(3693) 厄多岡(Unknown) 若(92766) 能(582260) 當選(3469) 國會(6466) 議員(4905) 將(448374) 取代(14551) 古爾(15) 出任(5389) 總理(6056),"{'High': 11, 'Low': 2}","{'第3*級': 1, '第6級': 3, 'Unknown': 3, '第1*級': 1, '第5級': 5}",1,Y,Y,N,Y
土國報紙引述土國內政部長阿克蘇的話說，未來將由厄多岡政府決定是否再向國會提出允許美軍使用該國基地的要求。,土國 報紙 引述 土國 內政部長 阿克蘇 的 話 說 未來 將 由 厄多岡 政府 決定 是否 再 向 國會 提出 允許 美軍 使用 該 國 基地 的 要求,28,土國(17) 報紙(22331) 引述(3165) 土國(17) 內政部長(186) 阿克蘇(59) 的(16029838) 話(148020) 說(1285247) 未來(54445) 將(448374) 由(208604) 厄多岡(Unknown) 政府(92663) 決定(101837) 是否(78907) 再(326207) 向(231672) 國會(6466) 提出(63073) 允許(13099) 美軍(3434) 使用(99640) 該(148369) 國(73377) 基地(6653) 的(16029838) 要求(71192),"{'Low': 4, 'High': 24}","{'Unknown': 7, '第2*級': 1, '第6級': 1, '第1級': 5, '第4級': 3, '第5級': 5, '第4*級': 2, '第2級': 2, '第1*級': 1, '第3*級': 1}",3,Y,N,N,Y
這項決定可能需要至少十天。,這 項 決定 可能 需要 至少 十天,7,這(2114032) 項(88887) 決定(101837) 可能(271025) 需要(166793) 至少(41964) 十天(Unknown),"{'High': 6, 'Low': 1}","{'第1級': 2, '第5級': 1, '第2級': 2, '第4級': 1, 'Unknown': 1}",0,Y,N,N,N
ING安泰投顧下午舉行亞太股市投資展望說明會，安本亞洲資產管理公司亞洲股票投資經理，同時也是安本環球亞太股票基金經理團隊之一的張美霓表示，假如戰爭因素快速消失，而且全球經濟復甦步伐持續，資產負債表、財報透明度或企業治理各方面已有長足改善的亞洲地區，股市的突出表現可以期待。,ING 安泰 投顧 下午 舉行 亞太 股市 投資 展望 說明會 安本 亞洲 資產 管理 公司 亞洲 股票 投資 經理 同時 也 是 安本 環球 亞太 股票 基金 經理 團隊 之 一 的 張美霓 表示 假如 戰爭 因素 快速 消失 而且 全球 經濟 復甦 步伐 持續 資產 負債表 財報 透明度 或 企業 治理 各 方面 已 有 長足 改善 的 亞洲 地區 股市 的 突出 表現 可以 期待,67,ING(185) 安泰(233) 投顧(82) 下午(20045) 舉行(17660) 亞太(1426) 股市(5507) 投資(38191) 展望(1306) 說明會(324) 安本(4) 亞洲(13256) 資產(14148) 管理(54484) 公司(168500) 亞洲(13256) 股票(13732) 投資(38191) 經理(11331) 同時(115305) 也(1590760) 是(4642407) 安本(4) 環球(1461) 亞太(1426) 股票(13732) 基金(10265) 經理(11331) 團隊(16971) 之(875481) 一(3701681) 的(16029838) 張美霓(Unknown) 表示(74452) 假如(27690) 戰爭(42758) 因素(34409) 快速(20632) 消失(30223) 而且(180402) 全球(21104) 經濟(83046) 復甦(1406) 步伐(3777) 持續(33796) 資產(14148) 負債表(1) 財報(186) 透明度(386) 或(478077) 企業(65457) 治理(5304) 各(243023) 方面(75079) 已(215610) 有(2217079) 長足(519) 改善(21559) 的(16029838) 亞洲(13256) 地區(40339) 股市(5507) 的(16029838) 突出(7198) 表現(67272) 可以(560531) 期待(21616),"{'High': 62, 'Low': 5}","{'Unknown': 14, '第1級': 9, '第4級': 7, '第5級': 10, '第4*級': 14, '第7級': 1, '第3*級': 5, '第2級': 2, '第3級': 3, '第6級': 2}",5,Y,Y,N,Y
亞洲經濟基本面仍然堅實，投資人預期也已落底。,亞洲 經濟 基本面 仍然 堅實 投資人 預期 也 已 落 底,11,亞洲(13256) 經濟(83046) 基本面(387) 仍然(46200) 堅實(1821) 投資人(4395) 預期(11499) 也(1590760) 已(215610) 落(7273) 底(37174),{'High': 11},"{'第3*級': 2, '第4級': 2, 'Unknown': 2, '第7級': 1, '第4*級': 1, '第1級': 1, '第3級': 1, '第5級': 1}",2,Y,N,N,N
此外，亞洲企業產能過剩的情況較西方國家輕微很多，目前美國公司仍持續受到定價能力減弱與產能閒置問題所苦，但亞洲國家早從199798年亞洲金融風暴開始，即積極進行降低成本與企業重整的工作，因此，不論在資產負債表、透明度或是企業治理各方面，皆有長足的改善。,此外 亞洲 企業 產能 過剩 的 情況 較 西方 國家 輕微 很多 目前 美國 公司 仍 持續 受到 定價 能力 減弱 與 產能 閒置 問題 所 苦 但 亞洲 國家 早 從 1997 98年 亞洲 金融 風暴 開始 即 積極 進行 降低 成本 與 企業 重整 的 工作 因此 不論 在 資產 負債表 透明度 或是 企業 治理 各 方面 皆 有 長足 的 改善,64,此外(30247) 亞洲(13256) 企業(65457) 產能(1444) 過剩(1337) 的(16029838) 情況(92301) 較(78424) 西方(28701) 國家(109166) 輕微(4389) 很多(113128) 目前(48695) 美國(148299) 公司(168500) 仍(92056) 持續(33796) 受到(66513) 定價(1447) 能力(93399) 減弱(1944) 與(968432) 產能(1444) 閒置(724) 問題(280782) 所(527327) 苦(19101) 但(597124) 亞洲(13256) 國家(109166) 早(62038) 從(496546) 1997(4336) 98年(36) 亞洲(13256) 金融(15237) 風暴(4066) 開始(245562) 即(110826) 積極(24247) 進行(100298) 降低(15638) 成本(20612) 與(968432) 企業(65457) 重整(1607) 的(16029838) 工作(220164) 因此(184606) 不論(28127) 在(3284238) 資產(14148) 負債表(1) 透明度(386) 或是(75906) 企業(65457) 治理(5304) 各(243023) 方面(75079) 皆(45736) 有(2217079) 長足(519) 的(16029838) 改善(21559),"{'High': 62, 'Low': 2}","{'第5級': 8, '第3*級': 4, '第4*級': 10, 'Unknown': 12, '第1級': 8, '第4級': 5, '第2級': 9, '第1*級': 4, '第7級': 1, '第6級': 3}",4,Y,Y,N,N
而在目前審慎樂觀的環境中，亞洲內部需求對經濟成長有相當大的貢獻，包括南韓、泰國與印尼都是顯著的例子。,而 在 目前 審慎 樂觀 的 環境 中 亞洲 內部 需求 對 經濟 成長 有 相當 大 的 貢獻 包括 南韓 泰國 與 印尼 都 是 顯著 的 例子,29,而(937923) 在(3284238) 目前(48695) 審慎(1734) 樂觀(10259) 的(16029838) 環境(71054) 中(1011729) 亞洲(13256) 內部(20578) 需求(29061) 對(897964) 經濟(83046) 成長(42450) 有(2217079) 相當(66293) 大(525780) 的(16029838) 貢獻(15759) 包括(74410) 南韓(2210) 泰國(2285) 與(968432) 印尼(3068) 都(1125846) 是(4642407) 顯著(7255) 的(16029838) 例子(31209),{'High': 29},"{'第5級': 5, '第1*級': 1, '第4級': 3, '第7級': 1, '第4*級': 2, '第1級': 8, '第3級': 3, 'Unknown': 3, '第3*級': 2, '第6級': 1}",0,Y,Y,N,N
去年美歐股市持續破底下挫，亞洲區域卻有相對抗跌的表現。,去年 美 歐 股市 持續 破底 下挫 亞洲 區域 卻 有 相對 抗跌 的 表現,15,去年(9462) 美(53380) 歐(9276) 股市(5507) 持續(33796) 破底(13) 下挫(124) 亞洲(13256) 區域(14982) 卻(333007) 有(2217079) 相對(20694) 抗跌(4) 的(16029838) 表現(67272),"{'High': 13, 'Low': 2}","{'第1級': 3, '第1*級': 1, 'Unknown': 4, '第5級': 2, '第4*級': 2, '第3*級': 1, '第4級': 2}",0,Y,N,N,N
在低迷的投資氣氛中，亞股之所以能得到適度的支撐，除因具有本益比偏低的優勢之外，亞洲股市的平均股利率普遍較美國來得高，突顯出亞洲市場除了成長性，更兼具防禦價值，也是亞股受到投資人青睞的另一原因。,在 低迷 的 投資 氣氛 中 亞股 之所以 能 得到 適度 的 支撐 除 因 具有 本益比 偏低 的 優勢 之外 亞洲 股市 的 平均 股利率 普遍 較 美國 來得 高 突顯出 亞洲 市場 除了 成長性 更 兼具 防禦 價值 也 是 亞股 受到 投資人 青睞 的 另 一 原因,50,在(3284238) 低迷(693) 的(16029838) 投資(38191) 氣氛(16132) 中(1011729) 亞股(Unknown) 之所以(21602) 能(582260) 得到(84614) 適度(2296) 的(16029838) 支撐(6335) 除(15929) 因(119364) 具有(60702) 本益比(271) 偏低(719) 的(16029838) 優勢(16050) 之外(45757) 亞洲(13256) 股市(5507) 的(16029838) 平均(13871) 股利率(Unknown) 普遍(16221) 較(78424) 美國(148299) 來得(9459) 高(128858) 突顯出(338) 亞洲(13256) 市場(65023) 除了(75964) 成長性(81) 更(361676) 兼具(2204) 防禦(4470) 價值(58784) 也(1590760) 是(4642407) 亞股(Unknown) 受到(66513) 投資人(4395) 青睞(1855) 的(16029838) 另(138369) 一(3701681) 原因(67404),"{'High': 46, 'Low': 4}","{'第1*級': 2, '第7級': 1, '第1級': 10, '第4*級': 3, 'Unknown': 13, '第5級': 2, '第3*級': 6, '第6級': 7, '第4級': 3, '第2級': 2, '第3級': 1}",6,Y,Y,N,N
廣達電腦預估第一季營收將可突破500億元，業績雖然成長，但今天股價仍隨勢下跌，在平盤63元之下成交。,廣達 電腦 預估 第一 季 營收 將 可 突破 500億 元 業績 雖然 成長 但 今天 股價 仍 隨 勢 下跌 在 平盤 63 元 之下 成交,27,廣達(214) 電腦(38528) 預估(1387) 第一(172544) 季(8122) 營收(1572) 將(448374) 可(307359) 突破(10583) 500億(39) 元(60807) 業績(4265) 雖然(152988) 成長(42450) 但(597124) 今天(73277) 股價(5495) 仍(92056) 隨(28011) 勢(7403) 下跌(2217) 在(3284238) 平盤(36) 63(1247) 元(60807) 之下(34606) 成交(1424),"{'High': 25, 'Low': 2}","{'Unknown': 9, '第1*級': 2, '第6級': 3, '第2級': 3, '第3級': 1, '第5級': 3, '第4*級': 1, '第1級': 3, '第4級': 2}",1,Y,Y,N,Y
廣達1月營收172億元，創歷史新高，2、3月營收也有機會再創新高，由於客戶持續追加訂單，預估第一季營收將突破500億元，在不景氣中創下單季營收新高紀錄。,廣達 1月 營收 172億 元 創 歷史 新高 2 3月 營收 也 有 機會 再 創 新高 由於 客戶 持續 追加 訂單 預估 第一 季 營收 將 突破 500億 元 在 不景氣 中 創下 單 季 營收 新高 紀錄,39,廣達(214) 1月(1) 營收(1572) 172億(1) 元(60807) 創(5368) 歷史(96060) 新高(219) 2(66480) 3月(3) 營收(1572) 也(1590760) 有(2217079) 機會(81244) 再(326207) 創(5368) 新高(219) 由於(88111) 客戶(19413) 持續(33796) 追加(560) 訂單(2471) 預估(1387) 第一(172544) 季(8122) 營收(1572) 將(448374) 突破(10583) 500億(39) 元(60807) 在(3284238) 不景氣(1650) 中(1011729) 創下(1422) 單(10648) 季(8122) 營收(1572) 新高(219) 紀錄(14233),"{'High': 35, 'Low': 4}","{'Unknown': 19, '第1級': 4, '第3級': 3, '第2級': 2, '第1*級': 2, '第4*級': 3, '第5級': 4, '第6級': 1, '第4級': 1}",3,Y,Y,N,Y
法人指出，由於廣達90年度現金股利2.5元，市場預期91年度廣達現金股利仍有2元以上的實力。,法人 指出 由於 廣達 90年度 現金 股利 25 元 市場 預期 91年度 廣達 現金 股利 仍 有 2 元 以上 的 實力,22,法人(2764) 指出(38456) 由於(88111) 廣達(214) 90年度(3) 現金(5112) 股利(482) 25(6914) 元(60807) 市場(65023) 預期(11499) 91年度(3) 廣達(214) 現金(5112) 股利(482) 仍(92056) 有(2217079) 2(66480) 元(60807) 以上(36569) 的(16029838) 實力(9808),"{'High': 20, 'Low': 2}","{'第6級': 1, 'Unknown': 9, '第4*級': 2, '第4級': 3, '第1級': 4, '第2級': 1, '第3*級': 1, '第5級': 1}",2,Y,Y,N,Y
以目前銀行定存年息不到2%來計算，廣達若發放現金股利2元，相當於年息3.2%，遠高於定存的投資報酬率。,以 目前 銀行 定存 年息 不到 2 來 計算 廣達 若 發放 現金 股利 2 元 相當於 年息 32 遠 高於 定存 的 投資 報酬率,25,以(547785) 目前(48695) 銀行(33825) 定存(230) 年息(165) 不到(2809) 2(66480) 來(742183) 計算(14712) 廣達(214) 若(92766) 發放(1376) 現金(5112) 股利(482) 2(66480) 元(60807) 相當於(6270) 年息(165) 32(3073) 遠(57546) 高於(3879) 定存(230) 的(16029838) 投資(38191) 報酬率(1515),{'High': 25},"{'第5級': 1, '第4級': 3, '第2級': 2, 'Unknown': 14, '第1級': 3, '第6級': 1, '第4*級': 1}",2,Y,Y,N,Y
證期會昨日發布期貨商財報編製準則草案，擬要求期貨商揭露重估價的固定資產及無形資產折舊或攤銷方式，以及將未認列為退休金成本的淨損失和庫藏股票列為股東權益其他項目。,證期會 昨 日 發布 期貨商 財報 編製 準則 草案 擬 要求 期貨商 揭露 重 估價 的 固定 資產 及 無形 資產 折舊 或 攤銷 方式 以及 將 未 認列 為 退休金 成本 的 淨損失 和 庫藏 股票 列為 股東 權益 其他 項目,42,證期會(5) 昨(531) 日(94041) 發布(3171) 期貨商(1) 財報(186) 編製(1345) 準則(4607) 草案(1195) 擬(5629) 要求(71192) 期貨商(1) 揭露(4038) 重(31331) 估價(905) 的(16029838) 固定(15809) 資產(14148) 及(304586) 無形(5760) 資產(14148) 折舊(364) 或(478077) 攤銷(27) 方式(133407) 以及(155624) 將(448374) 未(101927) 認列(66) 為(761341) 退休金(737) 成本(20612) 的(16029838) 淨損失(Unknown) 和(1338337) 庫藏(146) 股票(13732) 列為(3260) 股東(6692) 權益(3789) 其他(189445) 項目(12387),"{'Low': 6, 'High': 36}","{'Unknown': 17, '第1級': 3, '第6級': 7, '第3*級': 1, '第4*級': 2, '第5級': 10, '第3級': 1, '第2級': 1}",5,Y,Y,N,N
證期會規定，期貨商管理當局應對財報的編製出具聲明和資產與負債應區分與非流動的分類標準；另增訂其他金融資產揭露相關規定，以及長期負債分類及揭露的相關規定。,證期會 規定 期貨商 管理 當局 應對 財報 的 編製 出具 聲明 和 資產 與 負債 應 區分 與 非 流動 的 分類 標準 另 增訂 其他 金融 資產 揭露 相關 規定 以及 長期 負債 分類 及 揭露 的 相關 規定,40,證期會(5) 規定(24592) 期貨商(1) 管理(54484) 當局(8761) 應對(3459) 財報(186) 的(16029838) 編製(1345) 出具(251) 聲明(5271) 和(1338337) 資產(14148) 與(968432) 負債(2396) 應(82417) 區分(6917) 與(968432) 非(112415) 流動(7826) 的(16029838) 分類(9460) 標準(31106) 另(138369) 增訂(348) 其他(189445) 金融(15237) 資產(14148) 揭露(4038) 相關(41599) 規定(24592) 以及(155624) 長期(28592) 負債(2396) 分類(9460) 及(304586) 揭露(4038) 的(16029838) 相關(41599) 規定(24592),"{'Low': 2, 'High': 38}","{'Unknown': 9, '第4級': 3, '第4*級': 5, '第5級': 11, '第6級': 6, '第1級': 3, '第3*級': 1, '第3級': 1, '第2級': 1}",2,Y,Y,N,N
為強化會計師的獨立性，證期會此次也在草案中增訂，期貨商董事長、總經理、負責財務或會計事務的經理人，最近一年內曾任職於簽證會計師所屬事務所或其關係企業者，須揭露有關資訊。,為 強化 會計師 的 獨立性 證期會 此 次 也 在 草案 中 增訂 期貨商 董事長 總經理 負責 財務 或 會計 事務 的 經理人 最近 一 年 內 曾 任職 於 簽證 會計師 所屬 事務所 或 其 關係 企業 者 須 揭露 有關 資訊,43,為(761341) 強化(10215) 會計師(1348) 的(16029838) 獨立性(1275) 證期會(5) 此(288458) 次(331701) 也(1590760) 在(3284238) 草案(1195) 中(1011729) 增訂(348) 期貨商(1) 董事長(8106) 總經理(6256) 負責(37090) 財務(9196) 或(478077) 會計(4887) 事務(12270) 的(16029838) 經理人(5742) 最近(30174) 一(3701681) 年(514736) 內(183051) 曾(132981) 任職(4951) 於(327210) 簽證(1065) 會計師(1348) 所屬(4028) 事務所(3856) 或(478077) 其(307905) 關係(162883) 企業(65457) 者(423504) 須(17260) 揭露(4038) 有關(69607) 資訊(37848),"{'High': 41, 'Low': 2}","{'Unknown': 13, '第5級': 5, '第1級': 5, '第2級': 2, '第1*級': 1, '第6級': 6, '第4*級': 2, '第3級': 6, '第4級': 3}",9,Y,Y,N,N
台灣證券交易所昨日統計，外資在前周小幅買超後上周又轉買為賣，使得今年到上周五為止，外資累計買超再降為108億元；外資持股總市值也減少為1兆4，511億元，占全體市場總市值的16.01%。,台灣 證券 交易所 昨 日 統計 外資 在 前 周 小幅 買超 後 上 周 又 轉 買 為 賣 使得 今年 到 上 周五 為止 外資 累計 買超 再 降為 108億 元 外資 持股 總市值 也 減少 為 1兆4 511億 元 占 全體 市場 總市值 的 1601,48,台灣(130718) 證券(5757) 交易所(2199) 昨(531) 日(94041) 統計(9580) 外資(1829) 在(3284238) 前(272709) 周(10111) 小幅(235) 買超(8) 後(422857) 上(1233218) 周(10111) 又(535555) 轉(20108) 買(59736) 為(761341) 賣(27821) 使得(30960) 今年(10836) 到(546906) 上(1233218) 周五(65) 為止(17781) 外資(1829) 累計(660) 買超(8) 再(326207) 降為(779) 108億(3) 元(60807) 外資(1829) 持股(1245) 總市值(118) 也(1590760) 減少(22815) 為(761341) 1兆4(Unknown) 511億(Unknown) 元(60807) 占(14546) 全體(7029) 市場(65023) 總市值(118) 的(16029838) 1601(87),"{'High': 41, 'Low': 7}","{'第1級': 13, '第6級': 5, 'Unknown': 17, '第5級': 7, '第1*級': 3, '第2級': 2, '第4級': 1}",7,Y,N,N,N
證交所說，外資持股(包括原始股東持股及自集中市場買進之持股)到上周五的市值為1兆4，511億元，佔全體上市公司市值的16.01%；同時較前周的1兆5，026億元減少515億元。,證交所 說 外資 持股 包括 原始 股東 持股 及 自 集中 市場 買進 之 持股 到 上 周五 的 市值 為 1兆4511億 元 佔 全體 上市 公司 市值 的 1601 同時 較 前 周 的 1兆5026億 元 減少 515億 元,40,證交所(121) 說(1285247) 外資(1829) 持股(1245) 包括(74410) 原始(11993) 股東(6692) 持股(1245) 及(304586) 自(59676) 集中(18277) 市場(65023) 買進(2343) 之(875481) 持股(1245) 到(546906) 上(1233218) 周五(65) 的(16029838) 市值(827) 為(761341) 1兆4511億(Unknown) 元(60807) 佔(11252) 全體(7029) 上市(7933) 公司(168500) 市值(827) 的(16029838) 1601(87) 同時(115305) 較(78424) 前(272709) 周(10111) 的(16029838) 1兆5026億(Unknown) 元(60807) 減少(22815) 515億(1) 元(60807),"{'High': 35, 'Low': 5}","{'Unknown': 13, '第1級': 10, '第6級': 2, '第3*級': 2, '第5級': 8, '第4*級': 1, '第2級': 3, '第4級': 1}",5,Y,Y,N,N
