sentence,sentence_preprocessed,sentence_length,word_freq,high_low_freq,word_level,long_word_count,is_complete_sentence,is_complete_context,is_blacklist,is_greylist
中船公司推動再生計畫引爆發不出薪水的勞資爭議案，十七日在高雄市政府勞工局第一次調解，勞、資雙方一度惡言相向，初步獲得兩點結論，勞工局將深入問題癥結，再邀雙方調解。,中船 公司 推動 再生 計畫 引爆 發不出 薪水 的 勞資 爭議案 十七日 在 高雄市 政府 勞工局 第一 次 調解 勞 資 雙方 一度 惡言相向 初步 獲得 兩 點 結論 勞工局 將 深入 問題 癥結 再 邀 雙方 調解,38,中船(51) 公司(168500) 推動(14867) 再生(2722) 計畫(54820) 引爆(1328) 發不出(Unknown) 薪水(5575) 的(16029838) 勞資(591) 爭議案(6) 十七日(2909) 在(3284238) 高雄市(1220) 政府(92663) 勞工局(54) 第一(172544) 次(331701) 調解(1129) 勞(2196) 資(1722) 雙方(22984) 一度(5292) 惡言相向(3) 初步(3730) 獲得(54809) 兩(526190) 點(118735) 結論(15145) 勞工局(54) 將(448374) 深入(18074) 問題(280782) 癥結(1313) 再(326207) 邀(7410) 雙方(22984) 調解(1129),"{'Low': 6, 'High': 32}","{'Unknown': 12, '第2級': 4, '第4*級': 4, '第6級': 4, '第4級': 2, '第1級': 4, '第1*級': 2, '第7級': 2, '第5級': 4}",7,Y,N,N,N
工會代表表示，目前有三分之一員工以年休假方式抗議。,工會 代表 表示 目前 有 三分之一 員工 以 年休假 方式 抗議,11,工會(3243) 代表(58333) 表示(74452) 目前(48695) 有(2217079) 三分之一(3691) 員工(31766) 以(547785) 年休假(Unknown) 方式(133407) 抗議(8382),"{'High': 10, 'Low': 1}","{'Unknown': 3, '第4級': 3, '第4*級': 2, '第1級': 1, '第5級': 2}",2,Y,N,N,N
中船公司上月底宣布發不出薪水，而引發推動再生計畫的爭議，勞方向市府勞工局申請重大勞資爭議調解。,中船 公司 上 月底 宣布 發不出 薪水 而 引發 推動 再生 計畫 的 爭議 勞方 向 市府 勞工局 申請 重大 勞資 爭議 調解,23,中船(51) 公司(168500) 上(1233218) 月底(333) 宣布(10219) 發不出(Unknown) 薪水(5575) 而(937923) 引發(17487) 推動(14867) 再生(2722) 計畫(54820) 的(16029838) 爭議(7127) 勞方(81) 向(231672) 市府(433) 勞工局(54) 申請(10489) 重大(19228) 勞資(591) 爭議(7127) 調解(1129),"{'Low': 4, 'High': 19}","{'Unknown': 7, '第2級': 3, '第1級': 2, '第4*級': 3, '第4級': 2, '第5級': 4, '第6級': 1, '第7級': 1}",2,Y,Y,N,N
勞工局十七日下午四時邀集雙方調解，雙方都派員出席，調解會由勞工局主任秘書李煥薰主持。,勞工局 十七日 下午 四時 邀集 雙方 調解 雙方 都 派員 出席 調解會 由 勞工局 主任秘書 李煥薰 主持,17,勞工局(54) 十七日(2909) 下午(20045) 四時(775) 邀集(426) 雙方(22984) 調解(1129) 雙方(22984) 都(1125846) 派員(584) 出席(6104) 調解會(2) 由(208604) 勞工局(54) 主任秘書(Unknown) 李煥薰(Unknown) 主持(9827),"{'Low': 5, 'High': 12}","{'Unknown': 9, '第1級': 2, '第4*級': 3, '第7級': 1, '第5級': 2}",6,Y,N,N,Y
產業工會代表與資方代表中船副總經理范光男在勞工局見面時，對過去資方點名六名工會代表幹部之事相當憤慨，雙方互責不是，由李主任秘書勸說後平息火氣。,產業 工會 代表 與 資方 代表 中船 副總經理 范光男 在 勞工局 見面 時 對 過去 資方 點名 六 名 工會 代表 幹部 之 事 相當 憤慨 雙方 互 責 不是 由 李 主任秘書 勸說 後 平息 火氣,37,產業(29756) 工會(3243) 代表(58333) 與(968432) 資方(325) 代表(58333) 中船(51) 副總經理(810) 范光男(Unknown) 在(3284238) 勞工局(54) 見面(13096) 時(623734) 對(897964) 過去(88758) 資方(325) 點名(1244) 六(77936) 名(136287) 工會(3243) 代表(58333) 幹部(7475) 之(875481) 事(385949) 相當(66293) 憤慨(1258) 雙方(22984) 互(2999) 責(2713) 不是(12) 由(208604) 李(17994) 主任秘書(Unknown) 勸說(2078) 後(422857) 平息(2771) 火氣(962),"{'High': 32, 'Low': 5}","{'第5級': 4, 'Unknown': 13, '第4級': 4, '第4*級': 3, '第1*級': 2, '第2*級': 1, '第3*級': 1, '第1級': 3, '第2級': 1, '第3級': 1, '第7級': 1, '第6級': 3}",4,Y,Y,N,Y
經過將近兩個小時的折衝討論獲得初步結論，員工代表雖然不滿意，但仍接受。,經過 將近 兩 個 小時 的 折衝 討論 獲得 初步 結論 員工 代表 雖然 不 滿意 但 仍 接受,19,經過(64617) 將近(7567) 兩(526190) 個(2296574) 小時(48521) 的(16029838) 折衝(349) 討論(59041) 獲得(54809) 初步(3730) 結論(15145) 員工(31766) 代表(58333) 雖然(152988) 不(2282521) 滿意(16756) 但(597124) 仍(92056) 接受(84729),{'High': 19},"{'第2級': 3, '第4*級': 2, '第1級': 5, 'Unknown': 1, '第3*級': 1, '第5級': 2, '第4級': 5}",0,Y,Y,N,N
兩項決議，一是下次再舉行調解時，由中船董事長余辰南或總經理江元璋出席，以獲得有效且具體的結論；另一是同意由勞工局指定調查委員高雄市工業會總幹事李威穎等人，調查真正自願離退的員工名單，了解勞、資爭議的癥結。,兩 項 決議 一 是 下 次 再 舉行 調解 時 由 中船 董事長 余辰南 或 總經理 江元璋 出席 以 獲得 有效 且 具體 的 結論 另 一 是 同意 由 勞工局 指定 調查 委員 高雄市 工業會 總幹事 李威穎 等 人 調查 真正 自願 離退 的 員工 名單 了解 勞 資 爭議 的 癥結,54,兩(526190) 項(88887) 決議(2452) 一(3701681) 是(4642407) 下(329549) 次(331701) 再(326207) 舉行(17660) 調解(1129) 時(623734) 由(208604) 中船(51) 董事長(8106) 余辰南(Unknown) 或(478077) 總經理(6256) 江元璋(Unknown) 出席(6104) 以(547785) 獲得(54809) 有效(30667) 且(67015) 具體(20349) 的(16029838) 結論(15145) 另(138369) 一(3701681) 是(4642407) 同意(30620) 由(208604) 勞工局(54) 指定(5033) 調查(34821) 委員(10662) 高雄市(1220) 工業會(33) 總幹事(582) 李威穎(Unknown) 等(327380) 人(1550512) 調查(34821) 真正(77318) 自願(4020) 離退(4) 的(16029838) 員工(31766) 名單(6552) 了解(82970) 勞(2196) 資(1722) 爭議(7127) 的(16029838) 癥結(1313),"{'High': 47, 'Low': 7}","{'第1級': 9, '第5級': 9, '第6級': 2, '第1*級': 2, '第2級': 1, '第4級': 3, '第7級': 1, '第3*級': 3, '第4*級': 6, 'Unknown': 14, '第3級': 4}",9,Y,Y,N,Y
工會代表說，公司十一月底宣布對工人只發放四分之一薪資，而職員的十二月薪資至十七日仍未發放，資方表示將於十二月二十日先發放薪資三分之一，未來再協調向台糖、台鹽公司融資，取得十三億元後即可正常發放薪資。,工會 代表 說 公司 十一月 底 宣布 對 工人 只 發放 四分之一 薪資 而 職員 的 十二月 薪資 至 十七日 仍 未 發放 資方 表示 將 於 十二月 二十日 先 發放 薪資 三分之一 未來 再 協調 向 台糖 台鹽 公司 融資 取得 十三億 元 後 即可 正常 發放 薪資,49,工會(3243) 代表(58333) 說(1285247) 公司(168500) 十一月(12863) 底(37174) 宣布(10219) 對(897964) 工人(13089) 只(436725) 發放(1376) 四分之一(2159) 薪資(3239) 而(937923) 職員(4322) 的(16029838) 十二月(13715) 薪資(3239) 至(101530) 十七日(2909) 仍(92056) 未(101927) 發放(1376) 資方(325) 表示(74452) 將(448374) 於(327210) 十二月(13715) 二十日(3322) 先(136649) 發放(1376) 薪資(3239) 三分之一(3691) 未來(54445) 再(326207) 協調(8656) 向(231672) 台糖(398) 台鹽(20) 公司(168500) 融資(2070) 取得(25649) 十三億(194) 元(60807) 後(422857) 即可(7563) 正常(28865) 發放(1376) 薪資(3239),"{'High': 48, 'Low': 1}","{'Unknown': 14, '第4級': 3, '第1級': 5, '第2級': 3, '第3*級': 3, '第4*級': 2, '第1*級': 3, '第6級': 6, '第5級': 10}",8,Y,Y,N,Y
但員工都持懷疑態度，擔心薪水沒有下落。,但 員工 都 持 懷疑 態度 擔心 薪水 沒有 下落,10,但(597124) 員工(31766) 都(1125846) 持(11680) 懷疑(29705) 態度(56470) 擔心(40962) 薪水(5575) 沒有(594280) 下落(2704),{'High': 10},"{'第2級': 1, '第4級': 3, '第1級': 2, '第5級': 1, '第4*級': 1, '第3*級': 1, '第6級': 1}",0,Y,Y,N,N
長榮航空今年四月才宣布調整董事長與總經理的重大人事案，不到九個月的時間再次出現人事異動。,長榮 航空 今年 四月 才 宣布 調整 董事長 與 總經理 的 重大 人事案 不 到 九 個 月 的 時間 再次 出現 人事 異動,24,長榮(1252) 航空(4707) 今年(10836) 四月(14996) 才(394539) 宣布(10219) 調整(18900) 董事長(8106) 與(968432) 總經理(6256) 的(16029838) 重大(19228) 人事案(53) 不(2282521) 到(546906) 九(34506) 個(2296574) 月(148997) 的(16029838) 時間(213595) 再次(21282) 出現(124694) 人事(6842) 異動(388),"{'High': 23, 'Low': 1}","{'Unknown': 7, '第5級': 2, '第1級': 9, '第2級': 1, '第4*級': 4, '第4級': 1}",3,Y,Y,N,Y
長榮集團副總裁鄭金泉免兼長榮航空董事長，遺缺內定由長榮航勤董事長游長和繼任。,長榮 集團 副總裁 鄭金泉 免 兼 長榮 航空 董事長 遺缺 內定 由 長榮 航勤 董事長 游長和 繼任,17,長榮(1252) 集團(20609) 副總裁(1729) 鄭金泉(1) 免(7314) 兼(16339) 長榮(1252) 航空(4707) 董事長(8106) 遺缺(135) 內定(192) 由(208604) 長榮(1252) 航勤(1) 董事長(8106) 游長和(Unknown) 繼任(2126),"{'High': 14, 'Low': 3}","{'Unknown': 11, '第5級': 3, '第6級': 2, '第4*級': 1}",5,Y,N,N,Y
這項人事異動案將在長榮航空召開董事會與股東常會後敲定。,這 項 人事 異動案 將 在 長榮 航空 召開 董事會 與 股東 常會 後 敲定,15,這(2114032) 項(88887) 人事(6842) 異動案(1) 將(448374) 在(3284238) 長榮(1252) 航空(4707) 召開(5858) 董事會(3346) 與(968432) 股東(6692) 常會(15) 後(422857) 敲定(522),"{'High': 13, 'Low': 2}","{'第1級': 2, '第5級': 4, 'Unknown': 4, '第1*級': 1, '第6級': 2, '第4*級': 1, '第7級': 1}",2,Y,Y,N,Y
此外，配合董事長調整，原長榮航空總經理吳景明也轉任他職，遺缺由長榮空廚總經理嚴若琪接任。,此外 配合 董事長 調整 原 長榮 航空 總經理 吳景明 也 轉任 他職 遺缺 由 長榮 空廚 總經理 嚴若琪 接任,19,此外(30247) 配合(17173) 董事長(8106) 調整(18900) 原(33852) 長榮(1252) 航空(4707) 總經理(6256) 吳景明(1) 也(1590760) 轉任(855) 他職(Unknown) 遺缺(135) 由(208604) 長榮(1252) 空廚(19) 總經理(6256) 嚴若琪(Unknown) 接任(2185),"{'High': 15, 'Low': 4}","{'第5級': 2, '第4*級': 3, 'Unknown': 12, '第1級': 1, '第6級': 1}",5,Y,Y,N,Y
長榮航空這項人事搬風數週前已出現徵兆，不過當時無法證實。,長榮 航空 這 項 人事 搬風 數 週 前 已 出現 徵兆 不過 當時 無法 證實,16,長榮(1252) 航空(4707) 這(2114032) 項(88887) 人事(6842) 搬風(3) 數(38654) 週(20879) 前(272709) 已(215610) 出現(124694) 徵兆(2839) 不過(186226) 當時(126214) 無法(150606) 證實(10978),"{'High': 15, 'Low': 1}","{'Unknown': 2, '第5級': 5, '第1級': 2, '第3*級': 2, '第3級': 2, '第4級': 1, '第6級': 1, '第2級': 1}",0,Y,Y,N,Y
新任長榮航空總經理嚴若琪幹練精明，在長榮集團歷練不少職務，資歷亦不淺。,新任 長榮 航空 總經理 嚴若琪 幹練 精明 在 長榮 集團 歷練 不少 職務 資歷 亦 不 淺,17,新任(1584) 長榮(1252) 航空(4707) 總經理(6256) 嚴若琪(Unknown) 幹練(780) 精明(3297) 在(3284238) 長榮(1252) 集團(20609) 歷練(1525) 不少(35256) 職務(7851) 資歷(1487) 亦(68507) 不(2282521) 淺(6626),"{'High': 16, 'Low': 1}","{'Unknown': 6, '第5級': 3, '第7級': 1, '第6級': 4, '第1*級': 1, '第1級': 1, '第3*級': 1}",2,Y,N,N,Y
嚴若琪的出線，除了替長榮航空創下第一位女總經理的紀錄，未來也與中華航空總經理宗才怡同樣是巾幗英雄，不讓鬚眉。,嚴若琪 的 出線 除了 替 長榮 航空 創下 第一 位 女 總經理 的 紀錄 未來 也 與 中華 航空 總經理 宗才怡 同樣 是 巾幗英雄 不 讓 鬚眉,27,嚴若琪(Unknown) 的(16029838) 出線(158) 除了(75964) 替(34886) 長榮(1252) 航空(4707) 創下(1422) 第一(172544) 位(284809) 女(51944) 總經理(6256) 的(16029838) 紀錄(14233) 未來(54445) 也(1590760) 與(968432) 中華(8450) 航空(4707) 總經理(6256) 宗才怡(Unknown) 同樣(63568) 是(4642407) 巾幗英雄(39) 不(2282521) 讓(526314) 鬚眉(109),"{'Low': 3, 'High': 24}","{'Unknown': 10, '第1級': 6, '第3*級': 2, '第2級': 3, '第5級': 2, '第1*級': 1, '第4級': 2, '第4*級': 1}",5,Y,N,N,Y
兩位傑出女性分掌國內兩大航空集團總座，使得這兩大航空集團的競爭意外地成為「兩個女人」的戰爭。,兩 位 傑出 女性 分 掌 國內 兩 大 航空 集團 總座 使得 這 兩 大 航空 集團 的 競爭 意外 地 成為 兩 個 女人 的 戰爭,28,兩(526190) 位(284809) 傑出(8102) 女性(59364) 分(62224) 掌(6406) 國內(17537) 兩(526190) 大(525780) 航空(4707) 集團(20609) 總座(3) 使得(30960) 這(2114032) 兩(526190) 大(525780) 航空(4707) 集團(20609) 的(16029838) 競爭(30766) 意外(21631) 地(754998) 成為(143834) 兩(526190) 個(2296574) 女人(71948) 的(16029838) 戰爭(42758),"{'High': 27, 'Low': 1}","{'第1級': 12, '第5級': 7, '第4級': 5, '第7級': 1, 'Unknown': 3}",0,Y,N,N,N
嚴若琪也是近年來長榮集團高階主管異動最頻繁的一位。,嚴若琪 也 是 近年 來 長榮 集團 高階 主管 異動 最 頻繁 的 一 位,15,嚴若琪(Unknown) 也(1590760) 是(4642407) 近年(7929) 來(742183) 長榮(1252) 集團(20609) 高階(4030) 主管(23448) 異動(388) 最(421680) 頻繁(4536) 的(16029838) 一(3701681) 位(284809),"{'Low': 1, 'High': 14}","{'Unknown': 3, '第1級': 6, '第4級': 1, '第5級': 3, '第4*級': 1, '第1*級': 1}",1,Y,N,N,Y
今年初，她才從長榮空廚調任長榮航空擔任副總經理，沒多久，又回鍋長榮空廚擔任總經理。,今年 初 她 才 從 長榮 空廚 調任 長榮 航空 擔任 副總經理 沒 多久 又 回鍋 長榮 空廚 擔任 總經理,20,今年(10836) 初(42087) 她(1052913) 才(394539) 從(496546) 長榮(1252) 空廚(19) 調任(1338) 長榮(1252) 航空(4707) 擔任(34825) 副總經理(810) 沒(306167) 多久(4774) 又(535555) 回鍋(133) 長榮(1252) 空廚(19) 擔任(34825) 總經理(6256),"{'High': 18, 'Low': 2}","{'第1級': 3, '第4級': 1, '第2級': 1, '第1*級': 3, 'Unknown': 9, '第5級': 3}",2,Y,N,N,Y
在此之前，嚴若琪在集團內經歷過不少職務，包括長榮海運與長榮國際等，是一位相當幹練的女性主管，深得長榮集團總裁張榮發的器重，不僅外語能力強，也涉獵不少新知識。,在 此 之前 嚴若琪 在 集團 內 經歷 過 不少 職務 包括 長榮 海運 與 長榮 國際 等 是 一 位 相當 幹練 的 女性 主管 深得 長榮 集團 總裁 張榮發 的 器重 不僅 外語 能力 強 也 涉獵 不少 新 知識,42,在(3284238) 此(288458) 之前(79748) 嚴若琪(Unknown) 在(3284238) 集團(20609) 內(183051) 經歷(29621) 過(412878) 不少(35256) 職務(7851) 包括(74410) 長榮(1252) 海運(1158) 與(968432) 長榮(1252) 國際(40846) 等(327380) 是(4642407) 一(3701681) 位(284809) 相當(66293) 幹練(780) 的(16029838) 女性(59364) 主管(23448) 深得(1310) 長榮(1252) 集團(20609) 總裁(5668) 張榮發(82) 的(16029838) 器重(754) 不僅(43138) 外語(1156) 能力(93399) 強(34876) 也(1590760) 涉獵(749) 不少(35256) 新(212453) 知識(63665),"{'High': 40, 'Low': 2}","{'第1*級': 3, '第5級': 7, '第4級': 4, 'Unknown': 10, '第3級': 2, '第3*級': 3, '第4*級': 2, '第1級': 7, '第7級': 3, '第2級': 1}",2,Y,Y,N,Y
這次嚴若琪扶正，升任長榮航空的總經理，一般並不意外。,這 次 嚴若琪 扶正 升任 長榮 航空 的 總經理 一般 並 不 意外,13,這(2114032) 次(331701) 嚴若琪(Unknown) 扶正(318) 升任(2085) 長榮(1252) 航空(4707) 的(16029838) 總經理(6256) 一般(80732) 並(442790) 不(2282521) 意外(21631),"{'High': 12, 'Low': 1}","{'第1級': 3, '第2級': 1, 'Unknown': 5, '第5級': 1, '第3*級': 1, '第4*級': 1, '第4級': 1}",2,Y,N,N,Y
以她的長才與能力，面對今後的挑戰，將可帶領長榮航空邁向一個新紀元。,以 她 的 長才 與 能力 面對 今後 的 挑戰 將 可 帶領 長榮 航空 邁向 一 個 新 紀元,20,以(547785) 她(1052913) 的(16029838) 長才(682) 與(968432) 能力(93399) 面對(62914) 今後(5606) 的(16029838) 挑戰(27513) 將(448374) 可(307359) 帶領(10447) 長榮(1252) 航空(4707) 邁向(3701) 一(3701681) 個(2296574) 新(212453) 紀元(1470),{'High': 20},"{'第5級': 4, '第1級': 6, 'Unknown': 3, '第4*級': 5, '第2級': 1, '第7級': 1}",0,Y,Y,N,Y
對長榮航空而言，由一位女性總經理領軍也算是頭一遭。,對 長榮 航空 而言 由 一 位 女性 總經理 領軍 也 算是 頭 一 遭,15,對(897964) 長榮(1252) 航空(4707) 而言(Unknown) 由(208604) 一(3701681) 位(284809) 女性(59364) 總經理(6256) 領軍(1532) 也(1590760) 算是(20622) 頭(112925) 一(3701681) 遭(18764),"{'High': 14, 'Low': 1}","{'第1級': 5, 'Unknown': 3, '第5級': 1, '第4*級': 2, '第4級': 1, '第6級': 1, '第1*級': 1, '第7級': 1}",1,Y,N,N,Y
嚴若琪在長榮航空當家後，也將為國內航空業界拉開兩個女人之戰的序幕。,嚴若琪 在 長榮 航空 當家 後 也 將 為 國內 航空 業界 拉開 兩 個 女人 之 戰 的 序幕,20,嚴若琪(Unknown) 在(3284238) 長榮(1252) 航空(4707) 當家(1703) 後(422857) 也(1590760) 將(448374) 為(761341) 國內(17537) 航空(4707) 業界(2575) 拉開(4485) 兩(526190) 個(2296574) 女人(71948) 之(875481) 戰(19521) 的(16029838) 序幕(1239),"{'Low': 1, 'High': 19}","{'Unknown': 5, '第1*級': 1, '第5級': 4, '第6級': 3, '第1級': 5, '第4級': 1, '第7級': 1}",1,Y,N,N,Y
嚴若琪的競爭對手華航總經理宗才怡不是省油的燈。,嚴若琪 的 競爭 對手 華航 總經理 宗才怡 不 是 省油 的 燈,12,嚴若琪(Unknown) 的(16029838) 競爭(30766) 對手(14528) 華航(215) 總經理(6256) 宗才怡(Unknown) 不(2282521) 是(4642407) 省油(16) 的(16029838) 燈(13821),"{'Low': 3, 'High': 9}","{'Unknown': 5, '第1級': 4, '第4級': 1, '第4*級': 1, '第2*級': 1}",3,Y,N,N,Y
宗才怡初掌華航總座一年半，華航的業務表現頗佳，今年在全球航空業界都傳出虧損惡耗之際，華航是少數仍有獲利的航空公司。,宗才怡 初 掌 華航 總座 一 年 半 華航 的 業務 表現 頗佳 今年 在 全球 航空 業界 都 傳出 虧損 惡耗 之 際 華航 是 少數 仍 有 獲利 的 航空 公司,33,宗才怡(Unknown) 初(42087) 掌(6406) 華航(215) 總座(3) 一(3701681) 年(514736) 半(80813) 華航(215) 的(16029838) 業務(15620) 表現(67272) 頗佳(241) 今年(10836) 在(3284238) 全球(21104) 航空(4707) 業界(2575) 都(1125846) 傳出(4421) 虧損(2400) 惡耗(101) 之(875481) 際(14344) 華航(215) 是(4642407) 少數(17629) 仍(92056) 有(2217079) 獲利(5644) 的(16029838) 航空(4707) 公司(168500),"{'Low': 2, 'High': 31}","{'Unknown': 8, '第4級': 5, '第7級': 1, '第1級': 9, '第4*級': 1, '第1*級': 1, '第5級': 4, '第6級': 3, '第2級': 1}",1,Y,N,N,Y
單憑這項能耐，使得當初以有色眼光看待宗才怡的人跌破眼鏡。,單 憑 這 項 能耐 使得 當初 以 有色 眼光 看待 宗才怡 的 人 跌破 眼鏡,16,單(10648) 憑(14790) 這(2114032) 項(88887) 能耐(1969) 使得(30960) 當初(14449) 以(547785) 有色(496) 眼光(13910) 看待(11392) 宗才怡(Unknown) 的(16029838) 人(1550512) 跌破(608) 眼鏡(6629),"{'High': 15, 'Low': 1}","{'第5級': 5, '第1級': 3, '第6級': 2, '第4*級': 2, 'Unknown': 3, '第2*級': 1}",1,Y,N,N,Y
各團隊競標3G執照到今(十八)日才截止收件，不過昨(十七)日十一時大眾集團和東元集團決定聯手以世界全通名義送件拔得頭籌，中午過後依序又有和信電訊、台灣大哥大、遠傳電信和東森寬頻電信等五組團隊陸續送件，今日聯邦電信和中華電信也會跟進，明年一月將有七組團隊競價爭取五張3G執照，電信總局將在競價作業開始前十四天，邀集各投標團隊說明競價作業流程。,各 團隊 競標 3G 執照 到 今 十八 日 才 截止 收件 不過 昨 十七 日 十一時 大眾 集團 和 東元 集團 決定 聯手 以 世界全通 名義 送件 拔得 頭籌 中午 過後 依序 又 有 和信 電訊 台灣 大哥大 遠傳 電信 和 東森 寬頻 電信 等 五 組 團隊 陸續 送件 今日 聯邦 電信 和 中華 電信 也 會 跟進 明年 一月 將 有 七 組 團隊 競價 爭取 五 張 3G 執照 電信總局 將 在 競價 作業 開始 前 十四 天 邀集 各 投標 團隊 說明 競價 作業 流程,90,各(243023) 團隊(16971) 競標(362) 3G(Unknown) 執照(2213) 到(546906) 今(33635) 十八(13604) 日(94041) 才(394539) 截止(582) 收件(333) 不過(186226) 昨(531) 十七(7310) 日(94041) 十一時(287) 大眾(22411) 集團(20609) 和(1338337) 東元(542) 集團(20609) 決定(101837) 聯手(2334) 以(547785) 世界全通(Unknown) 名義(5851) 送件(57) 拔得(162) 頭籌(182) 中午(6779) 過後(7751) 依序(1884) 又(535555) 有(2217079) 和信(109) 電訊(777) 台灣(130718) 大哥大(351) 遠傳(14) 電信(1755) 和(1338337) 東森(62) 寬頻(271) 電信(1755) 等(327380) 五(112649) 組(22075) 團隊(16971) 陸續(7091) 送件(57) 今日(20291) 聯邦(6246) 電信(1755) 和(1338337) 中華(8450) 電信(1755) 也(1590760) 會(1014977) 跟進(1352) 明年(3059) 一月(8186) 將(448374) 有(2217079) 七(59385) 組(22075) 團隊(16971) 競價(136) 爭取(9666) 五(112649) 張(99414) 3G(Unknown) 執照(2213) 電信總局(38) 將(448374) 在(3284238) 競價(136) 作業(16954) 開始(245562) 前(272709) 十四(9837) 天(330413) 邀集(426) 各(243023) 投標(348) 團隊(16971) 說明(52918) 競價(136) 作業(16954) 流程(6227),"{'High': 82, 'Low': 8}","{'第2級': 8, '第4*級': 7, 'Unknown': 32, '第5級': 16, '第1級': 14, '第6級': 5, '第1*級': 5, '第7級': 1, '第3*級': 1, '第4級': 1}",4,Y,Y,N,Y
交通部常務次長蔡堆十七日表示，業者發展3G業務最大的風險不在於執照標金，而在於何時才能提供3G服務，他個人認為，國內業者最快要到九十二年第一季才可能提供3G服務。,交通部 常務 次長 蔡堆 十七日 表示 業者 發展 3G 業務 最 大 的 風險 不 在於 執照 標金 而 在於 何時 才 能 提供 3G 服務 他 個人 認為 國內 業者 最 快 要 到 九十二年 第一 季 才 可能 提供 3G 服務,43,交通部(506) 常務(1660) 次長(520) 蔡堆(29) 十七日(2909) 表示(74452) 業者(6857) 發展(117494) 3G(Unknown) 業務(15620) 最(421680) 大(525780) 的(16029838) 風險(19287) 不(2282521) 在於(37953) 執照(2213) 標金(23) 而(937923) 在於(37953) 何時(9136) 才(394539) 能(582260) 提供(73097) 3G(Unknown) 服務(38055) 他(2487930) 個人(76253) 認為(192030) 國內(17537) 業者(6857) 最(421680) 快(116207) 要(851264) 到(546906) 九十二年(57) 第一(172544) 季(8122) 才(394539) 可能(271025) 提供(73097) 3G(Unknown) 服務(38055),"{'High': 37, 'Low': 6}","{'Unknown': 13, '第4*級': 4, '第4級': 3, '第1*級': 4, '第1級': 7, '第5級': 3, '第6級': 2, '第2級': 4, '第3級': 3}",3,Y,Y,N,Y
在聯邦電信今(十七)日的遞送3G標書後，業界原本預估的六組競標團隊瞬時變成七組團隊，除了打亂六家業者透過協調談判，完成五家業者以底價得標的美夢外，同時也墊高五張執照的取得成本，增加3G業者的成本。,在 聯邦 電信 今 十七 日 的 遞送 3G 標書 後 業界 原本 預估 的 六 組 競標 團隊 瞬時 變成 七 組 團隊 除了 打亂 六 家 業者 透過 協調 談判 完成 五 家 業者 以 底價 得標 的 美 夢 外 同時 也 墊高 五 張 執照 的 取得 成本 增加 3G 業者 的 成本,57,在(3284238) 聯邦(6246) 電信(1755) 今(33635) 十七(7310) 日(94041) 的(16029838) 遞送(352) 3G(Unknown) 標書(4) 後(422857) 業界(2575) 原本(35765) 預估(1387) 的(16029838) 六(77936) 組(22075) 競標(362) 團隊(16971) 瞬時(307) 變成(73009) 七(59385) 組(22075) 團隊(16971) 除了(75964) 打亂(907) 六(77936) 家(236822) 業者(6857) 透過(63117) 協調(8656) 談判(6935) 完成(60471) 五(112649) 家(236822) 業者(6857) 以(547785) 底價(82) 得標(246) 的(16029838) 美(53380) 夢(36155) 外(109310) 同時(115305) 也(1590760) 墊高(235) 五(112649) 張(99414) 執照(2213) 的(16029838) 取得(25649) 成本(20612) 增加(48296) 3G(Unknown) 業者(6857) 的(16029838) 成本(20612),"{'High': 53, 'Low': 4}","{'第1*級': 3, '第6級': 5, '第5級': 7, 'Unknown': 15, '第1級': 16, '第4*級': 6, '第4級': 2, '第3*級': 2, '第3級': 1}",0,Y,N,N,N
其間最大的獲利者，除了聯邦電信之外，當屬電信總局。,其 間 最 大 的 獲利 者 除了 聯邦 電信 之外 當 屬 電信總局,14,其(307905) 間(115638) 最(421680) 大(525780) 的(16029838) 獲利(5644) 者(423504) 除了(75964) 聯邦(6246) 電信(1755) 之外(45757) 當(294625) 屬(26012) 電信總局(38),"{'High': 13, 'Low': 1}","{'第6級': 2, 'Unknown': 5, '第1*級': 1, '第1級': 2, '第5級': 3, '第3*級': 1}",1,Y,N,N,N
