sentence,sentence_preprocessed,sentence_length,word_freq,high_low_freq,word_level,long_word_count,is_complete_sentence,is_complete_context,is_blacklist,is_greylist
隨著科學的迅速發展，若沒有必要的學歷和良好的知識，要想將來在科學技術界甚至文、法和商界求得較大的進取，沒有必要的學歷和良好的知識，會越來越困難。,隨著 科學 的 迅速 發展 若 沒有 必要 的 學歷 和 良好 的 知識 要 想 將來 在 科學 技術 界 甚至 文 法 和 商界 求得 較 大 的 進取 沒有 必要 的 學歷 和 良好 的 知識 會 越來越 困難,42,隨著(32948) 科學(55156) 的(16029838) 迅速(19888) 發展(117494) 若(92766) 沒有(594280) 必要(29889) 的(16029838) 學歷(2414) 和(1338337) 良好(16069) 的(16029838) 知識(63665) 要(851264) 想(449884) 將來(17836) 在(3284238) 科學(55156) 技術(47691) 界(2359) 甚至(122502) 文(28958) 法(40998) 和(1338337) 商界(1000) 求得(1797) 較(78424) 大(525780) 的(16029838) 進取(1974) 沒有(594280) 必要(29889) 的(16029838) 學歷(2414) 和(1338337) 良好(16069) 的(16029838) 知識(63665) 會(1014977) 越來越(27239) 困難(37504),{'High': 42},"{'第5級': 3, '第4級': 8, '第1級': 11, '第4*級': 4, 'Unknown': 9, '第3*級': 3, '第1*級': 2, '第2級': 1, '第7級': 1}",1,Y,Y,N,N
科學總是優惠於那些有足夠知識準備的人，這不僅變成了人們的常識，而且有變成規律的趨向。,科學 總是 優惠 於 那些 有 足夠 知識 準備 的 人 這 不僅 變成 了 人們 的 常識 而且 有 變成 規律 的 趨向,24,科學(55156) 總是(62757) 優惠(1810) 於(327210) 那些(113704) 有(2217079) 足夠(16814) 知識(63665) 準備(64901) 的(16029838) 人(1550512) 這(2114032) 不僅(43138) 變成(73009) 了(3199291) 人們(77778) 的(16029838) 常識(4123) 而且(180402) 有(2217079) 變成(73009) 規律(7165) 的(16029838) 趨向(1988),{'High': 24},"{'第4級': 4, '第2級': 2, '第6級': 1, '第5級': 2, 'Unknown': 4, '第1級': 7, '第3*級': 1, '第4*級': 2, '第3級': 1}",0,Y,Y,N,N
這並不是因為學習了科學技術就有了什麼特權，而是因為用現代先進的科學技術知識裝備起來的年輕一代，才能夠適應社會發展的高度需要。,這 並 不 是 因為 學習 了 科學 技術 就 有 了 什麼 特權 而是 因為 用 現代 先進 的 科學 技術 知識 裝備 起來 的 年輕 一 代 才 能夠 適應 社會 發展 的 高度 需要,37,這(2114032) 並(442790) 不(2282521) 是(4642407) 因為(425061) 學習(105345) 了(3199291) 科學(55156) 技術(47691) 就(1737544) 有(2217079) 了(3199291) 什麼(431321) 特權(4152) 而是(74258) 因為(425061) 用(377038) 現代(40344) 先進(6427) 的(16029838) 科學(55156) 技術(47691) 知識(63665) 裝備(3939) 起來(110738) 的(16029838) 年輕(48853) 一(3701681) 代(39507) 才(394539) 能夠(96422) 適應(14698) 社會(176660) 發展(117494) 的(16029838) 高度(20229) 需要(166793),{'High': 37},"{'第1級': 11, '第4*級': 2, '第1*級': 3, '第2級': 4, 'Unknown': 6, '第4級': 6, '第3*級': 3, '第5級': 1, '第6級': 1}",0,Y,Y,N,N
盡管在複雜的社會需要條件下，一個人的成長和成功取決於多方面的因素，有些因素又是個人所無法左右的，但是認真考慮起來，知識的良好準備往往有著關鍵性作用。,盡管 在 複雜 的 社會 需要 條件 下 一 個 人 的 成長 和 成功 取決 於 多方面 的 因素 有些 因素 又 是 個人 所 無法 左右 的 但是 認真 考慮 起來 知識 的 良好 準備 往往 有 著 關鍵性 作用,42,盡管(658) 在(3284238) 複雜(29761) 的(16029838) 社會(176660) 需要(166793) 條件(36308) 下(329549) 一(3701681) 個(2296574) 人(1550512) 的(16029838) 成長(42450) 和(1338337) 成功(80266) 取決(4501) 於(327210) 多方面(489) 的(16029838) 因素(34409) 有些(6971) 因素(34409) 又(535555) 是(4642407) 個人(76253) 所(527327) 無法(150606) 左右(33714) 的(16029838) 但是(247988) 認真(20556) 考慮(28774) 起來(110738) 知識(63665) 的(16029838) 良好(16069) 準備(64901) 往往(41388) 有(2217079) 著(1004687) 關鍵性(1953) 作用(37837),{'High': 42},"{'Unknown': 6, '第1*級': 4, '第4級': 5, '第1級': 10, '第3*級': 4, '第2級': 4, '第6級': 1, '第5級': 3, '第4*級': 4, '第3級': 1}",2,Y,Y,N,N
為了進一步說明這個道理，為了增強潛心攻讀的無數學子的信心，我們可以從英國劍橋大學卡文迪什實驗室(CavendishLaboratory)在126年的成功歷史中，找到很多的例證。,為了 進一步 說明 這 個 道理 為了 增強 潛心 攻讀 的 無數 學子 的 信心 我們 可以 從 英國 劍橋 大學 卡文迪什 實驗室 Cavendish Laboratory 在 126 年 的 成功 歷史 中 找到 很多 的 例證,36,為了(Unknown) 進一步(25130) 說明(52918) 這(2114032) 個(2296574) 道理(26615) 為了(Unknown) 增強(7309) 潛心(642) 攻讀(1211) 的(16029838) 無數(12002) 學子(1193) 的(16029838) 信心(17507) 我們(979260) 可以(560531) 從(496546) 英國(44248) 劍橋(2572) 大學(83893) 卡文迪什(36) 實驗室(12027) Cavendish(10) Laboratory(Unknown) 在(3284238) 126(544) 年(514736) 的(16029838) 成功(80266) 歷史(96060) 中(1011729) 找到(65281) 很多(113128) 的(16029838) 例證(1837),"{'Low': 5, 'High': 31}","{'Unknown': 11, '第4*級': 2, '第4級': 2, '第1級': 11, '第7級': 2, '第6級': 2, '第5級': 1, '第1*級': 2, '第3*級': 1, '第3級': 1, '第2級': 1}",6,Y,N,N,Y
卡文迪什物理實驗室成立於1871年，至今已有126年的漫長歷史，歷任卡文迪什教授兼物理系主任都是舉世聞名的大科學家，如電磁理論創立者馬克士威爾(J.C.Maxwell)、近代聲學理論奠基人瑞利男爵(LordJohnWilliamRayleight)、電子發現者湯姆森(J.J.Thomson)、核物理之父拉塞福(E.Rutherford)、X射線晶體結構分析提出者之一布拉格(W.L.Bragg)、非晶半導體理論提出者莫特(N.F.Mott)、倫敦兄弟超導體電動力學方程的修改者派帕德(A.B.Pippard)。,卡文迪什 物理 實驗室 成立 於 1871年 至今 已 有 126 年 的 漫長 歷史 歷任 卡文迪什 教授 兼 物理系 主任 都 是 舉世聞名 的 大 科學家 如 電磁 理論 創立 者 馬克士威爾 JCMaxwell 近代 聲學 理論 奠基人 瑞利 男爵 Lord John William Rayleight 電子 發現 者 湯姆森 JJThomson 核 物理 之 父 拉塞福 ERutherford X 射線 晶體 結構 分析 提出 者 之 一 布拉格 WLBragg 非 晶 半導體 理論 提出 者 莫特 NFMott 倫敦 兄弟 超導體 電動 力學 方程 的 修改 者 派帕德 ABPippard,84,卡文迪什(36) 物理(7524) 實驗室(12027) 成立(28506) 於(327210) 1871年(47) 至今(14540) 已(215610) 有(2217079) 126(544) 年(514736) 的(16029838) 漫長(5523) 歷史(96060) 歷任(2289) 卡文迪什(36) 教授(39068) 兼(16339) 物理系(363) 主任(13859) 都(1125846) 是(4642407) 舉世聞名(341) 的(16029838) 大(525780) 科學家(18346) 如(195069) 電磁(516) 理論(62242) 創立(6414) 者(423504) 馬克士威爾(2) JCMaxwell(Unknown) 近代(7878) 聲學(197) 理論(62242) 奠基人(26) 瑞利(188) 男爵(1715) Lord(472) John(Unknown) William(Unknown) Rayleight(Unknown) 電子(17642) 發現(175233) 者(423504) 湯姆森(191) JJThomson(Unknown) 核(3479) 物理(7524) 之(875481) 父(12251) 拉塞福(87) ERutherford(Unknown) X(Unknown) 射線(1833) 晶體(1815) 結構(43294) 分析(59250) 提出(63073) 者(423504) 之(875481) 一(3701681) 布拉格(1284) WLBragg(Unknown) 非(112415) 晶(241) 半導體(2346) 理論(62242) 提出(63073) 者(423504) 莫特(36) NFMott(Unknown) 倫敦(14516) 兄弟(28517) 超導體(60) 電動(1893) 力學(1415) 方程(691) 的(16029838) 修改(6592) 者(423504) 派帕德(Unknown) ABPippard(Unknown),"{'Low': 19, 'High': 65}","{'Unknown': 47, '第5級': 15, '第4*級': 1, '第3級': 3, '第1級': 9, '第6級': 4, '第3*級': 1, '第4級': 2, '第7級': 1, '第2級': 1}",26,Y,N,N,Y
在他們的相繼領導下，卡文迪什實驗室成為現代科學革命的主力軍，奠定了電磁理論、原子物理、核物理、X射線晶體結構分析、分子生物學、射電天文學、非晶半導體等學科，培養出二十五位諾貝爾獎得主、四位皇家學會主席、六位大英科學促進協會主席、二十三位爵士和二位勛爵，其成就和盛名在二十世紀中被國際譽為「人才苗圃」和「物理學家勝地」。,在 他們 的 相繼 領導 下 卡文迪什 實驗室 成為 現代 科學 革命 的 主力軍 奠定 了 電磁 理論 原子 物理 核 物理 X 射線 晶體 結構 分析 分子 生物學 射電 天文學 非 晶 半導體 等 學科 培養出 二十五 位 諾貝爾獎 得主 四 位 皇家 學會 主席 六 位 大英 科學 促進 協會 主席 二十三 位 爵士 和 二 位 勛爵 其 成就 和 盛名 在 二十世紀 中 被 國際 譽為 人才 苗圃 和 物理學家 勝地,75,在(3284238) 他們(716752) 的(16029838) 相繼(3927) 領導(27789) 下(329549) 卡文迪什(36) 實驗室(12027) 成為(143834) 現代(40344) 科學(55156) 革命(22713) 的(16029838) 主力軍(166) 奠定(3081) 了(3199291) 電磁(516) 理論(62242) 原子(5122) 物理(7524) 核(3479) 物理(7524) X(Unknown) 射線(1833) 晶體(1815) 結構(43294) 分析(59250) 分子(13418) 生物學(3823) 射電(38) 天文學(1118) 非(112415) 晶(241) 半導體(2346) 等(327380) 學科(5987) 培養出(1802) 二十五(7894) 位(284809) 諾貝爾獎(1463) 得主(1855) 四(141667) 位(284809) 皇家(6995) 學會(25720) 主席(9526) 六(77936) 位(284809) 大英(1615) 科學(55156) 促進(10265) 協會(13492) 主席(9526) 二十三(3554) 位(284809) 爵士(9225) 和(1338337) 二(152494) 位(284809) 勛爵(529) 其(307905) 成就(25263) 和(1338337) 盛名(1059) 在(3284238) 二十世紀(7890) 中(1011729) 被(540683) 國際(40846) 譽為(1433) 人才(17220) 苗圃(198) 和(1338337) 物理學家(2702) 勝地(934),"{'High': 72, 'Low': 3}","{'第1*級': 3, '第1級': 11, '第6級': 8, '第5級': 13, 'Unknown': 28, '第3*級': 2, '第4級': 4, '第7級': 3, '第4*級': 2, '第2級': 1}",12,Y,Y,N,Y
他們在培養有優良知識準備的青年物理學家方面，成就卓著，其中有很多事例享譽全球，傳為佳話，頗有教益。,他們 在 培養 有 優良 知識 準備 的 青年 物理學家 方面 成就 卓著 其中 有 很多 事例 享譽 全球 傳為 佳話 頗 有 教益,24,他們(716752) 在(3284238) 培養(17148) 有(2217079) 優良(3018) 知識(63665) 準備(64901) 的(16029838) 青年(18436) 物理學家(2702) 方面(75079) 成就(25263) 卓著(996) 其中(95627) 有(2217079) 很多(113128) 事例(1903) 享譽(455) 全球(21104) 傳為(388) 佳話(575) 頗(22266) 有(2217079) 教益(101),{'High': 24},"{'第1級': 5, '第1*級': 1, '第5級': 1, '第6級': 2, '第3*級': 3, '第2級': 1, '第4*級': 2, 'Unknown': 5, '第7級': 3, '第4級': 1}",1,Y,N,N,N
法國大革命之後，在蒙日(G.Monge)領導下，巴黎綜合技術學校廢除封建特權，建立通過考試平等競爭入學和大班講課體制，進行了近代教育革命，培養了一大批優秀的科技人才，使世界科學中心由英國轉移到法國。,法國 大 革命 之後 在 蒙日 GMonge 領導 下 巴黎 綜合 技術 學校 廢除 封建 特權 建立 通過 考試 平等 競爭 入學 和 大班 講課 體制 進行 了 近代 教育 革命 培養 了 一 大 批 優秀 的 科技 人才 使 世界 科學 中心 由 英國 轉移到 法國,48,法國(29029) 大(525780) 革命(22713) 之後(190467) 在(3284238) 蒙日(25) GMonge(Unknown) 領導(27789) 下(329549) 巴黎(15132) 綜合(8011) 技術(47691) 學校(74782) 廢除(3114) 封建(4653) 特權(4152) 建立(52946) 通過(29652) 考試(12696) 平等(10989) 競爭(30766) 入學(3233) 和(1338337) 大班(376) 講課(730) 體制(11517) 進行(100298) 了(3199291) 近代(7878) 教育(71554) 革命(22713) 培養(17148) 了(3199291) 一(3701681) 大(525780) 批(22121) 優秀(11296) 的(16029838) 科技(30630) 人才(17220) 使(197544) 世界(165235) 科學(55156) 中心(46076) 由(208604) 英國(44248) 轉移到(3237) 法國(29029),"{'High': 46, 'Low': 2}","{'第1級': 8, '第5級': 12, '第4級': 8, '第1*級': 3, 'Unknown': 10, '第6級': 3, '第3級': 2, '第2級': 1, '第4*級': 1}",2,Y,Y,N,Y
1897年，在湯姆森領導下，卡文迪什實驗室首先改革傳統的數學優等生制，嘗試打破英國的島國意識。,1897年 在 湯姆森 領導 下 卡文迪什 實驗室 首先 改革 傳統 的 數學 優等生制 嘗試 打破 英國 的 島國 意識,19,1897年(85) 在(3284238) 湯姆森(191) 領導(27789) 下(329549) 卡文迪什(36) 實驗室(12027) 首先(31260) 改革(21497) 傳統(60517) 的(16029838) 數學(13597) 優等生制(Unknown) 嘗試(21645) 打破(10218) 英國(44248) 的(16029838) 島國(370) 意識(49648),"{'Low': 3, 'High': 16}","{'Unknown': 6, '第1*級': 2, '第5級': 4, '第4級': 1, '第3級': 1, '第1級': 3, '第4*級': 2}",5,Y,N,N,Y
先向英屬自治領後向全世界優選人才，建立了面向世界選擇最優秀人才的學位研究生的制度。,先 向 英屬 自治 領 後 向 全 世界 優選 人才 建立 了 面向 世界 選擇 最 優秀 人才 的 學位 研究生 的 制度,24,先(136649) 向(231672) 英屬(409) 自治(2269) 領(11128) 後(422857) 向(231672) 全(178642) 世界(165235) 優選(32) 人才(17220) 建立(52946) 了(3199291) 面向(7743) 世界(165235) 選擇(75178) 最(421680) 優秀(11296) 人才(17220) 的(16029838) 學位(5741) 研究生(2954) 的(16029838) 制度(37973),"{'High': 23, 'Low': 1}","{'第1*級': 2, '第2級': 5, 'Unknown': 4, '第6級': 1, '第4級': 4, '第1級': 3, '第5級': 3, '第3*級': 1, '第4*級': 1}",1,Y,N,N,N
其結果是群英會聚，思想活躍、成果累累，這個實驗室成了世界性的科學組織，培養出包括湯姆森在內的九位諾貝爾獎得主。,其 結果 是 群英 會聚 思想 活躍 成果 累累 這 個 實驗室 成 了 世界性 的 科學 組織 培養出 包括 湯姆森 在 內 的 九 位 諾貝爾獎 得主,28,其(307905) 結果(114008) 是(4642407) 群英(2) 會聚(61) 思想(45606) 活躍(6133) 成果(16253) 累累(901) 這(2114032) 個(2296574) 實驗室(12027) 成(76470) 了(3199291) 世界性(1067) 的(16029838) 科學(55156) 組織(69485) 培養出(1802) 包括(74410) 湯姆森(191) 在(3284238) 內(183051) 的(16029838) 九(34506) 位(284809) 諾貝爾獎(1463) 得主(1855),"{'High': 26, 'Low': 2}","{'第6級': 2, '第3*級': 2, '第1級': 7, 'Unknown': 8, '第5級': 3, '第4*級': 2, '第7級': 1, '第4級': 1, '第1*級': 1, '第3級': 1}",5,Y,N,N,Y
作為這個體制的第一批受益者，拉塞福不但才華橫溢，發現了放射性元素衰變規律、原子核和人工元素嬗變，而且有著來自紐西蘭的學者具有的科學國際主義精神。,作為 這 個 體制 的 第一 批 受益 者 拉塞福 不但 才華 橫溢 發現 了 放射性 元素 衰變 規律 原子核 和 人工 元素 嬗變 而且 有 著 來自 紐西蘭 的 學者 具有 的 科學 國際 主義 精神,37,作為(58009) 這(2114032) 個(2296574) 體制(11517) 的(16029838) 第一(172544) 批(22121) 受益(2105) 者(423504) 拉塞福(87) 不但(40359) 才華(5617) 橫溢(511) 發現(175233) 了(3199291) 放射性(1091) 元素(13702) 衰變(227) 規律(7165) 原子核(327) 和(1338337) 人工(6736) 元素(13702) 嬗變(68) 而且(180402) 有(2217079) 著(1004687) 來自(41811) 紐西蘭(1302) 的(16029838) 學者(28981) 具有(60702) 的(16029838) 科學(55156) 國際(40846) 主義(82852) 精神(79222),"{'High': 35, 'Low': 2}","{'第5級': 6, '第1級': 6, '第6級': 5, '第2級': 2, 'Unknown': 11, '第3級': 2, '第4級': 3, '第4*級': 1, '第3*級': 1}",4,Y,Y,N,Y
他在1923年首次提出「科學是國際的」，對來自貧窮、落後和殖民地的學生寄予厚望和支持，擇優錄取，因而培養了丹麥的波爾(N.H.D.Bohr)、德國的哈恩、紐西蘭的馬斯頓、前蘇聯的卡皮察(P.L.Kapitsa)、澳大利亞的奧立芬特，以及英國的查德威克和考克饒夫(J.P.Cockcroft)等十一位諾貝爾獎得主和第一代原子物理與核物理人才。,他 在 1923年 首次 提出 科學 是 國際 的 對 來自 貧窮 落後 和 殖民地 的 學生 寄予 厚望 和 支持 擇優 錄取 因而 培養 了 丹麥 的 波爾 NHDBohr 德國 的 哈恩 紐西蘭 的 馬斯頓 前 蘇聯 的 卡皮察 PLKapitsa 澳大利亞 的 奧立芬特 以及 英國 的 查德威克 和 考克饒夫 JPCockcroft 等 十一 位 諾貝爾獎 得主 和 第一 代 原子 物理 與 核 物理 人才,65,他(2487930) 在(3284238) 1923年(182) 首次(2918) 提出(63073) 科學(55156) 是(4642407) 國際(40846) 的(16029838) 對(897964) 來自(41811) 貧窮(6510) 落後(5281) 和(1338337) 殖民地(5021) 的(16029838) 學生(115846) 寄予(628) 厚望(461) 和(1338337) 支持(42489) 擇優(71) 錄取(1428) 因而(29060) 培養(17148) 了(3199291) 丹麥(1608) 的(16029838) 波爾(510) NHDBohr(Unknown) 德國(22936) 的(16029838) 哈恩(175) 紐西蘭(1302) 的(16029838) 馬斯頓(223) 前(272709) 蘇聯(8391) 的(16029838) 卡皮察(13) PLKapitsa(Unknown) 澳大利亞(1090) 的(16029838) 奧立芬特(Unknown) 以及(155624) 英國(44248) 的(16029838) 查德威克(18) 和(1338337) 考克饒夫(Unknown) JPCockcroft(Unknown) 等(327380) 十一(9141) 位(284809) 諾貝爾獎(1463) 得主(1855) 和(1338337) 第一(172544) 代(39507) 原子(5122) 物理(7524) 與(968432) 核(3479) 物理(7524) 人才(17220),"{'High': 57, 'Low': 8}","{'第1級': 15, '第1*級': 1, 'Unknown': 26, '第4級': 6, '第5級': 10, '第7級': 1, '第2級': 2, '第3*級': 1, '第6級': 2, '第4*級': 1}",13,Y,Y,N,Y
這些事例告訴我們，在科學上不分國家、民族和信仰，按知識情況平等選擇和培養人才，對人類的科學發展有著多麼重大的意義。,這些 事例 告訴 我們 在 科學 上 不 分 國家 民族 和 信仰 按 知識 情況 平等 選擇 和 培養 人才 對 人類 的 科學 發展 有 著 多麼 重大 的 意義,32,這些(315113) 事例(1903) 告訴(122898) 我們(979260) 在(3284238) 科學(55156) 上(1233218) 不(2282521) 分(62224) 國家(109166) 民族(25724) 和(1338337) 信仰(17902) 按(31532) 知識(63665) 情況(92301) 平等(10989) 選擇(75178) 和(1338337) 培養(17148) 人才(17220) 對(897964) 人類(78855) 的(16029838) 科學(55156) 發展(117494) 有(2217079) 著(1004687) 多麼(20834) 重大(19228) 的(16029838) 意義(71714),{'High': 32},"{'Unknown': 5, '第7級': 1, '第1級': 8, '第1*級': 2, '第4級': 7, '第4*級': 3, '第5級': 3, '第3*級': 3}",0,Y,Y,N,N
如果不執行這樣的方針，卡文迪什實驗室不可能發展成世界物理的中心和現代科學革命的主力軍，並取得那麼大的成就和威望。,如果 不 執行 這樣 的 方針 卡文迪什 實驗室 不 可能 發展成 世界 物理 的 中心 和 現代 科學 革命 的 主力軍 並 取得 那麼 大 的 成就 和 威望,29,如果(322121) 不(2282521) 執行(25364) 這樣(288344) 的(16029838) 方針(3460) 卡文迪什(36) 實驗室(12027) 不(2282521) 可能(271025) 發展成(2117) 世界(165235) 物理(7524) 的(16029838) 中心(46076) 和(1338337) 現代(40344) 科學(55156) 革命(22713) 的(16029838) 主力軍(166) 並(442790) 取得(25649) 那麼(127785) 大(525780) 的(16029838) 成就(25263) 和(1338337) 威望(1235),"{'High': 28, 'Low': 1}","{'第2級': 3, '第1級': 8, '第5級': 4, '第3級': 2, '第6級': 1, 'Unknown': 6, '第3*級': 1, '第4級': 1, '第4*級': 2, '第7級': 1}",4,Y,Y,N,Y
長期以來升級和考試是按照分數高低取人，「在分數面前人人平等」成為辦學和升學的準則，已經取得多國的公認。,長期 以來 升級 和 考試 是 按照 分數 高低 取 人 在 分數 面前 人人 平等 成為 辦學 和 升學 的 準則 已經 取得 多 國 的 公認,28,長期(28592) 以來(26654) 升級(1962) 和(1338337) 考試(12696) 是(4642407) 按照(15014) 分數(6483) 高低(4010) 取(22155) 人(1550512) 在(3284238) 分數(6483) 面前(32768) 人人(12728) 平等(10989) 成為(143834) 辦學(464) 和(1338337) 升學(1757) 的(16029838) 準則(4607) 已經(245160) 取得(25649) 多(318992) 國(73377) 的(16029838) 公認(2800),{'High': 28},"{'Unknown': 5, '第4*級': 3, '第1*級': 2, '第1級': 6, '第4級': 5, '第6級': 3, '第5級': 3, '第2級': 1}",0,Y,Y,N,N
但是，我們常聽到很多議論，如一錘定乾坤、高分低能和好運的說法。,但是 我們 常 聽到 很多 議論 如 一 錘 定 乾坤 高分 低能 和 好運 的 說法,17,但是(247988) 我們(979260) 常(86207) 聽到(61809) 很多(113128) 議論(4274) 如(195069) 一(3701681) 錘(636) 定(18743) 乾坤(1443) 高分(822) 低能(248) 和(1338337) 好運(2463) 的(16029838) 說法(32457),{'High': 17},"{'第2級': 2, '第1級': 3, '第1*級': 1, 'Unknown': 6, '第6級': 1, '第7級': 2, '第4*級': 1, '第4級': 1}",0,Y,Y,N,N
分數有時是檢驗學習成績的重要尺度，但時常含有虛假成分，英國實行平時成績、推薦和面談相結合的方法選擇學生，各國獎學金和基金委員會大多採用自報、推薦和專家評議的辦法，其目的在於避免一次考試定乾坤的弊端，使真正有知識準備和才華的學生能夠被發掘出來。,分數 有時 是 檢驗 學習 成績 的 重要 尺度 但 時常 含有 虛假 成分 英國 實行 平時 成績 推薦 和 面談 相 結合 的 方法 選擇 學生 各 國 獎學金 和 基金 委員會 大多 採用 自報 推薦 和 專家 評議 的 辦法 其 目的 在於 避免 一 次 考試 定 乾坤 的 弊端 使 真正 有 知識 準備 和 才華 的 學生 能夠 被 發掘出來,65,分數(6483) 有時(47894) 是(4642407) 檢驗(6917) 學習(105345) 成績(16851) 的(16029838) 重要(154863) 尺度(1881) 但(597124) 時常(8286) 含有(8772) 虛假(2150) 成分(9525) 英國(44248) 實行(8386) 平時(9449) 成績(16851) 推薦(11283) 和(1338337) 面談(1906) 相(32217) 結合(22408) 的(16029838) 方法(99064) 選擇(75178) 學生(115846) 各(243023) 國(73377) 獎學金(1642) 和(1338337) 基金(10265) 委員會(19419) 大多(12946) 採用(20582) 自報(155) 推薦(11283) 和(1338337) 專家(26090) 評議(397) 的(16029838) 辦法(43280) 其(307905) 目的(45226) 在於(37953) 避免(33211) 一(3701681) 次(331701) 考試(12696) 定(18743) 乾坤(1443) 的(16029838) 弊端(1129) 使(197544) 真正(77318) 有(2217079) 知識(63665) 準備(64901) 和(1338337) 才華(5617) 的(16029838) 學生(115846) 能夠(96422) 被(540683) 發掘出來(198),{'High': 65},"{'第4級': 8, '第1*級': 2, '第1級': 12, '第5級': 5, '第2級': 11, '第6級': 5, 'Unknown': 13, '第4*級': 4, '第3*級': 3, '第7級': 2}",3,Y,Y,N,N
我們知道，科學上有重要成就的人才往往表現在某個或某幾個前沿難點的突破上，有的甚至能突破一點打開一個新領域，這主要表現在研究者的起源性(originality)和創造性的能力。,我們 知道 科學 上 有 重要 成就 的 人才 往往 表現 在 某 個 或 某 幾 個 前沿 難點 的 突破 上 有的 甚至 能 突破 一點 打開 一 個 新 領域 這 主要 表現 在 研究 者 的 起源性 originality 和 創造性 的 能力,46,我們(979260) 知道(343214) 科學(55156) 上(1233218) 有(2217079) 重要(154863) 成就(25263) 的(16029838) 人才(17220) 往往(41388) 表現(67272) 在(3284238) 某(119862) 個(2296574) 或(478077) 某(119862) 幾(229415) 個(2296574) 前沿(3) 難點(50) 的(16029838) 突破(10583) 上(1233218) 有的(31553) 甚至(122502) 能(582260) 突破(10583) 一點(90745) 打開(33125) 一(3701681) 個(2296574) 新(212453) 領域(37450) 這(2114032) 主要(78757) 表現(67272) 在(3284238) 研究(182500) 者(423504) 的(16029838) 起源性(6) originality(Unknown) 和(1338337) 創造性(3239) 的(16029838) 能力(93399),"{'High': 42, 'Low': 4}","{'第1級': 16, '第4級': 5, '第2級': 3, '第4*級': 3, '第1*級': 4, '第5級': 4, '第3級': 2, 'Unknown': 8, '第6級': 1}",3,Y,Y,N,N
所謂起源性係指突破從某人和出新自某人開始而言，一個學者一生中做的可能很多，但重要的代表性貢獻可能只有一、二個，這樣看來，沒有足夠的知識準備，要做出這一、二個大突破是不可能的。,所謂 起源性 係指 突破 從 某人 和 出新 自 某人 開始 而言 一 個 學者 一生 中 做 的 可能 很多 但 重要 的 代表性 貢獻 可能 只 有 一 二 個 這樣 看來 沒有 足夠 的 知識 準備 要 做出 這 一 二 個 大 突破 是 不 可能 的,51,所謂(59460) 起源性(6) 係指(610) 突破(10583) 從(496546) 某人(6538) 和(1338337) 出新(12) 自(59676) 某人(6538) 開始(245562) 而言(Unknown) 一(3701681) 個(2296574) 學者(28981) 一生(25444) 中(1011729) 做(411649) 的(16029838) 可能(271025) 很多(113128) 但(597124) 重要(154863) 的(16029838) 代表性(3248) 貢獻(15759) 可能(271025) 只(436725) 有(2217079) 一(3701681) 二(152494) 個(2296574) 這樣(288344) 看來(23504) 沒有(594280) 足夠(16814) 的(16029838) 知識(63665) 準備(64901) 要(851264) 做出(28140) 這(2114032) 一(3701681) 二(152494) 個(2296574) 大(525780) 突破(10583) 是(4642407) 不(2282521) 可能(271025) 的(16029838),"{'High': 48, 'Low': 3}","{'第5級': 5, 'Unknown': 10, '第1*級': 2, '第2級': 4, '第1級': 23, '第4*級': 3, '第3級': 1, '第4級': 2, '第3*級': 1}",2,Y,Y,N,N
