sentence,sentence_preprocessed,sentence_length,word_freq,high_low_freq,word_level,long_word_count,is_complete_sentence,is_complete_context,is_blacklist,is_greylist
理由是不忍心看我得為房子打拼、吃苦，女兒栽培到這麼大，當然得找個有房子的好人家，別吃虧了。,理由 是 不 忍心 看 我 得 為 房子 打拼 吃苦 女兒 栽培 到 這麼 大 當然 得 找 個 有 房子 的 好 人家 別 吃虧 了,28,理由(32460) 是(4642407) 不(2282521) 忍心(1959) 看(444691) 我(3033032) 得(573721) 為(761341) 房子(31430) 打拼(431) 吃苦(1380) 女兒(46072) 栽培(2024) 到(546906) 這麼(116973) 大(525780) 當然(113971) 得(573721) 找(108128) 個(2296574) 有(2217079) 房子(31430) 的(16029838) 好(448428) 人家(25372) 別(78082) 吃虧(1867) 了(3199291),{'High': 28},"{'第4級': 1, '第1級': 10, '第6級': 2, 'Unknown': 7, '第1*級': 3, '第7級': 1, '第5級': 2, '第2級': 2}",0,Y,N,N,N
財產繼承權？,財產 繼承 權,3,財產(10078) 繼承(11750) 權(11552),{'High': 3},"{'第5級': 2, 'Unknown': 1}",0,Y,N,N,N
簡單兩個字：「放棄」。,簡單 兩 個 字 放棄,5,簡單(52683) 兩(526190) 個(2296574) 字(75654) 放棄(27664),{'High': 5},"{'第2級': 1, '第1級': 3, '第4級': 1}",0,Y,N,N,N
連提都不用提。,連 提 都 不用 提,5,連(91153) 提(33635) 都(1125846) 不用(23091) 提(33635),{'High': 5},"{'第3*級': 1, '第3級': 3, '第1級': 1}",0,Y,Y,N,N
對女人而言，30歲，是一個老化的象徵，這不只是「馬齒徒長」的現象而已。,對 女人 而言 30 歲 是 一 個 老化 的 象徵 這 不只 是 馬齒徒長 的 現象 而已,18,對(897964) 女人(71948) 而言(Unknown) 30(11946) 歲(130085) 是(4642407) 一(3701681) 個(2296574) 老化(3967) 的(16029838) 象徵(18975) 這(2114032) 不只(20841) 是(4642407) 馬齒徒長(10) 的(16029838) 現象(47383) 而已(43005),"{'High': 16, 'Low': 2}","{'第1級': 9, 'Unknown': 6, '第6級': 1, '第4*級': 1, '第4級': 1}",1,Y,N,N,N
妳想想，在大學校園中，如果大四等同「沒人要」的話，年屆30，可就是超級沒人要了。,妳 想想 在 大學 校園 中 如果 大四 等同 沒 人 要 的 話 年 屆 30 可 就 是 超級 沒 人 要 了,25,妳(141217) 想想(14544) 在(3284238) 大學(83893) 校園(7406) 中(1011729) 如果(322121) 大四(433) 等同(3117) 沒(306167) 人(1550512) 要(851264) 的(16029838) 話(148020) 年(514736) 屆(10220) 30(11946) 可(307359) 就(1737544) 是(4642407) 超級(6869) 沒(306167) 人(1550512) 要(851264) 了(3199291),{'High': 25},"{'第1級': 13, 'Unknown': 5, '第1*級': 1, '第3級': 1, '第2級': 1, '第6級': 1, '第5級': 1, '第4*級': 1, '第4級': 1}",0,Y,Y,N,N
不過，不嫁也沒什麼，我既不物化自己，也還養得活自己，人生不是七十才開始嗎？,不過 不 嫁 也 沒 什麼 我 既 不 物化 自己 也 還 養 得 活 自己 人生 不 是 七十 才 開始 嗎,24,不過(186226) 不(2282521) 嫁(5790) 也(1590760) 沒(306167) 什麼(431321) 我(3033032) 既(43838) 不(2282521) 物化(498) 自己(744739) 也(1590760) 還(625086) 養(16614) 得(573721) 活(49727) 自己(744739) 人生(69234) 不(2282521) 是(4642407) 七十(4970) 才(394539) 開始(245562) 嗎(248249),{'High': 24},"{'第2級': 3, '第1級': 10, '第4*級': 2, 'Unknown': 5, '第1*級': 2, '第4級': 2}",0,Y,Y,N,N
我還不到開始的時候呢。,我 還 不到 開始 的 時候 呢,7,我(3033032) 還(625086) 不到(2809) 開始(245562) 的(16029838) 時候(199970) 呢(204566),{'High': 7},"{'第1級': 4, 'Unknown': 2, '第2級': 1}",0,Y,N,N,N
這可是一個民主自由的國家咧！,這 可 是 一 個 民主 自由 的 國家 咧,10,這(2114032) 可(307359) 是(4642407) 一(3701681) 個(2296574) 民主(18177) 自由(56360) 的(16029838) 國家(109166) 咧(3124),{'High': 10},"{'第1級': 5, '第4*級': 1, '第4級': 1, '第3*級': 1, '第1*級': 1, 'Unknown': 1}",0,Y,N,N,N
不結婚犯法嗎？,不 結婚 犯法 嗎,4,不(2282521) 結婚(22719) 犯法(1086) 嗎(248249),{'High': 4},"{'第1級': 2, '第3級': 1, '第5級': 1}",0,Y,N,N,N
當然不。,當然 不,2,當然(113971) 不(2282521),{'High': 2},"{'第2級': 1, '第1級': 1}",0,N,N,N,N
但結婚總是一個合法的制度，一個合法的制度，大家都進的去，妳如果不進去，那麼妳不是有寡人隱疾，就是沒人要。,但 結婚 總 是 一 個 合法 的 制度 一 個 合法 的 制度 大家 都 進 的 去 妳 如果 不 進去 那麼 妳 不 是 有 寡人 隱疾 就 是 沒 人 要,35,但(597124) 結婚(22719) 總(46750) 是(4642407) 一(3701681) 個(2296574) 合法(4975) 的(16029838) 制度(37973) 一(3701681) 個(2296574) 合法(4975) 的(16029838) 制度(37973) 大家(109692) 都(1125846) 進(40005) 的(16029838) 去(479993) 妳(141217) 如果(322121) 不(2282521) 進去(13780) 那麼(127785) 妳(141217) 不(2282521) 是(4642407) 有(2217079) 寡人(125) 隱疾(67) 就(1737544) 是(4642407) 沒(306167) 人(1550512) 要(851264),"{'High': 34, 'Low': 1}","{'第2級': 4, '第3級': 1, '第1級': 22, '第5級': 2, '第4級': 2, '第1*級': 1, 'Unknown': 3}",0,Y,Y,N,N
我自己不覺得什麼，家人可把它當莫大的恥辱。,我 自己 不 覺得 什麼 家人 可 把 它 當 莫大 的 恥辱,13,我(3033032) 自己(744739) 不(2282521) 覺得(183034) 什麼(431321) 家人(30861) 可(307359) 把(617773) 它(316854) 當(294625) 莫大(2751) 的(16029838) 恥辱(1666),{'High': 13},"{'第1級': 4, '第1*級': 4, '第4*級': 1, '第2級': 1, 'Unknown': 1, '第6級': 1, '第7級': 1}",0,Y,N,N,N
在這個社會中，「30歲，未婚」，早就是一項天大的污名，電視名嘴早已名之「單身公害」。,在 這 個 社會 中 30 歲 未婚 早 就 是 一 項 天大 的 污名 電視 名嘴 早已 名 之 單身 公害,23,在(3284238) 這(2114032) 個(2296574) 社會(176660) 中(1011729) 30(11946) 歲(130085) 未婚(1402) 早(62038) 就(1737544) 是(4642407) 一(3701681) 項(88887) 天大(1590) 的(16029838) 污名(204) 電視(41289) 名嘴(110) 早已(21910) 名(136287) 之(875481) 單身(3039) 公害(370),{'High': 23},"{'第1*級': 2, '第1級': 8, '第3*級': 1, 'Unknown': 7, '第5級': 4, '第2級': 1}",0,Y,N,N,N
父母甚至會用沒把妳教好，所以妳嫁不出去的道德觀譴責妳，也譴責她們自己。,父母 甚至 會 用 沒 把 妳 教好 所以 妳 嫁不出去 的 道德觀 譴責 妳 也 譴責 她們 自己,19,父母(78215) 甚至(122502) 會(1014977) 用(377038) 沒(306167) 把(617773) 妳(141217) 教好(298) 所以(239080) 妳(141217) 嫁不出去(Unknown) 的(16029838) 道德觀(735) 譴責(3512) 妳(141217) 也(1590760) 譴責(3512) 她們(52188) 自己(744739),"{'High': 18, 'Low': 1}","{'第3級': 1, '第4*級': 1, '第1*級': 3, '第1級': 7, '第2級': 1, 'Unknown': 4, '第6級': 2}",2,Y,Y,N,N
將婚姻視為享受人生的入口，人們開始把各種同情的眼光丟給妳，同情妳沒有合法的護花使者，同情你無法享受性的愉悅，所以背後稱妳為老處女，同情妳沒有養幾個小孩子來承歡膝下、享受「天倫之樂」，同情社會上又多了一個無人送終、孤獨無依的老女人......，不管你願不願承受，這些自以為是的同情像是無厘頭電影中的蘋果派從四面八方炸過來。,將 婚姻 視為 享受 人生 的 入口 人們 開始 把 各 種 同情 的 眼光 丟給 妳 同情 妳 沒有 合法 的 護花使者 同情 你 無法 享受 性 的 愉悅 所以 背後 稱 妳 為 老處女 同情 妳 沒有 養 幾 個 小孩子 來 承歡膝下 享受 天倫之樂 同情 社會 上 又 多 了 一 個 無 人 送終 孤獨 無依 的 老 女人 不管 你 願不願 承受 這些 自以為是 的 同情 像 是 無厘頭 電影 中 的 蘋果派 從 四面八方 炸 過來,82,將(448374) 婚姻(22257) 視為(26535) 享受(21312) 人生(69234) 的(16029838) 入口(5175) 人們(77778) 開始(245562) 把(617773) 各(243023) 種(701563) 同情(10830) 的(16029838) 眼光(13910) 丟給(1017) 妳(141217) 同情(10830) 妳(141217) 沒有(594280) 合法(4975) 的(16029838) 護花使者(Unknown) 同情(10830) 你(1414837) 無法(150606) 享受(21312) 性(23731) 的(16029838) 愉悅(5160) 所以(239080) 背後(22697) 稱(60191) 妳(141217) 為(761341) 老處女(Unknown) 同情(10830) 妳(141217) 沒有(594280) 養(16614) 幾(229415) 個(2296574) 小孩子(8103) 來(742183) 承歡膝下(11) 享受(21312) 天倫之樂(272) 同情(10830) 社會(176660) 上(1233218) 又(535555) 多(318992) 了(3199291) 一(3701681) 個(2296574) 無(157858) 人(1550512) 送終(180) 孤獨(8251) 無依(472) 的(16029838) 老(75373) 女人(71948) 不管(41857) 你(1414837) 願不願(Unknown) 承受(9524) 這些(315113) 自以為是(1546) 的(16029838) 同情(10830) 像(289494) 是(4642407) 無厘頭(234) 電影(115295) 中(1011729) 的(16029838) 蘋果派(112) 從(496546) 四面八方(1942) 炸(3622) 過來(18602),"{'High': 78, 'Low': 4}","{'第5級': 7, '第4*級': 11, '第4級': 4, '第1級': 26, '第3級': 1, '第2級': 3, 'Unknown': 19, '第1*級': 5, '第3*級': 2, '第7級': 1, '第6級': 3}",10,Y,Y,N,N
相愛的人一定要有婚姻制度來證明「相愛」的合法性，否則，就是「不倫」。,相愛 的 人 一定 要 有 婚姻 制度 來 證明 相愛 的 合法性 否則 就 是 不倫,17,相愛(2223) 的(16029838) 人(1550512) 一定(138695) 要(851264) 有(2217079) 婚姻(22257) 制度(37973) 來(742183) 證明(32919) 相愛(2223) 的(16029838) 合法性(1466) 否則(26547) 就(1737544) 是(4642407) 不倫(97),"{'High': 16, 'Low': 1}","{'第5級': 2, '第1級': 8, '第1*級': 1, '第4*級': 2, '第4級': 2, 'Unknown': 2}",1,Y,Y,N,N
好大的帽子呀！,好 大 的 帽子 呀,5,好(448428) 大(525780) 的(16029838) 帽子(8332) 呀(47302),{'High': 5},"{'Unknown': 1, '第1級': 2, '第2*級': 1, '第2級': 1}",0,Y,N,N,N
一個女人不結婚就等於放棄了「相愛」的權利。,一 個 女人 不 結婚 就 等於 放棄 了 相愛 的 權利,12,一(3701681) 個(2296574) 女人(71948) 不(2282521) 結婚(22719) 就(1737544) 等於(18149) 放棄(27664) 了(3199291) 相愛(2223) 的(16029838) 權利(15625),{'High': 12},"{'第1級': 5, 'Unknown': 2, '第3級': 1, '第5級': 2, '第4級': 2}",0,Y,N,N,N
為什麼？,為什麼,1,為什麼(106142),{'High': 1},{'第1*級': 1},1,N,N,N,N
很簡單，人家會告誡妳，不管對方年紀比妳大、比妳小，女人若不結婚，就別耽誤別人，人家可是要傳宗接代的。,很 簡單 人家 會 告誡 妳 不管 對方 年紀 比 妳 大 比 妳 小 女人 若 不 結婚 就 別 耽誤 別人 人家 可是 要 傳宗接代 的,28,很(715675) 簡單(52683) 人家(25372) 會(1014977) 告誡(2953) 妳(141217) 不管(41857) 對方(62393) 年紀(21116) 比(170486) 妳(141217) 大(525780) 比(170486) 妳(141217) 小(318835) 女人(71948) 若(92766) 不(2282521) 結婚(22719) 就(1737544) 別(78082) 耽誤(1430) 別人(108427) 人家(25372) 可是(125487) 要(851264) 傳宗接代(538) 的(16029838),{'High': 28},"{'第1級': 10, '第2級': 2, 'Unknown': 4, '第1*級': 5, '第6級': 1, '第3*級': 1, '第4級': 1, '第3級': 2, '第5級': 1, '第7級': 1}",1,Y,Y,N,N
好啦，告訴妳對方也是不婚族，我倆只想同居，別人的眼光不止同情，還得加上憐憫了。,好 啦 告訴 妳 對方 也 是 不婚族 我倆 只 想 同居 別人 的 眼光 不止 同情 還 得 加上 憐憫 了,22,好(448428) 啦(51335) 告訴(122898) 妳(141217) 對方(62393) 也(1590760) 是(4642407) 不婚族(13) 我倆(1836) 只(436725) 想(449884) 同居(1395) 別人(108427) 的(16029838) 眼光(13910) 不止(4107) 同情(10830) 還(625086) 得(573721) 加上(38121) 憐憫(2807) 了(3199291),"{'High': 21, 'Low': 1}","{'Unknown': 7, '第2級': 2, '第1級': 5, '第4級': 1, '第1*級': 1, '第6級': 2, '第4*級': 2, '第5級': 1, '第3級': 1}",1,Y,Y,N,N
沒結婚，就和人家住在一起，發生關係，這不注定虧大了？,沒 結婚 就 和 人家 住 在一起 發生 關係 這 不 注定 虧 大 了,15,沒(306167) 結婚(22719) 就(1737544) 和(1338337) 人家(25372) 住(69815) 在一起(45658) 發生(129211) 關係(162883) 這(2114032) 不(2282521) 注定(4243) 虧(3113) 大(525780) 了(3199291),{'High': 15},"{'第1級': 5, '第3級': 3, 'Unknown': 4, '第1*級': 1, '第6級': 2}",1,Y,N,N,N
30歲的未婚女子若生了幾個孩子可成了重大的社會問題了。,30 歲 的 未婚 女子 若 生 了 幾 個 孩子 可 成 了 重大 的 社會 問題 了,19,30(11946) 歲(130085) 的(16029838) 未婚(1402) 女子(23797) 若(92766) 生(61638) 了(3199291) 幾(229415) 個(2296574) 孩子(242092) 可(307359) 成(76470) 了(3199291) 重大(19228) 的(16029838) 社會(176660) 問題(280782) 了(3199291),{'High': 19},"{'Unknown': 5, '第1級': 7, '第5級': 1, '第4*級': 4, '第4級': 1, '第3*級': 1}",0,Y,Y,N,N
君不見「代理孕母」草案都有未婚歧視嗎？,君 不 見 代理 孕母 草案 都 有 未婚 歧視 嗎,11,君(20204) 不(2282521) 見(179113) 代理(5411) 孕母(99) 草案(1195) 都(1125846) 有(2217079) 未婚(1402) 歧視(4948) 嗎(248249),"{'High': 10, 'Low': 1}","{'Unknown': 2, '第1級': 4, '第1*級': 1, '第5級': 3, '第6級': 1}",0,Y,N,N,N
要求「已」婚才夠格擔任代理孕母。,要求 已 婚 才 夠格 擔任 代理 孕母,8,要求(71192) 已(215610) 婚(3771) 才(394539) 夠格(502) 擔任(34825) 代理(5411) 孕母(99),"{'High': 7, 'Low': 1}","{'第3*級': 1, '第3級': 1, 'Unknown': 2, '第2級': 1, '第7級': 1, '第5級': 2}",0,Y,N,N,N
所以不論一個未婚女子多會生孩子，生育能力就是會遭到否定，也難怪已婚不孕兒子者的壓力有多大了。,所以 不論 一 個 未婚 女子 多 會 生 孩子 生育 能力 就是 會 遭到 否定 也 難怪 已婚 不孕 兒子 者 的 壓力 有 多 大 了,28,所以(239080) 不論(28127) 一(3701681) 個(2296574) 未婚(1402) 女子(23797) 多(318992) 會(1014977) 生(61638) 孩子(242092) 生育(2577) 能力(93399) 就是(2943) 會(1014977) 遭到(16228) 否定(9670) 也(1590760) 難怪(6835) 已婚(1738) 不孕(1092) 兒子(60663) 者(423504) 的(16029838) 壓力(40408) 有(2217079) 多(318992) 大(525780) 了(3199291),{'High': 28},"{'第1*級': 3, '第4級': 3, '第1級': 10, '第5級': 3, '第4*級': 2, '第6級': 1, '第2級': 1, 'Unknown': 5}",0,Y,Y,N,N
一個30歲的單身女子，不論之前有多少情人，「30歲，未婚」就足以構成一個社會歧視的事實──妳沒有能力綁住一個男人。,一 個 30 歲 的 單身 女子 不論 之前 有 多少 情人 30 歲 未婚 就 足以 構成 一 個 社會 歧視 的 事實 妳 沒有 能力 綁住 一 個 男人,31,一(3701681) 個(2296574) 30(11946) 歲(130085) 的(16029838) 單身(3039) 女子(23797) 不論(28127) 之前(79748) 有(2217079) 多少(50265) 情人(5848) 30(11946) 歲(130085) 未婚(1402) 就(1737544) 足以(18852) 構成(16185) 一(3701681) 個(2296574) 社會(176660) 歧視(4948) 的(16029838) 事實(84995) 妳(141217) 沒有(594280) 能力(93399) 綁住(1151) 一(3701681) 個(2296574) 男人(56333),{'High': 31},"{'第1級': 15, 'Unknown': 4, '第5級': 6, '第4*級': 1, '第4級': 3, '第3*級': 1, '第2級': 1}",0,Y,Y,N,N
因此30歲未婚的女子事業有成與否並不重要，有不少朋友已經誓死無所不用其極地要把自己嫁出去。,因此 30 歲 未婚 的 女子 事業 有成 與否 並 不 重要 有 不少 朋友 已經 誓死 無所不用其極 地 要 把 自己 嫁 出去,24,因此(184606) 30(11946) 歲(130085) 未婚(1402) 的(16029838) 女子(23797) 事業(32957) 有成(1145) 與否(4610) 並(442790) 不(2282521) 重要(154863) 有(2217079) 不少(35256) 朋友(101331) 已經(245160) 誓死(633) 無所不用其極(337) 地(754998) 要(851264) 把(617773) 自己(744739) 嫁(5790) 出去(20922),{'High': 24},"{'第4*級': 5, 'Unknown': 6, '第1級': 6, '第5級': 1, '第6級': 1, '第2級': 3, '第7級': 1, '第1*級': 1}",1,Y,Y,N,N
托人介紹，或在婚姻介紹所中投注大把的錢，希望可以找到一個比較不爛的男人來嫁，最起碼，不用再面對別人知道妳年齡時抱歉的眼神。,托 人 介紹 或 在 婚姻 介紹所 中 投注 大 把 的 錢 希望 可以 找到 一 個 比較 不 爛 的 男人 來 嫁 最 起碼 不用 再 面對 別人 知道 妳 年齡 時 抱歉 的 眼神,38,托(3543) 人(1550512) 介紹(26468) 或(478077) 在(3284238) 婚姻(22257) 介紹所(262) 中(1011729) 投注(2393) 大(525780) 把(617773) 的(16029838) 錢(89883) 希望(119975) 可以(560531) 找到(65281) 一(3701681) 個(2296574) 比較(112212) 不(2282521) 爛(6806) 的(16029838) 男人(56333) 來(742183) 嫁(5790) 最(421680) 起碼(4990) 不用(23091) 再(326207) 面對(62914) 別人(108427) 知道(343214) 妳(141217) 年齡(17758) 時(623734) 抱歉(7779) 的(16029838) 眼神(15149),{'High': 38},"{'第6級': 2, '第1級': 13, '第1*級': 4, '第3級': 2, '第4*級': 3, 'Unknown': 3, '第2級': 5, '第5級': 3, '第4級': 2, '第3*級': 1}",1,Y,Y,N,N
運氣差一點的，可能遇到的婚姻騙子，成為報紙社會版上的一篇小故事，讓讀者引為茶餘飯後的閒聊話題，但這些好事的讀者們除了笑妳傻外，可從來不會認為他們可能是壓迫別人走入婚姻的共犯。,運氣 差 一點 的 可能 遇到 的 婚姻 騙子 成為 報紙 社會版 上 的 一 篇 小 故事 讓 讀者 引為 茶餘飯後 的 閒聊 話題 但 這些 好 事 的 讀者 們 除了 笑 妳 傻 外 可 從來 不會 認為 他們 可能 是 壓迫 別人 走入 婚姻 的 共犯,50,運氣(6942) 差(23865) 一點(90745) 的(16029838) 可能(271025) 遇到(29470) 的(16029838) 婚姻(22257) 騙子(2299) 成為(143834) 報紙(22331) 社會版(79) 上(1233218) 的(16029838) 一(3701681) 篇(46368) 小(318835) 故事(101316) 讓(526314) 讀者(34316) 引為(420) 茶餘飯後(312) 的(16029838) 閒聊(2714) 話題(13592) 但(597124) 這些(315113) 好(448428) 事(385949) 的(16029838) 讀者(34316) 們(140794) 除了(75964) 笑(68493) 妳(141217) 傻(5307) 外(109310) 可(307359) 從來(35243) 不會(173045) 認為(192030) 他們(716752) 可能(271025) 是(4642407) 壓迫(4780) 別人(108427) 走入(3338) 婚姻(22257) 的(16029838) 共犯(870),"{'High': 49, 'Low': 1}","{'第4級': 4, 'Unknown': 9, '第1*級': 2, '第1級': 16, '第4*級': 6, '第5級': 4, '第2*級': 1, '第2級': 6, '第3*級': 2}",2,Y,Y,N,N
「嫁不出去」成為生命中無法承受之輕，開始攬鏡自憐，想像出自己身上各種阻撓自己未婚的「缺陷」，答案也許是身材太胖、胸部不夠挺、臉蛋不好看、個性不夠溫柔......，不管是什麼答案，總之「嫁不出去」都要怪自己「改造不夠」。,嫁 不 出去 成為 生命 中 無法 承受 之 輕 開始 攬鏡自憐 想像 出自 己身 上 各 種 阻撓 自己 未婚 的 缺陷 答案 也許 是 身材 太 胖 胸部 不 夠 挺 臉蛋 不 好看 個性 不 夠 溫柔 不管 是 什麼 答案 總之 嫁 不 出去 都 要 怪 自己 改造 不 夠,55,嫁(5790) 不(2282521) 出去(20922) 成為(143834) 生命(92595) 中(1011729) 無法(150606) 承受(9524) 之(875481) 輕(18944) 開始(245562) 攬鏡自憐(Unknown) 想像(45673) 出自(8364) 己身(510) 上(1233218) 各(243023) 種(701563) 阻撓(1679) 自己(744739) 未婚(1402) 的(16029838) 缺陷(4760) 答案(29628) 也許(68286) 是(4642407) 身材(8302) 太(181732) 胖(7499) 胸部(3450) 不(2282521) 夠(49042) 挺(10985) 臉蛋(1117) 不(2282521) 好看(6573) 個性(18904) 不(2282521) 夠(49042) 溫柔(9695) 不管(41857) 是(4642407) 什麼(431321) 答案(29628) 總之(12790) 嫁(5790) 不(2282521) 出去(20922) 都(1125846) 要(851264) 怪(20561) 自己(744739) 改造(6226) 不(2282521) 夠(49042),"{'High': 54, 'Low': 1}","{'第4*級': 4, '第1級': 14, 'Unknown': 8, '第5級': 10, '第6級': 2, '第2*級': 1, '第2級': 2, '第4級': 3, '第1*級': 6, '第3*級': 4, '第7級': 1}",1,Y,Y,N,N
「婚姻」轉化為未婚女子心頭自虐的枷鎖。,婚姻 轉化為 未婚 女子 心頭 自虐 的 枷鎖,8,婚姻(22257) 轉化為(2526) 未婚(1402) 女子(23797) 心頭(6587) 自虐(199) 的(16029838) 枷鎖(1019),{'High': 8},"{'第4*級': 2, 'Unknown': 2, '第5級': 1, '第6級': 1, '第1級': 1, '第7級': 1}",1,Y,N,N,N
不斷有人問：「為什麼不結婚？」,不斷 有 人 問 為什麼 不 結婚,7,不斷(68526) 有(2217079) 人(1550512) 問(165473) 為什麼(106142) 不(2282521) 結婚(22719),{'High': 7},"{'第4級': 1, '第1級': 4, '第1*級': 1, '第3級': 1}",1,Y,N,N,N
我也常常反問對方：「為什麼要結婚？」,我 也 常常 反問 對方 為什麼 要 結婚,8,我(3033032) 也(1590760) 常常(38706) 反問(2768) 對方(62393) 為什麼(106142) 要(851264) 結婚(22719),{'High': 8},"{'第1級': 3, '第1*級': 2, '第6級': 1, '第4級': 1, '第3級': 1}",1,Y,N,N,N
結婚不過是一個約定俗成的習慣，一個傳承、確認子嗣的社會制度，從來就不是為了愛情而存在的，在台灣，成年情侶取得婚姻自主權是20世紀初的事。,結婚 不過 是 一 個 約定俗成 的 習慣 一 個 傳承 確認 子嗣 的 社會 制度 從來 就 不 是 為了 愛情 而 存在 的 在 台灣 成年 情侶 取得 婚姻 自主 權 是 20世紀 初 的 事,38,結婚(22719) 不過(186226) 是(4642407) 一(3701681) 個(2296574) 約定俗成(488) 的(16029838) 習慣(42175) 一(3701681) 個(2296574) 傳承(4920) 確認(11862) 子嗣(972) 的(16029838) 社會(176660) 制度(37973) 從來(35243) 就(1737544) 不(2282521) 是(4642407) 為了(Unknown) 愛情(22826) 而(937923) 存在(75197) 的(16029838) 在(3284238) 台灣(130718) 成年(5565) 情侶(2104) 取得(25649) 婚姻(22257) 自主(6552) 權(11552) 是(4642407) 20世紀(575) 初(42087) 的(16029838) 事(385949),"{'High': 37, 'Low': 1}","{'第3級': 1, '第2級': 2, '第1級': 14, 'Unknown': 4, '第6級': 1, '第5級': 6, '第7級': 1, '第3*級': 2, '第4級': 3, '第1*級': 2, '第4*級': 2}",2,Y,Y,N,N
曾幾何時，婚姻成了雙方對感情負責任的作法。,曾幾何時 婚姻 成 了 雙方 對 感情 負責任 的 作法,10,曾幾何時(378) 婚姻(22257) 成(76470) 了(3199291) 雙方(22984) 對(897964) 感情(27553) 負責任(3081) 的(16029838) 作法(9353),{'High': 10},"{'第7級': 1, '第4*級': 3, 'Unknown': 2, '第1級': 2, '第4級': 1, '第3級': 1}",2,Y,N,N,N
確認婚姻上的名分，並不保證會有一個幸福的婚姻生活，讓小孩有父親、母親，也不代表孩子就能快快樂樂的長成。,確認 婚姻 上 的 名分 並 不 保證 會 有 一 個 幸福 的 婚姻 生活 讓 小孩 有 父親 母親 也 不 代表 孩子 就 能 快快樂樂 的 長成,30,確認(11862) 婚姻(22257) 上(1233218) 的(16029838) 名分(686) 並(442790) 不(2282521) 保證(17492) 會(1014977) 有(2217079) 一(3701681) 個(2296574) 幸福(27449) 的(16029838) 婚姻(22257) 生活(213189) 讓(526314) 小孩(47282) 有(2217079) 父親(86472) 母親(84326) 也(1590760) 不(2282521) 代表(58333) 孩子(242092) 就(1737544) 能(582260) 快快樂樂(479) 的(16029838) 長成(2026),{'High': 30},"{'第5級': 1, '第4*級': 5, '第1級': 14, 'Unknown': 3, '第1*級': 2, '第3級': 3, '第2級': 1, '第4級': 1}",1,Y,N,N,N
我，30歲，不婚，沒有房子，和愛人住在一起與婚姻制度戰鬥。,我 30 歲 不婚 沒有 房子 和 愛人 住 在一起 與 婚姻 制度 戰鬥,14,我(3033032) 30(11946) 歲(130085) 不婚(147) 沒有(594280) 房子(31430) 和(1338337) 愛人(3168) 住(69815) 在一起(45658) 與(968432) 婚姻(22257) 制度(37973) 戰鬥(8191),{'High': 14},"{'第1級': 3, 'Unknown': 5, '第1*級': 2, '第4*級': 2, '第4級': 1, '第6級': 1}",1,Y,N,N,N
和愛人住在一起與婚姻制度戰鬥。,和 愛人 住 在一起 與 婚姻 制度 戰鬥,8,和(1338337) 愛人(3168) 住(69815) 在一起(45658) 與(968432) 婚姻(22257) 制度(37973) 戰鬥(8191),{'High': 8},"{'Unknown': 3, '第1*級': 1, '第4*級': 2, '第4級': 1, '第6級': 1}",1,Y,Y,N,N
從生物結構來看，豺、狼、虎、豹至居家寵物貓、狗，都是獠牙外露、四肢利爪，有助撕裂獵物軀體的食肉動物，而人類既無獠牙也無利爪，有的只是類似牛羊的平排牙齒與細薄指甲，似乎應屬於素食動物？,從 生物 結構 來 看 豺 狼 虎 豹 至 居家 寵物 貓 狗 都 是 獠牙 外露 四肢 利爪 有助 撕裂 獵物 軀體 的 食 肉 動物 而 人類 既 無 獠牙 也 無 利爪 有 的 只 是 類似 牛 羊 的 平排 牙齒 與 細 薄 指甲 似乎 應 屬於 素食 動物,55,從(496546) 生物(18302) 結構(43294) 來(742183) 看(444691) 豺(370) 狼(11042) 虎(17126) 豹(2101) 至(101530) 居家(1606) 寵物(3272) 貓(20459) 狗(36436) 都(1125846) 是(4642407) 獠牙(305) 外露(409) 四肢(3772) 利爪(162) 有助(1326) 撕裂(1302) 獵物(4465) 軀體(2323) 的(16029838) 食(13009) 肉(21294) 動物(36835) 而(937923) 人類(78855) 既(43838) 無(157858) 獠牙(305) 也(1590760) 無(157858) 利爪(162) 有(2217079) 的(16029838) 只(436725) 是(4642407) 類似(29985) 牛(22594) 羊(12825) 的(16029838) 平排(7) 牙齒(7443) 與(968432) 細(9786) 薄(7901) 指甲(3366) 似乎(85481) 應(82417) 屬於(39478) 素食(1809) 動物(36835),"{'High': 54, 'Low': 1}","{'第1*級': 4, 'Unknown': 17, '第5級': 11, '第1級': 9, '第4級': 5, '第6級': 4, '第2級': 2, '第7級': 1, '第4*級': 2}",0,Y,Y,N,N
