sentence,sentence_preprocessed,sentence_length,word_freq,high_low_freq,word_level,long_word_count,is_complete_sentence,is_complete_context,is_blacklist,is_greylist
石獅山在七堵瑪陵坑溪下游附近，則有形肖獅子的石獅山，也有兩則有關獅精吃人的傳說：一是石獅山的獅口原來會吞雲吐霧，人一走過去就會被吞下去吃掉，一直到了鄭成功來了以後，才以大砲打破獅口，獅精從此以後就不再吐霧吃人了；一是以前這附近有一個老阿伯到石獅山上去撿柴火，一去不回，當地人就傳說是被獅子吃掉了，所以，那時大家叫這座山為「活獅山」，後來，獅精吃人的事情被天神知道後，就將這活獅子打死，這座山才變成石獅山。,石獅山 在 七堵 瑪陵坑溪 下游 附近 則 有 形 肖 獅子 的 石獅山 也 有 兩 則 有關 獅精 吃 人 的 傳說 一 是 石獅山 的 獅口 原來 會 吞雲吐霧 人 一 走過 去就 會 被 吞下去 吃掉 一直 到了 鄭成功 來 了 以後 才 以 大砲 打破 獅口 獅精 從此 以後 就 不再 吐 霧 吃 人 了 一 是 以前 這 附近 有 一 個 老 阿伯 到 石獅山 上去 撿 柴火 一 去 不 回 當地人 就 傳說 是 被 獅子 吃掉 了 所以 那時 大家 叫 這 座 山 為 活 獅 山 後來 獅精 吃 人 的 事情 被 天神 知道 後 就 將 這 活 獅子 打死 這 座 山 才 變成 石獅山,120,石獅山(Unknown) 在(3284238) 七堵(8) 瑪陵坑溪(Unknown) 下游(2287) 附近(32204) 則(254096) 有(2217079) 形(6800) 肖(396) 獅子(5309) 的(16029838) 石獅山(Unknown) 也(1590760) 有(2217079) 兩(526190) 則(254096) 有關(69607) 獅精(Unknown) 吃(141660) 人(1550512) 的(16029838) 傳說(14362) 一(3701681) 是(4642407) 石獅山(Unknown) 的(16029838) 獅口(Unknown) 原來(49649) 會(1014977) 吞雲吐霧(178) 人(1550512) 一(3701681) 走過(10466) 去就(Unknown) 會(1014977) 被(540683) 吞下去(639) 吃掉(3407) 一直(119877) 到了(Unknown) 鄭成功(4076) 來(742183) 了(3199291) 以後(71883) 才(394539) 以(547785) 大砲(1510) 打破(10218) 獅口(Unknown) 獅精(Unknown) 從此(20476) 以後(71883) 就(1737544) 不再(51754) 吐(11307) 霧(5459) 吃(141660) 人(1550512) 了(3199291) 一(3701681) 是(4642407) 以前(59453) 這(2114032) 附近(32204) 有(2217079) 一(3701681) 個(2296574) 老(75373) 阿伯(519) 到(546906) 石獅山(Unknown) 上去(4641) 撿(3532) 柴火(691) 一(3701681) 去(479993) 不(2282521) 回(92620) 當地人(2867) 就(1737544) 傳說(14362) 是(4642407) 被(540683) 獅子(5309) 吃掉(3407) 了(3199291) 所以(239080) 那時(28619) 大家(109692) 叫(111645) 這(2114032) 座(49959) 山(54936) 為(761341) 活(49727) 獅(2207) 山(54936) 後來(95618) 獅精(Unknown) 吃(141660) 人(1550512) 的(16029838) 事情(112079) 被(540683) 天神(5232) 知道(343214) 後(422857) 就(1737544) 將(448374) 這(2114032) 活(49727) 獅子(5309) 打死(3829) 這(2114032) 座(49959) 山(54936) 才(394539) 變成(73009) 石獅山(Unknown),"{'Low': 14, 'High': 106}","{'Unknown': 35, '第1*級': 12, '第6級': 1, '第5級': 11, '第1級': 41, '第4級': 4, '第4*級': 3, '第3*級': 3, '第2級': 9, '第7級': 1}",10,Y,Y,N,Y
從自然的角度看，厚層砂岩耐侵蝕的特性構成了各種陡峭的山形，而冒著生命危險、剛渡過黑水溝來到這塊陌生土地的漢人移民，心裡的恐慌尚未撫平，又要面對像山那般巨大的怪獸時，只好搬出有軍隊大砲武力的鄭成功或天神來消滅牠們了。,從 自然 的 角度 看 厚 層 砂岩 耐 侵蝕 的 特性 構成 了 各 種 陡峭 的 山形 而 冒 著 生命 危險 剛 渡過 黑 水溝 來到 這 塊 陌生 土地 的 漢人 移民 心 裡 的 恐慌 尚未 撫平 又 要 面對 像 山 那般 巨大 的 怪獸 時 只好 搬出 有 軍隊 大砲 武力 的 鄭成功 或 天神 來 消滅 牠們 了,66,從(496546) 自然(91995) 的(16029838) 角度(26690) 看(444691) 厚(9144) 層(36369) 砂岩(152) 耐(2430) 侵蝕(1589) 的(16029838) 特性(12673) 構成(16185) 了(3199291) 各(243023) 種(701563) 陡峭(1379) 的(16029838) 山形(648) 而(937923) 冒(9276) 著(1004687) 生命(92595) 危險(30190) 剛(55049) 渡過(2757) 黑(37780) 水溝(1152) 來到(45261) 這(2114032) 塊(54148) 陌生(7928) 土地(32151) 的(16029838) 漢人(9245) 移民(8767) 心(180243) 裡(520435) 的(16029838) 恐慌(4015) 尚未(16593) 撫平(760) 又(535555) 要(851264) 面對(62914) 像(289494) 山(54936) 那般(2722) 巨大(22154) 的(16029838) 怪獸(3917) 時(623734) 只好(29170) 搬出(1128) 有(2217079) 軍隊(23639) 大砲(1510) 武力(4534) 的(16029838) 鄭成功(4076) 或(478077) 天神(5232) 來(742183) 消滅(6638) 牠們(28803) 了(3199291),{'High': 66},"{'第1*級': 6, '第3*級': 3, '第1級': 12, '第5級': 10, 'Unknown': 18, '第4級': 3, '第7級': 2, '第4*級': 5, '第2級': 3, '第3級': 3, '第6級': 1}",1,Y,Y,N,Y
天燈每年元宵節平溪鄉的「放天燈」活動都受到全國矚目。,天燈 每 年 元宵節 平溪鄉 的 放 天燈 活動 都 受到 全 國 矚目,14,天燈(209) 每(333357) 年(514736) 元宵節(377) 平溪鄉(8) 的(16029838) 放(83587) 天燈(209) 活動(85743) 都(1125846) 受到(66513) 全(178642) 國(73377) 矚目(2050),"{'High': 13, 'Low': 1}","{'Unknown': 4, '第1*級': 1, '第1級': 4, '第2級': 3, '第4級': 1, '第6級': 1}",2,Y,N,N,N
基隆河上游平溪附近，清朝時期因為地處偏遠，官府的力量難以觸及，因而，也變成打家劫社的強盜土匪看中的地方。,基隆河 上游 平溪 附近 清朝 時期 因為 地處 偏遠 官府 的 力量 難以 觸及 因而 也 變成 打家劫社 的 強盜 土匪 看中 的 地方,24,基隆河(162) 上游(2860) 平溪(346) 附近(32204) 清朝(9222) 時期(47839) 因為(425061) 地處(984) 偏遠(1898) 官府(3390) 的(16029838) 力量(59655) 難以(30294) 觸及(2528) 因而(29060) 也(1590760) 變成(73009) 打家劫社(Unknown) 的(16029838) 強盜(2962) 土匪(1112) 看中(1138) 的(16029838) 地方(139164),"{'High': 23, 'Low': 1}","{'Unknown': 4, '第6級': 4, '第1*級': 3, '第7級': 3, '第4*級': 1, '第1級': 4, '第5級': 4, '第4級': 1}",2,Y,Y,N,N
平溪鄉十分寮過去曾有土匪來襲，但因這裡的山林廣闊，居民們都逃上山躲藏避難，然而，分散在山上的居民要如何才能知道土匪們是不是走了呢？,平溪鄉 十分寮 過去 曾 有 土匪 來襲 但 因 這裡 的 山林 廣闊 居民 們 都 逃上 山 躲藏 避難 然而 分散 在 山 上 的 居民 要 如何 才 能 知道 土匪 們 是 不 是 走 了 呢,40,平溪鄉(8) 十分寮(Unknown) 過去(88758) 曾(132981) 有(2217079) 土匪(1112) 來襲(1499) 但(597124) 因(119364) 這裡(100385) 的(16029838) 山林(2890) 廣闊(2842) 居民(13554) 們(140794) 都(1125846) 逃上(13) 山(54936) 躲藏(1566) 避難(1617) 然而(94482) 分散(4714) 在(3284238) 山(54936) 上(1233218) 的(16029838) 居民(13554) 要(851264) 如何(148068) 才(394539) 能(582260) 知道(343214) 土匪(1112) 們(140794) 是(4642407) 不(2282521) 是(4642407) 走(128453) 了(3199291) 呢(204566),"{'Low': 3, 'High': 37}","{'Unknown': 6, '第4級': 2, '第1級': 15, '第7級': 2, '第2級': 2, '第6級': 4, '第4*級': 2, '第1*級': 4, '第5級': 3}",2,Y,Y,N,N
聰明的平溪人就承襲三國時代的孔明燈，發明了天燈，由留在村內的人在晚上放天燈，通知那些在山上躲藏的人下山。,聰明 的 平溪 人 就 承襲 三國 時代 的 孔明 燈 發明 了 天燈 由 留在 村 內 的 人 在 晚上 放 天燈 通知 那些 在 山 上 躲藏 的 人 下山,33,聰明(27161) 的(16029838) 平溪(346) 人(1550512) 就(1737544) 承襲(1464) 三國(1824) 時代(74034) 的(16029838) 孔明(3160) 燈(13821) 發明(14496) 了(3199291) 天燈(209) 由(208604) 留在(12537) 村(10979) 內(183051) 的(16029838) 人(1550512) 在(3284238) 晚上(42206) 放(83587) 天燈(209) 通知(9047) 那些(113704) 在(3284238) 山(54936) 上(1233218) 躲藏(1566) 的(16029838) 人(1550512) 下山(5040),{'High': 33},"{'第2*級': 2, '第1級': 10, 'Unknown': 10, '第4*級': 2, '第4級': 2, '第5級': 1, '第3級': 1, '第1*級': 3, '第2級': 1, '第6級': 1}",0,Y,N,N,Y
由於那天剛好是元月十五日元宵節，所以，後來平溪十分附近的人就把元月十五日放天燈變成一種民俗節慶傳統，到了這天，都要以放天燈來慶祝平安，所以，天燈也叫「平安燈」或「祈福燈」。,由於 那 天 剛好 是 元月 十五日 元宵節 所以 後來 平溪 十分 附近 的 人 就 把 元月 十五日 放 天燈 變成 一 種 民俗 節慶 傳統 到了 這 天 都 要 以 放 天燈 來 慶祝 平安 所以 天燈 也 叫 平安 燈 或 祈福 燈,47,由於(88111) 那(754138) 天(330413) 剛好(11296) 是(4642407) 元月(856) 十五日(4220) 元宵節(377) 所以(239080) 後來(95618) 平溪(346) 十分(63196) 附近(32204) 的(16029838) 人(1550512) 就(1737544) 把(617773) 元月(856) 十五日(4220) 放(83587) 天燈(209) 變成(73009) 一(3701681) 種(701563) 民俗(2342) 節慶(1284) 傳統(60517) 到了(Unknown) 這(2114032) 天(330413) 都(1125846) 要(851264) 以(547785) 放(83587) 天燈(209) 來(742183) 慶祝(5285) 平安(7479) 所以(239080) 天燈(209) 也(1590760) 叫(111645) 平安(7479) 燈(13821) 或(478077) 祈福(913) 燈(13821),"{'High': 46, 'Low': 1}","{'第4*級': 2, '第1級': 14, '第3*級': 1, 'Unknown': 11, '第1*級': 3, '第2級': 4, '第4級': 5, '第6級': 1, '第3級': 2, '第5級': 1, '第2*級': 2, '第7級': 1}",3,Y,Y,N,N
堵的猜測在不同族群相互爭地的時代，何止是土匪，敵對力量的防堵就變成最重要的一件事。,堵 的 猜測 在 不同 族群 相互 爭 地 的 時代 何止 是 土匪 敵對 力量 的 防堵 就 變成 最 重要 的 一 件 事,26,堵(2440) 的(16029838) 猜測(5359) 在(3284238) 不同(159432) 族群(11192) 相互(21268) 爭(11763) 地(754998) 的(16029838) 時代(74034) 何止(559) 是(4642407) 土匪(1112) 敵對(2540) 力量(59655) 的(16029838) 防堵(347) 就(1737544) 變成(73009) 最(421680) 重要(154863) 的(16029838) 一(3701681) 件(139257) 事(385949),{'High': 26},"{'第6級': 2, '第1級': 7, '第5級': 4, '第1*級': 4, '第3級': 1, '第4*級': 2, 'Unknown': 3, '第7級': 1, '第4級': 1, '第2級': 1}",0,Y,N,N,N
基隆河中游的五、六、七、八堵就是最具象徵意涵的老地名。,基隆河 中游 的 五 六 七 八堵 就 是 最 具 象徵 意涵 的 老 地名,16,基隆河(162) 中游(440) 的(16029838) 五(112649) 六(77936) 七(59385) 八堵(Unknown) 就(1737544) 是(4642407) 最(421680) 具(41661) 象徵(18975) 意涵(4487) 的(16029838) 老(75373) 地名(2920),"{'High': 15, 'Low': 1}","{'Unknown': 4, '第1級': 8, '第1*級': 1, '第6級': 3}",1,Y,N,N,N
有人會問，有五堵、六堵、七堵、八堵，那有沒有四堵、三堵...？,有 人 會 問 有 五堵 六堵 七堵 八堵 那 有 沒 有 四堵 三堵,15,有(2217079) 人(1550512) 會(1014977) 問(165473) 有(2217079) 五堵(Unknown) 六堵(Unknown) 七堵(8) 八堵(Unknown) 那(754138) 有(2217079) 沒(306167) 有(2217079) 四堵(Unknown) 三堵(Unknown),"{'High': 9, 'Low': 6}","{'第1級': 8, '第1*級': 1, 'Unknown': 6}",0,Y,N,N,N
當然有，一堵、二堵、三堵在宜蘭，四堵在台北縣坪林，只是，讓人想不透的是從一堵到八堵的「堵」，到底是誰在防堵誰？,當然 有 一堵 二堵 三堵 在 宜蘭 四堵 在 台北縣 坪林 只是 讓 人 想不透 的 是 從 一堵 到 八堵 的 堵 到底 是 誰 在 防堵 誰,29,當然(113971) 有(2217079) 一堵(Unknown) 二堵(Unknown) 三堵(Unknown) 在(3284238) 宜蘭(2874) 四堵(Unknown) 在(3284238) 台北縣(1048) 坪林(382) 只是(96536) 讓(526314) 人(1550512) 想不透(113) 的(16029838) 是(4642407) 從(496546) 一堵(Unknown) 到(546906) 八堵(Unknown) 的(16029838) 堵(2440) 到底(41946) 是(4642407) 誰(110452) 在(3284238) 防堵(347) 誰(110452),"{'High': 23, 'Low': 6}","{'第2級': 2, '第1級': 9, 'Unknown': 11, '第1*級': 4, '第4級': 1, '第6級': 1, '第4*級': 1}",2,Y,Y,N,N
是漢人防堵平埔族噶瑪蘭人還是泰雅族人？,是 漢人 防堵 平埔族 噶瑪蘭人 還是 泰雅族人,7,是(4642407) 漢人(9245) 防堵(347) 平埔族(1077) 噶瑪蘭人(31) 還是(155231) 泰雅族人(192),"{'High': 6, 'Low': 1}","{'第1級': 1, 'Unknown': 5, '第1*級': 1}",3,Y,Y,N,Y
還是西班牙人、荷蘭人在防堵？,還是 西班牙人 荷蘭人 在 防堵,5,還是(155231) 西班牙人(1295) 荷蘭人(3428) 在(3284238) 防堵(347),{'High': 5},"{'第1*級': 2, 'Unknown': 3}",2,Y,Y,N,N
到目前為止還沒有明確的證據可以解釋。,到 目前 為止 還 沒有 明確 的 證據 可以 解釋,10,到(546906) 目前(48695) 為止(17781) 還(625086) 沒有(594280) 明確(17292) 的(16029838) 證據(20726) 可以(560531) 解釋(59761),{'High': 10},"{'第1級': 4, '第4級': 2, '第5級': 2, 'Unknown': 1, '第4*級': 1}",0,Y,N,N,N
日人安倍明義在台灣地名研究一書中說：「堵為土牆之義，土牆一丈謂之板，五板之堵，殆即指此。」,日人 安倍明義 在 台灣 地名 研究 一 書 中 說 堵 為 土牆 之 義 土牆 一 丈 謂 之 板 五 板 之 堵 殆 即 指 此,29,日人(1406) 安倍明義(23) 在(3284238) 台灣(130718) 地名(2920) 研究(182500) 一(3701681) 書(174356) 中(1011729) 說(1285247) 堵(2440) 為(761341) 土牆(443) 之(875481) 義(21932) 土牆(443) 一(3701681) 丈(4077) 謂(15399) 之(875481) 板(2345) 五(112649) 板(2345) 之(875481) 堵(2440) 殆(969) 即(110826) 指(84264) 此(288458),"{'High': 28, 'Low': 1}","{'Unknown': 10, '第1*級': 1, '第1級': 6, '第3級': 1, '第6級': 5, '第5級': 5, '第4級': 1}",1,Y,N,N,Y
意即堵為在山地或平地自然通道中所築的防禦土牆。,意即 堵 為 在 山地 或 平地 自然 通道 中 所 築 的 防禦 土牆,15,意即(1309) 堵(2440) 為(761341) 在(3284238) 山地(1919) 或(478077) 平地(2528) 自然(91995) 通道(4751) 中(1011729) 所(527327) 築(3713) 的(16029838) 防禦(4470) 土牆(443),{'High': 15},"{'Unknown': 7, '第6級': 3, '第1*級': 1, '第3級': 1, '第3*級': 1, '第2級': 1, '第1級': 1}",0,Y,Y,N,N
然而，什麼是自然通道？,然而 什麼 是 自然 通道,5,然而(94482) 什麼(431321) 是(4642407) 自然(91995) 通道(4751),{'High': 5},"{'第5級': 1, '第1級': 2, '第3*級': 1, '第6級': 1}",0,N,Y,N,N
這其實也是個疑問，畢竟，路是人走出來的。,這 其實 也 是 個 疑問 畢竟 路 是 人 走出來 的,12,這(2114032) 其實(109290) 也(1590760) 是(4642407) 個(2296574) 疑問(10304) 畢竟(21919) 路(74635) 是(4642407) 人(1550512) 走出來(4006) 的(16029838),{'High': 12},"{'第1級': 8, '第3*級': 1, '第5級': 2, 'Unknown': 1}",1,Y,N,N,N
在基隆河中游，我們今天仍可由六堵山上的老地名，像「荷蘭仔溝」、「茅草埔營」、「死豬仔營」等，探索有關「堵」的傳說，這裡的堵據傳說是荷蘭時期以基隆為基地，沿基隆河中游推向宜蘭方面在各山頭築的防禦據點，並且有兵營駐紮。,在 基隆河 中游 我們 今天 仍 可 由 六堵 山 上 的 老 地名 像 荷蘭仔溝 茅草埔營 死豬仔營 等 探索 有關 堵 的 傳說 這裡 的 堵 據 傳說 是 荷蘭 時期 以 基隆 為 基地 沿 基隆河 中游 推向 宜蘭 方面 在 各 山頭 築 的 防禦 據點 並且 有 兵營 駐紮,53,在(3284238) 基隆河(162) 中游(440) 我們(979260) 今天(73277) 仍(92056) 可(307359) 由(208604) 六堵(Unknown) 山(54936) 上(1233218) 的(16029838) 老(75373) 地名(2920) 像(289494) 荷蘭仔溝(Unknown) 茅草埔營(Unknown) 死豬仔營(Unknown) 等(327380) 探索(15308) 有關(69607) 堵(2440) 的(16029838) 傳說(14362) 這裡(100385) 的(16029838) 堵(2440) 據(24392) 傳說(14362) 是(4642407) 荷蘭(7554) 時期(47839) 以(547785) 基隆(2063) 為(761341) 基地(6653) 沿(19661) 基隆河(162) 中游(440) 推向(1616) 宜蘭(2874) 方面(75079) 在(3284238) 各(243023) 山頭(2324) 築(3713) 的(16029838) 防禦(4470) 據點(2750) 並且(60996) 有(2217079) 兵營(429) 駐紮(1965),"{'High': 49, 'Low': 4}","{'第1*級': 4, 'Unknown': 15, '第1級': 11, '第4級': 3, '第4*級': 6, '第3*級': 2, '第6級': 7, '第5級': 4, '第2級': 1}",5,Y,Y,N,N
西班牙人領有台灣北部時，愛斯基委神父等八十餘人就曾沿淡水河上溯，發現台北平原，後來又發現沿基馬遜河(基隆河)可到達雞籠。,西班牙人 領有 台灣 北部 時 愛斯基委 神父 等 八十餘 人 就 曾 沿 淡水河 上溯 發現 台北 平原 後來 又 發現 沿 基馬遜河 基隆河 可 到達 雞籠,27,西班牙人(1295) 領有(762) 台灣(130718) 北部(5380) 時(623734) 愛斯基委(Unknown) 神父(6492) 等(327380) 八十餘(184) 人(1550512) 就(1737544) 曾(132981) 沿(19661) 淡水河(437) 上溯(437) 發現(175233) 台北(22242) 平原(4378) 後來(95618) 又(535555) 發現(175233) 沿(19661) 基馬遜河(Unknown) 基隆河(162) 可(307359) 到達(15955) 雞籠(474),"{'High': 25, 'Low': 2}","{'Unknown': 10, '第1級': 3, '第2*級': 1, '第3*級': 2, '第6級': 1, '第4級': 1, '第5級': 3, '第2級': 3, '第1*級': 1, '第4*級': 2}",6,Y,Y,N,Y
基隆河的水路運輸在陸路未開的時代裡，具有相當重要的地位。,基隆河 的 水路 運輸 在 陸路 未 開 的 時代 裡 具有 相當 重要 的 地位,16,基隆河(162) 的(16029838) 水路(707) 運輸(4226) 在(3284238) 陸路(827) 未(101927) 開(62807) 的(16029838) 時代(74034) 裡(520435) 具有(60702) 相當(66293) 重要(154863) 的(16029838) 地位(36831),{'High': 16},"{'Unknown': 3, '第1級': 3, '第6級': 2, '第1*級': 3, '第5級': 1, '第4*級': 1, '第3級': 1, '第2級': 1, '第4級': 1}",1,Y,N,N,N
因此，無論從河流水運的角度或山嶺防禦的觀點看，基隆河中游在台灣北部族群互動的發展歷史上，都具有不可磨滅的重要意義。,因此 無論 從 河流 水運 的 角度 或 山嶺 防禦 的 觀點 看 基隆河 中游 在 台灣 北部 族群 互動 的 發展 歷史 上 都 具有 不可 磨滅 的 重要 意義,31,因此(184606) 無論(37021) 從(496546) 河流(4762) 水運(120) 的(16029838) 角度(26690) 或(478077) 山嶺(590) 防禦(4470) 的(16029838) 觀點(38495) 看(444691) 基隆河(162) 中游(440) 在(3284238) 台灣(130718) 北部(5380) 族群(11192) 互動(21463) 的(16029838) 發展(117494) 歷史(96060) 上(1233218) 都(1125846) 具有(60702) 不可(50808) 磨滅(633) 的(16029838) 重要(154863) 意義(71714),{'High': 31},"{'第4*級': 2, '第4級': 2, '第1*級': 2, '第5級': 5, 'Unknown': 5, '第1級': 7, '第3級': 2, '第7級': 2, '第6級': 2, '第2*級': 1, '第2級': 1}",1,Y,Y,N,N
鱸鰻基隆河及其兩邊的支流水系就像在山嶺間蠕動的水蛇，將有些地方挖成深潭、有的填為淺灘，造就出可以適應各種水生族群生存的生態環境。,鱸鰻 基隆河 及 其 兩 邊 的 支流 水系 就 像 在 山嶺 間 蠕動 的 水蛇 將 有些 地方 挖成 深潭 有的 填為 淺灘 造就出 可以 適應 各 種 水生 族群 生存 的 生態環境,35,鱸鰻(62) 基隆河(162) 及(304586) 其(307905) 兩(526190) 邊(123152) 的(16029838) 支流(928) 水系(109) 就(1737544) 像(289494) 在(3284238) 山嶺(590) 間(115638) 蠕動(1518) 的(16029838) 水蛇(Unknown) 將(448374) 有些(6971) 地方(139164) 挖成(58) 深潭(227) 有的(31553) 填為(Unknown) 淺灘(499) 造就出(282) 可以(560531) 適應(14698) 各(243023) 種(701563) 水生(486) 族群(11192) 生存(17765) 的(16029838) 生態環境(21),"{'Low': 5, 'High': 30}","{'Unknown': 14, '第5級': 4, '第6級': 1, '第1級': 6, '第1*級': 4, '第7級': 3, '第2級': 2, '第4*級': 1}",3,Y,Y,N,N
而具有傳奇色彩的鱸鰻就是喜歡住在潭中的水族。,而 具有 傳奇 色彩 的 鱸鰻 就 是 喜歡 住在 潭 中 的 水族,14,而(937923) 具有(60702) 傳奇(5970) 色彩(16026) 的(16029838) 鱸鰻(62) 就(1737544) 是(4642407) 喜歡(113753) 住在(7545) 潭(877) 中(1011729) 的(16029838) 水族(183),"{'High': 13, 'Low': 1}","{'第5級': 2, '第6級': 2, '第4*級': 1, '第1級': 5, 'Unknown': 4}",0,Y,Y,N,N
過去，基隆河兩岸尚未大量開墾時，有許多埤塘分布其間，為兩岸的農田貯存灌溉用水，許多鱸鰻也生活在其間。,過去 基隆河 兩岸 尚未 大量 開墾 時 有 許多 埤塘 分布 其 間 為 兩岸 的 農田 貯存 灌溉 用水 許多 鱸鰻 也 生活 在 其 間,27,過去(88758) 基隆河(162) 兩岸(6984) 尚未(16593) 大量(28414) 開墾(1691) 時(623734) 有(2217079) 許多(159791) 埤塘(47) 分布(5163) 其(307905) 間(115638) 為(761341) 兩岸(6984) 的(16029838) 農田(1237) 貯存(635) 灌溉(1649) 用水(1431) 許多(159791) 鱸鰻(62) 也(1590760) 生活(213189) 在(3284238) 其(307905) 間(115638),"{'High': 25, 'Low': 2}","{'第4級': 1, 'Unknown': 11, '第4*級': 1, '第7級': 3, '第3*級': 3, '第1級': 3, '第6級': 3, '第3級': 1, '第1*級': 1}",1,Y,N,N,N
在汐止的金龍湖，原名匠頭埤，因為這裡有很多料材館(鋸木材的工廠)，有一次大水將料材館全部沖走，同時淹死了許多人。,在 汐止 的 金龍湖 原名 匠頭埤 因為 這裡 有 很多 料材館 鋸 木材 的 工廠 有 一 次 大水 將 料材館 全部 沖走 同時 淹死 了 許多 人,28,在(3284238) 汐止(205) 的(16029838) 金龍湖(1) 原名(1675) 匠頭埤(Unknown) 因為(425061) 這裡(100385) 有(2217079) 很多(113128) 料材館(Unknown) 鋸(627) 木材(2801) 的(16029838) 工廠(16192) 有(2217079) 一(3701681) 次(331701) 大水(1115) 將(448374) 料材館(Unknown) 全部(34039) 沖走(567) 同時(115305) 淹死(1832) 了(3199291) 許多(159791) 人(1550512),"{'High': 24, 'Low': 4}","{'第1*級': 2, 'Unknown': 11, '第1級': 7, '第7級': 1, '第6級': 1, '第4級': 1, '第2級': 2, '第5級': 1, '第3*級': 2}",4,Y,Y,N,N
後來，因為湖中有許多鱸鰻，打雷時喜歡浮上水面，看起來金光閃閃，好像金龍一樣而得名。,後來 因為 湖 中 有 許多 鱸鰻 打雷 時 喜歡 浮上 水面 看起來 金光 閃閃 好像 金龍 一樣 而 得名,20,後來(95618) 因為(425061) 湖(8772) 中(1011729) 有(2217079) 許多(159791) 鱸鰻(62) 打雷(498) 時(623734) 喜歡(113753) 浮上(766) 水面(5598) 看起來(41830) 金光(1404) 閃閃(3080) 好像(67024) 金龍(411) 一樣(188109) 而(937923) 得名(829),"{'High': 19, 'Low': 1}","{'第2級': 2, '第1*級': 2, '第4*級': 1, 'Unknown': 7, '第1級': 2, '第3*級': 2, '第7級': 1, '第3級': 1, '第6級': 1, '第5級': 1}",1,Y,Y,N,N
在基隆河中游支流的許多深潭，如鴛鴦潭、豬母潭、巷仔潭...等，也都有很多鱸鰻。,在 基隆河 中游 支流 的 許多 深潭 如 鴛鴦潭 豬母潭 巷仔潭 等 也 都 有 很多 鱸鰻,17,在(3284238) 基隆河(162) 中游(440) 支流(928) 的(16029838) 許多(159791) 深潭(227) 如(195069) 鴛鴦潭(6) 豬母潭(Unknown) 巷仔潭(Unknown) 等(327380) 也(1590760) 都(1125846) 有(2217079) 很多(113128) 鱸鰻(62),"{'High': 13, 'Low': 4}","{'第1*級': 1, 'Unknown': 9, '第7級': 1, '第1級': 4, '第3*級': 2}",4,Y,Y,N,N
鱸鰻睡覺時身體都是與水面垂直的，這也是牠需要深潭的原因。,鱸鰻 睡覺 時 身體 都 是 與 水面 垂直 的 這 也 是 牠 需要 深潭 的 原因,18,鱸鰻(62) 睡覺(14542) 時(623734) 身體(97873) 都(1125846) 是(4642407) 與(968432) 水面(5598) 垂直(3887) 的(16029838) 這(2114032) 也(1590760) 是(4642407) 牠(72229) 需要(166793) 深潭(227) 的(16029838) 原因(67404),"{'Low': 1, 'High': 17}","{'Unknown': 3, '第1級': 8, '第3*級': 2, '第1*級': 1, '第4*級': 1, '第6級': 1, '第4級': 1, '第2級': 1}",0,Y,N,N,N
這裡的鱸鰻還很喜歡趁晚上上岸吃竿蓁的嫩芽，牠們在水中將尾巴甩上岸後，再用尾巴撐住的力量將身體拋上來。,這裡 的 鱸鰻 還 很 喜歡 趁 晚上 上岸 吃 竿蓁 的 嫩芽 牠們 在 水 中 將 尾巴 甩 上岸 後 再 用 尾巴 撐住 的 力量 將 身體 拋上來,31,這裡(100385) 的(16029838) 鱸鰻(62) 還(625086) 很(715675) 喜歡(113753) 趁(9845) 晚上(42206) 上岸(2260) 吃(141660) 竿蓁(Unknown) 的(16029838) 嫩芽(356) 牠們(28803) 在(3284238) 水(86260) 中(1011729) 將(448374) 尾巴(6147) 甩(3286) 上岸(2260) 後(422857) 再(326207) 用(377038) 尾巴(6147) 撐住(618) 的(16029838) 力量(59655) 將(448374) 身體(97873) 拋上來(3),"{'High': 28, 'Low': 3}","{'第1級': 11, 'Unknown': 10, '第4級': 1, '第1*級': 3, '第5級': 5, '第6級': 1}",1,Y,N,N,N
有些人發現鱸鰻的行為模式後，為了抓牠，就在鱸鰻時常經過的路徑地上插一片刮鬍刀片，使鱸鰻經過時割破肚皮流血而死。,有些 人 發現 鱸鰻 的 行為 模式 後 為了 抓 牠 就 在 鱸鰻 時常 經過 的 路徑 地上 插 一 片 刮鬍刀片 使 鱸鰻 經過 時 割破 肚皮 流血 而 死,32,有些(6971) 人(1550512) 發現(175233) 鱸鰻(62) 的(16029838) 行為(97450) 模式(35179) 後(422857) 為了(Unknown) 抓(21151) 牠(72229) 就(1737544) 在(3284238) 鱸鰻(62) 時常(8286) 經過(64617) 的(16029838) 路徑(4358) 地上(Unknown) 插(7254) 一(3701681) 片(71870) 刮鬍刀片(60) 使(197544) 鱸鰻(62) 經過(64617) 時(623734) 割破(239) 肚皮(1533) 流血(3020) 而(937923) 死(117075),"{'High': 26, 'Low': 6}","{'Unknown': 8, '第1級': 6, '第2級': 4, '第5級': 5, '第6級': 3, '第3*級': 2, '第4級': 2, '第1*級': 1, '第3級': 1}",1,Y,Y,N,N
