sentence,sentence_preprocessed,sentence_length,word_freq,high_low_freq,word_level,long_word_count,is_complete_sentence,is_complete_context,is_blacklist,is_greylist
最受矚目的包括在廿三日開幕儀式中，京華城建構十五年所歷經的五位台北市市長，包括現任總統陳水扁、現任台北市長馬英九以及歷任的黃大洲、吳伯雄、徐水德都將出席；而廿六日開始送出的一百部汽車誘賓宣傳案也確定選定價格近五十萬元的鈴木休旅車。,最 受 矚目 的 包括 在 廿三日 開幕 儀式 中 京華城 建構 十五 年 所 歷經 的 五 位 台北市 市長 包括 現任 總統 陳水扁 現任 台北市長 馬英九 以及 歷任 的 黃大洲 吳伯雄 徐水德 都 將 出席 而 廿六日 開始 送出 的 一百 部 汽車 誘 賓 宣傳案 也 確定 選定 價格 近 五十萬 元 的 鈴木 休旅車,58,最(421680) 受(109982) 矚目(2050) 的(16029838) 包括(74410) 在(3284238) 廿三日(182) 開幕(2013) 儀式(13945) 中(1011729) 京華城(10) 建構(13771) 十五(19907) 年(514736) 所(527327) 歷經(5945) 的(16029838) 五(112649) 位(284809) 台北市(4393) 市長(4502) 包括(74410) 現任(3412) 總統(23662) 陳水扁(1345) 現任(3412) 台北市長(Unknown) 馬英九(1151) 以及(155624) 歷任(2289) 的(16029838) 黃大洲(26) 吳伯雄(62) 徐水德(Unknown) 都(1125846) 將(448374) 出席(6104) 而(937923) 廿六日(122) 開始(245562) 送出(1514) 的(16029838) 一百(17093) 部(71567) 汽車(21028) 誘(1231) 賓(469) 宣傳案(Unknown) 也(1590760) 確定(40181) 選定(2354) 價格(21121) 近(43555) 五十萬(1626) 元(60807) 的(16029838) 鈴木(694) 休旅車(316),"{'High': 52, 'Low': 6}","{'第1*級': 2, '第4級': 4, '第6級': 9, '第1級': 11, '第3*級': 2, 'Unknown': 21, '第2級': 5, '第5級': 4}",13,Y,Y,N,Y
明天登場的「卡通共和國」遊行，將有許多家喻戶曉的卡通人物參加，包括國王企鵝、超人蝙蝠俠、美人魚、小飛俠及海盜等，卡通人物將在明天下午二時至四時搭乘京華城的免費生活巴士，沿生活巴士行經路線，在市民廣場、華納商圈、頂好商圈等站下車，在現場雜耍與民眾同樂，並分送四萬個卡通造型的汽球與玩偶給參觀民眾。,明天 登場 的 卡通 共和國 遊行 將 有 許多 家喻戶曉 的 卡通 人物 參加 包括 國王 企鵝 超人 蝙蝠俠 美人魚 小飛俠 及 海盜 等 卡通 人物 將 在 明天 下午 二時 至 四時 搭乘 京華城 的 免費 生活 巴士 沿 生活 巴士 行經 路線 在 市民 廣場 華納 商圈 頂好 商圈 等 站 下車 在 現場 雜耍 與 民眾 同樂 並 分送 四萬 個 卡通 造型 的 汽球 與 玩偶 給 參觀 民眾,73,明天(18918) 登場(2031) 的(16029838) 卡通(3171) 共和國(3820) 遊行(3347) 將(448374) 有(2217079) 許多(159791) 家喻戶曉(928) 的(16029838) 卡通(3171) 人物(52614) 參加(42962) 包括(74410) 國王(27180) 企鵝(799) 超人(4475) 蝙蝠俠(251) 美人魚(414) 小飛俠(236) 及(304586) 海盜(3585) 等(327380) 卡通(3171) 人物(52614) 將(448374) 在(3284238) 明天(18918) 下午(20045) 二時(354) 至(101530) 四時(775) 搭乘(4116) 京華城(10) 的(16029838) 免費(6101) 生活(213189) 巴士(3384) 沿(19661) 生活(213189) 巴士(3384) 行經(1016) 路線(9508) 在(3284238) 市民(6158) 廣場(8418) 華納(1370) 商圈(523) 頂好(128) 商圈(523) 等(327380) 站(68488) 下車(4505) 在(3284238) 現場(15949) 雜耍(560) 與(968432) 民眾(17097) 同樂(54) 並(442790) 分送(398) 四萬(1414) 個(2296574) 卡通(3171) 造型(6053) 的(16029838) 汽球(397) 與(968432) 玩偶(972) 給(240485) 參觀(9034) 民眾(17097),"{'High': 71, 'Low': 2}","{'第1級': 10, '第6級': 1, '第4級': 6, 'Unknown': 22, '第5級': 12, '第3*級': 5, '第7級': 2, '第2級': 1, '第1*級': 4, '第3級': 2, '第2*級': 2, '第4*級': 6}",6,Y,Y,N,Y
周日(十八日)的遊行時間、路線均相同，但遊行隊伍改以「世界大不同」作為主題，有來自世界各地包括西班牙、荷蘭、希臘、摩洛哥、印地安等超過十個國家特殊造型服飾；廿四日(周六)再推出「童話天堂」遊行、廿五日(周日)則是小丑雜耍大遊行。,周日 十八日 的 遊行 時間 路線 均 相同 但 遊行 隊伍 改以 世界 大 不同 作為 主題 有 來自 世界 各 地 包括 西班牙 荷蘭 希臘 摩洛哥 印地安 等 超過 十 個 國家 特殊 造型 服飾 廿四日 周六 再 推出 童話 天堂 遊行 廿五日 周日 則 是 小丑 雜耍 大 遊行,51,周日(143) 十八日(2987) 的(16029838) 遊行(3347) 時間(213595) 路線(9508) 均(27783) 相同(33311) 但(597124) 遊行(3347) 隊伍(7975) 改以(655) 世界(165235) 大(525780) 不同(159432) 作為(58009) 主題(28398) 有(2217079) 來自(41811) 世界(165235) 各(243023) 地(754998) 包括(74410) 西班牙(7097) 荷蘭(7554) 希臘(8913) 摩洛哥(514) 印地安(377) 等(327380) 超過(30507) 十(77415) 個(2296574) 國家(109166) 特殊(28606) 造型(6053) 服飾(3633) 廿四日(169) 周六(104) 再(326207) 推出(10009) 童話(3230) 天堂(6443) 遊行(3347) 廿五日(179) 周日(143) 則(254096) 是(4642407) 小丑(1614) 雜耍(560) 大(525780) 遊行(3347),{'High': 51},"{'Unknown': 11, '第1級': 8, '第5級': 13, '第4級': 5, '第6級': 4, '第2級': 4, '第3級': 1, '第3*級': 2, '第4*級': 1, '第1*級': 2}",6,Y,Y,N,N
京華城指出，廿三日開幕後，慶祝活動更是多得無法數，為強調廿四小時營業，幾乎每晚都有活動。,京華城 指出 廿三日 開幕 後 慶祝 活動 更 是 多 得 無法 數 為 強調 廿四 小時 營業 幾乎 每 晚 都 有 活動,24,京華城(10) 指出(38456) 廿三日(182) 開幕(2013) 後(422857) 慶祝(5285) 活動(85743) 更(361676) 是(4642407) 多(318992) 得(573721) 無法(150606) 數(38654) 為(761341) 強調(36095) 廿四(473) 小時(48521) 營業(4800) 幾乎(74298) 每(333357) 晚(24931) 都(1125846) 有(2217079) 活動(85743),"{'Low': 1, 'High': 23}","{'Unknown': 7, '第6級': 1, '第1級': 6, '第4級': 2, '第2級': 2, '第5級': 3, '第3*級': 1, '第1*級': 2}",2,Y,N,N,N
廿三日起將展開「挑戰極限」系列活動，下午二時，京華城內的「峽谷區」，將舉辦室內高空彈跳。,廿三日 起 將 展開 挑戰 極限 系列 活動 下午 二時 京華城 內 的 峽谷區 將 舉辦 室內 高空彈跳,18,廿三日(182) 起(96746) 將(448374) 展開(17154) 挑戰(27513) 極限(4227) 系列(19048) 活動(85743) 下午(20045) 二時(354) 京華城(10) 內(183051) 的(16029838) 峽谷區(2) 將(448374) 舉辦(12070) 室內(Unknown) 高空彈跳(81),"{'High': 14, 'Low': 4}","{'Unknown': 5, '第3*級': 1, '第5級': 3, '第4*級': 2, '第6級': 2, '第2級': 1, '第1級': 2, '第3級': 1, '第4級': 1}",4,Y,N,N,N
京華城強調，工作人員這幾天正加強安全設施的檢查。,京華城 強調 工作 人員 這 幾 天 正 加強 安全 設施 的 檢查,13,京華城(10) 強調(36095) 工作(220164) 人員(49261) 這(2114032) 幾(229415) 天(330413) 正(179334) 加強(13098) 安全(35338) 設施(5472) 的(16029838) 檢查(21295),"{'Low': 1, 'High': 12}","{'Unknown': 1, '第5級': 2, '第1級': 5, '第3*級': 1, '第4*級': 1, '第3級': 1, '第6級': 1, '第4級': 1}",1,Y,N,N,N
開幕當晚六時起，同樣號稱亞洲唯一的「超炫峽谷聲光秀」將啟動，由晚上六時到翌日凌晨四時，每個整點SHOW一次，每次五分鐘；廿四日將在京華城廣場舉辦數千人的打擊樂、十二月一日展出全世界最大的塗鴨、十二月八日則有「萬人PALAPALA」，希望能創下世界紀錄。,開幕 當晚 六時 起 同樣 號稱 亞洲 唯一 的 超炫 峽谷 聲光秀 將 啟動 由 晚上 六時 到 翌日 凌晨 四時 每 個 整 點 SHOW 一 次 每 次 五 分鐘 廿四日 將 在 京華城 廣場 舉辦 數千 人 的 打擊樂 十二月 一日 展出 全 世界 最 大 的 塗鴨 十二月 八日 則 有 萬 人 PALAPALA 希望 能 創下 世界 紀錄,63,開幕(2013) 當晚(3170) 六時(349) 起(96746) 同樣(63568) 號稱(3257) 亞洲(13256) 唯一(39149) 的(16029838) 超炫(60) 峽谷(1936) 聲光秀(5) 將(448374) 啟動(6280) 由(208604) 晚上(42206) 六時(349) 到(546906) 翌日(1946) 凌晨(3229) 四時(775) 每(333357) 個(2296574) 整(105785) 點(118735) SHOW(Unknown) 一(3701681) 次(331701) 每(333357) 次(331701) 五(112649) 分鐘(52479) 廿四日(169) 將(448374) 在(3284238) 京華城(10) 廣場(8418) 舉辦(12070) 數千(4849) 人(1550512) 的(16029838) 打擊樂(177) 十二月(13715) 一日(5343) 展出(3360) 全(178642) 世界(165235) 最(421680) 大(525780) 的(16029838) 塗鴨(44) 十二月(13715) 八日(3536) 則(254096) 有(2217079) 萬(13178) 人(1550512) PALAPALA(Unknown) 希望(119975) 能(582260) 創下(1422) 世界(165235) 紀錄(14233),"{'High': 57, 'Low': 6}","{'第6級': 4, 'Unknown': 19, '第3*級': 4, '第5級': 6, '第1級': 13, '第4*級': 1, '第7級': 1, '第1*級': 7, '第2級': 6, '第4級': 2}",8,Y,N,N,N
此外，開幕後，每天晚上九時至翌日凌晨四時，京華城多達八個表演場地，將舉辦異國浪漫的街頭表演、新人歌唱舞台等，每天都有不同的節目，且持續到凌晨四時，希望提供台北市民不一樣的休閒去處。,此外 開幕 後 每 天 晚上 九時 至 翌日 凌晨 四時 京華城 多達 八 個 表演 場地 將 舉辦 異國 浪漫 的 街頭 表演 新人 歌唱 舞台 等 每 天 都 有 不同 的 節目 且 持續 到 凌晨 四時 希望 提供 台北 市民 不 一樣 的 休閒 去處,49,此外(30247) 開幕(2013) 後(422857) 每(333357) 天(330413) 晚上(42206) 九時(372) 至(101530) 翌日(1946) 凌晨(3229) 四時(775) 京華城(10) 多達(2200) 八(54961) 個(2296574) 表演(20601) 場地(2712) 將(448374) 舉辦(12070) 異國(2078) 浪漫(9865) 的(16029838) 街頭(6382) 表演(20601) 新人(3079) 歌唱(3396) 舞台(13305) 等(327380) 每(333357) 天(330413) 都(1125846) 有(2217079) 不同(159432) 的(16029838) 節目(21445) 且(67015) 持續(33796) 到(546906) 凌晨(3229) 四時(775) 希望(119975) 提供(73097) 台北(22242) 市民(6158) 不(2282521) 一樣(188109) 的(16029838) 休閒(5416) 去處(972),"{'High': 48, 'Low': 1}","{'第5級': 6, '第6級': 4, '第1級': 13, '第1*級': 3, 'Unknown': 8, '第7級': 1, '第4級': 6, '第4*級': 4, '第3*級': 1, '第3級': 2, '第2級': 1}",1,Y,Y,N,N
陳水扁總統廿一日晚間做出重大政治宣示，基於國家安全、政局穩定和國家經濟的長遠發展，他將在選後籌組跨黨派的聯合政府、跨黨派的國家安定聯盟，在這個聯盟的運作下，盟員將就兩岸政策、國家認同在內的重大政策簽署政策綱領，在綱領外的政策意見可以容許多元意見，盟員對於重大人事擁有建議權。,陳水扁 總統 廿一日 晚間 做出 重大 政治 宣示 基於 國家 安全 政局 穩定 和 國家 經濟 的 長遠 發展 他 將 在 選後 籌組 跨黨派 的 聯合 政府 跨黨派 的 國家 安定 聯盟 在 這 個 聯盟 的 運作 下 盟員 將 就 兩岸 政策 國家 認同 在 內 的 重大 政策 簽署 政策 綱領 在 綱領 外 的 政策 意見 可以 容許 多元 意見 盟員 對於 重大 人事 擁有 建議權,71,陳水扁(1345) 總統(23662) 廿一日(139) 晚間(1978) 做出(28140) 重大(19228) 政治(79504) 宣示(1899) 基於(12809) 國家(109166) 安全(35338) 政局(1677) 穩定(19878) 和(1338337) 國家(109166) 經濟(83046) 的(16029838) 長遠(2941) 發展(117494) 他(2487930) 將(448374) 在(3284238) 選後(97) 籌組(582) 跨黨派(Unknown) 的(16029838) 聯合(10911) 政府(92663) 跨黨派(Unknown) 的(16029838) 國家(109166) 安定(6827) 聯盟(7935) 在(3284238) 這(2114032) 個(2296574) 聯盟(7935) 的(16029838) 運作(23209) 下(329549) 盟員(10) 將(448374) 就(1737544) 兩岸(6984) 政策(30965) 國家(109166) 認同(21303) 在(3284238) 內(183051) 的(16029838) 重大(19228) 政策(30965) 簽署(2297) 政策(30965) 綱領(837) 在(3284238) 綱領(837) 外(109310) 的(16029838) 政策(30965) 意見(34740) 可以(560531) 容許(4248) 多元(10941) 意見(34740) 盟員(10) 對於(99570) 重大(19228) 人事(6842) 擁有(55809) 建議權(9),"{'High': 65, 'Low': 6}","{'Unknown': 13, '第4級': 6, '第4*級': 8, '第6級': 5, '第1*級': 9, '第3級': 2, '第1級': 12, '第5級': 12, '第7級': 2, '第3*級': 2}",5,Y,Y,N,Y
陳總統並感慨表示，朝野歧見其實不是那麼大，國會運作的問題多在於人的問題而非政策理念，政黨輪替五百多天，選舉恩怨猶未了結，「其實選後誰下台大家都知道。」,陳 總統 並 感慨 表示 朝野 歧見 其實 不 是 那麼 大 國會 運作 的 問題 多 在於 人 的 問題 而 非 政策 理念 政黨 輪替 五百多 天 選舉 恩怨 猶 未 了結 其實 選後 誰 下台 大家 都 知道,41,陳(10579) 總統(23662) 並(442790) 感慨(3614) 表示(74452) 朝野(1679) 歧見(620) 其實(109290) 不(2282521) 是(4642407) 那麼(127785) 大(525780) 國會(6466) 運作(23209) 的(16029838) 問題(280782) 多(318992) 在於(37953) 人(1550512) 的(16029838) 問題(280782) 而(937923) 非(112415) 政策(30965) 理念(13826) 政黨(4138) 輪替(632) 五百多(484) 天(330413) 選舉(8292) 恩怨(1181) 猶(8753) 未(101927) 了結(1287) 其實(109290) 選後(97) 誰(110452) 下台(1666) 大家(109692) 都(1125846) 知道(343214),"{'High': 40, 'Low': 1}","{'Unknown': 5, '第4級': 1, '第4*級': 3, '第6級': 6, '第7級': 3, '第3*級': 2, '第1級': 14, '第2級': 1, '第5級': 6}",1,Y,Y,N,Y
他就是希望能透過國家安定聯盟這個機制來解決。,他 就是 希望 能 透過 國家 安定 聯盟 這 個 機制 來 解決,13,他(2487930) 就是(2943) 希望(119975) 能(582260) 透過(63117) 國家(109166) 安定(6827) 聯盟(7935) 這(2114032) 個(2296574) 機制(13955) 來(742183) 解決(55725),{'High': 13},"{'第1級': 4, 'Unknown': 1, '第2級': 1, '第1*級': 2, '第5級': 3, '第6級': 1, '第4級': 1}",0,Y,Y,N,N
對他口中「誰會下台」究竟指涉何人？,對 他 口 中 誰 會 下台 究竟 指涉 何 人,11,對(897964) 他(2487930) 口(83854) 中(1011729) 誰(110452) 會(1014977) 下台(1666) 究竟(28589) 指涉(2137) 何(46992) 人(1550512),{'High': 11},"{'第1級': 4, '第3級': 1, 'Unknown': 3, '第1*級': 1, '第5級': 2}",0,Y,N,N,N
陳總統並未具體言明。,陳 總統 並 未 具體 言明,6,陳(10579) 總統(23662) 並(442790) 未(101927) 具體(20349) 言明(434),{'High': 6},"{'Unknown': 2, '第4級': 1, '第4*級': 2, '第5級': 1}",0,Y,N,N,Y
陳總統的「世紀首航」列車昨日赴宜蘭為民進黨候選人助講，在晚間十時準時結束後，隨即搭夜班火車返回台北，行程中他與隨行媒體談話，做以上重大的政治宣示。,陳 總統 的 世紀 首航 列車 昨日 赴 宜蘭 為 民進黨 候選人 助講 在 晚間 十時 準時 結束 後 隨即 搭 夜班 火車 返回 台北 行程 中 他 與 隨行 媒體 談話 做 以上 重大 的 政治 宣示,38,陳(10579) 總統(23662) 的(16029838) 世紀(16204) 首航(129) 列車(2658) 昨日(2036) 赴(12878) 宜蘭(2874) 為(761341) 民進黨(2844) 候選人(4847) 助講(23) 在(3284238) 晚間(1978) 十時(397) 準時(2997) 結束(40669) 後(422857) 隨即(10199) 搭(16185) 夜班(361) 火車(13566) 返回(9595) 台北(22242) 行程(5276) 中(1011729) 他(2487930) 與(968432) 隨行(1835) 媒體(32308) 談話(16731) 做(411649) 以上(36569) 重大(19228) 的(16029838) 政治(79504) 宣示(1899),"{'High': 37, 'Low': 1}","{'Unknown': 12, '第4級': 5, '第1級': 5, '第6級': 4, '第5級': 4, '第1*級': 2, '第3*級': 2, '第3級': 1, '第4*級': 2, '第7級': 1}",2,Y,N,N,Y
陳水扁表示，他非常有信心這場政黨輪替後的第一次大選，絕對是公開公正、最乾淨的一次選舉。,陳水扁 表示 他 非常 有 信心 這 場 政黨 輪替 後 的 第一 次 大選 絕對 是 公開 公正 最 乾淨 的 一 次 選舉,25,陳水扁(1345) 表示(74452) 他(2487930) 非常(152032) 有(2217079) 信心(17507) 這(2114032) 場(68915) 政黨(4138) 輪替(632) 後(422857) 的(16029838) 第一(172544) 次(331701) 大選(1789) 絕對(42446) 是(4642407) 公開(19118) 公正(4260) 最(421680) 乾淨(12245) 的(16029838) 一(3701681) 次(331701) 選舉(8292),{'High': 25},"{'Unknown': 3, '第4*級': 3, '第1級': 8, '第1*級': 2, '第4級': 1, '第2級': 5, '第6級': 2, '第5級': 1}",1,Y,N,N,Y
對於民進黨的選情，他也信心十足的表示，民進黨目前十二個執政縣市「絕對不會更少」，同時一定可以成為國會第一大黨。,對於 民進黨 的 選情 他 也 信心 十足 的 表示 民進黨 目前 十二 個 執政 縣市 絕對 不會 更少 同時 一定 可以 成為 國會 第一 大 黨,27,對於(99570) 民進黨(2844) 的(16029838) 選情(221) 他(2487930) 也(1590760) 信心(17507) 十足(6475) 的(16029838) 表示(74452) 民進黨(2844) 目前(48695) 十二(22310) 個(2296574) 執政(5128) 縣市(1349) 絕對(42446) 不會(173045) 更少(1133) 同時(115305) 一定(138695) 可以(560531) 成為(143834) 國會(6466) 第一(172544) 大(525780) 黨(23312),{'High': 27},"{'第5級': 4, 'Unknown': 8, '第1級': 7, '第4級': 2, '第4*級': 2, '第6級': 1, '第3*級': 1, '第1*級': 1, '第2級': 1}",2,Y,N,N,Y
陳水扁表示，這段時間來，他對許多問題有過省思，他認為，有些問題朝野差異並不大，甚至共識還滿大的，「如果大家不嫌棄，有共同的理想目標者，就可以組織這個聯盟。」,陳水扁 表示 這 段 時間 來 他 對 許多 問題 有 過 省思 他 認為 有些 問題 朝野 差異 並 不 大 甚至 共識 還 滿 大 的 如果 大家 不 嫌棄 有 共同 的 理想 目標 者 就 可以 組織 這 個 聯盟,44,陳水扁(1345) 表示(74452) 這(2114032) 段(95980) 時間(213595) 來(742183) 他(2487930) 對(897964) 許多(159791) 問題(280782) 有(2217079) 過(412878) 省思(1578) 他(2487930) 認為(192030) 有些(6971) 問題(280782) 朝野(1679) 差異(24997) 並(442790) 不(2282521) 大(525780) 甚至(122502) 共識(6750) 還(625086) 滿(46727) 大(525780) 的(16029838) 如果(322121) 大家(109692) 不(2282521) 嫌棄(902) 有(2217079) 共同(36636) 的(16029838) 理想(27021) 目標(62638) 者(423504) 就(1737544) 可以(560531) 組織(69485) 這(2114032) 個(2296574) 聯盟(7935),{'High': 44},"{'Unknown': 4, '第4*級': 5, '第1級': 21, '第4級': 3, '第3*級': 1, '第1*級': 1, '第7級': 2, '第2級': 2, '第6級': 2, '第3級': 1, '第5級': 2}",1,Y,Y,N,Y
在這個聯盟下，有幾個大的政策綱領：第一，共同推動國會改革，立委席次減半，單一選區兩票制；第二，國家安全上，堅持中華民國是主權獨立的國家，絕對不是中華人民共和國的一部份，堅決反對一國兩制；第三，社會福利上，同意發放敬老津貼；第四，落實經發會三百廿二項共同意見。,在 這 個 聯盟 下 有 幾 個 大 的 政策 綱領 第一 共同 推動 國會 改革 立委 席次 減半 單一 選區 兩票制 第二 國家 安全 上 堅持 中華民國 是 主權 獨立 的 國家 絕對 不 是 中華 人民 共和國 的 一 部份 堅決 反對 一國兩制 第三 社會 福利 上 同意 發放 敬老 津貼 第四 落實 經發會 三百廿二 項 共同 意見,61,在(3284238) 這(2114032) 個(2296574) 聯盟(7935) 下(329549) 有(2217079) 幾(229415) 個(2296574) 大(525780) 的(16029838) 政策(30965) 綱領(837) 第一(172544) 共同(36636) 推動(14867) 國會(6466) 改革(21497) 立委(1052) 席次(452) 減半(450) 單一(8337) 選區(468) 兩票制(Unknown) 第二(98741) 國家(109166) 安全(35338) 上(1233218) 堅持(30662) 中華民國(5430) 是(4642407) 主權(4544) 獨立(29364) 的(16029838) 國家(109166) 絕對(42446) 不(2282521) 是(4642407) 中華(8450) 人民(36441) 共和國(3820) 的(16029838) 一(3701681) 部份(11022) 堅決(6192) 反對(26810) 一國兩制(401) 第三(50320) 社會(176660) 福利(4311) 上(1233218) 同意(30620) 發放(1376) 敬老(119) 津貼(984) 第四(21065) 落實(4291) 經發會(8) 三百廿二(Unknown) 項(88887) 共同(36636) 意見(34740),"{'High': 58, 'Low': 3}","{'第1*級': 4, '第1級': 15, '第5級': 8, '第4*級': 4, '第7級': 1, '第2級': 2, '第4級': 4, 'Unknown': 14, '第6級': 5, '第3級': 2, '第3*級': 2}",6,Y,Y,N,N
陳水扁表示，這個聯盟要邀請不同政黨或個人參加，從聯盟的權利義務到形成決策機制，是他目前思考的問題。,陳水扁 表示 這 個 聯盟 要 邀請 不同 政黨 或 個人 參加 從 聯盟 的 權利 義務 到 形成 決策 機制 是 他 目前 思考 的 問題,27,陳水扁(1345) 表示(74452) 這(2114032) 個(2296574) 聯盟(7935) 要(851264) 邀請(14342) 不同(159432) 政黨(4138) 或(478077) 個人(76253) 參加(42962) 從(496546) 聯盟(7935) 的(16029838) 權利(15625) 義務(7086) 到(546906) 形成(47486) 決策(16052) 機制(13955) 是(4642407) 他(2487930) 目前(48695) 思考(63031) 的(16029838) 問題(280782),{'High': 27},"{'Unknown': 1, '第4*級': 2, '第1級': 9, '第5級': 4, '第4級': 4, '第3級': 2, '第6級': 3, '第2級': 1, '第1*級': 1}",1,Y,Y,N,Y
他並已和行政院長張俊雄和民進黨主席謝長廷討論溝通，並獲致相當默契與結論。,他 並 已 和 行政院長 張俊雄 和 民進黨 主席 謝長廷 討論 溝通 並 獲致 相當 默契 與 結論,18,他(2487930) 並(442790) 已(215610) 和(1338337) 行政院長(698) 張俊雄(49) 和(1338337) 民進黨(2844) 主席(9526) 謝長廷(162) 討論(59041) 溝通(31533) 並(442790) 獲致(1490) 相當(66293) 默契(2115) 與(968432) 結論(15145),"{'High': 17, 'Low': 1}","{'第1級': 1, '第4*級': 4, '第3級': 2, 'Unknown': 7, '第5級': 1, '第3*級': 1, '第4級': 1, '第6級': 1}",4,Y,Y,N,Y
就聯盟成員的義務上，必須共同推動並遵守簽署的「政策綱領」，在上述四大綱領外則可容許有其他多元主張並存。,就 聯盟 成員 的 義務 上 必須 共同 推動 並 遵守 簽署 的 政策 綱領 在 上述 四 大 綱領 外 則 可 容許 有 其他 多元 主張 並存,29,就(1737544) 聯盟(7935) 成員(25071) 的(16029838) 義務(7086) 上(1233218) 必須(170592) 共同(36636) 推動(14867) 並(442790) 遵守(7070) 簽署(2297) 的(16029838) 政策(30965) 綱領(837) 在(3284238) 上述(18640) 四(141667) 大(525780) 綱領(837) 外(109310) 則(254096) 可(307359) 容許(4248) 有(2217079) 其他(189445) 多元(10941) 主張(23147) 並存(1420),{'High': 29},"{'第1級': 8, '第5級': 8, '第3級': 1, '第4級': 1, '第4*級': 4, '第6級': 2, '第7級': 2, '第1*級': 1, '第2級': 1, 'Unknown': 1}",0,Y,Y,N,N
權利上，總統對國家政策和重大事項需要事先徵詢聯盟成員(包括政黨和個人)意見，政策之外，重大人事包括總統任命閣揆和閣員，盟員都有建議權。,權利 上 總統 對 國家 政策 和 重大 事項 需要 事先 徵詢 聯盟 成員 包括 政黨 和 個人 意見 政策 之外 重大 人事 包括 總統 任命 閣揆 和 閣員 盟員 都 有 建議權,33,權利(15625) 上(1233218) 總統(23662) 對(897964) 國家(109166) 政策(30965) 和(1338337) 重大(19228) 事項(5635) 需要(166793) 事先(9723) 徵詢(1099) 聯盟(7935) 成員(25071) 包括(74410) 政黨(4138) 和(1338337) 個人(76253) 意見(34740) 政策(30965) 之外(45757) 重大(19228) 人事(6842) 包括(74410) 總統(23662) 任命(8000) 閣揆(111) 和(1338337) 閣員(262) 盟員(10) 都(1125846) 有(2217079) 建議權(9),"{'High': 31, 'Low': 2}","{'第4級': 4, '第1級': 4, '第1*級': 1, '第4*級': 4, 'Unknown': 8, '第5級': 5, '第2級': 1, '第6級': 3, '第3*級': 3}",1,Y,Y,N,N
陳水扁強調，聯盟成立同時，就要議定未來重大事項和國家政策如何形成的民主機制。,陳水扁 強調 聯盟 成立 同時 就 要 議定 未來 重大 事項 和 國家 政策 如何 形成 的 民主 機制,19,陳水扁(1345) 強調(36095) 聯盟(7935) 成立(28506) 同時(115305) 就(1737544) 要(851264) 議定(567) 未來(54445) 重大(19228) 事項(5635) 和(1338337) 國家(109166) 政策(30965) 如何(148068) 形成(47486) 的(16029838) 民主(18177) 機制(13955),{'High': 19},"{'Unknown': 3, '第5級': 4, '第4*級': 3, '第3*級': 1, '第1級': 3, '第4級': 2, '第1*級': 1, '第6級': 2}",1,Y,Y,N,Y
這個機制一定會事前談妥，並且是常態性的決策機制，如此才有助於行政、立法部門的合作和政策的推動，以及政策綱領的落實。,這 個 機制 一定 會 事 前 談妥 並且 是 常態性 的 決策 機制 如此 才 有助於 行政 立法 部門 的 合作 和 政策 的 推動 以及 政策 綱領 的 落實,31,這(2114032) 個(2296574) 機制(13955) 一定(138695) 會(1014977) 事(385949) 前(272709) 談妥(322) 並且(60996) 是(4642407) 常態性(138) 的(16029838) 決策(16052) 機制(13955) 如此(133083) 才(394539) 有助於(9351) 行政(15666) 立法(3759) 部門(21166) 的(16029838) 合作(35908) 和(1338337) 政策(30965) 的(16029838) 推動(14867) 以及(155624) 政策(30965) 綱領(837) 的(16029838) 落實(4291),{'High': 31},"{'第1級': 8, '第6級': 4, '第1*級': 3, 'Unknown': 4, '第4級': 1, '第5級': 4, '第2級': 1, '第4*級': 4, '第3*級': 1, '第7級': 1}",2,Y,Y,N,N
