sentence,sentence_preprocessed,sentence_length,word_freq,high_low_freq,word_level,long_word_count,is_complete_sentence,is_complete_context,is_blacklist,is_greylist
我也認識林家的兒子和媳婦，他們因為工作的關係，住在桃園，但是每個假日，幾乎都會回來陪伴林老太太，我時常在散步時遇見他們夫妻倆，也會寒暄一番，林太太除了託我平日幫忙照應林老太太之外，也會笑咪咪的和我閒話家常，我從談話中瞭解林先生，對林太太非常的體貼，由於都是上班族，下班後會主動的幫忙林太太作家事，像洗碗、拖地、倒垃圾、照顧小孩......等等，平時也很尊重林太太，家裡有甚麼事情都會彼此討論，雙方家庭有什麼困難也會提出來共同解決，像林先生的岳父作生意，一時周轉困難，就是林先生慷慨解囊，才得以解決困境；林先生的妹妹出嫁，一切的繁文縟節，也都是林太太張羅打點的；這對親家就像一家人似的，彼此互相幫助。,我 也 認識 林家 的 兒子 和 媳婦 他們 因為 工作 的 關係 住在 桃園 但是 每 個 假日 幾乎 都 會 回來 陪伴 林 老太太 我 時常 在 散步 時 遇見 他們 夫妻倆 也 會 寒暄 一 番 林 太太 除了 託 我 平日 幫忙 照應 林 老太太 之外 也 會 笑咪咪 的 和 我 閒話家常 我 從 談話 中 瞭解 林 先生 對 林 太太 非常 的 體貼 由於 都 是 上班族 下班 後 會 主動 的 幫忙 林 太太 作 家事 像 洗碗 拖地 倒 垃圾 照顧 小孩 等等 平時 也 很 尊重 林 太太 家 裡 有 甚麼 事情 都 會 彼此 討論 雙方 家庭 有 什麼 困難 也 會 提出來 共同 解決 像 林 先生 的 岳父 作生意 一時 周轉 困難 就是 林 先生 慷慨解囊 才 得以 解決 困境 林 先生 的 妹妹 出嫁 一切 的 繁文縟節 也 都 是 林 太太 張羅 打點 的 這 對 親家 就 像 一家人 似的 彼此 互相 幫助,160,我(3033032) 也(1590760) 認識(51425) 林家(1030) 的(16029838) 兒子(60663) 和(1338337) 媳婦(5304) 他們(716752) 因為(425061) 工作(220164) 的(16029838) 關係(162883) 住在(7545) 桃園(1991) 但是(247988) 每(333357) 個(2296574) 假日(2962) 幾乎(74298) 都(1125846) 會(1014977) 回來(45286) 陪伴(6246) 林(10268) 老太太(5537) 我(3033032) 時常(8286) 在(3284238) 散步(6803) 時(623734) 遇見(7702) 他們(716752) 夫妻倆(1444) 也(1590760) 會(1014977) 寒暄(1347) 一(3701681) 番(30293) 林(10268) 太太(46720) 除了(75964) 託(3801) 我(3033032) 平日(6274) 幫忙(21072) 照應(665) 林(10268) 老太太(5537) 之外(45757) 也(1590760) 會(1014977) 笑咪咪(532) 的(16029838) 和(1338337) 我(3033032) 閒話家常(389) 我(3033032) 從(496546) 談話(16731) 中(1011729) 瞭解(28366) 林(10268) 先生(159645) 對(897964) 林(10268) 太太(46720) 非常(152032) 的(16029838) 體貼(3561) 由於(88111) 都(1125846) 是(4642407) 上班族(1890) 下班(4531) 後(422857) 會(1014977) 主動(18624) 的(16029838) 幫忙(21072) 林(10268) 太太(46720) 作(78184) 家事(4101) 像(289494) 洗碗(984) 拖地(251) 倒(40381) 垃圾(7197) 照顧(29251) 小孩(47282) 等等(38274) 平時(9449) 也(1590760) 很(715675) 尊重(18394) 林(10268) 太太(46720) 家(236822) 裡(520435) 有(2217079) 甚麼(13339) 事情(112079) 都(1125846) 會(1014977) 彼此(39449) 討論(59041) 雙方(22984) 家庭(60608) 有(2217079) 什麼(431321) 困難(37504) 也(1590760) 會(1014977) 提出來(2306) 共同(36636) 解決(55725) 像(289494) 林(10268) 先生(159645) 的(16029838) 岳父(1529) 作生意(183) 一時(19906) 周轉(330) 困難(37504) 就是(2943) 林(10268) 先生(159645) 慷慨解囊(162) 才(394539) 得以(20774) 解決(55725) 困境(10774) 林(10268) 先生(159645) 的(16029838) 妹妹(15695) 出嫁(1700) 一切(95523) 的(16029838) 繁文縟節(224) 也(1590760) 都(1125846) 是(4642407) 林(10268) 太太(46720) 張羅(783) 打點(1097) 的(16029838) 這(2114032) 對(897964) 親家(862) 就(1737544) 像(289494) 一家人(4587) 似的(20081) 彼此(39449) 互相(23967) 幫助(62744),{'High': 160},"{'第1級': 54, '第2級': 8, 'Unknown': 20, '第5級': 10, '第1*級': 15, '第3級': 3, '第3*級': 12, '第4級': 11, '第4*級': 15, '第7級': 5, '第6級': 6, '第2*級': 1}",11,Y,Y,N,Y
總而言之，林先生對林太太是尊重、體貼、擔當和彼此分享，所以他們夫妻倆的婚姻生活非常的甜蜜。,總而言之 林 先生 對 林 太太 是 尊重 體貼 擔當 和 彼此 分享 所以 他們 夫妻倆 的 婚姻 生活 非常 的 甜蜜,22,總而言之(2486) 林(10268) 先生(159645) 對(897964) 林(10268) 太太(46720) 是(4642407) 尊重(18394) 體貼(3561) 擔當(2315) 和(1338337) 彼此(39449) 分享(19471) 所以(239080) 他們(716752) 夫妻倆(1444) 的(16029838) 婚姻(22257) 生活(213189) 非常(152032) 的(16029838) 甜蜜(3026),{'High': 22},"{'第5級': 5, '第4*級': 3, '第1級': 7, '第6級': 1, 'Unknown': 2, '第4級': 1, '第1*級': 2, '第3級': 1}",2,Y,Y,N,Y
我在想：鄰居老太太時常誇讚媳婦，體貼孝順，那一點一滴的讚譽，應當也是來自於林家兒子一點一滴的對林太太的好所累積的吧！,我 在 想 鄰居 老太太 時常 誇讚 媳婦 體貼 孝順 那 一點一滴 的 讚譽 應當 也 是 來自於 林家 兒子 一點一滴 的 對 林 太太 的 好 所 累積 的 吧,31,我(3033032) 在(3284238) 想(449884) 鄰居(10426) 老太太(5537) 時常(8286) 誇讚(775) 媳婦(5304) 體貼(3561) 孝順(2037) 那(754138) 一點一滴(1492) 的(16029838) 讚譽(844) 應當(8408) 也(1590760) 是(4642407) 來自於(6664) 林家(1030) 兒子(60663) 一點一滴(1492) 的(16029838) 對(897964) 林(10268) 太太(46720) 的(16029838) 好(448428) 所(527327) 累積(13742) 的(16029838) 吧(184477),{'High': 31},"{'第1級': 13, '第1*級': 1, '第3級': 1, '第3*級': 1, '第4級': 1, '第7級': 2, '第5級': 4, '第6級': 2, '第4*級': 2, 'Unknown': 3, '第2級': 1}",4,Y,N,N,Y
所以說：想要自己的太太，來孝順自己的媽媽，男人是否要先對自己的太太好，太太感恩在心，對自己的婆婆自然就百依百順，孝順有加了。,所以 說 想要 自己 的 太太 來 孝順 自己 的 媽媽 男人 是否 要 先 對 自己 的 太太 好 太太 感恩 在 心 對 自己 的 婆婆 自然 就 百依百順 孝順 有加 了,34,所以(239080) 說(1285247) 想要(63278) 自己(744739) 的(16029838) 太太(46720) 來(742183) 孝順(2037) 自己(744739) 的(16029838) 媽媽(70492) 男人(56333) 是否(78907) 要(851264) 先(136649) 對(897964) 自己(744739) 的(16029838) 太太(46720) 好(448428) 太太(46720) 感恩(4295) 在(3284238) 心(180243) 對(897964) 自己(744739) 的(16029838) 婆婆(6367) 自然(91995) 就(1737544) 百依百順(197) 孝順(2037) 有加(1370) 了(3199291),{'High': 34},"{'第1*級': 7, '第1級': 14, 'Unknown': 6, '第5級': 4, '第2級': 1, '第4*級': 1, '第3*級': 1}",1,Y,Y,N,N
當洛夫頓九局上的高飛球被接殺後，邦茲所能做的，只是躲在休息室的黑暗一角，無奈地看著對手瘋狂慶功。,當 洛夫頓 九 局 上 的 高飛球 被 接殺 後 邦茲 所 能 做 的 只是 躲 在 休息室 的 黑暗 一角 無奈 地 看 著 對手 瘋狂 慶功,29,當(294625) 洛夫頓(Unknown) 九(34506) 局(7737) 上(1233218) 的(16029838) 高飛球(142) 被(540683) 接殺(151) 後(422857) 邦茲(4) 所(527327) 能(582260) 做(411649) 的(16029838) 只是(96536) 躲(13520) 在(3284238) 休息室(1015) 的(16029838) 黑暗(16430) 一角(659) 無奈(8144) 地(754998) 看(444691) 著(1004687) 對手(14528) 瘋狂(11212) 慶功(283),"{'High': 27, 'Low': 2}","{'Unknown': 11, '第1級': 7, '第5級': 2, '第2級': 2, '第1*級': 2, '第4級': 2, '第4*級': 2, '第6級': 1}",3,Y,Y,N,Y
昨日，邦茲沒有光榮的全壘打，也沒有勝利的跑壘。,昨日 邦茲 沒有 光榮 的 全壘打 也 沒有 勝利 的 跑壘,11,昨日(2036) 邦茲(4) 沒有(594280) 光榮(3078) 的(16029838) 全壘打(655) 也(1590760) 沒有(594280) 勝利(14590) 的(16029838) 跑壘(124),"{'High': 10, 'Low': 1}","{'第5級': 1, 'Unknown': 3, '第1級': 5, '第6級': 1, '第4*級': 1}",1,Y,N,N,Y
當然，也沒有世界大賽冠軍戒指。,當然 也 沒有 世界 大賽 冠軍 戒指,7,當然(113971) 也(1590760) 沒有(594280) 世界(165235) 大賽(1690) 冠軍(3670) 戒指(3408),{'High': 7},"{'第2級': 2, '第1級': 2, 'Unknown': 1, '第5級': 2}",0,Y,N,N,N
毫無疑問，這將是今年冬天，圍繞在邦茲耳邊的聲音，或許也將糾纏他整個棒球生涯，甚至餘生。,毫無 疑問 這 將 是 今年 冬天 圍繞 在 邦茲 耳 邊 的 聲音 或許 也 將 糾纏 他 整個 棒球 生涯 甚至 餘生,24,毫無(32086) 疑問(10304) 這(2114032) 將(448374) 是(4642407) 今年(10836) 冬天(8241) 圍繞(5686) 在(3284238) 邦茲(4) 耳(16140) 邊(123152) 的(16029838) 聲音(85694) 或許(60077) 也(1590760) 將(448374) 糾纏(3789) 他(2487930) 整個(Unknown) 棒球(3224) 生涯(11332) 甚至(122502) 餘生(843),"{'High': 22, 'Low': 2}","{'Unknown': 3, '第5級': 4, '第1級': 6, '第2級': 2, '第1*級': 2, '第4級': 2, '第6級': 2, '第2*級': 1, '第4*級': 1, '第7級': 1}",0,Y,N,N,Y
大聯盟征戰十七年，依舊和冠軍戒指無緣的邦茲說：「三打數一安打，外加一保送，還算不錯吧。,大聯盟 征戰 十七 年 依舊 和 冠軍 戒指 無緣 的 邦茲 說 三 打數 一 安打 外加 一 保送 還 算 不錯 吧,23,大聯盟(7) 征戰(1448) 十七(7310) 年(514736) 依舊(10984) 和(1338337) 冠軍(3670) 戒指(3408) 無緣(1299) 的(16029838) 邦茲(4) 說(1285247) 三(313861) 打數(28) 一(3701681) 安打(744) 外加(2016) 一(3701681) 保送(538) 還(625086) 算(33905) 不錯(23297) 吧(184477),"{'Low': 3, 'High': 20}","{'Unknown': 9, '第7級': 2, '第1級': 7, '第5級': 3, '第2級': 1, '第1*級': 1}",1,Y,N,N,Y
難道你們要我三打數三支全壘打不成？」,難道 你們 要 我 三 打數 三 支 全壘打 不成,10,難道(22961) 你們(104323) 要(851264) 我(3033032) 三(313861) 打數(28) 三(313861) 支(25666) 全壘打(655) 不成(3054),"{'High': 9, 'Low': 1}","{'第4*級': 1, '第1級': 5, 'Unknown': 3, '第2級': 1}",1,Y,N,N,N
今年之前，邦茲在他季後賽九十七打數只有一支全壘打、六個打點，打擊率一成九六。,今年 之前 邦茲 在 他 季後賽 九十七 打數 只 有 一 支 全壘打 六 個 打點 打擊率 一成九六,18,今年(10836) 之前(79748) 邦茲(4) 在(3284238) 他(2487930) 季後賽(131) 九十七(206) 打數(28) 只(436725) 有(2217079) 一(3701681) 支(25666) 全壘打(655) 六(77936) 個(2296574) 打點(1097) 打擊率(212) 一成九六(Unknown),"{'High': 15, 'Low': 3}","{'第1級': 6, '第4級': 1, 'Unknown': 7, '第1*級': 2, '第2級': 1, '第7級': 1}",5,Y,N,N,Y
今年，邦茲轟出八支全壘打，被保送廿七次，仍洗刷不掉刻在他背上「輸家」的烙印。,今年 邦茲 轟出 八 支 全壘打 被 保送 廿七 次 仍 洗刷 不 掉 刻 在 他 背上 輸家 的 烙印,21,今年(10836) 邦茲(4) 轟出(109) 八(54961) 支(25666) 全壘打(655) 被(540683) 保送(538) 廿七(95) 次(331701) 仍(92056) 洗刷(696) 不(2282521) 掉(11182) 刻(18151) 在(3284238) 他(2487930) 背上(29) 輸家(613) 的(16029838) 烙印(1069),"{'High': 18, 'Low': 3}","{'第1級': 5, 'Unknown': 6, '第2級': 3, '第4級': 1, '第7級': 3, '第2*級': 1, '第5級': 1, '第1*級': 1}",1,Y,N,N,Y
一九七七年在洋基封王戰轟出三支紅不讓的前「十月先生」傑克森說：「邦茲是我在棒壇三十五年來所見過最可怕的打者。,一九七七年 在 洋基 封王戰 轟出 三 支 紅不讓 的 前 十月 先生 傑克森 說 邦茲 是 我 在 棒壇 三十五 年 來 所 見 過 最 可怕 的 打者,29,一九七七年(1285) 在(3284238) 洋基(195) 封王戰(Unknown) 轟出(109) 三(313861) 支(25666) 紅不讓(Unknown) 的(16029838) 前(272709) 十月(15556) 先生(159645) 傑克森(1713) 說(1285247) 邦茲(4) 是(4642407) 我(3033032) 在(3284238) 棒壇(19) 三十五(3498) 年(514736) 來(742183) 所(527327) 見(179113) 過(412878) 最(421680) 可怕(19096) 的(16029838) 打者(796),"{'High': 25, 'Low': 4}","{'Unknown': 11, '第1*級': 5, '第1級': 10, '第2級': 2, '第3級': 1}",5,Y,N,N,Y
我從未看過任何人做到邦茲最近兩年完成的事。」,我 從未 看過 任何 人 做到 邦茲 最近 兩 年 完成 的 事,13,我(3033032) 從未(15150) 看過(1832) 任何(131795) 人(1550512) 做到(19894) 邦茲(4) 最近(30174) 兩(526190) 年(514736) 完成(60471) 的(16029838) 事(385949),"{'High': 12, 'Low': 1}","{'第1級': 5, 'Unknown': 3, '第4*級': 2, '第3*級': 1, '第2級': 1, '第1*級': 1}",0,Y,N,N,Y
不過，傑克森戴著他的冠軍戒指，卅八歲的邦茲手指上卻只有結婚戒指。,不過 傑克森 戴 著 他 的 冠軍 戒指 卅八 歲 的 邦茲 手指 上 卻 只 有 結婚 戒指,19,不過(186226) 傑克森(1713) 戴(25973) 著(1004687) 他(2487930) 的(16029838) 冠軍(3670) 戒指(3408) 卅八(33) 歲(130085) 的(16029838) 邦茲(4) 手指(14729) 上(1233218) 卻(333007) 只(436725) 有(2217079) 結婚(22719) 戒指(3408),"{'High': 17, 'Low': 2}","{'第2級': 2, 'Unknown': 4, '第1級': 6, '第5級': 3, '第4級': 2, '第1*級': 1, '第3級': 1}",1,Y,Y,N,Y
儘管奪冠夢碎，邦茲仍抬頭挺胸說：「我們不會被打倒，明年春訓，我們將捲土重來。」,儘管 奪冠 夢 碎 邦茲 仍 抬頭挺胸 說 我們 不會 被 打倒 明年 春訓 我們 將 捲土重來,17,儘管(36818) 奪冠(343) 夢(36155) 碎(4911) 邦茲(4) 仍(92056) 抬頭挺胸(456) 說(1285247) 我們(979260) 不會(173045) 被(540683) 打倒(2632) 明年(3059) 春訓(70) 我們(979260) 將(448374) 捲土重來(594),"{'High': 15, 'Low': 2}","{'第5級': 3, 'Unknown': 6, '第3級': 1, '第4級': 1, '第7級': 1, '第1級': 3, '第2級': 1, '第1*級': 1}",2,Y,Y,N,Y
但是，明年球季，巨人可能會有新面貌，因為教頭貝克可能琵琶別抱，洛夫頓、肯特、貝爾、桑提亞戈等老將，也可能改穿別隊戰袍。,但是 明年 球季 巨人 可能 會 有 新 面貌 因為 教頭 貝克 可能 琵琶別抱 洛夫頓 肯特 貝爾 桑提亞戈 等 老將 也 可能 改穿 別 隊 戰袍,26,但是(247988) 明年(3059) 球季(732) 巨人(6944) 可能(271025) 會(1014977) 有(2217079) 新(212453) 面貌(5835) 因為(425061) 教頭(72) 貝克(7927) 可能(271025) 琵琶別抱(Unknown) 洛夫頓(Unknown) 肯特(461) 貝爾(1738) 桑提亞戈(47) 等(327380) 老將(724) 也(1590760) 可能(271025) 改穿(254) 別(78082) 隊(7801) 戰袍(325),"{'High': 22, 'Low': 4}","{'第2級': 1, '第1*級': 4, 'Unknown': 11, '第1級': 6, '第5級': 1, '第3*級': 1, '第7級': 1, '第4級': 1}",3,Y,Y,N,Y
今年世界大賽前夕，保送邦茲還是投給邦茲打，已成焦點話題。,今年 世界 大賽 前夕 保送 邦茲 還是 投給 邦茲 打 已 成 焦點 話題,14,今年(10836) 世界(165235) 大賽(1690) 前夕(2814) 保送(538) 邦茲(4) 還是(155231) 投給(375) 邦茲(4) 打(76962) 已(215610) 成(76470) 焦點(10000) 話題(13592),"{'High': 12, 'Low': 2}","{'第1級': 2, '第2級': 1, 'Unknown': 5, '第6級': 1, '第1*級': 1, '第3級': 1, '第4*級': 1, '第5級': 1, '第4級': 1}",0,Y,N,N,Y
七戰中，一旦隊友踏上得分位置，邦茲只獲一次揮棒機會。,七 戰 中 一旦 隊友 踏上 得分 位置 邦茲 只 獲 一 次 揮棒 機會,15,七(59385) 戰(19521) 中(1011729) 一旦(37557) 隊友(1497) 踏上(4027) 得分(2333) 位置(32151) 邦茲(4) 只(436725) 獲(11610) 一(3701681) 次(331701) 揮棒(666) 機會(81244),"{'High': 14, 'Low': 1}","{'第1級': 2, '第6級': 1, 'Unknown': 6, '第5級': 2, '第4*級': 1, '第1*級': 1, '第2級': 2}",0,Y,Y,N,Y
他共被保送十三次，比原紀錄多兩次，其中七次是敬遠球。,他 共 被 保送 十三 次 比 原 紀錄 多 兩 次 其中 七 次 是 敬遠球,17,他(2487930) 共(32138) 被(540683) 保送(538) 十三(9810) 次(331701) 比(170486) 原(33852) 紀錄(14233) 多(318992) 兩(526190) 次(331701) 其中(95627) 七(59385) 次(331701) 是(4642407) 敬遠球(Unknown),"{'High': 16, 'Low': 1}","{'第1級': 5, '第1*級': 2, '第2級': 4, 'Unknown': 4, '第4級': 1, '第3*級': 1}",1,Y,N,N,N
然而，巨人仍讓天使在保送邦茲後付出一些代價：邦茲在十三次保送裏得到三分。,然而 巨人 仍 讓 天使 在 保送 邦茲 後 付出 一些 代價 邦茲 在 十三 次 保送 裏 得到 三 分,21,然而(94482) 巨人(6944) 仍(92056) 讓(526314) 天使(7140) 在(3284238) 保送(538) 邦茲(4) 後(422857) 付出(14854) 一些(156929) 代價(9270) 邦茲(4) 在(3284238) 十三(9810) 次(331701) 保送(538) 裏(41895) 得到(84614) 三(313861) 分(62224),"{'High': 19, 'Low': 2}","{'第5級': 3, 'Unknown': 6, '第4級': 1, '第2級': 2, '第1*級': 4, '第1級': 3, '第4*級': 1, '第3*級': 1}",0,Y,Y,N,Y
最後，邦茲以打擊率四成七一、四支全壘打、兩支二壘打、七成整的上壘率、一點二九四長打率，結束令人難忘的世界大賽。,最後 邦茲 以 打擊率 四成七一 四 支 全壘打 兩 支 二壘打 七成 整 的 上壘率 一點二九四 長打率 結束 令 人 難忘 的 世界 大賽,24,最後(142102) 邦茲(4) 以(547785) 打擊率(212) 四成七一(Unknown) 四(141667) 支(25666) 全壘打(655) 兩(526190) 支(25666) 二壘打(10) 七成(577) 整(105785) 的(16029838) 上壘率(17) 一點二九四(Unknown) 長打率(5) 結束(40669) 令(128742) 人(1550512) 難忘(3374) 的(16029838) 世界(165235) 大賽(1690),"{'High': 18, 'Low': 6}","{'第2級': 4, 'Unknown': 10, '第5級': 2, '第1級': 5, '第3*級': 2, '第4*級': 1}",7,Y,N,N,Y
不過成為悲劇英雄，已是邦茲在今年十月的命運。,不過 成為 悲劇 英雄 已 是 邦茲 在 今年 十月 的 命運,12,不過(186226) 成為(143834) 悲劇(9222) 英雄(22678) 已(215610) 是(4642407) 邦茲(4) 在(3284238) 今年(10836) 十月(15556) 的(16029838) 命運(20184),"{'High': 11, 'Low': 1}","{'第2級': 1, '第5級': 2, '第4級': 1, '第3級': 1, '第1級': 3, 'Unknown': 2, '第1*級': 1, '第4*級': 1}",0,Y,Y,N,Y
已是邦茲在今年十月的命運。,已 是 邦茲 在 今年 十月 的 命運,8,已(215610) 是(4642407) 邦茲(4) 在(3284238) 今年(10836) 十月(15556) 的(16029838) 命運(20184),"{'High': 7, 'Low': 1}","{'第3級': 1, '第1級': 3, 'Unknown': 2, '第1*級': 1, '第4*級': 1}",0,N,N,N,Y
繼昨日在「第8屆釜山遠南殘障運動會」首日3金2銀2銅後，中華健兒又在昨日的賽事拿擁抱2金5銀2銅，總統陳水扁、副總統呂秀蓮特別拍電致賀。,繼 昨日 在 第8 屆 釜山 遠南 殘障 運動會 首日 3 金 2 銀 2 銅 後 中華 健兒 又 在 昨日 的 賽事 拿 擁抱 2 金 5 銀 2 銅 總統 陳水扁 副總統 呂秀蓮 特別 拍電 致賀,39,繼(6145) 昨日(2036) 在(3284238) 第8(Unknown) 屆(10220) 釜山(201) 遠南(Unknown) 殘障(1664) 運動會(1088) 首日(113) 3(51223) 金(23223) 2(66480) 銀(9451) 2(66480) 銅(5295) 後(422857) 中華(8450) 健兒(112) 又(535555) 在(3284238) 昨日(2036) 的(16029838) 賽事(1271) 拿(69263) 擁抱(8580) 2(66480) 金(23223) 5(33754) 銀(9451) 2(66480) 銅(5295) 總統(23662) 陳水扁(1345) 副總統(1411) 呂秀蓮(173) 特別(91212) 拍電(12) 致賀(88),"{'High': 35, 'Low': 4}","{'第6級': 2, '第5級': 8, '第1*級': 3, 'Unknown': 19, '第4*級': 2, '第1級': 3, '第4級': 1, '第2級': 1}",4,Y,N,N,Y
施祝華、廖敏秀桌球雙打兩位老搭檔，先以直落3點勝南韓對手完成衛冕，為中華隊在殘運賽會次日開金。,施祝華 廖敏秀 桌球 雙打 兩 位 老搭檔 先 以 直落 3 點 勝 南韓 對手 完成 衛冕 為 中華隊 在 殘運 賽會 次日 開 金,25,施祝華(Unknown) 廖敏秀(Unknown) 桌球(190) 雙打(67) 兩(526190) 位(284809) 老搭檔(82) 先(136649) 以(547785) 直落(119) 3(51223) 點(118735) 勝(15471) 南韓(2210) 對手(14528) 完成(60471) 衛冕(100) 為(761341) 中華隊(95) 在(3284238) 殘運(Unknown) 賽會(132) 次日(2787) 開(62807) 金(23223),"{'Low': 7, 'High': 18}","{'Unknown': 15, '第1級': 3, '第1*級': 3, '第5級': 1, '第4*級': 2, '第6級': 1}",4,Y,N,N,Y
朱仁德/陳興隆奪下桌球團體TT10級銀牌，林啟榮取得柔道100公斤級銀牌。,朱仁德 陳興隆 奪下 桌球 團體 TT10級 銀牌 林啟榮 取得 柔道 100 公斤 級 銀牌,14,朱仁德(Unknown) 陳興隆(Unknown) 奪下(547) 桌球(190) 團體(30852) TT10級(Unknown) 銀牌(173) 林啟榮(2) 取得(25649) 柔道(413) 100(5632) 公斤(6150) 級(11106) 銀牌(173),"{'Low': 4, 'High': 10}","{'Unknown': 10, '第4級': 3, '第5級': 1}",5,Y,N,N,Y
梁耿縉繼前天於田徑百米T12級奪銅，昨日又拿下跳遠F12級銅牌。,梁耿縉 繼 前天 於 田徑 百 米 T12級 奪 銅 昨日 又 拿下 跳遠 F12級 銅牌,16,梁耿縉(Unknown) 繼(6145) 前天(1256) 於(327210) 田徑(361) 百(24843) 米(25678) T12級(Unknown) 奪(6082) 銅(5295) 昨日(2036) 又(535555) 拿下(3104) 跳遠(132) F12級(Unknown) 銅牌(214),"{'Low': 3, 'High': 13}","{'Unknown': 7, '第6級': 2, '第1*級': 2, '第5級': 3, '第1級': 1, '第3*級': 1}",3,Y,N,N,Y
晚間的游泳賽事也是捷報頻頻。,晚間 的 游泳 賽事 也 是 捷報 頻頻,8,晚間(1978) 的(16029838) 游泳(5207) 賽事(1271) 也(1590760) 是(4642407) 捷報(618) 頻頻(3312),{'High': 8},"{'Unknown': 3, '第1級': 3, '第2*級': 1, '第6級': 1}",0,Y,N,N,N
甘修豪一人連奪S14級100公尺仰式金牌、S14級100公尺蝶式銀牌，王盛文、方姿雅則分別在S10級100公尺蝶式、女子SM67級200公尺混合奪銀牌，陳皇申再追加S10級100公尺仰式銅牌。,甘修豪 一 人 連奪 S14級 100 公尺 仰式 金牌 S14級 100 公尺 蝶式 銀牌 王盛文 方姿雅 則 分別 在 S10級 100 公尺 蝶式 女子 SM67級 200 公尺 混合 奪 銀牌 陳皇申 再 追加 S10級 100 公尺 仰式 銅牌,38,甘修豪(Unknown) 一(3701681) 人(1550512) 連奪(15) S14級(Unknown) 100(5632) 公尺(19233) 仰式(25) 金牌(1125) S14級(Unknown) 100(5632) 公尺(19233) 蝶式(28) 銀牌(173) 王盛文(4) 方姿雅(Unknown) 則(254096) 分別(25566) 在(3284238) S10級(Unknown) 100(5632) 公尺(19233) 蝶式(28) 女子(23797) SM67級(Unknown) 200(2079) 公尺(19233) 混合(6939) 奪(6082) 銀牌(173) 陳皇申(Unknown) 再(326207) 追加(560) S10級(Unknown) 100(5632) 公尺(19233) 仰式(25) 銅牌(214),"{'Low': 14, 'High': 24}","{'Unknown': 24, '第1級': 2, '第4級': 5, '第5級': 3, '第4*級': 2, '第1*級': 2}",14,Y,N,N,Y
游泳隊獨立拿下1金3銀1銅。,游泳隊 獨立 拿下 1 金 3 銀 1 銅,9,游泳隊(49) 獨立(29364) 拿下(3104) 1(79772) 金(23223) 3(51223) 銀(9451) 1(79772) 銅(5295),"{'Low': 1, 'High': 8}","{'Unknown': 6, '第4級': 1, '第4*級': 1, '第5級': 1}",1,Y,N,N,N
昨日桌球比賽現場湧進許多地主南韓觀眾，當然他們都是衝著南韓隊而來。,昨日 桌球 比賽 現場 湧進 許多 地主 南韓 觀眾 當然 他們 都 是 衝 著 南韓隊 而 來,18,昨日(2036) 桌球(190) 比賽(20220) 現場(15949) 湧進(781) 許多(159791) 地主(3647) 南韓(2210) 觀眾(31587) 當然(113971) 他們(716752) 都(1125846) 是(4642407) 衝(8475) 著(1004687) 南韓隊(Unknown) 而(937923) 來(742183),"{'High': 17, 'Low': 1}","{'第5級': 2, 'Unknown': 6, '第2級': 2, '第4*級': 1, '第3*級': 1, '第6級': 1, '第4級': 1, '第1級': 4}",1,Y,Y,N,N
儘管陣仗不如人，旅居釜山的中華僑民特別掛上長長的加油布條(球場唯一固定式加油布條)，為施祝華/廖敏秀聲援。,儘管 陣仗 不如 人 旅居 釜山 的 中華 僑民 特別 掛上 長長 的 加油 布條 球場 唯一 固定式 加油 布條 為 施祝華 廖敏秀 聲援,24,儘管(36818) 陣仗(368) 不如(21722) 人(1550512) 旅居(628) 釜山(201) 的(16029838) 中華(8450) 僑民(294) 特別(91212) 掛上(1806) 長長(5605) 的(16029838) 加油(3235) 布條(789) 球場(3296) 唯一(39149) 固定式(124) 加油(3235) 布條(789) 為(761341) 施祝華(Unknown) 廖敏秀(Unknown) 聲援(628),"{'High': 22, 'Low': 2}","{'第5級': 2, 'Unknown': 11, '第4級': 1, '第1級': 3, '第7級': 4, '第2級': 1, '第2*級': 2}",3,Y,Y,N,Y
兩位好姊妹不愧是上屆曼谷殘運會衛冕軍，施祝華先是輕取對方新手，然後廖敏秀超水準演出，3：2立刻南韓老將；接下來兩人在第3點雙打根本沒給對手機會，直落3點奪金。,兩 位 好 姊妹 不愧 是 上 屆 曼谷 殘運會 衛冕 軍 施祝華 先 是 輕取 對方 新手 然後 廖敏秀 超 水準 演出 32 立刻 南韓 老將 接下來 兩 人 在 第3 點 雙打 根本 沒 給 對手 機會 直落 3 點 奪金,43,兩(526190) 位(284809) 好(448428) 姊妹(6832) 不愧(1334) 是(4642407) 上(1233218) 屆(10220) 曼谷(419) 殘運會(Unknown) 衛冕(100) 軍(18300) 施祝華(Unknown) 先(136649) 是(4642407) 輕取(46) 對方(62393) 新手(1984) 然後(156193) 廖敏秀(Unknown) 超(903) 水準(9940) 演出(20672) 32(3073) 立刻(46255) 南韓(2210) 老將(724) 接下來(22227) 兩(526190) 人(1550512) 在(3284238) 第3(Unknown) 點(118735) 雙打(67) 根本(66330) 沒(306167) 給(240485) 對手(14528) 機會(81244) 直落(119) 3(51223) 點(118735) 奪金(2),"{'High': 35, 'Low': 8}","{'第1級': 11, 'Unknown': 16, '第7級': 2, '第5級': 2, '第1*級': 3, '第4級': 3, '第6級': 1, '第4*級': 3, '第3級': 1, '第2級': 1}",4,Y,N,N,Y
