sentence,sentence_preprocessed,sentence_length,word_freq,high_low_freq,word_level,long_word_count,is_complete_sentence,is_complete_context,is_blacklist,is_greylist
高雄市苓雅警分局成功路派出所，惟恐爆發意外不幸事件，由派出所主管陳明和親自率領部份警力，到場坐鎮維持秩序。,高雄市 苓雅 警分局 成功路 派出所 惟恐 爆發 意外 不幸 事件 由 派出所 主管 陳明和 親自 率領 部份 警力 到場 坐鎮 維持 秩序,22,高雄市(1220) 苓雅(11) 警分局(5) 成功路(100) 派出所(646) 惟恐(478) 爆發(11071) 意外(21631) 不幸(17433) 事件(59059) 由(208604) 派出所(646) 主管(23448) 陳明和(Unknown) 親自(19554) 率領(10329) 部份(11022) 警力(353) 到場(1005) 坐鎮(1000) 維持(31284) 秩序(13855),"{'High': 18, 'Low': 4}","{'Unknown': 9, '第7級': 2, '第5級': 6, '第4級': 1, '第4*級': 3, '第2級': 1}",6,Y,N,N,Y
一夥人聚集商議期間，由於員工及投資人彼此信任度不足，雙方一度爆發激烈口角衝突，所幸有警員在場觀察，未造成任何意外事件。,一 夥 人 聚集 商議 期間 由於 員工 及 投資人 彼此 信任度 不足 雙方 一度 爆發 激烈 口角 衝突 所幸 有 警員 在場 觀察 未 造成 任何 意外 事件,29,一(3701681) 夥(2400) 人(1550512) 聚集(8764) 商議(2780) 期間(32981) 由於(88111) 員工(31766) 及(304586) 投資人(4395) 彼此(39449) 信任度(136) 不足(20371) 雙方(22984) 一度(5292) 爆發(11071) 激烈(11890) 口角(700) 衝突(27003) 所幸(2029) 有(2217079) 警員(1474) 在場(7726) 觀察(44358) 未(101927) 造成(63141) 任何(131795) 意外(21631) 事件(59059),{'High': 29},"{'第1級': 3, '第6級': 4, '第5級': 8, '第4*級': 7, '第4級': 3, 'Unknown': 3, '第7級': 1}",2,Y,Y,N,N
聯信高雄分公司前襄理黃聚慶，在大夥一陣高聲喧嘩中站出來，向眾人表示員工及投資人均是被害者，並提出自己兩百多萬元退休金已血本無歸取信在場人士後，希望眾人同心協力，共同解決當前問題。,聯信 高雄 分公司 前 襄理 黃聚慶 在 大夥 一 陣 高聲 喧嘩 中 站出來 向 眾人 表示 員工 及 投資人 均 是 被 害 者 並 提出 自己 兩百多萬 元 退休金 已 血本無歸 取信 在場 人士 後 希望 眾人 同心協力 共同 解決 當前 問題,44,聯信(11) 高雄(4674) 分公司(1287) 前(272709) 襄理(48) 黃聚慶(Unknown) 在(3284238) 大夥(2261) 一(3701681) 陣(26383) 高聲(3703) 喧嘩(1036) 中(1011729) 站出來(1306) 向(231672) 眾人(18671) 表示(74452) 員工(31766) 及(304586) 投資人(4395) 均(27783) 是(4642407) 被(540683) 害(15573) 者(423504) 並(442790) 提出(63073) 自己(744739) 兩百多萬(85) 元(60807) 退休金(737) 已(215610) 血本無歸(228) 取信(130) 在場(7726) 人士(27666) 後(422857) 希望(119975) 眾人(18671) 同心協力(814) 共同(36636) 解決(55725) 當前(4812) 問題(280782),"{'Low': 4, 'High': 40}","{'Unknown': 15, '第1級': 6, '第1*級': 2, '第6級': 3, '第4級': 5, '第7級': 2, '第2級': 3, '第5級': 5, '第4*級': 2, '第3級': 1}",8,Y,Y,N,Y
黃聚慶隨即拿出債權登記表，請員工及投資人填寫，藉此成立自救會，並著手推選被害員工及投資人各七位代表，共同前往高雄分公司辦公室清點剩餘資產後，送往銀行保管箱封存，準備日後變賣折現分配。,黃聚慶 隨即 拿出 債權 登記表 請 員工 及 投資人 填寫 藉 此 成立 自救會 並 著手 推選 被 害 員工 及 投資人 各 七 位 代表 共同 前往 高雄 分公司 辦公室 清點 剩餘 資產 後 送往 銀行 保管箱 封存 準備 日後 變賣 折現 分配,44,黃聚慶(Unknown) 隨即(10199) 拿出(14551) 債權(1201) 登記表(57) 請(120629) 員工(31766) 及(304586) 投資人(4395) 填寫(1552) 藉(14277) 此(288458) 成立(28506) 自救會(44) 並(442790) 著手(9072) 推選(367) 被(540683) 害(15573) 員工(31766) 及(304586) 投資人(4395) 各(243023) 七(59385) 位(284809) 代表(58333) 共同(36636) 前往(27321) 高雄(4674) 分公司(1287) 辦公室(22302) 清點(614) 剩餘(2606) 資產(14148) 後(422857) 送往(1811) 銀行(33825) 保管箱(30) 封存(279) 準備(64901) 日後(12851) 變賣(643) 折現(126) 分配(8696),"{'Low': 4, 'High': 40}","{'Unknown': 17, '第6級': 3, '第4級': 6, '第1級': 4, '第5級': 7, '第4*級': 2, '第2級': 4, '第2*級': 1}",8,Y,Y,N,Y
現行中小學科學教育知識支離破碎。,現行 中小學 科學 教育 知識 支離破碎,6,現行(1947) 中小學(1083) 科學(55156) 教育(71554) 知識(63665) 支離破碎(652),{'High': 6},"{'第6級': 1, 'Unknown': 1, '第4級': 1, '第3級': 1, '第3*級': 1, '第7級': 1}",2,Y,N,N,N
學習刻板化，昨天在全國科技會議中引起教育學者的極度關切，學者們將此現象歸咎於聯考壓力的不正常教學所致，因此建議教育部成立科學教育委員會，定期召開全國性會議，徹底通盤檢討各級學校的科學教育課程。,學習 刻板化 昨天 在 全 國 科技 會議 中 引起 教育 學者 的 極度 關切 學者 們 將 此 現象 歸咎於 聯考 壓力 的 不 正常 教學 所 致 因此 建議 教育部 成立 科學 教育 委員會 定期 召開 全國性 會議 徹底 通盤 檢討 各 級 學校 的 科學 教育 課程,50,學習(105345) 刻板化(118) 昨天(12735) 在(3284238) 全(178642) 國(73377) 科技(30630) 會議(30698) 中(1011729) 引起(36729) 教育(71554) 學者(28981) 的(16029838) 極度(6497) 關切(3828) 學者(28981) 們(140794) 將(448374) 此(288458) 現象(47383) 歸咎於(1215) 聯考(1246) 壓力(40408) 的(16029838) 不(2282521) 正常(28865) 教學(28989) 所(527327) 致(11578) 因此(184606) 建議(45709) 教育部(3240) 成立(28506) 科學(55156) 教育(71554) 委員會(19419) 定期(5791) 召開(5858) 全國性(1755) 會議(30698) 徹底(17782) 通盤(432) 檢討(5992) 各(243023) 級(11106) 學校(74782) 的(16029838) 科學(55156) 教育(71554) 課程(30183),{'High': 50},"{'第2級': 4, 'Unknown': 6, '第1級': 8, '第1*級': 1, '第4級': 9, '第4*級': 6, '第3級': 3, '第6級': 4, '第5級': 7, '第3*級': 2}",5,Y,Y,N,N
參與全國科技會議的學者指出，現在學生學習科學教育時，因課程支離破碎，無法融會貫通，倚賴記憶，不求理解，從而學習刻板化，產生焦慮症。,參與 全 國 科技 會議 的 學者 指出 現在 學生 學習 科學 教育 時 因 課程 支離破碎 無法 融會貫通 倚賴 記憶 不 求 理解 從而 學習 刻板化 產生 焦慮症,29,參與(40595) 全(178642) 國(73377) 科技(30630) 會議(30698) 的(16029838) 學者(28981) 指出(38456) 現在(218744) 學生(115846) 學習(105345) 科學(55156) 教育(71554) 時(623734) 因(119364) 課程(30183) 支離破碎(652) 無法(150606) 融會貫通(497) 倚賴(1035) 記憶(37224) 不(2282521) 求(30359) 理解(41017) 從而(10064) 學習(105345) 刻板化(118) 產生(82753) 焦慮症(720),{'High': 29},"{'第5級': 3, '第2級': 3, '第1級': 5, '第4級': 4, '第4*級': 4, 'Unknown': 4, '第3級': 1, '第3*級': 1, '第7級': 3, '第6級': 1}",4,Y,Y,N,N
再加以考試引導教學之政策，無視學生間的個別差異與個別需要，忽略了高層次思考能力的培養，致使我國科技人才之培育面臨瓶頸。,再 加以 考試 引導 教學 之 政策 無視 學生 間 的 個別差異 與 個別 需要 忽略 了 高層次 思考 能力 的 培養 致使 我國 科技 人才 之 培育 面臨 瓶頸,30,再(326207) 加以(25724) 考試(12696) 引導(12862) 教學(28989) 之(875481) 政策(30965) 無視(1423) 學生(115846) 間(115638) 的(16029838) 個別差異(Unknown) 與(968432) 個別(9906) 需要(166793) 忽略(13056) 了(3199291) 高層次(1488) 思考(63031) 能力(93399) 的(16029838) 培養(17148) 致使(2775) 我國(7225) 科技(30630) 人才(17220) 之(875481) 培育(3504) 面臨(16531) 瓶頸(1343),"{'High': 29, 'Low': 1}","{'第1*級': 2, '第6級': 6, '第4級': 3, '第5級': 5, '第4*級': 4, '第1級': 3, 'Unknown': 5, '第2級': 2}",2,Y,Y,N,N
與會學者說明，我國中小學之科學教育，反應學理論上以反覆練習為綱，以精熟學習為目，以增強學生的應考能力為要務，甚至以考試代替教學，未提供學生進行思考所必須的時空條件，致使學子不是逃避排斥科學，便是強記死背。,與會 學者 說明 我國 中小學 之 科學 教育 反應學 理論 上 以 反覆 練習 為 綱 以 精熟 學習 為 目 以 增強 學生 的 應考 能力 為 要務 甚至 以 考試 代替 教學 未 提供 學生 進行 思考 所 必須 的 時空 條件 致使 學子 不 是 逃避 排斥 科學 便是 強記 死背,54,與會(2411) 學者(28981) 說明(52918) 我國(7225) 中小學(1083) 之(875481) 科學(55156) 教育(71554) 反應學(1) 理論(62242) 上(1233218) 以(547785) 反覆(9756) 練習(23555) 為(761341) 綱(451) 以(547785) 精熟(587) 學習(105345) 為(761341) 目(3483) 以(547785) 增強(7309) 學生(115846) 的(16029838) 應考(360) 能力(93399) 為(761341) 要務(906) 甚至(122502) 以(547785) 考試(12696) 代替(6407) 教學(28989) 未(101927) 提供(73097) 學生(115846) 進行(100298) 思考(63031) 所(527327) 必須(170592) 的(16029838) 時空(7773) 條件(36308) 致使(2775) 學子(1193) 不(2282521) 是(4642407) 逃避(9220) 排斥(5523) 科學(55156) 便是(6111) 強記(241) 死背(250),"{'High': 53, 'Low': 1}","{'第6級': 4, '第4*級': 4, '第4級': 5, 'Unknown': 15, '第5級': 12, '第3級': 2, '第1級': 7, '第2級': 4, '第1*級': 1}",2,Y,Y,N,N
成功大學校長馬哲儒表示，應徹底整體跨級檢討各級各類學校教學及自然科學課程標準，規劃推動各種適應現代化潮流之課程，使課程生動化。,成功 大學 校長 馬哲儒 表示 應 徹底 整體 跨級 檢討 各 級 各 類 學校 教學 及 自然 科學 課程 標準 規劃 推動 各 種 適應 現代化 潮流 之 課程 使 課程 生動化,33,成功(80266) 大學(83893) 校長(14327) 馬哲儒(Unknown) 表示(74452) 應(82417) 徹底(17782) 整體(19788) 跨級(2) 檢討(5992) 各(243023) 級(11106) 各(243023) 類(58191) 學校(74782) 教學(28989) 及(304586) 自然(91995) 科學(55156) 課程(30183) 標準(31106) 規劃(14663) 推動(14867) 各(243023) 種(701563) 適應(14698) 現代化(6049) 潮流(4509) 之(875481) 課程(30183) 使(197544) 課程(30183) 生動化(11),"{'High': 30, 'Low': 3}","{'第3*級': 4, '第1級': 2, '第4級': 7, 'Unknown': 5, '第4*級': 4, '第5級': 7, '第2級': 3, '第6級': 1}",3,Y,Y,N,Y
多元化，並進行實驗教學，經評鑑後由學校參考，自行選擇採用推廣，以提昇科學教育品質。,多元化 並 進行 實驗 教學 經 評鑑 後 由 學校 參考 自行 選擇 採用 推廣 以 提昇 科學 教育 品質,20,多元化(2174) 並(442790) 進行(100298) 實驗(36801) 教學(28989) 經(38471) 評鑑(2698) 後(422857) 由(208604) 學校(74782) 參考(24401) 自行(9833) 選擇(75178) 採用(20582) 推廣(6820) 以(547785) 提昇(3304) 科學(55156) 教育(71554) 品質(19388),{'High': 20},"{'Unknown': 2, '第4*級': 4, '第5級': 5, '第4級': 3, '第7級': 1, '第1級': 2, '第3*級': 1, '第6級': 1, '第3級': 1}",1,Y,Y,N,N
東吳大學教授劉源俊則建議教育部成立科學教育委員會，召開全國性科學教育會議，以檢討教科書的統編制度。,東吳 大學 教授 劉源俊 則 建議 教育部 成立 科學 教育 委員會 召開 全國性 科學 教育 會議 以 檢討 教科書 的 統編 制度,22,東吳(3279) 大學(83893) 教授(39068) 劉源俊(28) 則(254096) 建議(45709) 教育部(3240) 成立(28506) 科學(55156) 教育(71554) 委員會(19419) 召開(5858) 全國性(1755) 科學(55156) 教育(71554) 會議(30698) 以(547785) 檢討(5992) 教科書(3622) 的(16029838) 統編(14) 制度(37973),"{'High': 20, 'Low': 2}","{'Unknown': 5, '第1級': 2, '第3*級': 2, '第5級': 4, '第4*級': 1, '第4級': 4, '第3級': 2, '第6級': 2}",5,Y,N,N,Y
教育部長毛高文表示，全國性科教會議宜與全國教育會議同時舉行，最快在兩年後才召開，會議檢討內容以人文。,教育部長 毛高文 表示 全國性 科教 會議 宜 與 全 國 教育 會議 同時 舉行 最 快 在 兩 年 後 才 召開 會議 檢討 內容 以 人文,27,教育部長(521) 毛高文(14) 表示(74452) 全國性(1755) 科教(61) 會議(30698) 宜(7123) 與(968432) 全(178642) 國(73377) 教育(71554) 會議(30698) 同時(115305) 舉行(17660) 最(421680) 快(116207) 在(3284238) 兩(526190) 年(514736) 後(422857) 才(394539) 召開(5858) 會議(30698) 檢討(5992) 內容(55074) 以(547785) 人文(6474),"{'High': 25, 'Low': 2}","{'Unknown': 5, '第4*級': 2, '第4級': 5, '第2級': 2, '第1級': 4, '第3級': 1, '第3*級': 1, '第1*級': 3, '第6級': 2, '第5級': 2}",3,Y,N,N,Y
科技並重，教育部並計畫設立教育研究院之超然機構，以落實。,科技 並重 教育部 並 計畫 設立 教育 研究院 之 超然 機構 以 落實,13,科技(30630) 並重(538) 教育部(3240) 並(442790) 計畫(54820) 設立(12114) 教育(71554) 研究院(5082) 之(875481) 超然(1130) 機構(24025) 以(547785) 落實(4291),{'High': 13},"{'第4級': 1, 'Unknown': 2, '第5級': 5, '第4*級': 1, '第2級': 1, '第3級': 1, '第7級': 1, '第6級': 1}",2,Y,N,N,N
長期規劃整體教育政策。,長期 規劃 整體 教育 政策,5,長期(28592) 規劃(14663) 整體(19788) 教育(71554) 政策(30965),{'High': 5},"{'Unknown': 1, '第6級': 1, '第4*級': 2, '第3級': 1}",0,Y,N,N,N
李崇道教授則指出，改善不正常教學，應積極研究廢除大型聯考並改進入學制度，給與各科系有充足之自由度，自行甄選學生。,李崇道 教授 則 指出 改善 不 正常 教學 應 積極 研究 廢除 大型 聯考 並 改進 入學 制度 給與 各 科系 有 充足 之 自由度 自行 甄選 學生,28,李崇道(5) 教授(39068) 則(254096) 指出(38456) 改善(21559) 不(2282521) 正常(28865) 教學(28989) 應(82417) 積極(24247) 研究(182500) 廢除(3114) 大型(12588) 聯考(1246) 並(442790) 改進(6433) 入學(3233) 制度(37973) 給與(621) 各(243023) 科系(1361) 有(2217079) 充足(3300) 之(875481) 自由度(514) 自行(9833) 甄選(457) 學生(115846),"{'Low': 1, 'High': 27}","{'Unknown': 7, '第3*級': 2, '第5級': 7, '第4*級': 4, '第1級': 3, '第4級': 2, '第3級': 1, '第6級': 1, '第2級': 1}",2,Y,Y,N,Y
因江南案剛出獄的陳啟禮，日前也上了今夜星光，在此之前同案出獄的吳敦剛上過華視，不過吳錄的是華視新聞雜誌，而陳上的卻是綜藝節目，在今夜星光近四十分鐘的訪問過程中，陳啟禮始終緊握著妻子的手，在妻子溫柔的眼神交會下，娓娓道來他的童年生活。,因 江南案 剛 出獄 的 陳啟禮 日前 也 上 了 今夜 星光 在 此 之前 同 案 出獄 的 吳敦 剛 上 過 華視 不過 吳 錄 的 是 華視 新聞 雜誌 而 陳 上 的 卻 是 綜藝 節目 在 今夜 星光 近 四十 分鐘 的 訪問 過程 中 陳啟禮 始終 緊握 著 妻子 的 手 在 妻子 溫柔 的 眼神 交會 下 娓娓道來 他 的 童年 生活,69,因(119364) 江南案(18) 剛(55049) 出獄(1422) 的(16029838) 陳啟禮(4) 日前(1738) 也(1590760) 上(1233218) 了(3199291) 今夜(1662) 星光(1264) 在(3284238) 此(288458) 之前(79748) 同(102917) 案(11719) 出獄(1422) 的(16029838) 吳敦(8) 剛(55049) 上(1233218) 過(412878) 華視(404) 不過(186226) 吳(8226) 錄(3990) 的(16029838) 是(4642407) 華視(404) 新聞(40430) 雜誌(22563) 而(937923) 陳(10579) 上(1233218) 的(16029838) 卻(333007) 是(4642407) 綜藝(553) 節目(21445) 在(3284238) 今夜(1662) 星光(1264) 近(43555) 四十(15256) 分鐘(52479) 的(16029838) 訪問(12881) 過程(87889) 中(1011729) 陳啟禮(4) 始終(19593) 緊握(1655) 著(1004687) 妻子(33898) 的(16029838) 手(146361) 在(3284238) 妻子(33898) 溫柔(9695) 的(16029838) 眼神(15149) 交會(1744) 下(329549) 娓娓道來(460) 他(2487930) 的(16029838) 童年(10874) 生活(213189),"{'High': 65, 'Low': 4}","{'Unknown': 18, '第2級': 4, '第6級': 4, '第1級': 15, '第7級': 3, '第1*級': 7, '第5級': 7, '第4級': 4, '第4*級': 4, '第3級': 2, '第3*級': 1}",4,Y,Y,N,Y
幫派生涯，與妻子的一見鍾情以及對國內治安的看法。,幫派 生涯 與 妻子 的 一見鍾情 以及 對 國內 治安 的 看法,12,幫派(2034) 生涯(11332) 與(968432) 妻子(33898) 的(16029838) 一見鍾情(667) 以及(155624) 對(897964) 國內(17537) 治安(2364) 的(16029838) 看法(30115),{'High': 12},"{'第7級': 2, '第6級': 2, '第4*級': 2, '第1級': 3, '第5級': 1, '第4級': 1, '第3*級': 1}",1,N,Y,N,N
陳啟禮說：在獄中我從來不感到寂寞，因為寂寞對我來說是件奢侈品！,陳啟禮 說 在 獄 中 我 從來 不 感到 寂寞 因為 寂寞 對 我 來 說 是 件 奢侈品,19,陳啟禮(4) 說(1285247) 在(3284238) 獄(2887) 中(1011729) 我(3033032) 從來(35243) 不(2282521) 感到(74094) 寂寞(8212) 因為(425061) 寂寞(8212) 對(897964) 我(3033032) 來(742183) 說(1285247) 是(4642407) 件(139257) 奢侈品(720),"{'Low': 1, 'High': 18}","{'Unknown': 4, '第1級': 8, '第1*級': 3, '第3*級': 1, '第4級': 1, '第5級': 2}",2,Y,Y,N,Y
他解釋說，從年輕時身旁一直有許多好友圍繞，因此寂寞對他而言幾乎是不可能的事。,他 解釋 說 從 年輕 時 身 旁 一直 有 許多 好友 圍繞 因此 寂寞 對 他 而 言 幾乎 是 不可能 的 事,24,他(2487930) 解釋(59761) 說(1285247) 從(496546) 年輕(48853) 時(623734) 身(122324) 旁(39478) 一直(119877) 有(2217079) 許多(159791) 好友(6818) 圍繞(5686) 因此(184606) 寂寞(8212) 對(897964) 他(2487930) 而(937923) 言(97691) 幾乎(74298) 是(4642407) 不可能(41626) 的(16029838) 事(385949),{'High': 24},"{'第1級': 7, '第4級': 2, '第1*級': 3, '第2級': 2, '第3*級': 2, '第4*級': 2, 'Unknown': 3, '第5級': 3}",1,Y,Y,N,N
陳啟禮說他六歲逃難來台，與妻子是青梅竹馬，入幫派是年少時就開始的，他非常佩服郝院長的鐵腕作風，但當主持人趙寧與方芳芳問到，他曾在獄中表示如果把國內治安交給他處理一定會很好時，陳啟禮卻笑而不答。,陳啟禮 說 他 六 歲 逃難 來 台 與 妻子 是 青梅竹馬 入 幫派 是 年少 時 就 開始 的 他 非常 佩服 郝 院長 的 鐵腕 作風 但 當 主持人 趙寧 與 方芳芳 問到 他 曾 在 獄 中 表示 如果 把 國內 治安 交給 他 處理 一定 會 很 好 時 陳啟禮 卻 笑 而 不 答,59,陳啟禮(4) 說(1285247) 他(2487930) 六(77936) 歲(130085) 逃難(1075) 來(742183) 台(29325) 與(968432) 妻子(33898) 是(4642407) 青梅竹馬(427) 入(30777) 幫派(2034) 是(4642407) 年少(2256) 時(623734) 就(1737544) 開始(245562) 的(16029838) 他(2487930) 非常(152032) 佩服(4908) 郝(1325) 院長(5857) 的(16029838) 鐵腕(437) 作風(4966) 但(597124) 當(294625) 主持人(4030) 趙寧(15) 與(968432) 方芳芳(3) 問到(2398) 他(2487930) 曾(132981) 在(3284238) 獄(2887) 中(1011729) 表示(74452) 如果(322121) 把(617773) 國內(17537) 治安(2364) 交給(17334) 他(2487930) 處理(61797) 一定(138695) 會(1014977) 很(715675) 好(448428) 時(623734) 陳啟禮(4) 卻(333007) 笑(68493) 而(937923) 不(2282521) 答(11720),"{'Low': 4, 'High': 55}","{'Unknown': 15, '第1級': 15, '第6級': 4, '第2級': 6, '第4*級': 6, '第7級': 1, '第3*級': 2, '第1*級': 4, '第5級': 2, '第4級': 3, '第3級': 1}",5,Y,Y,N,Y
這位曾令黑白兩道聞之喪膽的大哥大，在談及夫妻感情時，深情款款地表示我堅信我老婆一定會等我！,這 位 曾 令 黑白兩道 聞 之 喪膽 的 大哥大 在 談及 夫妻 感情 時 深情款款 地 表示 我 堅信 我 老婆 一定 會 等 我,26,這(2114032) 位(284809) 曾(132981) 令(128742) 黑白兩道(33) 聞(19108) 之(875481) 喪膽(223) 的(16029838) 大哥大(351) 在(3284238) 談及(1549) 夫妻(15179) 感情(27553) 時(623734) 深情款款(97) 地(754998) 表示(74452) 我(3033032) 堅信(2704) 我(3033032) 老婆(10910) 一定(138695) 會(1014977) 等(327380) 我(3033032),"{'High': 24, 'Low': 2}","{'第1級': 6, '第4級': 4, '第5級': 2, 'Unknown': 6, '第3級': 1, '第1*級': 3, '第3*級': 2, '第4*級': 1, '第6級': 1}",3,Y,N,N,N
他說，甚至在獄中，每晚九點一過，就能感覺到妻子的電波源源不斷地包圍著他，讓他覺得妻子並沒有一天離開過身邊。,他 說 甚至 在 獄 中 每 晚 九點 一 過 就 能 感覺到 妻子 的 電波 源源 不斷 地 包圍 著 他 讓 他 覺得 妻子 並 沒有 一 天 離開 過 身邊,34,他(2487930) 說(1285247) 甚至(122502) 在(3284238) 獄(2887) 中(1011729) 每(333357) 晚(24931) 九點(2467) 一(3701681) 過(412878) 就(1737544) 能(582260) 感覺到(14524) 妻子(33898) 的(16029838) 電波(1290) 源源(891) 不斷(68526) 地(754998) 包圍(7840) 著(1004687) 他(2487930) 讓(526314) 他(2487930) 覺得(183034) 妻子(33898) 並(442790) 沒有(594280) 一(3701681) 天(330413) 離開(71748) 過(412878) 身邊(33516),{'High': 34},"{'第1級': 10, '第4*級': 4, '第1*級': 7, 'Unknown': 7, '第7級': 1, '第4級': 1, '第5級': 1, '第2級': 2, '第3*級': 1}",1,Y,Y,N,N
據台視今夜星光製作單位表示，陳啟禮夫婦間的感情濃厚到令人非常感動，陳在福華飯店清洗換裝前，居然不避旁人耳目地一直親吻愛妻，而在他返回景美家中時，迎面而來的居然是一條又一條的黃絲帶，其妻陳怡帆的溫柔嫻淑由此可見一斑。,據 台視 今夜 星光 製作 單位 表示 陳啟禮 夫婦 間 的 感情 濃厚到 令 人 非常 感動 陳 在 福華 飯店 清洗 換裝 前 居然 不 避 旁人 耳目 地 一直 親吻 愛妻 而 在 他 返回 景美 家 中 時 迎面 而 來 的 居然 是 一 條 又 一 條 的 黃 絲帶 其 妻 陳怡帆 的 溫柔 嫻淑 由 此 可見一斑,64,據(24392) 台視(395) 今夜(1662) 星光(1264) 製作(26135) 單位(23148) 表示(74452) 陳啟禮(4) 夫婦(12400) 間(115638) 的(16029838) 感情(27553) 濃厚到(Unknown) 令(128742) 人(1550512) 非常(152032) 感動(15132) 陳(10579) 在(3284238) 福華(109) 飯店(9669) 清洗(3259) 換裝(316) 前(272709) 居然(16421) 不(2282521) 避(5865) 旁人(3341) 耳目(1591) 地(754998) 一直(119877) 親吻(3059) 愛妻(480) 而(937923) 在(3284238) 他(2487930) 返回(9595) 景美(114) 家(236822) 中(1011729) 時(623734) 迎面(2186) 而(937923) 來(742183) 的(16029838) 居然(16421) 是(4642407) 一(3701681) 條(115362) 又(535555) 一(3701681) 條(115362) 的(16029838) 黃(20574) 絲帶(774) 其(307905) 妻(11654) 陳怡帆(Unknown) 的(16029838) 溫柔(9695) 嫻淑(61) 由(208604) 此(288458) 可見一斑(537),"{'High': 60, 'Low': 4}","{'第4*級': 7, 'Unknown': 17, '第6級': 6, '第5級': 9, '第1級': 13, '第4級': 2, '第1*級': 4, '第2*級': 1, '第2級': 4, '第3*級': 1}",4,Y,Y,N,Y
據了解，今夜星光是三台中目前唯一專訪到陳氏夫婦的綜藝節目，將於本周六(廿六日)在台視播出。,據了解 今夜 星光 是 三 台 中 目前 唯一 專訪到 陳氏 夫婦 的 綜藝 節目 將 於 本 周六 廿六日 在 台視 播出,23,據了解(263) 今夜(1662) 星光(1264) 是(4642407) 三(313861) 台(29325) 中(1011729) 目前(48695) 唯一(39149) 專訪到(1) 陳氏(1090) 夫婦(12400) 的(16029838) 綜藝(553) 節目(21445) 將(448374) 於(327210) 本(197156) 周六(104) 廿六日(122) 在(3284238) 台視(395) 播出(2950),"{'High': 22, 'Low': 1}","{'Unknown': 10, '第6級': 1, '第1級': 4, '第2級': 1, '第4級': 2, '第5級': 3, '第4*級': 1, '第1*級': 1}",3,Y,N,N,Y
第四次全國科技會議第三中心議題分組討論昨日就短期及中長期努力的方向，有效推動整體科技發展。,第四 次 全 國 科技 會議 第三 中心 議題 分組 討論 昨日 就 短期 及 中長期 努力 的 方向 有效 推動 整體 科技 發展,24,第四(21065) 次(331701) 全(178642) 國(73377) 科技(30630) 會議(30698) 第三(50320) 中心(46076) 議題(15856) 分組(1131) 討論(59041) 昨日(2036) 就(1737544) 短期(5507) 及(304586) 中長期(213) 努力(62566) 的(16029838) 方向(39560) 有效(30667) 推動(14867) 整體(19788) 科技(30630) 發展(117494),{'High': 24},"{'Unknown': 6, '第2級': 3, '第1級': 3, '第4級': 4, '第3級': 1, '第6級': 1, '第3*級': 2, '第5級': 2, '第4*級': 2}",1,Y,Y,N,N
