sentence,sentence_preprocessed,sentence_length,word_freq,high_low_freq,word_level,long_word_count,is_complete_sentence,is_complete_context,is_blacklist,is_greylist
不知龍局長是否有告訴她的小孩，美醜的標準很多，最重要的分法是內在及外在的標準，外在的標準來看，台北確實有些醜陋，但這不是台北城市本身的問題，這是歷年來台北或台灣的統治者，從來不想用心經營台灣或台北，從最早期的殖民地政府到近期國民政府以來的一些貪官污吏，他們把台北或台灣當作掠奪財富的地方，從未用心經營這裡，因此她才會有今天的醜陋面貌，但龍局長或許居住外國太久了，以至於她沒有注意到台北市近來逐漸變美麗了，因為我們開始有了新的市民，例如永康街的居民，他們嘗試逐漸的改變台北的風貌，也因此，你走在台北的街頭常會意外發現一個個小巧美麗的公園，而我的學生告訴我二二八紀念公園現在變得很漂亮，過去非常醜陋的中山堂已經換裝成為美麗的廣場了。,不 知 龍 局長 是否 有 告訴 她 的 小孩 美醜 的 標準 很多 最 重要 的 分法 是 內在 及 外在 的 標準 外在 的 標準 來 看 台北 確實 有些 醜陋 但 這 不 是 台北 城市 本身 的 問題 這 是 歷年來 台北 或 台灣 的 統治者 從來 不 想 用心 經營 台灣 或 台北 從 最 早期 的 殖民地 政府 到 近期 國民 政府 以來 的 一些 貪官污吏 他們 把 台北 或 台灣 當作 掠奪 財富 的 地方 從未 用心 經營 這裡 因此 她 才 會 有 今天 的 醜陋 面貌 但 龍 局長 或許 居住 外國 太 久 了 以至於 她 沒有 注意到 台北市 近來 逐漸 變 美麗 了 因為 我們 開始 有 了 新 的 市民 例如 永康街 的 居民 他們 嘗試 逐漸 的 改變 台北 的 風貌 也 因此 你 走 在 台北 的 街頭 常 會 意外 發現 一個個 小巧 美麗 的 公園 而 我 的 學生 告訴 我 二二八 紀念 公園 現在 變 得 很 漂亮 過去 非常 醜陋 的 中山堂 已經 換裝 成為 美麗 的 廣場 了,177,不(2282521) 知(108500) 龍(20093) 局長(3442) 是否(78907) 有(2217079) 告訴(122898) 她(1052913) 的(16029838) 小孩(47282) 美醜(342) 的(16029838) 標準(31106) 很多(113128) 最(421680) 重要(154863) 的(16029838) 分法(216) 是(4642407) 內在(24537) 及(304586) 外在(11982) 的(16029838) 標準(31106) 外在(11982) 的(16029838) 標準(31106) 來(742183) 看(444691) 台北(22242) 確實(36977) 有些(6971) 醜陋(2997) 但(597124) 這(2114032) 不(2282521) 是(4642407) 台北(22242) 城市(32018) 本身(44138) 的(16029838) 問題(280782) 這(2114032) 是(4642407) 歷年來(380) 台北(22242) 或(478077) 台灣(130718) 的(16029838) 統治者(Unknown) 從來(35243) 不(2282521) 想(449884) 用心(8780) 經營(39913) 台灣(130718) 或(478077) 台北(22242) 從(496546) 最(421680) 早期(20120) 的(16029838) 殖民地(5021) 政府(92663) 到(546906) 近期(1640) 國民(10927) 政府(92663) 以來(26654) 的(16029838) 一些(156929) 貪官污吏(384) 他們(716752) 把(617773) 台北(22242) 或(478077) 台灣(130718) 當作(16643) 掠奪(2091) 財富(12713) 的(16029838) 地方(139164) 從未(15150) 用心(8780) 經營(39913) 這裡(100385) 因此(184606) 她(1052913) 才(394539) 會(1014977) 有(2217079) 今天(73277) 的(16029838) 醜陋(2997) 面貌(5835) 但(597124) 龍(20093) 局長(3442) 或許(60077) 居住(12699) 外國(13057) 太(181732) 久(68086) 了(3199291) 以至於(4191) 她(1052913) 沒有(594280) 注意到(20925) 台北市(4393) 近來(3822) 逐漸(38705) 變(80345) 美麗(24889) 了(3199291) 因為(425061) 我們(979260) 開始(245562) 有(2217079) 了(3199291) 新(212453) 的(16029838) 市民(6158) 例如(72240) 永康街(77) 的(16029838) 居民(13554) 他們(716752) 嘗試(21645) 逐漸(38705) 的(16029838) 改變(92018) 台北(22242) 的(16029838) 風貌(2141) 也(1590760) 因此(184606) 你(1414837) 走(128453) 在(3284238) 台北(22242) 的(16029838) 街頭(6382) 常(86207) 會(1014977) 意外(21631) 發現(175233) 一個個(6479) 小巧(939) 美麗(24889) 的(16029838) 公園(13910) 而(937923) 我(3033032) 的(16029838) 學生(115846) 告訴(122898) 我(3033032) 二二八(956) 紀念(7956) 公園(13910) 現在(218744) 變(80345) 得(573721) 很(715675) 漂亮(19609) 過去(88758) 非常(152032) 醜陋(2997) 的(16029838) 中山堂(296) 已經(245160) 換裝(316) 成為(143834) 美麗(24889) 的(16029838) 廣場(8418) 了(3199291),"{'High': 175, 'Low': 2}","{'第1級': 59, 'Unknown': 35, '第4級': 12, '第5級': 22, '第3*級': 8, '第1*級': 15, '第2級': 10, '第6級': 5, '第3級': 4, '第4*級': 5, '第7級': 2}",11,Y,Y,N,Y
而我在這裡想談的是台北內在的美，這個內在的美是經由我的外國友人的指點，我才逐漸發現的，一九九四年我在德國法蘭克福進修一年，龍局長請我到海德堡大學中文系去演講，當天有一個從馬堡趕來的德國學生，他肢體不便的坐在輪椅上。,而 我 在 這裡 想 談 的 是 台北 內在的 美 這 個 內在的 美 是 經由 我 的 外國 友人 的 指點 我 才 逐漸 發現 的 一九九四年 我 在 德國 法蘭克福 進修 一 年 龍 局長 請 我 到 海德堡 大學 中文系 去 演講 當天 有 一 個 從 馬堡 趕來 的 德國 學生 他 肢體 不便 的 坐 在 輪椅 上,64,而(937923) 我(3033032) 在(3284238) 這裡(100385) 想(449884) 談(44043) 的(16029838) 是(4642407) 台北(22242) 內在的(Unknown) 美(53380) 這(2114032) 個(2296574) 內在的(Unknown) 美(53380) 是(4642407) 經由(14759) 我(3033032) 的(16029838) 外國(13057) 友人(4780) 的(16029838) 指點(2478) 我(3033032) 才(394539) 逐漸(38705) 發現(175233) 的(16029838) 一九九四年(2312) 我(3033032) 在(3284238) 德國(22936) 法蘭克福(1245) 進修(2097) 一(3701681) 年(514736) 龍(20093) 局長(3442) 請(120629) 我(3033032) 到(546906) 海德堡(189) 大學(83893) 中文系(718) 去(479993) 演講(16050) 當天(11728) 有(2217079) 一(3701681) 個(2296574) 從(496546) 馬堡(113) 趕來(3287) 的(16029838) 德國(22936) 學生(115846) 他(2487930) 肢體(5566) 不便(4361) 的(16029838) 坐(93873) 在(3284238) 輪椅(2735) 上(1233218),"{'High': 62, 'Low': 2}","{'第5級': 6, '第1級': 30, '第1*級': 7, '第3*級': 1, 'Unknown': 9, '第6級': 3, '第2級': 4, '第4級': 3, '第4*級': 1}",6,Y,Y,N,Y
演講後他告訴我，他曾經來台灣住一年。,演講 後 他 告訴 我 他 曾經 來 台灣 住 一 年,12,演講(16050) 後(422857) 他(2487930) 告訴(122898) 我(3033032) 他(2487930) 曾經(52970) 來(742183) 台灣(130718) 住(69815) 一(3701681) 年(514736),{'High': 12},"{'第4級': 2, '第1級': 8, 'Unknown': 1, '第1*級': 1}",0,Y,N,N,N
我記得我當時瞪大眼晴幾乎不敢相信，接著我有些同情地問他，那一定很不方便吧？,我 記得 我 當時 瞪大 眼晴 幾乎 不 敢 相信 接著 我 有些 同情 地 問 他 那 一定 很 不 方便 吧,23,我(3033032) 記得(47506) 我(3033032) 當時(126214) 瞪大(1709) 眼晴(32) 幾乎(74298) 不(2282521) 敢(65700) 相信(82200) 接著(57062) 我(3033032) 有些(6971) 同情(10830) 地(754998) 問(165473) 他(2487930) 那(754138) 一定(138695) 很(715675) 不(2282521) 方便(14172) 吧(184477),"{'High': 22, 'Low': 1}","{'第1級': 10, '第2級': 3, '第3*級': 2, 'Unknown': 4, '第4級': 1, '第4*級': 1, '第1*級': 2}",0,Y,N,N,N
你的行動一定受到很大的限制。,你 的 行動 一定 受到 很 大 的 限制,9,你(1414837) 的(16029838) 行動(69326) 一定(138695) 受到(66513) 很(715675) 大(525780) 的(16029838) 限制(23094),{'High': 9},"{'第1級': 5, '第5級': 1, '第1*級': 1, '第4級': 1, '第4*級': 1}",0,Y,N,N,N
沒想到他卻說，不會，因為我有很棒很棒的朋友，他們幫助我，帶我到各處旅遊。,沒想到 他 卻 說 不會 因為 我 有 很 棒 很 棒 的 朋友 他們 幫助 我 帶 我 到 各 處 旅遊,23,沒想到(13287) 他(2487930) 卻(333007) 說(1285247) 不會(173045) 因為(425061) 我(3033032) 有(2217079) 很(715675) 棒(16112) 很(715675) 棒(16112) 的(16029838) 朋友(101331) 他們(716752) 幫助(62744) 我(3033032) 帶(105786) 我(3033032) 到(546906) 各(243023) 處(84410) 旅遊(8465),{'High': 23},"{'第3*級': 1, '第1級': 13, '第4級': 2, 'Unknown': 2, '第1*級': 1, '第2級': 4}",1,Y,Y,N,N
我可以感受到他說那話的心情，那是一張怎麼發光的臉。,我 可以 感受到 他 說 那 話 的 心情 那 是 一 張 怎麼 發光 的 臉,17,我(3033032) 可以(560531) 感受到(14394) 他(2487930) 說(1285247) 那(754138) 話(148020) 的(16029838) 心情(33611) 那(754138) 是(4642407) 一(3701681) 張(99414) 怎麼(143418) 發光(3162) 的(16029838) 臉(86234),{'High': 17},"{'第1級': 12, 'Unknown': 1, '第3*級': 1, '第1*級': 1, '第6級': 1, '第2級': 1}",1,Y,N,N,N
這個經驗教會我用另一個眼光看我自己成長的地方。,這 個 經驗 教 會 我 用 另 一 個 眼光 看 我 自己 成長 的 地方,17,這(2114032) 個(2296574) 經驗(86997) 教(42322) 會(1014977) 我(3033032) 用(377038) 另(138369) 一(3701681) 個(2296574) 眼光(13910) 看(444691) 我(3033032) 自己(744739) 成長(42450) 的(16029838) 地方(139164),{'High': 17},"{'第1級': 8, '第2級': 1, 'Unknown': 2, '第1*級': 3, '第3級': 1, '第4*級': 1, '第4級': 1}",0,Y,N,N,N
是的，這就是台北內在的美，這裡的人民善良，樂於助人，而且最重要的是，他們很謙卑。,是 的 這 就是 台北 內在的 美 這裡 的 人民 善良 樂於助人 而且 最 重要 的 是 他們 很 謙卑,20,是(4642407) 的(16029838) 這(2114032) 就是(2943) 台北(22242) 內在的(Unknown) 美(53380) 這裡(100385) 的(16029838) 人民(36441) 善良(6489) 樂於助人(282) 而且(180402) 最(421680) 重要(154863) 的(16029838) 是(4642407) 他們(716752) 很(715675) 謙卑(1634),"{'High': 19, 'Low': 1}","{'第1級': 9, 'Unknown': 4, '第1*級': 2, '第4*級': 1, '第5級': 1, '第3級': 1, '第2級': 1, '第7級': 1}",2,Y,Y,N,N
一九九四年在德國進修時，住在法蘭克福，那是一個實在不太美麗的城市，我又住城市的邊緣，冬天的晚上，走在陰暗的街道，心情實在不很舒服，一天，我無意地跟我的一個德國朋友說：「法蘭克福實在不適宜人居住。」,一九九四年 在 德國 進修 時 住在 法蘭克福 那 是 一 個 實在 不 太 美麗 的 城市 我 又 住 城市 的 邊緣 冬天 的 晚上 走 在 陰暗 的 街道 心情 實在 不 很 舒服 一 天 我 無意 地 跟 我 的 一 個 德國 朋友 說 法蘭克福 實在 不適 宜人 居住,54,一九九四年(2312) 在(3284238) 德國(22936) 進修(2097) 時(623734) 住在(7545) 法蘭克福(1245) 那(754138) 是(4642407) 一(3701681) 個(2296574) 實在(51634) 不(2282521) 太(181732) 美麗(24889) 的(16029838) 城市(32018) 我(3033032) 又(535555) 住(69815) 城市(32018) 的(16029838) 邊緣(10706) 冬天(8241) 的(16029838) 晚上(42206) 走(128453) 在(3284238) 陰暗(2902) 的(16029838) 街道(8031) 心情(33611) 實在(51634) 不(2282521) 很(715675) 舒服(15280) 一(3701681) 天(330413) 我(3033032) 無意(7221) 地(754998) 跟(260280) 我(3033032) 的(16029838) 一(3701681) 個(2296574) 德國(22936) 朋友(101331) 說(1285247) 法蘭克福(1245) 實在(51634) 不適(3294) 宜人(730) 居住(12699),{'High': 54},"{'Unknown': 6, '第1*級': 6, '第2級': 3, '第6級': 3, '第3*級': 3, '第1級': 24, '第5級': 5, '第3級': 2, '第4*級': 1, '第7級': 1}",3,Y,N,N,N
那位朋友竟然回答我說：「你如果不喜歡這裏，你可以離開。」,那 位 朋友 竟然 回答 我 說 你 如果 不 喜歡 這裏 你 可以 離開,15,那(754138) 位(284809) 朋友(101331) 竟然(31233) 回答(63497) 我(3033032) 說(1285247) 你(1414837) 如果(322121) 不(2282521) 喜歡(113753) 這裏(8917) 你(1414837) 可以(560531) 離開(71748),{'High': 15},"{'第1級': 11, '第4*級': 1, '第3級': 1, '第2級': 2}",0,Y,Y,N,N
我當場愣在那裡，非常窘迫。,我 當場 愣 在 那裡 非常 窘迫,7,我(3033032) 當場(6478) 愣(2152) 在(3284238) 那裡(55755) 非常(152032) 窘迫(757),{'High': 7},"{'第1級': 2, '第5級': 1, '第6級': 1, '第1*級': 2, '第7級': 1}",0,Y,N,N,N
我提這段經驗並不是要責難安安，當安安說台北市很醜的時候，他是小小聲地在告訴他的媽媽，只是他的媽媽有點不小心地把他的悄悄話說給了全台北市的市民或全台灣的人民聽。,我 提 這 段 經驗 並不是 要 責難 安安 當 安安 說 台北市 很 醜 的 時候 他 是 小小聲 地 在 告訴 他 的 媽媽 只是 他 的 媽媽 有點 不 小心 地 把 他 的 悄悄話 說給 了 全 台北市 的 市民 或 全 台灣 的 人民 聽,50,我(3033032) 提(33635) 這(2114032) 段(95980) 經驗(86997) 並不是(Unknown) 要(851264) 責難(1217) 安安(299) 當(294625) 安安(299) 說(1285247) 台北市(4393) 很(715675) 醜(4315) 的(16029838) 時候(199970) 他(2487930) 是(4642407) 小小聲(183) 地(754998) 在(3284238) 告訴(122898) 他(2487930) 的(16029838) 媽媽(70492) 只是(96536) 他(2487930) 的(16029838) 媽媽(70492) 有點(43275) 不(2282521) 小心(24226) 地(754998) 把(617773) 他(2487930) 的(16029838) 悄悄話(488) 說給(221) 了(3199291) 全(178642) 台北市(4393) 的(16029838) 市民(6158) 或(478077) 全(178642) 台灣(130718) 的(16029838) 人民(36441) 聽(138052),"{'High': 49, 'Low': 1}","{'第1級': 22, '第3級': 2, '第4級': 3, '第2級': 5, 'Unknown': 12, '第7級': 2, '第1*級': 2, '第5級': 1, '第4*級': 1}",5,Y,Y,N,Y
我知道很多台北市民都很謙卑地贊同安安的意見，他們說是呀，台北真醜，但他們也知道，我們有信心將台北變成一個漂亮的城市，昨天報紙不就說，台北是亞洲第二個適合人居住的城市。,我 知道 很多 台北 市民 都 很 謙卑 地 贊同 安安 的 意見 他們 說 是 呀 台北 真 醜 但 他們 也 知道 我們 有 信心 將 台北 變成 一 個 漂亮 的 城市 昨天 報紙 不 就 說 台北 是 亞洲 第二 個 適合 人 居住 的 城市,50,我(3033032) 知道(343214) 很多(113128) 台北(22242) 市民(6158) 都(1125846) 很(715675) 謙卑(1634) 地(754998) 贊同(4904) 安安(299) 的(16029838) 意見(34740) 他們(716752) 說(1285247) 是(4642407) 呀(47302) 台北(22242) 真(137497) 醜(4315) 但(597124) 他們(716752) 也(1590760) 知道(343214) 我們(979260) 有(2217079) 信心(17507) 將(448374) 台北(22242) 變成(73009) 一(3701681) 個(2296574) 漂亮(19609) 的(16029838) 城市(32018) 昨天(12735) 報紙(22331) 不(2282521) 就(1737544) 說(1285247) 台北(22242) 是(4642407) 亞洲(13256) 第二(98741) 個(2296574) 適合(25592) 人(1550512) 居住(12699) 的(16029838) 城市(32018),{'High': 50},"{'第1級': 24, 'Unknown': 8, '第5級': 4, '第7級': 1, '第3*級': 2, '第2級': 2, '第1*級': 2, '第4級': 3, '第3級': 3, '第2*級': 1}",0,Y,Y,N,Y
我們歡迎安安跟我們一起來改造台北，讓她越來越漂亮。,我們 歡迎 安安 跟 我們 一起 來 改造 台北 讓 她 越來越 漂亮,13,我們(979260) 歡迎(19513) 安安(299) 跟(260280) 我們(979260) 一起(79297) 來(742183) 改造(6226) 台北(22242) 讓(526314) 她(1052913) 越來越(27239) 漂亮(19609),{'High': 13},"{'第1級': 5, '第2級': 2, 'Unknown': 3, '第1*級': 2, '第5級': 1}",1,Y,N,N,Y
讓她越來越漂亮。,讓 她 越來越 漂亮,4,讓(526314) 她(1052913) 越來越(27239) 漂亮(19609),{'High': 4},"{'第2級': 1, '第1級': 1, 'Unknown': 1, '第1*級': 1}",1,Y,N,N,N
加拿大研究人員今天宣布，他們已經找出人工培養、製造眼角膜的方法，目前可用來代替動物接受實驗，醫學界相信假以時日，人工角膜將可以移植到人體上面，造福無數眼病或失明的人。,加拿大 研究 人員 今天 宣布 他們 已經 找出 人工 培養 製造 眼角膜 的 方法 目前 可 用來 代替 動物 接受 實驗 醫學界 相信 假以時日 人工 角膜 將 可以 移植到 人體 上面 造福 無數 眼病 或 失明 的 人,38,加拿大(5370) 研究(182500) 人員(49261) 今天(73277) 宣布(10219) 他們(716752) 已經(245160) 找出(20185) 人工(6736) 培養(17148) 製造(28512) 眼角膜(101) 的(16029838) 方法(99064) 目前(48695) 可(307359) 用來(29356) 代替(6407) 動物(36835) 接受(84729) 實驗(36801) 醫學界(861) 相信(82200) 假以時日(377) 人工(6736) 角膜(212) 將(448374) 可以(560531) 移植到(367) 人體(10825) 上面(33520) 造福(1109) 無數(12002) 眼病(82) 或(478077) 失明(1272) 的(16029838) 人(1550512),"{'High': 37, 'Low': 1}","{'第4級': 3, '第3級': 2, '第5級': 10, '第1級': 6, '第4*級': 3, '第2級': 3, 'Unknown': 9, '第7級': 1, '第6級': 1}",5,Y,Y,N,N
渥太華大學眼科研究所經過五年的試驗，成功地培養出人工角膜，過程與結果將發表在明天出版的「科學」雜誌上。,渥太華 大學 眼科 研究所 經過 五 年 的 試驗 成功 地 培養出 人工 角膜 過程 與 結果 將 發表 在 明天 出版 的 科學 雜誌 上,26,渥太華(103) 大學(83893) 眼科(721) 研究所(12287) 經過(64617) 五(112649) 年(514736) 的(16029838) 試驗(4136) 成功(80266) 地(754998) 培養出(1802) 人工(6736) 角膜(212) 過程(87889) 與(968432) 結果(114008) 將(448374) 發表(25858) 在(3284238) 明天(18918) 出版(37283) 的(16029838) 科學(55156) 雜誌(22563) 上(1233218),{'High': 26},"{'Unknown': 5, '第1級': 7, '第4級': 2, '第2級': 1, '第5級': 4, '第3*級': 3, '第4*級': 3, '第1*級': 1}",3,Y,Y,N,N
研究員葛瑞菲斯女士今天向新聞界展示看起來像隱形眼鏡的人造角膜，不過，與隱形眼鏡不同的是，它的材料是真人角膜的細胞，可以說「天然」得多。,研究員 葛瑞菲斯 女士 今天 向 新聞界 展示 看起來 像 隱形眼鏡 的 人造 角膜 不過 與 隱形眼鏡 不同 的 是 它 的 材料 是 真人 角膜 的 細胞 可以 說 天然 得多,31,研究員(2609) 葛瑞菲斯(28) 女士(16146) 今天(73277) 向(231672) 新聞界(1937) 展示(9373) 看起來(41830) 像(289494) 隱形眼鏡(298) 的(16029838) 人造(2519) 角膜(212) 不過(186226) 與(968432) 隱形眼鏡(298) 不同(159432) 的(16029838) 是(4642407) 它(316854) 的(16029838) 材料(16513) 是(4642407) 真人(2225) 角膜(212) 的(16029838) 細胞(22817) 可以(560531) 說(1285247) 天然(6103) 得多(2027),"{'High': 30, 'Low': 1}","{'Unknown': 7, '第4*級': 2, '第1級': 9, '第2級': 2, '第5級': 4, '第3級': 2, '第1*級': 2, '第6級': 2, '第4級': 1}",6,Y,Y,N,Y
葛瑞菲斯女士因為研究眼睛在雷射手術過程遭到「刮壞」的問題，想到何不從人體細胞培養角膜，供實驗用。,葛瑞菲斯 女士 因為 研究 眼睛 在 雷射 手術 過程 遭到 刮壞 的 問題 想到 何不 從 人體 細胞 培養 角膜 供 實驗 用,23,葛瑞菲斯(28) 女士(16146) 因為(425061) 研究(182500) 眼睛(65022) 在(3284238) 雷射(1567) 手術(9776) 過程(87889) 遭到(16228) 刮壞(19) 的(16029838) 問題(280782) 想到(48955) 何不(3221) 從(496546) 人體(10825) 細胞(22817) 培養(17148) 角膜(212) 供(17109) 實驗(36801) 用(377038),"{'Low': 2, 'High': 21}","{'Unknown': 7, '第4*級': 2, '第1*級': 4, '第3級': 1, '第6級': 2, '第5級': 4, '第1級': 3}",1,Y,Y,N,Y
她實驗需要的天然角膜因為捐助者太少，時常不夠，這也是促成她「自造」角膜的原因。,她 實驗 需要 的 天然 角膜 因為 捐助 者 太少 時常 不 夠 這 也 是 促成 她 自造 角膜 的 原因,22,她(1052913) 實驗(36801) 需要(166793) 的(16029838) 天然(6103) 角膜(212) 因為(425061) 捐助(673) 者(423504) 太少(2388) 時常(8286) 不(2282521) 夠(49042) 這(2114032) 也(1590760) 是(4642407) 促成(4737) 她(1052913) 自造(135) 角膜(212) 的(16029838) 原因(67404),{'High': 22},"{'第1級': 8, '第5級': 2, '第2級': 1, 'Unknown': 6, '第1*級': 2, '第4級': 1, '第6級': 1, '第3*級': 1}",0,Y,Y,N,N
她先用不同的「骨有機質」蛋白質(collagens)當「骨架」，讓角膜細胞分層衍生，在角膜細胞生長、累積到相當程度，有「整塊角膜」的作用時，設法讓「骨架」退出或消失。,她 先 用 不同 的 骨 有機質 蛋白質 collagens 當 骨架 讓 角膜 細胞 分 層 衍生 在 角膜 細胞 生長 累積到 相當 程度 有 整 塊 角膜 的 作用 時 設法 讓 骨架 退出 或 消失,37,她(1052913) 先(136649) 用(377038) 不同(159432) 的(16029838) 骨(4762) 有機質(53) 蛋白質(8943) collagens(Unknown) 當(294625) 骨架(1201) 讓(526314) 角膜(212) 細胞(22817) 分(62224) 層(36369) 衍生(3265) 在(3284238) 角膜(212) 細胞(22817) 生長(11628) 累積到(84) 相當(66293) 程度(43988) 有(2217079) 整(105785) 塊(54148) 角膜(212) 的(16029838) 作用(37837) 時(623734) 設法(10253) 讓(526314) 骨架(1201) 退出(5477) 或(478077) 消失(30223),"{'High': 34, 'Low': 3}","{'第1級': 7, '第1*級': 2, '第3級': 3, '第5級': 4, 'Unknown': 7, '第6級': 4, '第7級': 2, '第2級': 2, '第3*級': 4, '第4*級': 2}",4,Y,Y,N,N
她培養出來的眼角膜，看起來跟真的一樣，不過她說「機能還不夠強」，能夠發揮功效的時間也不夠長，裝到人體上安全還會有問題。,她 培養出來 的 眼角膜 看起來 跟 真的 一樣 不過 她 說 機能 還 不 夠 強 能夠 發揮 功效 的 時間 也 不 夠 長 裝到 人體 上 安全 還 會 有 問題,33,她(1052913) 培養出來(585) 的(16029838) 眼角膜(101) 看起來(41830) 跟(260280) 真的(88001) 一樣(188109) 不過(186226) 她(1052913) 說(1285247) 機能(4575) 還(625086) 不(2282521) 夠(49042) 強(34876) 能夠(96422) 發揮(23985) 功效(4513) 的(16029838) 時間(213595) 也(1590760) 不(2282521) 夠(49042) 長(107092) 裝到(229) 人體(10825) 上(1233218) 安全(35338) 還(625086) 會(1014977) 有(2217079) 問題(280782),{'High': 33},"{'第1級': 12, 'Unknown': 8, '第3級': 2, '第1*級': 6, '第2級': 1, '第6級': 1, '第5級': 3}",3,Y,Y,N,N
目前人工眼角膜可以用來代替動物的眼睛，拿來測試化學品、化妝品等對人體的影響。,目前 人工 眼角膜 可以 用來 代替 動物 的 眼睛 拿來 測試 化學品 化妝品 等 對 人體 的 影響,18,目前(48695) 人工(6736) 眼角膜(101) 可以(560531) 用來(29356) 代替(6407) 動物(36835) 的(16029838) 眼睛(65022) 拿來(8521) 測試(10686) 化學品(146) 化妝品(1251) 等(327380) 對(897964) 人體(10825) 的(16029838) 影響(95840),{'High': 18},"{'第4級': 1, '第5級': 5, 'Unknown': 5, '第1級': 4, '第1*級': 1, '第3*級': 1, '第3級': 1}",3,Y,Y,N,N
通常這種任務由沒有淚腺的兔子擔任，引起愛護動物協會會員的抗議。,通常 這 種 任務 由 沒有 淚腺的 兔子 擔任 引起 愛護 動物 協會 會員 的 抗議,16,通常(56445) 這(2114032) 種(701563) 任務(25232) 由(208604) 沒有(594280) 淚腺的(Unknown) 兔子(4934) 擔任(34825) 引起(36729) 愛護(2222) 動物(36835) 協會(13492) 會員(5850) 的(16029838) 抗議(8382),"{'High': 15, 'Low': 1}","{'第4級': 1, '第1級': 3, 'Unknown': 4, '第4*級': 4, '第5級': 4}",1,Y,N,N,N
多倫多人道協會的懷特說，動物被拿來試驗化學品的「威力」時，痛苦不堪，如今有這樣代替品，替無數動物解除痛苦，真是功德無量。,多倫多 人道 協會 的 懷特 說 動物 被 拿來 試驗 化學品 的 威力 時 痛苦 不堪 如今 有 這樣 代替品 替 無數 動物 解除 痛苦 真是 功德 無量,28,多倫多(610) 人道(3806) 協會(13492) 的(16029838) 懷特(1261) 說(1285247) 動物(36835) 被(540683) 拿來(8521) 試驗(4136) 化學品(146) 的(16029838) 威力(4262) 時(623734) 痛苦(38501) 不堪(6676) 如今(29812) 有(2217079) 這樣(288344) 代替品(125) 替(34886) 無數(12002) 動物(36835) 解除(6448) 痛苦(38501) 真是(17243) 功德(2329) 無量(1379),{'High': 28},"{'Unknown': 8, '第6級': 2, '第5級': 5, '第1級': 4, '第2級': 2, '第3*級': 1, '第4級': 2, '第4*級': 1, '第3級': 1, '第7級': 2}",3,Y,N,N,Y
更令人鼓舞的是，人工培養的角膜繼續發展的話，有朝一日可能可以代替真人捐獻的角膜，移植到需要的人的眼睛裡。,更 令 人 鼓舞 的 是 人工 培養 的 角膜 繼續 發展 的 話 有朝一日 可能 可以 代替 真人 捐獻 的 角膜 移植到 需要 的 人 的 眼睛 裡,29,更(361676) 令(128742) 人(1550512) 鼓舞(3696) 的(16029838) 是(4642407) 人工(6736) 培養(17148) 的(16029838) 角膜(212) 繼續(80649) 發展(117494) 的(16029838) 話(148020) 有朝一日(1441) 可能(271025) 可以(560531) 代替(6407) 真人(2225) 捐獻(772) 的(16029838) 角膜(212) 移植到(367) 需要(166793) 的(16029838) 人(1550512) 的(16029838) 眼睛(65022) 裡(520435),{'High': 29},"{'Unknown': 5, '第5級': 4, '第1級': 12, '第6級': 1, '第4級': 2, '第7級': 2, '第2級': 1, '第1*級': 2}",2,Y,N,N,N
渥太華大學眼科研究所所長賈克遜表示，要達到這麼一天，還需更多的研究、時間和經費。,渥太華 大學 眼科 研究所 所長 賈克遜 表示 要 達到 這麼 一 天 還 需 更多 的 研究 時間 和 經費,20,渥太華(103) 大學(83893) 眼科(721) 研究所(12287) 所長(2381) 賈克遜(17) 表示(74452) 要(851264) 達到(35670) 這麼(116973) 一(3701681) 天(330413) 還(625086) 需(27999) 更多(44083) 的(16029838) 研究(182500) 時間(213595) 和(1338337) 經費(7039),"{'High': 19, 'Low': 1}","{'Unknown': 7, '第1級': 6, '第4級': 1, '第4*級': 2, '第2級': 2, '第3級': 1, '第5級': 1}",3,Y,Y,N,Y
