sentence,sentence_preprocessed,sentence_length,word_freq,high_low_freq,word_level,long_word_count,is_complete_sentence,is_complete_context,is_blacklist,is_greylist
不過整個法案必須經由眾議院院會通過，並與參議院取得一致版本，然後咨請總統簽署，才能成為法律，而且其中某些條文只是表達國會觀點，未必有法律約束力。,不過 整個 法案 必須 經由 眾議院 院會 通過 並 與 參議院 取得 一致 版本 然後 咨請 總統 簽署 才 能 成為 法律 而且 其中 某些 條文 只是 表達 國會 觀點 未必 有 法律 約束力,34,不過(186226) 整個(Unknown) 法案(3015) 必須(170592) 經由(14759) 眾議院(554) 院會(184) 通過(29652) 並(442790) 與(968432) 參議院(661) 取得(25649) 一致(17053) 版本(7791) 然後(156193) 咨請(2) 總統(23662) 簽署(2297) 才(394539) 能(582260) 成為(143834) 法律(27914) 而且(180402) 其中(95627) 某些(33967) 條文(1949) 只是(96536) 表達(34582) 國會(6466) 觀點(38495) 未必(8393) 有(2217079) 法律(27914) 約束力(348),"{'High': 32, 'Low': 2}","{'第2級': 2, 'Unknown': 7, '第6級': 2, '第3級': 2, '第5級': 8, '第4級': 3, '第4*級': 3, '第1*級': 2, '第3*級': 3, '第7級': 1, '第1級': 1}",3,Y,Y,N,N
美國與台灣沒有官方關係，所以雙方的代表機構都不飄揚國旗。,美國 與 台灣 沒有 官方 關係 所以 雙方 的 代表 機構 都 不 飄揚 國旗,15,美國(148299) 與(968432) 台灣(130718) 沒有(594280) 官方(9319) 關係(162883) 所以(239080) 雙方(22984) 的(16029838) 代表(58333) 機構(24025) 都(1125846) 不(2282521) 飄揚(873) 國旗(1659),{'High': 15},"{'第1級': 6, '第4*級': 2, '第6級': 1, '第3級': 1, '第1*級': 1, '第4級': 1, '第5級': 2, '第7級': 1}",0,Y,Y,N,N
這項「眾議院第一六四六號法案」第七三六節則載明，國會認為，美國在台協會台北辦事處以及處長居所應懸掛美國國旗，「一如美國在世界各地的大使館、領事館、官舍」。,這 項 眾議院 第一六四六 號 法案 第七三六 節 則 載明 國會 認為 美國 在 台 協會 台北 辦事處 以及 處長 居所 應 懸掛 美國 國旗 一如 美國 在 世界 各 地 的 大使館 領事館 官舍,35,這(2114032) 項(88887) 眾議院(554) 第一六四六(Unknown) 號(26108) 法案(3015) 第七三六(Unknown) 節(14936) 則(254096) 載明(368) 國會(6466) 認為(192030) 美國(148299) 在(3284238) 台(29325) 協會(13492) 台北(22242) 辦事處(1515) 以及(155624) 處長(1328) 居所(1126) 應(82417) 懸掛(2566) 美國(148299) 國旗(1659) 一如(8016) 美國(148299) 在(3284238) 世界(165235) 各(243023) 地(754998) 的(16029838) 大使館(1324) 領事館(686) 官舍(184),"{'High': 33, 'Low': 2}","{'第1級': 5, '第5級': 6, 'Unknown': 13, '第6級': 3, '第4級': 1, '第2級': 4, '第1*級': 2, '第4*級': 1}",6,Y,Y,N,N
而由眾議員薛爾曼(民主黨，加州)提出的修正案則主張，台灣應被視為「非北大西洋公約組織的主要盟邦」，以便於對台灣轉移軍備。,而 由 眾議員 薛爾曼 民主黨 加州 提出 的 修正案 則 主張 台灣 應 被 視為 非 北大西洋 公約 組織 的 主要 盟邦 以 便於 對 台灣 轉移 軍備,28,而(937923) 由(208604) 眾議員(443) 薛爾曼(9) 民主黨(1528) 加州(8076) 提出(63073) 的(16029838) 修正案(553) 則(254096) 主張(23147) 台灣(130718) 應(82417) 被(540683) 視為(26535) 非(112415) 北大西洋(176) 公約(1324) 組織(69485) 的(16029838) 主要(78757) 盟邦(243) 以(547785) 便於(1954) 對(897964) 台灣(130718) 轉移(7023) 軍備(692),"{'High': 27, 'Low': 1}","{'第5級': 8, '第4*級': 1, 'Unknown': 9, '第1級': 5, '第2級': 1, '第7級': 2, '第4級': 1, '第6級': 1}",5,Y,Y,N,Y
在第七三四節中，國會認為，台灣是成熟的民主政體，美國的政策係「台海爭議唯有以和平方式化解，並包含台灣人民贊同」。,在 第七三四 節 中 國會 認為 台灣 是 成熟 的 民主 政體 美國 的 政策 係 台海 爭議 唯有 以 和平 方式 化解 並 包含 台灣 人民 贊同,28,在(3284238) 第七三四(Unknown) 節(14936) 中(1011729) 國會(6466) 認為(192030) 台灣(130718) 是(4642407) 成熟(15793) 的(16029838) 民主(18177) 政體(1447) 美國(148299) 的(16029838) 政策(30965) 係(9477) 台海(587) 爭議(7127) 唯有(10986) 以(547785) 和平(14127) 方式(133407) 化解(4186) 並(442790) 包含(17285) 台灣(130718) 人民(36441) 贊同(4904),"{'High': 27, 'Low': 1}","{'第1*級': 1, 'Unknown': 3, '第4級': 4, '第5級': 4, '第2級': 1, '第1級': 6, '第7級': 1, '第4*級': 5, '第6級': 3}",1,Y,Y,N,N
有關對台軍售，布希總統曾表示應廢除現行的年度諮商，改為視實際需要適時研議。,有關 對 台 軍售 布希 總統 曾 表示 應 廢除 現行 的 年度 諮商 改為 視 實際 需要 適時 研議,20,有關(69607) 對(897964) 台(29325) 軍售(131) 布希(1770) 總統(23662) 曾(132981) 表示(74452) 應(82417) 廢除(3114) 現行(1947) 的(16029838) 年度(4709) 諮商(3258) 改為(6294) 視(15590) 實際(52755) 需要(166793) 適時(3359) 研議(180),{'High': 20},"{'第4級': 3, '第1級': 2, '第2級': 2, 'Unknown': 4, '第4*級': 2, '第6級': 6, '第7級': 1}",0,Y,N,N,Y
但是艾克曼議員(民主黨，紐約州)提出修正案，要求維持現行作法。,但是 艾克曼 議員 民主黨 紐約州 提出 修正案 要求 維持 現行 作法,11,但是(247988) 艾克曼(341) 議員(4905) 民主黨(1528) 紐約州(867) 提出(63073) 修正案(553) 要求(71192) 維持(31284) 現行(1947) 作法(9353),{'High': 11},"{'第2級': 1, 'Unknown': 5, '第6級': 2, '第3*級': 1, '第5級': 1, '第3級': 1}",4,Y,Y,N,Y
他說，他是最支持防衛台灣的議員之一，但是布希的主張晦暗不明，而且「國會去年才爭取到軍售諮商權」，所以不應變動現行作法。,他 說 他 是 最 支持 防衛 台灣 的 議員 之 一 但是 布希 的 主張 晦暗 不明 而且 國會 去年 才 爭取到 軍售 諮商 權 所以 不 應 變動 現行 作法,32,他(2487930) 說(1285247) 他(2487930) 是(4642407) 最(421680) 支持(42489) 防衛(4690) 台灣(130718) 的(16029838) 議員(4905) 之(875481) 一(3701681) 但是(247988) 布希(1770) 的(16029838) 主張(23147) 晦暗(598) 不明(6635) 而且(180402) 國會(6466) 去年(9462) 才(394539) 爭取到(1028) 軍售(131) 諮商(3258) 權(11552) 所以(239080) 不(2282521) 應(82417) 變動(7232) 現行(1947) 作法(9353),{'High': 32},"{'第1級': 10, '第1*級': 2, '第4級': 1, '第6級': 4, '第5級': 5, '第2級': 2, 'Unknown': 5, '第7級': 1, '第3級': 2}",1,Y,Y,N,Y
這項修正案以口頭通過。,這 項 修正案 以 口頭 通過,6,這(2114032) 項(88887) 修正案(553) 以(547785) 口頭(2855) 通過(29652),{'High': 6},"{'第1級': 1, '第5級': 3, 'Unknown': 1, '第4級': 1}",1,Y,N,N,N
這個決議屬於法案的本體，所以具有強制拘束力。,這 個 決議 屬於 法案 的 本體 所以 具有 強制 拘束力,11,這(2114032) 個(2296574) 決議(2452) 屬於(39478) 法案(3015) 的(16029838) 本體(2326) 所以(239080) 具有(60702) 強制(3772) 拘束力(101),{'High': 11},"{'第1級': 3, '第6級': 4, '第5級': 1, 'Unknown': 2, '第1*級': 1}",1,Y,Y,N,N
法案中也授權移轉四艘「紀德級」驅逐艦給台灣，分別是「紀德號」、「卡拉漢號」、「史考特號」、以及「錢得樂號」。,法案 中 也 授權 移轉 四 艘 紀德級 驅逐艦 給 台灣 分別 是 紀德號 卡拉 漢號 史考特號 以及 錢得樂號,19,法案(3015) 中(1011729) 也(1590760) 授權(3802) 移轉(2907) 四(141667) 艘(13569) 紀德級(2) 驅逐艦(280) 給(240485) 台灣(130718) 分別(25566) 是(4642407) 紀德號(Unknown) 卡拉(2524) 漢號(Unknown) 史考特號(Unknown) 以及(155624) 錢得樂號(Unknown),"{'High': 14, 'Low': 5}","{'第6級': 2, 'Unknown': 9, '第1級': 5, '第5級': 2, '第4*級': 1}",5,Y,Y,N,Y
多位大學生三日在一場公聽會中表示，大學調漲學雜費，教育品質也應相對提升。,多 位 大學生 三日 在 一 場 公聽會 中 表示 大學 調漲 學雜費 教育 品質 也 應 相對 提升,19,多(318992) 位(284809) 大學生(5007) 三日(3684) 在(3284238) 一(3701681) 場(68915) 公聽會(218) 中(1011729) 表示(74452) 大學(83893) 調漲(146) 學雜費(103) 教育(71554) 品質(19388) 也(1590760) 應(82417) 相對(20694) 提升(17122),{'High': 19},"{'第1級': 5, '第3級': 2, 'Unknown': 6, '第1*級': 1, '第2級': 1, '第4*級': 1, '第4級': 1, '第5級': 1, '第6級': 1}",3,Y,N,N,N
有些學校未將經費用在刀口上，卻將教室隨便拆掉、重新裝潢。,有些 學校 未 將 經費 用 在 刀口 上 卻 將 教室 隨便 拆掉 重新 裝潢,16,有些(6971) 學校(74782) 未(101927) 將(448374) 經費(7039) 用(377038) 在(3284238) 刀口(327) 上(1233218) 卻(333007) 將(448374) 教室(16437) 隨便(10857) 拆掉(973) 重新(44668) 裝潢(2051),{'High': 16},"{'Unknown': 3, '第1級': 3, '第5級': 5, '第1*級': 2, '第4級': 2, '第6級': 1}",0,Y,N,N,N
他們呼籲教育部應仔細評鑑各大學，並視其結果作為是否允許學校調漲學雜費的依據。,他們 呼籲 教育部 應 仔細 評鑑 各 大學 並 視 其 結果 作為 是否 允許 學校 調漲 學雜費 的 依據,20,他們(716752) 呼籲(3515) 教育部(3240) 應(82417) 仔細(27626) 評鑑(2698) 各(243023) 大學(83893) 並(442790) 視(15590) 其(307905) 結果(114008) 作為(58009) 是否(78907) 允許(13099) 學校(74782) 調漲(146) 學雜費(103) 的(16029838) 依據(12089),{'High': 20},"{'第1級': 4, '第6級': 3, '第5級': 5, 'Unknown': 3, '第4*級': 2, '第7級': 1, '第2級': 1, '第3*級': 1}",2,Y,Y,N,N
部分大學學雜費今年將再調漲，教育部長曾志朗發出公開信呼籲各校共體時艱、今年不要調漲學雜費，但仍有學校執意要漲。,部分 大學 學雜費 今年 將 再 調漲 教育部長 曾志朗 發出 公開信 呼籲 各 校 共體時艱 今年 不要 調漲 學雜費 但 仍 有 學校 執意 要 漲,26,部分(82518) 大學(83893) 學雜費(103) 今年(10836) 將(448374) 再(326207) 調漲(146) 教育部長(521) 曾志朗(226) 發出(29993) 公開信(547) 呼籲(3515) 各(243023) 校(14484) 共體時艱(19) 今年(10836) 不要(101931) 調漲(146) 學雜費(103) 但(597124) 仍(92056) 有(2217079) 學校(74782) 執意(1535) 要(851264) 漲(3422),"{'High': 25, 'Low': 1}","{'第2級': 3, '第1級': 6, 'Unknown': 11, '第5級': 1, '第1*級': 1, '第4*級': 1, '第6級': 1, '第4級': 1, '第7級': 1}",6,Y,Y,N,Y
立委秦慧珠昨日舉辦一場公聽會，邀請多所大學學生、校方代表討論此一問題。,立委 秦慧珠 昨日 舉辦 一 場 公聽會 邀請 多 所 大學 學生 校方 代表 討論 此 一 問題,18,立委(1052) 秦慧珠(11) 昨日(2036) 舉辦(12070) 一(3701681) 場(68915) 公聽會(218) 邀請(14342) 多(318992) 所(527327) 大學(83893) 學生(115846) 校方(1227) 代表(58333) 討論(59041) 此(288458) 一(3701681) 問題(280782),"{'High': 17, 'Low': 1}","{'Unknown': 4, '第5級': 2, '第4級': 3, '第1級': 6, '第2級': 2, '第3*級': 1}",2,Y,N,N,Y
國立台北大學學生會會長吳凱華說，各大學學雜費是否調整，應有更客觀的評估方式。,國立 台北 大學 學生會 會長 吳凱華 說 各 大學 學雜費 是否 調整 應 有 更 客觀 的 評估 方式,19,國立(5098) 台北(22242) 大學(83893) 學生會(1015) 會長(3381) 吳凱華(Unknown) 說(1285247) 各(243023) 大學(83893) 學雜費(103) 是否(78907) 調整(18900) 應(82417) 有(2217079) 更(361676) 客觀(11309) 的(16029838) 評估(16292) 方式(133407),"{'High': 18, 'Low': 1}","{'第5級': 4, 'Unknown': 7, '第1級': 5, '第2級': 1, '第4*級': 2}",3,Y,N,N,Y
今年該校調漲學雜費時，雖曾和學生會溝通，但學生仍不滿意結果，她認為，學校並未把錢用在刀口上，例如學校花了一千多萬建置宿舍網路，這只是住校學生才能享有的福利，為何要花這些錢？,今年 該 校 調漲 學雜費 時 雖 曾 和 學生會 溝通 但 學生 仍 不 滿意 結果 她 認為 學校 並 未 把 錢 用 在 刀口 上 例如 學校 花 了 一千多萬 建置 宿舍 網路 這 只 是 住 校 學生 才 能 享有 的 福利 為何 要 花 這些 錢,52,今年(10836) 該(148369) 校(14484) 調漲(146) 學雜費(103) 時(623734) 雖(48164) 曾(132981) 和(1338337) 學生會(1015) 溝通(31533) 但(597124) 學生(115846) 仍(92056) 不(2282521) 滿意(16756) 結果(114008) 她(1052913) 認為(192030) 學校(74782) 並(442790) 未(101927) 把(617773) 錢(89883) 用(377038) 在(3284238) 刀口(327) 上(1233218) 例如(72240) 學校(74782) 花(72593) 了(3199291) 一千多萬(107) 建置(763) 宿舍(4509) 網路(26656) 這(2114032) 只(436725) 是(4642407) 住(69815) 校(14484) 學生(115846) 才(394539) 能(582260) 享有(5799) 的(16029838) 福利(4311) 為何(25238) 要(851264) 花(72593) 這些(315113) 錢(89883),{'High': 52},"{'第1級': 15, '第4*級': 2, 'Unknown': 13, '第3*級': 3, '第2級': 6, '第4級': 4, '第5級': 2, '第1*級': 4, '第2*級': 1, '第6級': 2}",3,Y,Y,N,N
該校資訊大樓一樓也重新改裝一個電子商務室，不知有何用。,該 校 資訊 大樓 一樓 也 重新 改裝 一 個 電子 商務室 不 知 有 何 用,17,該(148369) 校(14484) 資訊(37848) 大樓(7532) 一樓(2155) 也(1590760) 重新(44668) 改裝(954) 一(3701681) 個(2296574) 電子(17642) 商務室(Unknown) 不(2282521) 知(108500) 有(2217079) 何(46992) 用(377038),"{'High': 16, 'Low': 1}","{'第4*級': 1, 'Unknown': 6, '第4級': 2, '第2*級': 1, '第1級': 6, '第5級': 1}",1,Y,N,N,N
該校通識教育曾被教育部評為不佳、行政人員服務態度很差，卻都不見改善，難道這些問題不如硬體建設重要？,該 校 通識 教育 曾 被 教育部 評為 不佳 行政 人員 服務 態度 很 差 卻 都 不 見 改善 難道 這些 問題 不如 硬體 建設 重要,27,該(148369) 校(14484) 通識(568) 教育(71554) 曾(132981) 被(540683) 教育部(3240) 評為(565) 不佳(4940) 行政(15666) 人員(49261) 服務(38055) 態度(56470) 很(715675) 差(23865) 卻(333007) 都(1125846) 不(2282521) 見(179113) 改善(21559) 難道(22961) 這些(315113) 問題(280782) 不如(21722) 硬體(1723) 建設(11627) 重要(154863),{'High': 27},"{'第4*級': 3, 'Unknown': 6, '第3級': 2, '第4級': 4, '第2級': 2, '第5級': 5, '第1級': 4, '第1*級': 1}",1,Y,N,N,N
文化大學學生柯裕峰、淡江大學學生陳弘儒、政大學生會權利部部長楊家俍等人也都認為，教育部對大學學雜費調漲應訂定一套制度，讓學生能因調高學雜費而獲得教育品質的改善。,文化 大學 學生 柯裕峰 淡江 大學 學生 陳弘儒 政大 學生會 權利部 部長 楊家俍 等 人 也 都 認為 教育部 對 大學 學雜費 調漲 應 訂定 一 套 制度 讓 學生 能 因 調高 學雜費 而 獲得 教育 品質 的 改善,40,文化(115697) 大學(83893) 學生(115846) 柯裕峰(Unknown) 淡江(447) 大學(83893) 學生(115846) 陳弘儒(1) 政大(1475) 學生會(1015) 權利部(84) 部長(6226) 楊家俍(Unknown) 等(327380) 人(1550512) 也(1590760) 都(1125846) 認為(192030) 教育部(3240) 對(897964) 大學(83893) 學雜費(103) 調漲(146) 應(82417) 訂定(2929) 一(3701681) 套(37180) 制度(37973) 讓(526314) 學生(115846) 能(582260) 因(119364) 調高(405) 學雜費(103) 而(937923) 獲得(54809) 教育(71554) 品質(19388) 的(16029838) 改善(21559),"{'High': 36, 'Low': 4}","{'第2級': 3, '第1級': 12, 'Unknown': 14, '第3*級': 1, '第5級': 3, '第6級': 1, '第3級': 2, '第4級': 2, '第1*級': 1, '第4*級': 1}",8,Y,Y,N,Y
面對學生的反應，與會大學代表也無奈。,面對 學生 的 反應 與會 大學 代表 也 無奈,9,面對(62914) 學生(115846) 的(16029838) 反應(53196) 與會(2411) 大學(83893) 代表(58333) 也(1590760) 無奈(8144),{'High': 9},"{'第4*級': 1, '第1級': 4, '第4級': 2, '第6級': 2}",0,Y,N,N,N
台北大學副校長梁發進表示，該校甫由中興大學法商學院改制為台北大學，但員額等資源都無法與一般公立大學相較，校務運作得很辛苦。,台北 大學 副校長 梁發進 表示 該 校 甫 由 中興 大學法 商學院 改制為 台北 大學 但 員額 等 資源 都 無法 與 一般 公立 大學 相較 校務 運作 得 很 辛苦,31,台北(22242) 大學(83893) 副校長(412) 梁發進(Unknown) 表示(74452) 該(148369) 校(14484) 甫(2367) 由(208604) 中興(1532) 大學法(23) 商學院(1180) 改制為(264) 台北(22242) 大學(83893) 但(597124) 員額(174) 等(327380) 資源(27580) 都(1125846) 無法(150606) 與(968432) 一般(80732) 公立(1828) 大學(83893) 相較(5934) 校務(436) 運作(23209) 得(573721) 很(715675) 辛苦(13451),"{'High': 29, 'Low': 2}","{'Unknown': 11, '第1級': 5, '第4*級': 4, '第7級': 2, '第2級': 2, '第3*級': 2, '第4級': 1, '第5級': 2, '第6級': 2}",5,Y,Y,N,Y
今年決定調漲學雜費時，也都和學生溝通過，最後決定調漲四.五%。,今年 決定 調漲 學雜費 時 也 都 和 學生 溝通 過 最後 決定 調漲 四五,15,今年(10836) 決定(101837) 調漲(146) 學雜費(103) 時(623734) 也(1590760) 都(1125846) 和(1338337) 學生(115846) 溝通(31533) 過(412878) 最後(142102) 決定(101837) 調漲(146) 四五(599),{'High': 15},"{'第1級': 4, '第2級': 3, 'Unknown': 5, '第3*級': 1, '第4級': 1, '第1*級': 1}",1,Y,N,N,N
政大主任秘書關尚仁則說，該校今年決定調漲學雜費前，曾做過詳細分析，若不調漲學雜費，該校收支會出現八千多萬赤字，因此決定調漲五%，平均每位學生分配到的教育成本不足四千多元，學校願以其他方式補足。,政大 主任秘書 關尚仁 則 說 該 校 今年 決定 調漲 學雜費 前 曾 做 過 詳細 分析 若 不 調漲 學雜費 該 校 收支 會 出現 八千多萬 赤字 因此 決定 調漲 五 平均 每 位 學生 分配到 的 教育 成本 不足 四千多 元 學校 願 以 其他 方式 補足,49,政大(1475) 主任秘書(Unknown) 關尚仁(5) 則(254096) 說(1285247) 該(148369) 校(14484) 今年(10836) 決定(101837) 調漲(146) 學雜費(103) 前(272709) 曾(132981) 做(411649) 過(412878) 詳細(13379) 分析(59250) 若(92766) 不(2282521) 調漲(146) 學雜費(103) 該(148369) 校(14484) 收支(1112) 會(1014977) 出現(124694) 八千多萬(19) 赤字(1043) 因此(184606) 決定(101837) 調漲(146) 五(112649) 平均(13871) 每(333357) 位(284809) 學生(115846) 分配到(816) 的(16029838) 教育(71554) 成本(20612) 不足(20371) 四千多(217) 元(60807) 學校(74782) 願(30213) 以(547785) 其他(189445) 方式(133407) 補足(1021),"{'High': 46, 'Low': 3}","{'Unknown': 15, '第5級': 5, '第1級': 11, '第4*級': 6, '第2級': 3, '第4級': 3, '第1*級': 3, '第7級': 2, '第3級': 1}",7,Y,Y,N,Y
包括中山、清大、台大等代表都表示，自公立大學實施校務基金以來，學校自籌經費比例高、找錢找得很辛苦。,包括 中山 清大 台大 等 代表 都 表示 自 公立 大學 實施 校務 基金 以來 學校 自籌 經費 比例 高 找錢 找 得 很 辛苦,25,包括(74410) 中山(2828) 清大(262) 台大(3363) 等(327380) 代表(58333) 都(1125846) 表示(74452) 自(59676) 公立(1828) 大學(83893) 實施(11851) 校務(436) 基金(10265) 以來(26654) 學校(74782) 自籌(167) 經費(7039) 比例(13747) 高(128858) 找錢(152) 找(108128) 得(573721) 很(715675) 辛苦(13451),{'High': 25},"{'第3*級': 2, 'Unknown': 6, '第4級': 2, '第1級': 6, '第4*級': 2, '第5級': 5, '第6級': 1, '第2級': 1}",0,Y,Y,N,Y
依規定，調漲的學雜費都只能用在發獎學金給學生、增添儀器設備方面，不會亂花錢，請學生放心。,依 規定 調漲 的 學雜費 都 只 能 用 在 發 獎學金 給 學生 增添 儀器 設備 方面 不會 亂 花錢 請 學生 放心,24,依(37519) 規定(24592) 調漲(146) 的(16029838) 學雜費(103) 都(1125846) 只(436725) 能(582260) 用(377038) 在(3284238) 發(22092) 獎學金(1642) 給(240485) 學生(115846) 增添(3615) 儀器(4419) 設備(12866) 方面(75079) 不會(173045) 亂(24412) 花錢(4670) 請(120629) 學生(115846) 放心(10401),{'High': 24},"{'Unknown': 5, '第4級': 4, '第1級': 7, '第1*級': 3, '第6級': 1, '第5級': 1, '第3*級': 2, '第3級': 1}",2,Y,N,N,N
核三廠一號機三月十八日發生三A核子事故，被裁定二級違規處分，原子能委員會昨日核定台電公司提報的獎懲名單。,核三廠 一號機 三月 十八日 發生 三A 核子 事故 被 裁定 二級 違規 處分 原子能 委員會 昨日 核定 台電 公司 提報 的 獎懲 名單,23,核三廠(27) 一號機(Unknown) 三月(16043) 十八日(2987) 發生(129211) 三A(Unknown) 核子(1443) 事故(3476) 被(540683) 裁定(821) 二級(930) 違規(1052) 處分(2806) 原子能(144) 委員會(19419) 昨日(2036) 核定(551) 台電(386) 公司(168500) 提報(258) 的(16029838) 獎懲(335) 名單(6552),"{'Low': 3, 'High': 20}","{'Unknown': 12, '第3級': 1, '第6級': 2, '第5級': 3, '第2級': 2, '第7級': 2, '第1級': 1}",5,Y,N,N,Y
包括台電總公司、核三廠及供電處共有十名相關主管分別被記過或申誡處分，懲處名單中以台電副總經理蔡茂村層級最高，處分也最重，遭記過一次處分。,包括 台電 總公司 核三廠 及 供電處 共有 十 名 相關 主管 分別 被 記過 或 申誡 處分 懲處 名單 中 以 台電 副 總經理 蔡茂村 層級 最 高 處分 也 最 重 遭 記過 一 次 處分,37,包括(74410) 台電(386) 總公司(1537) 核三廠(27) 及(304586) 供電處(Unknown) 共有(692) 十(77415) 名(136287) 相關(41599) 主管(23448) 分別(25566) 被(540683) 記過(137) 或(478077) 申誡(48) 處分(2806) 懲處(1101) 名單(6552) 中(1011729) 以(547785) 台電(386) 副(21458) 總經理(6256) 蔡茂村(Unknown) 層級(2359) 最(421680) 高(128858) 處分(2806) 也(1590760) 最(421680) 重(31331) 遭(18764) 記過(137) 一(3701681) 次(331701) 處分(2806),"{'High': 33, 'Low': 4}","{'第3*級': 1, 'Unknown': 12, '第5級': 5, '第1級': 4, '第2級': 3, '第4*級': 3, '第3級': 1, '第6級': 4, '第7級': 2, '第1*級': 2}",5,Y,Y,N,Y
另有十五名核三廠第一線員工因搶救得宜，獲記功嘉獎。,另 有 十五 名 核三廠 第一線 員工 因 搶救 得宜 獲 記功 嘉獎,13,另(138369) 有(2217079) 十五(19907) 名(136287) 核三廠(27) 第一線(1125) 員工(31766) 因(119364) 搶救(1357) 得宜(843) 獲(11610) 記功(53) 嘉獎(498),"{'High': 11, 'Low': 2}","{'第3級': 1, '第1級': 1, 'Unknown': 6, '第2級': 1, '第4級': 1, '第6級': 1, '第7級': 1, '第5級': 1}",2,Y,N,N,N
原能會昨日核定台電提報的獎懲名單，並立即向行政院報備。,原能會 昨日 核定 台電 提報 的 獎懲 名單 並 立即 向 行政院 報備,13,原能會(16) 昨日(2036) 核定(551) 台電(386) 提報(258) 的(16029838) 獎懲(335) 名單(6552) 並(442790) 立即(28594) 向(231672) 行政院(4347) 報備(189),"{'Low': 1, 'High': 12}","{'Unknown': 6, '第5級': 3, '第7級': 1, '第1級': 1, '第4*級': 1, '第2級': 1}",2,Y,Y,N,N
原能會副主委歐陽敏盛強調，台電這份重新提報的獎懲名單完全符合該會要求的「賞罰分明」，以及「獎勵由下而上、處罰由上而下」的管理原則，當天現場搶救的十五名工作人員，分別獲得記功一次或兩次的獎勵。,原能會 副 主委 歐陽敏盛 強調 台電 這 份 重新 提報 的 獎懲 名單 完全 符合 該 會 要求 的 賞罰 分明 以及 獎勵 由 下 而 上 處罰 由 上 而 下 的 管理 原則 當天 現場 搶救 的 十五 名 工作 人員 分別 獲得 記功 一 次 或 兩 次 的 獎勵,53,原能會(16) 副(21458) 主委(1067) 歐陽敏盛(2) 強調(36095) 台電(386) 這(2114032) 份(53198) 重新(44668) 提報(258) 的(16029838) 獎懲(335) 名單(6552) 完全(115744) 符合(19232) 該(148369) 會(1014977) 要求(71192) 的(16029838) 賞罰(1105) 分明(4849) 以及(155624) 獎勵(5345) 由(208604) 下(329549) 而(937923) 上(1233218) 處罰(5163) 由(208604) 上(1233218) 而(937923) 下(329549) 的(16029838) 管理(54484) 原則(31148) 當天(11728) 現場(15949) 搶救(1357) 的(16029838) 十五(19907) 名(136287) 工作(220164) 人員(49261) 分別(25566) 獲得(54809) 記功(53) 一(3701681) 次(331701) 或(478077) 兩(526190) 次(331701) 的(16029838) 獎勵(5345),"{'Low': 3, 'High': 50}","{'Unknown': 9, '第5級': 13, '第1級': 11, '第2級': 4, '第3*級': 2, '第4*級': 8, '第1*級': 3, '第6級': 2, '第3級': 1}",2,Y,Y,N,Y
