sentence,sentence_preprocessed,sentence_length,word_freq,high_low_freq,word_level,long_word_count,is_complete_sentence,is_complete_context,is_blacklist,is_greylist
要到陽光刺痛了絲紅的眼球之時，才能夠躲臥入棉被的墓寢，而睡眠不過只是極端疲累後的一些慰藉品。,要 到 陽光 刺痛 了 絲紅 的 眼球 之 時 才 能夠 躲 臥入 棉被 的 墓寢 而 睡眠 不過 只 是 極端 疲累 後 的 一些 慰藉品,28,要(851264) 到(546906) 陽光(17239) 刺痛(1625) 了(3199291) 絲紅(1) 的(16029838) 眼球(1865) 之(875481) 時(623734) 才(394539) 能夠(96422) 躲(13520) 臥入(Unknown) 棉被(1666) 的(16029838) 墓寢(7) 而(937923) 睡眠(12801) 不過(186226) 只(436725) 是(4642407) 極端(10017) 疲累(2103) 後(422857) 的(16029838) 一些(156929) 慰藉品(Unknown),"{'High': 24, 'Low': 4}","{'第1級': 7, '第4*級': 2, '第6級': 3, 'Unknown': 7, '第7級': 1, '第5級': 2, '第3*級': 1, '第2級': 2, '第4級': 1, '第1*級': 2}",1,Y,Y,N,N
日子，在顛倒中，毫無目的地走過。,日子 在 顛倒 中 毫無 目的 地 走過,8,日子(28378) 在(3284238) 顛倒(2901) 中(1011729) 毫無(32086) 目的(45226) 地(754998) 走過(10466),{'High': 8},"{'第3*級': 2, '第1*級': 1, '第6級': 1, 'Unknown': 4}",0,Y,N,N,N
我也分不清日月究竟交替過多少次。,我 也 分 不清 日月 究竟 交替 過 多少 次,10,我(3033032) 也(1590760) 分(62224) 不清(1439) 日月(2081) 究竟(28589) 交替(2473) 過(412878) 多少(50265) 次(331701),{'High': 10},"{'第1級': 4, 'Unknown': 2, '第5級': 1, '第6級': 1, '第1*級': 1, '第2級': 1}",0,Y,N,N,N
我沒有出走的慾望，只能躲在狹小的房間內，期盼著時間療好病情，但卻只是散播了瘟疫般的低落病毒。,我 沒有 出走 的 慾望 只 能 躲 在 狹小 的 房間 內 期盼 著 時間 療好 病情 但 卻 只 是 散播 了 瘟疫 般 的 低落 病毒,29,我(3033032) 沒有(594280) 出走(2669) 的(16029838) 慾望(9645) 只(436725) 能(582260) 躲(13520) 在(3284238) 狹小(1983) 的(16029838) 房間(44038) 內(183051) 期盼(3156) 著(1004687) 時間(213595) 療好(4) 病情(4930) 但(597124) 卻(333007) 只(436725) 是(4642407) 散播(1578) 了(3199291) 瘟疫(1532) 般(44639) 的(16029838) 低落(3388) 病毒(8421),"{'High': 28, 'Low': 1}","{'第1級': 7, '第5級': 4, '第1*級': 5, '第4級': 2, '第6級': 5, '第3級': 1, 'Unknown': 3, '第4*級': 1, '第2級': 1}",0,Y,Y,N,N
憔悴的不單是骷顱般的面容，髮絲糾也結成枯黃的棄草，蔓延的鬍渣更是黑沈了臉色。,憔悴 的 不單 是 骷顱 般 的 面容 髮絲 糾 也 結成 枯黃 的 棄草 蔓延 的 鬍渣 更 是 黑沈 了 臉色,23,憔悴(1713) 的(16029838) 不單(2364) 是(4642407) 骷顱(1) 般(44639) 的(16029838) 面容(2430) 髮絲(544) 糾(277) 也(1590760) 結成(1981) 枯黃(338) 的(16029838) 棄草(Unknown) 蔓延(2065) 的(16029838) 鬍渣(199) 更(361676) 是(4642407) 黑沈(6) 了(3199291) 臉色(10744),"{'High': 20, 'Low': 3}","{'第6級': 5, '第1級': 7, 'Unknown': 9, '第7級': 1, '第3*級': 1}",0,Y,N,N,Y
而久未更換的低落空氣，在房裡沈澱了許多沮喪的灰塵，狼籍的杯盤衣物，更是散發著頹廢的惡臭。,而 久 未 更換 的 低落 空氣 在 房 裡 沈澱 了 許多 沮喪 的 灰塵 狼籍 的 杯盤 衣物 更 是 散發 著 頹廢 的 惡臭,27,而(937923) 久(68086) 未(101927) 更換(2931) 的(16029838) 低落(3388) 空氣(18137) 在(3284238) 房(17530) 裡(520435) 沈澱(242) 了(3199291) 許多(159791) 沮喪(10871) 的(16029838) 灰塵(2996) 狼籍(105) 的(16029838) 杯盤(239) 衣物(3721) 更(361676) 是(4642407) 散發(3603) 著(1004687) 頹廢(986) 的(16029838) 惡臭(994),{'High': 27},"{'第5級': 5, '第1級': 6, '第1*級': 3, '第3*級': 2, 'Unknown': 8, '第6級': 2, '第7級': 1}",0,Y,Y,N,N
走向了鏡子，我自憐的眼神終於看到我落魄的模樣。,走向 了 鏡子 我 自憐 的 眼神 終於 看到 我 落魄 的 模樣,13,走向(18382) 了(3199291) 鏡子(8307) 我(3033032) 自憐(705) 的(16029838) 眼神(15149) 終於(59622) 看到(159419) 我(3033032) 落魄(1205) 的(16029838) 模樣(16099),{'High': 13},"{'Unknown': 2, '第4級': 2, '第1級': 4, '第7級': 2, '第5級': 2, '第1*級': 1}",0,Y,N,N,N
這就是此刻的我，在失去了情感的依賴之後，我竟讓靈魂墮落到如此可悲的情境。,這 就是 此刻 的 我 在 失去 了 情感 的 依賴 之後 我 竟 讓 靈魂 墮落 到 如此 可悲 的 情境,22,這(2114032) 就是(2943) 此刻(12496) 的(16029838) 我(3033032) 在(3284238) 失去(39949) 了(3199291) 情感(23819) 的(16029838) 依賴(13548) 之後(190467) 我(3033032) 竟(35425) 讓(526314) 靈魂(20244) 墮落(2847) 到(546906) 如此(133083) 可悲(2093) 的(16029838) 情境(21379),{'High': 22},"{'第1級': 7, 'Unknown': 3, '第1*級': 1, '第5級': 4, '第4級': 1, '第4*級': 1, '第2級': 1, '第6級': 4}",0,Y,Y,N,N
何苦呢？,何苦 呢,2,何苦(718) 呢(204566),{'High': 2},"{'第7級': 1, '第1級': 1}",0,N,N,N,N
心靈受的傷已經夠了，何必牽扯無辜的肉體一起陪葬呢？,心靈 受 的 傷 已經 夠 了 何必 牽扯 無辜 的 肉體 一起 陪葬 呢,15,心靈(37927) 受(109982) 的(16029838) 傷(11567) 已經(245160) 夠(49042) 了(3199291) 何必(5781) 牽扯(988) 無辜(5213) 的(16029838) 肉體(7413) 一起(79297) 陪葬(387) 呢(204566),{'High': 15},"{'第6級': 2, '第4級': 2, '第1級': 4, '第2級': 1, '第1*級': 1, 'Unknown': 2, '第5級': 2, '第7級': 1}",0,Y,N,N,N
望穿了哭乾了悲傷的眼眶，我無奈的知道這些日子走的荒唐而可悲。,望穿 了 哭乾 了 悲傷 的 眼眶 我 無奈 的 知道 這些 日子 走 的 荒唐 而 可悲,18,望穿(41) 了(3199291) 哭乾(8) 了(3199291) 悲傷(9716) 的(16029838) 眼眶(2413) 我(3033032) 無奈(8144) 的(16029838) 知道(343214) 這些(315113) 日子(28378) 走(128453) 的(16029838) 荒唐(2949) 而(937923) 可悲(2093),"{'Low': 2, 'High': 16}","{'Unknown': 5, '第5級': 2, '第1級': 6, '第6級': 4, '第3*級': 1}",0,Y,Y,N,N
出去走走吧，就讓鮮洌的微風洗滌我這污穢而憔悴的靈魂吧。,出去 走走 吧 就 讓 鮮洌 的 微風 洗滌 我 這 污穢 而 憔悴 的 靈魂 吧,17,出去(20922) 走走(2459) 吧(184477) 就(1737544) 讓(526314) 鮮洌(Unknown) 的(16029838) 微風(2052) 洗滌(1133) 我(3033032) 這(2114032) 污穢(766) 而(937923) 憔悴(1713) 的(16029838) 靈魂(20244) 吧(184477),"{'High': 16, 'Low': 1}","{'Unknown': 3, '第1級': 7, '第2級': 1, '第5級': 2, '第7級': 2, '第6級': 2}",0,Y,Y,N,N
才一出門，我又開始後悔出走的決定。,才 一 出門 我 又 開始 後悔 出走 的 決定,10,才(394539) 一(3701681) 出門(12554) 我(3033032) 又(535555) 開始(245562) 後悔(7222) 出走(2669) 的(16029838) 決定(101837),{'High': 10},"{'第2級': 3, '第1級': 3, '第3級': 1, '第1*級': 1, '第5級': 2}",0,Y,N,N,N
呆呆望著空盪的機車後座，我看到了不該見到的幻影。,呆呆 望 著 空盪 的 機車 後座 我 看到 了 不 該 見到 的 幻影,15,呆呆(1925) 望(32727) 著(1004687) 空盪(129) 的(16029838) 機車(2826) 後座(1758) 我(3033032) 看到(159419) 了(3199291) 不(2282521) 該(148369) 見到(30619) 的(16029838) 幻影(1440),{'High': 15},"{'Unknown': 6, '第1級': 4, '第3級': 1, '第1*級': 1, '第4*級': 1, '第4級': 1, '第7級': 1}",0,Y,N,N,N
頓時之間，振作的勇氣萎縮如洩了氣的氣球。,頓時 之間 振作 的 勇氣 萎縮 如 洩 了 氣 的 氣球,12,頓時(8363) 之間(117932) 振作(2776) 的(16029838) 勇氣(15221) 萎縮(2240) 如(195069) 洩(1061) 了(3199291) 氣(53111) 的(16029838) 氣球(2514),{'High': 12},"{'第6級': 2, '第4級': 1, '第5級': 1, '第1級': 2, '第4*級': 1, 'Unknown': 4, '第7級': 1}",0,Y,N,N,N
我害怕在騎車的時候，背後空虛的冷空氣，會讓我想念曾經擁抱過我的體溫。,我 害怕 在 騎車 的 時候 背後 空虛 的 冷 空氣 會 讓 我 想念 曾經 擁抱 過 我 的 體溫,21,我(3033032) 害怕(30308) 在(3284238) 騎車(1473) 的(16029838) 時候(199970) 背後(22697) 空虛(3953) 的(16029838) 冷(17629) 空氣(18137) 會(1014977) 讓(526314) 我(3033032) 想念(3711) 曾經(52970) 擁抱(8580) 過(412878) 我(3033032) 的(16029838) 體溫(2962),{'High': 21},"{'第1級': 8, '第3*級': 1, '第1*級': 4, 'Unknown': 1, '第4*級': 1, '第6級': 1, '第2級': 1, '第4級': 2, '第5級': 2}",0,Y,N,N,N
我也害怕我那不再有乘客的車子，會驚慌的找不到一處停泊的站牌。,我 也 害怕 我 那 不再 有 乘客 的 車子 會 驚慌 的 找 不 到 一 處 停泊 的 站牌,21,我(3033032) 也(1590760) 害怕(30308) 我(3033032) 那(754138) 不再(51754) 有(2217079) 乘客(4311) 的(16029838) 車子(15933) 會(1014977) 驚慌(3439) 的(16029838) 找(108128) 不(2282521) 到(546906) 一(3701681) 處(84410) 停泊(1420) 的(16029838) 站牌(312),{'High': 21},"{'第1級': 13, '第3*級': 1, 'Unknown': 3, '第4*級': 1, '第1*級': 1, '第6級': 1, '第7級': 1}",0,Y,N,N,N
強忍著幾乎脫韁的情緒，我說服自己還是到出去呼吸一些久違的新鮮空氣。,強忍 著 幾乎 脫韁 的 情緒 我 說服 自己 還是 到 出去 呼吸 一些 久違 的 新鮮 空氣,18,強忍(844) 著(1004687) 幾乎(74298) 脫韁(255) 的(16029838) 情緒(66126) 我(3033032) 說服(11945) 自己(744739) 還是(155231) 到(546906) 出去(20922) 呼吸(17817) 一些(156929) 久違(543) 的(16029838) 新鮮(9966) 空氣(18137),{'High': 18},"{'Unknown': 5, '第4級': 2, '第1級': 4, '第5級': 2, '第1*級': 4, '第3級': 1}",0,Y,N,N,N
積壓在胸中苦悶的嘆息，再不釋放可是會令人窒息。,積壓 在 胸 中 苦悶 的 嘆息 再 不 釋放 可是 會 令 人 窒息,15,積壓(551) 在(3284238) 胸(11307) 中(1011729) 苦悶(1490) 的(16029838) 嘆息(3167) 再(326207) 不(2282521) 釋放(6788) 可是(125487) 會(1014977) 令(128742) 人(1550512) 窒息(2135),{'High': 15},"{'第7級': 1, '第1*級': 4, '第5級': 2, 'Unknown': 1, '第6級': 4, '第1級': 3}",0,Y,N,N,N
於是，繞過山上的道路，邂逅幾陣奢望許久的爽朗涼風，用力吐出鬱積的苦悶，然後，換取輕淡的空氣。,於是 繞過 山 上 的 道路 邂逅 幾 陣 奢望 許久 的 爽朗 涼風 用力 吐出 鬱積 的 苦悶 然後 換取 輕淡 的 空氣,24,於是(108155) 繞過(2678) 山(54936) 上(1233218) 的(16029838) 道路(15812) 邂逅(1492) 幾(229415) 陣(26383) 奢望(835) 許久(3799) 的(16029838) 爽朗(900) 涼風(759) 用力(13072) 吐出(2917) 鬱積(213) 的(16029838) 苦悶(1490) 然後(156193) 換取(2567) 輕淡(13) 的(16029838) 空氣(18137),"{'High': 23, 'Low': 1}","{'第4*級': 2, 'Unknown': 5, '第1*級': 3, '第1級': 6, '第7級': 3, '第4級': 2, '第6級': 3}",0,Y,Y,N,N
清新的氧氣滲透入血液，很快的散佈到缺氧已久的細胞裡，頹靡的軀殼，似乎也因此慢慢找回一些活力。,清新 的 氧氣 滲透入 血液 很 快 的 散佈 到 缺氧 已 久 的 細胞 裡 頹靡 的 軀殼 似乎 也 因此 慢慢 找回 一些 活力,26,清新(2258) 的(16029838) 氧氣(2091) 滲透入(23) 血液(9800) 很(715675) 快(116207) 的(16029838) 散佈(1357) 到(546906) 缺氧(278) 已(215610) 久(68086) 的(16029838) 細胞(22817) 裡(520435) 頹靡(37) 的(16029838) 軀殼(499) 似乎(85481) 也(1590760) 因此(184606) 慢慢(36056) 找回(2832) 一些(156929) 活力(10454),"{'High': 24, 'Low': 2}","{'第6級': 4, '第1級': 8, 'Unknown': 6, '第5級': 2, '第1*級': 3, '第3級': 1, '第4*級': 2}",1,Y,Y,N,N
也許，低迷的心情已經慢慢淡去了吧。,也許 低迷 的 心情 已經 慢慢 淡去 了 吧,9,也許(68286) 低迷(693) 的(16029838) 心情(33611) 已經(245160) 慢慢(36056) 淡去(48) 了(3199291) 吧(184477),"{'High': 8, 'Low': 1}","{'第3*級': 2, '第7級': 1, '第1級': 2, '第2級': 1, 'Unknown': 3}",0,Y,N,N,N
我決定繼續轉入城市，在漫無目的遊走中，我想要以乘風瀏覽，一路宣洩所有的傷悲。,我 決定 繼續 轉入 城市 在 漫無目的 遊走 中 我 想要 以 乘風 瀏覽 一路 宣洩 所有 的 傷悲,19,我(3033032) 決定(101837) 繼續(80649) 轉入(1610) 城市(32018) 在(3284238) 漫無目的(345) 遊走(1459) 中(1011729) 我(3033032) 想要(63278) 以(547785) 乘風(264) 瀏覽(2375) 一路(14840) 宣洩(1549) 所有(146771) 的(16029838) 傷悲(283),{'High': 19},"{'第1級': 3, '第2級': 2, '第4級': 1, 'Unknown': 6, '第3級': 1, '第1*級': 1, '第7級': 2, '第5級': 1, '第6級': 2}",1,Y,N,N,N
街頭仍舊沸騰著騷動的靈魂，而我只是一縷大病初癒的孤魂，茫然的穿梭中，似乎莫名的想尋覓些什麼。,街頭 仍舊 沸騰 著 騷動 的 靈魂 而 我 只 是 一 縷 大病初癒 的 孤魂 茫然 的 穿梭 中 似乎 莫名 的 想 尋覓 些 什麼,27,街頭(6382) 仍舊(5748) 沸騰(2352) 著(1004687) 騷動(3791) 的(16029838) 靈魂(20244) 而(937923) 我(3033032) 只(436725) 是(4642407) 一(3701681) 縷(1298) 大病初癒(Unknown) 的(16029838) 孤魂(82) 茫然(3928) 的(16029838) 穿梭(3269) 中(1011729) 似乎(85481) 莫名(3334) 的(16029838) 想(449884) 尋覓(1691) 些(159879) 什麼(431321),"{'High': 25, 'Low': 2}","{'第5級': 4, '第6級': 6, 'Unknown': 5, '第1級': 9, '第1*級': 1, '第7級': 2}",1,Y,Y,N,N
或許是遺漏的平靜感覺，或許是逸逃的所有感官，或許是躲藏的橘色心情，好像都是，但也似乎不只如此。,或許 是 遺漏 的 平靜 感覺 或許 是 逸逃 的 所有 感官 或許 是 躲藏 的 橘色 心情 好像 都 是 但 也 似乎 不只 如此,26,或許(60077) 是(4642407) 遺漏(1509) 的(16029838) 平靜(13986) 感覺(91265) 或許(60077) 是(4642407) 逸逃(Unknown) 的(16029838) 所有(146771) 感官(6197) 或許(60077) 是(4642407) 躲藏(1566) 的(16029838) 橘色(1291) 心情(33611) 好像(67024) 都(1125846) 是(4642407) 但(597124) 也(1590760) 似乎(85481) 不只(20841) 如此(133083),"{'High': 25, 'Low': 1}","{'第4級': 3, '第1級': 9, '第6級': 2, '第4*級': 1, '第3*級': 2, 'Unknown': 3, '第2級': 3, '第7級': 1, '第5級': 2}",0,Y,Y,N,N
金黃色的麥當勞M字招牌，閃亮的映入眼簾。,金黃色 的 麥當勞 M 字 招牌 閃亮 的 映入 眼簾,10,金黃色(1302) 的(16029838) 麥當勞(1642) M(Unknown) 字(75654) 招牌(3940) 閃亮(2264) 的(16029838) 映入(883) 眼簾(1194),"{'High': 9, 'Low': 1}","{'Unknown': 4, '第1級': 3, '第5級': 1, '第6級': 1, '第7級': 1}",2,Y,N,N,N
心頭剎時一陣酸疼，我的視野無助地衍生迷惘的幻覺。,心頭 剎時 一 陣 酸疼 我 的 視野 無助 地 衍生 迷惘 的 幻覺,14,心頭(6587) 剎時(426) 一(3701681) 陣(26383) 酸疼(13) 我(3033032) 的(16029838) 視野(7815) 無助(4402) 地(754998) 衍生(3265) 迷惘(1406) 的(16029838) 幻覺(3644),"{'High': 13, 'Low': 1}","{'第6級': 3, 'Unknown': 3, '第1級': 4, '第4級': 1, '第5級': 2, '第7級': 1}",0,Y,N,N,N
望穿樓上的透明落地玻璃，我看見了那個熟悉的角落，浮現一幕幕的幻影。,望穿 樓上 的 透明 落地 玻璃 我 看見 了 那 個 熟悉 的 角落 浮現 一幕幕 的 幻影,18,望穿(41) 樓上(2885) 的(16029838) 透明(5815) 落地(3127) 玻璃(11698) 我(3033032) 看見(56420) 了(3199291) 那(754138) 個(2296574) 熟悉(20265) 的(16029838) 角落(11104) 浮現(6931) 一幕幕(484) 的(16029838) 幻影(1440),"{'Low': 1, 'High': 17}","{'Unknown': 4, '第2*級': 1, '第1級': 6, '第5級': 2, '第4級': 1, '第1*級': 1, '第4*級': 1, '第6級': 1, '第7級': 1}",1,Y,N,N,N
為何我會如此不爭氣的想起一些回憶呢？,為何 我 會 如此 不 爭氣 的 想起 一些 回憶 呢,11,為何(25238) 我(3033032) 會(1014977) 如此(133083) 不(2282521) 爭氣(671) 的(16029838) 想起(25243) 一些(156929) 回憶(17740) 呢(204566),{'High': 11},"{'第5級': 3, '第1級': 4, '第1*級': 2, '第7級': 1, '第4級': 1}",0,Y,N,N,N
恍惚的時光交錯裡，我看到了纏綿過的殘影，所有的主角早已散場，只留下囚禁在那一個回憶時空的心情，在我無意錯入時，勾起一陣陣的惆悵與心傷。,恍惚 的 時光 交錯 裡 我 看到 了 纏綿 過 的 殘影 所有 的 主角 早已 散場 只 留下 囚禁 在 那 一 個 回憶 時空 的 心情 在 我 無意 錯入 時 勾起 一陣陣 的 惆悵 與 心傷,39,恍惚(2026) 的(16029838) 時光(10444) 交錯(3079) 裡(520435) 我(3033032) 看到(159419) 了(3199291) 纏綿(761) 過(412878) 的(16029838) 殘影(66) 所有(146771) 的(16029838) 主角(20334) 早已(21910) 散場(299) 只(436725) 留下(29992) 囚禁(2369) 在(3284238) 那(754138) 一(3701681) 個(2296574) 回憶(17740) 時空(7773) 的(16029838) 心情(33611) 在(3284238) 我(3033032) 無意(7221) 錯入(3) 時(623734) 勾起(1075) 一陣陣(1062) 的(16029838) 惆悵(816) 與(968432) 心傷(22),"{'High': 36, 'Low': 3}","{'第6級': 3, '第1級': 10, '第5級': 4, '第1*級': 6, 'Unknown': 8, '第7級': 2, '第2級': 1, '第4級': 1, '第3*級': 3, '第4*級': 1}",1,Y,Y,N,N
我想逃離開可能決堤的狼狽情緒，趕緊繞遠了路，想遺忘方才不該憶起的情景與心緒。,我 想 逃 離開 可能 決堤 的 狼狽 情緒 趕緊 繞 遠 了 路 想 遺忘 方才 不 該 憶起 的 情景 與 心緒,24,我(3033032) 想(449884) 逃(9749) 離開(71748) 可能(271025) 決堤(239) 的(16029838) 狼狽(2116) 情緒(66126) 趕緊(11897) 繞(9935) 遠(57546) 了(3199291) 路(74635) 想(449884) 遺忘(5223) 方才(3923) 不(2282521) 該(148369) 憶起(947) 的(16029838) 情景(7266) 與(968432) 心緒(906),{'High': 24},"{'第1級': 8, '第4*級': 4, '第2級': 2, 'Unknown': 3, '第6級': 2, '第5級': 4, '第7級': 1}",0,Y,Y,N,N
然而，就像是開啟了潘朵拉盒子一樣，所有封印的感覺，只是毫不留情的敏銳了每一份回憶的知覺。,然而 就 像是 開啟 了 潘朵拉 盒子 一樣 所有 封印 的 感覺 只是 毫不 留情 的 敏銳 了 每 一 份 回憶 的 知覺,24,然而(94482) 就(1737544) 像是(49912) 開啟(7461) 了(3199291) 潘朵拉(228) 盒子(5035) 一樣(188109) 所有(146771) 封印(375) 的(16029838) 感覺(91265) 只是(96536) 毫不(14921) 留情(1561) 的(16029838) 敏銳(5400) 了(3199291) 每(333357) 一(3701681) 份(53198) 回憶(17740) 的(16029838) 知覺(7081),{'High': 24},"{'第5級': 4, '第1級': 5, 'Unknown': 6, '第6級': 1, '第2*級': 1, '第1*級': 2, '第2級': 2, '第3*級': 1, '第4級': 1, '第7級': 1}",1,Y,Y,N,Y
於是，回憶狠狠地將我捲入往昔的時空裡，一再的強迫我看見在潛藏在各個角落裡的殘影。,於是 回憶 狠狠地 將 我 捲入 往昔 的 時空 裡 一再 的 強迫 我 看見 在 潛藏 在 各 個 角落 裡 的 殘影,24,於是(108155) 回憶(17740) 狠狠地(136) 將(448374) 我(3033032) 捲入(2706) 往昔(1776) 的(16029838) 時空(7773) 裡(520435) 一再(12315) 的(16029838) 強迫(9130) 我(3033032) 看見(56420) 在(3284238) 潛藏(2172) 在(3284238) 各(243023) 個(2296574) 角落(11104) 裡(520435) 的(16029838) 殘影(66),"{'High': 23, 'Low': 1}","{'第4*級': 2, '第5級': 5, 'Unknown': 2, '第1級': 6, '第6級': 3, '第1*級': 5, '第2級': 1}",1,Y,Y,N,N
我茫然地望著街頭上，公園裡，餐館內，湖泊邊，熟悉的身影無聲的演著我們的故事，那是曾經有過的甜蜜，但此刻卻是如此苦澀而心痛。,我 茫然 地 望 著 街頭 上 公園 裡 餐館 內 湖泊 邊 熟悉 的 身影 無聲 的 演 著 我們 的 故事 那 是 曾經 有 過 的 甜蜜 但 此刻 卻 是 如此 苦澀 而 心痛,38,我(3033032) 茫然(3928) 地(754998) 望(32727) 著(1004687) 街頭(6382) 上(1233218) 公園(13910) 裡(520435) 餐館(2626) 內(183051) 湖泊(1394) 邊(123152) 熟悉(20265) 的(16029838) 身影(6212) 無聲(3059) 的(16029838) 演(11552) 著(1004687) 我們(979260) 的(16029838) 故事(101316) 那(754138) 是(4642407) 曾經(52970) 有(2217079) 過(412878) 的(16029838) 甜蜜(3026) 但(597124) 此刻(12496) 卻(333007) 是(4642407) 如此(133083) 苦澀(1273) 而(937923) 心痛(1590),{'High': 38},"{'第1級': 11, '第6級': 1, 'Unknown': 8, '第5級': 6, '第1*級': 4, '第3級': 1, '第7級': 2, '第4*級': 1, '第2級': 2, '第4級': 2}",0,Y,Y,N,N
原來，在心碎的那一瞬間，我整個靈魂也被撕扯成碎片，我那不甘心放手的破碎孤魂，飄散到每一處無法遺忘的時空裡，成了一縷縷逃不出回憶的地縛靈。,原來 在 心碎 的 那 一瞬間 我 整個 靈魂 也 被 撕扯成 碎片 我 那 不 甘心 放手 的 破碎 孤魂 飄散 到 每 一 處 無法 遺忘 的 時空 裡 成 了 一縷縷 逃不出 回憶 的 地縛靈,38,原來(49649) 在(3284238) 心碎(1063) 的(16029838) 那(754138) 一瞬間(4119) 我(3033032) 整個(Unknown) 靈魂(20244) 也(1590760) 被(540683) 撕扯成(10) 碎片(3842) 我(3033032) 那(754138) 不(2282521) 甘心(2685) 放手(3810) 的(16029838) 破碎(2275) 孤魂(82) 飄散(628) 到(546906) 每(333357) 一(3701681) 處(84410) 無法(150606) 遺忘(5223) 的(16029838) 時空(7773) 裡(520435) 成(76470) 了(3199291) 一縷縷(82) 逃不出(11) 回憶(17740) 的(16029838) 地縛靈(Unknown),"{'High': 32, 'Low': 6}","{'第3*級': 1, '第1*級': 3, '第6級': 4, '第1級': 12, 'Unknown': 10, '第2級': 1, '第5級': 5, '第7級': 1, '第4*級': 1}",5,Y,N,N,N
我所看見的殘影，是我那流浪到往昔的幾縷遊魂，眷戀在無可自拔的自欺裡。,我 所 看見 的 殘影 是 我 那 流浪 到 往昔 的 幾 縷 遊魂 眷戀 在 無可 自拔 的 自欺 裡,22,我(3033032) 所(527327) 看見(56420) 的(16029838) 殘影(66) 是(4642407) 我(3033032) 那(754138) 流浪(4123) 到(546906) 往昔(1776) 的(16029838) 幾(229415) 縷(1298) 遊魂(283) 眷戀(873) 在(3284238) 無可(6563) 自拔(1457) 的(16029838) 自欺(305) 裡(520435),"{'High': 21, 'Low': 1}","{'第1級': 9, '第2級': 1, '第1*級': 3, 'Unknown': 5, '第5級': 1, '第6級': 1, '第7級': 2}",0,Y,N,N,N
這一個曾經愛過的城市裡，失落了太多回憶的遊魂。,這 一 個 曾經 愛 過 的 城市 裡 失落 了 太多 回憶 的 遊魂,15,這(2114032) 一(3701681) 個(2296574) 曾經(52970) 愛(124337) 過(412878) 的(16029838) 城市(32018) 裡(520435) 失落(4103) 了(3199291) 太多(30757) 回憶(17740) 的(16029838) 遊魂(283),{'High': 15},"{'第1級': 6, '第4級': 1, '第1*級': 2, '第3級': 1, '第6級': 1, 'Unknown': 3, '第5級': 1}",0,Y,N,N,N
我微薄的振作，根本喚不回那些無法忘懷過去的地縛靈，於是，只能任由那一縷縷破碎的遊魂，傻傻的守候在曾經擁有的美好回憶裡。,我 微薄 的 振作 根本 喚 不 回 那些 無法 忘懷 過去 的 地縛靈 於是 只 能 任由 那 一縷縷 破碎 的 遊魂 傻傻 的 守候 在 曾經 擁有 的 美好 回憶 裡,33,我(3033032) 微薄(1091) 的(16029838) 振作(2776) 根本(66330) 喚(2952) 不(2282521) 回(92620) 那些(113704) 無法(150606) 忘懷(1419) 過去(88758) 的(16029838) 地縛靈(Unknown) 於是(108155) 只(436725) 能(582260) 任由(2193) 那(754138) 一縷縷(82) 破碎(2275) 的(16029838) 遊魂(283) 傻傻(612) 的(16029838) 守候(881) 在(3284238) 曾經(52970) 擁有(55809) 的(16029838) 美好(17327) 回憶(17740) 裡(520435),"{'High': 31, 'Low': 2}","{'第1級': 8, '第7級': 3, '第5級': 4, '第4*級': 3, 'Unknown': 6, '第2級': 1, '第4級': 2, '第1*級': 4, '第6級': 2}",2,Y,Y,N,N
大部分的魂魄都背棄了我的軀體，自甘成為一縷回憶的遊魂。,大部分 的 魂魄 都 背棄 了 我 的 軀體 自甘 成為 一 縷 回憶 的 遊魂,16,大部分(32534) 的(16029838) 魂魄(1028) 都(1125846) 背棄(618) 了(3199291) 我(3033032) 的(16029838) 軀體(2323) 自甘(146) 成為(143834) 一(3701681) 縷(1298) 回憶(17740) 的(16029838) 遊魂(283),{'High': 16},"{'Unknown': 4, '第1級': 6, '第7級': 3, '第6級': 1, '第5級': 2}",1,Y,N,N,N
於是，我只能繼續過著失魂落魄的空白日子，將自己化身傀儡，在生活的舞台上，隨著茫然的絲線，擺出著連自己都不明白表情與舉動。,於是 我 只 能 繼續 過 著 失魂落魄 的 空白 日子 將 自己 化身 傀儡 在 生活 的 舞台 上 隨著 茫然 的 絲線 擺出 著 連 自己 都 不 明白 表情 與 舉動,34,於是(108155) 我(3033032) 只(436725) 能(582260) 繼續(80649) 過(412878) 著(1004687) 失魂落魄(4) 的(16029838) 空白(4214) 日子(28378) 將(448374) 自己(744739) 化身(2843) 傀儡(1389) 在(3284238) 生活(213189) 的(16029838) 舞台(13305) 上(1233218) 隨著(32948) 茫然(3928) 的(16029838) 絲線(880) 擺出(3015) 著(1004687) 連(91153) 自己(744739) 都(1125846) 不(2282521) 明白(50011) 表情(25210) 與(968432) 舉動(6854),"{'High': 33, 'Low': 1}","{'第4*級': 2, '第1級': 7, '第1*級': 6, '第4級': 4, 'Unknown': 4, '第5級': 4, '第3*級': 2, '第6級': 2, '第7級': 2, '第3級': 1}",1,Y,Y,N,N
一九四四年冬季，在戰火的碾壓下成為廢墟的華沙，斷壁殘垣被灰色的冰雪半遮半掩，更顯破敗與荒涼。,一九四四年 冬季 在 戰火 的 碾壓 下 成為 廢墟 的 華沙 斷壁 殘垣 被 灰色 的 冰雪 半遮半掩 更顯 破敗 與 荒涼,22,一九四四年(1032) 冬季(3660) 在(3284238) 戰火(1672) 的(16029838) 碾壓(52) 下(329549) 成為(143834) 廢墟(2240) 的(16029838) 華沙(400) 斷壁(121) 殘垣(170) 被(540683) 灰色(5356) 的(16029838) 冰雪(1082) 半遮半掩(Unknown) 更顯(Unknown) 破敗(541) 與(968432) 荒涼(1910),"{'High': 19, 'Low': 3}","{'Unknown': 10, '第1*級': 2, '第7級': 2, '第1級': 3, '第5級': 1, '第6級': 2, '第2級': 1, '第4*級': 1}",2,Y,Y,N,N
