sentence,sentence_preprocessed,sentence_length,word_freq,high_low_freq,word_level,long_word_count,is_complete_sentence,is_complete_context,is_blacklist,is_greylist
籠罩元宵歡慶氣氛的台南縣鹽水鎮，昨(廿五)日傍晚發生製造炮城的沖天炮地下工廠大爆炸，方圓一百公尺範圍內農作物被夷為平地，現場血肉橫飛，已知死亡一人、五人失蹤，從現場狀況判斷，失蹤者凶多吉少；南縣警、消與民間搜救團體漏夜在現場搜尋屍塊。,籠罩 元宵 歡慶 氣氛 的 台南縣 鹽水鎮 昨 廿五 日 傍晚 發生 製造 炮城 的 沖天炮 地下 工廠 大 爆炸 方圓 一百 公尺 範圍 內 農作物 被 夷為平地 現場 血肉橫飛 已 知 死亡 一 人 五 人 失蹤 從 現場 狀況 判斷 失蹤 者 凶多吉少 南縣 警 消 與 民間 搜救 團體 漏夜 在 現場 搜尋 屍塊,57,籠罩(3849) 元宵(362) 歡慶(440) 氣氛(16132) 的(16029838) 台南縣(404) 鹽水鎮(28) 昨(531) 廿五(244) 日(94041) 傍晚(6389) 發生(129211) 製造(28512) 炮城(10) 的(16029838) 沖天炮(63) 地下(2707) 工廠(16192) 大(525780) 爆炸(5645) 方圓(968) 一百(17093) 公尺(19233) 範圍(24784) 內(183051) 農作物(1576) 被(540683) 夷為平地(239) 現場(15949) 血肉橫飛(3) 已(215610) 知(108500) 死亡(34520) 一(3701681) 人(1550512) 五(112649) 人(1550512) 失蹤(5389) 從(496546) 現場(15949) 狀況(44199) 判斷(22780) 失蹤(5389) 者(423504) 凶多吉少(274) 南縣(62) 警(964) 消(3427) 與(968432) 民間(16236) 搜救(906) 團體(30852) 漏夜(78) 在(3284238) 現場(15949) 搜尋(7345) 屍塊(Unknown),"{'High': 50, 'Low': 7}","{'第6級': 1, '第4*級': 10, 'Unknown': 21, '第1級': 8, '第5級': 7, '第3級': 3, '第4級': 3, '第7級': 1, '第2級': 1, '第1*級': 2}",7,Y,Y,N,N
台南縣副縣長曾旭正趕赴現場指揮救災，並隨時將現場狀況向總統府呈報。,台南縣 副 縣長 曾旭正 趕赴 現場 指揮 救災 並 隨時 將 現場 狀況 向 總統府 呈報,16,台南縣(404) 副(21458) 縣長(2523) 曾旭正(11) 趕赴(611) 現場(15949) 指揮(13870) 救災(692) 並(442790) 隨時(21195) 將(448374) 現場(15949) 狀況(44199) 向(231672) 總統府(1378) 呈報(799),"{'High': 15, 'Low': 1}","{'Unknown': 5, '第5級': 4, '第4*級': 4, '第4級': 1, '第2級': 1, '第7級': 1}",3,Y,Y,N,Y
總統府昨晚開會決定，基於救災優先並避免影響警力調度等考量，陳水扁總統取消原定今晚參加主持太子爺炮城啟炮儀式，至於具有百年歷史的鹽水鎮元宵節燃放蜂炮民俗活動，台南縣政府也決定不受影響，照常舉行。,總統府 昨晚 開會 決定 基於 救災 優先 並 避免 影響 警力 調度 等 考量 陳水扁 總統 取消 原定 今晚 參加 主持 太子爺 炮城 啟炮 儀式 至於 具有 百 年 歷史 的 鹽水鎮 元宵節 燃放 蜂炮 民俗 活動 台南縣 政府 也 決定 不 受 影響 照常 舉行,46,總統府(1378) 昨晚(5400) 開會(6368) 決定(101837) 基於(12809) 救災(692) 優先(6299) 並(442790) 避免(33211) 影響(95840) 警力(353) 調度(1899) 等(327380) 考量(9481) 陳水扁(1345) 總統(23662) 取消(5437) 原定(390) 今晚(7367) 參加(42962) 主持(9827) 太子爺(144) 炮城(10) 啟炮(Unknown) 儀式(13945) 至於(39363) 具有(60702) 百(24843) 年(514736) 歷史(96060) 的(16029838) 鹽水鎮(28) 元宵節(377) 燃放(164) 蜂炮(71) 民俗(2342) 活動(85743) 台南縣(404) 政府(92663) 也(1590760) 決定(101837) 不(2282521) 受(109982) 影響(95840) 照常(1180) 舉行(17660),"{'High': 42, 'Low': 4}","{'第4*級': 3, 'Unknown': 14, '第3*級': 2, '第2級': 4, '第6級': 4, '第5級': 6, '第3級': 3, '第7級': 1, '第4級': 4, '第1級': 5}",6,Y,Y,N,Y
這件地下爆竹工廠爆炸案發生於昨天下午五時四十分左右，爆炸現場在鹽水鎮下中里四鄰卅四號，為一處鐵皮屋搭蓋、面積約二百坪的獨立屋，位處一大片玉米田中央。,這 件 地下 爆竹 工廠 爆炸 案 發生 於 昨天 下午 五時 四十分 左右 爆炸 現場 在 鹽水鎮 下中里 四鄰 卅四號 為 一 處 鐵皮屋 搭蓋 面積 約 二百 坪 的 獨立屋 位處 一 大 片 玉米田 中央,38,這(2114032) 件(139257) 地下(2707) 爆竹(330) 工廠(16192) 爆炸(5645) 案(11719) 發生(129211) 於(327210) 昨天(12735) 下午(20045) 五時(298) 四十分(300) 左右(33714) 爆炸(5645) 現場(15949) 在(3284238) 鹽水鎮(28) 下中里(Unknown) 四鄰(29) 卅四號(4) 為(761341) 一(3701681) 處(84410) 鐵皮屋(169) 搭蓋(173) 面積(6281) 約(47731) 二百(3266) 坪(2297) 的(16029838) 獨立屋(2) 位處(363) 一(3701681) 大(525780) 片(71870) 玉米田(277) 中央(46180),"{'High': 33, 'Low': 5}","{'第1級': 7, '第1*級': 2, 'Unknown': 16, '第4級': 1, '第5級': 6, '第4*級': 2, '第3級': 1, '第3*級': 2, '第2級': 1}",7,Y,N,N,N
爆炸案發生時轟然巨響，讓人誤以為是鹽水鎮市區炮城提前施放，連遠在新營市護鎮里的居民亦耳聞轟隆聲響。,爆炸案 發生 時 轟然 巨響 讓 人 誤以為 是 鹽水鎮 市區 炮城 提前 施放 連 遠 在 新營市 護鎮里 的 居民 亦 耳聞 轟隆 聲響,25,爆炸案(175) 發生(129211) 時(623734) 轟然(697) 巨響(1307) 讓(526314) 人(1550512) 誤以為(2491) 是(4642407) 鹽水鎮(28) 市區(3749) 炮城(10) 提前(3167) 施放(369) 連(91153) 遠(57546) 在(3284238) 新營市(17) 護鎮里(Unknown) 的(16029838) 居民(13554) 亦(68507) 耳聞(923) 轟隆(991) 聲響(5117),"{'High': 21, 'Low': 4}","{'Unknown': 9, '第3級': 1, '第3*級': 3, '第7級': 2, '第2級': 2, '第1級': 3, '第5級': 2, '第1*級': 1, '第4*級': 1, '第6級': 1}",5,Y,Y,N,N
位在現場附近的下中里四十六號連棟民宅，玻璃門窗禁不起氣爆衝擊，「玻璃雨」嘩啦啦從天空灑下來，佈滿了百餘公尺長巷。,位在 現場 附近 的 下中里 四十六號 連棟 民宅 玻璃 門窗 禁不起 氣爆 衝擊 玻璃 雨 嘩啦啦 從 天空 灑下來 佈滿 了 百餘 公尺 長 巷,25,位在(30) 現場(15949) 附近(32204) 的(16029838) 下中里(Unknown) 四十六號(10) 連棟(Unknown) 民宅(637) 玻璃(11698) 門窗(1382) 禁不起(400) 氣爆(48) 衝擊(8508) 玻璃(11698) 雨(16736) 嘩啦啦(297) 從(496546) 天空(16342) 灑下來(58) 佈滿(1477) 了(3199291) 百餘(1429) 公尺(19233) 長(107092) 巷(2863),"{'Low': 6, 'High': 19}","{'Unknown': 12, '第4*級': 2, '第1*級': 3, '第1級': 1, '第4級': 4, '第7級': 1, '第6級': 2}",5,Y,N,N,N
據目擊者指出，爆炸發生時，產生巨大黑色濃煙，直衝雲霄呈蕈狀雲，瞬間火光照亮週遭，畫面猶如被飛機投擲炸彈一般。,據 目擊 者 指出 爆炸 發生 時 產生 巨大 黑色 濃煙 直 衝 雲霄 呈 蕈狀雲 瞬間 火光 照亮 週遭 畫面 猶如 被 飛機 投擲 炸彈 一般,27,據(24392) 目擊(2192) 者(423504) 指出(38456) 爆炸(5645) 發生(129211) 時(623734) 產生(82753) 巨大(22154) 黑色(16240) 濃煙(701) 直(32801) 衝(8475) 雲霄(443) 呈(11604) 蕈狀雲(42) 瞬間(9169) 火光(2291) 照亮(2459) 週遭(550) 畫面(17554) 猶如(5976) 被(540683) 飛機(18598) 投擲(737) 炸彈(3887) 一般(80732),"{'High': 26, 'Low': 1}","{'第4*級': 3, '第6級': 6, 'Unknown': 7, '第5級': 3, '第3級': 1, '第3*級': 2, '第4級': 1, '第7級': 2, '第2級': 1, '第1*級': 1}",1,Y,N,N,N
而除了碎裂一地的廠房設施破片、附近居家玻璃碎片外，肉眼還能看到被炸成一塊塊的屍體肉塊，警、消人員在樹子腳部落巷道地面、居家四樓頂、遮陽棚、鐵窗欄柵、玉米田裡均撿獲罹難者屍塊，令人怵目驚心。,而 除了 碎裂 一 地 的 廠房 設施 破片 附近 居家 玻璃 碎片 外 肉眼 還 能 看到 被 炸成 一塊塊 的 屍體 肉塊 警 消 人員 在 樹子腳 部落 巷道 地面 居家 四樓 頂 遮陽棚 鐵窗 欄柵 玉米田 裡 均 撿 獲 罹難 者 屍塊 令 人 怵目驚心,49,而(937923) 除了(75964) 碎裂(866) 一(3701681) 地(754998) 的(16029838) 廠房(1191) 設施(5472) 破片(63) 附近(32204) 居家(1606) 玻璃(11698) 碎片(3842) 外(109310) 肉眼(1562) 還(625086) 能(582260) 看到(159419) 被(540683) 炸成(217) 一塊塊(741) 的(16029838) 屍體(13598) 肉塊(371) 警(964) 消(3427) 人員(49261) 在(3284238) 樹子腳(Unknown) 部落(17699) 巷道(545) 地面(12348) 居家(1606) 四樓(650) 頂(16472) 遮陽棚(6) 鐵窗(349) 欄柵(74) 玉米田(277) 裡(520435) 均(27783) 撿(3532) 獲(11610) 罹難(432) 者(423504) 屍塊(Unknown) 令(128742) 人(1550512) 怵目驚心(239),"{'High': 44, 'Low': 5}","{'第5級': 7, '第3*級': 1, '第7級': 2, '第1級': 5, 'Unknown': 21, '第6級': 6, '第1*級': 5, '第4級': 1, '第2級': 1}",5,Y,Y,N,N
案發後確定死亡的是十二歲男童林靖傑，屍體掉落附近甘蔗園內，五位失蹤者為負責人徐吉明的妻子郭素杏(四十歲)、郭政儒(男、十七歲)、康豐源(男、五十四歲)、李月鳳(女、卅八歲)、林童的母親潘佳貝(卅三歲)，不排除已全部罹難；徐吉明(四十五歲)原也被列入失蹤名單，不過據潘佳貝的丈夫表示，案發後不久才在嘉義與徐分手，應該逃過一劫，但徐某迄昨天深夜仍未出面。,案發 後 確定 死亡 的 是 十二 歲 男童 林靖傑 屍體 掉落 附近 甘蔗園 內 五 位 失蹤 者 為 負責人 徐吉明 的 妻子 郭素杏 四十 歲 郭政儒 男 十七 歲 康豐源 男 五十四 歲 李月鳳 女 卅八 歲 林童 的 母親 潘佳貝 卅三 歲 不 排除 已 全部 罹難 徐吉明 四十五 歲 原 也 被 列入 失蹤 名單 不過 據 潘佳貝 的 丈夫 表示 案發 後 不久 才 在 嘉義 與 徐 分手 應該 逃過一劫 但 徐某 迄 昨天 深夜 仍 未 出面,84,案發(826) 後(422857) 確定(40181) 死亡(34520) 的(16029838) 是(4642407) 十二(22310) 歲(130085) 男童(392) 林靖傑(46) 屍體(13598) 掉落(2915) 附近(32204) 甘蔗園(60) 內(183051) 五(112649) 位(284809) 失蹤(5389) 者(423504) 為(761341) 負責人(3840) 徐吉明(Unknown) 的(16029838) 妻子(33898) 郭素杏(Unknown) 四十(15256) 歲(130085) 郭政儒(Unknown) 男(23928) 十七(7310) 歲(130085) 康豐源(Unknown) 男(23928) 五十四(735) 歲(130085) 李月鳳(Unknown) 女(51944) 卅八(33) 歲(130085) 林童(Unknown) 的(16029838) 母親(84326) 潘佳貝(Unknown) 卅三(29) 歲(130085) 不(2282521) 排除(7750) 已(215610) 全部(34039) 罹難(432) 徐吉明(Unknown) 四十五(2971) 歲(130085) 原(33852) 也(1590760) 被(540683) 列入(3205) 失蹤(5389) 名單(6552) 不過(186226) 據(24392) 潘佳貝(Unknown) 的(16029838) 丈夫(31006) 表示(74452) 案發(826) 後(422857) 不久(34049) 才(394539) 在(3284238) 嘉義(2515) 與(968432) 徐(3281) 分手(4597) 應該(165478) 逃過一劫(Unknown) 但(597124) 徐某(16) 迄(3998) 昨天(12735) 深夜(4741) 仍(92056) 未(101927) 出面(4199),"{'High': 69, 'Low': 15}","{'Unknown': 30, '第1級': 19, '第4級': 2, '第4*級': 8, '第6級': 5, '第5級': 6, '第1*級': 6, '第3級': 3, '第2級': 5}",14,Y,Y,N,Y
死亡與失蹤者均住在鹽水鎮下中里「樹子腳」部落，由於係地下爆竹工廠，沒有工廠登記證也沒有列入當地消防單位安檢記錄中，因此案發後，到底有多少人在這家工廠工作，難以查證。,死亡 與 失蹤 者 均 住在 鹽水鎮 下中里 樹子腳 部落 由於 係 地下 爆竹 工廠 沒有 工廠 登記證 也 沒有 列入 當地 消防 單位 安檢 記錄 中 因此 案發 後 到底 有 多少 人 在 這 家 工廠 工作 難以 查證,41,死亡(34520) 與(968432) 失蹤(5389) 者(423504) 均(27783) 住在(7545) 鹽水鎮(28) 下中里(Unknown) 樹子腳(Unknown) 部落(17699) 由於(88111) 係(9477) 地下(2707) 爆竹(330) 工廠(16192) 沒有(594280) 工廠(16192) 登記證(48) 也(1590760) 沒有(594280) 列入(3205) 當地(23011) 消防(639) 單位(23148) 安檢(221) 記錄(18871) 中(1011729) 因此(184606) 案發(826) 後(422857) 到底(41946) 有(2217079) 多少(50265) 人(1550512) 在(3284238) 這(2114032) 家(236822) 工廠(16192) 工作(220164) 難以(30294) 查證(1108),"{'High': 37, 'Low': 4}","{'第4*級': 6, '第5級': 4, 'Unknown': 11, '第6級': 4, '第4級': 4, '第1級': 10, '第1*級': 1, '第7級': 1}",4,Y,Y,N,N
這處地下爆竹工廠成立已有一段時間，負責人徐吉明原本從事花圈花籃生意，但他另在屋後搭建鐵皮屋，專門製造炮城用的沖天炮，最近元宵節生意應接不暇，趕工應市而埋下這場慘劇肇因，全案正由警方依法繼續偵辦。,這 處 地下 爆竹 工廠 成立 已 有 一 段 時間 負責人 徐吉明 原本 從事 花圈 花籃 生意 但 他 另 在 屋 後 搭建 鐵皮屋 專門 製造 炮城用 的 沖天炮 最近 元宵節 生意 應接不暇 趕工 應市 而 埋下 這 場 慘劇 肇因 全案 正 由 警方 依法 繼續 偵辦,50,這(2114032) 處(84410) 地下(2707) 爆竹(330) 工廠(16192) 成立(28506) 已(215610) 有(2217079) 一(3701681) 段(95980) 時間(213595) 負責人(3840) 徐吉明(Unknown) 原本(35765) 從事(22774) 花圈(306) 花籃(199) 生意(13520) 但(597124) 他(2487930) 另(138369) 在(3284238) 屋(30514) 後(422857) 搭建(1279) 鐵皮屋(169) 專門(13209) 製造(28512) 炮城用(Unknown) 的(16029838) 沖天炮(63) 最近(30174) 元宵節(377) 生意(13520) 應接不暇(216) 趕工(483) 應市(9) 而(937923) 埋下(1188) 這(2114032) 場(68915) 慘劇(771) 肇因(361) 全案(Unknown) 正(179334) 由(208604) 警方(8008) 依法(2242) 繼續(80649) 偵辦(354),"{'High': 45, 'Low': 5}","{'第1級': 8, 'Unknown': 18, '第4級': 3, '第4*級': 6, '第3級': 4, '第2級': 4, '第1*級': 1, '第7級': 3, '第5級': 1, '第3*級': 1, '第6級': 1}",7,Y,Y,N,Y
一年一度的鹽水鎮蜂炮祭典活動，昨(廿五)日啟炮後正式展開，今天元宵夜隨著巨無霸太子爺神像蜂炮城點燃，達到最高潮，全國各地民眾已紛紛湧入鹽水小鎮，推神轎犁炮城，體驗蜂炮衝擊的刺激感，一時之間，鹽水鎮熱鬧滾滾，連日本電視台都慕名而至，採訪紀錄這項兼具觀光的祭典活動。,一 年 一 度 的 鹽水鎮 蜂炮 祭典 活動 昨 廿五 日 啟炮 後 正式 展開 今天 元宵夜 隨著 巨無霸 太子爺 神像 蜂炮城 點燃 達到 最高潮 全 國 各 地 民眾 已 紛紛 湧入 鹽水 小鎮 推 神轎 犁 炮城 體驗 蜂炮 衝擊 的 刺激感 一時之間 鹽水鎮 熱鬧滾滾 連 日本 電視台 都 慕名 而 至 採訪 紀錄 這 項 兼具 觀光 的 祭典 活動,64,一(3701681) 年(514736) 一(3701681) 度(25018) 的(16029838) 鹽水鎮(28) 蜂炮(71) 祭典(2189) 活動(85743) 昨(531) 廿五(244) 日(94041) 啟炮(Unknown) 後(422857) 正式(23229) 展開(17154) 今天(73277) 元宵夜(22) 隨著(32948) 巨無霸(248) 太子爺(144) 神像(1682) 蜂炮城(Unknown) 點燃(3973) 達到(35670) 最高潮(392) 全(178642) 國(73377) 各(243023) 地(754998) 民眾(17097) 已(215610) 紛紛(14617) 湧入(1453) 鹽水(786) 小鎮(5758) 推(13235) 神轎(7) 犁(1424) 炮城(10) 體驗(15945) 蜂炮(71) 衝擊(8508) 的(16029838) 刺激感(151) 一時之間(1920) 鹽水鎮(28) 熱鬧滾滾(83) 連(91153) 日本(105587) 電視台(4618) 都(1125846) 慕名(409) 而(937923) 至(101530) 採訪(8722) 紀錄(14233) 這(2114032) 項(88887) 兼具(2204) 觀光(4478) 的(16029838) 祭典(2189) 活動(85743),"{'High': 54, 'Low': 10}","{'第1級': 13, '第3級': 2, 'Unknown': 24, '第2級': 4, '第3*級': 2, '第5級': 8, '第7級': 2, '第6級': 3, '第4*級': 3, '第4級': 3}",11,Y,Y,N,Y
昨天上午八時，鹽水鎮元宵節蜂炮祭典活動在武廟前廣場舉行啟炮儀式後，活動隨即正式展開，武廟神轎及花藝車輛開始第一天的繞境行程，白天分別繞行舊岸內保興宮、佰年宮；義稠里普照宮、義隆宮；下中里護濟宮、福王宮；後宅里永慶宮；舊營里天德宮；桐寮里王宮；治水路觀音坪。,昨天 上午 八時 鹽水鎮 元宵節 蜂炮 祭典 活動 在 武廟 前 廣場 舉行 啟炮 儀式 後 活動 隨即 正式 展開 武廟 神轎 及 花藝 車輛 開始 第一 天 的 繞境 行程 白天 分別 繞行 舊岸內 保興宮 佰年宮 義稠里 普照宮 義隆宮 下中里 護濟宮 福王宮 後宅里 永慶宮 舊營里 天德宮 桐寮里 王宮 治水路 觀音坪,51,昨天(12735) 上午(6241) 八時(307) 鹽水鎮(28) 元宵節(377) 蜂炮(71) 祭典(2189) 活動(85743) 在(3284238) 武廟(121) 前(272709) 廣場(8418) 舉行(17660) 啟炮(Unknown) 儀式(13945) 後(422857) 活動(85743) 隨即(10199) 正式(23229) 展開(17154) 武廟(121) 神轎(7) 及(304586) 花藝(122) 車輛(3098) 開始(245562) 第一(172544) 天(330413) 的(16029838) 繞境(110) 行程(5276) 白天(9386) 分別(25566) 繞行(581) 舊岸內(Unknown) 保興宮(Unknown) 佰年宮(Unknown) 義稠里(Unknown) 普照宮(Unknown) 義隆宮(Unknown) 下中里(Unknown) 護濟宮(Unknown) 福王宮(Unknown) 後宅里(Unknown) 永慶宮(Unknown) 舊營里(Unknown) 天德宮(8) 桐寮里(Unknown) 王宮(2044) 治水路(Unknown) 觀音坪(Unknown),"{'High': 31, 'Low': 20}","{'第1級': 6, 'Unknown': 27, '第2級': 4, '第1*級': 1, '第5級': 5, '第4級': 1, '第6級': 2, '第3*級': 1, '第2*級': 1, '第4*級': 1, '第7級': 2}",18,Y,Y,N,N
昨天下午六時，神轎再度由武廟出發繞境，此時天色已暗下來，也是蜂炮活動開始上場的時候，神轎分兩條路線行進，A線從北門社區、高興砂磚場、曾金印宅社區、土庫「上帝廟」，進入菜寮出十號道路經康樂路轉入余仙船巷內，出朝琴路再轉入文武街會合B線，再經由清泉路返回武廟；B線由武廟路過西門路轉入橋南街進「北帝殿」，再轉入南門路進入「朱玄宮」及社區一圈，折回月津路入「長成宮」及社區一圈，轉回南門路進福南宮境後，折回十號道路與A線會合。,昨天 下午 六時 神轎 再度 由 武廟 出發 繞境 此時 天色 已 暗下來 也 是 蜂炮 活動 開始 上場 的 時候 神轎 分 兩 條 路線 行進 A線 從 北門 社區 高興 砂磚場 曾金印宅 社區 土庫 上帝廟 進入 菜寮 出 十號 道路 經 康樂路 轉入 余仙船巷 內 出 朝琴路 再 轉入 文武街 會合 B線 再 經由 清泉路 返回 武廟 B線 由 武廟路 過 西門路 轉入 橋南街 進 北帝殿 再 轉入 南門路 進入 朱玄宮 及 社區 一 圈 折回 月津路 入 長成宮 及 社區 一 圈 轉回 南門路 進 福南宮 境 後 折回 十號 道路 與 A線 會合,97,昨天(12735) 下午(20045) 六時(349) 神轎(7) 再度(22234) 由(208604) 武廟(121) 出發(17257) 繞境(110) 此時(34278) 天色(3308) 已(215610) 暗下來(227) 也(1590760) 是(4642407) 蜂炮(71) 活動(85743) 開始(245562) 上場(2275) 的(16029838) 時候(199970) 神轎(7) 分(62224) 兩(526190) 條(115362) 路線(9508) 行進(2437) A線(Unknown) 從(496546) 北門(1017) 社區(22407) 高興(38552) 砂磚場(Unknown) 曾金印宅(Unknown) 社區(22407) 土庫(123) 上帝廟(Unknown) 進入(66885) 菜寮(4) 出(84457) 十號(189) 道路(15812) 經(38471) 康樂路(9) 轉入(1610) 余仙船巷(Unknown) 內(183051) 出(84457) 朝琴路(2) 再(326207) 轉入(1610) 文武街(3) 會合(2726) B線(Unknown) 再(326207) 經由(14759) 清泉路(Unknown) 返回(9595) 武廟(121) B線(Unknown) 由(208604) 武廟路(3) 過(412878) 西門路(45) 轉入(1610) 橋南街(Unknown) 進(40005) 北帝殿(Unknown) 再(326207) 轉入(1610) 南門路(37) 進入(66885) 朱玄宮(Unknown) 及(304586) 社區(22407) 一(3701681) 圈(12178) 折回(663) 月津路(Unknown) 入(30777) 長成宮(Unknown) 及(304586) 社區(22407) 一(3701681) 圈(12178) 轉回(965) 南門路(37) 進(40005) 福南宮(Unknown) 境(15223) 後(422857) 折回(663) 十號(189) 道路(15812) 與(968432) A線(Unknown) 會合(2726),"{'High': 71, 'Low': 26}","{'第1級': 11, 'Unknown': 48, '第5級': 5, '第4*級': 10, '第4級': 4, '第6級': 4, '第3級': 2, '第2級': 4, '第1*級': 9}",19,Y,Y,N,N
神轎繞境所經之處，當地居民及提前抵達的遊客紛紛焚香膜拜，蜂炮城也一座接著一座推到空地上燃放，來自各地的民眾聚集而上，觀賞蜂炮燃放過程，推神轎的民眾則推動神轎犁炮城，讓蜂炮射在身上，相當刺激，不少年輕人勇氣過人，站在蜂炮城前面任由蜂炮衝擊，其大膽行徑令人捏把冷汗。,神轎 繞境 所 經 之 處 當地 居民 及 提前 抵達 的 遊客 紛紛 焚香 膜拜 蜂炮城 也 一 座 接著 一 座 推到 空地 上 燃放 來自 各 地 的 民眾 聚集 而 上 觀賞 蜂炮 燃放 過程 推 神轎 的 民眾 則 推動 神轎 犁 炮城 讓 蜂炮 射 在 身 上 相當 刺激 不少 年輕人 勇氣 過人 站 在 蜂炮城 前面 任由 蜂炮 衝擊 其 大膽 行徑 令 人 捏 把 冷汗,75,神轎(7) 繞境(110) 所(527327) 經(38471) 之(875481) 處(84410) 當地(23011) 居民(13554) 及(304586) 提前(3167) 抵達(16291) 的(16029838) 遊客(4899) 紛紛(14617) 焚香(527) 膜拜(1113) 蜂炮城(Unknown) 也(1590760) 一(3701681) 座(49959) 接著(57062) 一(3701681) 座(49959) 推到(3012) 空地(3213) 上(1233218) 燃放(164) 來自(41811) 各(243023) 地(754998) 的(16029838) 民眾(17097) 聚集(8764) 而(937923) 上(1233218) 觀賞(5617) 蜂炮(71) 燃放(164) 過程(87889) 推(13235) 神轎(7) 的(16029838) 民眾(17097) 則(254096) 推動(14867) 神轎(7) 犁(1424) 炮城(10) 讓(526314) 蜂炮(71) 射(7097) 在(3284238) 身(122324) 上(1233218) 相當(66293) 刺激(24326) 不少(35256) 年輕人(25137) 勇氣(15221) 過人(3105) 站(68488) 在(3284238) 蜂炮城(Unknown) 前面(29469) 任由(2193) 蜂炮(71) 衝擊(8508) 其(307905) 大膽(8669) 行徑(2903) 令(128742) 人(1550512) 捏(3204) 把(617773) 冷汗(1819),"{'Low': 9, 'High': 66}","{'Unknown': 19, '第2級': 4, '第5級': 13, '第4*級': 8, '第6級': 8, '第1級': 10, '第7級': 3, '第3*級': 3, '第4級': 2, '第1*級': 4, '第3級': 1}",3,Y,Y,N,N
武廟神轎今天將持續繞境，並且分成三條路線行進，因此，到處都可以看到燃放蜂炮的景象，鹽水鎮的天空炮火將通宵達旦，今天晚上九點十五分，鹽水鎮史上規模最大的太子爺神像蜂炮城將在鹽水國中操場開光點燃，同時把蜂炮活動熱鬧氣氛推向最高潮。,武廟 神轎 今天 將 持續 繞境 並且 分成 三 條 路線 行進 因此 到處 都 可以 看到 燃放 蜂炮 的 景象 鹽水鎮 的 天空 炮火 將 通宵達旦 今天 晚上 九點 十五分 鹽水鎮 史 上 規模 最 大 的 太子爺 神像 蜂炮城 將 在 鹽水 國中 操場 開光 點燃 同時 把 蜂炮 活動 熱鬧 氣氛 推向 最高潮,56,武廟(121) 神轎(7) 今天(73277) 將(448374) 持續(33796) 繞境(110) 並且(60996) 分成(7720) 三(313861) 條(115362) 路線(9508) 行進(2437) 因此(184606) 到處(19723) 都(1125846) 可以(560531) 看到(159419) 燃放(164) 蜂炮(71) 的(16029838) 景象(9474) 鹽水鎮(28) 的(16029838) 天空(16342) 炮火(520) 將(448374) 通宵達旦(247) 今天(73277) 晚上(42206) 九點(2467) 十五分(405) 鹽水鎮(28) 史(6356) 上(1233218) 規模(17762) 最(421680) 大(525780) 的(16029838) 太子爺(144) 神像(1682) 蜂炮城(Unknown) 將(448374) 在(3284238) 鹽水(786) 國中(5108) 操場(1791) 開光(82) 點燃(3973) 同時(115305) 把(617773) 蜂炮(71) 活動(85743) 熱鬧(6537) 氣氛(16132) 推向(1616) 最高潮(392),"{'High': 49, 'Low': 7}","{'Unknown': 20, '第1級': 11, '第5級': 4, '第4*級': 6, '第4級': 3, '第2級': 3, '第6級': 2, '第3級': 1, '第1*級': 3, '第7級': 1, '第3*級': 2}",7,Y,Y,N,Y
朝向觀光發展的鹽水鎮蜂炮祭典活動，不僅在國內知名度高，連外國人都感興趣，今年即有日本的電視台專程前來採訪紀錄蜂炮活動，要讓日本人對臺灣這項特殊的祭典活動有更進一步的了解。,朝向 觀光 發展 的 鹽水鎮 蜂炮 祭典 活動 不僅 在 國 內 知名度 高 連 外國人 都 感興趣 今年 即 有 日本 的 電視台 專程 前來 採訪 紀錄 蜂炮 活動 要 讓 日本人 對 臺灣 這 項 特殊 的 祭典 活動 有 更 進一步 的 了解,46,朝向(4160) 觀光(4478) 發展(117494) 的(16029838) 鹽水鎮(28) 蜂炮(71) 祭典(2189) 活動(85743) 不僅(43138) 在(3284238) 國(73377) 內(183051) 知名度(2300) 高(128858) 連(91153) 外國人(5666) 都(1125846) 感興趣(10107) 今年(10836) 即(110826) 有(2217079) 日本(105587) 的(16029838) 電視台(4618) 專程(1372) 前來(13412) 採訪(8722) 紀錄(14233) 蜂炮(71) 活動(85743) 要(851264) 讓(526314) 日本人(15735) 對(897964) 臺灣(36443) 這(2114032) 項(88887) 特殊(28606) 的(16029838) 祭典(2189) 活動(85743) 有(2217079) 更(361676) 進一步(25130) 的(16029838) 了解(82970),"{'High': 43, 'Low': 3}","{'Unknown': 13, '第4級': 3, '第1級': 15, '第2級': 4, '第1*級': 1, '第3級': 1, '第3*級': 2, '第6級': 2, '第4*級': 2, '第5級': 3}",7,Y,Y,N,N
