sentence,sentence_preprocessed,sentence_length,word_freq,high_low_freq,word_level,long_word_count,is_complete_sentence,is_complete_context,is_blacklist,is_greylist
昨天，也是得意門生的紀麗如體貼地為她扇風，還聊到紀麗如兩次聚賭兩次被捉的新聞，另一位洪秀玉則是倒了上千萬的會，目前行蹤難定，對於「徒弟」成了社會版人物一事，楊麗花笑笑說：「啊，那是私人的事啦，和演戲無關，就好像魚、蝦不同一樣，只要有料，我還是會找她們來演戲。」,昨天 也 是 得意 門生 的 紀麗如 體貼 地 為 她 扇風 還 聊到 紀麗如 兩 次 聚賭 兩 次 被 捉 的 新聞 另 一 位 洪秀玉 則 是 倒 了 上千萬 的 會 目前 行蹤 難 定 對於 徒弟 成 了 社會版 人物 一 事 楊麗花 笑笑 說 啊 那 是 私人 的 事 啦 和 演戲 無關 就 好像 魚 蝦 不同 一樣 只要 有 料 我 還是 會 找 她們 來 演戲,76,昨天(12735) 也(1590760) 是(4642407) 得意(8446) 門生(1146) 的(16029838) 紀麗如(Unknown) 體貼(3561) 地(754998) 為(761341) 她(1052913) 扇風(11) 還(625086) 聊到(674) 紀麗如(Unknown) 兩(526190) 次(331701) 聚賭(102) 兩(526190) 次(331701) 被(540683) 捉(3565) 的(16029838) 新聞(40430) 另(138369) 一(3701681) 位(284809) 洪秀玉(Unknown) 則(254096) 是(4642407) 倒(40381) 了(3199291) 上千萬(207) 的(16029838) 會(1014977) 目前(48695) 行蹤(1712) 難(75701) 定(18743) 對於(99570) 徒弟(1961) 成(76470) 了(3199291) 社會版(79) 人物(52614) 一(3701681) 事(385949) 楊麗花(63) 笑笑(2249) 說(1285247) 啊(135484) 那(754138) 是(4642407) 私人(12403) 的(16029838) 事(385949) 啦(51335) 和(1338337) 演戲(2285) 無關(8568) 就(1737544) 好像(67024) 魚(34923) 蝦(2858) 不同(159432) 一樣(188109) 只要(99140) 有(2217079) 料(4257) 我(3033032) 還是(155231) 會(1014977) 找(108128) 她們(52188) 來(742183) 演戲(2285),"{'High': 70, 'Low': 6}","{'第1級': 22, '第5級': 9, 'Unknown': 23, '第2級': 6, '第3級': 4, '第1*級': 7, '第4級': 2, '第6級': 2, '第4*級': 1}",6,Y,Y,N,Y
隨著「扣扳機」的參展，楊順清導演與男主角蔡信弘趕抵東京，為「扣扳機」的觀摩放映登台並參加觀眾的討論會。,隨著 扣扳機 的 參展 楊順清 導演 與 男 主角 蔡信弘 趕抵 東京 為 扣扳機 的 觀摩 放映 登台 並 參加 觀眾 的 討論會,23,隨著(32948) 扣扳機(51) 的(16029838) 參展(779) 楊順清(14) 導演(24296) 與(968432) 男(23928) 主角(20334) 蔡信弘(Unknown) 趕抵(27) 東京(13670) 為(761341) 扣扳機(51) 的(16029838) 觀摩(870) 放映(3543) 登台(514) 並(442790) 參加(42962) 觀眾(31587) 的(16029838) 討論會(1324),"{'High': 18, 'Low': 5}","{'第5級': 1, 'Unknown': 10, '第1級': 3, '第4級': 3, '第4*級': 2, '第1*級': 1, '第7級': 2, '第2級': 1}",5,Y,Y,N,Y
楊順清表示，「扣扳機」雖然是個悲劇，但卻是個能夠淨化人心，讓人產生莫大勇氣的悲劇。,楊順清 表示 扣扳機 雖然 是 個 悲劇 但 卻 是 個 能夠 淨化 人心 讓 人 產生 莫大 勇氣 的 悲劇,21,楊順清(14) 表示(74452) 扣扳機(51) 雖然(152988) 是(4642407) 個(2296574) 悲劇(9222) 但(597124) 卻(333007) 是(4642407) 個(2296574) 能夠(96422) 淨化(2214) 人心(11229) 讓(526314) 人(1550512) 產生(82753) 莫大(2751) 勇氣(15221) 的(16029838) 悲劇(9222),"{'Low': 2, 'High': 19}","{'Unknown': 3, '第4*級': 3, '第2級': 3, '第1級': 6, '第5級': 3, '第4級': 1, '第6級': 2}",2,Y,Y,N,Y
91年，曾隨楊德昌來東京參加東京國際影展的楊順清說：「參加國際影展有沒有得獎不是最重要的，觀察其他大城市觀眾的反應，與觀眾做交流才是重要的。」,91年 曾 隨 楊德昌 來 東京 參加 東京 國際 影展 的 楊順清 說 參加 國際 影展 有沒有 得獎 不 是 最 重要 的 觀察 其他 大 城市 觀眾 的 反應 與 觀眾 做 交流 才 是 重要 的,38,91年(48) 曾(132981) 隨(28011) 楊德昌(871) 來(742183) 東京(13670) 參加(42962) 東京(13670) 國際(40846) 影展(3008) 的(16029838) 楊順清(14) 說(1285247) 參加(42962) 國際(40846) 影展(3008) 有沒有(21555) 得獎(1462) 不(2282521) 是(4642407) 最(421680) 重要(154863) 的(16029838) 觀察(44358) 其他(189445) 大(525780) 城市(32018) 觀眾(31587) 的(16029838) 反應(53196) 與(968432) 觀眾(31587) 做(411649) 交流(10657) 才(394539) 是(4642407) 重要(154863) 的(16029838),"{'Low': 2, 'High': 36}","{'Unknown': 8, '第4級': 6, '第1級': 11, '第2級': 6, '第5級': 3, '第1*級': 1, '第3級': 1, '第4*級': 2}",4,Y,N,N,Y
為了化解緊張氣氛，楊順清還主動爆料，指出蔡信弘此行除了影展，其實還準備跟交往四年的日本女友求婚！,為了 化解 緊張 氣氛 楊順清 還 主動 爆料 指出 蔡信弘 此 行 除了 影展 其實 還 準備 跟 交往 四 年 的 日本 女友 求婚,25,為了(Unknown) 化解(4186) 緊張(27303) 氣氛(16132) 楊順清(14) 還(625086) 主動(18624) 爆料(404) 指出(38456) 蔡信弘(Unknown) 此(288458) 行(63474) 除了(75964) 影展(3008) 其實(109290) 還(625086) 準備(64901) 跟(260280) 交往(10508) 四(141667) 年(514736) 的(16029838) 日本(105587) 女友(3706) 求婚(1958),"{'Low': 3, 'High': 22}","{'Unknown': 9, '第6級': 1, '第2級': 2, '第4*級': 2, '第5級': 4, '第3*級': 2, '第1*級': 1, '第1級': 4}",2,Y,N,N,Y
蔡信弘不好意思地表示，4年前他隨著「果醬」一片來東京，因此認識了現今的日本女友車崎美希。,蔡信弘 不好意思 地 表示 4 年 前 他 隨著 果醬 一 片 來 東京 因此 認識 了 現今 的 日本 女友 車崎美希,22,蔡信弘(Unknown) 不好意思(3723) 地(754998) 表示(74452) 4(36054) 年(514736) 前(272709) 他(2487930) 隨著(32948) 果醬(1167) 一(3701681) 片(71870) 來(742183) 東京(13670) 因此(184606) 認識(51425) 了(3199291) 現今(6891) 的(16029838) 日本(105587) 女友(3706) 車崎美希(Unknown),"{'Low': 2, 'High': 20}","{'Unknown': 8, '第2*級': 1, '第4*級': 2, '第1級': 7, '第5級': 2, '第2級': 2}",3,Y,Y,N,Y
後來美希到台北學習了一年半的中文課程，蔡信弘因此與她有了更進一步的發展。,後來 美希 到 台北 學習 了 一 年 半 的 中文 課程 蔡信弘 因此 與 她 有 了 更 進一步 的 發展,22,後來(95618) 美希(3) 到(546906) 台北(22242) 學習(105345) 了(3199291) 一(3701681) 年(514736) 半(80813) 的(16029838) 中文(9751) 課程(30183) 蔡信弘(Unknown) 因此(184606) 與(968432) 她(1052913) 有(2217079) 了(3199291) 更(361676) 進一步(25130) 的(16029838) 發展(117494),"{'High': 20, 'Low': 2}","{'第2級': 2, 'Unknown': 6, '第1級': 9, '第4級': 2, '第4*級': 3}",2,Y,Y,N,Y
蔡信弘表示，此行他準備拜見美希的父母，並希望找機會向女友及准岳父母求婚。,蔡信弘 表示 此 行 他 準備 拜見 美希 的 父母 並 希望 找 機會 向 女友 及 准 岳父母 求婚,20,蔡信弘(Unknown) 表示(74452) 此(288458) 行(63474) 他(2487930) 準備(64901) 拜見(1251) 美希(3) 的(16029838) 父母(78215) 並(442790) 希望(119975) 找(108128) 機會(81244) 向(231672) 女友(3706) 及(304586) 准(3254) 岳父母(121) 求婚(1958),"{'Low': 2, 'High': 18}","{'Unknown': 6, '第4*級': 2, '第5級': 4, '第1級': 3, '第2級': 4, '第3級': 1}",2,Y,Y,N,Y
在台灣電影界工作11年，但同時也因此「失業」10年的楊順清有感而發地說：「結婚生子，讓我對人生的看法改變。,在 台灣 電影界 工作 11 年 但 同時 也 因此 失業 10年 的 楊順清 有感而發 地 說 結婚 生子 讓 我 對 人生 的 看法 改變,26,在(3284238) 台灣(130718) 電影界(725) 工作(220164) 11(15182) 年(514736) 但(597124) 同時(115305) 也(1590760) 因此(184606) 失業(3729) 10年(621) 的(16029838) 楊順清(14) 有感而發(418) 地(754998) 說(1285247) 結婚(22719) 生子(1372) 讓(526314) 我(3033032) 對(897964) 人生(69234) 的(16029838) 看法(30115) 改變(92018),"{'High': 25, 'Low': 1}","{'第1*級': 1, '第1級': 9, 'Unknown': 7, '第2級': 2, '第3*級': 2, '第4*級': 2, '第5級': 1, '第3級': 1, '第4級': 1}",4,Y,Y,N,Y
生了孩子後，為了留給兒子一個做父親的『典範』，讓我對人生更有勇氣、有自信。」,生 了 孩子 後 為了 留給 兒子 一 個 做 父親 的 典範 讓 我 對 人生 更 有 勇氣 有 自信,22,生(61638) 了(3199291) 孩子(242092) 後(422857) 為了(Unknown) 留給(5719) 兒子(60663) 一(3701681) 個(2296574) 做(411649) 父親(86472) 的(16029838) 典範(6073) 讓(526314) 我(3033032) 對(897964) 人生(69234) 更(361676) 有(2217079) 勇氣(15221) 有(2217079) 自信(14578),"{'High': 21, 'Low': 1}","{'第4級': 2, 'Unknown': 4, '第1級': 11, '第3級': 1, '第5級': 1, '第2級': 1, '第4*級': 2}",0,Y,N,N,N
楊順清笑著說：「楊德昌現在也當爸爸了，你沒發現他的新作『一.一』也改變了嗎？」,楊順清 笑 著 說 楊德昌 現在 也 當 爸爸 了 你 沒 發現 他 的 新作 一一 也 改變 了 嗎,21,楊順清(14) 笑(68493) 著(1004687) 說(1285247) 楊德昌(871) 現在(218744) 也(1590760) 當(294625) 爸爸(43983) 了(3199291) 你(1414837) 沒(306167) 發現(175233) 他(2487930) 的(16029838) 新作(752) 一一(11524) 也(1590760) 改變(92018) 了(3199291) 嗎(248249),"{'Low': 1, 'High': 20}","{'Unknown': 8, '第2級': 2, '第1級': 10, '第4級': 1}",2,Y,N,N,Y
為了迎接第二個孩子的誕生，楊順清說：「我的下一部新電影正在籌備中了。」,為了 迎接 第二 個 孩子 的 誕生 楊順清 說 我 的 下 一 部 新 電影 正在 籌備 中 了,20,為了(Unknown) 迎接(8917) 第二(98741) 個(2296574) 孩子(242092) 的(16029838) 誕生(8377) 楊順清(14) 說(1285247) 我(3033032) 的(16029838) 下(329549) 一(3701681) 部(71567) 新(212453) 電影(115295) 正在(54336) 籌備(2198) 中(1011729) 了(3199291),"{'Low': 2, 'High': 18}","{'Unknown': 6, '第5級': 2, '第1級': 8, '第1*級': 2, '第2級': 1, '第6級': 1}",1,Y,N,N,Y
新片定名為「彈簧床」，故事是描寫事業有成並逐漸步入中年的男子，某日突然發現自己「不行」了......，該中年男子為了找出「不行」的理由，因此發生不少爆笑趣事。,新片 定名為 彈簧床 故事 是 描寫 事業 有成 並 逐漸 步入 中年 的 男子 某 日 突然 發現 自己 不行 了 該 中年 男子 為了 找出 不行 的 理由 因此 發生 不少 爆笑 趣事,34,新片(376) 定名為(410) 彈簧床(138) 故事(101316) 是(4642407) 描寫(8937) 事業(32957) 有成(1145) 並(442790) 逐漸(38705) 步入(2192) 中年(7043) 的(16029838) 男子(17448) 某(119862) 日(94041) 突然(69636) 發現(175233) 自己(744739) 不行(16352) 了(3199291) 該(148369) 中年(7043) 男子(17448) 為了(Unknown) 找出(20185) 不行(16352) 的(16029838) 理由(32460) 因此(184606) 發生(129211) 不少(35256) 爆笑(490) 趣事(997),"{'High': 33, 'Low': 1}","{'Unknown': 9, '第2級': 2, '第1級': 4, '第5級': 3, '第4*級': 8, '第6級': 1, '第4級': 4, '第1*級': 1, '第3級': 1, '第7級': 1}",2,Y,Y,N,N
楊順清特別加註說明：「我要聲明，我不是故事的男主角，因為我第二個孩子即將出生。,楊順清 特別 加註 說明 我 要 聲明 我 不 是 故事 的 男 主角 因為 我 第二 個 孩子 即將 出生,21,楊順清(14) 特別(91212) 加註(331) 說明(52918) 我(3033032) 要(851264) 聲明(5271) 我(3033032) 不(2282521) 是(4642407) 故事(101316) 的(16029838) 男(23928) 主角(20334) 因為(425061) 我(3033032) 第二(98741) 個(2296574) 孩子(242092) 即將(16780) 出生(21734),"{'Low': 1, 'High': 20}","{'Unknown': 3, '第2級': 2, '第4級': 2, '第1級': 9, '第6級': 2, '第1*級': 2, '第3*級': 1}",1,Y,Y,N,Y
哈哈！」,哈哈,1,哈哈(7410),{'High': 1},{'Unknown': 1},0,N,N,N,N
為了堅持藝術與商業並存的原則，今年的東京影展除了加入兒童電影及卡通片外，昨日漏夜還一連放映了4部英、美恐怖片。,為了 堅持 藝術 與 商業 並存 的 原則 今年 的 東京 影展 除了 加入 兒童 電影 及 卡通片 外 昨日 漏夜 還 一連 放映 了 4 部 英 美 恐怖片,30,為了(Unknown) 堅持(30662) 藝術(80645) 與(968432) 商業(19292) 並存(1420) 的(16029838) 原則(31148) 今年(10836) 的(16029838) 東京(13670) 影展(3008) 除了(75964) 加入(28847) 兒童(30462) 電影(115295) 及(304586) 卡通片(310) 外(109310) 昨日(2036) 漏夜(78) 還(625086) 一連(2950) 放映(3543) 了(3199291) 4(36054) 部(71567) 英(12886) 美(53380) 恐怖片(685),"{'Low': 2, 'High': 28}","{'Unknown': 11, '第5級': 5, '第4級': 3, '第4*級': 2, '第1級': 4, '第3*級': 1, '第1*級': 2, '第7級': 1, '第2級': 1}",2,Y,Y,N,N
此外，昨日香港的動畫電影「麥兜故事」，在東京影展的觀摩放映，也吸引不少親子入場。,此外 昨日 香港 的 動畫 電影 麥兜 故事 在 東京 影展 的 觀摩 放映 也 吸引 不少 親子 入場,19,此外(30247) 昨日(2036) 香港(46937) 的(16029838) 動畫(5744) 電影(115295) 麥兜(12) 故事(101316) 在(3284238) 東京(13670) 影展(3008) 的(16029838) 觀摩(870) 放映(3543) 也(1590760) 吸引(20619) 不少(35256) 親子(5521) 入場(626),"{'High': 18, 'Low': 1}","{'第5級': 5, 'Unknown': 5, '第1級': 3, '第1*級': 2, '第2級': 1, '第7級': 2, '第4級': 1}",0,Y,Y,N,Y
昨日，東京影展放映了印尼的「國旗」、新加坡的「孩子不笨」、伊朗電影「風的地毯」等3部兒童電影。,昨日 東京 影展 放映 了 印尼 的 國旗 新加坡 的 孩子 不 笨 伊朗 電影 風 的 地毯 等 3 部 兒童 電影,23,昨日(2036) 東京(13670) 影展(3008) 放映(3543) 了(3199291) 印尼(3068) 的(16029838) 國旗(1659) 新加坡(5228) 的(16029838) 孩子(242092) 不(2282521) 笨(6379) 伊朗(1572) 電影(115295) 風(30613) 的(16029838) 地毯(3510) 等(327380) 3(51223) 部(71567) 兒童(30462) 電影(115295),{'High': 23},"{'第5級': 4, 'Unknown': 3, '第7級': 2, '第6級': 2, '第1級': 5, '第2*級': 1, '第1*級': 3, '第3*級': 1, '第2級': 1, '第4級': 1}",1,Y,Y,N,N
全是以兒童為眼光，刻畫生活在不同文化下的純真童情。,全 是 以 兒童 為 眼光 刻畫 生活 在 不同 文化 下 的 純真 童情,15,全(178642) 是(4642407) 以(547785) 兒童(30462) 為(761341) 眼光(13910) 刻畫(1015) 生活(213189) 在(3284238) 不同(159432) 文化(115697) 下(329549) 的(16029838) 純真(2232) 童情(Unknown),"{'High': 14, 'Low': 1}","{'第2級': 2, '第1級': 2, '第5級': 1, '第4級': 1, 'Unknown': 2, '第4*級': 1, '第6級': 2, '第3級': 2, '第1*級': 2}",0,Y,N,N,N
此外，「麥兜故事」是本屆影展「亞洲之風」單元的參展觀摩片，這部在香港也寫下票房佳績的卡通片，昨日放映後被影評人評價「具有國際水準」。,此外 麥兜 故事 是 本 屆 影展 亞洲 之 風 單元 的 參展 觀摩片 這 部 在 香港 也 寫下 票房 佳績 的 卡通片 昨日 放映 後 被 影評人 評價 具有 國際 水準,33,此外(30247) 麥兜(12) 故事(101316) 是(4642407) 本(197156) 屆(10220) 影展(3008) 亞洲(13256) 之(875481) 風(30613) 單元(4957) 的(16029838) 參展(779) 觀摩片(Unknown) 這(2114032) 部(71567) 在(3284238) 香港(46937) 也(1590760) 寫下(9383) 票房(2221) 佳績(470) 的(16029838) 卡通片(310) 昨日(2036) 放映(3543) 後(422857) 被(540683) 影評人(2949) 評價(9950) 具有(60702) 國際(40846) 水準(9940),"{'High': 31, 'Low': 2}","{'第5級': 6, 'Unknown': 8, '第2級': 3, '第1級': 7, '第3*級': 1, '第1*級': 2, '第6級': 3, '第7級': 1, '第4級': 2}",3,Y,Y,N,Y
導演袁建滔在接受訪問時表示，當初萬萬沒想到此片會紅，因為動畫電影在香港幾乎可以說是毫無市場可言。,導演 袁建滔 在 接受 訪問 時 表示 當初 萬萬 沒想到 此 片 會 紅 因為 動畫 電影 在 香港 幾乎 可以 說 是 毫無 市場 可 言,27,導演(24296) 袁建滔(Unknown) 在(3284238) 接受(84729) 訪問(12881) 時(623734) 表示(74452) 當初(14449) 萬萬(1840) 沒想到(13287) 此(288458) 片(71870) 會(1014977) 紅(34717) 因為(425061) 動畫(5744) 電影(115295) 在(3284238) 香港(46937) 幾乎(74298) 可以(560531) 說(1285247) 是(4642407) 毫無(32086) 市場(65023) 可(307359) 言(97691),"{'High': 26, 'Low': 1}","{'第4級': 4, 'Unknown': 4, '第1*級': 6, '第3*級': 2, '第4*級': 3, '第6級': 1, '第5級': 2, '第2級': 2, '第1級': 3}",2,Y,Y,N,Y
除此之外，本屆入評審委員之一的韓國導演朴贊郁，也有一部新作「給復仇者同情」放映。,除此之外 本 屆 入 評審 委員 之 一 的 韓國 導演 朴贊郁 也 有 一 部 新作 給 復仇 者 同情 放映,22,除此之外(6309) 本(197156) 屆(10220) 入(30777) 評審(1904) 委員(10662) 之(875481) 一(3701681) 的(16029838) 韓國(7113) 導演(24296) 朴贊郁(3) 也(1590760) 有(2217079) 一(3701681) 部(71567) 新作(752) 給(240485) 復仇(3931) 者(423504) 同情(10830) 放映(3543),"{'High': 21, 'Low': 1}","{'第5級': 5, '第1級': 7, '第4*級': 2, '第3*級': 1, '第4級': 1, 'Unknown': 3, '第2級': 1, '第6級': 1, '第7級': 1}",2,Y,N,N,Y
不過，本身擔任評審的朴贊郁為了避嫌，並未為自己的電影登台。,不過 本身 擔任 評審 的 朴贊郁 為了 避嫌 並 未 為 自己 的 電影 登台,15,不過(186226) 本身(44138) 擔任(34825) 評審(1904) 的(16029838) 朴贊郁(3) 為了(Unknown) 避嫌(221) 並(442790) 未(101927) 為(761341) 自己(744739) 的(16029838) 電影(115295) 登台(514),"{'High': 13, 'Low': 2}","{'第2級': 1, '第5級': 4, '第1級': 2, 'Unknown': 5, '第4*級': 1, '第1*級': 2}",1,Y,Y,N,Y
至於午夜後推出的4部恐怖電影，因為「七夜怪談」的連鎖效應，從下午就有觀眾在戲院外排長龍。,至於 午夜 後 推出 的 4 部 恐怖 電影 因為 七 夜 怪談 的 連鎖 效應 從 下午 就 有 觀眾 在 戲院 外 排 長龍,26,至於(39363) 午夜(2647) 後(422857) 推出(10009) 的(16029838) 4(36054) 部(71567) 恐怖(14460) 電影(115295) 因為(425061) 七(59385) 夜(31283) 怪談(14) 的(16029838) 連鎖(2455) 效應(8027) 從(496546) 下午(20045) 就(1737544) 有(2217079) 觀眾(31587) 在(3284238) 戲院(4927) 外(109310) 排(16810) 長龍(182),"{'High': 25, 'Low': 1}","{'第5級': 5, '第1級': 8, 'Unknown': 3, '第2級': 1, '第4級': 3, '第1*級': 4, '第3*級': 1, '第6級': 1}",0,Y,Y,N,N
45歲的鄭裕玲染了金髮，穿了耳洞，但生命中總有一些不變的事物，對她來說，那就是呂方。,45 歲 的 鄭裕玲 染 了 金髮 穿 了 耳洞 但 生命 中 總 有 一些 不變 的 事物 對 她 來說 那 就 是 呂方,26,45(3139) 歲(130085) 的(16029838) 鄭裕玲(16) 染(3731) 了(3199291) 金髮(3016) 穿(46113) 了(3199291) 耳洞(Unknown) 但(597124) 生命(92595) 中(1011729) 總(46750) 有(2217079) 一些(156929) 不變(7246) 的(16029838) 事物(32454) 對(897964) 她(1052913) 來說(Unknown) 那(754138) 就(1737544) 是(4642407) 呂方(12),"{'High': 22, 'Low': 4}","{'Unknown': 11, '第1級': 9, '第5級': 1, '第1*級': 2, '第2級': 2, '第4*級': 1}",1,Y,Y,N,Y
鄭裕玲下個月即將來台擔任金馬獎晚會主持人。,鄭裕玲 下 個 月 即將 來 台 擔任 金馬獎 晚會 主持人,11,鄭裕玲(16) 下(329549) 個(2296574) 月(148997) 即將(16780) 來(742183) 台(29325) 擔任(34825) 金馬獎(387) 晚會(1331) 主持人(4030),"{'Low': 1, 'High': 10}","{'Unknown': 4, '第1*級': 1, '第1級': 3, '第6級': 1, '第2級': 1, '第5級': 1}",3,Y,N,N,Y
儘管不否認竭盡心力使自己保持青春美貌，但羅文過世的事情為她帶來很多省思。,儘管 不 否認 竭盡 心力 使 自己 保持 青春 美貌 但 羅文 過世 的 事情 為 她 帶來 很多 省思,20,儘管(36818) 不(2282521) 否認(8670) 竭盡(2034) 心力(4764) 使(197544) 自己(744739) 保持(39415) 青春(6277) 美貌(2440) 但(597124) 羅文(168) 過世(8929) 的(16029838) 事情(112079) 為(761341) 她(1052913) 帶來(40305) 很多(113128) 省思(1578),{'High': 20},"{'第5級': 6, '第1級': 3, '第7級': 2, '第1*級': 1, '第4*級': 1, '第6級': 1, '第2級': 2, 'Unknown': 3, '第3*級': 1}",0,Y,Y,N,Y
「我兩個月前探望過他一次，他說他自己一定不輸。,我 兩 個 月 前 探望 過 他 一 次 他 說 他 自己 一定 不 輸,17,我(3033032) 兩(526190) 個(2296574) 月(148997) 前(272709) 探望(3135) 過(412878) 他(2487930) 一(3701681) 次(331701) 他(2487930) 說(1285247) 他(2487930) 自己(744739) 一定(138695) 不(2282521) 輸(8071),{'High': 17},"{'第1級': 11, '第6級': 1, '第1*級': 3, '第2級': 1, '第4級': 1}",0,Y,N,N,N
後來瘦成那樣子，我想再看他一次，阿東(羅文的助手)說他不想再見人了。」,後來 瘦成 那 樣子 我 想 再 看 他 一 次 阿東 羅文 的 助手 說 他 不 想 再 見 人 了,23,後來(95618) 瘦成(49) 那(754138) 樣子(37812) 我(3033032) 想(449884) 再(326207) 看(444691) 他(2487930) 一(3701681) 次(331701) 阿東(39) 羅文(168) 的(16029838) 助手(3553) 說(1285247) 他(2487930) 不(2282521) 想(449884) 再(326207) 見(179113) 人(1550512) 了(3199291),"{'High': 21, 'Low': 2}","{'第2級': 3, 'Unknown': 5, '第1級': 11, '第1*級': 3, '第6級': 1}",0,Y,N,N,Y
鄭裕玲近來染了一頭金髮，穿了6個耳洞，還學習騎摩托車，因為覺醒到有些事再不做，就真的沒機會做了。,鄭裕玲 近來 染 了 一頭 金髮 穿 了 6 個 耳洞 還 學習 騎 摩托車 因為 覺醒到 有些 事 再 不 做 就 真的 沒 機會 做 了,28,鄭裕玲(16) 近來(3822) 染(3731) 了(3199291) 一頭(Unknown) 金髮(3016) 穿(46113) 了(3199291) 6(25671) 個(2296574) 耳洞(Unknown) 還(625086) 學習(105345) 騎(20953) 摩托車(2395) 因為(425061) 覺醒到(1) 有些(6971) 事(385949) 再(326207) 不(2282521) 做(411649) 就(1737544) 真的(88001) 沒(306167) 機會(81244) 做(411649) 了(3199291),"{'Low': 4, 'High': 24}","{'Unknown': 11, '第5級': 2, '第1*級': 5, '第1級': 6, '第2級': 3, '第3級': 1}",3,Y,Y,N,Y
她笑說自己用了95%的精神、時間去做健身、按摩、做臉、修指甲、弄眼睫毛，忙到根本沒有時間覺得寂寞。,她 笑說 自己 用 了 95 的 精神 時間 去 做 健身 按摩 做臉 修指甲 弄 眼睫毛 忙到 根本 沒有 時間 覺得 寂寞,23,她(1052913) 笑說(1121) 自己(744739) 用(377038) 了(3199291) 95(1348) 的(16029838) 精神(79222) 時間(213595) 去(479993) 做(411649) 健身(1843) 按摩(4828) 做臉(1) 修指甲(Unknown) 弄(13639) 眼睫毛(Unknown) 忙到(199) 根本(66330) 沒有(594280) 時間(213595) 覺得(183034) 寂寞(8212),"{'High': 20, 'Low': 3}","{'第1級': 8, 'Unknown': 8, '第1*級': 2, '第3*級': 1, '第7級': 1, '第5級': 2, '第4*級': 1}",2,Y,N,N,N
如果真有一天要離開世界，她第一個想到的就是呂方。,如果 真 有 一 天 要 離開 世界 她 第一 個 想到 的 就 是 呂方,16,如果(322121) 真(137497) 有(2217079) 一(3701681) 天(330413) 要(851264) 離開(71748) 世界(165235) 她(1052913) 第一(172544) 個(2296574) 想到(48955) 的(16029838) 就(1737544) 是(4642407) 呂方(12),"{'High': 15, 'Low': 1}","{'第2級': 4, '第1*級': 1, '第1級': 9, 'Unknown': 2}",0,Y,Y,N,Y
「這十年來，他的確是我一個很好的伴。,這 十 年 來 他 的確 是 我 一 個 很 好 的 伴,14,這(2114032) 十(77415) 年(514736) 來(742183) 他(2487930) 的確(33471) 是(4642407) 我(3033032) 一(3701681) 個(2296574) 很(715675) 好(448428) 的(16029838) 伴(3976),{'High': 14},"{'第1級': 11, '第4*級': 1, 'Unknown': 2}",0,Y,N,N,N
我買保險在『受益人』一欄裡沒寫過他的名字，但最捨不得的，還是只想到他。」,我 買 保險 在 受益人 一 欄 裡 沒 寫 過 他 的 名字 但 最 捨不得 的 還是 只 想到 他,22,我(3033032) 買(59736) 保險(11763) 在(3284238) 受益人(221) 一(3701681) 欄(3275) 裡(520435) 沒(306167) 寫(113933) 過(412878) 他(2487930) 的(16029838) 名字(42571) 但(597124) 最(421680) 捨不得(3057) 的(16029838) 還是(155231) 只(436725) 想到(48955) 他(2487930),{'High': 22},"{'第1級': 10, '第5級': 2, '第1*級': 6, 'Unknown': 2, '第6級': 1, '第2級': 1}",2,Y,Y,N,N
外界常有人猜測鄭裕玲星運較旺，呂方會有心結。,外界 常 有 人 猜測 鄭裕玲 星運 較 旺 呂方 會 有 心結,13,外界(9618) 常(86207) 有(2217079) 人(1550512) 猜測(5359) 鄭裕玲(16) 星運(17) 較(78424) 旺(2326) 呂方(12) 會(1014977) 有(2217079) 心結(707),"{'High': 10, 'Low': 3}","{'第5級': 2, '第1*級': 2, '第1級': 3, 'Unknown': 3, '第2級': 1, '第6級': 1, '第7級': 1}",1,Y,N,N,Y
但鄭裕玲表示，呂方雖然外表較年輕，但其實是個大男人。,但 鄭裕玲 表示 呂方 雖然 外表 較 年輕 但 其實 是 個 大男人,13,但(597124) 鄭裕玲(16) 表示(74452) 呂方(12) 雖然(152988) 外表(8606) 較(78424) 年輕(48853) 但(597124) 其實(109290) 是(4642407) 個(2296574) 大男人(55),"{'High': 10, 'Low': 3}","{'第2級': 5, 'Unknown': 3, '第4*級': 2, '第3*級': 1, '第1級': 2}",2,Y,Y,N,Y
「他其實是一個很downtoearth(實際)的男人。,他 其實 是 一 個 很 downtoearth 實際 的 男人,10,他(2487930) 其實(109290) 是(4642407) 一(3701681) 個(2296574) 很(715675) downtoearth(Unknown) 實際(52755) 的(16029838) 男人(56333),"{'High': 9, 'Low': 1}","{'第1級': 6, '第3*級': 1, 'Unknown': 2, '第4*級': 1}",1,Y,N,N,N
