sentence,sentence_preprocessed,sentence_length,word_freq,high_low_freq,word_level,long_word_count,is_complete_sentence,is_complete_context,is_blacklist,is_greylist
顏清標後援會和律師團則指出，坊間傳聞，顏清標就算選上立委，無法就職，也是當選無效，這種耳語意圖造成顏清標落選，有妨礙選舉之嫌，因此，特別聲明，人民用選票支持顏清標，是主權在民的表現，顏清標只要當選，絕對能進入立法院為民服務。,顏清標 後援會 和 律師團 則 指出 坊間 傳聞 顏清標 就算 選上 立委 無法 就職 也 是 當選 無效 這 種 耳語 意圖 造成 顏清標 落選 有 妨礙 選舉 之 嫌 因此 特別 聲明 人民 用 選票 支持 顏清標 是 主權 在 民 的 表現 顏清標 只要 當選 絕對 能 進入 立法院 為 民 服務,54,顏清標(3) 後援會(117) 和(1338337) 律師團(103) 則(254096) 指出(38456) 坊間(1482) 傳聞(3427) 顏清標(3) 就算(28034) 選上(709) 立委(1052) 無法(150606) 就職(1287) 也(1590760) 是(4642407) 當選(3469) 無效(3054) 這(2114032) 種(701563) 耳語(1307) 意圖(7695) 造成(63141) 顏清標(3) 落選(597) 有(2217079) 妨礙(3526) 選舉(8292) 之(875481) 嫌(7613) 因此(184606) 特別(91212) 聲明(5271) 人民(36441) 用(377038) 選票(1177) 支持(42489) 顏清標(3) 是(4642407) 主權(4544) 在(3284238) 民(8043) 的(16029838) 表現(67272) 顏清標(3) 只要(99140) 當選(3469) 絕對(42446) 能(582260) 進入(66885) 立法院(1934) 為(761341) 民(8043) 服務(38055),"{'Low': 5, 'High': 49}","{'Unknown': 19, '第5級': 8, '第6級': 6, '第4*級': 5, '第1級': 7, '第7級': 1, '第2級': 1, '第4級': 3, '第1*級': 2, '第3級': 2}",8,Y,Y,N,Y
至於獲得交保的副議長和主任秘書，由於官司並未定讞，近日內即可復職上班，不過，議長沒有交保，地方預期對選情並不會造成太大影響。,至於 獲得 交保 的 副議長 和 主任秘書 由於 官司 並 未 定讞 近日 內 即可 復職 上班 不過 議長 沒有 交保 地方 預期 對 選情 並 不會 造成 太 大 影響,31,至於(39363) 獲得(54809) 交保(99) 的(16029838) 副議長(119) 和(1338337) 主任秘書(Unknown) 由於(88111) 官司(1813) 並(442790) 未(101927) 定讞(81) 近日(1497) 內(183051) 即可(7563) 復職(342) 上班(10205) 不過(186226) 議長(729) 沒有(594280) 交保(99) 地方(139164) 預期(11499) 對(897964) 選情(221) 並(442790) 不會(173045) 造成(63141) 太(181732) 大(525780) 影響(95840),"{'High': 27, 'Low': 4}","{'第5級': 3, '第7級': 2, '第1級': 5, 'Unknown': 9, '第4*級': 5, '第6級': 2, '第3級': 2, '第2*級': 1, '第2級': 1, '第1*級': 1}",2,Y,Y,N,N
失業男子詹文仰疑因承受不了沈重的生活壓力，與智障的妹妹詹文麗一起在房間燃燒木炭自殺，屍體昨晚被發現。,失業 男子 詹文仰 疑 因 承受不了 沈重 的 生活 壓力 與 智障 的 妹妹 詹文麗 一起 在 房間 燃燒 木炭 自殺 屍體 昨晚 被 發現,25,失業(3729) 男子(17448) 詹文仰(Unknown) 疑(2606) 因(119364) 承受不了(388) 沈重(1167) 的(16029838) 生活(213189) 壓力(40408) 與(968432) 智障(481) 的(16029838) 妹妹(15695) 詹文麗(Unknown) 一起(79297) 在(3284238) 房間(44038) 燃燒(6861) 木炭(605) 自殺(15372) 屍體(13598) 昨晚(5400) 被(540683) 發現(175233),"{'High': 23, 'Low': 2}","{'第5級': 3, '第4*級': 3, 'Unknown': 8, '第1級': 4, '第3級': 1, '第4級': 1, '第1*級': 2, '第6級': 1, '第2級': 2}",3,Y,N,N,Y
詹文仰在遺書中寫道：「人生絕望，對不起房東太太、房東先生！」,詹文仰 在 遺書 中 寫道 人生 絕望 對不起 房東 太太 房東 先生,12,詹文仰(Unknown) 在(3284238) 遺書(1281) 中(1011729) 寫道(10052) 人生(69234) 絕望(8699) 對不起(9459) 房東(1555) 太太(46720) 房東(1555) 先生(159645),"{'Low': 1, 'High': 11}","{'Unknown': 4, '第1*級': 1, '第4*級': 1, '第5級': 1, '第1級': 3, '第2*級': 2}",2,Y,N,N,Y
令人聞之鼻酸。,令 人 聞 之 鼻酸,5,令(128742) 人(1550512) 聞(19108) 之(875481) 鼻酸(217),{'High': 5},"{'第5級': 2, '第1級': 1, '第3級': 1, 'Unknown': 1}",0,Y,N,N,N
卅九歲的詹文仰和卅五歲的詹文麗為嘉義市人，係兄妹關係，因為父母雙亡，於是北上新莊打拚，今年六月十五日才搬到新莊市化成路二○五巷居住。,卅九 歲 的 詹文仰 和 卅五 歲 的 詹文麗 為 嘉義市 人 係 兄妹 關係 因為 父母 雙亡 於是 北上 新莊 打拚 今年 六月 十五日 才 搬到 新莊市 化成路 二五巷 居住,31,卅九(25) 歲(130085) 的(16029838) 詹文仰(Unknown) 和(1338337) 卅五(67) 歲(130085) 的(16029838) 詹文麗(Unknown) 為(761341) 嘉義市(355) 人(1550512) 係(9477) 兄妹(1868) 關係(162883) 因為(425061) 父母(78215) 雙亡(244) 於是(108155) 北上(3157) 新莊(562) 打拚(936) 今年(10836) 六月(14880) 十五日(4220) 才(394539) 搬到(6358) 新莊市(34) 化成路(Unknown) 二五巷(Unknown) 居住(12699),"{'Low': 7, 'High': 24}","{'Unknown': 17, '第1級': 6, '第6級': 1, '第3級': 2, '第1*級': 1, '第4*級': 1, '第7級': 1, '第2級': 1, '第5級': 1}",7,Y,Y,N,Y
由於妹妹詹文麗智障，生活重擔全賴哥哥詹文仰在附近的一家馬達工廠上班支持。,由於 妹妹 詹文麗 智障 生活 重擔 全 賴 哥哥 詹文仰 在 附近 的 一 家 馬達 工廠 上班 支持,19,由於(88111) 妹妹(15695) 詹文麗(Unknown) 智障(481) 生活(213189) 重擔(1461) 全(178642) 賴(8367) 哥哥(18973) 詹文仰(Unknown) 在(3284238) 附近(32204) 的(16029838) 一(3701681) 家(236822) 馬達(1364) 工廠(16192) 上班(10205) 支持(42489),"{'High': 17, 'Low': 2}","{'第4*級': 1, '第1級': 5, 'Unknown': 4, '第3級': 1, '第7級': 1, '第2級': 1, '第6級': 1, '第1*級': 2, '第4級': 2, '第2*級': 1}",2,Y,Y,N,Y
雖然日子過得並不寬裕，哥哥還是非常照顧妹妹，即使休息時間僅卅分鐘，他還是急忙趕回家中照顧妹妹三餐，只可惜好景不常，因為經濟不景氣工廠沒有訂單，端午過後即失業在家，兄妹倆頓時坐困愁城。,雖然 日子 過 得 並 不 寬裕 哥哥 還是 非常 照顧 妹妹 即使 休息 時間 僅 卅 分鐘 他 還是 急忙 趕 回家 中 照顧 妹妹 三 餐 只 可惜 好景不常 因為 經濟 不景氣 工廠 沒有 訂單 端午 過後 即 失業 在 家 兄妹倆 頓時 坐困愁城,46,雖然(152988) 日子(28378) 過(412878) 得(573721) 並(442790) 不(2282521) 寬裕(638) 哥哥(18973) 還是(155231) 非常(152032) 照顧(29251) 妹妹(15695) 即使(68376) 休息(20958) 時間(213595) 僅(30739) 卅(333) 分鐘(52479) 他(2487930) 還是(155231) 急忙(7550) 趕(6168) 回家(35375) 中(1011729) 照顧(29251) 妹妹(15695) 三(313861) 餐(6587) 只(436725) 可惜(16141) 好景不常(235) 因為(425061) 經濟(83046) 不景氣(1650) 工廠(16192) 沒有(594280) 訂單(2471) 端午(329) 過後(7751) 即(110826) 失業(3729) 在(3284238) 家(236822) 兄妹倆(367) 頓時(8363) 坐困愁城(114),{'High': 46},"{'第2級': 1, '第3*級': 2, '第1*級': 9, 'Unknown': 11, '第4*級': 4, '第1級': 9, '第3級': 2, '第5級': 3, '第2*級': 1, '第4級': 2, '第6級': 2}",4,Y,Y,N,N
鄰居表示，十四日早上五、六點鐘還看到屋內燈火通明，可能是詹文仰也有看到鄰居的身影，立即熄燈，從此就再也沒有看到兩人踏出房門一步。,鄰居 表示 十四日 早上 五 六點鐘 還 看到 屋 內 燈火 通明 可能 是 詹文仰 也 有 看到 鄰居 的 身影 立即 熄燈 從此 就 再 也 沒有 看到 兩 人 踏出 房門 一 步,35,鄰居(10426) 表示(74452) 十四日(2977) 早上(22242) 五(112649) 六點鐘(502) 還(625086) 看到(159419) 屋(30514) 內(183051) 燈火(2411) 通明(698) 可能(271025) 是(4642407) 詹文仰(Unknown) 也(1590760) 有(2217079) 看到(159419) 鄰居(10426) 的(16029838) 身影(6212) 立即(28594) 熄燈(399) 從此(20476) 就(1737544) 再(326207) 也(1590760) 沒有(594280) 看到(159419) 兩(526190) 人(1550512) 踏出(1977) 房門(4557) 一(3701681) 步(45427),"{'High': 34, 'Low': 1}","{'第3級': 3, '第4*級': 2, 'Unknown': 7, '第1級': 13, '第1*級': 4, '第2級': 1, '第5級': 3, '第7級': 1, '第3*級': 1}",3,Y,N,N,Y
事實上，鄰居好幾天前就聞到怪味，但當時並不以為意，以為只是老鼠死掉，可是怪味卻愈來愈濃，鄰居最後受不了，終於向屋主求援，屋主昨晚八時卅分許會同新莊警頭前派出所警員破門而入，赫然發現兄妹倆陳屍在房間，屍體早已浮腫。,事實 上 鄰居 好幾 天 前 就 聞到 怪 味 但 當時 並 不以為意 以為 只是 老鼠 死掉 可是 怪 味 卻 愈來愈 濃 鄰居 最後 受不了 終於 向 屋主 求援 屋主 昨晚 八時 卅分 許 會同 新莊 警頭前 派出所 警員 破門而入 赫然 發現 兄妹倆 陳屍 在 房間 屍體 早已 浮腫,51,事實(84995) 上(1233218) 鄰居(10426) 好幾(30650) 天(330413) 前(272709) 就(1737544) 聞到(3502) 怪(20561) 味(6064) 但(597124) 當時(126214) 並(442790) 不以為意(884) 以為(58719) 只是(96536) 老鼠(10496) 死掉(3333) 可是(125487) 怪(20561) 味(6064) 卻(333007) 愈來愈(19342) 濃(5888) 鄰居(10426) 最後(142102) 受不了(6124) 終於(59622) 向(231672) 屋主(982) 求援(1224) 屋主(982) 昨晚(5400) 八時(307) 卅分(29) 許(6172) 會同(1413) 新莊(562) 警頭前(Unknown) 派出所(646) 警員(1474) 破門而入(Unknown) 赫然(1669) 發現(175233) 兄妹倆(367) 陳屍(161) 在(3284238) 房間(44038) 屍體(13598) 早已(21910) 浮腫(566),"{'High': 48, 'Low': 3}","{'第4級': 9, '第1級': 4, '第3級': 2, 'Unknown': 18, '第2級': 7, '第3*級': 1, '第4*級': 1, '第7級': 3, '第1*級': 3, '第6級': 3}",7,Y,Y,N,Y
警方在房間內發現燃燒木炭的痕跡，加上門窗縫隙都被膠帶封死，研判是二氧化碳中毒，死亡時間約三到五天。,警方 在 房間 內 發現 燃燒 木炭 的 痕跡 加上 門窗 縫隙 都 被 膠帶 封死 研判 是 二氧化碳 中毒 死亡 時間 約 三 到 五 天,27,警方(8008) 在(3284238) 房間(44038) 內(183051) 發現(175233) 燃燒(6861) 木炭(605) 的(16029838) 痕跡(7069) 加上(38121) 門窗(1382) 縫隙(2091) 都(1125846) 被(540683) 膠帶(1200) 封死(193) 研判(1052) 是(4642407) 二氧化碳(1363) 中毒(2753) 死亡(34520) 時間(213595) 約(47731) 三(313861) 到(546906) 五(112649) 天(330413),{'High': 27},"{'Unknown': 4, '第1*級': 2, '第3級': 2, '第2級': 2, '第5級': 3, '第1級': 8, '第6級': 3, '第4*級': 2, '第3*級': 1}",1,Y,Y,N,N
警方還在屋內找到一封詹文仰親筆寫的遺書，他一開始就寫道：「人生絕望」，因為不忍留下妹妹一人受苦，所以才決定帶她一起走。,警方 還 在 屋 內 找到 一 封 詹文仰 親筆 寫 的 遺書 他 一 開始 就 寫道 人生 絕望 因為 不忍 留下 妹妹 一 人 受苦 所以 才 決定 帶 她 一起 走,34,警方(8008) 還(625086) 在(3284238) 屋(30514) 內(183051) 找到(65281) 一(3701681) 封(32905) 詹文仰(Unknown) 親筆(1485) 寫(113933) 的(16029838) 遺書(1281) 他(2487930) 一(3701681) 開始(245562) 就(1737544) 寫道(10052) 人生(69234) 絕望(8699) 因為(425061) 不忍(3203) 留下(29992) 妹妹(15695) 一(3701681) 人(1550512) 受苦(3843) 所以(239080) 才(394539) 決定(101837) 帶(105786) 她(1052913) 一起(79297) 走(128453),"{'High': 33, 'Low': 1}","{'Unknown': 6, '第1*級': 3, '第2級': 5, '第3級': 2, '第1級': 13, '第6級': 1, '第4*級': 1, '第5級': 2, '第3*級': 1}",1,Y,Y,N,Y
信尾還特別向房東太太、房東先生說對不起。,信尾 還 特別 向 房東 太太 房東 先生 說 對不起,10,信尾(62) 還(625086) 特別(91212) 向(231672) 房東(1555) 太太(46720) 房東(1555) 先生(159645) 說(1285247) 對不起(9459),"{'Low': 1, 'High': 9}","{'Unknown': 2, '第2級': 2, '第2*級': 2, '第1級': 4}",1,Y,N,N,N
據指出，房租每月是一萬元，詹文仰因為失業手頭緊，已經兩個月未繳房租。,據 指出 房租 每 月 是 一萬 元 詹文仰 因為 失業 手頭 緊 已經 兩 個 月 未 繳 房租,20,據(24392) 指出(38456) 房租(1203) 每(333357) 月(148997) 是(4642407) 一萬(5844) 元(60807) 詹文仰(Unknown) 因為(425061) 失業(3729) 手頭(1181) 緊(12748) 已經(245160) 兩(526190) 個(2296574) 月(148997) 未(101927) 繳(3244) 房租(1203),"{'High': 19, 'Low': 1}","{'第4*級': 1, 'Unknown': 3, '第2*級': 2, '第1*級': 2, '第1級': 6, '第5級': 2, '第6級': 2, '第4級': 1, '第2級': 1}",1,Y,Y,N,Y
房東知道他們生活辛苦，而且對詹文仰細心照顧妹妹心很感佩，並未為難他們，反而還安慰他「不要緊」，沒想到他還是想不開。,房東 知道 他們 生活 辛苦 而且 對 詹文仰 細心 照顧 妹妹 心 很 感佩 並 未 為難 他們 反而 還 安慰 他 不 要緊 沒想到 他 還是 想 不 開,30,房東(1555) 知道(343214) 他們(716752) 生活(213189) 辛苦(13451) 而且(180402) 對(897964) 詹文仰(Unknown) 細心(4187) 照顧(29251) 妹妹(15695) 心(180243) 很(715675) 感佩(372) 並(442790) 未(101927) 為難(2907) 他們(716752) 反而(39627) 還(625086) 安慰(11587) 他(2487930) 不(2282521) 要緊(4155) 沒想到(13287) 他(2487930) 還是(155231) 想(449884) 不(2282521) 開(62807),"{'High': 29, 'Low': 1}","{'第2*級': 1, '第1級': 11, '第3級': 3, '第2級': 2, 'Unknown': 2, '第5級': 4, '第7級': 1, '第4*級': 1, '第6級': 1, '第4級': 1, '第3*級': 1, '第1*級': 2}",2,Y,Y,N,Y
兩人的大哥聞訊己連夜從嘉義北上辦理後事。,兩 人 的 大哥 聞訊 己 連夜 從 嘉義 北上 辦理 後事,12,兩(526190) 人(1550512) 的(16029838) 大哥(9107) 聞訊(1003) 己(8260) 連夜(1640) 從(496546) 嘉義(2515) 北上(3157) 辦理(7225) 後事(823),{'High': 12},"{'第1級': 3, 'Unknown': 5, '第6級': 1, '第1*級': 1, '第5級': 1, '第7級': 1}",0,Y,N,N,N
刑事局偵一隊二組及北市警大安分局刑事組，昨日凌晨突襲緝查一個強盜集團，在北市中區三處地點，查獲包括國內首見比利時製P90步槍等在內的五把長短槍械、三百多發子彈，以及大麻、快樂丸等毒品。,刑事局 偵一隊 二組 及 北市 警 大安 分局 刑事組 昨日 凌晨 突襲 緝查 一 個 強盜 集團 在 北市 中區 三 處 地點 查獲 包括 國內 首見 比利時製 P90 步槍 等 在 內 的 五 把 長短 槍械 三百多 發 子彈 以及 大麻 快樂丸 等 毒品,46,刑事局(38) 偵一隊(Unknown) 二組(1) 及(304586) 北市(787) 警(964) 大安(286) 分局(510) 刑事組(83) 昨日(2036) 凌晨(3229) 突襲(1337) 緝查(21) 一(3701681) 個(2296574) 強盜(2962) 集團(20609) 在(3284238) 北市(787) 中區(320) 三(313861) 處(84410) 地點(16808) 查獲(259) 包括(74410) 國內(17537) 首見(122) 比利時製(Unknown) P90(3) 步槍(1282) 等(327380) 在(3284238) 內(183051) 的(16029838) 五(112649) 把(617773) 長短(2397) 槍械(452) 三百多(1156) 發(22092) 子彈(4296) 以及(155624) 大麻(1258) 快樂丸(17) 等(327380) 毒品(3177),"{'Low': 8, 'High': 38}","{'Unknown': 21, '第5級': 5, '第6級': 2, '第7級': 2, '第1級': 5, '第1*級': 2, '第3*級': 4, '第4級': 2, '第3級': 1, '第2級': 1, '第4*級': 1}",7,Y,Y,N,Y
到案八名男女嫌犯中，包括北聯幫幫主「仔仔」饒台生的胞弟饒偉生在內，警方研判嫌犯仍藏有其它槍械，正擴大追查中。,到案 八 名 男女 嫌犯 中 包括 北聯幫 幫主 仔仔 饒台生 的 胞弟 饒偉生 在 內 警方 研判 嫌犯 仍 藏有 其它 槍械 正 擴大 追查 中,27,到案(122) 八(54961) 名(136287) 男女(14723) 嫌犯(1224) 中(1011729) 包括(74410) 北聯幫(2) 幫主(644) 仔仔(18) 饒台生(Unknown) 的(16029838) 胞弟(437) 饒偉生(Unknown) 在(3284238) 內(183051) 警方(8008) 研判(1052) 嫌犯(1224) 仍(92056) 藏有(1096) 其它(3339) 槍械(452) 正(179334) 擴大(12352) 追查(1932) 中(1011729),"{'High': 23, 'Low': 4}","{'Unknown': 13, '第1級': 2, '第2級': 2, '第7級': 2, '第3*級': 2, '第1*級': 1, '第3級': 1, '第6級': 2, '第4級': 1, '第5級': 1}",3,Y,N,N,Y
據了解，綽號「小寶」的北聯幫大哥饒偉生(卅六歲)胞兄就是北聯幫幫主「仔仔」饒台生，饒偉生雖屬北聯幫，不過因經營當鋪生意，而與竹聯幫份子熟識。,據了解 綽號 小寶 的 北聯幫 大哥 饒偉生 卅六 歲 胞兄 就是 北聯幫 幫主 仔仔 饒台生 饒偉生 雖 屬 北聯幫 不過 因 經營 當鋪 生意 而 與 竹聯幫 份子 熟識,29,據了解(263) 綽號(2224) 小寶(6821) 的(16029838) 北聯幫(2) 大哥(9107) 饒偉生(Unknown) 卅六(32) 歲(130085) 胞兄(182) 就是(2943) 北聯幫(2) 幫主(644) 仔仔(18) 饒台生(Unknown) 饒偉生(Unknown) 雖(48164) 屬(26012) 北聯幫(2) 不過(186226) 因(119364) 經營(39913) 當鋪(440) 生意(13520) 而(937923) 與(968432) 竹聯幫(20) 份子(9420) 熟識(1380),"{'High': 20, 'Low': 9}","{'Unknown': 18, '第6級': 2, '第1級': 2, '第2級': 2, '第5級': 3, '第3級': 1, '第4*級': 1}",8,Y,Y,N,Y
由於饒偉生平素行事低調，因此，饒偉生在外名號不像其兄饒台生一樣響亮。,由於 饒偉生 平素 行事 低調 因此 饒偉生 在外 名號 不 像 其 兄 饒台生 一樣 響亮,16,由於(88111) 饒偉生(Unknown) 平素(693) 行事(8100) 低調(2546) 因此(184606) 饒偉生(Unknown) 在外(2509) 名號(2018) 不(2282521) 像(289494) 其(307905) 兄(6617) 饒台生(Unknown) 一樣(188109) 響亮(2097),"{'High': 13, 'Low': 3}","{'第4*級': 3, 'Unknown': 4, '第7級': 2, '第6級': 4, '第1級': 1, '第1*級': 2}",3,Y,Y,N,Y
據悉，今年六月中旬，位在北市大安區敦化南路一段的一家進口服飾貿易公司遭三名持刀歹徒侵入，綑綁負責人、店員，劫走六萬元現金以及價值數百萬元的名貴服飾。,據悉 今年 六月 中旬 位在 北市 大安區 敦化南路 一段 的 一 家 進口 服飾 貿易 公司 遭 三名 持刀 歹徒 侵入 綑綁 負責人 店員 劫走 六萬 元 現金 以及 價值 數百萬 元 的 名貴 服飾,35,據悉(283) 今年(10836) 六月(14880) 中旬(1756) 位在(30) 北市(787) 大安區(101) 敦化南路(91) 一段(740) 的(16029838) 一(3701681) 家(236822) 進口(5751) 服飾(3633) 貿易(16952) 公司(168500) 遭(18764) 三名(Unknown) 持刀(336) 歹徒(1353) 侵入(2200) 綑綁(671) 負責人(3840) 店員(3930) 劫走(185) 六萬(1094) 元(60807) 現金(5112) 以及(155624) 價值(58784) 數百萬(1843) 元(60807) 的(16029838) 名貴(798) 服飾(3633),"{'High': 32, 'Low': 3}","{'第7級': 3, '第1級': 7, 'Unknown': 13, '第4級': 2, '第6級': 4, '第4*級': 2, '第2級': 1, '第3級': 1, '第5級': 2}",4,Y,Y,N,N
案發後，轄區大安分局展開偵辦，先於八月間逮獲嫌犯吳世皇，起出部份被搶服飾贓物。,案發 後 轄區 大安 分局 展開 偵辦 先於 八月 間 逮獲 嫌犯 吳世皇 起出 部份 被 搶 服飾 贓物,19,案發(826) 後(422857) 轄區(781) 大安(286) 分局(510) 展開(17154) 偵辦(354) 先於(576) 八月(15534) 間(115638) 逮獲(25) 嫌犯(1224) 吳世皇(Unknown) 起出(89) 部份(11022) 被(540683) 搶(9120) 服飾(3633) 贓物(435),"{'High': 16, 'Low': 3}","{'Unknown': 11, '第1級': 1, '第5級': 1, '第6級': 2, '第7級': 1, '第2級': 2, '第4級': 1}",1,Y,N,N,Y
警方根據吳嫌所稱，查出另兩名搶匪分別為施俊吉(廿一歲)、黃建儒兩人。,警方 根據 吳嫌 所 稱 查出 另 兩 名 搶匪 分別 為 施俊吉 廿一 歲 黃建儒 兩 人,18,警方(8008) 根據(51908) 吳嫌(Unknown) 所(527327) 稱(60191) 查出(1980) 另(138369) 兩(526190) 名(136287) 搶匪(371) 分別(25566) 為(761341) 施俊吉(3) 廿一(231) 歲(130085) 黃建儒(Unknown) 兩(526190) 人(1550512),"{'High': 15, 'Low': 3}","{'Unknown': 9, '第4*級': 2, '第2級': 2, '第3級': 1, '第1級': 4}",2,Y,N,N,Y
大安分局刑事組幹員會同刑事局偵一隊二組幹員組成專案小組，積極佈線緝查在逃共犯。,大安 分局 刑事組 幹員 會同 刑事局 偵一隊 二組 幹員 組成 專案 小組 積極 佈線 緝查 在逃 共犯,17,大安(286) 分局(510) 刑事組(83) 幹員(231) 會同(1413) 刑事局(38) 偵一隊(Unknown) 二組(1) 幹員(231) 組成(20095) 專案(4937) 小組(12825) 積極(24247) 佈線(17) 緝查(21) 在逃(124) 共犯(870),"{'High': 11, 'Low': 6}","{'Unknown': 13, '第7級': 1, '第6級': 1, '第5級': 1, '第4*級': 1}",3,Y,N,N,N
專案人員經多日佈線查訪發現，施俊吉等人不僅在大台北地區犯下多起民宅強盜案，並在北市各知名PUB販售大麻、快樂丸、K他命等毒品。,專案 人員 經 多 日 佈線 查訪 發現 施俊吉 等 人 不僅 在 大台北 地區 犯下 多 起 民宅 強盜案 並 在 北市 各 知名 PUB 販售 大麻 快樂丸 K他命 等 毒品,32,專案(4937) 人員(49261) 經(38471) 多(318992) 日(94041) 佈線(17) 查訪(381) 發現(175233) 施俊吉(3) 等(327380) 人(1550512) 不僅(43138) 在(3284238) 大台北(151) 地區(40339) 犯下(2923) 多(318992) 起(96746) 民宅(637) 強盜案(9) 並(442790) 在(3284238) 北市(787) 各(243023) 知名(9697) PUB(Unknown) 販售(2175) 大麻(1258) 快樂丸(17) K他命(1) 等(327380) 毒品(3177),"{'High': 26, 'Low': 6}","{'第6級': 2, '第5級': 2, 'Unknown': 14, '第1級': 4, '第2級': 2, '第3*級': 3, '第1*級': 2, '第4級': 1, '第4*級': 1, '第7級': 1}",6,Y,Y,N,Y
警方在查知施俊吉等人平日分別在北市長安東路一段、新生北路三段等三處地點出入後，昨日凌晨，警方動員前往三處地點執行突襲搜查，順利逮捕施俊吉、饒偉生、石子奇(廿八歲)、徐子淵(十九歲)、華俊溢(十九歲)、柯建成(卅一歲)，以及一名高姓少年、吳姓女子等。,警方 在 查知 施俊吉 等 人 平日 分別 在 北市 長安東路 一段 新生北路 三段 等 三 處 地點 出入 後 昨日 凌晨 警方 動員 前往 三 處 地點 執行 突襲 搜查 順利 逮捕 施俊吉 饒偉生 石子奇 廿八 歲 徐子淵 十九 歲 華俊溢 十九 歲 柯建成 卅一 歲 以及 一 名 高姓 少年 吳姓 女子 等,55,警方(8008) 在(3284238) 查知(62) 施俊吉(3) 等(327380) 人(1550512) 平日(6274) 分別(25566) 在(3284238) 北市(787) 長安東路(25) 一段(740) 新生北路(8) 三段(470) 等(327380) 三(313861) 處(84410) 地點(16808) 出入(4213) 後(422857) 昨日(2036) 凌晨(3229) 警方(8008) 動員(3827) 前往(27321) 三(313861) 處(84410) 地點(16808) 執行(25364) 突襲(1337) 搜查(1988) 順利(17708) 逮捕(7333) 施俊吉(3) 饒偉生(Unknown) 石子奇(Unknown) 廿八(125) 歲(130085) 徐子淵(Unknown) 十九(5778) 歲(130085) 華俊溢(Unknown) 十九(5778) 歲(130085) 柯建成(Unknown) 卅一(28) 歲(130085) 以及(155624) 一(3701681) 名(136287) 高姓(74) 少年(15730) 吳姓(78) 女子(23797) 等(327380),"{'High': 42, 'Low': 13}","{'Unknown': 23, '第1*級': 2, '第3*級': 5, '第1級': 9, '第4級': 2, '第4*級': 3, '第6級': 4, '第5級': 5, '第7級': 1, '第2級': 1}",9,Y,Y,N,Y
並起出一把P90步槍、一把MP5衝鋒槍、三把九0手槍、子彈三百一十三發、彈匣廿個、大麻一.八公斤、快樂丸四百九十顆、K他命五十瓶、犯罪工具頭套、面罩、手套等物品。,並 起出 一 把 P90 步槍 一 把 MP5 衝鋒槍 三 把 九0 手槍 子彈 三百一十三 發 彈匣 廿 個 大麻 一八 公斤 快樂丸 四百九十 顆 K他命 五十 瓶 犯罪 工具 頭套 面罩 手套 等 物品,36,並(442790) 起出(89) 一(3701681) 把(617773) P90(3) 步槍(1282) 一(3701681) 把(617773) MP5(Unknown) 衝鋒槍(145) 三(313861) 把(617773) 九0(Unknown) 手槍(3564) 子彈(4296) 三百一十三(12) 發(22092) 彈匣(168) 廿(542) 個(2296574) 大麻(1258) 一八(673) 公斤(6150) 快樂丸(17) 四百九十(21) 顆(32006) K他命(1) 五十(17500) 瓶(9509) 犯罪(11684) 工具(26319) 頭套(71) 面罩(515) 手套(3686) 等(327380) 物品(10557),"{'High': 27, 'Low': 9}","{'第4*級': 2, 'Unknown': 17, '第1級': 4, '第2級': 3, '第6級': 2, '第4級': 3, '第7級': 1, '第3級': 2, '第2*級': 1, '第3*級': 1}",7,Y,Y,N,Y
現場儼然是一個大型槍械、毒品集中地。,現場 儼然 是 一 個 大型 槍械 毒品 集中地,9,現場(15949) 儼然(2336) 是(4642407) 一(3701681) 個(2296574) 大型(12588) 槍械(452) 毒品(3177) 集中地(147),{'High': 9},"{'第4*級': 1, '第7級': 1, '第1級': 3, 'Unknown': 4}",1,N,N,N,N
到案八名嫌犯中，除施俊吉外，其餘人員都否認與槍枝、毒品有關。,到案 八 名 嫌犯 中 除 施俊吉 外 其餘 人員 都 否認 與 槍枝 毒品 有關,16,到案(122) 八(54961) 名(136287) 嫌犯(1224) 中(1011729) 除(15929) 施俊吉(3) 外(109310) 其餘(8181) 人員(49261) 都(1125846) 否認(8670) 與(968432) 槍枝(888) 毒品(3177) 有關(69607),"{'High': 15, 'Low': 1}","{'Unknown': 4, '第1級': 3, '第2級': 1, '第7級': 2, '第3*級': 1, '第5級': 3, '第4*級': 1, '第4級': 1}",1,Y,Y,N,Y
據施俊吉供稱，這些槍枝是已經過世的北聯幫大哥「重重」唐重生生前交給他保管至今。,據 施俊吉 供稱 這些 槍枝 是 已經 過世 的 北聯幫 大哥 重重 唐 重生 生前 交給 他 保管 至今,19,據(24392) 施俊吉(3) 供稱(166) 這些(315113) 槍枝(888) 是(4642407) 已經(245160) 過世(8929) 的(16029838) 北聯幫(2) 大哥(9107) 重重(6785) 唐(11933) 重生(1757) 生前(4475) 交給(17334) 他(2487930) 保管(1800) 至今(14540),"{'High': 17, 'Low': 2}","{'第4*級': 1, 'Unknown': 9, '第7級': 1, '第1級': 3, '第2級': 1, '第5級': 2, '第6級': 2}",2,Y,N,N,Y
