sentence,sentence_preprocessed,sentence_length,word_freq,high_low_freq,word_level,long_word_count,is_complete_sentence,is_complete_context,is_blacklist,is_greylist
那麼我們又何須終日在玩弄討論不同廠牌的相機、不同焦距、光圈的鏡頭所拍的照片差了多少色彩濃度？,那麼 我們 又 何須 終日 在 玩弄 討論 不同 廠牌 的 相機 不同 焦距 光圈 的 鏡頭 所 拍 的 照片 差 了 多少 色彩 濃度,26,那麼(127785) 我們(979260) 又(535555) 何須(347) 終日(2595) 在(3284238) 玩弄(2131) 討論(59041) 不同(159432) 廠牌(479) 的(16029838) 相機(3675) 不同(159432) 焦距(605) 光圈(651) 的(16029838) 鏡頭(17952) 所(527327) 拍(28875) 的(16029838) 照片(25355) 差(23865) 了(3199291) 多少(50265) 色彩(16026) 濃度(2815),{'High': 26},"{'第2級': 3, '第1級': 5, '第1*級': 2, 'Unknown': 6, '第6級': 3, '第3*級': 1, '第3級': 3, '第7級': 1, '第5級': 1, '第4*級': 1}",0,Y,N,N,N
攝影者何須廢寢忘食於科學家的工作，攝影者要找尋的只是機具中所隱藏的程式，就是你的相機(不管是萊卡還是柯達(能拍出什麼？,攝影 者 何須 廢寢忘食 於 科學家 的 工作 攝影 者 要 找尋 的 只 是 機具 中 所 隱藏 的 程式 就是 你 的 相機 不管 是 萊卡 還是 柯達 能 拍出 什麼,33,攝影(12899) 者(423504) 何須(347) 廢寢忘食(382) 於(327210) 科學家(18346) 的(16029838) 工作(220164) 攝影(12899) 者(423504) 要(851264) 找尋(4483) 的(16029838) 只(436725) 是(4642407) 機具(515) 中(1011729) 所(527327) 隱藏(9951) 的(16029838) 程式(6566) 就是(2943) 你(1414837) 的(16029838) 相機(3675) 不管(41857) 是(4642407) 萊卡(89) 還是(155231) 柯達(648) 能(582260) 拍出(998) 什麼(431321),"{'High': 32, 'Low': 1}","{'第5級': 5, 'Unknown': 10, '第7級': 1, '第1級': 10, '第6級': 2, '第1*級': 3, '第2級': 1, '第3*級': 1}",2,Y,Y,N,Y
當代的攝影工業相信已凌駕「布列松」、「羅伯‧卡帕」這些大師的年代了，但是我們所拍攝的影像卻與其難以比較；這麼說似乎有失公道，在鋼琴已普遍到人人買得起的現代，世上也沒出現第二個貝多芬。,當代 的 攝影 工業 相信 已 凌駕 布列松 羅伯卡帕 這些 大師 的 年代 了 但是 我們 所 拍攝 的 影像 卻 與 其 難以 比較 這麼 說 似乎 有失 公道 在 鋼琴 已 普遍 到 人人 買得起 的 現代 世上 也 沒 出現 第二 個 貝多芬,46,當代(11423) 的(16029838) 攝影(12899) 工業(20144) 相信(82200) 已(215610) 凌駕(1290) 布列松(52) 羅伯卡帕(Unknown) 這些(315113) 大師(15010) 的(16029838) 年代(15510) 了(3199291) 但是(247988) 我們(979260) 所(527327) 拍攝(15537) 的(16029838) 影像(22328) 卻(333007) 與(968432) 其(307905) 難以(30294) 比較(112212) 這麼(116973) 說(1285247) 似乎(85481) 有失(851) 公道(1568) 在(3284238) 鋼琴(8942) 已(215610) 普遍(16221) 到(546906) 人人(12728) 買得起(440) 的(16029838) 現代(40344) 世上(9075) 也(1590760) 沒(306167) 出現(124694) 第二(98741) 個(2296574) 貝多芬(3508),"{'High': 44, 'Low': 2}","{'第5級': 6, '第1級': 10, 'Unknown': 10, '第2級': 5, '第3級': 2, '第7級': 3, '第4*級': 3, '第4級': 4, '第6級': 1, '第1*級': 1, '第3*級': 1}",4,Y,Y,N,Y
工業文明所帶來的普及化並不期待每個人成為藝術家，但是若你拿著相機不是只想拍拍家庭生活照而已，那麼你至少該認識一點影像文化，了解圖像的語言，才能用照片來表達你想描述的人、事、物。,工業 文明 所 帶來 的 普及化 並 不 期待 每 個 人 成為 藝術家 但是 若 你 拿 著 相機 不 是 只 想 拍拍 家庭 生活照 而已 那麼 你 至少 該 認識 一點 影像 文化 了解 圖像 的 語言 才 能 用 照片 來 表達 你 想 描述 的 人 事 物,53,工業(20144) 文明(17878) 所(527327) 帶來(40305) 的(16029838) 普及化(263) 並(442790) 不(2282521) 期待(21616) 每(333357) 個(2296574) 人(1550512) 成為(143834) 藝術家(26163) 但是(247988) 若(92766) 你(1414837) 拿(69263) 著(1004687) 相機(3675) 不(2282521) 是(4642407) 只(436725) 想(449884) 拍拍(3426) 家庭(60608) 生活照(22) 而已(43005) 那麼(127785) 你(1414837) 至少(41964) 該(148369) 認識(51425) 一點(90745) 影像(22328) 文化(115697) 了解(82970) 圖像(6658) 的(16029838) 語言(49871) 才(394539) 能(582260) 用(377038) 照片(25355) 來(742183) 表達(34582) 你(1414837) 想(449884) 描述(32580) 的(16029838) 人(1550512) 事(385949) 物(16930),"{'High': 52, 'Low': 1}","{'Unknown': 8, '第5級': 4, '第2級': 9, '第3*級': 2, '第1級': 17, '第4*級': 5, '第1*級': 5, '第6級': 1, '第4級': 2}",3,Y,Y,N,N
入門者常犯的錯誤是「詞不達意」，攝影與文學的相同處是「傳遞訊息」；所謂專業，就是能在適當的「時機」、運用適當的「鏡頭」、站在適當的「位置」、選擇適當的「曝光數據」、適當安排畫面中的「元素」來完成一張照片。,入門 者 常 犯 的 錯誤 是 詞不達意 攝影 與 文學 的 相同處 是 傳遞 訊息 所謂 專業 就是 能 在 適當 的 時機 運用 適當 的 鏡頭 站 在 適當 的 位置 選擇 適當 的 曝光 數據 適當 安排 畫面 中 的 元素 來 完成 一 張 照片,49,入門(1853) 者(423504) 常(86207) 犯(13312) 的(16029838) 錯誤(32054) 是(4642407) 詞不達意(73) 攝影(12899) 與(968432) 文學(33345) 的(16029838) 相同處(Unknown) 是(4642407) 傳遞(6590) 訊息(33515) 所謂(59460) 專業(33030) 就是(2943) 能(582260) 在(3284238) 適當(17983) 的(16029838) 時機(11280) 運用(35916) 適當(17983) 的(16029838) 鏡頭(17952) 站(68488) 在(3284238) 適當(17983) 的(16029838) 位置(32151) 選擇(75178) 適當(17983) 的(16029838) 曝光(2785) 數據(8761) 適當(17983) 安排(30105) 畫面(17554) 中(1011729) 的(16029838) 元素(13702) 來(742183) 完成(60471) 一(3701681) 張(99414) 照片(25355),"{'High': 47, 'Low': 2}","{'第6級': 4, 'Unknown': 5, '第1*級': 6, '第4*級': 11, '第1級': 11, '第4級': 3, '第5級': 7, '第3*級': 1, '第2級': 1}",2,Y,Y,N,N
這如同文學家能夠擅用我們所熟知的語言來創作一般，一切只是文字與文字適當的組合。,這 如同 文學家 能夠 擅用 我們 所 熟知 的 語言 來 創作 一般 一切 只 是 文字 與 文字 適當 的 組合,22,這(2114032) 如同(24070) 文學家(1771) 能夠(96422) 擅用(108) 我們(979260) 所(527327) 熟知(2408) 的(16029838) 語言(49871) 來(742183) 創作(30713) 一般(80732) 一切(95523) 只(436725) 是(4642407) 文字(31407) 與(968432) 文字(31407) 適當(17983) 的(16029838) 組合(14334),{'High': 22},"{'第1級': 6, '第5級': 2, 'Unknown': 3, '第2級': 2, '第6級': 1, '第3*級': 2, '第1*級': 1, '第4級': 2, '第4*級': 3}",1,Y,Y,N,N
而初學者該學習的就是了解與擅用影像的「語言」及「文法」；構圖、色彩、符號..........是語言，科學性的原理是文法。,而 初學 者 該 學習 的 就是 了解 與 擅用 影像 的 語言 及 文法 構圖 色彩 符號 是 語言 科學性 的 原理 是 文法,25,而(937923) 初學(1207) 者(423504) 該(148369) 學習(105345) 的(16029838) 就是(2943) 了解(82970) 與(968432) 擅用(108) 影像(22328) 的(16029838) 語言(49871) 及(304586) 文法(2012) 構圖(2843) 色彩(16026) 符號(11491) 是(4642407) 語言(49871) 科學性(543) 的(16029838) 原理(6939) 是(4642407) 文法(2012),{'High': 25},"{'第5級': 3, 'Unknown': 6, '第4*級': 4, '第2級': 3, '第1級': 5, '第3*級': 1, '第3級': 2, '第6級': 1}",1,Y,Y,N,N
你或許不必像專業工作者一樣面面俱到，毫無瑕疵，但至少可以把照片拍得讓人一目了然，知其所言；那麼，你已經是半個懂影像的人了。,你 或許 不必 像 專業 工作 者 一樣 面面俱到 毫無 瑕疵 但 至少 可以 把 照片 拍 得 讓 人 一目了然 知 其 所 言 那麼 你 已經 是 半 個 懂 影像 的 人 了,36,你(1414837) 或許(60077) 不必(29161) 像(289494) 專業(33030) 工作(220164) 者(423504) 一樣(188109) 面面俱到(362) 毫無(32086) 瑕疵(1643) 但(597124) 至少(41964) 可以(560531) 把(617773) 照片(25355) 拍(28875) 得(573721) 讓(526314) 人(1550512) 一目了然(714) 知(108500) 其(307905) 所(527327) 言(97691) 那麼(127785) 你(1414837) 已經(245160) 是(4642407) 半(80813) 個(2296574) 懂(32301) 影像(22328) 的(16029838) 人(1550512) 了(3199291),{'High': 36},"{'第1級': 10, '第4級': 3, '第3級': 2, '第1*級': 3, 'Unknown': 7, '第6級': 2, '第2級': 7, '第7級': 1, '第4*級': 1}",2,Y,Y,N,N
至於另一半，那是更複雜與專業的領域，我將在未來的文章中循序述說。,至於 另 一半 那 是 更 複雜 與 專業 的 領域 我 將 在 未來 的 文章 中 循序 述說,20,至於(39363) 另(138369) 一半(21409) 那(754138) 是(4642407) 更(361676) 複雜(29761) 與(968432) 專業(33030) 的(16029838) 領域(37450) 我(3033032) 將(448374) 在(3284238) 未來(54445) 的(16029838) 文章(36137) 中(1011729) 循序(258) 述說(2279),{'High': 20},"{'第5級': 2, '第3級': 1, '第2級': 1, '第1級': 5, 'Unknown': 3, '第4級': 4, '第4*級': 1, '第6級': 2, '第1*級': 1}",0,Y,Y,N,N
教育部研議改進技專校院教師升等制度，並於1月底前已函請各校針對目前「專科以上學校以技術報告送審教師資格辦法」提出修正意見，預計3月底前彙整各校意見，並邀集行政院科技顧問組、產業界、技專校院代表、學者專家組成專案小組共同研議；4月底前提學審會技職教育審議委員會討論後，提常會審議；7月底前完成法規修正程序。,教育部 研議 改進 技專校院 教師 升等 制度 並 於 1月 底 前 已 函請 各 校 針對 目前 專科 以上 學校 以 技術 報告 送審 教師 資格 辦法 提出 修正 意見 預計 3月 底 前 彙整 各 校 意見 並 邀集 行政院 科技 顧問組 產業界 技專校院 代表 學者 專家 組成 專案 小組 共同 研議 4月 底 前 提 學審會 技職教育 審議 委員會 討論 後 提 常會 審議 7月 底 前 完成 法規 修正 程序,74,教育部(3240) 研議(180) 改進(6433) 技專校院(Unknown) 教師(27836) 升等(304) 制度(37973) 並(442790) 於(327210) 1月(1) 底(37174) 前(272709) 已(215610) 函請(74) 各(243023) 校(14484) 針對(23174) 目前(48695) 專科(1724) 以上(36569) 學校(74782) 以(547785) 技術(47691) 報告(37237) 送審(129) 教師(27836) 資格(8486) 辦法(43280) 提出(63073) 修正(8173) 意見(34740) 預計(2295) 3月(3) 底(37174) 前(272709) 彙整(837) 各(243023) 校(14484) 意見(34740) 並(442790) 邀集(426) 行政院(4347) 科技(30630) 顧問組(3) 產業界(491) 技專校院(Unknown) 代表(58333) 學者(28981) 專家(26090) 組成(20095) 專案(4937) 小組(12825) 共同(36636) 研議(180) 4月(Unknown) 底(37174) 前(272709) 提(33635) 學審會(4) 技職教育(2) 審議(1267) 委員會(19419) 討論(59041) 後(422857) 提(33635) 常會(15) 審議(1267) 7月(4) 底(37174) 前(272709) 完成(60471) 法規(2763) 修正(8173) 程序(11299),"{'High': 63, 'Low': 11}","{'第5級': 9, '第7級': 4, 'Unknown': 22, '第4級': 9, '第4*級': 4, '第3*級': 8, '第1級': 6, '第3級': 4, '第2級': 3, '第6級': 5}",9,Y,Y,N,N
由於近年來業界頻頻反應高等教育培育之人才，不符合產業需求，以致畢業生失業率不斷升高，業界究其原因認為，與大學教師升等制度大都以學術論文為導向有關，使具有實作能力的教師在升等上無法順利通過，並間接鼓勵教師往學術研究方向發展，且對於與產業界之合作則較欠缺動機。,由於 近年 來 業界 頻頻 反應 高等 教育 培育 之 人才 不 符合 產業 需求 以致 畢業生 失業率 不斷 升高 業界 究 其 原因 認為 與 大學 教師 升等 制度 大都 以 學術 論文 為 導向 有關 使 具有 實作 能力 的 教師 在 升等 上 無法 順利 通過 並 間接 鼓勵 教師 往 學術 研究 方向 發展 且 對於 與 產業界 之 合作 則 較 欠缺 動機,68,由於(88111) 近年(7929) 來(742183) 業界(2575) 頻頻(3312) 反應(53196) 高等(4352) 教育(71554) 培育(3504) 之(875481) 人才(17220) 不(2282521) 符合(19232) 產業(29756) 需求(29061) 以致(8954) 畢業生(2772) 失業率(547) 不斷(68526) 升高(3305) 業界(2575) 究(2093) 其(307905) 原因(67404) 認為(192030) 與(968432) 大學(83893) 教師(27836) 升等(304) 制度(37973) 大都(6626) 以(547785) 學術(15150) 論文(16753) 為(761341) 導向(4919) 有關(69607) 使(197544) 具有(60702) 實作(835) 能力(93399) 的(16029838) 教師(27836) 在(3284238) 升等(304) 上(1233218) 無法(150606) 順利(17708) 通過(29652) 並(442790) 間接(5005) 鼓勵(27004) 教師(27836) 往(95775) 學術(15150) 研究(182500) 方向(39560) 發展(117494) 且(67015) 對於(99570) 與(968432) 產業界(491) 之(875481) 合作(35908) 則(254096) 較(78424) 欠缺(4246) 動機(15854),{'High': 68},"{'第4*級': 5, '第4級': 13, '第1級': 5, '第6級': 10, '第5級': 15, '第3級': 3, 'Unknown': 9, '第3*級': 3, '第2級': 4, '第1*級': 1}",3,Y,Y,N,N
對此，教育部已訂有「專科以上學校以技術報告送審教師資格辦法」解決，不過，效果並不理想，教育部統計，87年至90學年度以技術報告送審件數合計僅有85件，與學術著作的上千件相差甚遠，且審核通過共有54件、不通過則有31件，整體通過率為63.53%，也低於學術著作送審通過率79.22%。,對 此 教育部 已 訂有 專科 以上 學校 以 技術 報告 送審 教師 資格 辦法 解決 不過 效果 並 不 理想 教育部 統計 87年 至 90學年度 以 技術 報告 送審 件數 合計 僅有 85 件 與 學術 著作 的 上 千 件 相差 甚 遠 且 審核 通過 共有 54 件 不 通過 則 有 31 件 整體 通過率 為 6353 也 低於 學術 著作 送審 通過率 7922,68,對(897964) 此(288458) 教育部(3240) 已(215610) 訂有(246) 專科(1724) 以上(36569) 學校(74782) 以(547785) 技術(47691) 報告(37237) 送審(129) 教師(27836) 資格(8486) 辦法(43280) 解決(55725) 不過(186226) 效果(38188) 並(442790) 不(2282521) 理想(27021) 教育部(3240) 統計(9580) 87年(71) 至(101530) 90學年度(7) 以(547785) 技術(47691) 報告(37237) 送審(129) 件數(231) 合計(1554) 僅有(4494) 85(1401) 件(139257) 與(968432) 學術(15150) 著作(14009) 的(16029838) 上(1233218) 千(19677) 件(139257) 相差(2610) 甚(21590) 遠(57546) 且(67015) 審核(1296) 通過(29652) 共有(692) 54(1632) 件(139257) 不(2282521) 通過(29652) 則(254096) 有(2217079) 31(3689) 件(139257) 整體(19788) 通過率(7) 為(761341) 6353(Unknown) 也(1590760) 低於(3421) 學術(15150) 著作(14009) 送審(129) 通過率(7) 7922(2),"{'High': 62, 'Low': 6}","{'第1級': 9, '第5級': 12, '第3級': 4, 'Unknown': 17, '第6級': 7, '第3*級': 1, '第4級': 6, '第2級': 3, '第4*級': 5, '第1*級': 4}",8,Y,Y,N,N
教育部分析原因，認為產業界與教師不清楚送審之相關規定，致使辦法開放將專利或技術轉移之成果納入升等的標準，無法被妥善利用。,教育部 分析 原因 認為 產業界 與 教師 不 清楚 送審 之 相關 規定 致使 辦法 開放 將 專利 或 技術 轉移 之 成果 納入 升等 的 標準 無法 被 妥善 利用,31,教育部(3240) 分析(59250) 原因(67404) 認為(192030) 產業界(491) 與(968432) 教師(27836) 不(2282521) 清楚(76185) 送審(129) 之(875481) 相關(41599) 規定(24592) 致使(2775) 辦法(43280) 開放(17546) 將(448374) 專利(3454) 或(478077) 技術(47691) 轉移(7023) 之(875481) 成果(16253) 納入(5488) 升等(304) 的(16029838) 標準(31106) 無法(150606) 被(540683) 妥善(2547) 利用(49229),{'High': 31},"{'第5級': 8, '第3*級': 3, '第2級': 4, 'Unknown': 3, '第4*級': 3, '第4級': 4, '第1級': 2, '第6級': 3, '第3級': 1}",2,Y,Y,N,N
同時，技專校院也反應審查委員皆以學術著作觀點審查，而影響使用技術報告送審升等的通過率。,同時 技專校院 也 反應 審查 委員 皆 以 學術 著作 觀點 審查 而 影響 使用 技術 報告 送審 升等 的 通過率,21,同時(115305) 技專校院(Unknown) 也(1590760) 反應(53196) 審查(4808) 委員(10662) 皆(45736) 以(547785) 學術(15150) 著作(14009) 觀點(38495) 審查(4808) 而(937923) 影響(95840) 使用(99640) 技術(47691) 報告(37237) 送審(129) 升等(304) 的(16029838) 通過率(7),"{'High': 19, 'Low': 2}","{'第3*級': 1, 'Unknown': 4, '第1級': 2, '第4級': 3, '第6級': 3, '第5級': 6, '第3級': 2}",2,Y,Y,N,N
因此，教育部除將進行宣導工作，舉辦分區說明會外，也將自今年開始，分開聘請學術論文及技術報告2類的審查委員。,因此 教育部 除 將 進行 宣導 工作 舉辦 分區 說明會 外 也 將 自 今年 開始 分開 聘請 學術 論文 及 技術 報告 2 類 的 審查 委員,28,因此(184606) 教育部(3240) 除(15929) 將(448374) 進行(100298) 宣導(1111) 工作(220164) 舉辦(12070) 分區(721) 說明會(324) 外(109310) 也(1590760) 將(448374) 自(59676) 今年(10836) 開始(245562) 分開(6975) 聘請(2541) 學術(15150) 論文(16753) 及(304586) 技術(47691) 報告(37237) 2(66480) 類(58191) 的(16029838) 審查(4808) 委員(10662),{'High': 28},"{'第4*級': 2, '第5級': 8, '第3*級': 2, '第7級': 1, '第1級': 5, '第4級': 3, 'Unknown': 3, '第2級': 1, '第6級': 2, '第3級': 1}",2,Y,Y,N,N
怎麼學英文最快、最有效率？,怎麼 學 英文 最 快 最 有 效率,8,怎麼(143418) 學(48982) 英文(15308) 最(421680) 快(116207) 最(421680) 有(2217079) 效率(12802),{'High': 8},"{'第1級': 4, '第1*級': 3, '第4*級': 1}",0,Y,N,N,N
由中視、大中媒體公司和科見美語一同研發出的「中視易學通」(CTVELEARN)隨身機，強調用錄音方式選出3000個美國人最普遍使用的句子，搭配可以隨身攜帶的輕巧儀器，幫助美語學習和記憶。,由 中視 大中 媒體 公司 和 科見 美語 一同 研發出 的 中視 易學通 CTV ELEARN 隨身機 強調 用 錄音 方式 選出 3000 個 美國人 最 普遍 使用 的 句子 搭配 可以 隨身 攜帶 的 輕巧 儀器 幫助 美語 學習 和 記憶,41,由(208604) 中視(975) 大中(262) 媒體(32308) 公司(168500) 和(1338337) 科見(Unknown) 美語(264) 一同(8982) 研發出(543) 的(16029838) 中視(975) 易學通(Unknown) CTV(1) ELEARN(Unknown) 隨身機(Unknown) 強調(36095) 用(377038) 錄音(3971) 方式(133407) 選出(3069) 3000(372) 個(2296574) 美國人(10796) 最(421680) 普遍(16221) 使用(99640) 的(16029838) 句子(7190) 搭配(6314) 可以(560531) 隨身(3376) 攜帶(5385) 的(16029838) 輕巧(908) 儀器(4419) 幫助(62744) 美語(264) 學習(105345) 和(1338337) 記憶(37224),"{'High': 36, 'Low': 5}","{'第4*級': 3, 'Unknown': 16, '第4級': 4, '第2級': 3, '第1級': 6, '第5級': 6, '第1*級': 2, '第7級': 1}",7,Y,Y,N,Y
科見美語老師MichaelRiley表示，台灣人最欠缺「聽」的能力，因為聽不懂，連帶說都成了問題。,科見 美語 老師 Michael Riley 表示 台灣人 最 欠缺 聽 的 能力 因為 聽 不 懂 連帶 說 都 成 了 問題,22,科見(Unknown) 美語(264) 老師(88888) Michael(Unknown) Riley(53) 表示(74452) 台灣人(6865) 最(421680) 欠缺(4246) 聽(138052) 的(16029838) 能力(93399) 因為(425061) 聽(138052) 不(2282521) 懂(32301) 連帶(2640) 說(1285247) 都(1125846) 成(76470) 了(3199291) 問題(280782),"{'Low': 3, 'High': 19}","{'Unknown': 5, '第1級': 9, '第4*級': 2, '第1*級': 3, '第6級': 2, '第2級': 1}",3,Y,Y,N,Y
而這個產品可以不斷加強使用者的聽力，不會把「working」聽成「walking」，順便藉此矯正英語發音。,而 這 個 產品 可以 不斷 加強 使用 者 的 聽力 不會 把 working 聽成 walking 順便 藉 此 矯正 英語 發音,22,而(937923) 這(2114032) 個(2296574) 產品(51029) 可以(560531) 不斷(68526) 加強(13098) 使用(99640) 者(423504) 的(16029838) 聽力(1995) 不會(173045) 把(617773) working(535) 聽成(120) walking(Unknown) 順便(5320) 藉(14277) 此(288458) 矯正(1831) 英語(7012) 發音(3885),"{'High': 21, 'Low': 1}","{'第5級': 2, '第1級': 4, 'Unknown': 8, '第4級': 4, '第4*級': 1, '第2級': 1, '第6級': 1, '第2*級': 1}",2,Y,Y,N,N
行政院衛生署嘉南療養院昨天公佈去年底台南地區國小至高中學生的3項調查報告發現，超過兩成的學生情緒不穩定，常有自殺念頭或情緒暴躁，有憂鬱症的傾向。,行政院 衛生署 嘉南 療養院 昨天 公佈 去年 底 台南 地區 國小 至 高中學生 的 3 項 調查 報告 發現 超過 兩成 的 學生 情緒 不 穩定 常 有 自殺 念頭 或 情緒 暴躁 有 憂鬱症 的 傾向,37,行政院(4347) 衛生署(603) 嘉南(424) 療養院(1130) 昨天(12735) 公佈(1798) 去年(9462) 底(37174) 台南(4016) 地區(40339) 國小(4760) 至(101530) 高中學生(Unknown) 的(16029838) 3(51223) 項(88887) 調查(34821) 報告(37237) 發現(175233) 超過(30507) 兩成(365) 的(16029838) 學生(115846) 情緒(66126) 不(2282521) 穩定(19878) 常(86207) 有(2217079) 自殺(15372) 念頭(13317) 或(478077) 情緒(66126) 暴躁(1964) 有(2217079) 憂鬱症(6415) 的(16029838) 傾向(14029),"{'High': 36, 'Low': 1}","{'Unknown': 8, '第7級': 1, '第1級': 9, '第5級': 5, '第3*級': 2, '第4級': 2, '第4*級': 3, '第3級': 2, '第2級': 1, '第1*級': 1, '第6級': 3}",5,Y,Y,N,N
嘉南療養院去年底對台南市某國小六年級學生進行調查，466名學生中有109人可能有憂鬱症。,嘉南 療養院 去年 底 對 台南市 某 國小 六年級 學生 進行 調查 466 名 學生 中 有 109 人 可能 有 憂鬱症,22,嘉南(424) 療養院(1130) 去年(9462) 底(37174) 對(897964) 台南市(999) 某(119862) 國小(4760) 六年級(1672) 學生(115846) 進行(100298) 調查(34821) 466(54) 名(136287) 學生(115846) 中(1011729) 有(2217079) 109(706) 人(1550512) 可能(271025) 有(2217079) 憂鬱症(6415),"{'High': 21, 'Low': 1}","{'Unknown': 7, '第7級': 1, '第1級': 8, '第3*級': 2, '第5級': 2, '第4*級': 1, '第2級': 1}",6,Y,N,N,N
嘉南療養院同時公佈兩項調查報告，一項是中華民國得勝者教育協會於去年對台南地區國中生的調查，台南市1624名國中一年級學生中，有392人可能有憂鬱症；台南縣1030名國中一年級學生中，有242人有憂鬱症傾向。,嘉南 療養院 同時 公佈 兩 項 調查 報告 一 項 是 中華民國 得勝 者 教育 協會 於 去年 對 台南 地區 國中生 的 調查 台南市 1624 名 國中 一年級 學生 中 有 392 人 可能 有 憂鬱症 台南縣 1030 名 國中 一年級 學生 中 有 242 人 有 憂鬱症 傾向,50,嘉南(424) 療養院(1130) 同時(115305) 公佈(1798) 兩(526190) 項(88887) 調查(34821) 報告(37237) 一(3701681) 項(88887) 是(4642407) 中華民國(5430) 得勝(730) 者(423504) 教育(71554) 協會(13492) 於(327210) 去年(9462) 對(897964) 台南(4016) 地區(40339) 國中生(443) 的(16029838) 調查(34821) 台南市(999) 1624(92) 名(136287) 國中(5108) 一年級(2113) 學生(115846) 中(1011729) 有(2217079) 392(62) 人(1550512) 可能(271025) 有(2217079) 憂鬱症(6415) 台南縣(404) 1030(12) 名(136287) 國中(5108) 一年級(2113) 學生(115846) 中(1011729) 有(2217079) 242(205) 人(1550512) 有(2217079) 憂鬱症(6415) 傾向(14029),"{'High': 47, 'Low': 3}","{'Unknown': 17, '第7級': 1, '第3*級': 1, '第5級': 6, '第1級': 15, '第4*級': 2, '第3級': 2, '第4級': 3, '第2級': 2, '第6級': 1}",13,Y,N,N,N
嘉南療養院一名鄭姓員工在成功大學碩士論文中，也對台南市7所高中、高職隨機採樣調查，發現343名學生中有96人有憂鬱症狀。,嘉南 療養院 一 名 鄭姓 員工 在 成功 大學 碩士 論文 中 也 對 台南市 7 所 高中 高職 隨機 採樣 調查 發現 343 名 學生 中 有 96 人 有 憂鬱 症狀,33,嘉南(424) 療養院(1130) 一(3701681) 名(136287) 鄭姓(30) 員工(31766) 在(3284238) 成功(80266) 大學(83893) 碩士(4129) 論文(16753) 中(1011729) 也(1590760) 對(897964) 台南市(999) 7(21969) 所(527327) 高中(11896) 高職(345) 隨機(3345) 採樣(207) 調查(34821) 發現(175233) 343(99) 名(136287) 學生(115846) 中(1011729) 有(2217079) 96(1047) 人(1550512) 有(2217079) 憂鬱(9291) 症狀(16599),"{'High': 31, 'Low': 2}","{'Unknown': 10, '第7級': 1, '第1級': 8, '第2級': 5, '第4級': 1, '第1*級': 1, '第3*級': 1, '第5級': 4, '第4*級': 2}",3,Y,N,N,Y
精神科醫師鍾明勳表示，憂鬱症、癌症和愛滋病是21世紀人類的3大疾病，自殺則於民國86年起擠進國人的十大死因，自殺也連續蟬連四年青少年十大死因的第三名。,精神科 醫師 鍾明勳 表示 憂鬱症 癌症 和 愛滋病 是 21世紀 人類 的 3 大 疾病 自殺 則 於 民國 86年 起 擠進 國人 的 十 大 死因 自殺 也 連續 蟬連 四 年 青少年 十 大 死因 的 第 三 名,41,精神科(3210) 醫師(30062) 鍾明勳(Unknown) 表示(74452) 憂鬱症(6415) 癌症(10250) 和(1338337) 愛滋病(1799) 是(4642407) 21世紀(404) 人類(78855) 的(16029838) 3(51223) 大(525780) 疾病(25287) 自殺(15372) 則(254096) 於(327210) 民國(16130) 86年(73) 起(96746) 擠進(898) 國人(4275) 的(16029838) 十(77415) 大(525780) 死因(1427) 自殺(15372) 也(1590760) 連續(11873) 蟬連(21) 四(141667) 年(514736) 青少年(16159) 十(77415) 大(525780) 死因(1427) 的(16029838) 第(29965) 三(313861) 名(136287),"{'High': 38, 'Low': 3}","{'Unknown': 14, '第1級': 14, '第4*級': 5, '第5級': 4, '第7級': 1, '第3*級': 1, '第4級': 1, '第2級': 1}",7,Y,Y,N,Y
