sentence,sentence_preprocessed,sentence_length,word_freq,high_low_freq,word_level,long_word_count,is_complete_sentence,is_complete_context,is_blacklist,is_greylist
美國情報官員說，神學士有些部隊已倒戈，但這些部隊均非歐瑪爾的嫡系，與奧薩瑪或基地組織也無密切關係。,美國 情報 官員 說 神學士 有些 部隊 已 倒戈 但 這些 部隊 均 非 歐瑪爾 的 嫡系 與 奧薩瑪 或 基地 組織 也 無 密切 關係,26,美國(148299) 情報(8228) 官員(31382) 說(1285247) 神學士(6) 有些(6971) 部隊(17772) 已(215610) 倒戈(104) 但(597124) 這些(315113) 部隊(17772) 均(27783) 非(112415) 歐瑪爾(3) 的(16029838) 嫡系(616) 與(968432) 奧薩瑪(3) 或(478077) 基地(6653) 組織(69485) 也(1590760) 無(157858) 密切(10538) 關係(162883),"{'High': 23, 'Low': 3}","{'第1級': 4, '第5級': 6, '第4*級': 2, 'Unknown': 7, '第6級': 3, '第3級': 3, '第2級': 1}",3,Y,Y,N,Y
五角大廈說，美國特種部隊已進入阿富汗南部，全力追捕奧薩瑪及基地組織的恐怖份子；他們可能藏身的地方包括洞穴、山區及地下碉堡等。,五角大廈 說 美國 特種 部隊 已 進入 阿富汗 南部 全力 追捕 奧薩瑪 及 基地 組織 的 恐怖份子 他們 可能 藏身 的 地方 包括 洞穴 山區 及 地下 碉堡 等,29,五角大廈(359) 說(1285247) 美國(148299) 特種(588) 部隊(17772) 已(215610) 進入(66885) 阿富汗(1036) 南部(5775) 全力(4329) 追捕(1610) 奧薩瑪(3) 及(304586) 基地(6653) 組織(69485) 的(16029838) 恐怖份子(790) 他們(716752) 可能(271025) 藏身(1664) 的(16029838) 地方(139164) 包括(74410) 洞穴(3953) 山區(4460) 及(304586) 地下(2707) 碉堡(1047) 等(327380),"{'High': 28, 'Low': 1}","{'Unknown': 9, '第1級': 6, '第6級': 3, '第3級': 1, '第4級': 1, '第7級': 2, '第5級': 4, '第1*級': 1, '第3*級': 2}",4,Y,Y,N,Y
奧薩瑪過去幾週不斷改換藏身地點，並似乎已和歐瑪爾分開行動。,奧薩瑪 過去 幾 週 不斷 改換 藏身 地點 並 似乎 已 和 歐瑪爾 分開 行動,15,奧薩瑪(3) 過去(88758) 幾(229415) 週(20879) 不斷(68526) 改換(522) 藏身(1664) 地點(16808) 並(442790) 似乎(85481) 已(215610) 和(1338337) 歐瑪爾(3) 分開(6975) 行動(69326),"{'Low': 2, 'High': 13}","{'Unknown': 4, '第4級': 3, '第1級': 1, '第3級': 2, '第7級': 1, '第3*級': 1, '第4*級': 1, '第5級': 2}",2,Y,Y,N,Y
根據巴基斯坦記者米爾的說法，奧薩瑪之所以不肯離開阿富汗，原因之一是他一心想和美軍在阿富汗的土地上決一死戰；而神學士棄守喀布爾正是他們為美軍所設陷阱的一環。,根據 巴基斯坦 記者 米爾 的 說法 奧薩瑪 之所以 不肯 離開 阿富汗 原因 之 一 是 他 一心 想 和 美軍 在 阿富汗 的 土地 上 決一死戰 而 神學士 棄守 喀布爾 正 是 他們 為 美軍 所 設 陷阱 的 一 環,41,根據(51908) 巴基斯坦(821) 記者(23855) 米爾(379) 的(16029838) 說法(32457) 奧薩瑪(3) 之所以(21602) 不肯(8400) 離開(71748) 阿富汗(1036) 原因(67404) 之(875481) 一(3701681) 是(4642407) 他(2487930) 一心(5936) 想(449884) 和(1338337) 美軍(3434) 在(3284238) 阿富汗(1036) 的(16029838) 土地(32151) 上(1233218) 決一死戰(112) 而(937923) 神學士(6) 棄守(253) 喀布爾(33) 正(179334) 是(4642407) 他們(716752) 為(761341) 美軍(3434) 所(527327) 設(17537) 陷阱(5716) 的(16029838) 一(3701681) 環(4630),"{'High': 38, 'Low': 3}","{'第4*級': 1, 'Unknown': 13, '第4級': 3, '第1級': 11, '第5級': 4, '第2級': 2, '第7級': 2, '第3*級': 2, '第6級': 2, '第1*級': 1}",8,Y,Y,N,Y
米爾聲稱奧薩瑪告訴他，「我們等著美國人和英國人深入阿富汗內陸，然後戰爭才真正開始」。,米爾 聲稱 奧薩瑪 告訴 他 我們 等 著 美國人 和 英國人 深入 阿富汗 內陸 然後 戰爭 才 真正 開始,19,米爾(379) 聲稱(4213) 奧薩瑪(3) 告訴(122898) 他(2487930) 我們(979260) 等(327380) 著(1004687) 美國人(10796) 和(1338337) 英國人(4529) 深入(18074) 阿富汗(1036) 內陸(1334) 然後(156193) 戰爭(42758) 才(394539) 真正(77318) 開始(245562),"{'High': 18, 'Low': 1}","{'Unknown': 7, '第6級': 1, '第1級': 2, '第3*級': 1, '第5級': 1, '第7級': 2, '第1*級': 1, '第4級': 2, '第2級': 2}",4,Y,Y,N,Y
聯合國秘書長安南的阿富汗特使布拉希米今天為阿富汗擬具了一項政治方案，首要目標在促成包括已進佔首都喀布爾的「北方聯盟」等阿富汗各黨派與聯合國官員，儘快於下週共同召開會議，協商阿富汗未來局勢演變的相關議題。,聯合國 秘書長 安南 的 阿富汗 特使 布拉希米 今天 為 阿富汗 擬具 了 一 項 政治 方案 首要 目標 在 促成 包括 已 進佔 首都 喀布爾 的 北方 聯盟 等 阿富汗 各 黨派 與 聯合國 官員 儘快 於 下 週 共同 召開 會議 協商 阿富汗 未來 局勢 演變 的 相關 議題,50,聯合國(4377) 秘書長(2112) 安南(855) 的(16029838) 阿富汗(1036) 特使(987) 布拉希米(Unknown) 今天(73277) 為(761341) 阿富汗(1036) 擬具(54) 了(3199291) 一(3701681) 項(88887) 政治(79504) 方案(14354) 首要(3630) 目標(62638) 在(3284238) 促成(4737) 包括(74410) 已(215610) 進佔(236) 首都(12838) 喀布爾(33) 的(16029838) 北方(9626) 聯盟(7935) 等(327380) 阿富汗(1036) 各(243023) 黨派(1250) 與(968432) 聯合國(4377) 官員(31382) 儘快(1736) 於(327210) 下(329549) 週(20879) 共同(36636) 召開(5858) 會議(30698) 協商(2919) 阿富汗(1036) 未來(54445) 局勢(4418) 演變(4429) 的(16029838) 相關(41599) 議題(15856),"{'High': 47, 'Low': 3}","{'第5級': 7, 'Unknown': 10, '第1級': 5, '第7級': 4, '第4級': 6, '第6級': 8, '第1*級': 2, '第3*級': 2, '第3級': 2, '第2級': 1, '第4*級': 3}",9,Y,Y,N,Y
根據這份政治藍圖，阿富汗應組成廣納各方勢力的過渡時期臨時政府運作兩年，而聯合國不宜組織國際維持和平部隊進駐阿富汗，應由阿富汗獨力組成安全部隊。,根據 這 份 政治 藍圖 阿富汗 應 組成 廣納 各 方 勢力 的 過渡 時期 臨時 政府 運作 兩 年 而 聯合國 不宜 組織 國際 維持 和平 部隊 進駐 阿富汗 應 由 阿富汗 獨力 組成 安全 部隊,37,根據(51908) 這(2114032) 份(53198) 政治(79504) 藍圖(2053) 阿富汗(1036) 應(82417) 組成(20095) 廣納(239) 各(243023) 方(33724) 勢力(15388) 的(16029838) 過渡(2052) 時期(47839) 臨時(7386) 政府(92663) 運作(23209) 兩(526190) 年(514736) 而(937923) 聯合國(4377) 不宜(4289) 組織(69485) 國際(40846) 維持(31284) 和平(14127) 部隊(17772) 進駐(2674) 阿富汗(1036) 應(82417) 由(208604) 阿富汗(1036) 獨力(995) 組成(20095) 安全(35338) 部隊(17772),{'High': 37},"{'第4*級': 3, '第1級': 4, '第2級': 2, '第4級': 4, '第6級': 7, '第7級': 3, 'Unknown': 6, '第3*級': 1, '第5級': 6, '第3級': 1}",4,Y,Y,N,N
但是美國國務院官員私下表示並不欣賞聯合國方案，美國也正在籌劃一支由土耳其、孟加拉、約旦、印尼等回教國家所組成的維和部隊。,但是 美國 國務院 官員 私下 表示 並 不 欣賞 聯合國 方案 美國 也 正在 籌劃 一 支 由 土耳其 孟加拉 約旦 印尼 等 回教 國家 所 組成 的 維和 部隊,30,但是(247988) 美國(148299) 國務院(5161) 官員(31382) 私下(4454) 表示(74452) 並(442790) 不(2282521) 欣賞(17817) 聯合國(4377) 方案(14354) 美國(148299) 也(1590760) 正在(54336) 籌劃(1036) 一(3701681) 支(25666) 由(208604) 土耳其(2537) 孟加拉(367) 約旦(183) 印尼(3068) 等(327380) 回教(1238) 國家(109166) 所(527327) 組成(20095) 的(16029838) 維和(36) 部隊(17772),"{'High': 29, 'Low': 1}","{'第2級': 3, '第1級': 6, 'Unknown': 7, '第4*級': 5, '第5級': 3, '第6級': 4, '第3*級': 1, '第1*級': 1}",4,Y,Y,N,Y
布拉希米向聯合國安全理事會指出，他正致力催促阿富汗各方儘快召開會議。,布拉希米 向 聯合國 安全 理事會 指出 他 正 致力 催促 阿富汗 各 方 儘快 召開 會議,16,布拉希米(Unknown) 向(231672) 聯合國(4377) 安全(35338) 理事會(671) 指出(38456) 他(2487930) 正(179334) 致力(5924) 催促(3352) 阿富汗(1036) 各(243023) 方(33724) 儘快(1736) 召開(5858) 會議(30698),"{'Low': 1, 'High': 15}","{'Unknown': 3, '第2級': 2, '第5級': 2, '第3級': 1, '第1級': 1, '第3*級': 2, '第6級': 3, '第7級': 1, '第4級': 1}",4,Y,N,N,Y
據美國官員表示，邀集阿富汗所有黨派與聯合國官員召開的會議預定下週在阿拉伯聯合大公國揭幕，但確切日程仍未定案。,據 美國 官員 表示 邀集 阿富汗 所有 黨派 與 聯合國 官員 召開 的 會議 預定 下 週 在 阿拉伯 聯合 大公國 揭幕 但 確切 日程 仍 未 定案,28,據(24392) 美國(148299) 官員(31382) 表示(74452) 邀集(426) 阿富汗(1036) 所有(146771) 黨派(1250) 與(968432) 聯合國(4377) 官員(31382) 召開(5858) 的(16029838) 會議(30698) 預定(3218) 下(329549) 週(20879) 在(3284238) 阿拉伯(2688) 聯合(10911) 大公國(69) 揭幕(272) 但(597124) 確切(4747) 日程(415) 仍(92056) 未(101927) 定案(714),"{'High': 27, 'Low': 1}","{'第4*級': 5, '第1級': 2, 'Unknown': 3, '第7級': 2, '第2級': 2, '第6級': 4, '第5級': 5, '第4級': 2, '第1*級': 2, '第3級': 1}",4,Y,Y,N,N
而外交界人士則指出，基於阿富汗鄰國伊朗持反對立場，阿富汗各黨派與聯合國官員的會議可能另擇於瑞士日內瓦召開。,而 外交界 人士 則 指出 基於 阿富汗 鄰國 伊朗 持 反對 立場 阿富汗 各 黨派 與 聯合國 官員 的 會議 可能 另 擇於 瑞士 日內瓦 召開,26,而(937923) 外交界(94) 人士(27666) 則(254096) 指出(38456) 基於(12809) 阿富汗(1036) 鄰國(1217) 伊朗(1572) 持(11680) 反對(26810) 立場(17198) 阿富汗(1036) 各(243023) 黨派(1250) 與(968432) 聯合國(4377) 官員(31382) 的(16029838) 會議(30698) 可能(271025) 另(138369) 擇於(Unknown) 瑞士(3874) 日內瓦(592) 召開(5858),"{'High': 24, 'Low': 2}","{'第5級': 7, 'Unknown': 4, '第6級': 3, '第7級': 4, '第4級': 2, '第2級': 1, '第4*級': 2, '第1級': 2, '第3級': 1}",5,Y,Y,N,N
伊朗與阿富汗「北方聯盟」旗下的回教什葉派哈札拉族裔存有密切的盟誼，而其與阿拉伯聯合大公國間則存有領土爭議。,伊朗 與 阿富汗 北方 聯盟 旗下 的 回教 什葉派 哈札拉 族裔 存有 密切 的 盟誼 而 其 與 阿拉伯 聯合 大公國 間 則 存有 領土 爭議,26,伊朗(1572) 與(968432) 阿富汗(1036) 北方(9626) 聯盟(7935) 旗下(2893) 的(16029838) 回教(1238) 什葉派(52) 哈札拉(Unknown) 族裔(771) 存有(3459) 密切(10538) 的(16029838) 盟誼(Unknown) 而(937923) 其(307905) 與(968432) 阿拉伯(2688) 聯合(10911) 大公國(69) 間(115638) 則(254096) 存有(3459) 領土(3619) 爭議(7127),"{'High': 22, 'Low': 4}","{'第7級': 2, '第4*級': 2, 'Unknown': 8, '第5級': 7, '第6級': 5, '第1級': 2}",5,Y,Y,N,Y
一旦聯合國安理會批准，布拉希米的副手范德海(西班牙籍，目前在阿富汗鄰國巴基斯坦境內)等聯合國政治事務官員，將儘速前往阿富汗首都喀布爾，就政治解決方案相關事宜諮詢各方意見。,一旦 聯合國 安理會 批准 布拉希米 的 副手 范德海 西班牙籍 目前 在 阿富汗 鄰國 巴基斯坦 境內 等 聯合國 政治 事務 官員 將 儘速 前往 阿富汗 首都 喀布爾 就 政治 解決 方案 相關 事宜 諮詢 各 方 意見,36,一旦(37557) 聯合國(4377) 安理會(246) 批准(3455) 布拉希米(Unknown) 的(16029838) 副手(667) 范德海(1) 西班牙籍(14) 目前(48695) 在(3284238) 阿富汗(1036) 鄰國(1217) 巴基斯坦(821) 境內(6) 等(327380) 聯合國(4377) 政治(79504) 事務(12270) 官員(31382) 將(448374) 儘速(438) 前往(27321) 阿富汗(1036) 首都(12838) 喀布爾(33) 就(1737544) 政治(79504) 解決(55725) 方案(14354) 相關(41599) 事宜(3374) 諮詢(5558) 各(243023) 方(33724) 意見(34740),"{'High': 31, 'Low': 5}","{'第5級': 6, 'Unknown': 9, '第6級': 4, '第1級': 2, '第4級': 5, '第1*級': 1, '第7級': 3, '第3*級': 3, '第4*級': 2, '第2級': 1}",10,Y,Y,N,Y
布拉希米期望阿富汗廣納境內及流亡異域的各部落、族裔、宗派及各黨派人士共同組織過渡時期臨時政府。,布拉希米 期望 阿富汗 廣納 境內 及 流亡 異域 的 各 部落 族裔 宗派 及 各 黨派 人士 共同 組織 過渡 時期 臨時 政府,23,布拉希米(Unknown) 期望(13591) 阿富汗(1036) 廣納(239) 境內(6) 及(304586) 流亡(1980) 異域(754) 的(16029838) 各(243023) 部落(17699) 族裔(771) 宗派(761) 及(304586) 各(243023) 黨派(1250) 人士(27666) 共同(36636) 組織(69485) 過渡(2052) 時期(47839) 臨時(7386) 政府(92663),"{'Low': 2, 'High': 21}","{'Unknown': 6, '第4*級': 2, '第7級': 2, '第5級': 6, '第1級': 1, '第2級': 2, '第6級': 2, '第4級': 2}",2,Y,Y,N,Y
此外，布拉希米的方案也建議阿富汗採行下列步驟：邀集阿富汗各方勢力合組兼顧各方均勢的臨時委員會，以團結阿富汗所有族裔、宗教團體及地域性結社。,此外 布拉希米 的 方案 也 建議 阿富汗 採行 下列 步驟 邀集 阿富汗 各 方 勢力 合組 兼顧 各 方 均勢 的 臨時 委員會 以 團結 阿富汗 所有 族裔 宗教 團體 及 地域性 結社,33,此外(30247) 布拉希米(Unknown) 的(16029838) 方案(14354) 也(1590760) 建議(45709) 阿富汗(1036) 採行(1835) 下列(8613) 步驟(12729) 邀集(426) 阿富汗(1036) 各(243023) 方(33724) 勢力(15388) 合組(244) 兼顧(2280) 各(243023) 方(33724) 均勢(119) 的(16029838) 臨時(7386) 委員會(19419) 以(547785) 團結(4877) 阿富汗(1036) 所有(146771) 族裔(771) 宗教(31336) 團體(30852) 及(304586) 地域性(292) 結社(453),"{'High': 32, 'Low': 1}","{'第5級': 8, 'Unknown': 8, '第1級': 3, '第6級': 2, '第3*級': 3, '第7級': 4, '第2級': 3, '第4級': 2}",6,Y,Y,N,Y
可由臨時委員會設定阿富汗過渡時期臨時政府組成要件，並提出臨時政府在政治轉型期(不宜超過兩年)的行動綱領。,可 由 臨時 委員會 設定 阿富汗 過渡 時期 臨時 政府 組成 要件 並 提出 臨時 政府 在 政治 轉型期 不宜 超過 兩 年 的 行動 綱領,26,可(307359) 由(208604) 臨時(7386) 委員會(19419) 設定(10564) 阿富汗(1036) 過渡(2052) 時期(47839) 臨時(7386) 政府(92663) 組成(20095) 要件(1459) 並(442790) 提出(63073) 臨時(7386) 政府(92663) 在(3284238) 政治(79504) 轉型期(245) 不宜(4289) 超過(30507) 兩(526190) 年(514736) 的(16029838) 行動(69326) 綱領(837),{'High': 26},"{'第4*級': 4, '第5級': 5, 'Unknown': 4, '第7級': 3, '第6級': 2, '第4級': 4, '第1*級': 1, '第1級': 3}",3,Y,Y,N,N
臨時政府將肩負起草擬阿富汗新憲法的使命。,臨時 政府 將 肩負起 草擬 阿富汗 新 憲法 的 使命,10,臨時(7386) 政府(92663) 將(448374) 肩負起(182) 草擬(708) 阿富汗(1036) 新(212453) 憲法(4467) 的(16029838) 使命(5540),{'High': 10},"{'第5級': 2, '第4級': 1, 'Unknown': 1, '第7級': 2, '第1級': 2, '第6級': 2}",2,Y,N,N,N
下一階段則可緊急召集阿富汗全體部落長老暨政治領袖大會，以審議批可臨時政府的組成及其行動綱領，並授權臨時政府草擬新憲法。,下 一 階段 則 可 緊急 召集 阿富汗 全體 部落 長老 暨 政治 領袖 大會 以 審議 批可 臨時 政府 的 組成 及 其 行動 綱領 並 授權 臨時 政府 草擬 新 憲法,33,下(329549) 一(3701681) 階段(35628) 則(254096) 可(307359) 緊急(8631) 召集(4315) 阿富汗(1036) 全體(7029) 部落(17699) 長老(4026) 暨(3829) 政治(79504) 領袖(12698) 大會(7830) 以(547785) 審議(1267) 批可(Unknown) 臨時(7386) 政府(92663) 的(16029838) 組成(20095) 及(304586) 其(307905) 行動(69326) 綱領(837) 並(442790) 授權(3802) 臨時(7386) 政府(92663) 草擬(708) 新(212453) 憲法(4467),"{'High': 32, 'Low': 1}","{'第1*級': 1, '第1級': 3, '第4*級': 3, '第5級': 12, '第7級': 4, '第6級': 5, '第4級': 3, 'Unknown': 2}",1,Y,Y,N,N
在阿富汗政局過渡期間，召集第二次全體部落長老暨政治領袖大會，以認可新憲法並據以建立新政府。,在 阿富汗 政局 過渡 期間 召集 第二 次 全體 部落 長老 暨 政治 領袖 大會 以 認可 新 憲法 並 據以 建立 新 政府,24,在(3284238) 阿富汗(1036) 政局(1677) 過渡(2052) 期間(32981) 召集(4315) 第二(98741) 次(331701) 全體(7029) 部落(17699) 長老(4026) 暨(3829) 政治(79504) 領袖(12698) 大會(7830) 以(547785) 認可(5069) 新(212453) 憲法(4467) 並(442790) 據以(643) 建立(52946) 新(212453) 政府(92663),{'High': 24},"{'第1*級': 1, '第7級': 2, 'Unknown': 2, '第6級': 5, '第4*級': 2, '第5級': 7, '第2級': 1, '第4級': 2, '第1級': 2}",1,Y,Y,N,N
廿一個受阿富汗情勢影響或關切當地局勢演變的國家，應持續追蹤阿富汗未來政局的走勢。,廿一 個 受 阿富汗 情勢 影響 或 關切 當地 局勢 演變 的 國家 應 持續 追蹤 阿富汗 未來 政局 的 走勢,21,廿一(231) 個(2296574) 受(109982) 阿富汗(1036) 情勢(7256) 影響(95840) 或(478077) 關切(3828) 當地(23011) 局勢(4418) 演變(4429) 的(16029838) 國家(109166) 應(82417) 持續(33796) 追蹤(6194) 阿富汗(1036) 未來(54445) 政局(1677) 的(16029838) 走勢(844),{'High': 21},"{'Unknown': 4, '第1級': 3, '第4級': 2, '第7級': 2, '第5級': 3, '第3級': 2, '第6級': 2, '第4*級': 2, '第1*級': 1}",2,Y,Y,N,N
此廿一國集團將取代當前阿富汗六個鄰邦與美國及俄羅斯共同組成的「六加二集團」。,此 廿一 國 集團 將 取代 當前 阿富汗 六 個 鄰邦 與 美國 及 俄羅斯 共同 組成 的 六 加 二 集團,22,此(288458) 廿一(231) 國(73377) 集團(20609) 將(448374) 取代(14551) 當前(4812) 阿富汗(1036) 六(77936) 個(2296574) 鄰邦(206) 與(968432) 美國(148299) 及(304586) 俄羅斯(5951) 共同(36636) 組成(20095) 的(16029838) 六(77936) 加(28242) 二(152494) 集團(20609),{'High': 22},"{'第5級': 6, 'Unknown': 3, '第1級': 7, '第6級': 1, '第7級': 1, '第4*級': 1, '第4級': 2, '第2級': 1}",2,Y,Y,N,N
而關於阿富汗的重建及社會結構重組，布拉希米認為，重點應在為阿富汗締造新政治體制、確保民主與人權等價值觀得以深植阿富汗的社會，而不應一味著重鋪橋造路、恢復水電供應等硬體工程建設。,而 關於 阿富汗 的 重建 及 社會 結構 重組 布拉希米 認為 重點 應 在 為 阿富汗 締造 新 政治 體制 確保 民主 與 人權 等 價值觀 得以 深植 阿富汗 的 社會 而 不 應 一味 著重 鋪橋造路 恢復 水電 供應 等 硬體 工程 建設,44,而(937923) 關於(45000) 阿富汗(1036) 的(16029838) 重建(7085) 及(304586) 社會(176660) 結構(43294) 重組(2787) 布拉希米(Unknown) 認為(192030) 重點(22761) 應(82417) 在(3284238) 為(761341) 阿富汗(1036) 締造(1027) 新(212453) 政治(79504) 體制(11517) 確保(9107) 民主(18177) 與(968432) 人權(5467) 等(327380) 價值觀(8964) 得以(20774) 深植(980) 阿富汗(1036) 的(16029838) 社會(176660) 而(937923) 不(2282521) 應(82417) 一味(4921) 著重(4094) 鋪橋造路(Unknown) 恢復(20693) 水電(486) 供應(8826) 等(327380) 硬體(1723) 工程(14284) 建設(11627),"{'High': 42, 'Low': 2}","{'第5級': 13, '第4*級': 2, '第7級': 5, '第1級': 4, '第3*級': 4, 'Unknown': 6, '第2級': 1, '第4級': 4, '第1*級': 1, '第6級': 4}",6,Y,Y,N,Y
陳水扁總統昨日首度對大陸「發聲」，接受中央廣播電台的專訪。,陳水扁 總統 昨日 首度 對 大陸 發聲 接受 中央 廣播 電台 的 專訪,13,陳水扁(1345) 總統(23662) 昨日(2036) 首度(2350) 對(897964) 大陸(27031) 發聲(1950) 接受(84729) 中央(46180) 廣播(9358) 電台(4092) 的(16029838) 專訪(1132),{'High': 13},"{'Unknown': 3, '第4級': 2, '第5級': 3, '第1級': 2, '第3*級': 1, '第6級': 2}",1,Y,N,N,Y
陳總統說，他最大的夢想是兩岸領導人握手的一刻，他呼籲北京當局領導人，和阿扁打交道才是改善兩岸關係最重要的關鍵。,陳 總統 說 他 最 大 的 夢想 是 兩岸 領導人 握手 的 一 刻 他 呼籲 北京 當局 領導人 和 阿扁 打交道 才 是 改善 兩岸 關係 最 重要 的 關鍵,32,陳(10579) 總統(23662) 說(1285247) 他(2487930) 最(421680) 大(525780) 的(16029838) 夢想(15516) 是(4642407) 兩岸(6984) 領導人(9526) 握手(3494) 的(16029838) 一(3701681) 刻(18151) 他(2487930) 呼籲(3515) 北京(36363) 當局(8761) 領導人(9526) 和(1338337) 阿扁(128) 打交道(2525) 才(394539) 是(4642407) 改善(21559) 兩岸(6984) 關係(162883) 最(421680) 重要(154863) 的(16029838) 關鍵(25952),{'High': 32},"{'Unknown': 8, '第4級': 2, '第1級': 10, '第1*級': 2, '第4*級': 2, '第5級': 3, '第6級': 2, '第2級': 2, '第3級': 1}",3,Y,N,N,Y
他還說，希望能有機會到福建詔安展開「尋根之旅」。,他 還 說 希望 能 有 機會 到 福建 詔安 展開 尋 根 之 旅,15,他(2487930) 還(625086) 說(1285247) 希望(119975) 能(582260) 有(2217079) 機會(81244) 到(546906) 福建(5572) 詔安(97) 展開(17154) 尋(8337) 根(38706) 之(875481) 旅(8620),"{'High': 14, 'Low': 1}","{'第1級': 4, 'Unknown': 5, '第2級': 2, '第1*級': 1, '第5級': 2, '第4級': 1}",0,Y,N,N,N
中央廣播電台是以十八種語言對全球播出的國家廣播電台，包括大陸在內。,中央 廣播 電台 是以 十八 種 語言 對 全球 播出 的 國家 廣播 電台 包括 大陸 在 內,18,中央(46180) 廣播(9358) 電台(4092) 是以(149) 十八(13604) 種(701563) 語言(49871) 對(897964) 全球(21104) 播出(2950) 的(16029838) 國家(109166) 廣播(9358) 電台(4092) 包括(74410) 大陸(27031) 在(3284238) 內(183051),{'High': 18},"{'第5級': 3, '第6級': 2, 'Unknown': 4, '第2級': 1, '第1級': 2, '第4級': 1, '第1*級': 2, '第3*級': 2, '第3級': 1}",0,Y,Y,N,N
該台製作「陳水扁的總統之路」，預計分二十五集播出，陳總統昨日下午四時接受為時一小時的專訪。,該 台 製作 陳水扁 的 總統 之 路 預計 分 二十五 集 播出 陳 總統 昨日 下午 四時 接受 為時 一 小時 的 專訪,24,該(148369) 台(29325) 製作(26135) 陳水扁(1345) 的(16029838) 總統(23662) 之(875481) 路(74635) 預計(2295) 分(62224) 二十五(7894) 集(9895) 播出(2950) 陳(10579) 總統(23662) 昨日(2036) 下午(20045) 四時(775) 接受(84729) 為時(559) 一(3701681) 小時(48521) 的(16029838) 專訪(1132),{'High': 24},"{'第4*級': 1, '第2級': 1, '第5級': 4, 'Unknown': 7, '第1級': 7, '第4級': 3, '第6級': 1}",2,Y,N,N,Y
此一專訪的完整內容，將於今早七時中央電台的「早安.中國人」播出。,此 一 專訪 的 完整 內容 將 於 今 早 七時 中央 電台 的 早安 中國人 播出,17,此(288458) 一(3701681) 專訪(1132) 的(16029838) 完整(19201) 內容(55074) 將(448374) 於(327210) 今(33635) 早(62038) 七時(275) 中央(46180) 電台(4092) 的(16029838) 早安(1257) 中國人(22060) 播出(2950),{'High': 17},"{'第5級': 4, '第1級': 5, 'Unknown': 5, '第4*級': 1, '第4級': 1, '第6級': 1}",1,Y,N,N,N
陳總統說，他必須用具體表現，讓國人同胞、華人社會與兩岸人民了解，用愛、民主選舉完成政黨輪替，讓台灣成為真正民主國家的選擇是對的，民主價值是政黨輪替的政黨政治，而不是一黨執政。,陳 總統 說 他 必須 用 具體 表現 讓 國人 同胞 華人 社會 與 兩岸 人民 了解 用 愛 民主 選舉 完成 政黨 輪替 讓 台灣 成為 真正 民主 國家 的 選擇 是 對 的 民主 價值 是 政黨 輪替 的 政黨 政治 而 不 是 一 黨 執政,49,陳(10579) 總統(23662) 說(1285247) 他(2487930) 必須(170592) 用(377038) 具體(20349) 表現(67272) 讓(526314) 國人(4275) 同胞(3450) 華人(9768) 社會(176660) 與(968432) 兩岸(6984) 人民(36441) 了解(82970) 用(377038) 愛(124337) 民主(18177) 選舉(8292) 完成(60471) 政黨(4138) 輪替(632) 讓(526314) 台灣(130718) 成為(143834) 真正(77318) 民主(18177) 國家(109166) 的(16029838) 選擇(75178) 是(4642407) 對(897964) 的(16029838) 民主(18177) 價值(58784) 是(4642407) 政黨(4138) 輪替(632) 的(16029838) 政黨(4138) 政治(79504) 而(937923) 不(2282521) 是(4642407) 一(3701681) 黨(23312) 執政(5128),{'High': 49},"{'Unknown': 6, '第4級': 7, '第1級': 15, '第3級': 1, '第4*級': 5, '第2級': 2, '第6級': 5, '第5級': 4, '第3*級': 3, '第1*級': 1}",0,Y,Y,N,Y
