sentence,sentence_preprocessed,sentence_length,word_freq,high_low_freq,word_level,long_word_count,is_complete_sentence,is_complete_context,is_blacklist,is_greylist
投資人表示，今年十月證管會撤銷該籌備處的許可後，不少投資人欲依認股憑證所規定認股人因故中途退出者，應扣除二成開辦費辦理退費，但幹部們卻指稱大部分資金已投入不動產，只願以每千股五千元處理，懷疑有詐欺的嫌疑。,投資人 表示 今年 十月 證管會 撤銷 該 籌備處 的 許可 後 不少 投資人 欲 依 認股 憑證 所 規定 認股人 因故 中途 退出 者 應 扣除 二成 開辦費 辦理 退費 但 幹部 們 卻 指稱 大部分 資金 已 投入 不動產 只 願 以 每 千 股 五千 元 處理 懷疑 有 詐欺 的 嫌疑,54,投資人(4395) 表示(74452) 今年(10836) 十月(15556) 證管會(66) 撤銷(1822) 該(148369) 籌備處(462) 的(16029838) 許可(3389) 後(422857) 不少(35256) 投資人(4395) 欲(27451) 依(37519) 認股(190) 憑證(745) 所(527327) 規定(24592) 認股人(1) 因故(540) 中途(3063) 退出(5477) 者(423504) 應(82417) 扣除(851) 二成(265) 開辦費(16) 辦理(7225) 退費(81) 但(597124) 幹部(7475) 們(140794) 卻(333007) 指稱(1844) 大部分(32534) 資金(12844) 已(215610) 投入(18783) 不動產(2595) 只(436725) 願(30213) 以(547785) 每(333357) 千(19677) 股(29263) 五千(4916) 元(60807) 處理(61797) 懷疑(29705) 有(2217079) 詐欺(655) 的(16029838) 嫌疑(1683),"{'High': 50, 'Low': 4}","{'Unknown': 18, '第4*級': 4, '第1級': 8, '第6級': 7, '第2級': 2, '第4級': 2, '第5級': 7, '第7級': 3, '第3級': 1, '第1*級': 2}",8,Y,Y,N,N
調查站人員在了解陳情人欲控告的原委後，指出該案權責區在台中市，且不只台中站已曾調查移送偵辦，彰化站也在調查後把鹿港地區的負責人尤金來移送彰化地檢署偵辦。,調查站 人員 在 了解 陳情人 欲 控告 的 原委 後 指出 該 案 權責區 在 台中市 且 不只 台中站 已 曾 調查 移送 偵辦 彰化站 也 在 調查 後 把 鹿港 地區 的 負責人 尤金來 移送 彰化 地檢署 偵辦,39,調查站(5) 人員(49261) 在(3284238) 了解(82970) 陳情人(10) 欲(27451) 控告(1453) 的(16029838) 原委(1032) 後(422857) 指出(38456) 該(148369) 案(11719) 權責區(Unknown) 在(3284238) 台中市(805) 且(67015) 不只(20841) 台中站(19) 已(215610) 曾(132981) 調查(34821) 移送(325) 偵辦(354) 彰化站(3) 也(1590760) 在(3284238) 調查(34821) 後(422857) 把(617773) 鹿港(1119) 地區(40339) 的(16029838) 負責人(3840) 尤金來(Unknown) 移送(325) 彰化(2603) 地檢署(52) 偵辦(354),"{'Low': 7, 'High': 32}","{'Unknown': 15, '第5級': 1, '第1*級': 3, '第3*級': 1, '第6級': 4, '第1級': 5, '第7級': 1, '第4*級': 4, '第3級': 2, '第4級': 2, '第2級': 1}",9,Y,N,N,Y
然而民眾卻表示，尤金來亦為受害人，目前也是陳情代表之一，至於台中調查站在今年四月間把周基順。,然而 民眾 卻 表示 尤金來 亦 為 受害人 目前 也 是 陳情 代表 之 一 至於 台中 調查站 在 今年 四月 間 把 周基順,24,然而(94482) 民眾(17097) 卻(333007) 表示(74452) 尤金來(Unknown) 亦(68507) 為(761341) 受害人(734) 目前(48695) 也(1590760) 是(4642407) 陳情(493) 代表(58333) 之(875481) 一(3701681) 至於(39363) 台中(3661) 調查站(5) 在(3284238) 今年(10836) 四月(14996) 間(115638) 把(617773) 周基順(Unknown),"{'High': 21, 'Low': 3}","{'第5級': 3, '第4*級': 2, '第4級': 3, 'Unknown': 9, '第6級': 1, '第1級': 4, '第1*級': 1, '第2級': 1}",4,Y,Y,N,Y
黃月娥等人，移送台中地檢署偵辦時，僅以違反證券交易法起訴，因此他們才再轉向彰化調查站要求徹查。,黃月娥 等 人 移送 台中 地檢署 偵辦 時 僅 以 違反 證券 交易法 起訴 因此 他們 才 再 轉向 彰化 調查站 要求 徹查,23,黃月娥(Unknown) 等(327380) 人(1550512) 移送(325) 台中(3661) 地檢署(52) 偵辦(354) 時(623734) 僅(30739) 以(547785) 違反(6717) 證券(5757) 交易法(217) 起訴(1999) 因此(184606) 他們(716752) 才(394539) 再(326207) 轉向(10520) 彰化(2603) 調查站(5) 要求(71192) 徹查(167),"{'Low': 3, 'High': 20}","{'Unknown': 9, '第3*級': 3, '第1級': 2, '第6級': 4, '第5級': 2, '第4*級': 1, '第2級': 1, '第1*級': 1}",4,Y,Y,N,Y
彰化調查站在受理偵訊筆錄時，向陳情民眾表示，只要查出確有不法情事，一定依法嚴辦，不過因權責區在台中市，可能把全案移交台中站處理，彰化站則從旁協助偵查。,彰化 調查站 在 受理 偵訊 筆錄 時 向 陳情 民眾 表示 只要 查出 確 有 不法 情事 一定 依法 嚴辦 不過 因 權責區 在 台中市 可能 把 全 案 移交 台中站 處理 彰化站 則 從旁 協助 偵查,37,彰化(2603) 調查站(5) 在(3284238) 受理(695) 偵訊(646) 筆錄(667) 時(623734) 向(231672) 陳情(493) 民眾(17097) 表示(74452) 只要(99140) 查出(1980) 確(6567) 有(2217079) 不法(1309) 情事(1210) 一定(138695) 依法(2242) 嚴辦(160) 不過(186226) 因(119364) 權責區(Unknown) 在(3284238) 台中市(805) 可能(271025) 把(617773) 全(178642) 案(11719) 移交(436) 台中站(19) 處理(61797) 彰化站(3) 則(254096) 從旁(1056) 協助(28701) 偵查(1265),"{'High': 33, 'Low': 4}","{'Unknown': 17, '第1*級': 3, '第3*級': 1, '第2級': 4, '第4*級': 5, '第3級': 1, '第1級': 2, '第6級': 1, '第7級': 2, '第5級': 1}",5,Y,Y,N,N
省立美術館行政工作。,省立 美術館 行政 工作,4,省立(705) 美術館(5538) 行政(15666) 工作(220164),{'High': 4},"{'Unknown': 1, '第6級': 1, '第5級': 1, '第1級': 1}",1,N,N,N,N
一二級主管充斥軍特色彩，其對下屬管理方式亦是軍事管制。,一 二 級 主管 充斥 軍特 色彩 其 對 下屬 管理 方式 亦 是 軍事 管制,16,一(3701681) 二(152494) 級(11106) 主管(23448) 充斥(3208) 軍特(10) 色彩(16026) 其(307905) 對(897964) 下屬(4332) 管理(54484) 方式(133407) 亦(68507) 是(4642407) 軍事(21013) 管制(5335),"{'High': 15, 'Low': 1}","{'第1級': 4, '第4級': 1, '第4*級': 4, '第6級': 5, 'Unknown': 1, '第5級': 1}",0,Y,N,N,N
而發展出有打小報告的情形。,而 發展出 有 打小報告 的 情形,6,而(937923) 發展出(9690) 有(2217079) 打小報告(326) 的(16029838) 情形(35199),{'High': 6},"{'第5級': 1, 'Unknown': 2, '第1級': 2, '第3*級': 1}",2,Y,Y,N,N
教育廳連日來接獲多通電話，指責省立美術館的管理出現弊端。,教育廳 連日 來 接獲 多 通 電話 指責 省立 美術館 的 管理 出現 弊端,14,教育廳(270) 連日(713) 來(742183) 接獲(1016) 多(318992) 通(19493) 電話(38698) 指責(6771) 省立(705) 美術館(5538) 的(16029838) 管理(54484) 出現(124694) 弊端(1129),{'High': 14},"{'Unknown': 2, '第7級': 2, '第1級': 4, '第6級': 3, '第4*級': 2, '第4級': 1}",2,Y,N,N,N
省教育廳決定，將派員前往調查了解。,省 教育廳 決定 將 派員 前往 調查 了解,8,省(17570) 教育廳(270) 決定(101837) 將(448374) 派員(584) 前往(27321) 調查(34821) 了解(82970),{'High': 8},"{'第4級': 1, 'Unknown': 2, '第2級': 1, '第5級': 2, '第4*級': 1, '第3*級': 1}",1,Y,N,N,N
全省最高級的美術館，因為一。,全 省 最 高級 的 美術館 因為 一,8,全(178642) 省(17570) 最(421680) 高級(10823) 的(16029838) 美術館(5538) 因為(425061) 一(3701681),{'High': 8},"{'第2級': 1, '第4級': 1, '第1*級': 2, '第3*級': 1, '第1級': 2, '第6級': 1}",1,Y,Y,N,N
二級主管有多人，具有濃厚軍特背景色彩，曾被外界批評為淪陷區的省立美術館，館長劉河也出身政戰學校，確實難以擺脫外界這種印象。,二 級 主管 有 多 人 具有 濃厚 軍特 背景 色彩 曾 被 外界 批評為 淪陷區 的 省立 美術館 館長 劉河 也 出身 政戰 學校 確實 難以 擺脫 外界 這 種 印象,32,二(152494) 級(11106) 主管(23448) 有(2217079) 多(318992) 人(1550512) 具有(60702) 濃厚(3668) 軍特(10) 背景(23264) 色彩(16026) 曾(132981) 被(540683) 外界(9618) 批評為(250) 淪陷區(235) 的(16029838) 省立(705) 美術館(5538) 館長(1234) 劉河(6) 也(1590760) 出身(12532) 政戰(88) 學校(74782) 確實(36977) 難以(30294) 擺脫(8440) 外界(9618) 這(2114032) 種(701563) 印象(24581),"{'High': 29, 'Low': 3}","{'第1級': 8, '第4級': 2, '第4*級': 4, '第6級': 3, 'Unknown': 8, '第2級': 1, '第5級': 6}",3,Y,N,N,Y
這些向教育廳檢舉的電話還透露出，美術館內下屬的專業人員與行政主管之間常有對峙情形，外界對此也有外行領導內行的批評，致使館中不時有打小報告的情形，這些檢舉內容已引起省教育廳的注意，決定派員前往了解。,這些 向 教育廳 檢舉 的 電話 還 透露出 美術館 內 下屬 的 專業 人員 與 行政 主管 之間 常 有 對峙 情形 外界 對 此 也 有 外行 領導 內行 的 批評 致使 館 中 不時 有 打小報告 的 情形 這些 檢舉 內容 已 引起 省 教育廳 的 注意 決定 派員 前往 了解,53,這些(315113) 向(231672) 教育廳(270) 檢舉(904) 的(16029838) 電話(38698) 還(625086) 透露出(1801) 美術館(5538) 內(183051) 下屬(4332) 的(16029838) 專業(33030) 人員(49261) 與(968432) 行政(15666) 主管(23448) 之間(117932) 常(86207) 有(2217079) 對峙(2505) 情形(35199) 外界(9618) 對(897964) 此(288458) 也(1590760) 有(2217079) 外行(598) 領導(27789) 內行(660) 的(16029838) 批評(24490) 致使(2775) 館(3995) 中(1011729) 不時(10714) 有(2217079) 打小報告(326) 的(16029838) 情形(35199) 這些(315113) 檢舉(904) 內容(55074) 已(215610) 引起(36729) 省(17570) 教育廳(270) 的(16029838) 注意(49591) 決定(101837) 派員(584) 前往(27321) 了解(82970),{'High': 53},"{'Unknown': 10, '第2級': 3, '第7級': 2, '第1級': 11, '第6級': 5, '第3級': 2, '第4級': 4, '第5級': 8, '第4*級': 4, '第1*級': 1, '第3*級': 3}",5,Y,Y,N,N
有關省美館的小道消息多不勝數，如積極爭權的下屬，以各種名義插手館內研究。,有關 省美館 的 小道 消息 多不勝數 如 積極 爭權 的 下屬 以 各 種 名義 插手 館 內 研究,19,有關(69607) 省美館(Unknown) 的(16029838) 小道(1130) 消息(37528) 多不勝數(39) 如(195069) 積極(24247) 爭權(286) 的(16029838) 下屬(4332) 以(547785) 各(243023) 種(701563) 名義(5851) 插手(1681) 館(3995) 內(183051) 研究(182500),"{'High': 17, 'Low': 2}","{'第4級': 1, 'Unknown': 7, '第1級': 2, '第3級': 3, '第4*級': 1, '第6級': 3, '第5級': 1, '第2級': 1}",2,Y,N,N,N
典藏。,典藏,1,典藏(928),{'High': 1},{'Unknown': 1},0,Y,N,N,N
館刊等工作，但上司則刻意積壓公文，使他無法進入當權派。,館刊 等 工作 但 上司 則 刻意 積壓 公文 使 他 無法 進入 當權派,14,館刊(7) 等(327380) 工作(220164) 但(597124) 上司(7237) 則(254096) 刻意(11267) 積壓(551) 公文(1974) 使(197544) 他(2487930) 無法(150606) 進入(66885) 當權派(268),"{'Low': 1, 'High': 13}","{'Unknown': 2, '第3*級': 1, '第1級': 2, '第2級': 1, '第5級': 4, '第6級': 1, '第7級': 2, '第4級': 1}",1,Y,Y,N,N
有人指出美術館內工作分配不均，有人忙得不可開交，有人卻閑得可以開畫展。,有 人 指出 美術館 內 工作 分配 不均 有 人 忙 得 不可開交 有 人 卻 閑 得 可以 開 畫展,21,有(2217079) 人(1550512) 指出(38456) 美術館(5538) 內(183051) 工作(220164) 分配(8696) 不均(622) 有(2217079) 人(1550512) 忙(26342) 得(573721) 不可開交(846) 有(2217079) 人(1550512) 卻(333007) 閑(910) 得(573721) 可以(560531) 開(62807) 畫展(1136),{'High': 21},"{'第1級': 8, 'Unknown': 5, '第6級': 1, '第3級': 1, '第5級': 1, '第7級': 2, '第1*級': 2, '第4級': 1}",2,Y,N,N,N
省美館館長劉河昨日回到台中，知道有不滿人士向教育廳檢舉館內弊端，引起教育廳注意，派員查察一事，他表示經他向人事室查詢，並無教育廳人員到此巡查的情形，對於這種打小報告的情形，他表示並無親身遇到，但是他並不否認內部有不和諧，甚至勞逸不均的情形，今後將多加注意，並朝團體精神，整體榮譽感方向努力，務必使省美館一片朝氣，欣欣向榮，不負民眾期望。,省美館 館長 劉河 昨日 回到 台中 知道 有 不滿 人士 向 教育廳 檢舉 館 內 弊端 引起 教育廳 注意 派員 查察 一 事 他 表示 經 他 向 人事室 查詢 並 無 教育廳 人員 到 此 巡查 的 情形 對於 這 種 打小報告 的 情形 他 表示 並 無 親身 遇到 但是 他 並 不 否認 內部 有 不 和諧 甚至 勞逸不均 的 情形 今後 將 多加 注意 並 朝 團體 精神 整體 榮譽感 方向 努力 務必 使 省美館 一 片 朝氣 欣欣向榮 不 負 民眾 期望,87,省美館(Unknown) 館長(1234) 劉河(6) 昨日(2036) 回到(60084) 台中(3661) 知道(343214) 有(2217079) 不滿(12145) 人士(27666) 向(231672) 教育廳(270) 檢舉(904) 館(3995) 內(183051) 弊端(1129) 引起(36729) 教育廳(270) 注意(49591) 派員(584) 查察(135) 一(3701681) 事(385949) 他(2487930) 表示(74452) 經(38471) 他(2487930) 向(231672) 人事室(81) 查詢(1750) 並(442790) 無(157858) 教育廳(270) 人員(49261) 到(546906) 此(288458) 巡查(771) 的(16029838) 情形(35199) 對於(99570) 這(2114032) 種(701563) 打小報告(326) 的(16029838) 情形(35199) 他(2487930) 表示(74452) 並(442790) 無(157858) 親身(4295) 遇到(29470) 但是(247988) 他(2487930) 並(442790) 不(2282521) 否認(8670) 內部(20578) 有(2217079) 不(2282521) 和諧(8994) 甚至(122502) 勞逸不均(13) 的(16029838) 情形(35199) 今後(5606) 將(448374) 多加(2058) 注意(49591) 並(442790) 朝(59301) 團體(30852) 精神(79222) 整體(19788) 榮譽感(326) 方向(39560) 努力(62566) 務必(4103) 使(197544) 省美館(Unknown) 一(3701681) 片(71870) 朝氣(753) 欣欣向榮(563) 不(2282521) 負(7238) 民眾(17097) 期望(13591),"{'Low': 5, 'High': 82}","{'Unknown': 21, '第5級': 14, '第2級': 8, '第1級': 17, '第7級': 3, '第3級': 1, '第4*級': 12, '第1*級': 1, '第6級': 3, '第3*級': 5, '第4級': 2}",10,Y,Y,N,Y
中市議長林仁德向交通部建議將高速鐵路車站設台中市區內，已引起中縣人士極力反彈，中縣議長林敏霖亦指出，經過專家，及都市計劃學者評估應設在烏日鄉，有其經濟交通上的價值，希望中市不要意氣用事，更不要爭一時，要爭千秋，要為大台中後代子孫發展而著想。,中市 議長 林仁德 向 交通部 建議 將 高速 鐵路 車站 設 台中 市區 內 已 引起 中縣 人士 極力 反彈 中縣 議長 林敏霖 亦 指出 經過 專家 及 都市 計劃 學者 評估 應 設 在 烏日鄉 有 其 經濟 交通 上 的 價值 希望 中市 不要 意氣用事 更 不要 爭 一時 要 爭 千秋 要 為 大 台中 後代 子孫 發展 而 著想,63,中市(32) 議長(729) 林仁德(Unknown) 向(231672) 交通部(506) 建議(45709) 將(448374) 高速(4778) 鐵路(7088) 車站(5982) 設(17537) 台中(3661) 市區(3749) 內(183051) 已(215610) 引起(36729) 中縣(23) 人士(27666) 極力(5116) 反彈(2045) 中縣(23) 議長(729) 林敏霖(Unknown) 亦(68507) 指出(38456) 經過(64617) 專家(26090) 及(304586) 都市(9548) 計劃(22462) 學者(28981) 評估(16292) 應(82417) 設(17537) 在(3284238) 烏日鄉(9) 有(2217079) 其(307905) 經濟(83046) 交通(11639) 上(1233218) 的(16029838) 價值(58784) 希望(119975) 中市(32) 不要(101931) 意氣用事(308) 更(361676) 不要(101931) 爭(11763) 一時(19906) 要(851264) 爭(11763) 千秋(744) 要(851264) 為(761341) 大(525780) 台中(3661) 後代(5727) 子孫(6876) 發展(117494) 而(937923) 著想(2795),"{'Low': 7, 'High': 56}","{'Unknown': 21, '第2級': 4, '第3*級': 2, '第5級': 7, '第4*級': 7, '第4級': 5, '第2*級': 1, '第3級': 3, '第6級': 5, '第1*級': 1, '第1級': 6, '第7級': 1}",5,Y,Y,N,Y
議長林敏霖昨自國外返中縣聞悉情形後，即針對高速鐵路設站表示意見，他表示該案設在烏日是學者專家經過縝密評估，仔細調查後，設計定案，因此，認為中市不必要再爭取改設中市，何況未來台中縣市升格為院轄市，烏日亦屬大台中市，況且目前整個大台中生活圈及捷運系統的設立與配合高鐵設站烏日，腹地大。,議長 林敏霖 昨 自 國外 返 中縣 聞悉 情形 後 即 針對 高速 鐵路 設 站 表示 意見 他 表示 該 案 設 在 烏日 是 學者 專家 經過 縝密 評估 仔細 調查 後 設計 定案 因此 認為 中市 不必 要 再 爭取 改設 中市 何況 未來 台中 縣市 升格為 院轄市 烏日 亦 屬 大 台中市 況且 目前 整 個 大 台中 生活圈 及 捷運 系統 的 設立 與 配合 高鐵 設 站 烏日 腹地 大,76,議長(729) 林敏霖(Unknown) 昨(531) 自(59676) 國外(8646) 返(7712) 中縣(23) 聞悉(12) 情形(35199) 後(422857) 即(110826) 針對(23174) 高速(4778) 鐵路(7088) 設(17537) 站(68488) 表示(74452) 意見(34740) 他(2487930) 表示(74452) 該(148369) 案(11719) 設(17537) 在(3284238) 烏日(30) 是(4642407) 學者(28981) 專家(26090) 經過(64617) 縝密(999) 評估(16292) 仔細(27626) 調查(34821) 後(422857) 設計(59326) 定案(714) 因此(184606) 認為(192030) 中市(32) 不必(29161) 要(851264) 再(326207) 爭取(9666) 改設(127) 中市(32) 何況(10179) 未來(54445) 台中(3661) 縣市(1349) 升格為(360) 院轄市(32) 烏日(30) 亦(68507) 屬(26012) 大(525780) 台中市(805) 況且(4413) 目前(48695) 整(105785) 個(2296574) 大(525780) 台中(3661) 生活圈(430) 及(304586) 捷運(1235) 系統(67366) 的(16029838) 設立(12114) 與(968432) 配合(17173) 高鐵(677) 設(17537) 站(68488) 烏日(30) 腹地(496) 大(525780),"{'High': 67, 'Low': 9}","{'Unknown': 23, '第5級': 8, '第4級': 6, '第3*級': 3, '第1級': 10, '第6級': 4, '第4*級': 12, '第1*級': 4, '第2級': 2, '第7級': 2, '第3級': 2}",5,Y,Y,N,Y
能紓解交通壅塞，應該對大台中整個地區都有好處。,能 紓解 交通 壅塞 應該 對 大 台中 整 個 地區 都 有 好處,14,能(582260) 紓解(1786) 交通(11639) 壅塞(238) 應該(165478) 對(897964) 大(525780) 台中(3661) 整(105785) 個(2296574) 地區(40339) 都(1125846) 有(2217079) 好處(15727),{'High': 14},"{'第1*級': 2, '第6級': 1, '第3級': 2, 'Unknown': 2, '第1級': 5, '第3*級': 1, '第4級': 1}",0,Y,N,N,N
而且專家已肯定，似不宜再變更。,而且 專家 已 肯定 似 不宜 再 變更,8,而且(180402) 專家(26090) 已(215610) 肯定(34303) 似(17655) 不宜(4289) 再(326207) 變更(2885),{'High': 8},"{'第3級': 2, '第4級': 1, '第4*級': 1, '第5級': 1, '第6級': 2, '第1*級': 1}",0,Y,Y,N,N
至於縣府方面亦表示，台灣西部交通走廊高速鐵路的規劃，路線是經過中縣烏日鄉，如能在烏日設置車站，由於位在台中縣市。,至於 縣府 方面 亦 表示 台灣 西部 交通 走廊 高速 鐵路 的 規劃 路線 是 經過 中縣 烏日鄉 如 能 在 烏日 設置 車站 由於 位 在 台中 縣市,29,至於(39363) 縣府(572) 方面(75079) 亦(68507) 表示(74452) 台灣(130718) 西部(5186) 交通(11639) 走廊(8563) 高速(4778) 鐵路(7088) 的(16029838) 規劃(14663) 路線(9508) 是(4642407) 經過(64617) 中縣(23) 烏日鄉(9) 如(195069) 能(582260) 在(3284238) 烏日(30) 設置(7131) 車站(5982) 由於(88111) 位(284809) 在(3284238) 台中(3661) 縣市(1349),"{'High': 26, 'Low': 3}","{'第5級': 2, 'Unknown': 8, '第3*級': 1, '第6級': 3, '第4*級': 3, '第1級': 4, '第3級': 1, '第4級': 2, '第2級': 1, '第1*級': 3, '第2*級': 1}",1,Y,Y,N,N
台中縣。,台中縣,1,台中縣(376),{'High': 1},{'Unknown': 1},1,N,N,N,N
彰化縣交界處，交通網四通八達，服務範圍則更因地點適中，功能更大。,彰化縣 交界處 交通網 四通八達 服務 範圍 則 更 因 地點 適中 功能 更 大,14,彰化縣(742) 交界處(477) 交通網(71) 四通八達(277) 服務(38055) 範圍(24784) 則(254096) 更(361676) 因(119364) 地點(16808) 適中(675) 功能(38600) 更(361676) 大(525780),"{'High': 13, 'Low': 1}","{'Unknown': 7, '第3級': 1, '第4*級': 1, '第5級': 1, '第3*級': 1, '第6級': 1, '第4級': 1, '第1級': 1}",4,Y,Y,N,N
在地理上烏日亦坐落台中大都會區內，位置恰為中。,在 地理 上 烏日 亦 坐落 台中 大 都會區 內 位置 恰 為 中,14,在(3284238) 地理(7072) 上(1233218) 烏日(30) 亦(68507) 坐落(1290) 台中(3661) 大(525780) 都會區(398) 內(183051) 位置(32151) 恰(2235) 為(761341) 中(1011729),"{'High': 13, 'Low': 1}","{'第1*級': 1, '第4*級': 2, '第1級': 2, 'Unknown': 6, '第6級': 2, '第3級': 1}",1,Y,N,N,N
彰。,彰,1,彰(456),{'High': 1},{'Unknown': 1},0,N,N,N,N
投四縣市中心點，將來捷運系統。,投 四 縣市 中心點 將來 捷運 系統,7,投(6092) 四(141667) 縣市(1349) 中心點(608) 將來(17836) 捷運(1235) 系統(67366),{'High': 7},"{'第4級': 2, '第1級': 1, 'Unknown': 2, '第3級': 1, '第5級': 1}",1,N,N,N,N
鐵路。,鐵路,1,鐵路(7088),{'High': 1},{'第4級': 1},0,N,N,N,N
公路各線交通網以烏日為中心點，其整體規劃開發，在土地上取得比較容易，各種交通工具接駁。,公路 各 線 交通網 以 烏日 為 中心點 其 整體 規劃 開發 在 土地 上 取得 比較 容易 各 種 交通 工具 接駁,23,公路(7300) 各(243023) 線(17703) 交通網(71) 以(547785) 烏日(30) 為(761341) 中心點(608) 其(307905) 整體(19788) 規劃(14663) 開發(19196) 在(3284238) 土地(32151) 上(1233218) 取得(25649) 比較(112212) 容易(80831) 各(243023) 種(701563) 交通(11639) 工具(26319) 接駁(345),"{'High': 21, 'Low': 2}","{'第3*級': 1, '第2級': 3, '第4級': 3, 'Unknown': 6, '第5級': 3, '第6級': 2, '第4*級': 1, '第1*級': 1, '第1級': 2, '第3級': 1}",2,Y,N,N,N
轉運方便，而在中程服務，可利用公路。,轉運 方便 而 在 中程 服務 可 利用 公路,9,轉運(697) 方便(14172) 而(937923) 在(3284238) 中程(222) 服務(38055) 可(307359) 利用(49229) 公路(7300),{'High': 9},"{'Unknown': 2, '第1*級': 2, '第5級': 1, '第3級': 1, '第4*級': 1, '第3*級': 2}",0,Y,Y,N,N
鐵路通台中港。,鐵路 通 台中港,3,鐵路(7088) 通(19493) 台中港(43),"{'High': 2, 'Low': 1}","{'第4級': 1, '第4*級': 1, 'Unknown': 1}",1,Y,N,N,N
南達雲林。,南 達 雲林,3,南(24203) 達(25383) 雲林(859),{'High': 3},"{'第2級': 1, 'Unknown': 2}",0,Y,N,N,N
北通苗栗，任何角度的發展，都不會受到限制。,北 通 苗栗 任何 角度 的 發展 都 不會 受到 限制,11,北(20351) 通(19493) 苗栗(976) 任何(131795) 角度(26690) 的(16029838) 發展(117494) 都(1125846) 不會(173045) 受到(66513) 限制(23094),{'High': 11},"{'第2級': 1, '第4*級': 3, 'Unknown': 2, '第5級': 1, '第1級': 2, '第4級': 2}",0,Y,N,N,N
所以中縣府會及工商界人士都希望將高鐵台中站設在烏日，有百利而無一害。,所以 中縣 府會 及 工商界 人士 都 希望 將 高鐵 台中站 設 在 烏日 有 百 利 而 無 一 害,21,所以(239080) 中縣(23) 府會(39) 及(304586) 工商界(297) 人士(27666) 都(1125846) 希望(119975) 將(448374) 高鐵(677) 台中站(19) 設(17537) 在(3284238) 烏日(30) 有(2217079) 百(24843) 利(10140) 而(937923) 無(157858) 一(3701681) 害(15573),"{'High': 17, 'Low': 4}","{'第1*級': 2, 'Unknown': 6, '第5級': 6, '第1級': 4, '第2級': 1, '第4級': 2}",2,Y,Y,N,N
虎尾警分局昨天下午在土庫鎮興新里查獲一家地下爆竹工廠，並起出大批成品。,虎尾 警分局 昨天 下午 在 土庫鎮 興新里 查獲 一 家 地下 爆竹 工廠 並 起出 大 批 成品,18,虎尾(464) 警分局(5) 昨天(12735) 下午(20045) 在(3284238) 土庫鎮(32) 興新里(Unknown) 查獲(259) 一(3701681) 家(236822) 地下(2707) 爆竹(330) 工廠(16192) 並(442790) 起出(89) 大(525780) 批(22121) 成品(1767),"{'High': 14, 'Low': 4}","{'Unknown': 9, '第1級': 5, '第1*級': 1, '第4級': 1, '第4*級': 1, '第5級': 1}",3,Y,Y,N,N
半成品及原料，負責人閻景祿被依公共危險及違反商業法罪嫌移送法辦。,半成品 及 原料 負責人 閻景祿 被 依 公共 危險 及 違反 商業法 罪嫌 移送法辦,14,半成品(231) 及(304586) 原料(4385) 負責人(3840) 閻景祿(Unknown) 被(540683) 依(37519) 公共(16088) 危險(30190) 及(304586) 違反(6717) 商業法(16) 罪嫌(182) 移送法辦(66),"{'High': 11, 'Low': 3}","{'Unknown': 7, '第5級': 3, '第2級': 1, '第4級': 1, '第3級': 1, '第6級': 1}",5,Y,Y,N,Y
