sentence,sentence_preprocessed,sentence_length,word_freq,high_low_freq,word_level,long_word_count,is_complete_sentence,is_complete_context,is_blacklist,is_greylist
老師說幼女童軍是一種教育兒童身心健康，人格完整，而以服務社會人群為宗旨的訓練制度，是英國貝登堡爵士所創，他也就是童子軍之父。,老師 說 幼 女 童軍 是 一 種 教育 兒童 身心 健康 人格 完整 而 以 服務 社會 人群 為 宗旨 的 訓練 制度 是 英國 貝登堡 爵士 所 創 他 也 就 是 童子軍 之 父,37,老師(88888) 說(1285247) 幼(3065) 女(51944) 童軍(488) 是(4642407) 一(3701681) 種(701563) 教育(71554) 兒童(30462) 身心(9736) 健康(50041) 人格(16637) 完整(19201) 而(937923) 以(547785) 服務(38055) 社會(176660) 人群(8886) 為(761341) 宗旨(2510) 的(16029838) 訓練(39436) 制度(37973) 是(4642407) 英國(44248) 貝登堡(7) 爵士(9225) 所(527327) 創(5368) 他(2487930) 也(1590760) 就(1737544) 是(4642407) 童子軍(504) 之(875481) 父(12251),"{'High': 36, 'Low': 1}","{'第1級': 11, 'Unknown': 8, '第1*級': 1, '第3級': 2, '第4級': 3, '第5級': 5, '第2級': 2, '第4*級': 1, '第3*級': 1, '第6級': 3}",2,Y,Y,N,Y
上幼女童軍課時，老師帶領我們唱歌、跳舞、玩遊戲，小童子軍們個個都興高采烈的玩著、笑著，還教我們做蘿蔔絲餅、煎荷包蛋、縫扣子等等。,上 幼 女 童軍 課 時 老師 帶領 我們 唱歌 跳舞 玩 遊戲 小 童子軍 們 個個 都 興高采烈 的 玩 著 笑 著 還 教 我們 做 蘿蔔絲餅 煎 荷包蛋 縫 扣子 等等,34,上(1233218) 幼(3065) 女(51944) 童軍(488) 課(14124) 時(623734) 老師(88888) 帶領(10447) 我們(979260) 唱歌(5901) 跳舞(6124) 玩(38177) 遊戲(31463) 小(318835) 童子軍(504) 們(140794) 個個(5022) 都(1125846) 興高采烈(1692) 的(16029838) 玩(38177) 著(1004687) 笑(68493) 著(1004687) 還(625086) 教(42322) 我們(979260) 做(411649) 蘿蔔絲餅(6) 煎(3321) 荷包蛋(228) 縫(3752) 扣子(411) 等等(38274),"{'High': 33, 'Low': 1}","{'第1級': 9, 'Unknown': 11, '第1*級': 6, '第3*級': 2, '第5級': 1, '第3級': 1, '第6級': 1, '第2級': 1, '第4*級': 2}",4,Y,Y,N,N
記得有一次做蘿蔔絲餅時，小童子軍們手忙腳亂，鍋子也打翻了，有的還燒焦，吃起來卻特別的香呢！,記得 有 一 次 做 蘿蔔絲餅 時 小 童子軍 們 手忙腳亂 鍋子 也 打翻 了 有的 還 燒焦 吃起來 卻 特別 的 香 呢,24,記得(47506) 有(2217079) 一(3701681) 次(331701) 做(411649) 蘿蔔絲餅(6) 時(623734) 小(318835) 童子軍(504) 們(140794) 手忙腳亂(822) 鍋子(1463) 也(1590760) 打翻(900) 了(3199291) 有的(31553) 還(625086) 燒焦(979) 吃起來(972) 卻(333007) 特別(91212) 的(16029838) 香(13312) 呢(204566),"{'High': 23, 'Low': 1}","{'第2級': 5, '第1級': 8, 'Unknown': 7, '第3*級': 1, '第5級': 1, '第4級': 2}",4,Y,N,N,N
六上我又再度參加幼女童軍，感到很親切，同時也學到很多東西，在家時也會幫忙做家事，遇到挫折時，不再退縮，個性變得較活潑、開朗，人也比以前獨立，不再事事依賴父母。,六上 我 又 再度 參加 幼 女 童軍 感到 很 親切 同時 也 學到 很多 東西 在 家 時 也 會 幫忙 做 家事 遇到 挫折 時 不再 退縮 個性 變 得 較 活潑 開朗 人 也 比 以前 獨立 不再 事事 依賴 父母,44,六上(12) 我(3033032) 又(535555) 再度(22234) 參加(42962) 幼(3065) 女(51944) 童軍(488) 感到(74094) 很(715675) 親切(7040) 同時(115305) 也(1590760) 學到(10451) 很多(113128) 東西(139472) 在(3284238) 家(236822) 時(623734) 也(1590760) 會(1014977) 幫忙(21072) 做(411649) 家事(4101) 遇到(29470) 挫折(11542) 時(623734) 不再(51754) 退縮(2988) 個性(18904) 變(80345) 得(573721) 較(78424) 活潑(6141) 開朗(2962) 人(1550512) 也(1590760) 比(170486) 以前(59453) 獨立(29364) 不再(51754) 事事(2132) 依賴(13548) 父母(78215),"{'Low': 1, 'High': 43}","{'Unknown': 9, '第1級': 9, '第1*級': 6, '第5級': 3, '第2級': 4, '第4級': 7, '第3*級': 3, '第6級': 2, '第3級': 1}",0,Y,N,N,N
今後，我要實踐幼女童軍的諾言，幫助需要幫助的人，遵守幼女童軍的規律，服從尊長、不自私，助人為快樂之本。,今後 我 要 實踐 幼 女 童軍 的 諾言 幫助 需要 幫助 的 人 遵守 幼 女 童軍 的 規律 服從 尊長 不 自私 助人 為 快樂 之 本,29,今後(5606) 我(3033032) 要(851264) 實踐(17654) 幼(3065) 女(51944) 童軍(488) 的(16029838) 諾言(1393) 幫助(62744) 需要(166793) 幫助(62744) 的(16029838) 人(1550512) 遵守(7070) 幼(3065) 女(51944) 童軍(488) 的(16029838) 規律(7165) 服從(5483) 尊長(227) 不(2282521) 自私(4796) 助人(2009) 為(761341) 快樂(45366) 之(875481) 本(197156),{'High': 29},"{'第4*級': 1, '第1級': 8, '第5級': 6, 'Unknown': 6, '第1*級': 3, '第6級': 2, '第2級': 3}",0,Y,N,N,N
其實不只是幼女童軍才能做，我相信，只要自己肯去做，每一個人都能夠做到的。,其實 不 只是 幼 女 童軍 才 能 做 我 相信 只要 自己 肯 去 做 每 一 個 人 都 能夠 做到 的,24,其實(109290) 不(2282521) 只是(96536) 幼(3065) 女(51944) 童軍(488) 才(394539) 能(582260) 做(411649) 我(3033032) 相信(82200) 只要(99140) 自己(744739) 肯(21145) 去(479993) 做(411649) 每(333357) 一(3701681) 個(2296574) 人(1550512) 都(1125846) 能夠(96422) 做到(19894) 的(16029838),{'High': 24},"{'第3*級': 2, '第1級': 10, '第4級': 1, 'Unknown': 3, '第1*級': 4, '第2級': 2, '第3級': 1, '第4*級': 1}",0,Y,Y,N,N
出國記‧好棒啊！,出國記 好棒 啊,3,出國記(13) 好棒(678) 啊(135484),"{'Low': 1, 'High': 2}","{'Unknown': 2, '第2級': 1}",1,Y,N,N,N
要出國了，我的心情就像吊桶一樣七上八下的，要睡覺時像打了興奮劑似的，久久都睡不著，好不容易才和周公一道下棋去。,要 出國 了 我 的 心情 就 像 吊桶 一樣 七上八下 的 要 睡覺 時 像 打 了 興奮劑 似的 久久 都 睡 不 著 好不容易 才 和 周公 一道 下棋 去,32,要(851264) 出國(4937) 了(3199291) 我(3033032) 的(16029838) 心情(33611) 就(1737544) 像(289494) 吊桶(33) 一樣(188109) 七上八下(437) 的(16029838) 要(851264) 睡覺(14542) 時(623734) 像(289494) 打(76962) 了(3199291) 興奮劑(822) 似的(20081) 久久(2110) 都(1125846) 睡(32669) 不(2282521) 著(1004687) 好不容易(5888) 才(394539) 和(1338337) 周公(1754) 一道(236) 下棋(1705) 去(479993),"{'High': 31, 'Low': 1}","{'第1級': 11, '第3級': 1, 'Unknown': 12, '第3*級': 2, '第1*級': 3, '第6級': 1, '第2級': 1, '第4*級': 1}",3,Y,N,N,Y
起床了呀！,起床 了 呀,3,起床(6314) 了(3199291) 呀(47302),{'High': 3},"{'第1*級': 1, 'Unknown': 1, '第2級': 1}",0,Y,N,N,N
媽媽叫醒了我，於是趕緊刷牙漱口。,媽媽 叫醒 了 我 於是 趕緊 刷牙 漱口,8,媽媽(70492) 叫醒(1717) 了(3199291) 我(3033032) 於是(108155) 趕緊(11897) 刷牙(1236) 漱口(547),{'High': 8},"{'第1級': 2, '第4*級': 3, 'Unknown': 3}",0,Y,Y,N,N
到了中正國際機場時，經過了繁忙的手續後，才上了飛機，飛機起飛時就像千斤的石頭壓在身上一樣，終於，我們到了目的地琉球。,到 了 中正 國際 機場 時 經過 了 繁忙 的 手續 後 才 上 了 飛機 飛機 起飛 時 就 像 千 斤 的 石頭 壓 在 身 上 一樣 終於 我們 到 了 目的地 琉球,36,到(546906) 了(3199291) 中正(1643) 國際(40846) 機場(7570) 時(623734) 經過(64617) 了(3199291) 繁忙(1789) 的(16029838) 手續(2500) 後(422857) 才(394539) 上(1233218) 了(3199291) 飛機(18598) 飛機(18598) 起飛(3036) 時(623734) 就(1737544) 像(289494) 千(19677) 斤(5193) 的(16029838) 石頭(17808) 壓(9687) 在(3284238) 身(122324) 上(1233218) 一樣(188109) 終於(59622) 我們(979260) 到(546906) 了(3199291) 目的地(3569) 琉球(1532),{'High': 36},"{'第1級': 10, 'Unknown': 6, '第4級': 4, '第2*級': 1, '第3*級': 2, '第2級': 2, '第6級': 1, '第5級': 1, '第1*級': 5, '第4*級': 4}",1,Y,N,N,Y
到了琉球，第一天導遊帶我們遊覽，經過了美軍的基地。,到 了 琉球 第一 天 導遊 帶 我們 遊覽 經過 了 美軍 的 基地,14,到(546906) 了(3199291) 琉球(1532) 第一(172544) 天(330413) 導遊(1089) 帶(105786) 我們(979260) 遊覽(1311) 經過(64617) 了(3199291) 美軍(3434) 的(16029838) 基地(6653),{'High': 14},"{'第1級': 5, 'Unknown': 4, '第2級': 2, '第7級': 1, '第5級': 2}",0,Y,N,N,N
我看到裡面有好幾架戰鬥機，也有戰車和大大小小的船艦，導遊帶我們去看那霸機場，我睜大眼睛看到了鐵絲網中，飛機起起落落，幾乎沒有休息的時間。,我 看到 裡面 有 好幾 架 戰鬥機 也 有 戰車 和 大大小小 的 船艦 導遊 帶 我們 去 看 那霸 機場 我 睜大 眼睛 看到 了 鐵絲網 中 飛機 起起落落 幾乎 沒有 休息 的 時間,35,我(3033032) 看到(159419) 裡面(40741) 有(2217079) 好幾(30650) 架(13400) 戰鬥機(841) 也(1590760) 有(2217079) 戰車(1750) 和(1338337) 大大小小(1994) 的(16029838) 船艦(1182) 導遊(1089) 帶(105786) 我們(979260) 去(479993) 看(444691) 那霸(44) 機場(7570) 我(3033032) 睜大(2227) 眼睛(65022) 看到(159419) 了(3199291) 鐵絲網(848) 中(1011729) 飛機(18598) 起起落落(233) 幾乎(74298) 沒有(594280) 休息(20958) 的(16029838) 時間(213595),"{'High': 34, 'Low': 1}","{'第1級': 12, '第1*級': 6, 'Unknown': 12, '第4級': 2, '第6級': 1, '第7級': 1, '第2*級': 1}",4,Y,Y,N,N
停車場中，車子停得整整齊齊的，真是守法。,停車場 中 車子 停 得 整整齊齊 的 真 是 守法,10,停車場(2735) 中(1011729) 車子(15933) 停(21846) 得(573721) 整整齊齊(936) 的(16029838) 真(137497) 是(4642407) 守法(831),{'High': 10},"{'第3級': 2, 'Unknown': 3, '第1級': 3, '第1*級': 1, '第6級': 1}",2,Y,N,N,N
第二天，坐上車子要去伊計島，途中的海邊，到處是游泳的人潮。,第二 天 坐上 車子 要 去 伊計島 途中 的 海 邊 到處 是 游泳 的 人潮,16,第二(98741) 天(330413) 坐上(2758) 車子(15933) 要(851264) 去(479993) 伊計島(Unknown) 途中(8114) 的(16029838) 海(33696) 邊(123152) 到處(19723) 是(4642407) 游泳(5207) 的(16029838) 人潮(2524),"{'High': 15, 'Low': 1}","{'Unknown': 4, '第1級': 7, '第2級': 1, '第1*級': 1, '第3級': 1, '第2*級': 1, '第5級': 1}",1,Y,N,N,N
到了伊計島後，我和弟弟去游泳池游泳，我原想來個花式跳水，可是沒想到池水是鹹的，中午吃的菜都變泡菜了，只好閉緊大嘴。,到 了 伊計島 後 我 和 弟弟 去 游泳池 游泳 我 原 想 來 個 花式 跳水 可是 沒想到 池水 是 鹹 的 中午 吃 的 菜 都 變 泡菜 了 只好 閉緊 大 嘴,35,到(546906) 了(3199291) 伊計島(Unknown) 後(422857) 我(3033032) 和(1338337) 弟弟(17584) 去(479993) 游泳池(1665) 游泳(5207) 我(3033032) 原(33852) 想(449884) 來(742183) 個(2296574) 花式(190) 跳水(437) 可是(125487) 沒想到(13287) 池水(444) 是(4642407) 鹹(2251) 的(16029838) 中午(6779) 吃(141660) 的(16029838) 菜(17883) 都(1125846) 變(80345) 泡菜(138) 了(3199291) 只好(29170) 閉緊(120) 大(525780) 嘴(32376),"{'High': 34, 'Low': 1}","{'第1級': 16, 'Unknown': 10, '第2*級': 3, '第1*級': 3, '第3*級': 1, '第2級': 1, '第3級': 1}",3,Y,Y,N,N
這時，弟弟下挑戰書看誰游得快，於是我和弟弟一跳水，馬上以飛毛腿的速度游著，最後我贏了。,這時 弟弟 下 挑戰書 看 誰 游 得 快 於是 我 和 弟弟 一 跳水 馬上 以 飛毛腿 的 速度 游 著 最後 我 贏 了,26,這時(49464) 弟弟(17584) 下(329549) 挑戰書(54) 看(444691) 誰(110452) 游(3352) 得(573721) 快(116207) 於是(108155) 我(3033032) 和(1338337) 弟弟(17584) 一(3701681) 跳水(437) 馬上(39402) 以(547785) 飛毛腿(112) 的(16029838) 速度(26646) 游(3352) 著(1004687) 最後(142102) 我(3033032) 贏(9445) 了(3199291),"{'High': 25, 'Low': 1}","{'Unknown': 9, '第1級': 7, '第1*級': 3, '第2*級': 2, '第4*級': 1, '第5級': 1, '第3*級': 1, '第2級': 1, '第4級': 1}",2,Y,Y,N,N
後來，天公不作美，下起雨來，只好一直待在第三天，我們離開了伊計島，到仙人掌公園看仙人掌。,後來 天公不作美 下 起 雨 來 只好 一直 待 在第三 天 我們 離開 了 伊計島 到 仙人掌 公園 看 仙人掌,20,後來(95618) 天公不作美(39) 下(329549) 起(96746) 雨(16736) 來(742183) 只好(29170) 一直(119877) 待(32599) 在第三(Unknown) 天(330413) 我們(979260) 離開(71748) 了(3199291) 伊計島(Unknown) 到(546906) 仙人掌(492) 公園(13910) 看(444691) 仙人掌(492),"{'High': 17, 'Low': 3}","{'第2級': 3, 'Unknown': 7, '第1*級': 3, '第3*級': 1, '第1級': 4, '第3級': 1, '第5級': 1}",5,Y,N,N,N
到了門口看到了兩棵巨大的仙人掌，你猜是不是真的？,到 了 門口 看到 了 兩 棵 巨大 的 仙人掌 你 猜 是 不 是 真 的,17,到(546906) 了(3199291) 門口(15619) 看到(159419) 了(3199291) 兩(526190) 棵(12832) 巨大(22154) 的(16029838) 仙人掌(492) 你(1414837) 猜(11427) 是(4642407) 不(2282521) 是(4642407) 真(137497) 的(16029838),{'High': 17},"{'第1級': 8, 'Unknown': 3, '第1*級': 3, '第4級': 2, '第5級': 1}",1,Y,N,N,N
進去後各種千奇百怪的仙人掌，有柱子、竹竿、排球、十字等形狀，讓我大開眼界。,進去 後 各 種 千奇百怪 的 仙人掌 有 柱子 竹竿 排球 十字 等 形狀 讓 我 大開眼界,17,進去(13780) 後(422857) 各(243023) 種(701563) 千奇百怪(438) 的(16029838) 仙人掌(492) 有(2217079) 柱子(2717) 竹竿(1105) 排球(313) 十字(1443) 等(327380) 形狀(12003) 讓(526314) 我(3033032) 大開眼界(598),{'High': 17},"{'Unknown': 4, '第1級': 4, '第2級': 2, '第7級': 2, '第6級': 2, '第4*級': 2, '第3*級': 1}",3,Y,Y,N,N
然後坐車子繞園一圈，才到下一個目的地。,然後 坐 車子 繞園 一 圈 才 到 下 一 個 目的地,12,然後(156193) 坐(93873) 車子(15933) 繞園(1) 一(3701681) 圈(12178) 才(394539) 到(546906) 下(329549) 一(3701681) 個(2296574) 目的地(3569),"{'High': 11, 'Low': 1}","{'第1*級': 2, '第1級': 6, 'Unknown': 2, '第2級': 1, '第4*級': 1}",1,Y,N,N,N
到了港口以後，你猜要做什麼呢？,到 了 港口 以後 你 猜 要 做 什麼 呢,10,到(546906) 了(3199291) 港口(3933) 以後(71883) 你(1414837) 猜(11427) 要(851264) 做(411649) 什麼(431321) 呢(204566),{'High': 10},"{'第1級': 6, 'Unknown': 1, '第5級': 1, '第1*級': 1, '第4級': 1}",0,Y,N,N,N
原來是坐潛水艇啊！,原來 是 坐 潛水艇 啊,5,原來(49649) 是(4642407) 坐(93873) 潛水艇(698) 啊(135484),{'High': 5},"{'第3*級': 1, '第1級': 2, 'Unknown': 1, '第2級': 1}",1,Y,N,N,N
到了海中，我看見海馬站立得直直的，真像一位衛兵。,到 了 海 中 我 看見 海馬 站立 得 直直 的 真 像 一 位 衛兵,16,到(546906) 了(3199291) 海(33696) 中(1011729) 我(3033032) 看見(56420) 海馬(493) 站立(3564) 得(573721) 直直(1921) 的(16029838) 真(137497) 像(289494) 一(3701681) 位(284809) 衛兵(1571),{'High': 16},"{'第1級': 5, 'Unknown': 5, '第2級': 1, '第1*級': 3, '第5級': 1, '第7級': 1}",0,Y,N,N,N
這時又看見了海參、鰹魚、金槍魚等。,這時 又 看見 了 海參 鰹魚 金槍魚 等,8,這時(49464) 又(535555) 看見(56420) 了(3199291) 海參(323) 鰹魚(78) 金槍魚(31) 等(327380),"{'High': 6, 'Low': 2}","{'Unknown': 5, '第1*級': 2, '第3*級': 1}",1,Y,Y,N,N
其中金槍魚的速度真是無魚能比，厲害！,其中 金槍魚 的 速度 真 是 無 魚 能 比 厲害,11,其中(95627) 金槍魚(31) 的(16029838) 速度(26646) 真(137497) 是(4642407) 無(157858) 魚(34923) 能(582260) 比(170486) 厲害(12727),"{'High': 10, 'Low': 1}","{'第3*級': 2, 'Unknown': 1, '第1級': 2, '第1*級': 4, '第5級': 1, '第4級': 1}",1,Y,N,N,N
厲害！,厲害,1,厲害(12727),{'High': 1},{'第4級': 1},0,Y,N,N,N
第四天，我們去海洋公園；到了水族館，天哪！,第四 天 我們 去 海洋 公園 到 了 水族館 天 哪,11,第四(21065) 天(330413) 我們(979260) 去(479993) 海洋(8653) 公園(13910) 到(546906) 了(3199291) 水族館(268) 天(330413) 哪(64146),{'High': 11},"{'Unknown': 4, '第1級': 5, '第4級': 1, '第1*級': 1}",1,Y,N,N,N
我要暈倒了！,我 要 暈倒 了,4,我(3033032) 要(851264) 暈倒(702) 了(3199291),{'High': 4},"{'第1級': 2, '第5級': 1, 'Unknown': 1}",0,Y,N,N,N
裡頭的魚幾乎是千奇百怪，有的頭像鎚子，有的尾巴像矛，有的甚至長得像哈巴狗，真是怪事年年有，今年特別多。,裡頭 的 魚 幾乎 是 千奇百怪 有的 頭 像 鎚子 有的 尾巴 像 矛 有的 甚至 長 得 像 哈巴狗 真 是 怪事 年年 有 今年 特別 多,28,裡頭(9962) 的(16029838) 魚(34923) 幾乎(74298) 是(4642407) 千奇百怪(438) 有的(31553) 頭(112925) 像(289494) 鎚子(210) 有的(31553) 尾巴(6147) 像(289494) 矛(1808) 有的(31553) 甚至(122502) 長(107092) 得(573721) 像(289494) 哈巴狗(134) 真(137497) 是(4642407) 怪事(1529) 年年(2228) 有(2217079) 今年(10836) 特別(91212) 多(318992),{'High': 28},"{'Unknown': 8, '第1級': 6, '第1*級': 6, '第4級': 1, '第7級': 1, '第2級': 4, '第5級': 1, '第4*級': 1}",2,Y,N,N,N
參觀完了水族館，接著去看海豚表演，牠們站著表演金雞獨立，還能向前滑水呢！,參觀完 了 水族館 接著 去 看 海豚 表演 牠們 站 著 表演 金雞獨立 還 能 向 前 滑水 呢,19,參觀完(73) 了(3199291) 水族館(268) 接著(57062) 去(479993) 看(444691) 海豚(1434) 表演(20601) 牠們(28803) 站(68488) 著(1004687) 表演(20601) 金雞獨立(Unknown) 還(625086) 能(582260) 向(231672) 前(272709) 滑水(103) 呢(204566),"{'Low': 2, 'High': 17}","{'Unknown': 10, '第3*級': 1, '第1級': 3, '第4級': 2, '第1*級': 2, '第2級': 1}",3,Y,N,N,N
然後牠們跳過了十公尺的高度，看牠們那樣子，好像很輕鬆呢！,然後 牠們 跳過 了 十 公尺 的 高度 看 牠們 那 樣子 好像 很 輕鬆 呢,16,然後(156193) 牠們(28803) 跳過(1733) 了(3199291) 十(77415) 公尺(19233) 的(16029838) 高度(20229) 看(444691) 牠們(28803) 那(754138) 樣子(37812) 好像(67024) 很(715675) 輕鬆(17407) 呢(204566),{'High': 16},"{'第1*級': 1, 'Unknown': 6, '第1級': 5, '第4級': 1, '第2級': 2, '第3級': 1}",0,Y,N,N,N
最後，我們才依依不捨的離開了琉球。,最後 我們 才 依依不捨 的 離開 了 琉球,8,最後(142102) 我們(979260) 才(394539) 依依不捨(602) 的(16029838) 離開(71748) 了(3199291) 琉球(1532),{'High': 8},"{'第2級': 3, '第1級': 2, '第7級': 1, 'Unknown': 2}",1,Y,N,N,N
地球哭了‧中壢市中壢國小六年四班陳奕璇‧在一個月黑風高的夜晚，突然聽見淅瀝！,地球 哭 了 中壢市 中壢 國小 六年四班 陳奕璇 在 一 個 月黑風高 的 夜晚 突然 聽見 淅瀝,17,地球(21533) 哭(28445) 了(3199291) 中壢市(34) 中壢(549) 國小(4760) 六年四班(1) 陳奕璇(Unknown) 在(3284238) 一(3701681) 個(2296574) 月黑風高(99) 的(16029838) 夜晚(9758) 突然(69636) 聽見(19236) 淅瀝(122),"{'High': 13, 'Low': 4}","{'第4級': 2, '第2級': 1, 'Unknown': 7, '第3*級': 2, '第1*級': 2, '第1級': 3}",4,Y,N,N,Y
淅瀝！,淅瀝,1,淅瀝(122),{'High': 1},{'Unknown': 1},0,N,N,N,N
的聲音，原來下雨了。,的 聲音 原來 下雨 了,5,的(16029838) 聲音(85694) 原來(49649) 下雨(3965) 了(3199291),{'High': 5},"{'第1級': 1, '第2級': 1, '第3*級': 1, '第1*級': 1, 'Unknown': 1}",0,Y,N,N,N
這時，阿萍坐在窗旁，忽然看見一位老伯伯穿著一件破的衣裳。,這時 阿萍 坐 在 窗 旁 忽然 看見 一 位 老伯伯 穿 著 一 件 破 的 衣裳,18,這時(49464) 阿萍(Unknown) 坐(93873) 在(3284238) 窗(19038) 旁(39478) 忽然(22293) 看見(56420) 一(3701681) 位(284809) 老伯伯(131) 穿(46113) 著(1004687) 一(3701681) 件(139257) 破(13962) 的(16029838) 衣裳(2439),"{'High': 17, 'Low': 1}","{'Unknown': 4, '第1級': 5, '第1*級': 5, '第2*級': 1, '第4級': 1, '第3級': 1, '第6級': 1}",1,Y,N,N,Y
原來他就是地球伯伯，方才那淅瀝！,原來 他 就 是 地球 伯伯 方才 那 淅瀝,9,原來(49649) 他(2487930) 就(1737544) 是(4642407) 地球(21533) 伯伯(1921) 方才(3923) 那(754138) 淅瀝(122),{'High': 9},"{'第3*級': 1, '第1級': 4, '第4級': 1, '第2*級': 1, '第6級': 1, 'Unknown': 1}",0,N,N,N,N
的聲音，正是他的哭泣聲。,的 聲音 正 是 他 的 哭泣聲,7,的(16029838) 聲音(85694) 正(179334) 是(4642407) 他(2487930) 的(16029838) 哭泣聲(157),{'High': 7},"{'第1級': 4, '第2級': 1, '第3*級': 1, 'Unknown': 1}",1,N,N,N,N
他悄悄的躲在樹下，自言自語的說：人類弄破了我的新衣，再加上他們不斷扔垃圾、排廢水，我的身體不但受損，大自然的生物也不再快樂了。,他 悄悄 的 躲 在 樹 下 自言自語 的 說 人類 弄破 了 我 的 新衣 再 加上 他們 不斷 扔 垃圾 排 廢水 我 的 身體 不但 受損 大自然 的 生物 也 不再 快樂 了,36,他(2487930) 悄悄(8693) 的(16029838) 躲(13520) 在(3284238) 樹(34746) 下(329549) 自言自語(2886) 的(16029838) 說(1285247) 人類(78855) 弄破(253) 了(3199291) 我(3033032) 的(16029838) 新衣(640) 再(326207) 加上(38121) 他們(716752) 不斷(68526) 扔(3562) 垃圾(7197) 排(16810) 廢水(414) 我(3033032) 的(16029838) 身體(97873) 不但(40359) 受損(3329) 大自然(10703) 的(16029838) 生物(18302) 也(1590760) 不再(51754) 快樂(45366) 了(3199291),{'High': 36},"{'第1級': 11, '第5級': 2, '第4級': 4, '第1*級': 5, '第2級': 1, '第6級': 2, '第4*級': 2, 'Unknown': 6, '第3級': 3}",2,Y,Y,N,N
講到這裡，地球伯伯擤了擤鼻涕，接下去說：從古到今，在我保護下的生物是多得不可數，而且，向來我就非常愛乾淨，無論溪流、河川、海水、高山，樣樣都維持得十分乾淨，自然界各種的生物都無滅亡之憂，不管水中的魚、蝦或陸地上的動物們，都過得非常快樂。,講到 這裡 地球 伯伯 擤 了 擤 鼻涕 接下去 說 從 古 到 今 在 我 保護 下 的 生物 是 多 得 不可 數 而且 向來 我 就 非常 愛 乾淨 無論 溪流 河川 海水 高山 樣樣 都 維持 得 十分 乾淨 自然界 各 種 的 生物 都 無 滅亡 之 憂 不管 水 中 的 魚 蝦 或 陸地 上 的 動物 們 都 過 得 非常 快樂,70,講到(4845) 這裡(100385) 地球(21533) 伯伯(1921) 擤(351) 了(3199291) 擤(351) 鼻涕(1529) 接下去(1082) 說(1285247) 從(496546) 古(21972) 到(546906) 今(33635) 在(3284238) 我(3033032) 保護(32573) 下(329549) 的(16029838) 生物(18302) 是(4642407) 多(318992) 得(573721) 不可(50808) 數(38654) 而且(180402) 向來(7370) 我(3033032) 就(1737544) 非常(152032) 愛(124337) 乾淨(12245) 無論(37021) 溪流(1785) 河川(1494) 海水(4373) 高山(5393) 樣樣(1607) 都(1125846) 維持(31284) 得(573721) 十分(63196) 乾淨(12245) 自然界(2504) 各(243023) 種(701563) 的(16029838) 生物(18302) 都(1125846) 無(157858) 滅亡(4747) 之(875481) 憂(2832) 不管(41857) 水(86260) 中(1011729) 的(16029838) 魚(34923) 蝦(2858) 或(478077) 陸地(3349) 上(1233218) 的(16029838) 動物(36835) 們(140794) 都(1125846) 過(412878) 得(573721) 非常(152032) 快樂(45366),{'High': 70},"{'Unknown': 21, '第1級': 19, '第4級': 4, '第2*級': 1, '第4*級': 1, '第1*級': 8, '第3*級': 3, '第3級': 2, '第5級': 6, '第2級': 3, '第6級': 2}",2,Y,Y,N,N
這時，地球伯伯的臉上不禁露出一絲笑容。,這時 地球 伯伯 的 臉 上 不禁 露出 一 絲 笑容,11,這時(49464) 地球(21533) 伯伯(1921) 的(16029838) 臉(86234) 上(1233218) 不禁(16707) 露出(17194) 一(3701681) 絲(15185) 笑容(12304),{'High': 11},"{'Unknown': 1, '第4級': 1, '第2*級': 1, '第1級': 3, '第2級': 1, '第6級': 1, '第5級': 1, '第4*級': 2}",0,Y,N,N,N
突然阿萍開口了，她問地球伯伯：那後來呢？,突然 阿萍 開口 了 她 問 地球 伯伯 那 後來 呢,11,突然(69636) 阿萍(Unknown) 開口(17934) 了(3199291) 她(1052913) 問(165473) 地球(21533) 伯伯(1921) 那(754138) 後來(95618) 呢(204566),"{'High': 10, 'Low': 1}","{'第4級': 2, 'Unknown': 2, '第7級': 1, '第1級': 4, '第2*級': 1, '第2級': 1}",0,Y,N,N,Y
地球伯伯答道：自從人類發展了科技，社會越來越文明，但是，工業廢水到處排放，垃圾也不停增多，樹木遭受砍伐，許多動物面臨絕種。,地球 伯伯 答道 自從 人類 發展 了 科技 社會 越來越 文明 但是 工業 廢水 到處 排放 垃圾 也 不停 增多 樹木 遭受 砍伐 許多 動物 面臨 絕種,27,地球(21533) 伯伯(1921) 答道(7628) 自從(13186) 人類(78855) 發展(117494) 了(3199291) 科技(30630) 社會(176660) 越來越(27239) 文明(17878) 但是(247988) 工業(20144) 廢水(414) 到處(19723) 排放(1066) 垃圾(7197) 也(1590760) 不停(20176) 增多(1948) 樹木(6166) 遭受(7323) 砍伐(877) 許多(159791) 動物(36835) 面臨(16531) 絕種(608),{'High': 27},"{'第4級': 4, '第2*級': 1, 'Unknown': 7, '第4*級': 2, '第3*級': 3, '第5級': 4, '第2級': 1, '第3級': 2, '第7級': 2, '第1級': 1}",1,Y,Y,N,N
