sentence,sentence_preprocessed,sentence_length,word_freq,high_low_freq,word_level,long_word_count,is_complete_sentence,is_complete_context,is_blacklist,is_greylist
這兩個不同的洄游方式，並無一定的排列順序，如望安三號會跨越台灣海峽快速的游到大陸近海，沿著廣東、福建沿海向南游到香港外海，再跨海游到海南島的近海地區(圖五)。,這 兩 個 不同 的 洄游 方式 並 無 一定 的 排列 順序 如 望安 三 號 會 跨越 台灣海峽 快速 的 游到 大陸 近海 沿著 廣東 福建 沿海 向 南 游到 香港 外海 再 跨海 游到 海南島 的 近海 地區 圖 五,43,這(2114032) 兩(526190) 個(2296574) 不同(159432) 的(16029838) 洄游(192) 方式(133407) 並(442790) 無(157858) 一定(138695) 的(16029838) 排列(6361) 順序(8098) 如(195069) 望安(47) 三(313861) 號(26108) 會(1014977) 跨越(4329) 台灣海峽(607) 快速(20632) 的(16029838) 游到(606) 大陸(27031) 近海(412) 沿著(Unknown) 廣東(7118) 福建(5572) 沿海(3250) 向(231672) 南(24203) 游到(606) 香港(46937) 外海(925) 再(326207) 跨海(222) 游到(606) 海南島(540) 的(16029838) 近海(412) 地區(40339) 圖(46009) 五(112649),"{'High': 41, 'Low': 2}","{'第1級': 9, '第3級': 1, 'Unknown': 17, '第4*級': 2, '第5級': 3, '第1*級': 3, '第6級': 2, '第4級': 2, '第3*級': 1, '第2級': 3}",2,Y,N,N,N
當海龜結束其產後洄游之後，便會返回其覓食地。,當 海龜 結束 其 產後 洄游 之後 便 會 返回 其 覓食地,12,當(294625) 海龜(727) 結束(40669) 其(307905) 產後(1047) 洄游(192) 之後(190467) 便(220860) 會(1014977) 返回(9595) 其(307905) 覓食地(Unknown),"{'High': 11, 'Low': 1}","{'Unknown': 5, '第3*級': 1, '第6級': 3, '第4級': 1, '第1*級': 1, '第5級': 1}",1,Y,N,N,N
產後洄游時間的長短則視其產卵與覓食地的遠近而定，從九、十天到兩、三個月不等，洄游的距離則從兩、三百公里到數千公里不等。,產 後 洄游 時間 的 長短 則 視 其 產卵 與 覓食地 的 遠近 而 定 從 九 十 天 到 兩 三 個 月 不等 洄游 的 距離 則 從 兩 三百 公里 到 數千 公里 不等,38,產(8102) 後(422857) 洄游(192) 時間(213595) 的(16029838) 長短(2397) 則(254096) 視(15590) 其(307905) 產卵(1337) 與(968432) 覓食地(Unknown) 的(16029838) 遠近(1574) 而(937923) 定(18743) 從(496546) 九(34506) 十(77415) 天(330413) 到(546906) 兩(526190) 三(313861) 個(2296574) 月(148997) 不等(2665) 洄游(192) 的(16029838) 距離(27644) 則(254096) 從(496546) 兩(526190) 三百(6433) 公里(16646) 到(546906) 數千(4849) 公里(16646) 不等(2665),"{'High': 37, 'Low': 1}","{'Unknown': 9, '第1級': 15, '第4*級': 2, '第5級': 3, '第6級': 4, '第1*級': 2, '第4級': 3}",1,Y,Y,N,N
成龜回到其覓食地後，就會待在那一直等到下次發情時，才會重新返回其出生地去交配及產卵。,成龜 回到 其 覓食地 後 就 會 待在 那 一直 等到 下 次 發情 時 才 會 重新 返回 其 出生地 去 交配 及 產卵,25,成龜(1) 回到(60084) 其(307905) 覓食地(Unknown) 後(422857) 就(1737544) 會(1014977) 待在(9413) 那(754138) 一直(119877) 等到(21150) 下(329549) 次(331701) 發情(235) 時(623734) 才(394539) 會(1014977) 重新(44668) 返回(9595) 其(307905) 出生地(790) 去(479993) 交配(1460) 及(304586) 產卵(1337),"{'Low': 2, 'High': 23}","{'Unknown': 6, '第2級': 4, '第6級': 2, '第1級': 4, '第1*級': 3, '第3*級': 2, '第5級': 3, '第7級': 1}",2,Y,Y,N,N
這個間隔，從兩到九年不等，但以三年的情形最為常見。,這 個 間隔 從 兩 到 九 年 不等 但 以 三 年 的 情形 最為 常見,17,這(2114032) 個(2296574) 間隔(2047) 從(496546) 兩(526190) 到(546906) 九(34506) 年(514736) 不等(2665) 但(597124) 以(547785) 三(313861) 年(514736) 的(16029838) 情形(35199) 最為(8804) 常見(13705),{'High': 17},"{'第1級': 9, '第6級': 2, '第1*級': 1, '第2級': 1, '第5級': 1, '第3*級': 1, 'Unknown': 1, '第4級': 1}",0,Y,Y,N,N
雖然有學者認為海龜，尤其是綠蠵龜，不但對其出生地，而且對其覓食地的忠誠度很高，因此牠的產卵洄游，基本上是在覓食與產卵地之間的來回遷徙。,雖然 有 學者 認為 海龜 尤其 是 綠蠵龜 不但 對 其 出生地 而且 對 其 覓食地 的 忠誠度 很 高 因此 牠 的 產卵 洄游 基本 上 是 在 覓食 與 產卵地 之間 的 來回 遷徙,36,雖然(152988) 有(2217079) 學者(28981) 認為(192030) 海龜(727) 尤其(50700) 是(4642407) 綠蠵龜(40) 不但(40359) 對(897964) 其(307905) 出生地(790) 而且(180402) 對(897964) 其(307905) 覓食地(Unknown) 的(16029838) 忠誠度(784) 很(715675) 高(128858) 因此(184606) 牠(72229) 的(16029838) 產卵(1337) 洄游(192) 基本(52069) 上(1233218) 是(4642407) 在(3284238) 覓食(1544) 與(968432) 產卵地(6) 之間(117932) 的(16029838) 來回(5129) 遷徙(1995),"{'High': 33, 'Low': 3}","{'第2級': 2, '第1級': 11, '第4*級': 4, 'Unknown': 8, '第3*級': 1, '第3級': 2, '第6級': 2, '第4級': 2, '第5級': 1, '第1*級': 1, '第7級': 2}",5,Y,Y,N,N
然而，我們並不知道，成龜的終生覓食地是否在其結束幼年浮游期即決定之，還是在成長過程中，經過一連串的轉換才決定下來的。,然而 我們 並 不 知道 成龜 的 終生 覓食地 是否 在 其 結束 幼年 浮游期 即 決定 之 還是 在 成長 過程 中 經過 一連串 的 轉換 才 決定下來 的,30,然而(94482) 我們(979260) 並(442790) 不(2282521) 知道(343214) 成龜(1) 的(16029838) 終生(2847) 覓食地(Unknown) 是否(78907) 在(3284238) 其(307905) 結束(40669) 幼年(1955) 浮游期(Unknown) 即(110826) 決定(101837) 之(875481) 還是(155231) 在(3284238) 成長(42450) 過程(87889) 中(1011729) 經過(64617) 一連串(8700) 的(16029838) 轉換(6744) 才(394539) 決定下來(38) 的(16029838),"{'High': 26, 'Low': 4}","{'第5級': 7, '第1級': 6, '第4*級': 1, 'Unknown': 5, '第6級': 3, '第1*級': 3, '第3*級': 1, '第2級': 3, '第4級': 1}",4,Y,Y,N,N
至於海龜為何不像許多的魚類，每年都會返回其出生地去產卵？,至於 海龜 為何 不 像 許多 的 魚類 每 年 都 會 返回 其 出生地 去 產卵,17,至於(39363) 海龜(727) 為何(25238) 不(2282521) 像(289494) 許多(159791) 的(16029838) 魚類(2738) 每(333357) 年(514736) 都(1125846) 會(1014977) 返回(9595) 其(307905) 出生地(790) 去(479993) 產卵(1337),{'High': 17},"{'第5級': 3, 'Unknown': 4, '第1級': 5, '第1*級': 3, '第3*級': 1, '第6級': 1}",1,Y,N,N,N
生理生態學家對此有一套說法，他們認為對於那些一生多產性(iteroparity)而且每次產卵時都得做長距離洄游的動物而言，為了節省洄游途中所消耗的能量與減少可能的天敵捕食壓力，最佳的生殖策略(reproductivestrategy)就是每隔數年才回去產卵一次。,生理 生態 學家 對 此 有 一 套 說法 他們 認為 對於 那些 一生 多產性 iteroparity 而且 每 次 產卵 時 都 得 做 長 距離 洄游 的 動物 而言 為了 節省 洄游 途中 所 消耗 的 能量 與 減少 可能 的 天敵 捕食 壓力 最佳 的 生殖 策略 reproductive strategy 就 是 每隔 數 年 才 回去 產卵 一 次,61,生理(11511) 生態(9124) 學家(3241) 對(897964) 此(288458) 有(2217079) 一(3701681) 套(37180) 說法(32457) 他們(716752) 認為(192030) 對於(99570) 那些(113704) 一生(25444) 多產性(1) iteroparity(Unknown) 而且(180402) 每(333357) 次(331701) 產卵(1337) 時(623734) 都(1125846) 得(573721) 做(411649) 長(107092) 距離(27644) 洄游(192) 的(16029838) 動物(36835) 而言(Unknown) 為了(Unknown) 節省(3777) 洄游(192) 途中(8114) 所(527327) 消耗(3835) 的(16029838) 能量(30785) 與(968432) 減少(22815) 可能(271025) 的(16029838) 天敵(551) 捕食(711) 壓力(40408) 最佳(27224) 的(16029838) 生殖(2185) 策略(35734) reproductive(24) strategy(Unknown) 就(1737544) 是(4642407) 每隔(3099) 數(38654) 年(514736) 才(394539) 回去(21353) 產卵(1337) 一(3701681) 次(331701),"{'High': 55, 'Low': 6}","{'第5級': 7, 'Unknown': 20, '第1級': 15, '第3級': 2, '第4級': 4, '第2級': 5, '第4*級': 2, '第1*級': 1, '第3*級': 2, '第6級': 3}",4,Y,Y,N,N
由於每頭海龜的發情期都不一樣，因此每年回去產卵的成龜數量變化很大，幅度甚至超過200%。,由於 每 頭 海龜 的 發情期 都 不 一樣 因此 每 年 回去 產卵 的 成龜 數量 變化 很 大 幅度 甚至 超過 200,24,由於(88111) 每(333357) 頭(112925) 海龜(727) 的(16029838) 發情期(80) 都(1125846) 不(2282521) 一樣(188109) 因此(184606) 每(333357) 年(514736) 回去(21353) 產卵(1337) 的(16029838) 成龜(1) 數量(14605) 變化(42502) 很(715675) 大(525780) 幅度(1908) 甚至(122502) 超過(30507) 200(2079),"{'High': 22, 'Low': 2}","{'第4*級': 3, '第1*級': 4, 'Unknown': 6, '第1級': 7, '第4級': 3, '第6級': 1}",2,Y,Y,N,N
像從民國81到86年之間，在澎湖望安島上產卵的綠蠵龜數量變化度為8到14頭之間，而在美國夏威夷島上FrenchFrigateShoals產卵之母綠蠵龜，數量則介於200到600頭之間，每年產卵的母龜數量均不相同。,像 從 民國 81 到 86年 之間 在 澎湖 望安島 上 產卵 的 綠蠵龜 數量 變化度 為 8 到 14 頭 之間 而 在 美國 夏威夷島 上 French Frigate Shoals 產卵 之 母 綠蠵龜 數量 則 介於 200 到 600 頭 之間 每 年 產卵 的 母龜 數量 均 不 相同,51,像(289494) 從(496546) 民國(16130) 81(1095) 到(546906) 86年(73) 之間(117932) 在(3284238) 澎湖(3267) 望安島(19) 上(1233218) 產卵(1337) 的(16029838) 綠蠵龜(40) 數量(14605) 變化度(4) 為(761341) 8(21070) 到(546906) 14(7638) 頭(112925) 之間(117932) 而(937923) 在(3284238) 美國(148299) 夏威夷島(14) 上(1233218) French(422) Frigate(2) Shoals(6) 產卵(1337) 之(875481) 母(15177) 綠蠵龜(40) 數量(14605) 則(254096) 介於(2566) 200(2079) 到(546906) 600(564) 頭(112925) 之間(117932) 每(333357) 年(514736) 產卵(1337) 的(16029838) 母龜(5) 數量(14605) 均(27783) 不(2282521) 相同(33311),"{'High': 42, 'Low': 9}","{'第1*級': 7, 'Unknown': 22, '第1級': 10, '第4級': 7, '第5級': 3, '第7級': 1, '第6級': 1}",11,Y,Y,N,N
海龜在茫茫的大海中是靠什麼才游到牠的目的地？,海龜 在 茫茫 的 大海 中 是 靠 什麼 才 游到 牠 的 目的地,14,海龜(727) 在(3284238) 茫茫(1620) 的(16029838) 大海(7293) 中(1011729) 是(4642407) 靠(51323) 什麼(431321) 才(394539) 游到(606) 牠(72229) 的(16029838) 目的地(3569),{'High': 14},"{'Unknown': 4, '第1*級': 1, '第6級': 1, '第1級': 4, '第4級': 2, '第2級': 1, '第4*級': 1}",1,Y,N,N,N
長久以來，人們都相信海龜和鮭魚一樣，是靠記憶出生地的物理和化學特性來決定的，因此不少人在釋放小海龜時，一定要讓牠們爬一段沙灘，以便「記得」其出生地之沙灘及海水的「味道」，如此一來，當牠長大成熟後，便知道那裡是「兒家」。,長久以來 人們 都 相信 海龜 和 鮭魚 一樣 是 靠 記憶 出生地 的 物理 和 化學 特性 來 決定 的 因此 不少 人 在 釋放 小 海龜 時 一定 要 讓 牠們 爬 一 段 沙灘 以便 記得 其 出生地 之 沙灘 及 海水 的 味道 如此一來 當 牠 長大 成熟 後 便 知道 那裡 是 兒家,57,長久以來(3338) 人們(77778) 都(1125846) 相信(82200) 海龜(727) 和(1338337) 鮭魚(1116) 一樣(188109) 是(4642407) 靠(51323) 記憶(37224) 出生地(790) 的(16029838) 物理(7524) 和(1338337) 化學(12491) 特性(12673) 來(742183) 決定(101837) 的(16029838) 因此(184606) 不少(35256) 人(1550512) 在(3284238) 釋放(6788) 小(318835) 海龜(727) 時(623734) 一定(138695) 要(851264) 讓(526314) 牠們(28803) 爬(10860) 一(3701681) 段(95980) 沙灘(3161) 以便(13160) 記得(47506) 其(307905) 出生地(790) 之(875481) 沙灘(3161) 及(304586) 海水(4373) 的(16029838) 味道(14200) 如此一來(6554) 當(294625) 牠(72229) 長大(20410) 成熟(15793) 後(422857) 便(220860) 知道(343214) 那裡(55755) 是(4642407) 兒家(16),"{'High': 56, 'Low': 1}","{'第6級': 5, '第4*級': 6, '第1級': 14, '第2級': 5, 'Unknown': 12, '第7級': 1, '第1*級': 3, '第4級': 4, '第5級': 4, '第3*級': 2, '第3級': 1}",4,Y,Y,N,N
然而，這種假說在1980年代中期，受到強烈質疑，許多人認為海龜出生的沙灘環境不若鮭魚那麼穩定，不但圍繞沙灘的水團會隨著潮汐、季節、風浪等而遷移，其產卵的沙灘也會因各種氣候因素如風暴等而產生大量的位移，甚至搬到附近的島嶼去堆積。,然而 這 種 假說 在 1980年代 中期 受到 強烈 質疑 許多 人 認為 海龜 出生 的 沙灘 環境 不若 鮭魚 那麼 穩定 不但 圍繞 沙灘 的 水團 會 隨著 潮汐 季節 風浪 等 而 遷移 其 產卵 的 沙灘 也 會 因 各 種 氣候 因素 如 風暴 等 而 產生 大量 的 位移 甚至 搬到 附近 的 島嶼 去 堆積,61,然而(94482) 這(2114032) 種(701563) 假說(1031) 在(3284238) 1980年代(1103) 中期(4645) 受到(66513) 強烈(27883) 質疑(9842) 許多(159791) 人(1550512) 認為(192030) 海龜(727) 出生(21734) 的(16029838) 沙灘(3161) 環境(71054) 不若(329) 鮭魚(1116) 那麼(127785) 穩定(19878) 不但(40359) 圍繞(5686) 沙灘(3161) 的(16029838) 水團(4) 會(1014977) 隨著(32948) 潮汐(474) 季節(5885) 風浪(902) 等(327380) 而(937923) 遷移(2480) 其(307905) 產卵(1337) 的(16029838) 沙灘(3161) 也(1590760) 會(1014977) 因(119364) 各(243023) 種(701563) 氣候(6752) 因素(34409) 如(195069) 風暴(4066) 等(327380) 而(937923) 產生(82753) 大量(28414) 的(16029838) 位移(365) 甚至(122502) 搬到(6358) 附近(32204) 的(16029838) 島嶼(3972) 去(479993) 堆積(2036),"{'High': 60, 'Low': 1}","{'第5級': 7, '第1級': 9, 'Unknown': 13, '第7級': 2, '第1*級': 4, '第4級': 2, '第6級': 6, '第3*級': 4, '第2級': 3, '第4*級': 8, '第3級': 3}",1,Y,Y,N,N
另外，海龜如何能從數千公里以外的海上「聞」得到其出生地的「氣味」，亦是一大問題。,另外 海龜 如何 能 從 數千 公里 以外 的 海 上 聞 得 到 其 出生地 的 氣味 亦 是 一 大 問題,23,另外(48233) 海龜(727) 如何(148068) 能(582260) 從(496546) 數千(4849) 公里(16646) 以外(13444) 的(16029838) 海(33696) 上(1233218) 聞(19108) 得(573721) 到(546906) 其(307905) 出生地(790) 的(16029838) 氣味(7860) 亦(68507) 是(4642407) 一(3701681) 大(525780) 問題(280782),{'High': 23},"{'第3級': 2, 'Unknown': 5, '第5級': 2, '第1*級': 2, '第4級': 1, '第1級': 8, '第2級': 1, '第6級': 2}",1,Y,Y,N,N
到目前為止，大部分的人們都相信海龜出生地的物理及化學特性，無法當成其回家之路的唯一「指標」。,到 目前 為止 大部分 的 人們 都 相信 海龜 出生地 的 物理 及 化學 特性 無法 當成 其 回家 之 路 的 唯一 指標,24,到(546906) 目前(48695) 為止(17781) 大部分(32534) 的(16029838) 人們(77778) 都(1125846) 相信(82200) 海龜(727) 出生地(790) 的(16029838) 物理(7524) 及(304586) 化學(12491) 特性(12673) 無法(150606) 當成(15280) 其(307905) 回家(35375) 之(875481) 路(74635) 的(16029838) 唯一(39149) 指標(8034),{'High': 24},"{'第1級': 6, '第4級': 2, '第5級': 7, 'Unknown': 4, '第4*級': 2, '第2級': 1, '第6級': 2}",2,Y,Y,N,N
也有人認為，海龜和候鳥一樣，是靠太陽做為航行的指標，但近十年的衛星追蹤研究顯示，海龜為了要躲避天敵，除了短暫的換氣外，幾乎是不浮上水面的，因此每天95%以上的時間是在水面下活動的，在這種情形下，太陽自然無法做為海龜的航行指標！,也 有 人 認為 海龜 和 候鳥 一樣 是 靠 太陽 做為 航行 的 指標 但 近 十 年 的 衛星 追蹤 研究 顯示 海龜 為了 要 躲避 天敵 除了 短暫 的 換氣 外 幾乎 是 不 浮上 水面 的 因此 每 天 95 以上 的 時間 是 在 水面 下 活動 的 在 這 種 情形 下 太陽 自然 無法 做為 海龜 的 航行 指標,66,也(1590760) 有(2217079) 人(1550512) 認為(192030) 海龜(727) 和(1338337) 候鳥(637) 一樣(188109) 是(4642407) 靠(51323) 太陽(21823) 做為(19421) 航行(4126) 的(16029838) 指標(8034) 但(597124) 近(43555) 十(77415) 年(514736) 的(16029838) 衛星(3757) 追蹤(6194) 研究(182500) 顯示(32718) 海龜(727) 為了(Unknown) 要(851264) 躲避(2699) 天敵(551) 除了(75964) 短暫(8065) 的(16029838) 換氣(293) 外(109310) 幾乎(74298) 是(4642407) 不(2282521) 浮上(766) 水面(5598) 的(16029838) 因此(184606) 每(333357) 天(330413) 95(1348) 以上(36569) 的(16029838) 時間(213595) 是(4642407) 在(3284238) 水面(5598) 下(329549) 活動(85743) 的(16029838) 在(3284238) 這(2114032) 種(701563) 情形(35199) 下(329549) 太陽(21823) 自然(91995) 無法(150606) 做為(19421) 海龜(727) 的(16029838) 航行(4126) 指標(8034),"{'High': 65, 'Low': 1}","{'第1級': 21, '第2級': 4, 'Unknown': 14, '第1*級': 6, '第4級': 2, '第3級': 3, '第6級': 7, '第5級': 4, '第3*級': 4, '第4*級': 1}",0,Y,Y,N,N
如果這些假說都不能夠滿意的解釋海龜的洄游機制，那什麼才是可能的答案？,如果 這些 假說 都 不能夠 滿意 的 解釋 海龜 的 洄游 機制 那 什麼 才 是 可能 的 答案,19,如果(322121) 這些(315113) 假說(1031) 都(1125846) 不能夠(2469) 滿意(16756) 的(16029838) 解釋(59761) 海龜(727) 的(16029838) 洄游(192) 機制(13955) 那(754138) 什麼(431321) 才(394539) 是(4642407) 可能(271025) 的(16029838) 答案(29628),{'High': 19},"{'第2級': 2, 'Unknown': 4, '第7級': 1, '第1級': 8, '第4級': 2, '第6級': 1, '第3*級': 1}",1,Y,Y,N,N
洛克曼(K.J.Lokmann)從1990年開始在美國佛州進行了一連串的實驗，他將剛出生的綠蠵龜帶回實驗室，並測試在不同的磁場傾角(geomagneticinclination)和強度(geomagneticintensity)下，牠們的游泳方向，由這些實驗的結果洛克曼提出了這兩種因素為決定海龜洄游「指標」的假說，他認為當海龜出生時，牠會記得出生地之地磁的傾角與強度，而這兩項資料就像地圖上任何一點的經緯度一樣的精確(圖六)，因此當海龜長大成熟後，牠便能按照記憶中的「地磁地圖」，游回其出生地去交配及產卵。,洛克曼 KJLokmann 從 1990年 開始 在 美國 佛州 進行 了 一連串 的 實驗 他 將 剛 出生 的 綠蠵龜 帶回 實驗室 並 測試 在 不同 的 磁場 傾角 geomagnetic inclination 和 強度 geomagnetic intensity 下 牠們 的 游泳 方向 由 這些 實驗 的 結果 洛克曼 提出 了 這 兩 種 因素 為 決定 海龜 洄游 指標 的 假說 他 認為 當 海龜 出生 時 牠 會 記得 出生地 之 地磁 的 傾角 與 強度 而 這 兩 項 資料 就 像 地圖 上 任何 一 點 的 經緯度 一樣 的 精確 圖 六 因此 當 海龜 長大 成熟 後 牠 便 能 按照 記憶 中 的 地磁 地圖 游回 其 出生地 去 交配 及 產卵,115,洛克曼(3) KJLokmann(Unknown) 從(496546) 1990年(578) 開始(245562) 在(3284238) 美國(148299) 佛州(114) 進行(100298) 了(3199291) 一連串(8700) 的(16029838) 實驗(36801) 他(2487930) 將(448374) 剛(55049) 出生(21734) 的(16029838) 綠蠵龜(40) 帶回(6256) 實驗室(12027) 並(442790) 測試(10686) 在(3284238) 不同(159432) 的(16029838) 磁場(2414) 傾角(12) geomagnetic(1) inclination(Unknown) 和(1338337) 強度(5359) geomagnetic(1) intensity(46) 下(329549) 牠們(28803) 的(16029838) 游泳(5207) 方向(39560) 由(208604) 這些(315113) 實驗(36801) 的(16029838) 結果(114008) 洛克曼(3) 提出(63073) 了(3199291) 這(2114032) 兩(526190) 種(701563) 因素(34409) 為(761341) 決定(101837) 海龜(727) 洄游(192) 指標(8034) 的(16029838) 假說(1031) 他(2487930) 認為(192030) 當(294625) 海龜(727) 出生(21734) 時(623734) 牠(72229) 會(1014977) 記得(47506) 出生地(790) 之(875481) 地磁(81) 的(16029838) 傾角(12) 與(968432) 強度(5359) 而(937923) 這(2114032) 兩(526190) 項(88887) 資料(52866) 就(1737544) 像(289494) 地圖(10218) 上(1233218) 任何(131795) 一(3701681) 點(118735) 的(16029838) 經緯度(40) 一樣(188109) 的(16029838) 精確(6695) 圖(46009) 六(77936) 因此(184606) 當(294625) 海龜(727) 長大(20410) 成熟(15793) 後(422857) 牠(72229) 便(220860) 能(582260) 按照(15014) 記憶(37224) 中(1011729) 的(16029838) 地磁(81) 地圖(10218) 游回(85) 其(307905) 出生地(790) 去(479993) 交配(1460) 及(304586) 產卵(1337),"{'Low': 14, 'High': 101}","{'Unknown': 39, '第1*級': 8, '第2級': 6, '第1級': 24, '第5級': 11, '第3*級': 5, '第4*級': 7, '第3級': 3, '第2*級': 3, '第6級': 3, '第7級': 2, '第4級': 4}",14,Y,Y,N,Y
由於海龜的腦中和大洋洄游的魚類一樣，具有類似磁鐵的組織，因此這個假說，較能為人們所接受。,由於 海龜 的 腦 中 和 大洋 洄游 的 魚類 一樣 具有 類似 磁鐵 的 組織 因此 這 個 假說 較 能 為 人們 所 接受,26,由於(88111) 海龜(727) 的(16029838) 腦(22627) 中(1011729) 和(1338337) 大洋(801) 洄游(192) 的(16029838) 魚類(2738) 一樣(188109) 具有(60702) 類似(29985) 磁鐵(835) 的(16029838) 組織(69485) 因此(184606) 這(2114032) 個(2296574) 假說(1031) 較(78424) 能(582260) 為(761341) 人們(77778) 所(527327) 接受(84729),{'High': 26},"{'第4*級': 3, 'Unknown': 8, '第1級': 5, '第4級': 2, '第1*級': 2, '第6級': 1, '第5級': 2, '第7級': 1, '第2級': 2}",0,Y,Y,N,N
然而，由於洛克曼所使用的實驗材料是稚龜，因此無法證實是否成龜仍具有相同的「辨識」能力。,然而 由於 洛克曼 所 使用 的 實驗 材料 是 稚龜 因此 無法 證實 是否 成龜 仍 具有 相同 的 辨識 能力,21,然而(94482) 由於(88111) 洛克曼(3) 所(527327) 使用(99640) 的(16029838) 實驗(36801) 材料(16513) 是(4642407) 稚龜(1) 因此(184606) 無法(150606) 證實(10978) 是否(78907) 成龜(1) 仍(92056) 具有(60702) 相同(33311) 的(16029838) 辨識(4831) 能力(93399),"{'High': 18, 'Low': 3}","{'第5級': 6, '第4*級': 2, 'Unknown': 3, '第2級': 2, '第4級': 4, '第1級': 3, '第6級': 1}",1,Y,Y,N,Y
另一個令人費解的問題是，不少產卵沙灘附近的海域，如澎湖的望安等地，都有海龜優良的棲息地，為何牠們還要不辭辛勞地洄游到數百甚至數千公里以外的地區去覓食，經過數年後再努力的游回來產卵？,另 一 個 令 人 費解 的 問題 是 不少 產卵 沙灘 附近 的 海域 如 澎湖 的 望安 等 地 都 有 海龜 優良 的 棲息地 為何 牠們 還要 不辭辛勞 地 洄游到 數百 甚至 數千 公里 以外 的 地區 去 覓食 經過 數 年 後 再 努力 的 游回來 產卵,51,另(138369) 一(3701681) 個(2296574) 令(128742) 人(1550512) 費解(792) 的(16029838) 問題(280782) 是(4642407) 不少(35256) 產卵(1337) 沙灘(3161) 附近(32204) 的(16029838) 海域(1974) 如(195069) 澎湖(3267) 的(16029838) 望安(47) 等(327380) 地(754998) 都(1125846) 有(2217079) 海龜(727) 優良(3018) 的(16029838) 棲息地(295) 為何(25238) 牠們(28803) 還要(6725) 不辭辛勞(176) 地(754998) 洄游到(2) 數百(5902) 甚至(122502) 數千(4849) 公里(16646) 以外(13444) 的(16029838) 地區(40339) 去(479993) 覓食(1544) 經過(64617) 數(38654) 年(514736) 後(422857) 再(326207) 努力(62566) 的(16029838) 游回來(38) 產卵(1337),"{'High': 48, 'Low': 3}","{'第3級': 1, '第1級': 16, '第5級': 2, '第7級': 3, 'Unknown': 18, '第4*級': 2, '第1*級': 2, '第3*級': 2, '第6級': 1, '第4級': 2, '第2級': 2}",4,Y,Y,N,N
牠們為何不就近選擇其覓食地呢？,牠們 為何 不 就近 選擇 其 覓食地 呢,8,牠們(28803) 為何(25238) 不(2282521) 就近(1183) 選擇(75178) 其(307905) 覓食地(Unknown) 呢(204566),"{'High': 7, 'Low': 1}","{'Unknown': 2, '第5級': 1, '第1級': 2, '第6級': 2, '第3*級': 1}",1,Y,N,N,N
演化生物學家認為這種行為和地殼的板塊漂移(continentaldrift)有關，由於海龜在兩億五千萬年前就出現在這個地球上，而且牠對其出生地的忠誠度很高，因此有可能牠在演化的初期和許多的動物一樣，都會選擇出生地附近合適的海域做為其覓食棲地。,演化 生物 學家 認為 這 種 行為 和 地殼 的 板塊 漂移 continental drift 有關 由於 海龜 在 兩億五千萬 年 前 就 出現 在 這 個 地球 上 而且 牠 對 其 出生地 的 忠誠度 很 高 因此 有 可能 牠 在 演化 的 初期 和 許多 的 動物 一樣 都 會 選擇 出生地 附近 合適 的 海域 做為 其 覓食 棲地,62,演化(7358) 生物(18302) 學家(3241) 認為(192030) 這(2114032) 種(701563) 行為(97450) 和(1338337) 地殼(441) 的(16029838) 板塊(542) 漂移(109) continental(Unknown) drift(Unknown) 有關(69607) 由於(88111) 海龜(727) 在(3284238) 兩億五千萬(43) 年(514736) 前(272709) 就(1737544) 出現(124694) 在(3284238) 這(2114032) 個(2296574) 地球(21533) 上(1233218) 而且(180402) 牠(72229) 對(897964) 其(307905) 出生地(790) 的(16029838) 忠誠度(784) 很(715675) 高(128858) 因此(184606) 有(2217079) 可能(271025) 牠(72229) 在(3284238) 演化(7358) 的(16029838) 初期(11598) 和(1338337) 許多(159791) 的(16029838) 動物(36835) 一樣(188109) 都(1125846) 會(1014977) 選擇(75178) 出生地(790) 附近(32204) 合適(7258) 的(16029838) 海域(1974) 做為(19421) 其(307905) 覓食(1544) 棲地(278),"{'High': 59, 'Low': 3}","{'第6級': 4, 'Unknown': 19, '第2級': 1, '第1級': 18, '第5級': 1, '第4級': 5, '第4*級': 2, '第1*級': 6, '第3級': 1, '第3*級': 3, '第7級': 2}",6,Y,Y,N,N
