sentence,sentence_preprocessed,sentence_length,word_freq,high_low_freq,word_level,long_word_count,is_complete_sentence,is_complete_context,is_blacklist,is_greylist
「陽明山的入口多，又是台北和東北角的交通必經之地，有許多穿越型的遊客，」陽明山國家公園管理處處長蔡佰祿指出，每天阿公阿媽早上來運動爬山，青少年晚上上山夜遊，看夜景、看星星，二十四小時都有人利用，而除了例假日和花季，遊客夏天來避暑、冬天上山洗溫泉，全年遊客數量幾乎沒有離尖峰的差別。,陽明山 的 入口 多 又 是 台北 和 東北角 的 交通 必 經 之 地 有 許多 穿越型 的 遊客 陽明山 國家 公園 管理處 處長 蔡佰祿 指出 每 天 阿公 阿媽 早上 來 運動 爬山 青少年 晚上 上山 夜遊 看 夜景 看 星星 二十四 小時 都 有 人 利用 而 除了 例假日 和 花季 遊客 夏天 來 避暑 冬天 上山 洗溫泉 全 年 遊客 數量 幾乎 沒有 離尖峰 的 差別,70,陽明山(687) 的(16029838) 入口(5175) 多(318992) 又(535555) 是(4642407) 台北(22242) 和(1338337) 東北角(461) 的(16029838) 交通(11639) 必(37598) 經(38471) 之(875481) 地(754998) 有(2217079) 許多(159791) 穿越型(Unknown) 的(16029838) 遊客(4899) 陽明山(687) 國家(109166) 公園(13910) 管理處(506) 處長(1328) 蔡佰祿(Unknown) 指出(38456) 每(333357) 天(330413) 阿公(4089) 阿媽(2176) 早上(22242) 來(742183) 運動(63153) 爬山(1378) 青少年(16159) 晚上(42206) 上山(4033) 夜遊(265) 看(444691) 夜景(466) 看(444691) 星星(5246) 二十四(7473) 小時(48521) 都(1125846) 有(2217079) 人(1550512) 利用(49229) 而(937923) 除了(75964) 例假日(128) 和(1338337) 花季(184) 遊客(4899) 夏天(11228) 來(742183) 避暑(1237) 冬天(8241) 上山(4033) 洗溫泉(62) 全(178642) 年(514736) 遊客(4899) 數量(14605) 幾乎(74298) 沒有(594280) 離尖峰(Unknown) 的(16029838) 差別(10648),"{'High': 66, 'Low': 4}","{'Unknown': 27, '第1級': 18, '第3級': 3, '第1*級': 5, '第5級': 3, '第3*級': 4, '第4級': 5, '第2級': 3, '第6級': 1, '第4*級': 1}",11,Y,Y,N,Y
五年前，面積只有玉山國家公園十分之一的陽明山國家公園，遊客量已高達二百五十萬人次，足足是玉山的兩倍。,五 年前 面積 只有 玉山 國家 公園 十分之一 的 陽明山 國家 公園 遊客量 已 高達 二百五十萬 人次 足足 是 玉山 的 兩 倍,23,五(112649) 年前(19) 面積(6281) 只有(43745) 玉山(1195) 國家(109166) 公園(13910) 十分之一(1231) 的(16029838) 陽明山(687) 國家(109166) 公園(13910) 遊客量(11) 已(215610) 高達(7931) 二百五十萬(148) 人次(848) 足足(2167) 是(4642407) 玉山(1195) 的(16029838) 兩(526190) 倍(22818),"{'High': 21, 'Low': 2}","{'第1級': 5, 'Unknown': 9, '第5級': 1, '第1*級': 4, '第3級': 1, '第6級': 2, '第3*級': 1}",4,Y,Y,N,N
今年，陽管處公布的最新資料更顯示，陽明山的入山人次已高達歷史上的新高峰──一千兩百萬人次。,今年 陽管處 公布 的 最 新 資料 更 顯示 陽明山 的 入 山 人次 已 高達 歷史 上 的 新 高峰 一千兩百萬 人次,23,今年(10836) 陽管處(3) 公布(3670) 的(16029838) 最(421680) 新(212453) 資料(52866) 更(361676) 顯示(32718) 陽明山(687) 的(16029838) 入(30777) 山(54936) 人次(848) 已(215610) 高達(7931) 歷史(96060) 上(1233218) 的(16029838) 新(212453) 高峰(2712) 一千兩百萬(90) 人次(848),"{'High': 21, 'Low': 2}","{'第1級': 7, 'Unknown': 5, '第5級': 2, '第1*級': 2, '第3級': 3, '第4*級': 1, '第6級': 3}",3,Y,N,N,N
今日客滿、明日請早！,今日 客滿 明日 請 早,5,今日(20291) 客滿(393) 明日(2940) 請(120629) 早(62038),{'High': 5},"{'第4*級': 1, '第3級': 1, '第5級': 1, '第1級': 2}",0,Y,N,N,N
有別於其他國家公園與原住民狩獵文化產生爭議等問題，陽明山國家公園管理處成立後，必須先花精力解決過去遊憩帶來的問題。,有別於 其他 國家 公園 與 原住民 狩獵 文化 產生 爭議 等 問題 陽明山 國家 公園 管理處 成立 後 必須 先 花 精力 解決 過去 遊憩 帶來 的 問題,28,有別於(2028) 其他(189445) 國家(109166) 公園(13910) 與(968432) 原住民(9390) 狩獵(2902) 文化(115697) 產生(82753) 爭議(7127) 等(327380) 問題(280782) 陽明山(687) 國家(109166) 公園(13910) 管理處(506) 成立(28506) 後(422857) 必須(170592) 先(136649) 花(72593) 精力(9629) 解決(55725) 過去(88758) 遊憩(195) 帶來(40305) 的(16029838) 問題(280782),{'High': 28},"{'Unknown': 5, '第2級': 2, '第1*級': 5, '第4*級': 3, '第5級': 3, '第7級': 1, '第3*級': 2, '第1級': 4, '第3級': 1, '第4級': 2}",4,Y,Y,N,N
「陽明山可說是台北市最早開始拆除招牌的地方，」當時仍在營建署服務的郭瓊瑩說，早在國家公園於民國七十四年成立之前，營建署即開始取締違章建築，甚至連陽金公路的電線桿也早已地下化。,陽明山 可 說 是 台北市 最早 開始 拆除 招牌 的 地方 當時 仍 在 營建署 服務 的 郭瓊瑩 說 早 在 國家 公園 於 民國 七十四年 成立 之前 營建署 即 開始 取締 違章建築 甚至 連 陽金公路 的 電線桿 也 早已 地下化,41,陽明山(687) 可(307359) 說(1285247) 是(4642407) 台北市(4393) 最早(9441) 開始(245562) 拆除(1614) 招牌(3940) 的(16029838) 地方(139164) 當時(126214) 仍(92056) 在(3284238) 營建署(103) 服務(38055) 的(16029838) 郭瓊瑩(9) 說(1285247) 早(62038) 在(3284238) 國家(109166) 公園(13910) 於(327210) 民國(16130) 七十四年(165) 成立(28506) 之前(79748) 營建署(103) 即(110826) 開始(245562) 取締(1152) 違章建築(114) 甚至(122502) 連(91153) 陽金公路(Unknown) 的(16029838) 電線桿(539) 也(1590760) 早已(21910) 地下化(72),"{'High': 38, 'Low': 3}","{'Unknown': 13, '第4*級': 3, '第1級': 8, '第2級': 2, '第6級': 3, '第5級': 2, '第1*級': 5, '第3*級': 2, '第4級': 2, '第3級': 1}",10,Y,Y,N,Y
「近年來遊客的素質已經提高很多了，」解說課課員柳正鳴說，現在隨地亂丟垃圾或是攀折花木的遊客遭解說人員勸導時，大部分都知道自己做錯事而能接受，山上環境倒沒有直接受到旅客的破壞。,近年 來 遊客 的 素質 已經 提高 很多 了 解說課 課員 柳正鳴 說 現在 隨地 亂丟 垃圾 或是 攀折 花木 的 遊客 遭 解說 人員 勸導 時 大部分 都 知道 自己 做錯 事 而 能 接受 山 上 環境 倒 沒有 直接 受到 旅客 的 破壞,46,近年(7929) 來(742183) 遊客(4899) 的(16029838) 素質(3102) 已經(245160) 提高(19797) 很多(113128) 了(3199291) 解說課(2) 課員(26) 柳正鳴(Unknown) 說(1285247) 現在(218744) 隨地(1766) 亂丟(463) 垃圾(7197) 或是(75906) 攀折(42) 花木(570) 的(16029838) 遊客(4899) 遭(18764) 解說(5627) 人員(49261) 勸導(575) 時(623734) 大部分(32534) 都(1125846) 知道(343214) 自己(744739) 做錯(2945) 事(385949) 而(937923) 能(582260) 接受(84729) 山(54936) 上(1233218) 環境(71054) 倒(40381) 沒有(594280) 直接(54798) 受到(66513) 旅客(3355) 的(16029838) 破壞(18326),"{'High': 42, 'Low': 4}","{'第4級': 4, '第1級': 10, 'Unknown': 14, '第6級': 1, '第2級': 2, '第4*級': 1, '第5級': 4, '第3級': 3, '第7級': 2, '第3*級': 1, '第1*級': 4}",3,Y,Y,N,Y
陽管處去年舉辦「走遍陽明山國家公園」的自然體驗活動，參加者只要買一本手冊，在截止日期前照著手冊上的十二條步道走一遍，在指定點的告示牌旁留影存證，就可以獲得證書和紀念品。,陽管處 去年 舉辦 走遍 陽明山 國家 公園 的 自然 體驗 活動 參加 者 只要 買 一 本 手冊 在 截止 日期 前 照著 手冊 上 的 十二 條 步道 走 一 遍 在 指定 點 的 告示牌 旁 留影 存證 就 可以 獲得 證書 和 紀念品,46,陽管處(3) 去年(9462) 舉辦(12070) 走遍(1031) 陽明山(687) 國家(109166) 公園(13910) 的(16029838) 自然(91995) 體驗(15945) 活動(85743) 參加(42962) 者(423504) 只要(99140) 買(59736) 一(3701681) 本(197156) 手冊(3707) 在(3284238) 截止(582) 日期(6537) 前(272709) 照著(Unknown) 手冊(3707) 上(1233218) 的(16029838) 十二(22310) 條(115362) 步道(2650) 走(128453) 一(3701681) 遍(20150) 在(3284238) 指定(5033) 點(118735) 的(16029838) 告示牌(371) 旁(39478) 留影(235) 存證(140) 就(1737544) 可以(560531) 獲得(54809) 證書(1420) 和(1338337) 紀念品(1268),"{'Low': 2, 'High': 44}","{'Unknown': 10, '第1級': 14, '第4級': 2, '第1*級': 5, '第3*級': 1, '第5級': 9, '第2級': 3, '第3級': 2}",4,Y,Y,N,N
陽管處解說教育課課長呂理昌指出，希望藉著這個活動分散遊客、鼓勵大家多爬山。,陽管處 解說 教育 課 課長 呂理昌 指出 希望 藉著 這 個 活動 分散 遊客 鼓勵 大家 多 爬山,18,陽管處(3) 解說(5627) 教育(71554) 課(14124) 課長(945) 呂理昌(Unknown) 指出(38456) 希望(119975) 藉著(9285) 這(2114032) 個(2296574) 活動(85743) 分散(4714) 遊客(4899) 鼓勵(27004) 大家(109692) 多(318992) 爬山(1378),"{'Low': 2, 'High': 16}","{'Unknown': 6, '第5級': 2, '第3級': 2, '第1*級': 1, '第2級': 2, '第1級': 4, '第4級': 1}",2,Y,N,N,Y
這個活動還有一項美意，解說課黃小翠說，希望民眾能夠一個月來走一條，細細體會陽明山的春夏秋冬。,這 個 活動 還 有 一 項 美意 解說課 黃小翠 說 希望 民眾 能夠 一 個 月 來 走 一 條 細細 體會 陽明山 的 春 夏 秋冬,28,這(2114032) 個(2296574) 活動(85743) 還(625086) 有(2217079) 一(3701681) 項(88887) 美意(387) 解說課(2) 黃小翠(Unknown) 說(1285247) 希望(119975) 民眾(17097) 能夠(96422) 一(3701681) 個(2296574) 月(148997) 來(742183) 走(128453) 一(3701681) 條(115362) 細細(3640) 體會(9519) 陽明山(687) 的(16029838) 春(12629) 夏(10706) 秋冬(Unknown),"{'High': 25, 'Low': 3}","{'第1級': 12, '第2級': 5, 'Unknown': 7, '第5級': 2, '第7級': 1, '第4*級': 1}",3,Y,N,N,Y
其實遊客壓力是國家公園普遍的問題，為了降低過量遊客對自然環境造成的影響，位在南投的玉山國家公園曾試辦過承載量管制，限制入山人數。,其實 遊客 壓力 是 國家 公園 普遍 的 問題 為了 降低 過量 遊客 對 自然 環境 造成 的 影響 位在 南投 的 玉山 國家 公園 曾 試辦 過 承載量 管制 限制 入 山 人數,34,其實(109290) 遊客(4899) 壓力(40408) 是(4642407) 國家(109166) 公園(13910) 普遍(16221) 的(16029838) 問題(280782) 為了(Unknown) 降低(15638) 過量(2056) 遊客(4899) 對(897964) 自然(91995) 環境(71054) 造成(63141) 的(16029838) 影響(95840) 位在(30) 南投(857) 的(16029838) 玉山(1195) 國家(109166) 公園(13910) 曾(132981) 試辦(327) 過(412878) 承載量(36) 管制(5335) 限制(23094) 入(30777) 山(54936) 人數(11834),"{'High': 31, 'Low': 3}","{'第3*級': 2, 'Unknown': 8, '第4級': 4, '第1級': 6, '第1*級': 6, '第4*級': 4, '第5級': 1, '第3級': 2, '第6級': 1}",1,Y,N,N,N
為了做好承載量管制，經過幾年的試辦，陽明山今年也開始實施假日交通管制，鼓勵民眾利用台北市新推出的「休閒公車」或步行上下山。,為了 做好 承載量 管制 經過 幾 年 的 試辦 陽明山 今年 也 開始 實施 假日 交通 管制 鼓勵 民眾 利用 台北市 新 推出 的 休閒 公車 或 步行 上下山,29,為了(Unknown) 做好(11572) 承載量(36) 管制(5335) 經過(64617) 幾(229415) 年(514736) 的(16029838) 試辦(327) 陽明山(687) 今年(10836) 也(1590760) 開始(245562) 實施(11851) 假日(2962) 交通(11639) 管制(5335) 鼓勵(27004) 民眾(17097) 利用(49229) 台北市(4393) 新(212453) 推出(10009) 的(16029838) 休閒(5416) 公車(4473) 或(478077) 步行(3973) 上下山(10),"{'Low': 3, 'High': 26}","{'Unknown': 7, '第6級': 4, '第2級': 2, '第1級': 7, '第3*級': 2, '第3級': 2, '第4級': 2, '第4*級': 1, '第5級': 1, '第1*級': 1}",4,Y,Y,N,N
只是陽明山國家公園四通八達，入山通道很多，管理處的人力又少，許多文化大學校友和觀光客都說，我們還是有很多捷徑和小路可以上山，因此管制承載量仍有技術層面的困難。,只是 陽明山 國家 公園 四通八達 入 山 通道 很多 管理處 的 人力 又 少 許多 文化 大學 校友 和 觀光客 都 說 我們 還是 有 很多 捷徑 和 小路 可以 上山 因此 管制 承載量 仍 有 技術 層面 的 困難,40,只是(96536) 陽明山(687) 國家(109166) 公園(13910) 四通八達(277) 入(30777) 山(54936) 通道(4751) 很多(113128) 管理處(506) 的(16029838) 人力(7261) 又(535555) 少(50762) 許多(159791) 文化(115697) 大學(83893) 校友(1227) 和(1338337) 觀光客(2140) 都(1125846) 說(1285247) 我們(979260) 還是(155231) 有(2217079) 很多(113128) 捷徑(1733) 和(1338337) 小路(3208) 可以(560531) 上山(4033) 因此(184606) 管制(5335) 承載量(36) 仍(92056) 有(2217079) 技術(47691) 層面(14492) 的(16029838) 困難(37504),"{'High': 39, 'Low': 1}","{'第4級': 4, 'Unknown': 11, '第1*級': 5, '第4*級': 2, '第6級': 4, '第1級': 10, '第3*級': 2, '第2級': 1, '第5級': 1}",5,Y,Y,N,N
三千人看三箱螢火蟲？,三千 人 看 三 箱 螢火蟲,6,三千(5525) 人(1550512) 看(444691) 三(313861) 箱(3893) 螢火蟲(1089),{'High': 6},"{'Unknown': 3, '第1級': 2, '第3*級': 1}",1,Y,N,N,N
管理處雖嘗試要讓長期來作為大台北後花園的陽明山區更回歸自然，但隨著周休二日、經濟環境改善，遊客帶來停車、垃圾等間接影響卻更形嚴重。,管理處 雖 嘗試 要 讓 長期 來 作為 大台北 後花園 的 陽明 山區 更 回歸 自然 但 隨著 周休 二 日 經濟 環境 改善 遊客 帶來 停車 垃圾 等 間接 影響 卻 更形 嚴重,34,管理處(506) 雖(48164) 嘗試(21645) 要(851264) 讓(526314) 長期(28592) 來(742183) 作為(58009) 大台北(151) 後花園(389) 的(16029838) 陽明(1185) 山區(4460) 更(361676) 回歸(6257) 自然(91995) 但(597124) 隨著(32948) 周休(44) 二(152494) 日(94041) 經濟(83046) 環境(71054) 改善(21559) 遊客(4899) 帶來(40305) 停車(1851) 垃圾(7197) 等(327380) 間接(5005) 影響(95840) 卻(333007) 更形(835) 嚴重(39284),"{'High': 33, 'Low': 1}","{'Unknown': 10, '第2級': 3, '第4*級': 2, '第1級': 5, '第5級': 3, '第6級': 1, '第3*級': 4, '第4級': 2, '第3級': 3, '第7級': 1}",3,Y,Y,N,Y
甚至陽管處為遊客舉辦的知性教育活動，立意雖好，卻因為人潮蜂擁而至，往往熱鬧有餘、卻無法發揮知性教育功能，有時幾箱螢火蟲，就吸引了兩、三千人前來觀賞。,甚至 陽管處 為 遊客 舉辦 的 知性 教育 活動 立意 雖 好 卻 因為 人潮 蜂擁 而 至 往往 熱鬧 有餘 卻 無法 發揮 知性 教育 功能 有時 幾 箱 螢火蟲 就 吸引 了 兩 三千 人 前來 觀賞,39,甚至(122502) 陽管處(3) 為(761341) 遊客(4899) 舉辦(12070) 的(16029838) 知性(2107) 教育(71554) 活動(85743) 立意(598) 雖(48164) 好(448428) 卻(333007) 因為(425061) 人潮(2524) 蜂擁(1060) 而(937923) 至(101530) 往往(41388) 熱鬧(6537) 有餘(1706) 卻(333007) 無法(150606) 發揮(23985) 知性(2107) 教育(71554) 功能(38600) 有時(47894) 幾(229415) 箱(3893) 螢火蟲(1089) 就(1737544) 吸引(20619) 了(3199291) 兩(526190) 三千(5525) 人(1550512) 前來(13412) 觀賞(5617),"{'High': 38, 'Low': 1}","{'第4*級': 2, 'Unknown': 9, '第4級': 5, '第1級': 5, '第6級': 2, '第3級': 2, '第2級': 2, '第7級': 2, '第1*級': 2, '第5級': 6, '第3*級': 2}",2,Y,Y,N,N
許多景點因遊客的口耳相傳更聲名大噪，除近來以吃炒青菜聞名的竹子湖外，國家公園成立以前，擎天崗還因茅草過高，入夜霧氣迷離而發生過山難，如今擎天崗已成了一次可容上千旅客的野餐區。,許多 景點 因 遊客 的 口 耳 相傳 更 聲名大噪 除 近來 以 吃 炒 青菜 聞名 的 竹子湖 外 國家 公園 成立 以前 擎天崗 還 因 茅草 過 高 入夜 霧氣 迷離 而 發生 過 山 難 如今 擎天崗 已 成 了 一 次 可 容 上 千 旅客 的 野餐區,52,許多(159791) 景點(1844) 因(119364) 遊客(4899) 的(16029838) 口(83854) 耳(16140) 相傳(4515) 更(361676) 聲名大噪(543) 除(15929) 近來(3822) 以(547785) 吃(141660) 炒(6541) 青菜(1040) 聞名(4406) 的(16029838) 竹子湖(23) 外(109310) 國家(109166) 公園(13910) 成立(28506) 以前(59453) 擎天崗(35) 還(625086) 因(119364) 茅草(753) 過(412878) 高(128858) 入夜(970) 霧氣(1130) 迷離(500) 而(937923) 發生(129211) 過(412878) 山(54936) 難(75701) 如今(29812) 擎天崗(35) 已(215610) 成(76470) 了(3199291) 一(3701681) 次(331701) 可(307359) 容(3650) 上(1233218) 千(19677) 旅客(3355) 的(16029838) 野餐區(18),"{'High': 48, 'Low': 4}","{'第3*級': 2, '第5級': 4, 'Unknown': 17, '第1級': 9, '第3級': 3, '第4級': 1, '第6級': 2, '第2*級': 2, '第1*級': 6, '第4*級': 4, '第7級': 1, '第2級': 1}",5,Y,Y,N,N
遊客太多，製造大量車潮、垃圾、污水，讓原本負有保育任務的管理處，也得分神照顧遊客的需要。,遊客 太多 製造 大量 車潮 垃圾 污水 讓 原本 負有 保育 任務 的 管理處 也 得 分神 照顧 遊客 的 需要,21,遊客(4899) 太多(30757) 製造(28512) 大量(28414) 車潮(128) 垃圾(7197) 污水(468) 讓(526314) 原本(35765) 負有(1002) 保育(1820) 任務(25232) 的(16029838) 管理處(506) 也(1590760) 得(573721) 分神(331) 照顧(29251) 遊客(4899) 的(16029838) 需要(166793),{'High': 21},"{'Unknown': 9, '第4*級': 4, '第3級': 2, '第2級': 2, '第7級': 1, '第1級': 3}",1,Y,N,N,N
陽明山國家公園管理處就在去年，決定在竹子湖產業道路和陽金公路的三叉路口興建一座立體停車場，以因應竹子湖的假日車潮。,陽明山 國家 公園 管理處 就 在 去年 決定 在 竹子湖 產業道路 和 陽金公路 的 三叉 路口 興建 一 座 立體 停車場 以 因應 竹子湖 的 假日 車潮,27,陽明山(687) 國家(109166) 公園(13910) 管理處(506) 就(1737544) 在(3284238) 去年(9462) 決定(101837) 在(3284238) 竹子湖(23) 產業道路(108) 和(1338337) 陽金公路(Unknown) 的(16029838) 三叉(119) 路口(917) 興建(5688) 一(3701681) 座(49959) 立體(3178) 停車場(2735) 以(547785) 因應(6201) 竹子湖(23) 的(16029838) 假日(2962) 車潮(128),"{'High': 24, 'Low': 3}","{'Unknown': 9, '第1*級': 4, '第1級': 5, '第2級': 1, '第2*級': 1, '第5級': 2, '第3*級': 2, '第6級': 2, '第3級': 1}",7,Y,Y,N,N
「竹子湖剛好在陽金公路人車分道系統的中間點，又有一個觀景平台，這裡設一座停車場可以當成行人的休憩點，也可以紓解交通問題，」陽管處企劃經理課代課長董人維說。,竹子湖 剛好 在 陽金公路 人 車 分 道 系統 的 中間 點 又 有 一 個 觀 景 平台 這裡 設 一 座 停車場 可以 當成 行人 的 休憩點 也 可以 紓解 交通 問題 陽管處 企劃 經理 課 代課長 董人維 說,41,竹子湖(23) 剛好(11296) 在(3284238) 陽金公路(Unknown) 人(1550512) 車(47590) 分(62224) 道(141723) 系統(67366) 的(16029838) 中間(19003) 點(118735) 又(535555) 有(2217079) 一(3701681) 個(2296574) 觀(12845) 景(12183) 平台(5518) 這裡(100385) 設(17537) 一(3701681) 座(49959) 停車場(2735) 可以(560531) 當成(15280) 行人(3266) 的(16029838) 休憩點(1) 也(1590760) 可以(560531) 紓解(1786) 交通(11639) 問題(280782) 陽管處(3) 企劃(2801) 經理(11331) 課(14124) 代課長(Unknown) 董人維(Unknown) 說(1285247),"{'Low': 6, 'High': 35}","{'Unknown': 9, '第3*級': 2, '第1*級': 3, '第1級': 16, '第5級': 1, '第2級': 1, '第6級': 5, '第3級': 2, '第4級': 1, '第4*級': 1}",7,Y,N,N,Y
世居當地的商家聽到這個可以帶來更多遊客的消息都很期待。,世居 當地 的 商家 聽到 這 個 可以 帶來 更多 遊客 的 消息 都 很 期待,16,世居(259) 當地(23011) 的(16029838) 商家(1939) 聽到(61809) 這(2114032) 個(2296574) 可以(560531) 帶來(40305) 更多(44083) 遊客(4899) 的(16029838) 消息(37528) 都(1125846) 很(715675) 期待(21616),{'High': 16},"{'Unknown': 3, '第4*級': 2, '第1級': 7, '第6級': 1, '第2級': 1, '第3*級': 1, '第3級': 1}",0,Y,N,N,N
但這塊停車場預定地看似一片荒蕪的濕地，正是國寶級的稀有植物「台灣水韭」與台灣原生烏龜材棺龜、台北樹蛙、艾氏樹蛙、中國樹蟾等特稀有生物的棲息地。,但 這 塊 停車場 預定地 看似 一 片 荒蕪 的 濕地 正 是 國寶級 的 稀有 植物 台灣 水韭 與 台灣 原生 烏龜 材棺龜 台北 樹蛙 艾氏 樹蛙 中國 樹蟾 等 特 稀有 生物 的 棲息地,36,但(597124) 這(2114032) 塊(54148) 停車場(2735) 預定地(104) 看似(8698) 一(3701681) 片(71870) 荒蕪(1187) 的(16029838) 濕地(657) 正(179334) 是(4642407) 國寶級(159) 的(16029838) 稀有(1563) 植物(19121) 台灣(130718) 水韭(25) 與(968432) 台灣(130718) 原生(1161) 烏龜(2903) 材棺龜(Unknown) 台北(22242) 樹蛙(336) 艾氏(364) 樹蛙(336) 中國(214840) 樹蟾(13) 等(327380) 特(11475) 稀有(1563) 生物(18302) 的(16029838) 棲息地(295),"{'High': 33, 'Low': 3}","{'第2級': 2, '第1級': 10, '第3級': 1, 'Unknown': 15, '第7級': 2, '第3*級': 2, '第6級': 3, '第4*級': 1}",5,Y,Y,N,Y
為了保護這塊棲地，輿論撻伐聲浪紛起。,為了 保護 這 塊 棲地 輿論 撻伐 聲浪 紛起,9,為了(Unknown) 保護(32573) 這(2114032) 塊(54148) 棲地(278) 輿論(4125) 撻伐(476) 聲浪(924) 紛起(98),"{'Low': 2, 'High': 7}","{'Unknown': 3, '第3*級': 1, '第1級': 2, '第6級': 1, '第7級': 2}",0,Y,N,N,N
「陽管處已經對所謂『龐大的遊憩壓力』投降了？」,陽管處 已經 對 所謂 龐大 的 遊憩 壓力 投降 了,10,陽管處(3) 已經(245160) 對(897964) 所謂(59460) 龐大(10804) 的(16029838) 遊憩(195) 壓力(40408) 投降(10637) 了(3199291),"{'Low': 1, 'High': 9}","{'Unknown': 3, '第2級': 1, '第1級': 2, '第5級': 2, '第6級': 1, '第4級': 1}",1,Y,N,N,N
台北市一位家庭主婦將疑慮投書報端。,台北市 一 位 家庭 主婦 將 疑慮 投書 報端,9,台北市(4393) 一(3701681) 位(284809) 家庭(60608) 主婦(2847) 將(448374) 疑慮(3628) 投書(496) 報端(154),{'High': 9},"{'Unknown': 3, '第1級': 2, '第2級': 1, '第5級': 2, '第6級': 1}",1,Y,N,N,N
承受來自各界的龐大壓力，陽管處已決定停建停車場。,承受 來自 各界 的 龐大 壓力 陽管處 已 決定 停 建 停車場,12,承受(9524) 來自(41811) 各界(2155) 的(16029838) 龐大(10804) 壓力(40408) 陽管處(3) 已(215610) 決定(101837) 停(21846) 建(13839) 停車場(2735),"{'High': 11, 'Low': 1}","{'第6級': 2, '第4級': 2, 'Unknown': 3, '第1級': 1, '第3級': 3, '第2級': 1}",2,Y,N,N,N
國家公園還需要建設？,國家 公園 還 需要 建設,5,國家(109166) 公園(13910) 還(625086) 需要(166793) 建設(11627),{'High': 5},"{'第1*級': 2, 'Unknown': 1, '第2級': 1, '第5級': 1}",0,Y,N,N,N
但長期以來潛伏的遊憩問題卻不只一端，尤其是國家公園管理處成立之前即已存在、私人擁有的休閒場所，如日月農莊早就營運多時、遠近馳名，違法佔用國土、違建及違規營業等許多問題至今未獲解決。,但 長期 以來 潛伏 的 遊憩 問題 卻 不只 一 端 尤其 是 國家 公園 管理處 成立 之前 即已 存在 私人 擁有 的 休閒 場所 如 日月 農莊 早 就 營運 多時 遠近馳名 違法 佔用 國土 違建 及 違規 營業 等 許多 問題 至今 未 獲 解決,47,但(597124) 長期(28592) 以來(26654) 潛伏(1663) 的(16029838) 遊憩(195) 問題(280782) 卻(333007) 不只(20841) 一(3701681) 端(15640) 尤其(50700) 是(4642407) 國家(109166) 公園(13910) 管理處(506) 成立(28506) 之前(79748) 即已(1407) 存在(75197) 私人(12403) 擁有(55809) 的(16029838) 休閒(5416) 場所(8263) 如(195069) 日月(2081) 農莊(1783) 早(62038) 就(1737544) 營運(5641) 多時(716) 遠近馳名(224) 違法(2775) 佔用(495) 國土(2685) 違建(134) 及(304586) 違規(1052) 營業(4800) 等(327380) 許多(159791) 問題(280782) 至今(14540) 未(101927) 獲(11610) 解決(55725),{'High': 47},"{'第2級': 1, 'Unknown': 11, '第4*級': 3, '第7級': 4, '第1級': 8, '第4級': 4, '第3*級': 3, '第1*級': 2, '第5級': 8, '第6級': 3}",2,Y,Y,N,N
其實，在陽明山國家公園的細部計劃中，馬槽溪的兩岸原本即屬於遊憩區，還有一塊旅館預定用地，計劃中並明定鼓勵民間投資開發經營管理。,其實 在 陽明山 國家 公園 的 細部 計劃 中 馬槽溪 的 兩岸 原本 即 屬於 遊憩區 還 有 一 塊 旅館 預定 用地 計劃 中 並 明定 鼓勵 民間 投資 開發 經營 管理,33,其實(109290) 在(3284238) 陽明山(687) 國家(109166) 公園(13910) 的(16029838) 細部(994) 計劃(22462) 中(1011729) 馬槽溪(Unknown) 的(16029838) 兩岸(6984) 原本(35765) 即(110826) 屬於(39478) 遊憩區(42) 還(625086) 有(2217079) 一(3701681) 塊(54148) 旅館(12498) 預定(3218) 用地(917) 計劃(22462) 中(1011729) 並(442790) 明定(380) 鼓勵(27004) 民間(16236) 投資(38191) 開發(19196) 經營(39913) 管理(54484),"{'High': 31, 'Low': 2}","{'第3*級': 1, '第1*級': 3, 'Unknown': 9, '第1級': 5, '第7級': 1, '第2級': 2, '第4*級': 5, '第6級': 1, '第5級': 4, '第2*級': 1, '第4級': 1}",3,Y,Y,N,N
