sentence,sentence_preprocessed,sentence_length,word_freq,high_low_freq,word_level,long_word_count,is_complete_sentence,is_complete_context,is_blacklist,is_greylist
「中小企業要立定『在別人肩膀上想東西』的觀念來創造智財權。,中小 企業 要 立定 在 別人 肩膀 上 想 東西 的 觀念 來 創造 智財權,15,中小(565) 企業(65457) 要(851264) 立定(367) 在(3284238) 別人(108427) 肩膀(12026) 上(1233218) 想(449884) 東西(139472) 的(16029838) 觀念(39915) 來(742183) 創造(38327) 智財權(64),"{'High': 14, 'Low': 1}","{'Unknown': 3, '第4*級': 2, '第1級': 6, '第1*級': 1, '第2級': 1, '第5級': 1, '第4級': 1}",1,Y,N,N,N
智財權的基本常識是老闆一定要具備的，因為智慧財產權與企業發展關係非常密切。」,智財權 的 基本 常識 是 老闆 一定 要 具備 的 因為 智慧 財產權 與 企業 發展 關係 非常 密切,19,智財權(64) 的(16029838) 基本(52069) 常識(4123) 是(4642407) 老闆(24988) 一定(138695) 要(851264) 具備(13398) 的(16029838) 因為(425061) 智慧(46294) 財產權(1092) 與(968432) 企業(65457) 發展(117494) 關係(162883) 非常(152032) 密切(10538),"{'Low': 1, 'High': 18}","{'Unknown': 2, '第1級': 4, '第5級': 4, '第4*級': 3, '第2級': 1, '第1*級': 3, '第4級': 1, '第3級': 1}",2,Y,Y,N,N
台灣產業發展就是RD：「宏碁創業第一天就認為台灣產業發展就是要做RD，產業不升級，長期就無路可走。」,台灣 產業 發展 就 是 RD 宏碁 創業 第一 天 就 認為 台灣 產業 發展 就 是 要 做 RD 產業 不 升級 長期 就 無路可走,26,台灣(130718) 產業(29756) 發展(117494) 就(1737544) 是(4642407) RD(40) 宏碁(857) 創業(10107) 第一(172544) 天(330413) 就(1737544) 認為(192030) 台灣(130718) 產業(29756) 發展(117494) 就(1737544) 是(4642407) 要(851264) 做(411649) RD(40) 產業(29756) 不(2282521) 升級(1962) 長期(28592) 就(1737544) 無路可走(83),"{'High': 23, 'Low': 3}","{'第1級': 12, '第5級': 4, '第4級': 2, 'Unknown': 5, '第2級': 2, '第4*級': 1}",1,Y,N,N,Y
宏碁董事長施振榮明確的表示。,宏碁 董事長 施振榮 明確 的 表示,6,宏碁(857) 董事長(8106) 施振榮(241) 明確(17292) 的(16029838) 表示(74452),{'High': 6},"{'Unknown': 3, '第5級': 1, '第1級': 1, '第4*級': 1}",2,Y,N,N,Y
施振榮說，從他創業以來，就從來沒想過要抄襲。,施振榮 說 從 他 創業 以來 就 從來 沒 想 過 要 抄襲,13,施振榮(241) 說(1285247) 從(496546) 他(2487930) 創業(10107) 以來(26654) 就(1737544) 從來(35243) 沒(306167) 想(449884) 過(412878) 要(851264) 抄襲(973),{'High': 13},"{'Unknown': 1, '第1級': 6, '第1*級': 2, '第5級': 1, '第4*級': 1, '第3*級': 1, '第7級': 1}",1,Y,N,N,Y
抄襲有兩種，一種可能構成侵害，一種則為不構成侵害的抄襲，而就算沒有侵害的抄襲，對公司形象仍很不利，因此有心要自立更生的廠商，是不會想要去做的。,抄襲 有 兩 種 一 種 可能 構成 侵害 一 種 則 為 不 構成 侵害 的 抄襲 而 就算 沒有 侵害 的 抄襲 對 公司 形象 仍 很 不利 因此 有心 要 自立 更生 的 廠商 是 不會 想要 去 做 的,43,抄襲(973) 有(2217079) 兩(526190) 種(701563) 一(3701681) 種(701563) 可能(271025) 構成(16185) 侵害(1865) 一(3701681) 種(701563) 則(254096) 為(761341) 不(2282521) 構成(16185) 侵害(1865) 的(16029838) 抄襲(973) 而(937923) 就算(28034) 沒有(594280) 侵害(1865) 的(16029838) 抄襲(973) 對(897964) 公司(168500) 形象(20430) 仍(92056) 很(715675) 不利(8888) 因此(184606) 有心(3762) 要(851264) 自立(2454) 更生(169) 的(16029838) 廠商(8879) 是(4642407) 不會(173045) 想要(63278) 去(479993) 做(411649) 的(16029838),{'High': 43},"{'第7級': 3, '第1級': 17, 'Unknown': 7, '第5級': 8, '第6級': 4, '第4*級': 2, '第2級': 1, '第4級': 1}",0,Y,Y,N,N
宏碁的態度是，「在工業設計上，有抄襲類似的東西就不用它，宏碁公司去學習他人的長處一定要做，但在學習過程中一定要翻新而且基本上不做跟別人一樣的東西。」,宏碁 的 態度 是 在 工業 設計 上 有 抄襲 類似 的 東西 就 不 用 它 宏碁 公司 去 學習 他人 的 長處 一定 要 做 但 在 學習 過程 中 一定 要 翻新 而且 基本 上 不 做 跟 別人 一樣 的 東西,45,宏碁(857) 的(16029838) 態度(56470) 是(4642407) 在(3284238) 工業(20144) 設計(59326) 上(1233218) 有(2217079) 抄襲(973) 類似(29985) 的(16029838) 東西(139472) 就(1737544) 不(2282521) 用(377038) 它(316854) 宏碁(857) 公司(168500) 去(479993) 學習(105345) 他人(35197) 的(16029838) 長處(3446) 一定(138695) 要(851264) 做(411649) 但(597124) 在(3284238) 學習(105345) 過程(87889) 中(1011729) 一定(138695) 要(851264) 翻新(590) 而且(180402) 基本(52069) 上(1233218) 不(2282521) 做(411649) 跟(260280) 別人(108427) 一樣(188109) 的(16029838) 東西(139472),{'High': 45},"{'Unknown': 4, '第1級': 19, '第4級': 1, '第1*級': 7, '第4*級': 1, '第7級': 2, '第5級': 5, '第2級': 5, '第3級': 1}",0,Y,Y,N,Y
宏碁的智財權管理制度向來備受資訊業界稱道，施振榮針對宏碁的智財權管理制度歸納出四項重要因素：專業的法務人員、針對智財權管理制度設計的僱佣合約、積極推動員工智財權教育，和RD研發的獎勵制度。,宏碁 的 智財權 管理 制度 向來 備受 資訊 業界 稱道 施振榮 針對 宏碁 的 智財權 管理 制度 歸納出 四 項 重要 因素 專業 的 法務 人員 針對 智財權 管理 制度 設計 的 僱佣 合約 積極 推動 員工 智財權 教育 和 RD 研發 的 獎勵 制度,45,宏碁(857) 的(16029838) 智財權(64) 管理(54484) 制度(37973) 向來(7370) 備受(3188) 資訊(37848) 業界(2575) 稱道(879) 施振榮(241) 針對(23174) 宏碁(857) 的(16029838) 智財權(64) 管理(54484) 制度(37973) 歸納出(865) 四(141667) 項(88887) 重要(154863) 因素(34409) 專業(33030) 的(16029838) 法務(162) 人員(49261) 針對(23174) 智財權(64) 管理(54484) 制度(37973) 設計(59326) 的(16029838) 僱佣(3) 合約(4647) 積極(24247) 推動(14867) 員工(31766) 智財權(64) 教育(71554) 和(1338337) RD(40) 研發(7366) 的(16029838) 獎勵(5345) 制度(37973),"{'High': 39, 'Low': 6}","{'Unknown': 12, '第1級': 6, '第4*級': 8, '第4級': 7, '第5級': 5, '第6級': 4, '第7級': 1, '第2級': 1, '第3級': 1}",6,Y,Y,N,Y
施振榮表示，宏碁初期經營時即決定要有法務專業人員，對員工做智財權觀念教育。,施振榮 表示 宏碁 初期 經營 時 即 決定 要 有 法務 專業 人員 對 員工 做 智財權 觀念 教育,19,施振榮(241) 表示(74452) 宏碁(857) 初期(11598) 經營(39913) 時(623734) 即(110826) 決定(101837) 要(851264) 有(2217079) 法務(162) 專業(33030) 人員(49261) 對(897964) 員工(31766) 做(411649) 智財權(64) 觀念(39915) 教育(71554),"{'High': 18, 'Low': 1}","{'Unknown': 5, '第4*級': 1, '第5級': 2, '第3*級': 1, '第6級': 1, '第2級': 1, '第1級': 4, '第4級': 3, '第3級': 1}",2,Y,N,N,Y
其次，施振榮認為，推展智財權重要關鍵在於必須要有專門針對智財權而設計的僱用合約。,其次 施振榮 認為 推展 智財權 重要 關鍵 在於 必須 要 有 專門 針對 智財權 而 設計 的 僱用 合約,19,其次(8985) 施振榮(241) 認為(192030) 推展(2011) 智財權(64) 重要(154863) 關鍵(25952) 在於(37953) 必須(170592) 要(851264) 有(2217079) 專門(13209) 針對(23174) 智財權(64) 而(937923) 設計(59326) 的(16029838) 僱用(1364) 合約(4647),"{'High': 17, 'Low': 2}","{'第5級': 3, 'Unknown': 3, '第2級': 2, '第6級': 4, '第3級': 1, '第1級': 3, '第4*級': 3}",3,Y,Y,N,Y
宏碁從1984年起就有這樣的合約，1987年還修訂過。,宏碁 從 1984年 起 就 有 這樣 的 合約 1987年 還 修訂 過,13,宏碁(857) 從(496546) 1984年(496) 起(96746) 就(1737544) 有(2217079) 這樣(288344) 的(16029838) 合約(4647) 1987年(516) 還(625086) 修訂(2313) 過(412878),{'High': 13},"{'Unknown': 4, '第1*級': 2, '第3*級': 1, '第1級': 3, '第3級': 1, '第4*級': 1, '第6級': 1}",2,Y,N,N,Y
宏碁公司對這項合約的簽署特別重視，有意見的員工皆由其主管親自溝通，甚至施董事長亦出面，儘可能將員工關切的事項納入合約中，但是如果實在無法納入而員工又無法協調者，「宏碁公司」只好犧牲人才，以維護合理公平的工作環境，這種溝通的工作非常困難而耗時，唯有主其事者全力支持才能有效達成。,宏碁 公司 對 這 項 合約 的 簽署 特別 重視 有 意見 的 員工 皆 由 其 主管 親自 溝通 甚至 施 董事長 亦 出面 儘可能 將 員工 關切 的 事項 納入 合約 中 但是 如果 實在 無法 納入 而 員工 又 無法 協調 者 宏碁 公司 只好 犧牲 人才 以 維護 合理 公平 的 工作 環境 這 種 溝通 的 工作 非常 困難 而 耗時 唯有 主 其 事 者 全力 支持 才 能 有效 達成,77,宏碁(857) 公司(168500) 對(897964) 這(2114032) 項(88887) 合約(4647) 的(16029838) 簽署(2297) 特別(91212) 重視(23501) 有(2217079) 意見(34740) 的(16029838) 員工(31766) 皆(45736) 由(208604) 其(307905) 主管(23448) 親自(19554) 溝通(31533) 甚至(122502) 施(4287) 董事長(8106) 亦(68507) 出面(4199) 儘可能(802) 將(448374) 員工(31766) 關切(3828) 的(16029838) 事項(5635) 納入(5488) 合約(4647) 中(1011729) 但是(247988) 如果(322121) 實在(51634) 無法(150606) 納入(5488) 而(937923) 員工(31766) 又(535555) 無法(150606) 協調(8656) 者(423504) 宏碁(857) 公司(168500) 只好(29170) 犧牲(13057) 人才(17220) 以(547785) 維護(8695) 合理(15811) 公平(12539) 的(16029838) 工作(220164) 環境(71054) 這(2114032) 種(701563) 溝通(31533) 的(16029838) 工作(220164) 非常(152032) 困難(37504) 而(937923) 耗時(715) 唯有(10986) 主(7737) 其(307905) 事(385949) 者(423504) 全力(4329) 支持(42489) 才(394539) 能(582260) 有效(30667) 達成(19667),{'High': 77},"{'Unknown': 13, '第2級': 6, '第1級': 11, '第5級': 14, '第4*級': 6, '第6級': 10, '第4級': 9, '第3*級': 2, '第1*級': 4, '第3級': 2}",2,Y,Y,N,Y
在對RD人員的獎勵制度上，宏碁公司鼓勵工程師看別人的專利說明書，並撰寫心得報告，只要擷取精要成一張紙之內容後即發象徵性獎金鼓勵；對提出專利構想經審查通過者給獎金，申請獲得專利時再給獎金，如果該專利有授權給外國的情形，又會再給獎金。,在 對 RD 人員 的 獎勵 制度 上 宏碁 公司 鼓勵 工程師 看 別人 的 專利 說明書 並 撰寫 心得 報告 只要 擷取 精要 成 一 張 紙 之 內容 後 即 發 象徵性 獎金 鼓勵 對 提出 專利 構想 經 審查 通過 者 給 獎金 申請 獲得 專利 時 再 給 獎金 如果 該 專利 有 授權給 外國 的 情形 又 會 再 給 獎金,66,在(3284238) 對(897964) RD(40) 人員(49261) 的(16029838) 獎勵(5345) 制度(37973) 上(1233218) 宏碁(857) 公司(168500) 鼓勵(27004) 工程師(6469) 看(444691) 別人(108427) 的(16029838) 專利(3454) 說明書(912) 並(442790) 撰寫(7324) 心得(3837) 報告(37237) 只要(99140) 擷取(1264) 精要(196) 成(76470) 一(3701681) 張(99414) 紙(23590) 之(875481) 內容(55074) 後(422857) 即(110826) 發(22092) 象徵性(1984) 獎金(2870) 鼓勵(27004) 對(897964) 提出(63073) 專利(3454) 構想(6562) 經(38471) 審查(4808) 通過(29652) 者(423504) 給(240485) 獎金(2870) 申請(10489) 獲得(54809) 專利(3454) 時(623734) 再(326207) 給(240485) 獎金(2870) 如果(322121) 該(148369) 專利(3454) 有(2217079) 授權給(262) 外國(13057) 的(16029838) 情形(35199) 又(535555) 會(1014977) 再(326207) 給(240485) 獎金(2870),"{'High': 65, 'Low': 1}","{'第1*級': 8, '第1級': 12, 'Unknown': 10, '第5級': 10, '第4級': 7, '第2級': 3, '第4*級': 4, '第6級': 7, '第7級': 1, '第3級': 2, '第3*級': 2}",4,Y,Y,N,Y
在鼓勵申請專利時，宏碁的政策是『早期求量，後期重質』，自1991年起開始建立單位「配額」之專利制度，並由智財權專業法務與專利工程師配合撰寫專利申請書，並藉以達成法律與技術人員溝通共識，提升專利申請品質的目的。,在 鼓勵 申請 專利 時 宏碁 的 政策 是 早期 求 量 後期 重質 自 1991年 起 開始 建立 單位 配額 之 專利 制度 並 由 智財權 專業 法務 與 專利 工程師 配合 撰寫 專利 申請書 並 藉以 達成 法律 與 技術 人員 溝通 共識 提升 專利 申請 品質 的 目的,51,在(3284238) 鼓勵(27004) 申請(10489) 專利(3454) 時(623734) 宏碁(857) 的(16029838) 政策(30965) 是(4642407) 早期(20120) 求(30359) 量(9581) 後期(5048) 重質(161) 自(59676) 1991年(542) 起(96746) 開始(245562) 建立(52946) 單位(23148) 配額(489) 之(875481) 專利(3454) 制度(37973) 並(442790) 由(208604) 智財權(64) 專業(33030) 法務(162) 與(968432) 專利(3454) 工程師(6469) 配合(17173) 撰寫(7324) 專利(3454) 申請書(736) 並(442790) 藉以(2797) 達成(19667) 法律(27914) 與(968432) 技術(47691) 人員(49261) 溝通(31533) 共識(6750) 提升(17122) 專利(3454) 申請(10489) 品質(19388) 的(16029838) 目的(45226),"{'High': 50, 'Low': 1}","{'第1*級': 1, '第4級': 8, '第6級': 9, '第3*級': 4, 'Unknown': 11, '第1級': 3, '第4*級': 9, '第5級': 5, '第2級': 1}",4,Y,Y,N,Y
這樣的做法同時也使得宏碁專利數激增。,這樣 的 做法 同時 也 使得 宏碁 專利數 激增,9,這樣(288344) 的(16029838) 做法(16990) 同時(115305) 也(1590760) 使得(30960) 宏碁(857) 專利數(6) 激增(690),"{'High': 8, 'Low': 1}","{'第3級': 2, '第1級': 2, '第3*級': 1, '第5級': 1, 'Unknown': 2, '第7級': 1}",1,Y,N,N,Y
中小企業創造智財權就會受用無窮：「台灣中小企業要立定能在別人肩膀上想東西的觀念，去創造智財權，只要能研發出一個有用的專利就會受用無窮。」,中小 企業 創造 智財權 就 會 受用 無窮 台灣 中小 企業 要 立定 能 在 別人 肩膀 上 想 東西 的 觀念 去 創造 智財權 只要 能 研發出 一 個 有用 的 專利 就 會 受用 無窮,37,中小(565) 企業(65457) 創造(38327) 智財權(64) 就(1737544) 會(1014977) 受用(1173) 無窮(4794) 台灣(130718) 中小(565) 企業(65457) 要(851264) 立定(367) 能(582260) 在(3284238) 別人(108427) 肩膀(12026) 上(1233218) 想(449884) 東西(139472) 的(16029838) 觀念(39915) 去(479993) 創造(38327) 智財權(64) 只要(99140) 能(582260) 研發出(543) 一(3701681) 個(2296574) 有用(10814) 的(16029838) 專利(3454) 就(1737544) 會(1014977) 受用(1173) 無窮(4794),"{'High': 35, 'Low': 2}","{'Unknown': 6, '第4*級': 4, '第1級': 12, '第1*級': 5, '第7級': 2, '第5級': 3, '第2級': 1, '第4級': 1, '第3級': 1, '第2*級': 1, '第6級': 1}",3,Y,Y,N,N
施振榮如此真誠地提出他的忠告。,施振榮 如此 真誠 地 提出 他 的 忠告,8,施振榮(241) 如此(133083) 真誠(5864) 地(754998) 提出(63073) 他(2487930) 的(16029838) 忠告(3002),{'High': 8},"{'Unknown': 3, '第5級': 2, '第1級': 2, '第6級': 1}",1,Y,N,N,Y
他並以「宏碁」的實例來詮釋他的忠告。,他 並 以 宏碁 的 實例 來 詮釋 他 的 忠告,11,他(2487930) 並(442790) 以(547785) 宏碁(857) 的(16029838) 實例(4444) 來(742183) 詮釋(10509) 他(2487930) 的(16029838) 忠告(3002),{'High': 11},"{'第1級': 5, '第4*級': 1, '第5級': 1, 'Unknown': 1, '第6級': 3}",0,Y,Y,N,Y
宏碁公司曾使用某大廠十多個專利，但是這個大廠在其生產的產品上使用到宏碁一個關鍵專利，由於其生產量大，宏碁便可以用到對方的十多個專利與對方相抵掉而不用支付權利金。,宏碁 公司 曾 使用 某 大 廠 十多 個 專利 但是 這 個 大 廠 在 其 生產 的 產品 上 使用到 宏碁 一 個 關鍵 專利 由於 其 生產量 大 宏碁 便 可以 用到 對方 的 十多 個 專利 與 對方 相抵掉 而 不用 支付 權利金,47,宏碁(857) 公司(168500) 曾(132981) 使用(99640) 某(119862) 大(525780) 廠(4599) 十多(4849) 個(2296574) 專利(3454) 但是(247988) 這(2114032) 個(2296574) 大(525780) 廠(4599) 在(3284238) 其(307905) 生產(36079) 的(16029838) 產品(51029) 上(1233218) 使用到(486) 宏碁(857) 一(3701681) 個(2296574) 關鍵(25952) 專利(3454) 由於(88111) 其(307905) 生產量(438) 大(525780) 宏碁(857) 便(220860) 可以(560531) 用到(4359) 對方(62393) 的(16029838) 十多(4849) 個(2296574) 專利(3454) 與(968432) 對方(62393) 相抵掉(Unknown) 而(937923) 不用(23091) 支付(6156) 權利金(312),"{'High': 46, 'Low': 1}","{'Unknown': 13, '第2級': 2, '第4級': 4, '第5級': 4, '第1級': 13, '第6級': 6, '第1*級': 1, '第4*級': 3, '第3級': 1}",4,Y,Y,N,Y
現今資訊產業主管對智財權應該有一項基本認識：智財權與企業發展關係影響非常重大，由不得你不重視尊重它。,現今 資訊 產業 主管 對 智財權 應該 有 一 項 基本 認識 智財權 與 企業 發展 關係 影響 非常 重大 由不得 你 不 重視 尊重 它,26,現今(6891) 資訊(37848) 產業(29756) 主管(23448) 對(897964) 智財權(64) 應該(165478) 有(2217079) 一(3701681) 項(88887) 基本(52069) 認識(51425) 智財權(64) 與(968432) 企業(65457) 發展(117494) 關係(162883) 影響(95840) 非常(152032) 重大(19228) 由不得(216) 你(1414837) 不(2282521) 重視(23501) 尊重(18394) 它(316854),"{'High': 24, 'Low': 2}","{'第5級': 5, '第4級': 3, '第4*級': 4, '第1級': 5, 'Unknown': 3, '第1*級': 3, '第2級': 1, '第3級': 2}",3,Y,Y,N,N
「宏碁在智財方面，都面對面去解決突破各種問題，雖然辛苦，但長期而言，還是較有利的」施振榮特別表示他的作法。,宏碁 在 智財 方面 都 面對面 去 解決 突破 各 種 問題 雖然 辛苦 但 長期 而 言 還是 較 有利 的 施振榮 特別 表示 他 的 作法,28,宏碁(857) 在(3284238) 智財(19) 方面(75079) 都(1125846) 面對面(2828) 去(479993) 解決(55725) 突破(10583) 各(243023) 種(701563) 問題(280782) 雖然(152988) 辛苦(13451) 但(597124) 長期(28592) 而(937923) 言(97691) 還是(155231) 較(78424) 有利(7507) 的(16029838) 施振榮(241) 特別(91212) 表示(74452) 他(2487930) 的(16029838) 作法(9353),"{'High': 27, 'Low': 1}","{'Unknown': 7, '第1*級': 2, '第3*級': 1, '第1級': 6, '第4級': 1, '第5級': 3, '第2級': 6, '第4*級': 1, '第3級': 1}",2,Y,Y,N,Y
施振榮認為，許多外國的中小企業都有自己的智慧財產權，所有的大廠也不是一天長成，國內的中小企業不宜畫地自限，認為自己技術水準跟不上而放棄研發。,施振榮 認為 許多 外國 的 中小 企業 都 有 自己 的 智慧 財產權 所有 的 大 廠 也 不 是 一 天 長成 國內 的 中小 企業 不宜 畫地自限 認為 自己 技術 水準 跟 不 上 而 放棄 研發,39,施振榮(241) 認為(192030) 許多(159791) 外國(13057) 的(16029838) 中小(565) 企業(65457) 都(1125846) 有(2217079) 自己(744739) 的(16029838) 智慧(46294) 財產權(1092) 所有(146771) 的(16029838) 大(525780) 廠(4599) 也(1590760) 不(2282521) 是(4642407) 一(3701681) 天(330413) 長成(2026) 國內(17537) 的(16029838) 中小(565) 企業(65457) 不宜(4289) 畫地自限(109) 認為(192030) 自己(744739) 技術(47691) 水準(9940) 跟(260280) 不(2282521) 上(1233218) 而(937923) 放棄(27664) 研發(7366),{'High': 39},"{'Unknown': 7, '第2級': 3, '第3*級': 1, '第1*級': 4, '第1級': 14, '第4*級': 2, '第5級': 3, '第4級': 4, '第6級': 1}",3,Y,Y,N,Y
智財觀念不應有任何投機取巧的想法：「宏碁公司除了老公老婆不賣外，其他都賣。」,智財 觀念 不 應 有 任何 投機取巧 的 想法 宏碁 公司 除了 老公 老婆 不 賣 外 其他 都 賣,20,智財(19) 觀念(39915) 不(2282521) 應(82417) 有(2217079) 任何(131795) 投機取巧(302) 的(16029838) 想法(54022) 宏碁(857) 公司(168500) 除了(75964) 老公(5172) 老婆(10910) 不(2282521) 賣(27821) 外(109310) 其他(189445) 都(1125846) 賣(27821),"{'Low': 1, 'High': 19}","{'Unknown': 4, '第4級': 3, '第1級': 6, '第4*級': 1, '第2級': 5, '第3*級': 1}",1,Y,N,N,Y
施先生以輕鬆的口語表示。,施 先生 以 輕鬆 的 口語 表示,7,施(4287) 先生(159645) 以(547785) 輕鬆(17407) 的(16029838) 口語(2645) 表示(74452),{'High': 7},"{'Unknown': 1, '第1級': 2, '第5級': 2, '第3級': 1, '第4*級': 1}",0,Y,N,N,Y
他認為無論在台灣或宏碁發展之利基與長期性來看都是在研發，而研發必須要有經費來源，公司在商品利潤與本身專利授權上必須有不斷的收入，才會有經費投資研發，也才有機會領先其他競爭者並開發更多的智財權。,他 認為 無論 在 台灣 或 宏碁 發展 之 利基 與 長期性 來 看 都 是 在 研發 而 研發 必須 要 有 經費 來源 公司 在 商品 利潤 與 本身 專利 授權 上 必須 有 不斷 的 收入 才 會 有 經費 投資 研發 也 才 有 機會 領先 其他 競爭 者 並 開發 更多 的 智財權,58,他(2487930) 認為(192030) 無論(37021) 在(3284238) 台灣(130718) 或(478077) 宏碁(857) 發展(117494) 之(875481) 利基(554) 與(968432) 長期性(368) 來(742183) 看(444691) 都(1125846) 是(4642407) 在(3284238) 研發(7366) 而(937923) 研發(7366) 必須(170592) 要(851264) 有(2217079) 經費(7039) 來源(18177) 公司(168500) 在(3284238) 商品(19582) 利潤(8047) 與(968432) 本身(44138) 專利(3454) 授權(3802) 上(1233218) 必須(170592) 有(2217079) 不斷(68526) 的(16029838) 收入(15636) 才(394539) 會(1014977) 有(2217079) 經費(7039) 投資(38191) 研發(7366) 也(1590760) 才(394539) 有(2217079) 機會(81244) 領先(3642) 其他(189445) 競爭(30766) 者(423504) 並(442790) 開發(19196) 更多(44083) 的(16029838) 智財權(64),"{'High': 57, 'Low': 1}","{'第1級': 14, '第2級': 6, '第4級': 5, '第1*級': 4, '第3級': 3, 'Unknown': 8, '第5級': 11, '第4*級': 5, '第6級': 2}",2,Y,Y,N,Y
「台灣未來高科技的規模及空間仍大，業界一定要對智財觀念了解，不應有任何投機取巧的想法」，施先生認為宏碁公司在矽奧事件上的立場是要繼續追索，這並不是有意在打擊同業，而是期望能透過此事件教育業界了解智財權之重要並尊重宏碁的智財權。,台灣 未來 高科技 的 規模 及 空間 仍 大 業界 一定 要 對 智財 觀念 了解 不 應 有 任何 投機取巧 的 想法 施 先生 認為 宏碁 公司 在 矽奧 事件 上 的 立場 是 要 繼續 追索 這 並 不 是 有意 在 打擊 同業 而是 期望 能 透過 此 事件 教育 業界 了解 智財權 之 重要 並 尊重 宏碁 的 智財權,63,台灣(130718) 未來(54445) 高科技(3243) 的(16029838) 規模(17762) 及(304586) 空間(52519) 仍(92056) 大(525780) 業界(2575) 一定(138695) 要(851264) 對(897964) 智財(19) 觀念(39915) 了解(82970) 不(2282521) 應(82417) 有(2217079) 任何(131795) 投機取巧(302) 的(16029838) 想法(54022) 施(4287) 先生(159645) 認為(192030) 宏碁(857) 公司(168500) 在(3284238) 矽奧(6) 事件(59059) 上(1233218) 的(16029838) 立場(17198) 是(4642407) 要(851264) 繼續(80649) 追索(452) 這(2114032) 並(442790) 不(2282521) 是(4642407) 有意(7824) 在(3284238) 打擊(11256) 同業(2212) 而是(74258) 期望(13591) 能(582260) 透過(63117) 此(288458) 事件(59059) 教育(71554) 業界(2575) 了解(82970) 智財權(64) 之(875481) 重要(154863) 並(442790) 尊重(18394) 宏碁(857) 的(16029838) 智財權(64),"{'High': 59, 'Low': 4}","{'第1級': 17, '第4級': 5, 'Unknown': 12, '第4*級': 5, '第5級': 10, '第6級': 3, '第1*級': 4, '第3*級': 2, '第2級': 4, '第3級': 1}",4,Y,Y,N,Y
生意歸生意，官司歸官司：談到宏碁對訴訟的態度，施振榮說：「打官司在商業上是正常行為，公司比較健康的態度應該是將其生意往來與打官司分開處理。」,生意 歸 生意 官司 歸 官司 談到 宏碁 對 訴訟 的 態度 施振榮 說 打官司 在 商業 上 是 正常 行為 公司 比較 健康 的 態度 應該 是 將 其 生意 往來 與 打官司 分開 處理,36,生意(13520) 歸(16865) 生意(13520) 官司(1813) 歸(16865) 官司(1813) 談到(13817) 宏碁(857) 對(897964) 訴訟(3509) 的(16029838) 態度(56470) 施振榮(241) 說(1285247) 打官司(632) 在(3284238) 商業(19292) 上(1233218) 是(4642407) 正常(28865) 行為(97450) 公司(168500) 比較(112212) 健康(50041) 的(16029838) 態度(56470) 應該(165478) 是(4642407) 將(448374) 其(307905) 生意(13520) 往來(7106) 與(968432) 打官司(632) 分開(6975) 處理(61797),{'High': 36},"{'第3級': 3, '第6級': 6, 'Unknown': 6, '第1級': 7, '第4級': 3, '第1*級': 2, '第3*級': 1, '第5級': 3, '第2級': 3, '第4*級': 2}",3,Y,Y,N,Y
