sentence,sentence_preprocessed,sentence_length,word_freq,high_low_freq,word_level,long_word_count,is_complete_sentence,is_complete_context,is_blacklist,is_greylist
張昭雄在台大醫學系，晚高明見三屆，兩人曾是同寢室的室友，感情相當深厚。,張昭雄 在 台大 醫學系 晚 高明見 三 屆 兩 人 曾 是 同 寢室 的 室友 感情 相當 深厚,19,張昭雄(34) 在(3284238) 台大(3363) 醫學系(354) 晚(24931) 高明見(1) 三(313861) 屆(10220) 兩(526190) 人(1550512) 曾(132981) 是(4642407) 同(102917) 寢室(1419) 的(16029838) 室友(1170) 感情(27553) 相當(66293) 深厚(3514),"{'Low': 2, 'High': 17}","{'Unknown': 6, '第1*級': 2, '第1級': 5, '第5級': 1, '第4級': 2, '第2*級': 1, '第3級': 1, '第6級': 1}",3,Y,N,N,Y
高明見說，當年張昭雄因在台大醫院已無主治大夫的缺，所以出國留學專攻心臟血管外科，如今是望重一方的心血管外科醫師。,高明見 說 當年 張昭雄 因 在 台大 醫院 已 無 主治 大夫 的 缺 所以 出國 留學 專攻 心臟 血管 外科 如今 是 望重一方 的 心血管 外科 醫師,28,高明見(1) 說(1285247) 當年(25091) 張昭雄(34) 因(119364) 在(3284238) 台大(3363) 醫院(30938) 已(215610) 無(157858) 主治(1318) 大夫(7663) 的(16029838) 缺(9184) 所以(239080) 出國(4937) 留學(4058) 專攻(829) 心臟(9522) 血管(4584) 外科(3279) 如今(29812) 是(4642407) 望重一方(1) 的(16029838) 心血管(1114) 外科(3279) 醫師(30062),"{'Low': 3, 'High': 25}","{'Unknown': 9, '第1級': 5, '第4*級': 2, '第1*級': 2, '第2級': 1, '第3級': 2, '第5級': 5, '第4級': 1, '第7級': 1}",4,Y,Y,N,Y
回到台灣後，受王永慶延攬，出任草創的長庚醫院外科主任，一路歷經心臟外科主任、院長及長庚大學校長。,回到 台灣 後 受 王永慶 延攬 出任 草創 的 長庚 醫院 外科 主任 一路 歷經 心臟 外科 主任 院長 及 長庚 大學 校長,23,回到(60084) 台灣(130718) 後(422857) 受(109982) 王永慶(4731) 延攬(658) 出任(5389) 草創(502) 的(16029838) 長庚(2156) 醫院(30938) 外科(3279) 主任(13859) 一路(14840) 歷經(5945) 心臟(9522) 外科(3279) 主任(13859) 院長(5857) 及(304586) 長庚(2156) 大學(83893) 校長(14327),{'High': 23},"{'第2級': 2, '第1級': 4, '第4級': 4, 'Unknown': 6, '第7級': 2, '第6級': 3, '第5級': 2}",1,Y,Y,N,Y
長庚醫院從當年的兩百張床小醫院，擴充至今六千多床，張昭雄因之成為台灣醫界企業化經營的先驅者。,長庚 醫院 從 當年 的 兩百 張 床 小 醫院 擴充 至 今 六千多 床 張昭雄 因之 成為 台灣 醫界 企業化 經營 的 先驅 者,25,長庚(2156) 醫院(30938) 從(496546) 當年(25091) 的(16029838) 兩百(3908) 張(99414) 床(30029) 小(318835) 醫院(30938) 擴充(2401) 至(101530) 今(33635) 六千多(151) 床(30029) 張昭雄(34) 因之(1499) 成為(143834) 台灣(130718) 醫界(439) 企業化(240) 經營(39913) 的(16029838) 先驅(2743) 者(423504),"{'High': 24, 'Low': 1}","{'Unknown': 9, '第2級': 2, '第1*級': 4, '第4*級': 1, '第1級': 4, '第6級': 2, '第5級': 3}",3,Y,Y,N,Y
高明見強調，台塑企業的經營管理精神，也是政府一向缺乏的。,高明見 強調 台塑 企業 的 經營 管理 精神 也 是 政府 一向 缺乏 的,14,高明見(1) 強調(36095) 台塑(3456) 企業(65457) 的(16029838) 經營(39913) 管理(54484) 精神(79222) 也(1590760) 是(4642407) 政府(92663) 一向(14985) 缺乏(27750) 的(16029838),"{'Low': 1, 'High': 13}","{'Unknown': 2, '第5級': 3, '第4*級': 3, '第1級': 4, '第3*級': 1, '第4級': 1}",1,Y,N,N,Y
但過去長庚系統總予外界是民進黨票倉的印象，高明見解釋說，張昭雄過去不是支持民進黨，而是身為醫師，崇尚自由思想，應該說是「支持在野黨」。,但 過去 長庚 系統 總 予 外界 是 民進黨 票倉 的 印象 高明見 解釋 說 張昭雄 過去 不 是 支持 民進黨 而是 身為 醫師 崇尚 自由 思想 應該 說 是 支持 在野黨,32,但(597124) 過去(88758) 長庚(2156) 系統(67366) 總(46750) 予(6046) 外界(9618) 是(4642407) 民進黨(2844) 票倉(Unknown) 的(16029838) 印象(24581) 高明見(1) 解釋(59761) 說(1285247) 張昭雄(34) 過去(88758) 不(2282521) 是(4642407) 支持(42489) 民進黨(2844) 而是(74258) 身為(18072) 醫師(30062) 崇尚(1632) 自由(56360) 思想(45606) 應該(165478) 說(1285247) 是(4642407) 支持(42489) 在野黨(301),"{'High': 29, 'Low': 3}","{'第2級': 2, '第4級': 5, 'Unknown': 9, '第5級': 3, '第1級': 8, '第4*級': 1, '第6級': 2, '第3*級': 1, '第1*級': 1}",5,Y,Y,N,Y
記者陳敏鳳特稿。,記者 陳敏鳳 特稿,3,記者(23855) 陳敏鳳(2) 特稿(111),"{'High': 2, 'Low': 1}","{'第4級': 1, 'Unknown': 2}",1,N,N,N,Y
前台灣省長宋楚瑜終於挑定長庚大學校長張昭雄，這位救人無數的「良醫」，宋陣營期待他能變成「良相」佐國。,前 台灣 省長 宋楚瑜 終於 挑定 長庚 大學 校長 張昭雄 這 位 救 人 無數 的 良醫 宋 陣營 期待 他 能 變成 良相 佐 國,26,前(272709) 台灣(130718) 省長(1539) 宋楚瑜(491) 終於(59622) 挑定(10) 長庚(2156) 大學(83893) 校長(14327) 張昭雄(34) 這(2114032) 位(284809) 救(17810) 人(1550512) 無數(12002) 的(16029838) 良醫(189) 宋(13341) 陣營(3833) 期待(21616) 他(2487930) 能(582260) 變成(73009) 良相(42) 佐(2822) 國(73377),"{'High': 23, 'Low': 3}","{'第1級': 9, 'Unknown': 9, '第4級': 4, '第5級': 1, '第6級': 1, '第4*級': 1, '第1*級': 1}",2,Y,N,N,Y
張昭雄是著名的心臟外科醫師，在醫界聲譽極高，是美國外科學院院士。,張昭雄 是 著名 的 心臟 外科 醫師 在 醫界 聲譽 極 高 是 美國 外科 學院 院士,17,張昭雄(34) 是(4642407) 著名(20279) 的(16029838) 心臟(9522) 外科(3279) 醫師(30062) 在(3284238) 醫界(439) 聲譽(2172) 極(61390) 高(128858) 是(4642407) 美國(148299) 外科(3279) 學院(18658) 院士(1252),"{'Low': 1, 'High': 16}","{'Unknown': 5, '第1級': 6, '第6級': 2, '第5級': 1, '第1*級': 1, '第3*級': 1, '第4*級': 1}",1,Y,N,N,Y
可以以救人無數來形容，而宋楚瑜挑選他為輔佐副手，是希望張以救人的心情來救國、治國，這種由良醫為良相的思考格局，跳脫了既有的政治框架，沒有政治人物難以避免的政治污點及缺點，對宋陣營的選情有很大的加分作用，是一種展現廣闊視野的組合，為政治注入新意義、新觀念。,可以 以 救 人 無數 來 形容 而 宋楚瑜 挑選 他 為 輔佐 副手 是 希望 張 以 救 人 的 心情 來 救國 治國 這 種 由 良醫 為 良相 的 思考 格局 跳脫 了 既有 的 政治 框架 沒有 政治 人物 難以 避免 的 政治 污點 及 缺點 對 宋 陣營 的 選情 有 很 大 的 加分 作用 是 一 種 展現 廣闊 視野 的 組合 為 政治 注入 新 意義 新 觀念,76,可以(560531) 以(547785) 救(17810) 人(1550512) 無數(12002) 來(742183) 形容(25604) 而(937923) 宋楚瑜(491) 挑選(6979) 他(2487930) 為(761341) 輔佐(2401) 副手(667) 是(4642407) 希望(119975) 張(99414) 以(547785) 救(17810) 人(1550512) 的(16029838) 心情(33611) 來(742183) 救國(854) 治國(3088) 這(2114032) 種(701563) 由(208604) 良醫(189) 為(761341) 良相(42) 的(16029838) 思考(63031) 格局(3549) 跳脫(1430) 了(3199291) 既有(6158) 的(16029838) 政治(79504) 框架(3645) 沒有(594280) 政治(79504) 人物(52614) 難以(30294) 避免(33211) 的(16029838) 政治(79504) 污點(423) 及(304586) 缺點(8892) 對(897964) 宋(13341) 陣營(3833) 的(16029838) 選情(221) 有(2217079) 很(715675) 大(525780) 的(16029838) 加分(673) 作用(37837) 是(4642407) 一(3701681) 種(701563) 展現(15289) 廣闊(2842) 視野(7815) 的(16029838) 組合(14334) 為(761341) 政治(79504) 注入(3771) 新(212453) 意義(71714) 新(212453) 觀念(39915),"{'High': 75, 'Low': 1}","{'第1級': 24, '第5級': 11, '第4級': 7, '第4*級': 6, 'Unknown': 16, '第6級': 9, '第2級': 1, '第1*級': 1, '第3*級': 1}",1,Y,Y,N,Y
而張昭雄濃厚的「台灣本土」形象，可以為宋楚瑜未來可能遭受的「賣台」等攻擊有防疫的功能。,而 張昭雄 濃厚 的 台灣 本土 形象 可以 為 宋楚瑜 未來 可能 遭受 的 賣 台 等 攻擊 有 防疫 的 功能,22,而(937923) 張昭雄(34) 濃厚(3668) 的(16029838) 台灣(130718) 本土(8025) 形象(20430) 可以(560531) 為(761341) 宋楚瑜(491) 未來(54445) 可能(271025) 遭受(7323) 的(16029838) 賣(27821) 台(29325) 等(327380) 攻擊(31061) 有(2217079) 防疫(271) 的(16029838) 功能(38600),"{'High': 21, 'Low': 1}","{'第5級': 5, 'Unknown': 4, '第6級': 1, '第1級': 7, '第4級': 2, '第2級': 2, '第3*級': 1}",2,Y,Y,N,Y
同時，張昭雄也可以對傳統的知識分子有一定的吸引力，對中南部的票源也有鞏固的作用，對民進黨的票源有一定的影響。,同時 張昭雄 也 可以 對 傳統 的 知識分子 有 一定 的 吸引力 對 中南部 的 票源 也 有 鞏固 的 作用 對 民進黨 的 票源 有 一定 的 影響,29,同時(115305) 張昭雄(34) 也(1590760) 可以(560531) 對(897964) 傳統(60517) 的(16029838) 知識分子(5489) 有(2217079) 一定(138695) 的(16029838) 吸引力(5086) 對(897964) 中南部(539) 的(16029838) 票源(75) 也(1590760) 有(2217079) 鞏固(4060) 的(16029838) 作用(37837) 對(897964) 民進黨(2844) 的(16029838) 票源(75) 有(2217079) 一定(138695) 的(16029838) 影響(95840),"{'High': 26, 'Low': 3}","{'第3*級': 1, 'Unknown': 7, '第1級': 15, '第3級': 2, '第1*級': 2, '第6級': 1, '第5級': 1}",5,Y,N,N,Y
張昭雄的明顯缺點是知名度不及其他的政治人物，不過，張昭雄個性溫和，同時在擅長管理、企業經營的台塑集團下的長庚醫院工作，為宋陣營帶來企業經營管理國家的形象，符合副元首的形象，有利選戰上的宣傳。,張昭雄 的 明顯 缺點 是 知名度 不及 其他 的 政治 人物 不過 張昭雄 個性 溫和 同時 在 擅長 管理 企業 經營 的 台塑 集團 下 的 長庚 醫院 工作 為 宋 陣營 帶來 企業 經營 管理 國家 的 形象 符合 副 元首 的 形象 有利 選戰 上 的 宣傳,49,張昭雄(34) 的(16029838) 明顯(35623) 缺點(8892) 是(4642407) 知名度(2300) 不及(5271) 其他(189445) 的(16029838) 政治(79504) 人物(52614) 不過(186226) 張昭雄(34) 個性(18904) 溫和(7924) 同時(115305) 在(3284238) 擅長(7376) 管理(54484) 企業(65457) 經營(39913) 的(16029838) 台塑(3456) 集團(20609) 下(329549) 的(16029838) 長庚(2156) 醫院(30938) 工作(220164) 為(761341) 宋(13341) 陣營(3833) 帶來(40305) 企業(65457) 經營(39913) 管理(54484) 國家(109166) 的(16029838) 形象(20430) 符合(19232) 副(21458) 元首(1116) 的(16029838) 形象(20430) 有利(7507) 選戰(656) 上(1233218) 的(16029838) 宣傳(11837),"{'Low': 2, 'High': 47}","{'Unknown': 9, '第1級': 10, '第5級': 11, '第4*級': 5, '第6級': 4, '第2級': 3, '第4級': 2, '第3*級': 2, '第1*級': 3}",3,Y,Y,N,Y
而且張昭雄也徵詢過王永慶的意見，台塑集團的資源勢必有所幫助。,而且 張昭雄 也 徵詢 過 王永慶 的 意見 台塑 集團 的 資源 勢必 有所 幫助,15,而且(180402) 張昭雄(34) 也(1590760) 徵詢(1099) 過(412878) 王永慶(4731) 的(16029838) 意見(34740) 台塑(3456) 集團(20609) 的(16029838) 資源(27580) 勢必(5212) 有所(14564) 幫助(62744),"{'High': 14, 'Low': 1}","{'第3級': 1, 'Unknown': 3, '第1級': 3, '第6級': 3, '第1*級': 1, '第3*級': 1, '第5級': 1, '第4級': 1, '第2級': 1}",2,Y,Y,N,Y
台塑集團的資源勢必有所幫助。,台塑 集團 的 資源 勢必 有所 幫助,7,台塑(3456) 集團(20609) 的(16029838) 資源(27580) 勢必(5212) 有所(14564) 幫助(62744),{'High': 7},"{'Unknown': 1, '第5級': 1, '第1級': 1, '第4級': 1, '第6級': 2, '第2級': 1}",0,Y,N,N,N
最新一期美國「人物」(People)雜誌選出四十四歲的港星周潤發為一九九九年「最性感的動作片演員」，剛滿五十歲的美國著名電影演員李察吉爾為一九九九年「最性感的在世男子」。,最 新 一 期 美國 人物 People 雜誌 選出 四十四 歲 的 港星 周潤發 為 一九九九年 最 性感 的 動作片 演員 剛 滿 五十 歲 的 美國 著名 電影 演員 李察吉爾 為 一九九九年 最 性感 的 在世 男子,38,最(421680) 新(212453) 一(3701681) 期(14058) 美國(148299) 人物(52614) People(1399) 雜誌(22563) 選出(3069) 四十四(926) 歲(130085) 的(16029838) 港星(57) 周潤發(147) 為(761341) 一九九九年(2370) 最(421680) 性感(2065) 的(16029838) 動作片(300) 演員(18584) 剛(55049) 滿(46727) 五十(17500) 歲(130085) 的(16029838) 美國(148299) 著名(20279) 電影(115295) 演員(18584) 李察吉爾(Unknown) 為(761341) 一九九九年(2370) 最(421680) 性感(2065) 的(16029838) 在世(2562) 男子(17448),"{'High': 36, 'Low': 2}","{'第1*級': 4, '第1級': 10, 'Unknown': 14, '第3*級': 1, '第5級': 2, '第4級': 2, '第2級': 1, '第3級': 1, '第6級': 2, '第4*級': 1}",7,Y,N,N,Y
「人物」週刊刊出一張佔三分之一頁篇幅，以綠葉為背景，周潤發靜坐沈思的彩色照片。,人物 週刊 刊出 一 張 佔 三分之一 頁 篇幅 以 綠葉 為 背景 周潤發 靜坐 沈思 的 彩色 照片,19,人物(52614) 週刊(2477) 刊出(1341) 一(3701681) 張(99414) 佔(11252) 三分之一(3691) 頁(48734) 篇幅(3208) 以(547785) 綠葉(1) 為(761341) 背景(23264) 周潤發(147) 靜坐(3614) 沈思(615) 的(16029838) 彩色(5038) 照片(25355),"{'High': 18, 'Low': 1}","{'Unknown': 7, '第5級': 4, '第1級': 2, '第1*級': 1, '第4級': 1, '第6級': 2, '第4*級': 1, '第2級': 1}",2,Y,N,N,Y
照片中的周潤發為了主演名導演李安執導的新片「臥虎藏龍」，剃了個大光頭。,照片 中 的 周潤發 為了 主演 名 導演 李安 執導 的 新片 臥虎藏龍 剃 了 個 大 光頭,18,照片(25355) 中(1011729) 的(16029838) 周潤發(147) 為了(Unknown) 主演(1865) 名(136287) 導演(24296) 李安(640) 執導(1223) 的(16029838) 新片(376) 臥虎藏龍(114) 剃(927) 了(3199291) 個(2296574) 大(525780) 光頭(977),"{'High': 17, 'Low': 1}","{'第2級': 2, 'Unknown': 8, '第1級': 4, '第5級': 1, '第4級': 1, '第7級': 2}",2,Y,N,N,Y
身高五呎十一吋的周潤發最近兩年開始在美國影壇走紅，在華人演員中名氣僅次於成龍。,身高 五 呎 十一 吋 的 周潤發 最近 兩 年 開始 在 美國 影壇 走紅 在 華人 演員 中 名氣 僅 次於 成龍,23,身高(3815) 五(112649) 呎(5295) 十一(9141) 吋(3441) 的(16029838) 周潤發(147) 最近(30174) 兩(526190) 年(514736) 開始(245562) 在(3284238) 美國(148299) 影壇(656) 走紅(394) 在(3284238) 華人(9768) 演員(18584) 中(1011729) 名氣(2438) 僅(30739) 次於(1742) 成龍(649),{'High': 23},"{'第3*級': 1, '第1級': 5, 'Unknown': 7, '第5級': 3, '第2級': 2, '第1*級': 2, '第4級': 1, '第6級': 2}",1,Y,N,N,Y
去年在美國市場推出的驚悚電影「替身殺手」為他樹立了「天良未泯」的殺手形象。,去年 在 美國 市場 推出 的 驚悚 電影 替身 殺手 為 他 樹立 了 天良 未 泯 的 殺手 形象,20,去年(9462) 在(3284238) 美國(148299) 市場(65023) 推出(10009) 的(16029838) 驚悚(1009) 電影(115295) 替身(737) 殺手(3410) 為(761341) 他(2487930) 樹立(2632) 了(3199291) 天良(315) 未(101927) 泯(127) 的(16029838) 殺手(3410) 形象(20430),{'High': 20},"{'第1級': 5, '第1*級': 2, '第2級': 1, '第5級': 3, 'Unknown': 6, '第6級': 3}",0,Y,N,N,N
在預定下個月上映的新片「安娜與國王」中，周潤發與奧斯卡影后茱蒂福斯特有精彩的對手戲。,在 預定 下 個 月 上映 的 新片 安娜 與 國王 中 周潤發 與 奧斯卡 影后 茱蒂福斯特 有 精彩 的 對手戲,21,在(3284238) 預定(3218) 下(329549) 個(2296574) 月(148997) 上映(1617) 的(16029838) 新片(376) 安娜(9658) 與(968432) 國王(27180) 中(1011729) 周潤發(147) 與(968432) 奧斯卡(3876) 影后(76) 茱蒂福斯特(Unknown) 有(2217079) 精彩(5163) 的(16029838) 對手戲(Unknown),"{'High': 18, 'Low': 3}","{'第1*級': 2, '第5級': 3, '第1級': 5, '第6級': 1, 'Unknown': 8, '第4*級': 2}",4,Y,Y,N,Y
妻子陳薈蓮接受「人物」訪問時透露，四年前周潤發在馬來西亞拍戲，有一次在機場，一群婦女蜂擁而上，搶著和他親吻，被他認為是一件「十分頭痛」的事。,妻子 陳薈蓮 接受 人物 訪問 時 透露 四 年 前 周潤發 在 馬來西亞 拍戲 有 一 次 在 機場 一 群 婦女 蜂擁而上 搶 著 和 他 親吻 被 他 認為 是 一 件 十分 頭痛 的 事,38,妻子(33898) 陳薈蓮(Unknown) 接受(84729) 人物(52614) 訪問(12881) 時(623734) 透露(7366) 四(141667) 年(514736) 前(272709) 周潤發(147) 在(3284238) 馬來西亞(2504) 拍戲(331) 有(2217079) 一(3701681) 次(331701) 在(3284238) 機場(7570) 一(3701681) 群(39283) 婦女(17834) 蜂擁而上(131) 搶(9120) 著(1004687) 和(1338337) 他(2487930) 親吻(3059) 被(540683) 他(2487930) 認為(192030) 是(4642407) 一(3701681) 件(139257) 十分(63196) 頭痛(5517) 的(16029838) 事(385949),"{'High': 37, 'Low': 1}","{'第4*級': 1, 'Unknown': 7, '第4級': 6, '第3*級': 1, '第5級': 2, '第1級': 11, '第1*級': 4, '第2級': 3, '第2*級': 1, '第6級': 1, '第3級': 1}",4,Y,N,N,Y
外貌英俊的周潤發有時不得已在電影中「犧牲色相」，但私底下他從不和女性打情罵俏。,外貌 英俊 的 周潤發 有時 不得已 在 電影 中 犧牲 色相 但 私底下 他 從不 和 女性 打情罵俏,18,外貌(2407) 英俊(2816) 的(16029838) 周潤發(147) 有時(47894) 不得已(3270) 在(3284238) 電影(115295) 中(1011729) 犧牲(13057) 色相(515) 但(597124) 私底下(1369) 他(2487930) 從不(10516) 和(1338337) 女性(59364) 打情罵俏(37),"{'High': 17, 'Low': 1}","{'第5級': 4, '第1級': 2, 'Unknown': 6, '第1*級': 3, '第6級': 1, '第2級': 1, '第4級': 1}",4,Y,Y,N,Y
拍片之餘，他喜歡與妻子待在九龍家中蒔花弄草，燒幾道好菜。,拍片 之餘 他 喜歡 與 妻子 待在 九龍 家 中 蒔花弄草 燒 幾 道 好 菜,16,拍片(3420) 之餘(5340) 他(2487930) 喜歡(113753) 與(968432) 妻子(33898) 待在(9413) 九龍(1287) 家(236822) 中(1011729) 蒔花弄草(8) 燒(13780) 幾(229415) 道(141723) 好(448428) 菜(17883),"{'High': 15, 'Low': 1}","{'Unknown': 7, '第5級': 1, '第1級': 4, '第4*級': 2, '第4級': 1, '第1*級': 1}",1,Y,N,N,N
對被選為性感偶像，周潤發感到大惑不解，他說，「也許人們現在覺得正派謙遜就是性感吧」。,對 被 選為 性感 偶像 周潤發 感到 大惑不解 他 說 也許 人們 現在 覺得 正派 謙遜 就 是 性感 吧,20,對(897964) 被(540683) 選為(1150) 性感(2065) 偶像(3833) 周潤發(147) 感到(74094) 大惑不解(493) 他(2487930) 說(1285247) 也許(68286) 人們(77778) 現在(218744) 覺得(183034) 正派(1278) 謙遜(1306) 就(1737544) 是(4642407) 性感(2065) 吧(184477),{'High': 20},"{'第1級': 7, '第2級': 1, 'Unknown': 2, '第5級': 3, '第4級': 1, '第7級': 3, '第3*級': 1, '第4*級': 1, '第1*級': 1}",2,Y,N,N,Y
「也許人們現在覺得正派謙遜就是性感吧」。,也許 人們 現在 覺得 正派 謙遜 就是 性感 吧,9,也許(68286) 人們(77778) 現在(218744) 覺得(183034) 正派(1278) 謙遜(1306) 就是(2943) 性感(2065) 吧(184477),{'High': 9},"{'第3*級': 1, '第4*級': 1, '第1級': 2, '第1*級': 1, '第7級': 2, 'Unknown': 1, '第5級': 1}",0,Y,Y,N,N
國民教育版的「中國傳統文化基本教材」中，有一則令人印象深刻的「君王不知民間疾苦」的故事，那就是晉惠帝著名的昭告：「何不食肉麋？」,國民教育版 的 中國 傳統 文化 基本 教材 中 有 一 則 令 人 印象 深刻 的 君王 不 知 民間 疾苦 的 故事 那 就是 晉惠帝 著名 的 昭告 何不 食 肉麋,32,國民教育版(Unknown) 的(16029838) 中國(214840) 傳統(60517) 文化(115697) 基本(52069) 教材(4132) 中(1011729) 有(2217079) 一(3701681) 則(254096) 令(128742) 人(1550512) 印象(24581) 深刻(16783) 的(16029838) 君王(5778) 不(2282521) 知(108500) 民間(16236) 疾苦(646) 的(16029838) 故事(101316) 那(754138) 就是(2943) 晉惠帝(24) 著名(20279) 的(16029838) 昭告(434) 何不(3221) 食(13009) 肉麋(Unknown),"{'Low': 3, 'High': 29}","{'Unknown': 10, '第1級': 10, '第3級': 1, '第2級': 2, '第5級': 4, '第4*級': 3, '第7級': 1, '第6級': 1}",2,Y,Y,N,Y
話說有一日晉惠帝聽到臣子報告由於米糧缺乏，人民已有食不飽之虞，他隨即脫口而出：那麼叫人民改吃肉吧！」,話說 有 一 日 晉惠帝 聽到 臣子 報告 由於 米糧 缺乏 人民 已 有 食 不 飽 之 虞 他 隨即 脫口而出 那麼 叫 人民 改吃 肉 吧,28,話說(1138) 有(2217079) 一(3701681) 日(94041) 晉惠帝(24) 聽到(61809) 臣子(1969) 報告(37237) 由於(88111) 米糧(464) 缺乏(27750) 人民(36441) 已(215610) 有(2217079) 食(13009) 不(2282521) 飽(4154) 之(875481) 虞(1427) 他(2487930) 隨即(10199) 脫口而出(1640) 那麼(127785) 叫(111645) 人民(36441) 改吃(183) 肉(21294) 吧(184477),"{'High': 27, 'Low': 1}","{'Unknown': 6, '第1級': 8, '第2級': 2, '第7級': 1, '第3級': 2, '第4*級': 3, '第5級': 2, '第1*級': 2, '第6級': 2}",2,Y,Y,N,Y
近來，種種網路政策與科技發展的論述也有反映酷似的思維。,近來 種種 網路 政策 與 科技 發展 的 論述 也 有 反映 酷似 的 思維,15,近來(3822) 種種(20469) 網路(26656) 政策(30965) 與(968432) 科技(30630) 發展(117494) 的(16029838) 論述(13009) 也(1590760) 有(2217079) 反映(14525) 酷似(777) 的(16029838) 思維(14435),{'High': 15},"{'第5級': 2, 'Unknown': 1, '第2級': 1, '第4*級': 2, '第4級': 2, '第1級': 4, '第6級': 2, '第7級': 1}",0,Y,Y,N,N
報上專欄提到，美國網際網路普及政策中有一則說法，提議無法上網的貧窮家庭，賣掉電視以採購網路電腦，反而可以一舉雙得擁有最先進的傳播科技與娛樂資訊；另外一則間接反映如此思維的新聞，就是近來行政院國家資訊通信基礎建設小組的「三年三百萬人上網」的後續政策：有鑑於目前公眾電話交換網路的擁塞，造成撥接上網傳輸速度緩慢，因此研議以分封上網方式讓民眾享有寬頻上網的便利。,報 上 專欄 提到 美國 網際網路 普及 政策 中 有 一 則 說法 提議 無法 上網 的 貧窮 家庭 賣掉 電視 以 採購 網路 電腦 反而 可以 一舉雙得 擁有 最 先進 的 傳播 科技 與 娛樂 資訊 另外 一 則 間接 反映 如此 思維 的 新聞 就是 近來 行政院 國家 資訊 通信 基礎 建設 小組 的 三 年 三百萬 人 上網 的 後續 政策 有鑑於 目前 公眾 電話 交換 網路 的 擁塞 造成 撥接 上網 傳輸 速度 緩慢 因此 研議 以 分封 上網 方式 讓 民眾 享有 寬頻 上網 的 便利,91,報(19250) 上(1233218) 專欄(3200) 提到(32306) 美國(148299) 網際網路(Unknown) 普及(3495) 政策(30965) 中(1011729) 有(2217079) 一(3701681) 則(254096) 說法(32457) 提議(7017) 無法(150606) 上網(3387) 的(16029838) 貧窮(6510) 家庭(60608) 賣掉(3436) 電視(41289) 以(547785) 採購(3679) 網路(26656) 電腦(38528) 反而(39627) 可以(560531) 一舉雙得(Unknown) 擁有(55809) 最(421680) 先進(6427) 的(16029838) 傳播(18106) 科技(30630) 與(968432) 娛樂(8783) 資訊(37848) 另外(48233) 一(3701681) 則(254096) 間接(5005) 反映(14525) 如此(133083) 思維(14435) 的(16029838) 新聞(40430) 就是(2943) 近來(3822) 行政院(4347) 國家(109166) 資訊(37848) 通信(2238) 基礎(39682) 建設(11627) 小組(12825) 的(16029838) 三(313861) 年(514736) 三百萬(983) 人(1550512) 上網(3387) 的(16029838) 後續(3723) 政策(30965) 有鑑於(425) 目前(48695) 公眾(6827) 電話(38698) 交換(11543) 網路(26656) 的(16029838) 擁塞(97) 造成(63141) 撥接(84) 上網(3387) 傳輸(1273) 速度(26646) 緩慢(7289) 因此(184606) 研議(180) 以(547785) 分封(739) 上網(3387) 方式(133407) 讓(526314) 民眾(17097) 享有(5799) 寬頻(271) 上網(3387) 的(16029838) 便利(3921),"{'High': 87, 'Low': 4}","{'Unknown': 13, '第1級': 17, '第6級': 7, '第4級': 8, '第4*級': 8, '第5級': 20, '第2*級': 5, '第2級': 4, '第1*級': 4, '第3級': 2, '第7級': 2, '第3*級': 1}",5,Y,Y,N,N
進一步來說，其實政策的焦點在於解決圖像與聲音傳輸的障礙。,進一步 來 說 其實 政策 的 焦點 在於 解決 圖像 與 聲音 傳輸 的 障礙,15,進一步(25130) 來(742183) 說(1285247) 其實(109290) 政策(30965) 的(16029838) 焦點(10000) 在於(37953) 解決(55725) 圖像(6658) 與(968432) 聲音(85694) 傳輸(1273) 的(16029838) 障礙(17905),{'High': 15},"{'第4*級': 3, '第1級': 4, '第3*級': 1, '第5級': 3, '第6級': 1, '第4級': 1, '第2級': 1, '第7級': 1}",1,Y,Y,N,N
