sentence,sentence_preprocessed,sentence_length,word_freq,high_low_freq,word_level,long_word_count,is_complete_sentence,is_complete_context,is_blacklist,is_greylist
最近網路謠言又增一起，一個看似專業人士所寫的文章，繪聲繪影的將浴室裡的濕毛巾列為扁平疣和息肉的罪魁禍首！,最近 網路 謠言 又 增 一 起 一 個 看似 專業 人士 所 寫 的 文章 繪聲繪影 的 將 浴室 裡 的 濕 毛巾 列為 扁平疣 和 息肉 的 罪魁禍首,30,最近(30174) 網路(26656) 謠言(3544) 又(535555) 增(4086) 一(3701681) 起(96746) 一(3701681) 個(2296574) 看似(8698) 專業(33030) 人士(27666) 所(527327) 寫(113933) 的(16029838) 文章(36137) 繪聲繪影(179) 的(16029838) 將(448374) 浴室(4500) 裡(520435) 的(16029838) 濕(4072) 毛巾(2989) 列為(3260) 扁平疣(7) 和(1338337) 息肉(10) 的(16029838) 罪魁禍首(712),"{'High': 28, 'Low': 2}","{'第2級': 3, '第6級': 1, '第1*級': 2, '第4級': 3, '第1級': 8, '第3*級': 1, 'Unknown': 6, '第5級': 2, '第3級': 3, '第7級': 1}",3,Y,Y,N,N
身為一個第一線的皮膚科醫師，面對這樣的網路謠言，不知增加了多少看診時的困擾，因為這種似是而非的言論如果沒有官方出面澄清，往往容易三人成虎造成患者深信不疑，結果反而是醫師正確的理論無人相信，百口莫辯。,身為 一 個 第一線 的 皮膚科 醫師 面對 這樣 的 網路 謠言 不 知 增加 了 多少 看診 時 的 困擾 因為 這 種 似是而非 的 言論 如果 沒有 官方 出面 澄清 往往 容易 三 人 成 虎 造成 患者 深信不疑 結果 反而 是 醫師 正確 的 理論 無 人 相信 百口莫辯,52,身為(18072) 一(3701681) 個(2296574) 第一線(1125) 的(16029838) 皮膚科(232) 醫師(30062) 面對(62914) 這樣(288344) 的(16029838) 網路(26656) 謠言(3544) 不(2282521) 知(108500) 增加(48296) 了(3199291) 多少(50265) 看診(1197) 時(623734) 的(16029838) 困擾(11106) 因為(425061) 這(2114032) 種(701563) 似是而非(654) 的(16029838) 言論(6961) 如果(322121) 沒有(594280) 官方(9319) 出面(4199) 澄清(2964) 往往(41388) 容易(80831) 三(313861) 人(1550512) 成(76470) 虎(17126) 造成(63141) 患者(20147) 深信不疑(908) 結果(114008) 反而(39627) 是(4642407) 醫師(30062) 正確(36593) 的(16029838) 理論(62242) 無(157858) 人(1550512) 相信(82200) 百口莫辯(97),"{'High': 51, 'Low': 1}","{'第6級': 5, '第1級': 18, 'Unknown': 6, '第4*級': 4, '第3級': 1, '第2級': 3, '第4級': 3, '第5級': 7, '第3*級': 2, '第1*級': 1, '第7級': 2}",5,Y,Y,N,N
事實到底是如何呢？,事實 到底 是 如何 呢,5,事實(84995) 到底(41946) 是(4642407) 如何(148068) 呢(204566),{'High': 5},"{'第4級': 1, '第4*級': 1, '第1級': 2, '第5級': 1}",0,Y,N,N,N
首先，濕毛巾容易造成黴菌孳生當然是沒有錯，但是問題是黴菌入侵皮膚產生的應該是黴菌感染，也就是所謂的體癬，而典型的體癬卻應該是一塊塊環型的紅斑，邊緣會稍稍隆起跟脫屑，卻不會形成一個個突起的小疙瘩！,首先 濕 毛巾 容易 造成 黴菌 孳生 當然 是 沒有 錯 但是 問題 是 黴菌 入侵 皮膚 產生 的 應該 是 黴菌 感染 也 就是 所謂 的 體癬 而 典型 的 體癬 卻 應該 是 一塊塊 環型 的 紅斑 邊緣 會 稍稍 隆起 跟 脫屑 卻 不會 形成 一個個 突起 的 小 疙瘩,53,首先(31260) 濕(4072) 毛巾(2989) 容易(80831) 造成(63141) 黴菌(812) 孳生(174) 當然(113971) 是(4642407) 沒有(594280) 錯(46341) 但是(247988) 問題(280782) 是(4642407) 黴菌(812) 入侵(5537) 皮膚(13766) 產生(82753) 的(16029838) 應該(165478) 是(4642407) 黴菌(812) 感染(10164) 也(1590760) 就是(2943) 所謂(59460) 的(16029838) 體癬(9) 而(937923) 典型(13843) 的(16029838) 體癬(9) 卻(333007) 應該(165478) 是(4642407) 一塊塊(741) 環型(22) 的(16029838) 紅斑(233) 邊緣(10706) 會(1014977) 稍稍(3365) 隆起(1139) 跟(260280) 脫屑(23) 卻(333007) 不會(173045) 形成(47486) 一個個(6479) 突起(999) 的(16029838) 小(318835) 疙瘩(514),"{'High': 49, 'Low': 4}","{'第4級': 4, '第3級': 2, '第1級': 14, '第4*級': 3, 'Unknown': 16, '第2級': 2, '第1*級': 5, '第6級': 3, '第5級': 3, '第7級': 1}",2,Y,Y,N,N
相反的，扁平疣形成的真正成因卻是因為皮膚遭受病毒感染！,相反 的 扁平疣 形成 的 真正 成因 卻 是 因為 皮膚 遭受 病毒 感染,14,相反(18945) 的(16029838) 扁平疣(7) 形成(47486) 的(16029838) 真正(77318) 成因(1653) 卻(333007) 是(4642407) 因為(425061) 皮膚(13766) 遭受(7323) 病毒(8421) 感染(10164),"{'High': 13, 'Low': 1}","{'第4級': 4, '第1級': 3, 'Unknown': 1, '第6級': 2, '第1*級': 1, '第5級': 3}",1,Y,Y,N,N
目前皮膚醫學確知，扁平疣是因為皮膚遭受到人類乳凸狀病毒第3或第10型的感染，會得到此疾病的基本要件是必須要親密接觸到患有此病的患者，假如真的從毛巾被傳染，那也得要患有扁平疣的人剛用過的毛巾您馬上接著用才會有機會，跟毛巾濕不濕根本無關！,目前 皮膚 醫學 確知 扁平疣 是 因為 皮膚 遭受到 人類 乳凸狀 病毒 第3 或 第10型 的 感染 會 得到 此 疾病 的 基本 要件 是 必須 要 親密 接觸到 患有 此 病 的 患者 假如 真的 從 毛巾 被 傳染 那 也 得 要 患有 扁平疣 的 人 剛 用 過 的 毛巾 您 馬上 接著 用 才 會 有 機會 跟 毛巾 濕 不 濕 根本 無關,68,目前(48695) 皮膚(13766) 醫學(17096) 確知(1094) 扁平疣(7) 是(4642407) 因為(425061) 皮膚(13766) 遭受到(730) 人類(78855) 乳凸狀(Unknown) 病毒(8421) 第3(Unknown) 或(478077) 第10型(Unknown) 的(16029838) 感染(10164) 會(1014977) 得到(84614) 此(288458) 疾病(25287) 的(16029838) 基本(52069) 要件(1459) 是(4642407) 必須(170592) 要(851264) 親密(10564) 接觸到(3777) 患有(2615) 此(288458) 病(29495) 的(16029838) 患者(20147) 假如(27690) 真的(88001) 從(496546) 毛巾(2989) 被(540683) 傳染(1998) 那(754138) 也(1590760) 得(573721) 要(851264) 患有(2615) 扁平疣(7) 的(16029838) 人(1550512) 剛(55049) 用(377038) 過(412878) 的(16029838) 毛巾(2989) 您(78094) 馬上(39402) 接著(57062) 用(377038) 才(394539) 會(1014977) 有(2217079) 機會(81244) 跟(260280) 毛巾(2989) 濕(4072) 不(2282521) 濕(4072) 根本(66330) 無關(8568),"{'High': 63, 'Low': 5}","{'第4級': 3, '第4*級': 5, 'Unknown': 9, '第1級': 17, '第1*級': 9, '第5級': 9, '第3級': 7, '第3*級': 2, '第7級': 1, '第6級': 2, '第2級': 4}",6,Y,Y,N,N
而我們一般俗稱的息肉，正確的醫學名詞應該叫做皮膚贅瘤，好發在脖子。,而 我們 一般 俗稱 的 息肉 正確 的 醫學 名詞 應該 叫做 皮膚 贅瘤 好 發 在 脖子,18,而(937923) 我們(979260) 一般(80732) 俗稱(3316) 的(16029838) 息肉(10) 正確(36593) 的(16029838) 醫學(17096) 名詞(9820) 應該(165478) 叫做(19437) 皮膚(13766) 贅瘤(14) 好(448428) 發(22092) 在(3284238) 脖子(10271),"{'High': 16, 'Low': 2}","{'第5級': 1, '第1級': 3, '第3*級': 2, '第6級': 1, 'Unknown': 3, '第4級': 4, '第4*級': 2, '第1*級': 2}",0,Y,Y,N,N
一開始它可能只是直徑約12厘米的小突起，但是漸漸地它會稍稍長大。,一 開始 它 可能 只 是 直徑 約 1 2 厘米 的 小 突起 但是 漸漸 地 它 會 稍稍 長大,21,一(3701681) 開始(245562) 它(316854) 可能(271025) 只(436725) 是(4642407) 直徑(2803) 約(47731) 1(79772) 2(66480) 厘米(185) 的(16029838) 小(318835) 突起(999) 但是(247988) 漸漸(20748) 地(754998) 它(316854) 會(1014977) 稍稍(3365) 長大(20410),{'High': 21},"{'第1級': 5, '第2級': 2, '第1*級': 4, '第6級': 1, '第3*級': 1, 'Unknown': 6, '第4*級': 1, '第3級': 1}",0,Y,Y,N,N
得皮膚贅瘤的人，通常都會無法接受會繼續慢慢長出皮膚贅瘤的現實，而在門診中質問這個疾病的病因，希望可以藉此知道預防的方法！,得 皮膚 贅瘤 的 人 通常 都 會 無法 接受 會 繼續 慢慢 長出 皮膚 贅瘤 的 現實 而 在 門診 中 質問 這 個 疾病 的 病因 希望 可以 藉 此 知道 預防 的 方法,36,得(573721) 皮膚(13766) 贅瘤(14) 的(16029838) 人(1550512) 通常(56445) 都(1125846) 會(1014977) 無法(150606) 接受(84729) 會(1014977) 繼續(80649) 慢慢(36056) 長出(3226) 皮膚(13766) 贅瘤(14) 的(16029838) 現實(34782) 而(937923) 在(3284238) 門診(2168) 中(1011729) 質問(2913) 這(2114032) 個(2296574) 疾病(25287) 的(16029838) 病因(1309) 希望(119975) 可以(560531) 藉(14277) 此(288458) 知道(343214) 預防(8608) 的(16029838) 方法(99064),"{'High': 34, 'Low': 2}","{'Unknown': 6, '第4級': 5, '第1級': 10, '第1*級': 3, '第5級': 6, '第4*級': 1, '第6級': 3, '第2級': 2}",0,Y,Y,N,N
但是很可惜的，目前皮膚贅瘤的確切成因，仍然是個謎。,但是 很 可惜 的 目前 皮膚 贅瘤 的 確切 成因 仍然 是 個 謎,14,但是(247988) 很(715675) 可惜(16141) 的(16029838) 目前(48695) 皮膚(13766) 贅瘤(14) 的(16029838) 確切(4747) 成因(1653) 仍然(46200) 是(4642407) 個(2296574) 謎(4807),"{'High': 13, 'Low': 1}","{'第2級': 1, '第1級': 5, '第3*級': 1, '第4級': 3, 'Unknown': 1, '第6級': 2, '第5級': 1}",0,Y,Y,N,N
儘管皮膚科醫師提出很多的理論，還是無法了解為何會莫名地產生纖維組織的增生，造成肉眼看到的一顆顆膚色小腫瘤。,儘管 皮膚科 醫師 提出 很多 的 理論 還是 無法 了解 為何 會 莫名 地 產生 纖維 組織 的 增生 造成 肉眼 看到 的 一顆顆 膚色 小 腫瘤,27,儘管(36818) 皮膚科(232) 醫師(30062) 提出(63073) 很多(113128) 的(16029838) 理論(62242) 還是(155231) 無法(150606) 了解(82970) 為何(25238) 會(1014977) 莫名(3334) 地(754998) 產生(82753) 纖維(5224) 組織(69485) 的(16029838) 增生(713) 造成(63141) 肉眼(1562) 看到(159419) 的(16029838) 一顆顆(663) 膚色(2416) 小(318835) 腫瘤(3785),{'High': 27},"{'第5級': 6, 'Unknown': 6, '第1級': 5, '第1*級': 3, '第3*級': 1, '第6級': 2, '第4*級': 2, '第7級': 2}",2,Y,Y,N,N
但是可以確定的，它絕對和任何的細菌病毒無關，當然更跟黴菌是八竿子都打不在一起！,但是 可以 確定 的 它 絕對 和 任何 的 細菌 病毒 無關 當然 更 跟 黴菌 是 八 竿子 都 打 不 在一起,23,但是(247988) 可以(560531) 確定(40181) 的(16029838) 它(316854) 絕對(42446) 和(1338337) 任何(131795) 的(16029838) 細菌(6797) 病毒(8421) 無關(8568) 當然(113971) 更(361676) 跟(260280) 黴菌(812) 是(4642407) 八(54961) 竿子(373) 都(1125846) 打(76962) 不(2282521) 在一起(45658),{'High': 23},"{'第2級': 2, '第1級': 8, '第4級': 1, '第1*級': 2, '第4*級': 2, 'Unknown': 5, '第5級': 3}",1,Y,Y,N,N
B型肝炎是台灣臨床上最重要的肝炎疾病之一，它可持續感染導致慢性肝炎及肝硬化，嚴重者可形成肝癌。,B型 肝炎 是 台灣 臨床 上 最 重要 的 肝炎 疾病 之 一 它 可 持續 感染 導致 慢性 肝炎 及 肝硬化 嚴重 者 可 形成 肝癌,27,B型(Unknown) 肝炎(846) 是(4642407) 台灣(130718) 臨床(6794) 上(1233218) 最(421680) 重要(154863) 的(16029838) 肝炎(846) 疾病(25287) 之(875481) 一(3701681) 它(316854) 可(307359) 持續(33796) 感染(10164) 導致(30222) 慢性(3000) 肝炎(846) 及(304586) 肝硬化(296) 嚴重(39284) 者(423504) 可(307359) 形成(47486) 肝癌(438),"{'Low': 1, 'High': 26}","{'Unknown': 8, '第1級': 5, '第6級': 3, '第1*級': 2, '第2級': 1, '第5級': 4, '第4*級': 3, '第3*級': 1}",1,Y,Y,N,N
而台灣人口中約有15%是B型肝炎病毒表面抗原帶原者，亦即約有三百萬人。,而 台灣 人口 中 約 有 15 是 B型 肝炎 病毒 表面 抗原 帶原者 亦即 約 有 三百萬 人,19,而(937923) 台灣(130718) 人口(17562) 中(1011729) 約(47731) 有(2217079) 15(11053) 是(4642407) B型(Unknown) 肝炎(846) 病毒(8421) 表面(20092) 抗原(240) 帶原者(278) 亦即(10577) 約(47731) 有(2217079) 三百萬(983) 人(1550512),"{'High': 18, 'Low': 1}","{'第5級': 2, '第1級': 5, '第4級': 1, 'Unknown': 8, '第3*級': 2, '第4*級': 1}",2,Y,Y,N,N
帶原者最常問的是「B肝是否會傳染？」,帶原者 最 常 問 的 是 B肝 是否 會 傳染,10,帶原者(278) 最(421680) 常(86207) 問(165473) 的(16029838) 是(4642407) B肝(Unknown) 是否(78907) 會(1014977) 傳染(1998),"{'High': 9, 'Low': 1}","{'Unknown': 2, '第1*級': 3, '第1級': 3, '第5級': 2}",1,Y,N,N,N
「是否應與家人飲食隔離？」,是否 應 與 家人 飲食 隔離,6,是否(78907) 應(82417) 與(968432) 家人(30861) 飲食(17432) 隔離(3624),{'High': 6},"{'第5級': 1, 'Unknown': 1, '第4*級': 1, '第1*級': 1, '第4級': 1, '第6級': 1}",0,Y,N,N,N
B肝確實可經由體液及血液傳染，帶原者的體液及血液是具有傳染性的，但在一般的生活中要使血液體液經過傷口傳入體內，並沒有想像中的容易，口水中雖然含有少量病毒，其含量似乎不足以直接傳染肝炎，不過儘管飲食本身不易傳染B肝，基於衛生習慣仍鼓勵公筷母匙的提倡。,B肝 確實 可 經由 體液 及 血液 傳染 帶原者 的 體液 及 血液 是 具有 傳染性 的 但 在 一般 的 生活 中 要 使 血液 體液 經過 傷口 傳入 體 內 並 沒有 想像 中 的 容易 口水 中 雖然 含有 少量 病毒 其 含量 似乎 不足以 直接 傳染 肝炎 不過 儘管 飲食 本身 不易 傳染 B肝 基於 衛生 習慣 仍 鼓勵 公筷 母匙 的 提倡,67,B肝(Unknown) 確實(36977) 可(307359) 經由(14759) 體液(494) 及(304586) 血液(9800) 傳染(1998) 帶原者(278) 的(16029838) 體液(494) 及(304586) 血液(9800) 是(4642407) 具有(60702) 傳染性(403) 的(16029838) 但(597124) 在(3284238) 一般(80732) 的(16029838) 生活(213189) 中(1011729) 要(851264) 使(197544) 血液(9800) 體液(494) 經過(64617) 傷口(6965) 傳入(2145) 體(15460) 內(183051) 並(442790) 沒有(594280) 想像(45673) 中(1011729) 的(16029838) 容易(80831) 口水(3471) 中(1011729) 雖然(152988) 含有(8772) 少量(2229) 病毒(8421) 其(307905) 含量(2543) 似乎(85481) 不足以(1501) 直接(54798) 傳染(1998) 肝炎(846) 不過(186226) 儘管(36818) 飲食(17432) 本身(44138) 不易(8805) 傳染(1998) B肝(Unknown) 基於(12809) 衛生(6348) 習慣(42175) 仍(92056) 鼓勵(27004) 公筷(7) 母匙(Unknown) 的(16029838) 提倡(5106),"{'Low': 4, 'High': 63}","{'Unknown': 20, '第5級': 17, '第4*級': 3, '第1級': 9, '第6級': 4, '第2級': 5, '第1*級': 1, '第3*級': 1, '第3級': 3, '第4級': 4}",3,Y,Y,N,N
日常用品需隔離患者可能沾有體液血液的日常用品，如毛巾、牙刷、刮鬍刀、指甲刀等，不宜與他人「分享」。,日常 用品 需 隔離 患者 可能 沾 有 體液 血液 的 日常 用品 如 毛巾 牙刷 刮鬍刀 指甲刀 等 不宜 與 他人 分享,23,日常(20732) 用品(4495) 需(27999) 隔離(3624) 患者(20147) 可能(271025) 沾(4775) 有(2217079) 體液(494) 血液(9800) 的(16029838) 日常(20732) 用品(4495) 如(195069) 毛巾(2989) 牙刷(758) 刮鬍刀(1192) 指甲刀(26) 等(327380) 不宜(4289) 與(968432) 他人(35197) 分享(19471),"{'High': 22, 'Low': 1}","{'第4*級': 3, 'Unknown': 6, '第2級': 1, '第6級': 2, '第5級': 4, '第1級': 3, '第3級': 2, '第3*級': 1, '第4級': 1}",2,Y,Y,N,N
患者家屬或未婚夫妻應接受健康檢查，以確定是否也感染B肝；若不是帶原者因沒有抗體，應接受B肝疫苗注射，將可免於被傳染的危險。,患者 家屬 或 未婚 夫妻 應 接受 健康 檢查 以 確定 是否 也 感染 B肝 若 不 是 帶原者 因 沒有 抗體 應 接受 B肝 疫苗 注射 將 可 免於 被 傳染 的 危險,34,患者(20147) 家屬(4509) 或(478077) 未婚(1402) 夫妻(15179) 應(82417) 接受(84729) 健康(50041) 檢查(21295) 以(547785) 確定(40181) 是否(78907) 也(1590760) 感染(10164) B肝(Unknown) 若(92766) 不(2282521) 是(4642407) 帶原者(278) 因(119364) 沒有(594280) 抗體(1369) 應(82417) 接受(84729) B肝(Unknown) 疫苗(1956) 注射(3133) 將(448374) 可(307359) 免於(3101) 被(540683) 傳染(1998) 的(16029838) 危險(30190),"{'High': 32, 'Low': 2}","{'第5級': 8, '第3級': 2, '第4級': 5, 'Unknown': 8, '第2級': 2, '第1級': 5, '第6級': 2, '第7級': 1, '第4*級': 1}",1,Y,Y,N,N
當然帶原者不應該捐血。,當然 帶原者 不應該 捐血,4,當然(113971) 帶原者(278) 不應該(Unknown) 捐血(261),"{'High': 3, 'Low': 1}","{'第2級': 1, 'Unknown': 3}",2,Y,N,N,N
如果母親是帶原者，小孩出生後務必注射肝炎球蛋白(HBIG)及B肝疫苗，母親原則上可餵母乳，但如果乳頭受傷或發炎可暫時終止授乳。,如果 母親 是 帶原者 小孩 出生 後 務必 注射 肝炎 球蛋白 HBIG 及 B肝 疫苗 母親 原則上 可 餵 母乳 但 如果 乳頭 受傷 或 發炎 可 暫時 終止 授乳,30,如果(322121) 母親(84326) 是(4642407) 帶原者(278) 小孩(47282) 出生(21734) 後(422857) 務必(4103) 注射(3133) 肝炎(846) 球蛋白(320) HBIG(Unknown) 及(304586) B肝(Unknown) 疫苗(1956) 母親(84326) 原則上(198) 可(307359) 餵(7079) 母乳(2528) 但(597124) 如果(322121) 乳頭(1434) 受傷(12746) 或(478077) 發炎(3827) 可(307359) 暫時(14976) 終止(2604) 授乳(184),"{'High': 28, 'Low': 2}","{'第2級': 3, '第3級': 3, '第1級': 3, 'Unknown': 8, '第3*級': 1, '第6級': 3, '第7級': 1, '第5級': 2, '第4*級': 5, '第4級': 1}",4,Y,Y,N,N
此外，許多藥物都是在肝臟代謝，肝病患者不宜濫用藥物增加肝臟負荷，特別一些藥物包、止痛藥、鎮定劑及安眠藥等宜謹慎使用，最重要的是避免使用類固醇，以免抑制免疫力使肝炎病毒大量增加，導致肝炎急性發作或慢性肝炎，這類肝炎發作相當猛暴可能致命，因此帶原者若非用類固醇，務必在醫師指示下小心使用。,此外 許多 藥物 都 是 在 肝臟 代謝 肝病 患者 不宜 濫用 藥物 增加 肝臟 負荷 特別 一些 藥物包 止痛藥 鎮定劑 及 安眠藥 等 宜 謹慎 使用 最 重要 的 是 避免 使用 類固醇 以免 抑制 免疫力 使 肝炎 病毒 大量 增加 導致 肝炎 急性 發作 或 慢性 肝炎 這 類 肝炎 發作 相當 猛暴 可能 致命 因此 帶原者 若非 用 類固醇 務必 在 醫師 指示 下 小心 使用,69,此外(30247) 許多(159791) 藥物(14995) 都(1125846) 是(4642407) 在(3284238) 肝臟(2186) 代謝(2152) 肝病(420) 患者(20147) 不宜(4289) 濫用(2682) 藥物(14995) 增加(48296) 肝臟(2186) 負荷(2156) 特別(91212) 一些(156929) 藥物包(Unknown) 止痛藥(721) 鎮定劑(322) 及(304586) 安眠藥(1097) 等(327380) 宜(7123) 謹慎(10119) 使用(99640) 最(421680) 重要(154863) 的(16029838) 是(4642407) 避免(33211) 使用(99640) 類固醇(807) 以免(8342) 抑制(6076) 免疫力(1183) 使(197544) 肝炎(846) 病毒(8421) 大量(28414) 增加(48296) 導致(30222) 肝炎(846) 急性(1514) 發作(5942) 或(478077) 慢性(3000) 肝炎(846) 這(2114032) 類(58191) 肝炎(846) 發作(5942) 相當(66293) 猛暴(4) 可能(271025) 致命(4827) 因此(184606) 帶原者(278) 若非(2240) 用(377038) 類固醇(807) 務必(4103) 在(3284238) 醫師(30062) 指示(10148) 下(329549) 小心(24226) 使用(99640),"{'High': 67, 'Low': 2}","{'第5級': 9, '第3*級': 3, 'Unknown': 18, '第1級': 8, '第1*級': 5, '第7級': 4, '第6級': 9, '第4級': 5, '第2級': 3, '第4*級': 3, '第3級': 2}",8,Y,Y,N,N
筆者每次生理期一到，正常的作息幾乎就須中斷。,筆者 每 次 生理期 一 到 正常 的 作息 幾乎 就 須 中斷,13,筆者(10224) 每(333357) 次(331701) 生理期(181) 一(3701681) 到(546906) 正常(28865) 的(16029838) 作息(2231) 幾乎(74298) 就(1737544) 須(17260) 中斷(4119),{'High': 13},"{'第6級': 2, '第1*級': 1, '第2級': 1, 'Unknown': 1, '第1級': 4, '第3*級': 1, '第4級': 1, '第3級': 1, '第5級': 1}",1,Y,N,N,N
長久以來的吃止痛藥、請假臥床暈睡，終於令我鼓起勇氣前往婦產科諮詢醫師正確又有效的解決之道。,長久以來 的 吃 止痛藥 請假 臥床 暈睡 終於 令 我 鼓起 勇氣 前往 婦產科 諮詢 醫師 正確 又 有效 的 解決之道,21,長久以來(3338) 的(16029838) 吃(141660) 止痛藥(721) 請假(1302) 臥床(834) 暈睡(2) 終於(59622) 令(128742) 我(3033032) 鼓起(2311) 勇氣(15221) 前往(27321) 婦產科(785) 諮詢(5558) 醫師(30062) 正確(36593) 又(535555) 有效(30667) 的(16029838) 解決之道(1489),"{'High': 20, 'Low': 1}","{'第6級': 4, '第1級': 5, '第7級': 1, '第4級': 3, 'Unknown': 4, '第5級': 2, '第4*級': 1, '第1*級': 1}",4,Y,Y,N,N
半年多以來，我很感謝醫師，他沒有開立任何止痛藥方給我，只是在每周一次的門診中，灌輸給我改善生理痛的飲食、作息運動及心理調適法。,半 年 多 以來 我 很 感謝 醫師 他 沒有 開立 任何 止痛 藥方 給 我 只是 在 每 周 一 次 的 門診 中 灌輸給 我 改善 生理 痛 的 飲食 作息 運動 及 心理 調適 法,38,半(80813) 年(514736) 多(318992) 以來(26654) 我(3033032) 很(715675) 感謝(18391) 醫師(30062) 他(2487930) 沒有(594280) 開立(466) 任何(131795) 止痛(825) 藥方(1536) 給(240485) 我(3033032) 只是(96536) 在(3284238) 每(333357) 周(10111) 一(3701681) 次(331701) 的(16029838) 門診(2168) 中(1011729) 灌輸給(204) 我(3033032) 改善(21559) 生理(11511) 痛(19678) 的(16029838) 飲食(17432) 作息(2231) 運動(63153) 及(304586) 心理(59538) 調適(2517) 法(40998),{'High': 38},"{'第1級': 14, '第4*級': 3, '第4級': 3, 'Unknown': 4, '第7級': 1, '第6級': 3, '第1*級': 4, '第5級': 5, '第2級': 1}",1,Y,Y,N,N
具體的食物名稱及運動方法，竟然根治了跟隨我十多年的生理痛呢！,具體 的 食物 名稱 及 運動 方法 竟然 根治 了 跟隨 我 十多 年 的 生理 痛 呢,18,具體(20349) 的(16029838) 食物(41958) 名稱(11922) 及(304586) 運動(63153) 方法(99064) 竟然(31233) 根治(444) 了(3199291) 跟隨(7868) 我(3033032) 十多(4849) 年(514736) 的(16029838) 生理(11511) 痛(19678) 呢(204566),{'High': 18},"{'第4*級': 3, '第1級': 5, '第3級': 1, '第5級': 3, '第1*級': 2, '第2級': 1, 'Unknown': 3}",0,Y,Y,N,N
首先，飲食方面，最重要的是，維生素B6的攝取。,首先 飲食 方面 最 重要 的 是 維生素 B6 的 攝取,11,首先(31260) 飲食(17432) 方面(75079) 最(421680) 重要(154863) 的(16029838) 是(4642407) 維生素(3709) B6(225) 的(16029838) 攝取(4975),{'High': 11},"{'第4級': 2, '第3*級': 1, '第1*級': 1, '第2級': 1, '第1級': 3, '第6級': 2, 'Unknown': 1}",1,Y,N,N,N
天然的食品如穀片粥、香蕉、番薯及魚肉，都是我每周食用三、四天的固定菜式。,天然 的 食品 如 穀片粥 香蕉 番薯 及 魚肉 都 是 我 每 周 食用 三 四 天 的 固定 菜式,21,天然(6103) 的(16029838) 食品(11311) 如(195069) 穀片粥(Unknown) 香蕉(2728) 番薯(1052) 及(304586) 魚肉(1379) 都(1125846) 是(4642407) 我(3033032) 每(333357) 周(10111) 食用(5486) 三(313861) 四(141667) 天(330413) 的(16029838) 固定(15809) 菜式(102),"{'High': 20, 'Low': 1}","{'第5級': 3, '第1級': 8, 'Unknown': 6, '第2*級': 1, '第1*級': 1, '第6級': 1, '第4*級': 1}",1,Y,Y,N,N
其他富含鐵質的食物如內臟、牡蠣、牛肉或菠菜，也在醫師的建議下增加攝取量。,其他 富含 鐵質 的 食物 如 內臟 牡蠣 牛肉 或 菠菜 也 在 醫師 的 建議 下 增加 攝取量,19,其他(189445) 富含(1589) 鐵質(569) 的(16029838) 食物(41958) 如(195069) 內臟(1991) 牡蠣(549) 牛肉(2721) 或(478077) 菠菜(830) 也(1590760) 在(3284238) 醫師(30062) 的(16029838) 建議(45709) 下(329549) 增加(48296) 攝取量(909),{'High': 19},"{'第2級': 1, '第7級': 1, 'Unknown': 6, '第1級': 4, '第3級': 2, '第6級': 1, '第1*級': 2, '第3*級': 1, '第4級': 1}",1,Y,Y,N,N
醫師也建議我，飯後二個小時內最好別喝咖啡，因為那會抑制鐵質的吸收喔！,醫師 也 建議 我 飯 後 二 個 小時 內 最好 別 喝 咖啡 因為 那 會 抑制 鐵質 的 吸收 喔,22,醫師(30062) 也(1590760) 建議(45709) 我(3033032) 飯(16473) 後(422857) 二(152494) 個(2296574) 小時(48521) 內(183051) 最好(22016) 別(78082) 喝(57552) 咖啡(12867) 因為(425061) 那(754138) 會(1014977) 抑制(6076) 鐵質(569) 的(16029838) 吸收(9741) 喔(24771),{'High': 22},"{'第1級': 11, '第3*級': 1, '第1*級': 4, '第3級': 2, '第6級': 1, 'Unknown': 1, '第4*級': 1, '第4級': 1}",0,Y,Y,N,N
另外，膝胸臥式(如趴下翹臀的膜拜姿勢)也十分有效。,另外 膝胸 臥式 如 趴下 翹 臀 的 膜拜 姿勢 也 十分 有效,13,另外(48233) 膝胸(Unknown) 臥式(27) 如(195069) 趴下(124) 翹(1789) 臀(935) 的(16029838) 膜拜(1113) 姿勢(10376) 也(1590760) 十分(63196) 有效(30667),"{'High': 11, 'Low': 2}","{'第3級': 1, 'Unknown': 5, '第6級': 1, '第7級': 2, '第1級': 2, '第5級': 1, '第4級': 1}",0,Y,Y,N,N
在地上舖塊海綿板即可；每天約做十分鐘，效果十分顯著！,在 地上 舖 塊 海綿板 即可 每 天 約 做 十 分 鐘 效果 十分 顯著,16,在(3284238) 地上(Unknown) 舖(1306) 塊(54148) 海綿板(Unknown) 即可(7563) 每(333357) 天(330413) 約(47731) 做(411649) 十(77415) 分(62224) 鐘(4134) 效果(38188) 十分(63196) 顯著(7255),"{'High': 14, 'Low': 2}","{'第1*級': 2, 'Unknown': 4, '第1級': 5, '第6級': 1, '第3*級': 1, '第4*級': 1, '第4級': 1, '第5級': 1}",1,Y,N,N,N
