sentence,sentence_preprocessed,sentence_length,word_freq,high_low_freq,word_level,long_word_count,is_complete_sentence,is_complete_context,is_blacklist,is_greylist
所謂「定向能武器」，係指向一定方向目標發射高能量射束以毀傷目標的武器，最著名的是雷射武器，它利用波長小於一毫米的電磁輻射射束摧毀目標或使目標失效。,所謂 定向能 武器 係指 向 一定 方向 目標 發射 高能量 射束 以 毀傷 目標 的 武器 最 著名 的 是 雷射 武器 它 利用 波長 小於 一 毫米 的 電磁 輻射 射束 摧毀 目標 或 使 目標 失效,38,所謂(59460) 定向能(Unknown) 武器(13794) 係指(610) 向(231672) 一定(138695) 方向(39560) 目標(62638) 發射(3632) 高能量(279) 射束(8) 以(547785) 毀傷(106) 目標(62638) 的(16029838) 武器(13794) 最(421680) 著名(20279) 的(16029838) 是(4642407) 雷射(1567) 武器(13794) 它(316854) 利用(49229) 波長(795) 小於(1009) 一(3701681) 毫米(448) 的(16029838) 電磁(516) 輻射(1748) 射束(8) 摧毀(5262) 目標(62638) 或(478077) 使(197544) 目標(62638) 失效(1002),"{'High': 35, 'Low': 3}","{'第5級': 6, 'Unknown': 11, '第2級': 1, '第1*級': 3, '第3*級': 2, '第4級': 4, '第6級': 4, '第1級': 5, '第7級': 1, '第3級': 1}",2,Y,Y,N,N
以媒介大陸女子賣淫為號召，並與台北縣、市二百五十餘家賓館業者掛勾的「東京」應召站，台北地檢署檢察官劉承武廿四日偵結，依妨害風化罪嫌將該應召站負責人蕭坤州、「馬伕」李文裕、蔣慶瓏、譚玉傑、陶利權及賓館服務生王美玲等六人提起公訴，檢方並分別求處六月到一年六月不等徒刑。,以 媒介 大陸 女子 賣淫 為 號召 並 與 台北縣 市 二百五十餘 家 賓館 業者 掛勾 的 東京 應召站 台北 地檢署 檢察官 劉承武 廿四日 偵結 依 妨害 風化 罪嫌 將 該 應召站 負責人 蕭坤州 馬伕 李文裕 蔣慶瓏 譚玉傑 陶利權 及 賓館 服務生 王美玲 等 六 人 提起公訴 檢方 並 分別 求處 六 月 到 一 年 六 月 不等 徒刑,60,以(547785) 媒介(9863) 大陸(27031) 女子(23797) 賣淫(432) 為(761341) 號召(2588) 並(442790) 與(968432) 台北縣(1048) 市(5149) 二百五十餘(11) 家(236822) 賓館(878) 業者(6857) 掛勾(257) 的(16029838) 東京(13670) 應召站(14) 台北(22242) 地檢署(52) 檢察官(2517) 劉承武(Unknown) 廿四日(169) 偵結(22) 依(37519) 妨害(646) 風化(497) 罪嫌(182) 將(448374) 該(148369) 應召站(14) 負責人(3840) 蕭坤州(Unknown) 馬伕(309) 李文裕(Unknown) 蔣慶瓏(Unknown) 譚玉傑(Unknown) 陶利權(Unknown) 及(304586) 賓館(878) 服務生(3056) 王美玲(4) 等(327380) 六(77936) 人(1550512) 提起公訴(102) 檢方(750) 並(442790) 分別(25566) 求處(Unknown) 六(77936) 月(148997) 到(546906) 一(3701681) 年(514736) 六(77936) 月(148997) 不等(2665) 徒刑(460),"{'High': 47, 'Low': 13}","{'第5級': 3, '第6級': 4, '第3*級': 2, '第4*級': 6, 'Unknown': 33, '第2*級': 1, '第1級': 11}",17,Y,Y,N,Y
不過，針對台北市警界日前接連爆發員警擄妓勒贖弊案，檢方廿四日亦針對「東京」應召站有無遭員警擄妓勒贖、違法包庇情事及二百餘家賓館服務生涉及妨害風化、協助大陸女子以假結婚方式來台賣淫的大批人頭丈夫刑責等部分，簽分「他」字案調查。,不過 針對 台北市 警界 日前 接連 爆發 員警 擄妓 勒贖 弊案 檢方 廿四日 亦 針對 東京 應召站 有無 遭 員警 擄妓 勒贖 違法 包庇 情事 及 二百餘 家 賓館 服務生 涉及 妨害 風化 協助 大陸 女子 以 假結婚 方式 來 台 賣淫 的 大 批 人頭 丈夫 刑責 等 部分 簽分 他 字 案 調查,55,不過(186226) 針對(23174) 台北市(4393) 警界(237) 日前(1738) 接連(2938) 爆發(11071) 員警(673) 擄妓(Unknown) 勒贖(37) 弊案(210) 檢方(750) 廿四日(169) 亦(68507) 針對(23174) 東京(13670) 應召站(14) 有無(3483) 遭(18764) 員警(673) 擄妓(Unknown) 勒贖(37) 違法(2775) 包庇(400) 情事(1210) 及(304586) 二百餘(453) 家(236822) 賓館(878) 服務生(3056) 涉及(9123) 妨害(646) 風化(497) 協助(28701) 大陸(27031) 女子(23797) 以(547785) 假結婚(Unknown) 方式(133407) 來(742183) 台(29325) 賣淫(432) 的(16029838) 大(525780) 批(22121) 人頭(2444) 丈夫(31006) 刑責(177) 等(327380) 部分(82518) 簽分(1) 他(2487930) 字(75654) 案(11719) 調查(34821),"{'High': 48, 'Low': 7}","{'第2級': 3, '第6級': 7, 'Unknown': 24, '第7級': 3, '第5級': 4, '第1級': 6, '第4*級': 6, '第3*級': 2}",6,Y,Y,N,N
檢方發現，「東京」應召站的大陸女子，大多是以假結婚方式來台賣淫，人頭丈夫負責大陸女子來台的一切手續費用，並安排大陸女子在台北縣市租屋居住，當大陸女子順利來台並開始接客賣淫後，即每月支付人頭丈夫新台幣三萬元。,檢方 發現 東京 應召站 的 大陸 女子 大多 是以 假結婚 方式 來 台 賣淫 人頭 丈夫 負責 大陸 女子 來 台 的 一切 手續 費用 並 安排 大陸 女子 在 台北 縣市 租屋 居住 當 大陸 女子 順利 來 台 並 開始 接客 賣淫 後 即 每 月 支付 人頭 丈夫 新台幣 三萬 元,54,檢方(750) 發現(175233) 東京(13670) 應召站(14) 的(16029838) 大陸(27031) 女子(23797) 大多(12946) 是以(149) 假結婚(Unknown) 方式(133407) 來(742183) 台(29325) 賣淫(432) 人頭(2444) 丈夫(31006) 負責(37090) 大陸(27031) 女子(23797) 來(742183) 台(29325) 的(16029838) 一切(95523) 手續(2500) 費用(10652) 並(442790) 安排(30105) 大陸(27031) 女子(23797) 在(3284238) 台北(22242) 縣市(1349) 租屋(524) 居住(12699) 當(294625) 大陸(27031) 女子(23797) 順利(17708) 來(742183) 台(29325) 並(442790) 開始(245562) 接客(212) 賣淫(432) 後(422857) 即(110826) 每(333357) 月(148997) 支付(6156) 人頭(2444) 丈夫(31006) 新台幣(1741) 三萬(2891) 元(60807),"{'High': 52, 'Low': 2}","{'Unknown': 14, '第2級': 5, '第1級': 8, '第3*級': 5, '第4*級': 10, '第6級': 3, '第5級': 3, '第4級': 4, '第1*級': 2}",3,Y,Y,N,N
檢方查出，這些台灣籍人頭丈夫的身分，大多數都是計程車司機。,檢方 查出 這些 台灣籍 人頭 丈夫 的 身分 大多數 都 是 計程車 司機,13,檢方(750) 查出(1980) 這些(315113) 台灣籍(59) 人頭(2444) 丈夫(31006) 的(16029838) 身分(22196) 大多數(21212) 都(1125846) 是(4642407) 計程車(5108) 司機(7766),"{'High': 12, 'Low': 1}","{'Unknown': 5, '第6級': 1, '第4*級': 2, '第1級': 3, '第1*級': 1, '第2*級': 1}",3,Y,N,N,N
起訴書指出，蕭坤州涉嫌自八十八年三月間到八十九年五月底止，於台北市設立「東京」應召站，並僱用計程車司機李文裕、蔣慶瓏、譚玉傑、陶利權等人為馬伕負責接送應召女子到台北市「帝華」賓館、「百花」等二百餘家飯店從事性交易。,起訴書 指出 蕭坤州 涉嫌 自 八十八年 三月 間 到 八十九年 五月 底 止 於 台北市 設立 東京 應召站 並 僱用 計程車 司機 李文裕 蔣慶瓏 譚玉傑 陶利權 等 人為 馬伕 負責 接送 應召 女子 到 台北市 帝華 賓館 百花 等 二百餘 家 飯店 從事 性交易,44,起訴書(190) 指出(38456) 蕭坤州(Unknown) 涉嫌(2037) 自(59676) 八十八年(208) 三月(16043) 間(115638) 到(546906) 八十九年(180) 五月(15682) 底(37174) 止(8003) 於(327210) 台北市(4393) 設立(12114) 東京(13670) 應召站(14) 並(442790) 僱用(1364) 計程車(5108) 司機(7766) 李文裕(Unknown) 蔣慶瓏(Unknown) 譚玉傑(Unknown) 陶利權(Unknown) 等(327380) 人為(3154) 馬伕(309) 負責(37090) 接送(807) 應召(287) 女子(23797) 到(546906) 台北市(4393) 帝華(Unknown) 賓館(878) 百花(1) 等(327380) 二百餘(453) 家(236822) 飯店(9669) 從事(22774) 性交易(77),"{'High': 35, 'Low': 9}","{'Unknown': 24, '第7級': 1, '第5級': 3, '第1級': 3, '第3*級': 3, '第4*級': 5, '第6級': 2, '第1*級': 1, '第2*級': 2}",14,Y,Y,N,Y
去年五月廿三日晚間，賓館服務生王美玲以電話聯絡應召站，由計程車司機譚玉傑載送賣春女前往賓館性交易時，被警方臨檢查獲，警方隨後循線逮捕另外三名「馬伕」及應召站負責人蕭坤州，將全案移送法辦。,去年 五月 廿三日 晚間 賓館 服務生 王美玲 以 電話 聯絡 應召站 由 計程車 司機 譚玉傑 載送 賣春女 前往 賓館 性交易 時 被 警方 臨檢 查獲 警方 隨後 循線 逮捕 另外 三名 馬伕 及 應召站 負責人 蕭坤州 將 全案 移送法辦,39,去年(9462) 五月(15682) 廿三日(182) 晚間(1978) 賓館(878) 服務生(3056) 王美玲(4) 以(547785) 電話(38698) 聯絡(7975) 應召站(14) 由(208604) 計程車(5108) 司機(7766) 譚玉傑(Unknown) 載送(15) 賣春女(1) 前往(27321) 賓館(878) 性交易(77) 時(623734) 被(540683) 警方(8008) 臨檢(140) 查獲(259) 警方(8008) 隨後(11299) 循線(153) 逮捕(7333) 另外(48233) 三名(Unknown) 馬伕(309) 及(304586) 應召站(14) 負責人(3840) 蕭坤州(Unknown) 將(448374) 全案(Unknown) 移送法辦(66),"{'High': 28, 'Low': 11}","{'第1級': 2, 'Unknown': 24, '第5級': 5, '第4級': 1, '第4*級': 1, '第1*級': 1, '第2*級': 1, '第3*級': 1, '第2級': 1, '第6級': 1, '第3級': 1}",12,Y,Y,N,Y
檢察官偵結全案，起訴蕭坤州等六人。,檢察官 偵結 全案 起訴 蕭坤州 等 六 人,8,檢察官(2517) 偵結(22) 全案(Unknown) 起訴(1999) 蕭坤州(Unknown) 等(327380) 六(77936) 人(1550512),"{'High': 5, 'Low': 3}","{'第6級': 2, 'Unknown': 3, '第3*級': 1, '第1級': 2}",2,Y,Y,N,Y
其中蕭坤州因是應召站負責人，被具體求刑一年六月，緩刑五年，至於司機蔣慶瓏、譚玉傑、陶利權、李文裕及賓館服務生王美玲，則分別被求處有期徒刑六月。,其中 蕭坤州 因 是 應召站 負責人 被 具體 求刑 一 年 六 月 緩刑 五 年 至於 司機 蔣慶瓏 譚玉傑 陶利權 李文裕 及 賓館 服務生 王美玲 則 分別 被 求 處 有期徒刑 六月,33,其中(95627) 蕭坤州(Unknown) 因(119364) 是(4642407) 應召站(14) 負責人(3840) 被(540683) 具體(20349) 求刑(15) 一(3701681) 年(514736) 六(77936) 月(148997) 緩刑(315) 五(112649) 年(514736) 至於(39363) 司機(7766) 蔣慶瓏(Unknown) 譚玉傑(Unknown) 陶利權(Unknown) 李文裕(Unknown) 及(304586) 賓館(878) 服務生(3056) 王美玲(4) 則(254096) 分別(25566) 被(540683) 求(30359) 處(84410) 有期徒刑(520) 六月(14880),"{'High': 25, 'Low': 8}","{'第3*級': 1, 'Unknown': 15, '第1級': 7, '第2級': 2, '第4*級': 3, '第5級': 3, '第2*級': 1, '第6級': 1}",10,Y,Y,N,Y
轟動一時去年十二月間被檢警查獲以九二一重建名義進口發電機，而夾藏大批槍彈的邱琮舜走私槍械集團案，板橋地方法院廿四日將十四名被告判刑，主嫌邱琮舜因走私七十把以上槍支及兩千八百多發子彈，被依違反槍砲彈藥刀械條例罪嫌判處死刑，褫奪公權終身，邱的胞弟，案發前擔任地院法警的邱義翔被判刑十五年；至於被告張淑惠及葛恆弼，因檢方依證人保護法規定同意列為污點證人，判決免刑。,轟動一時 去年 十二月 間 被 檢警 查獲 以 九二一 重建 名義 進口 發電機 而 夾藏 大 批 槍彈 的 邱琮舜 走私 槍械 集團案 板橋 地方 法院 廿四日 將 十四 名 被告 判刑 主嫌 邱琮舜 因 走私 七十 把 以上 槍支 及 兩千八百多 發 子彈 被 依 違反 槍砲 彈藥 刀械 條例 罪嫌 判處 死刑 褫奪公權 終身 邱 的 胞弟 案發 前 擔任 地院 法警 的 邱義翔 被 判刑 十五 年 至於 被告 張淑惠 及 葛恆弼 因 檢方 依 證人 保護法 規定 同意 列為 污點 證人 判決 免刑,87,轟動一時(449) 去年(9462) 十二月(13715) 間(115638) 被(540683) 檢警(40) 查獲(259) 以(547785) 九二一(560) 重建(7085) 名義(5851) 進口(5751) 發電機(596) 而(937923) 夾藏(8) 大(525780) 批(22121) 槍彈(331) 的(16029838) 邱琮舜(Unknown) 走私(1617) 槍械(452) 集團案(Unknown) 板橋(928) 地方(139164) 法院(7533) 廿四日(169) 將(448374) 十四(9837) 名(136287) 被告(2948) 判刑(958) 主嫌(51) 邱琮舜(Unknown) 因(119364) 走私(1617) 七十(4970) 把(617773) 以上(36569) 槍支(96) 及(304586) 兩千八百多(5) 發(22092) 子彈(4296) 被(540683) 依(37519) 違反(6717) 槍砲(347) 彈藥(1005) 刀械(27) 條例(3394) 罪嫌(182) 判處(1230) 死刑(3416) 褫奪公權(Unknown) 終身(5078) 邱(779) 的(16029838) 胞弟(437) 案發(826) 前(272709) 擔任(34825) 地院(68) 法警(214) 的(16029838) 邱義翔(Unknown) 被(540683) 判刑(958) 十五(19907) 年(514736) 至於(39363) 被告(2948) 張淑惠(6) 及(304586) 葛恆弼(Unknown) 因(119364) 檢方(750) 依(37519) 證人(3917) 保護法(234) 規定(24592) 同意(30620) 列為(3260) 污點(423) 證人(3917) 判決(4608) 免刑(16),"{'High': 72, 'Low': 15}","{'第7級': 3, '第1級': 7, 'Unknown': 43, '第2級': 5, '第5級': 11, '第6級': 12, '第4級': 3, '第1*級': 1, '第3*級': 1, '第3級': 1}",14,Y,Y,N,Y
該案於昨天下午四時在板橋地院第廿一法庭宣判，吸引多名關心本案的被告及其家屬到庭聆聽法官林錫凱判決，邱琮舜、邱義翔等六名被告聆判後並無反應，邱琮舜在警力戒護下還押時，曾朝旁聽席看一看，但面無表情。,該 案 於 昨天 下午 四時 在 板橋 地院 第廿一 法庭 宣判 吸引 多 名 關心 本案 的 被告 及 其 家屬 到庭 聆聽 法官 林錫凱 判決 邱琮舜 邱義翔 等 六 名 被告 聆判 後 並 無 反應 邱琮舜 在 警力 戒護 下 還 押 時 曾 朝 旁聽席 看 一 看 但 面無表情,54,該(148369) 案(11719) 於(327210) 昨天(12735) 下午(20045) 四時(775) 在(3284238) 板橋(928) 地院(68) 第廿一(12) 法庭(7131) 宣判(886) 吸引(20619) 多(318992) 名(136287) 關心(22258) 本案(Unknown) 的(16029838) 被告(2948) 及(304586) 其(307905) 家屬(4509) 到庭(52) 聆聽(7962) 法官(8999) 林錫凱(Unknown) 判決(4608) 邱琮舜(Unknown) 邱義翔(Unknown) 等(327380) 六(77936) 名(136287) 被告(2948) 聆判(6) 後(422857) 並(442790) 無(157858) 反應(53196) 邱琮舜(Unknown) 在(3284238) 警力(353) 戒護(53) 下(329549) 還(625086) 押(1649) 時(623734) 曾(132981) 朝(59301) 旁聽席(106) 看(444691) 一(3701681) 看(444691) 但(597124) 面無表情(Unknown),"{'High': 43, 'Low': 11}","{'第4*級': 3, '第5級': 6, '第1級': 7, 'Unknown': 19, '第1*級': 3, '第7級': 2, '第4級': 3, '第2級': 3, '第3級': 1, '第6級': 5, '第3*級': 2}",7,Y,Y,N,Y
另外同案被告陳上人被判刑廿年、潘國寶十三年、陳宏宗十二年、蔡自強判刑十年、陳崇賢判刑九年、周承德判刑八年、陳鼎福判刑七年、陳仁和判刑七年、張翔飛判刑七年、王科培判刑六年、郭振添兩年，被告楊志雄因藏匿人犯被判五月；除楊志雄外，十三名被判刑的被告均遭併科兩百萬到一千兩百萬元罰金，其中又以邱琮舜被併科一千兩百萬元最多。,另外 同案 被告 陳上人 被 判刑 廿 年 潘國寶 十三 年 陳宏宗 十二 年 蔡自強 判刑 十 年 陳崇賢 判刑 九 年 周承德 判刑 八 年 陳鼎福 判刑 七 年 陳仁和 判刑 七 年 張翔飛 判刑 七 年 王科培 判刑 六 年 郭振添 兩 年 被告 楊志雄 因 藏匿 人犯 被 判 五 月 除 楊志雄 外 十三 名 被 判刑 的 被告 均 遭 併科 兩百萬 到 一千兩百萬 元 罰金 其中 又 以 邱琮舜 被 併科 一千兩百萬 元 最多,80,另外(48233) 同案(Unknown) 被告(2948) 陳上人(Unknown) 被(540683) 判刑(958) 廿(542) 年(514736) 潘國寶(Unknown) 十三(9810) 年(514736) 陳宏宗(1) 十二(22310) 年(514736) 蔡自強(Unknown) 判刑(958) 十(77415) 年(514736) 陳崇賢(Unknown) 判刑(958) 九(34506) 年(514736) 周承德(Unknown) 判刑(958) 八(54961) 年(514736) 陳鼎福(Unknown) 判刑(958) 七(59385) 年(514736) 陳仁和(Unknown) 判刑(958) 七(59385) 年(514736) 張翔飛(Unknown) 判刑(958) 七(59385) 年(514736) 王科培(Unknown) 判刑(958) 六(77936) 年(514736) 郭振添(Unknown) 兩(526190) 年(514736) 被告(2948) 楊志雄(Unknown) 因(119364) 藏匿(1280) 人犯(507) 被(540683) 判(4618) 五(112649) 月(148997) 除(15929) 楊志雄(Unknown) 外(109310) 十三(9810) 名(136287) 被(540683) 判刑(958) 的(16029838) 被告(2948) 均(27783) 遭(18764) 併科(62) 兩百萬(763) 到(546906) 一千兩百萬(90) 元(60807) 罰金(438) 其中(95627) 又(535555) 以(547785) 邱琮舜(Unknown) 被(540683) 併科(62) 一千兩百萬(90) 元(60807) 最多(11485),"{'High': 61, 'Low': 19}","{'第3級': 1, 'Unknown': 38, '第6級': 4, '第2級': 5, '第1級': 26, '第7級': 2, '第3*級': 2, '第1*級': 1, '第5級': 1}",17,Y,Y,N,Y
司法院人事審議委員會昨日會議，通過台北地院、高雄高分院等七所法院院長的連鎖性調動案。,司法院 人事 審議 委員會 昨日 會議 通過 台北地院 高雄 高分院 等 七 所 法院 院長 的 連鎖性 調動案,18,司法院(140) 人事(6842) 審議(1267) 委員會(19419) 昨日(2036) 會議(30698) 通過(29652) 台北地院(Unknown) 高雄(4674) 高分院(5) 等(327380) 七(59385) 所(527327) 法院(7533) 院長(5857) 的(16029838) 連鎖性(37) 調動案(2),"{'High': 14, 'Low': 4}","{'Unknown': 8, '第5級': 3, '第7級': 1, '第4級': 2, '第3*級': 1, '第1級': 2, '第2級': 1}",6,Y,Y,N,N
其中，台北地院院長黃文調昇高雄高分院院長；新竹地院長林錦芳調昇台北地院院長；澎湖地院長黃梅月調昇苗栗地院長，因均屬女性院長調昇重用，備受矚目。,其中 台北地院 院長 黃文 調昇 高雄 高分院 院長 新竹 地院長 林錦芳 調昇 台北地院 院長 澎湖 地院長 黃梅月 調昇 苗栗 地院長 因 均 屬 女性 院長 調昇 重用 備受 矚目,29,其中(95627) 台北地院(Unknown) 院長(5857) 黃文(37) 調昇(1) 高雄(4674) 高分院(5) 院長(5857) 新竹(2736) 地院長(Unknown) 林錦芳(Unknown) 調昇(1) 台北地院(Unknown) 院長(5857) 澎湖(3267) 地院長(Unknown) 黃梅月(Unknown) 調昇(1) 苗栗(976) 地院長(Unknown) 因(119364) 均(27783) 屬(26012) 女性(59364) 院長(5857) 調昇(1) 重用(3051) 備受(3188) 矚目(2050),"{'High': 16, 'Low': 13}","{'第3*級': 1, 'Unknown': 22, '第6級': 4, '第5級': 1, '第4級': 1}",8,Y,Y,N,Y
而林錦芳由新竹地院院長直接調昇首都法院院長，更是史無前例。,而 林錦芳 由 新竹 地院 院長 直接 調昇 首都 法院 院長 更 是 史無前例,14,而(937923) 林錦芳(Unknown) 由(208604) 新竹(2736) 地院(68) 院長(5857) 直接(54798) 調昇(1) 首都(12838) 法院(7533) 院長(5857) 更(361676) 是(4642407) 史無前例(882),"{'High': 11, 'Low': 3}","{'第5級': 2, 'Unknown': 7, '第4*級': 1, '第3級': 1, '第4級': 1, '第1級': 1, '第7級': 1}",2,Y,Y,N,Y
司法院昨日另有一項高層人事案，即司法人員研習所長由高雄高分院院長劉瑞村接任，係由司法院院長逕行任命。,司法院 昨日 另 有 一 項 高層 人事案 即 司法 人員 研習 所長 由 高雄 高分院 院長 劉瑞村 接任 係 由 司法院 院長 逕行 任命,25,司法院(140) 昨日(2036) 另(138369) 有(2217079) 一(3701681) 項(88887) 高層(6030) 人事案(53) 即(110826) 司法(6288) 人員(49261) 研習(1601) 所長(2381) 由(208604) 高雄(4674) 高分院(5) 院長(5857) 劉瑞村(Unknown) 接任(2185) 係(9477) 由(208604) 司法院(140) 院長(5857) 逕行(270) 任命(8000),"{'High': 22, 'Low': 3}","{'Unknown': 10, '第5級': 4, '第3級': 1, '第1級': 2, '第6級': 5, '第7級': 1, '第4*級': 2}",5,Y,N,N,Y
昨日連鎖調動的院長人事如下：台北地院院長黃文調高雄高分院院長；新竹地院院長林錦芳調台北地院院長。,昨日 連鎖 調動 的 院長 人事 如下 台北 地院 院長 黃文 調 高雄 高分院 院長 新竹 地院 院長 林錦芳 調 台北 地院 院長,23,昨日(2036) 連鎖(2455) 調動(1787) 的(16029838) 院長(5857) 人事(6842) 如下(2340) 台北(22242) 地院(68) 院長(5857) 黃文(37) 調(6657) 高雄(4674) 高分院(5) 院長(5857) 新竹(2736) 地院(68) 院長(5857) 林錦芳(Unknown) 調(6657) 台北(22242) 地院(68) 院長(5857),"{'High': 17, 'Low': 6}","{'第5級': 2, '第6級': 1, 'Unknown': 19, '第1級': 1}",2,Y,N,N,Y
嘉義地院院長吳昭瑩調新竹地院院長；苗栗地院院長袁再興調嘉義地院院長。,嘉義 地院 院長 吳昭瑩 調 新竹 地院 院長 苗栗 地院 院長 袁再興 調 嘉義 地院 院長,16,嘉義(2515) 地院(68) 院長(5857) 吳昭瑩(3) 調(6657) 新竹(2736) 地院(68) 院長(5857) 苗栗(976) 地院(68) 院長(5857) 袁再興(Unknown) 調(6657) 嘉義(2515) 地院(68) 院長(5857),"{'High': 10, 'Low': 6}",{'Unknown': 16},2,Y,N,N,Y
澎湖地院院長黃梅月調苗栗地院長；金門地院院長王增瑜調澎湖地院院長；台中高分院法官蕭廣政調金門地院院長。,澎湖 地院 院長 黃梅月 調 苗栗 地 院長 金門 地院 院長 王增瑜 調 澎湖 地院 院長 台中 高分院 法官 蕭廣政 調 金門 地院 院長,24,澎湖(3267) 地院(68) 院長(5857) 黃梅月(Unknown) 調(6657) 苗栗(976) 地(754998) 院長(5857) 金門(4382) 地院(68) 院長(5857) 王增瑜(Unknown) 調(6657) 澎湖(3267) 地院(68) 院長(5857) 台中(3661) 高分院(5) 法官(8999) 蕭廣政(Unknown) 調(6657) 金門(4382) 地院(68) 院長(5857),"{'High': 16, 'Low': 8}","{'Unknown': 23, '第5級': 1}",4,Y,N,N,Y
海巡署雲林機動查緝隊經長期佈線，昨(廿四)日在檢察官王淑月坐鎮指揮下收網，破獲偽鈔集團設於斗六市中華路與南仁路兩處的地下工廠，起出新、舊版超過一千一百多萬元幾可亂真的成品、半成品偽鈔與印製工具，並逮獲周姓主嫌；據估計流入市面偽鈔超過一億元。,海巡署 雲林 機動查緝隊 經 長期 佈線 昨 廿四 日 在 檢察官 王淑月 坐鎮 指揮 下 收網 破獲 偽鈔 集團 設於 斗六市 中華路 與 南仁路 兩 處 的 地下 工廠 起出 新 舊版 超過 一千一百多萬 元 幾可亂真 的 成品 半成品 偽鈔 與 印製 工具 並 逮獲 周姓 主嫌 據 估計 流入 市面 偽鈔 超過 一億 元,55,海巡署(30) 雲林(859) 機動查緝隊(Unknown) 經(38471) 長期(28592) 佈線(17) 昨(531) 廿四(473) 日(94041) 在(3284238) 檢察官(2517) 王淑月(Unknown) 坐鎮(1000) 指揮(13870) 下(329549) 收網(51) 破獲(230) 偽鈔(47) 集團(20609) 設於(431) 斗六市(29) 中華路(281) 與(968432) 南仁路(Unknown) 兩(526190) 處(84410) 的(16029838) 地下(2707) 工廠(16192) 起出(89) 新(212453) 舊版(225) 超過(30507) 一千一百多萬(13) 元(60807) 幾可亂真(113) 的(16029838) 成品(1767) 半成品(231) 偽鈔(47) 與(968432) 印製(1014) 工具(26319) 並(442790) 逮獲(25) 周姓(55) 主嫌(51) 據(24392) 估計(7162) 流入(2123) 市面(2063) 偽鈔(47) 超過(30507) 一億(1225) 元(60807),"{'Low': 15, 'High': 40}","{'Unknown': 30, '第1級': 7, '第1*級': 2, '第6級': 2, '第7級': 3, '第5級': 3, '第4*級': 4, '第4級': 4}",10,Y,Y,N,Y
海巡署中巡局雲林機動查緝隊半年前獲得線報，指嫌犯羅姓男子持有偽鈔，是偽鈔集團「洗錢」下線，涉嫌在市面上以假購物真換鈔的方式「洗錢」，因此派員跟監，今年八月間在高雄市逮捕伺機換鈔的羅嫌，並在其身上起出十八萬九千元偽鈔，機動查緝隊長廖維新乃採取「釣魚」方式，擴大追查幕後集團。,海巡署 中巡局 雲林 機動查緝隊 半 年 前 獲得 線報 指 嫌犯 羅姓 男子 持有 偽鈔 是 偽鈔 集團 洗錢 下線 涉嫌 在 市面 上 以 假 購物 真 換鈔 的 方式 洗錢 因此 派員 跟監 今年 八月 間 在 高雄市 逮捕 伺機 換鈔 的 羅嫌 並 在 其 身 上 起出 十八萬九千 元 偽鈔 機動 查緝 隊長 廖維新 乃 採取 釣魚 方式 擴大 追查 幕後 集團,66,海巡署(30) 中巡局(Unknown) 雲林(859) 機動查緝隊(Unknown) 半(80813) 年(514736) 前(272709) 獲得(54809) 線報(44) 指(84264) 嫌犯(1224) 羅姓(22) 男子(17448) 持有(4356) 偽鈔(47) 是(4642407) 偽鈔(47) 集團(20609) 洗錢(270) 下線(80) 涉嫌(2037) 在(3284238) 市面(2063) 上(1233218) 以(547785) 假(18056) 購物(5443) 真(137497) 換鈔(Unknown) 的(16029838) 方式(133407) 洗錢(270) 因此(184606) 派員(584) 跟監(137) 今年(10836) 八月(15534) 間(115638) 在(3284238) 高雄市(1220) 逮捕(7333) 伺機(1239) 換鈔(Unknown) 的(16029838) 羅嫌(Unknown) 並(442790) 在(3284238) 其(307905) 身(122324) 上(1233218) 起出(89) 十八萬九千(3) 元(60807) 偽鈔(47) 機動(872) 查緝(146) 隊長(2763) 廖維新(Unknown) 乃(32413) 採取(30585) 釣魚(2583) 方式(133407) 擴大(12352) 追查(1932) 幕後(2164) 集團(20609),"{'Low': 15, 'High': 51}","{'Unknown': 27, '第1級': 10, '第5級': 7, '第4級': 1, '第7級': 4, '第4*級': 8, '第1*級': 4, '第6級': 5}",6,Y,Y,N,Y
