sentence,sentence_preprocessed,sentence_length,word_freq,high_low_freq,word_level,long_word_count,is_complete_sentence,is_complete_context,is_blacklist,is_greylist
但是，有個750的雙筒望遠鏡，就可以增加到25萬顆左右。,但是 有 個 750 的 雙筒 望遠鏡 就 可以 增加 到 25萬 顆 左右,14,但是(247988) 有(2217079) 個(2296574) 750(104) 的(16029838) 雙筒(105) 望遠鏡(2843) 就(1737544) 可以(560531) 增加(48296) 到(546906) 25萬(90) 顆(32006) 左右(33714),"{'High': 13, 'Low': 1}","{'第2級': 1, '第1級': 6, 'Unknown': 3, '第6級': 1, '第4級': 1, '第3級': 1, '第3*級': 1}",3,Y,Y,N,N
因此不可忽視雙筒望遠鏡的威力喔！,因此 不可 忽視 雙筒 望遠鏡 的 威力 喔,8,因此(184606) 不可(50808) 忽視(6825) 雙筒(105) 望遠鏡(2843) 的(16029838) 威力(4262) 喔(24771),{'High': 8},"{'第4*級': 1, 'Unknown': 2, '第5級': 2, '第6級': 1, '第1級': 1, '第4級': 1}",1,Y,Y,N,N
如果你年紀小怕臂力不夠的話，那麼選擇一個630的雙筒，同樣會讓你大開眼界。,如果 你 年紀 小 怕 臂力 不 夠 的話 那麼 選擇 一 個 630 的 雙筒 同樣 會 讓 你 大開眼界,21,如果(322121) 你(1414837) 年紀(21116) 小(318835) 怕(46704) 臂力(322) 不(2282521) 夠(49042) 的話(72341) 那麼(127785) 選擇(75178) 一(3701681) 個(2296574) 630(30) 的(16029838) 雙筒(105) 同樣(63568) 會(1014977) 讓(526314) 你(1414837) 大開眼界(598),"{'High': 20, 'Low': 1}","{'第2級': 3, '第1級': 7, '第3級': 1, '第1*級': 3, 'Unknown': 4, '第3*級': 2, '第6級': 1}",2,Y,Y,N,N
至於倍數較高的天文望遠鏡方面，複雜的赤道儀可以暫時不考慮使用，而選擇構造較簡單，操作較方便，移動較輕巧的經緯儀式天文望遠鏡，口徑只要6、7公分，甚至5公分也可以，配上一個適當的目鏡，倍數也可達到100多倍。,至於 倍數 較 高 的 天文 望遠鏡 方面 複雜 的 赤道儀 可以 暫時 不 考慮 使用 而 選擇 構造 較 簡單 操作 較 方便 移動 較 輕巧 的 經緯儀式 天文 望遠鏡 口徑 只 要 6 7 公分 甚至 5 公分 也 可以 配上 一 個 適當 的 目鏡 倍數 也 可 達到 100 多 倍,55,至於(39363) 倍數(748) 較(78424) 高(128858) 的(16029838) 天文(3177) 望遠鏡(2843) 方面(75079) 複雜(29761) 的(16029838) 赤道儀(2) 可以(560531) 暫時(14976) 不(2282521) 考慮(28774) 使用(99640) 而(937923) 選擇(75178) 構造(4531) 較(78424) 簡單(52683) 操作(10980) 較(78424) 方便(14172) 移動(16739) 較(78424) 輕巧(908) 的(16029838) 經緯儀式(Unknown) 天文(3177) 望遠鏡(2843) 口徑(583) 只(436725) 要(851264) 6(25671) 7(21969) 公分(9876) 甚至(122502) 5(33754) 公分(9876) 也(1590760) 可以(560531) 配上(2105) 一(3701681) 個(2296574) 適當(17983) 的(16029838) 目鏡(64) 倍數(748) 也(1590760) 可(307359) 達到(35670) 100(5632) 多(318992) 倍(22818),"{'High': 52, 'Low': 3}","{'第5級': 4, 'Unknown': 10, '第2級': 5, '第1級': 14, '第6級': 4, '第3*級': 3, '第4級': 5, '第4*級': 6, '第1*級': 2, '第7級': 2}",5,Y,Y,N,N
我們利用這個小天文望遠鏡，同樣可看到太陽的黑子(但要裝濾光鏡或投影板)，月球表面的環形山、金星的盈虧、木星的衛星、土星的光環與浩瀚銀河中的點點星光，相信凡是義大利著名天文學家伽利略所看過的天體，你都能看得到，而且看得比他更清楚。,我們 利用 這 個 小 天文 望遠鏡 同樣 可 看到 太陽 的 黑子 但 要 裝 濾光鏡 或 投影板 月球 表面 的 環形 山 金星 的 盈虧 木星 的 衛星 土星 的 光環 與 浩瀚 銀河 中 的 點點 星光 相信 凡是 義大利 著名 天文學家 伽利略 所 看 過 的 天體 你 都 能 看 得 到 而且 看 得 比 他 更 清楚,64,我們(979260) 利用(49229) 這(2114032) 個(2296574) 小(318835) 天文(3177) 望遠鏡(2843) 同樣(63568) 可(307359) 看到(159419) 太陽(21823) 的(16029838) 黑子(316) 但(597124) 要(851264) 裝(17432) 濾光鏡(34) 或(478077) 投影板(Unknown) 月球(2557) 表面(20092) 的(16029838) 環形(364) 山(54936) 金星(1357) 的(16029838) 盈虧(394) 木星(1270) 的(16029838) 衛星(3757) 土星(588) 的(16029838) 光環(1347) 與(968432) 浩瀚(1458) 銀河(1303) 中(1011729) 的(16029838) 點點(1652) 星光(1264) 相信(82200) 凡是(5571) 義大利(11552) 著名(20279) 天文學家(1503) 伽利略(737) 所(527327) 看(444691) 過(412878) 的(16029838) 天體(1233) 你(1414837) 都(1125846) 能(582260) 看(444691) 得(573721) 到(546906) 而且(180402) 看(444691) 得(573721) 比(170486) 他(2487930) 更(361676) 清楚(76185),"{'High': 62, 'Low': 2}","{'第1級': 16, '第3*級': 3, '第6級': 6, '第4*級': 3, '第1*級': 5, '第3級': 4, 'Unknown': 20, '第2級': 4, '第7級': 3}",6,Y,Y,N,Y
當你在使用這些簡單的儀器來作天文觀測時，要小心使用並注意保養，同時最好也能作一個簡單的記錄。,當 你 在 使用 這些 簡單 的 儀器 來 作 天文 觀測 時 要 小心 使用 並 注意 保養 同時 最好 也 能 作 一 個 簡單 的 記錄,29,當(294625) 你(1414837) 在(3284238) 使用(99640) 這些(315113) 簡單(52683) 的(16029838) 儀器(4419) 來(742183) 作(78184) 天文(3177) 觀測(1828) 時(623734) 要(851264) 小心(24226) 使用(99640) 並(442790) 注意(49591) 保養(2084) 同時(115305) 最好(22016) 也(1590760) 能(582260) 作(78184) 一(3701681) 個(2296574) 簡單(52683) 的(16029838) 記錄(18871),{'High': 29},"{'Unknown': 4, '第1級': 8, '第1*級': 2, '第4級': 3, '第2級': 4, '第5級': 1, '第6級': 2, '第7級': 1, '第3*級': 2, '第4*級': 1, '第3級': 1}",0,Y,N,N,N
久而久之，你自然會得到許多觀測心得，同時也能為將來換用較複雜的儀器時，打下一個良好的基礎。,久而久之 你 自然 會 得到 許多 觀測 心得 同時 也 能 為 將來 換用 較 複雜 的 儀器 時 打下 一 個 良好 的 基礎,25,久而久之(1737) 你(1414837) 自然(91995) 會(1014977) 得到(84614) 許多(159791) 觀測(1828) 心得(3837) 同時(115305) 也(1590760) 能(582260) 為(761341) 將來(17836) 換用(104) 較(78424) 複雜(29761) 的(16029838) 儀器(4419) 時(623734) 打下(1936) 一(3701681) 個(2296574) 良好(16069) 的(16029838) 基礎(39682),{'High': 25},"{'第6級': 1, '第1級': 6, '第3*級': 5, '第1*級': 2, '第7級': 1, '第5級': 2, 'Unknown': 3, '第4級': 2, '第2級': 1, '第4*級': 2}",1,Y,N,N,N
圖說：只要你肯用心觀測，即使是利用一個小的望遠鏡，也能成為小小天文家。,圖說 只要 你 肯 用心 觀測 即使 是 利用 一 個 小 的 望遠鏡 也 能 成為 小小 天文家,19,圖說(1053) 只要(99140) 你(1414837) 肯(21145) 用心(8780) 觀測(1828) 即使(68376) 是(4642407) 利用(49229) 一(3701681) 個(2296574) 小(318835) 的(16029838) 望遠鏡(2843) 也(1590760) 能(582260) 成為(143834) 小小(18150) 天文家(15),"{'High': 18, 'Low': 1}","{'Unknown': 3, '第3級': 1, '第1級': 7, '第4*級': 2, '第4級': 1, '第7級': 1, '第3*級': 1, '第6級': 1, '第1*級': 1, '第5級': 1}",2,Y,Y,N,N
(圖中是口徑6公分的折光鏡，裝置在相機用的三腳架上.)嫦娥臉上的雀斑，在60倍左右的望遠鏡下，一覽無遺。,圖 中 是 口徑 6 公分 的 折光鏡 裝置 在 相機用 的 三腳架 上 嫦娥 臉 上 的 雀斑 在 60 倍 左右 的 望遠鏡 下 一覽無遺,27,圖(46009) 中(1011729) 是(4642407) 口徑(583) 6(25671) 公分(9876) 的(16029838) 折光鏡(Unknown) 裝置(6558) 在(3284238) 相機用(Unknown) 的(16029838) 三腳架(119) 上(1233218) 嫦娥(485) 臉(86234) 上(1233218) 的(16029838) 雀斑(432) 在(3284238) 60(4288) 倍(22818) 左右(33714) 的(16029838) 望遠鏡(2843) 下(329549) 一覽無遺(458),"{'High': 25, 'Low': 2}","{'第2級': 2, 'Unknown': 9, '第1級': 7, '第7級': 1, '第4級': 1, '第5級': 1, '第1*級': 3, '第3*級': 2, '第6級': 1}",5,Y,N,N,Y
別錯過12月24日的日偏蝕！,別 錯過 12月 24日 的 日 偏蝕,7,別(78082) 錯過(4695) 12月(1) 24日(14) 的(16029838) 日(94041) 偏蝕(2),"{'High': 4, 'Low': 3}","{'第1*級': 1, '第5級': 1, 'Unknown': 3, '第1級': 2}",2,Y,N,N,N
文.藍文隆.今年的日、月蝕共有5次，其中有3次在臺灣地區都無緣見到，僅有12月10日清晨的月偏蝕及12月24日的日偏蝕，在臺灣地區的朋友才有緣看到，可別錯過這個難得的機會喔！,文 藍文隆 今年 的 日 月蝕 共 有 5 次 其中 有 3 次 在 臺灣 地區 都 無緣 見到 僅有 12月 10日 清晨 的 月 偏蝕 及 12月 24日 的 日 偏蝕 在 臺灣 地區 的 朋友 才 有緣 看到 可 別 錯過 這 個 難得 的 機會 喔,50,文(28958) 藍文隆(Unknown) 今年(10836) 的(16029838) 日(94041) 月蝕(161) 共(32138) 有(2217079) 5(33754) 次(331701) 其中(95627) 有(2217079) 3(51223) 次(331701) 在(3284238) 臺灣(36443) 地區(40339) 都(1125846) 無緣(1299) 見到(30619) 僅有(4494) 12月(1) 10日(23) 清晨(6122) 的(16029838) 月(148997) 偏蝕(2) 及(304586) 12月(1) 24日(14) 的(16029838) 日(94041) 偏蝕(2) 在(3284238) 臺灣(36443) 地區(40339) 的(16029838) 朋友(101331) 才(394539) 有緣(940) 看到(159419) 可(307359) 別(78082) 錯過(4695) 這(2114032) 個(2296574) 難得(8735) 的(16029838) 機會(81244) 喔(24771),"{'High': 43, 'Low': 7}","{'第4級': 5, 'Unknown': 11, '第1級': 17, '第1*級': 5, '第2級': 4, '第3*級': 1, '第7級': 1, '第6級': 1, '第5級': 3, '第4*級': 2}",5,Y,Y,N,Y
到10時41分終止，總共經過4小時20分。,到 10時 41分 終止 總共 經過 4 小時 20 分,10,到(546906) 10時(2) 41分(Unknown) 終止(2604) 總共(5077) 經過(64617) 4(36054) 小時(48521) 20(14081) 分(62224),"{'High': 8, 'Low': 2}","{'第1級': 3, 'Unknown': 4, '第6級': 1, '第4級': 1, '第2級': 1}",2,Y,N,N,N
由於是在日出的時候發生，而且月球陰影區掃過的範圍，使得除了高屏地區能見到完整的日偏蝕外，其餘各地都只能看到日出，即已呈現日蝕狀況的日出帶蝕。,由於 是 在 日出 的 時候 發生 而且 月球 陰影區 掃過 的 範圍 使得 除了 高屏 地區 能 見到 完整 的 日 偏蝕 外 其餘 各 地 都 只 能 看到 日出 即已 呈現 日蝕 狀況 的 日出帶蝕,38,由於(88111) 是(4642407) 在(3284238) 日出(1903) 的(16029838) 時候(199970) 發生(129211) 而且(180402) 月球(2557) 陰影區(9) 掃過(399) 的(16029838) 範圍(24784) 使得(30960) 除了(75964) 高屏(110) 地區(40339) 能(582260) 見到(30619) 完整(19201) 的(16029838) 日(94041) 偏蝕(2) 外(109310) 其餘(8181) 各(243023) 地(754998) 都(1125846) 只(436725) 能(582260) 看到(159419) 日出(1903) 即已(1407) 呈現(26810) 日蝕(329) 狀況(44199) 的(16029838) 日出帶蝕(Unknown),"{'High': 35, 'Low': 3}","{'第4*級': 5, '第1級': 9, '第1*級': 5, '第3級': 2, 'Unknown': 9, '第5級': 3, '第3*級': 1, '第4級': 2, '第2級': 1, '第6級': 1}",2,Y,Y,N,N
這次日偏蝕各地狀況如下：地點初虧時間蝕甚復圓臺北6點30分32秒7點11分10秒7點53分39秒臺中6點33分45秒7點09分56秒7點47分20秒嘉義6點36分02秒7點09分26秒7點44分02秒高雄6點40分28秒7點08分46秒7點38分54秒鵝鑾鼻6點40分25秒7點09分17秒7點40分03秒在準備觀測這次的日偏蝕時，如果沒有望遠鏡的話，那就必須準備好安全措施，免得眼睛受損。,這 次 日 偏蝕 各 地 狀況 如下 地點 初虧 時間 蝕甚復圓 臺北 6點 30分 32秒 7點 11分 10秒 7點 53分 39秒 臺中 6點 33分 45秒 7點 09分 56秒 7點 47分 20秒 嘉義 6點 36分 02秒 7點 09分 26秒 7點 44分 02秒 高雄 6點 40分 28秒 7點 08分 46秒 7點 38分 54秒 鵝鑾鼻 6點 40分 25秒 7點 09分 17秒 7點 40分 03秒 在 準備 觀測 這 次 的 日 偏蝕 時 如果 沒有 望遠鏡 的話 那 就 必須 準備好 安全 措施 免得 眼睛 受損,84,這(2114032) 次(331701) 日(94041) 偏蝕(2) 各(243023) 地(754998) 狀況(44199) 如下(2340) 地點(16808) 初虧(2) 時間(213595) 蝕甚復圓(Unknown) 臺北(7336) 6點(19) 30分(5) 32秒(Unknown) 7點(9) 11分(1) 10秒(Unknown) 7點(9) 53分(2) 39秒(Unknown) 臺中(941) 6點(19) 33分(Unknown) 45秒(Unknown) 7點(9) 09分(Unknown) 56秒(Unknown) 7點(9) 47分(2) 20秒(Unknown) 嘉義(2515) 6點(19) 36分(Unknown) 02秒(Unknown) 7點(9) 09分(Unknown) 26秒(Unknown) 7點(9) 44分(Unknown) 02秒(Unknown) 高雄(4674) 6點(19) 40分(1) 28秒(Unknown) 7點(9) 08分(Unknown) 46秒(Unknown) 7點(9) 38分(Unknown) 54秒(Unknown) 鵝鑾鼻(104) 6點(19) 40分(1) 25秒(Unknown) 7點(9) 09分(Unknown) 17秒(Unknown) 7點(9) 40分(1) 03秒(Unknown) 在(3284238) 準備(64901) 觀測(1828) 這(2114032) 次(331701) 的(16029838) 日(94041) 偏蝕(2) 時(623734) 如果(322121) 沒有(594280) 望遠鏡(2843) 的話(72341) 那(754138) 就(1737544) 必須(170592) 準備好(9688) 安全(35338) 措施(10317) 免得(4315) 眼睛(65022) 受損(3329),"{'High': 35, 'Low': 49}","{'第1級': 9, '第2級': 5, 'Unknown': 58, '第5級': 2, '第3*級': 2, '第1*級': 2, '第7級': 1, '第6級': 3, '第3級': 2}",34,Y,Y,N,N
在準備時，可以用曝光的幻燈片頭(務必是幻燈片，片頭一般沒有景物所以是深黑色)，以4、5張以上疊在一起，就可以做成一副簡單的遮光片。,在 準備 時 可以 用 曝光 的 幻燈片頭 務必 是 幻燈片 片頭 一般 沒有 景物 所以 是 深黑色 以 4 5 張 以上 疊 在一起 就 可以 做成 一 副 簡單 的 遮光片,33,在(3284238) 準備(64901) 時(623734) 可以(560531) 用(377038) 曝光(2785) 的(16029838) 幻燈片頭(Unknown) 務必(4103) 是(4642407) 幻燈片(837) 片頭(512) 一般(80732) 沒有(594280) 景物(1930) 所以(239080) 是(4642407) 深黑色(48) 以(547785) 4(36054) 5(33754) 張(99414) 以上(36569) 疊(4437) 在一起(45658) 就(1737544) 可以(560531) 做成(6466) 一(3701681) 副(21458) 簡單(52683) 的(16029838) 遮光片(8),"{'High': 30, 'Low': 3}","{'第1*級': 3, '第2級': 2, '第3*級': 3, '第1級': 10, '第6級': 3, 'Unknown': 9, '第7級': 1, '第5級': 2}",5,Y,Y,N,N
(注意：仍然不可持續用來看太陽太久。,注意 仍然 不可 持續 用來 看 太陽 太 久,9,注意(49591) 仍然(46200) 不可(50808) 持續(33796) 用來(29356) 看(444691) 太陽(21823) 太(181732) 久(68086),{'High': 9},"{'第2級': 1, '第4級': 1, 'Unknown': 2, '第4*級': 1, '第5級': 1, '第3級': 1, '第1級': 2}",0,Y,N,N,N
)另外，還有個自製遮光鏡的方法，就是燒小火堆，把玻璃片薰黑後，拿來觀測。,另外 還 有 個 自製 遮光鏡 的 方法 就 是 燒 小 火堆 把 玻璃片 薰黑 後 拿來 觀測,19,另外(48233) 還(625086) 有(2217079) 個(2296574) 自製(1854) 遮光鏡(1) 的(16029838) 方法(99064) 就(1737544) 是(4642407) 燒(13780) 小(318835) 火堆(846) 把(617773) 玻璃片(142) 薰黑(10) 後(422857) 拿來(8521) 觀測(1828),"{'High': 17, 'Low': 2}","{'第3級': 1, 'Unknown': 7, '第1級': 7, '第2級': 2, '第4級': 1, '第7級': 1}",2,Y,Y,N,N
在製作時要非常小心喔！,在 製作 時 要 非常 小心 喔,7,在(3284238) 製作(26135) 時(623734) 要(851264) 非常(152032) 小心(24226) 喔(24771),{'High': 7},"{'第1*級': 2, '第5級': 1, '第3*級': 1, '第1級': 1, '第2級': 1, '第4級': 1}",0,Y,N,N,N
如果有準備望遠鏡觀測時，也務必得加上太陽遮光鏡等設備，以防止眼睛受灼損壞。,如果 有 準備 望遠鏡 觀測 時 也 務必 得 加上 太陽 遮光鏡 等 設備 以 防止 眼睛 受灼 損壞,19,如果(322121) 有(2217079) 準備(64901) 望遠鏡(2843) 觀測(1828) 時(623734) 也(1590760) 務必(4103) 得(573721) 加上(38121) 太陽(21823) 遮光鏡(1) 等(327380) 設備(12866) 以(547785) 防止(7775) 眼睛(65022) 受灼(Unknown) 損壞(1499),"{'High': 17, 'Low': 2}","{'第2級': 2, '第1級': 2, '第6級': 2, '第7級': 1, '第3*級': 2, 'Unknown': 3, '第3級': 2, '第4級': 1, '第5級': 3, '第1*級': 1}",2,Y,Y,N,N
如果都準備好了，就可以耐心期待24日的來臨，如果你有相機，最好別忘了拍張照片留念吧！,如果 都 準備好 了 就 可以 耐心 期待 24日 的 來臨 如果 你 有 相機 最好 別 忘 了 拍 張 照片 留念 吧,24,如果(322121) 都(1125846) 準備好(9688) 了(3199291) 就(1737544) 可以(560531) 耐心(8731) 期待(21616) 24日(14) 的(16029838) 來臨(6978) 如果(322121) 你(1414837) 有(2217079) 相機(3675) 最好(22016) 別(78082) 忘(24299) 了(3199291) 拍(28875) 張(99414) 照片(25355) 留念(413) 吧(184477),"{'High': 23, 'Low': 1}","{'第2級': 3, '第1級': 7, 'Unknown': 4, '第4*級': 3, '第5級': 1, '第6級': 1, '第3級': 2, '第1*級': 2, '第2*級': 1}",2,Y,Y,N,N
未來機車秀.競賽場上的神兵利器TriumphDaytona900文.美國的Daytona大賽車，雖然不是使用專為比賽設計的純種賽車來競爭的比賽，但是，這項比賽的歷史卻可以一直追溯到本世紀初，而且在美國本地受到很大的歡迎，幾十年來都相當的盛行。,未來 機車秀 競賽場 上 的 神兵 利器 TriumphDaytona900 文 美國 的 Daytona 大 賽車 雖然 不 是 使用 專 為 比賽 設計 的 純種 賽車 來 競爭 的 比賽 但是 這 項 比賽 的 歷史 卻 可以 一直 追溯 到 本 世紀 初 而且 在 美國 本 地 受到 很 大 的 歡迎 幾十 年 來 都 相當 的 盛行,60,未來(54445) 機車秀(Unknown) 競賽場(67) 上(1233218) 的(16029838) 神兵(195) 利器(1251) TriumphDaytona900(Unknown) 文(28958) 美國(148299) 的(16029838) Daytona(6) 大(525780) 賽車(816) 雖然(152988) 不(2282521) 是(4642407) 使用(99640) 專(7355) 為(761341) 比賽(20220) 設計(59326) 的(16029838) 純種(225) 賽車(816) 來(742183) 競爭(30766) 的(16029838) 比賽(20220) 但是(247988) 這(2114032) 項(88887) 比賽(20220) 的(16029838) 歷史(96060) 卻(333007) 可以(560531) 一直(119877) 追溯(1742) 到(546906) 本(197156) 世紀(16204) 初(42087) 而且(180402) 在(3284238) 美國(148299) 本(197156) 地(754998) 受到(66513) 很(715675) 大(525780) 的(16029838) 歡迎(19513) 幾十(9173) 年(514736) 來(742183) 都(1125846) 相當(66293) 的(16029838) 盛行(3489),"{'High': 56, 'Low': 4}","{'第4級': 8, 'Unknown': 10, '第1級': 24, '第6級': 3, '第7級': 2, '第2級': 7, '第4*級': 1, '第5級': 1, '第3級': 3, '第1*級': 1}",4,Y,Y,N,Y
第一項特點是它的比賽場地是像一般運動場跑道一樣的環形賽道，由於沒有複雜的彎道，所以賽車的速度相當高。,第一 項 特點 是 它 的 比賽 場地 是 像 一般 運動場 跑道 一樣 的 環形 賽道 由於 沒有 複雜 的 彎 道 所以 賽車 的 速度 相當 高,29,第一(172544) 項(88887) 特點(8045) 是(4642407) 它(316854) 的(16029838) 比賽(20220) 場地(2712) 是(4642407) 像(289494) 一般(80732) 運動場(794) 跑道(2046) 一樣(188109) 的(16029838) 環形(364) 賽道(265) 由於(88111) 沒有(594280) 複雜(29761) 的(16029838) 彎(6908) 道(141723) 所以(239080) 賽車(816) 的(16029838) 速度(26646) 相當(66293) 高(128858),{'High': 29},"{'第2級': 2, '第5級': 4, '第4*級': 2, '第1級': 8, '第1*級': 4, '第3*級': 2, 'Unknown': 4, '第4級': 1, '第7級': 1, '第3級': 1}",1,Y,Y,N,N
第二，參賽的車種都是經過改裝的市售量產車種，所以，種類可以說是千奇百怪。,第二 參賽 的 車種 都 是 經過 改裝 的 市售 量產 車種 所以 種類 可以 說 是 千奇百怪,18,第二(98741) 參賽(2005) 的(16029838) 車種(265) 都(1125846) 是(4642407) 經過(64617) 改裝(954) 的(16029838) 市售(423) 量產(670) 車種(265) 所以(239080) 種類(8370) 可以(560531) 說(1285247) 是(4642407) 千奇百怪(438),{'High': 18},"{'Unknown': 7, '第1級': 7, '第2級': 1, '第1*級': 1, '第4級': 1, '第7級': 1}",1,Y,Y,N,N
由於Daytona大賽在世界車壇中很有特色，許多機車製造廠便針對這項比賽的特性設計適合的車種，來賣給那些想參加大賽的改裝車隊，其中Triumph車廠的Daytona900就是其中的佼佼者。,由於 Daytona 大賽 在 世界 車壇 中 很 有 特色 許多 機車 製造廠 便 針對 這 項 比賽 的 特性 設計 適合 的 車種 來 賣給 那些 想 參加 大賽 的 改裝 車隊 其中 Triumph 車廠 的 Daytona900 就 是 其中 的 佼佼者,43,由於(88111) Daytona(6) 大賽(1690) 在(3284238) 世界(165235) 車壇(8) 中(1011729) 很(715675) 有(2217079) 特色(16060) 許多(159791) 機車(2826) 製造廠(596) 便(220860) 針對(23174) 這(2114032) 項(88887) 比賽(20220) 的(16029838) 特性(12673) 設計(59326) 適合(25592) 的(16029838) 車種(265) 來(742183) 賣給(3949) 那些(113704) 想(449884) 參加(42962) 大賽(1690) 的(16029838) 改裝(954) 車隊(1031) 其中(95627) Triumph(65) 車廠(922) 的(16029838) Daytona900(Unknown) 就(1737544) 是(4642407) 其中(95627) 的(16029838) 佼佼者(713),"{'High': 39, 'Low': 4}","{'第4*級': 3, 'Unknown': 15, '第1*級': 1, '第2級': 3, '第1級': 12, '第4級': 1, '第3*級': 3, '第3級': 2, '第6級': 2, '第5級': 1}",5,Y,Y,N,Y
而是來自英國的機車製造廠。,而是 來自 英國 的 機車 製造廠,6,而是(74258) 來自(41811) 英國(44248) 的(16029838) 機車(2826) 製造廠(596),{'High': 6},"{'Unknown': 2, '第4級': 1, '第1級': 2, '第3級': 1}",1,Y,Y,N,N
Triumhp是凱旋、勝利的意思。,Triumhp 是 凱旋 勝利 的 意思,6,Triumhp(Unknown) 是(4642407) 凱旋(1016) 勝利(14590) 的(16029838) 意思(50961),"{'Low': 1, 'High': 5}","{'Unknown': 2, '第1級': 2, '第4*級': 1, '第1*級': 1}",1,Y,N,N,Y
它創立於西元1885年，至今已有超過100年的歷史。,它 創立 於 西元 1885年 至今 已 有 超過 100 年 的 歷史,13,它(316854) 創立(6414) 於(327210) 西元(19393) 1885年(86) 至今(14540) 已(215610) 有(2217079) 超過(30507) 100(5632) 年(514736) 的(16029838) 歷史(96060),"{'High': 12, 'Low': 1}","{'第1*級': 1, '第5級': 2, '第4*級': 1, 'Unknown': 3, '第3級': 2, '第1級': 3, '第4級': 1}",2,Y,N,N,N
由於20世紀初期美國的機車工業並不發達，使用的機車也大都是歐洲的車種，因此當時Triumhp車廠所製造的機車就非常受歡迎。,由於 20世紀 初期 美國 的 機車 工業 並 不 發達 使用 的 機車 也 大都 是 歐洲 的 車種 因此 當時 Triumhp 車廠 所 製造 的 機車 就 非常 受 歡迎,31,由於(88111) 20世紀(575) 初期(11598) 美國(148299) 的(16029838) 機車(2826) 工業(20144) 並(442790) 不(2282521) 發達(5976) 使用(99640) 的(16029838) 機車(2826) 也(1590760) 大都(6626) 是(4642407) 歐洲(24026) 的(16029838) 車種(265) 因此(184606) 當時(126214) Triumhp(Unknown) 車廠(922) 所(527327) 製造(28512) 的(16029838) 機車(2826) 就(1737544) 非常(152032) 受(109982) 歡迎(19513),"{'High': 30, 'Low': 1}","{'第4*級': 4, 'Unknown': 7, '第1級': 9, '第3級': 3, '第5級': 1, '第4級': 2, '第3*級': 2, '第2級': 2, '第1*級': 1}",2,Y,Y,N,Y
引擎的排氣量是900cc，如果以我國的標準來比較的話，是國內最大車種(150cc)的6倍，它出廠時設定的最大馬力是98匹，但是在設計時保留了很大的彈性，讓參加大賽的車隊，可以進行改裝。,引擎 的 排氣量 是 900 cc 如果 以 我國 的 標準 來 比較 的話 是 國內 最 大 車種 150 cc 的 6 倍 它 出廠 時 設定 的 最 大 馬力 是 98 匹 但是 在 設計 時 保留 了 很 大 的 彈性 讓 參加 大賽 的 車隊 可以 進行 改裝,53,引擎(5515) 的(16029838) 排氣量(40) 是(4642407) 900(206) cc(Unknown) 如果(322121) 以(547785) 我國(7225) 的(16029838) 標準(31106) 來(742183) 比較(112212) 的話(72341) 是(4642407) 國內(17537) 最(421680) 大(525780) 車種(265) 150(1290) cc(Unknown) 的(16029838) 6(25671) 倍(22818) 它(316854) 出廠(193) 時(623734) 設定(10564) 的(16029838) 最(421680) 大(525780) 馬力(974) 是(4642407) 98(1051) 匹(10062) 但是(247988) 在(3284238) 設計(59326) 時(623734) 保留(11400) 了(3199291) 很(715675) 大(525780) 的(16029838) 彈性(8540) 讓(526314) 參加(42962) 大賽(1690) 的(16029838) 車隊(1031) 可以(560531) 進行(100298) 改裝(954),"{'High': 50, 'Low': 3}","{'第5級': 6, '第1級': 15, 'Unknown': 16, '第2級': 5, '第3*級': 4, '第4級': 1, '第1*級': 4, '第7級': 1, '第4*級': 1}",3,Y,Y,N,N
經過重新改裝的賽車，馬力可以超過120匹，最快能夠達到250公里以上的時速。,經過 重新 改裝 的 賽車 馬力 可以 超過 120 匹 最 快 能夠 達到 250 公里 以上 的 時速,19,經過(64617) 重新(44668) 改裝(954) 的(16029838) 賽車(816) 馬力(974) 可以(560531) 超過(30507) 120(1397) 匹(10062) 最(421680) 快(116207) 能夠(96422) 達到(35670) 250(699) 公里(16646) 以上(36569) 的(16029838) 時速(1960),{'High': 19},"{'第2級': 1, '第5級': 2, 'Unknown': 5, '第1級': 3, '第7級': 2, '第4級': 2, '第1*級': 2, '第4*級': 1, '第3*級': 1}",2,Y,N,N,N
