sentence,sentence_preprocessed,sentence_length,word_freq,high_low_freq,word_level,long_word_count,is_complete_sentence,is_complete_context,is_blacklist,is_greylist
馬來西亞和新加坡原本一同在新加坡城中的丹絨巴葛火車站執行星馬鐵路出入境和海關業務，但新加坡從八月一日起把海關業務全部遷移到更接近雙方實際邊界的兀蘭站，其理由是將更有助於篩檢毒梟、走私客及非法移民。,馬來西亞 和 新加坡 原本 一同 在 新加坡城 中 的 丹絨巴葛 火車站 執行 星馬 鐵路 出入境 和 海關 業務 但 新加坡 從 八月 一日 起 把 海關 業務 全部 遷移到 更 接近 雙方 實際 邊界 的 兀蘭站 其 理由 是 將 更 有助於 篩檢 毒梟 走私客 及 非法 移民,48,馬來西亞(2504) 和(1338337) 新加坡(5228) 原本(35765) 一同(8982) 在(3284238) 新加坡城(Unknown) 中(1011729) 的(16029838) 丹絨巴葛(Unknown) 火車站(3115) 執行(25364) 星馬(68) 鐵路(7088) 出入境(100) 和(1338337) 海關(1974) 業務(15620) 但(597124) 新加坡(5228) 從(496546) 八月(15534) 一日(5343) 起(96746) 把(617773) 海關(1974) 業務(15620) 全部(34039) 遷移到(748) 更(361676) 接近(24049) 雙方(22984) 實際(52755) 邊界(4193) 的(16029838) 兀蘭站(Unknown) 其(307905) 理由(32460) 是(4642407) 將(448374) 更(361676) 有助於(9351) 篩檢(584) 毒梟(130) 走私客(12) 及(304586) 非法(3229) 移民(8767),"{'High': 42, 'Low': 6}","{'第5級': 9, 'Unknown': 18, '第4*級': 6, '第4級': 4, '第1*級': 2, '第1級': 3, '第2級': 3, '第3*級': 1, '第6級': 2}",11,Y,Y,N,N
新加坡並要求馬來西亞比照辦理，但馬國不從，因而引發一場爭執。,新加坡 並 要求 馬來西亞 比照 辦理 但 馬國 不 從 因而 引發 一 場 爭執,15,新加坡(5228) 並(442790) 要求(71192) 馬來西亞(2504) 比照(839) 辦理(7225) 但(597124) 馬國(73) 不(2282521) 從(496546) 因而(29060) 引發(17487) 一(3701681) 場(68915) 爭執(5110),"{'High': 14, 'Low': 1}","{'第5級': 6, '第4*級': 1, '第3*級': 1, '第7級': 1, '第2級': 2, 'Unknown': 1, '第1級': 2, '第1*級': 1}",2,Y,Y,N,N
馬來西亞仍將海關設在丹絨巴葛火車站內，但已採取變通的出入境查驗辦法，即對前往馬國的旅客，旅行證件上一律不蓋入境章，以免造成新加坡及外國旅客還沒有新加坡出境章，而先有了馬國入境章的問題。,馬來西亞 仍 將 海關 設 在 丹絨巴葛 火車站 內 但 已 採取 變通 的 出入境 查驗 辦法 即 對 前往 馬國 的 旅客 旅行 證件 上 一律 不 蓋 入境章 以免 造成 新加坡 及 外國 旅客 還 沒有 新加坡 出境章 而 先 有 了 馬國 入境章 的 問題,48,馬來西亞(2504) 仍(92056) 將(448374) 海關(1974) 設(17537) 在(3284238) 丹絨巴葛(Unknown) 火車站(3115) 內(183051) 但(597124) 已(215610) 採取(30585) 變通(1265) 的(16029838) 出入境(100) 查驗(361) 辦法(43280) 即(110826) 對(897964) 前往(27321) 馬國(73) 的(16029838) 旅客(3355) 旅行(18643) 證件(1179) 上(1233218) 一律(4178) 不(2282521) 蓋(21495) 入境章(Unknown) 以免(8342) 造成(63141) 新加坡(5228) 及(304586) 外國(13057) 旅客(3355) 還(625086) 沒有(594280) 新加坡(5228) 出境章(Unknown) 而(937923) 先(136649) 有(2217079) 了(3199291) 馬國(73) 入境章(Unknown) 的(16029838) 問題(280782),"{'High': 41, 'Low': 7}","{'第5級': 11, '第4級': 2, 'Unknown': 14, '第1*級': 3, '第3級': 2, '第2級': 3, '第6級': 3, '第1級': 9, '第4*級': 1}",9,Y,Y,N,N
由於這項變通方法，新加坡和馬國之間的火車今天第二天通行順暢。,由於 這 項 變通 方法 新加坡 和 馬國 之間 的 火車 今天 第二 天 通行 順暢,16,由於(88111) 這(2114032) 項(88887) 變通(1265) 方法(99064) 新加坡(5228) 和(1338337) 馬國(73) 之間(117932) 的(16029838) 火車(13566) 今天(73277) 第二(98741) 天(330413) 通行(1994) 順暢(2678),"{'High': 15, 'Low': 1}","{'第4*級': 1, '第1級': 4, '第5級': 2, '第6級': 3, '第2級': 1, 'Unknown': 3, '第4級': 1, '第1*級': 1}",1,Y,Y,N,N
馬來西亞總理馬哈地昨天就馬國和新加坡之間的火車站海關搬遷爭執表示，這完全是沒有意義，而且目前大家都面對經濟難題之際，挑起問題也不合宜。,馬來西亞 總理 馬哈地 昨天 就 馬國 和 新加坡 之間 的 火車站 海關 搬遷 爭執 表示 這 完全 是 沒有 意義 而且 目前 大家 都 面對 經濟 難題 之 際 挑起 問題 也 不 合宜,34,馬來西亞(2504) 總理(6056) 馬哈地(13) 昨天(12735) 就(1737544) 馬國(73) 和(1338337) 新加坡(5228) 之間(117932) 的(16029838) 火車站(3115) 海關(1974) 搬遷(727) 爭執(5110) 表示(74452) 這(2114032) 完全(115744) 是(4642407) 沒有(594280) 意義(71714) 而且(180402) 目前(48695) 大家(109692) 都(1125846) 面對(62914) 經濟(83046) 難題(6647) 之(875481) 際(14344) 挑起(2162) 問題(280782) 也(1590760) 不(2282521) 合宜(1388),"{'High': 32, 'Low': 2}","{'第5級': 8, 'Unknown': 5, '第1級': 11, '第4級': 3, '第7級': 1, '第4*級': 2, '第3*級': 1, '第3級': 1, '第6級': 2}",4,Y,Y,N,Y
馬來西亞新聞部長莫哈梅今天則指控新加坡媒體最近報導這項爭執時，推行一種「仇恨馬來西亞運動」，並警告說，若馬國因此引發反彈，將帶來「嚴重後果」。,馬來西亞 新聞 部長 莫哈梅 今天 則 指控 新加坡 媒體 最近 報導 這 項 爭執 時 推行 一 種 仇恨 馬來西亞 運動 並 警告 說 若 馬國 因此 引發 反彈 將 帶來 嚴重 後果,33,馬來西亞(2504) 新聞(40430) 部長(6226) 莫哈梅(Unknown) 今天(73277) 則(254096) 指控(4621) 新加坡(5228) 媒體(32308) 最近(30174) 報導(27311) 這(2114032) 項(88887) 爭執(5110) 時(623734) 推行(4552) 一(3701681) 種(701563) 仇恨(3165) 馬來西亞(2504) 運動(63153) 並(442790) 警告(11012) 說(1285247) 若(92766) 馬國(73) 因此(184606) 引發(17487) 反彈(2045) 將(448374) 帶來(40305) 嚴重(39284) 後果(11960),"{'High': 31, 'Low': 2}","{'第5級': 10, '第3級': 1, 'Unknown': 5, '第1級': 4, '第6級': 4, '第4級': 1, '第2級': 1, '第3*級': 3, '第1*級': 1, '第4*級': 3}",4,Y,Y,N,Y
新加坡和馬來西亞曾在一九六0年代初期短暫共組聯邦，兩國迄今仍維持緊密互賴關係，馬來西亞提供新加坡大部分用水及成千上萬工人，新加坡企業則對馬來西亞產業進行大量投資。,新加坡 和 馬來西亞 曾 在 一九六0年代 初期 短暫 共組 聯邦 兩 國 迄 今 仍 維持 緊密 互賴 關係 馬來西亞 提供 新加坡 大部分 用水 及 成千上萬 工人 新加坡 企業 則 對 馬來西亞 產業 進行 大量 投資,36,新加坡(5228) 和(1338337) 馬來西亞(2504) 曾(132981) 在(3284238) 一九六0年代(Unknown) 初期(11598) 短暫(8065) 共組(166) 聯邦(6246) 兩(526190) 國(73377) 迄(3998) 今(33635) 仍(92056) 維持(31284) 緊密(5675) 互賴(258) 關係(162883) 馬來西亞(2504) 提供(73097) 新加坡(5228) 大部分(32534) 用水(1431) 及(304586) 成千上萬(1887) 工人(13089) 新加坡(5228) 企業(65457) 則(254096) 對(897964) 馬來西亞(2504) 產業(29756) 進行(100298) 大量(28414) 投資(38191),"{'High': 35, 'Low': 1}","{'第5級': 13, 'Unknown': 8, '第4級': 2, '第1*級': 1, '第6級': 3, '第1級': 3, '第3級': 1, '第4*級': 4, '第3*級': 1}",9,Y,Y,N,N
新加坡企業則對馬來西亞產業進行大量投資。,新加坡 企業 則 對 馬來西亞 產業 進行 大量 投資,9,新加坡(5228) 企業(65457) 則(254096) 對(897964) 馬來西亞(2504) 產業(29756) 進行(100298) 大量(28414) 投資(38191),{'High': 9},"{'第5級': 5, '第4*級': 3, '第1級': 1}",2,Y,N,N,N
針對國民黨黨營事業裕台企業對北韓貿易近三十億元債款的追償問題，黨管會主委劉泰英昨日表示，目前還剩下大約五、六億元的債款要追償，北韓貿易希望用平壤飯店來抵債，黨管會正在評估其可行性；另外，遠東航空則計劃開闢台北平壤航線，發展北韓觀光事業。,針對 國民黨 黨營 事業 裕台 企業 對 北韓 貿易 近 三十億 元 債款 的 追償 問題 黨管會 主委 劉泰英 昨日 表示 目前 還 剩下 大約 五 六億 元 的 債款 要 追償 北韓 貿易 希望 用 平壤 飯店 來 抵債 黨管會 正在 評估 其 可行性 另外 遠東 航空 則 計劃 開闢 台北 平壤 航線 發展 北韓 觀光 事業,58,針對(23174) 國民黨(11621) 黨營(437) 事業(32957) 裕台(1) 企業(65457) 對(897964) 北韓(612) 貿易(16952) 近(43555) 三十億(273) 元(60807) 債款(83) 的(16029838) 追償(10) 問題(280782) 黨管會(Unknown) 主委(1067) 劉泰英(30) 昨日(2036) 表示(74452) 目前(48695) 還(625086) 剩下(16442) 大約(27064) 五(112649) 六億(208) 元(60807) 的(16029838) 債款(83) 要(851264) 追償(10) 北韓(612) 貿易(16952) 希望(119975) 用(377038) 平壤(515) 飯店(9669) 來(742183) 抵債(20) 黨管會(Unknown) 正在(54336) 評估(16292) 其(307905) 可行性(990) 另外(48233) 遠東(1905) 航空(4707) 則(254096) 計劃(22462) 開闢(2108) 台北(22242) 平壤(515) 航線(1424) 發展(117494) 北韓(612) 觀光(4478) 事業(32957),"{'High': 49, 'Low': 9}","{'第6級': 3, 'Unknown': 24, '第4*級': 7, '第1級': 10, '第2級': 3, '第5級': 4, '第4級': 4, '第2*級': 1, '第3級': 1, '第7級': 1}",6,Y,Y,N,Y
此外，黨營事業目前不僅準備出售中央日報大樓，劉泰英昨日表示，中廣位於仁愛路的五千坪辦公大樓也考慮要賣出，未來黨管會將陸續把黨營事業位於都市精華區的土地，盡可能的開發利用，這將是黨營文化事業提高營運績效的方法之一。,此外 黨營 事業 目前 不僅 準備 出售 中央日報 大樓 劉泰英 昨日 表示 中廣 位於 仁愛路 的 五千 坪 辦公 大樓 也 考慮 要 賣出 未來 黨管會 將 陸續 把 黨營 事業 位於 都市 精華區 的 土地 盡可能 的 開發 利用 這 將 是 黨營 文化 事業 提高 營運 績效 的 方法 之 一,53,此外(30247) 黨營(437) 事業(32957) 目前(48695) 不僅(43138) 準備(64901) 出售(3719) 中央日報(755) 大樓(7532) 劉泰英(30) 昨日(2036) 表示(74452) 中廣(400) 位於(19612) 仁愛路(139) 的(16029838) 五千(4916) 坪(2297) 辦公(2711) 大樓(7532) 也(1590760) 考慮(28774) 要(851264) 賣出(3070) 未來(54445) 黨管會(Unknown) 將(448374) 陸續(7091) 把(617773) 黨營(437) 事業(32957) 位於(19612) 都市(9548) 精華區(29) 的(16029838) 土地(32151) 盡可能(7447) 的(16029838) 開發(19196) 利用(49229) 這(2114032) 將(448374) 是(4642407) 黨營(437) 文化(115697) 事業(32957) 提高(19797) 營運(5641) 績效(6013) 的(16029838) 方法(99064) 之(875481) 一(3701681),"{'High': 50, 'Low': 3}","{'第5級': 10, 'Unknown': 13, '第4*級': 5, '第4級': 5, '第2級': 4, '第6級': 4, '第2*級': 2, '第1級': 9, '第3*級': 1}",6,Y,Y,N,Y
有關今年四月底爆發黨營事業裕台貿易部經理劉振憶涉嫌與其弟劉振強勾結廠商，以偽造信用狀詐騙裕台自北韓購買鋁錠等價值五千萬美元以上的原物料後，再轉由香港運往大陸轉手圖利。,有關 今年 四月 底 爆發 黨營 事業 裕台 貿易 部經理 劉振憶 涉嫌 與 其 弟 劉振強 勾結 廠商 以 偽造 信用狀 詐騙 裕台 自 北韓 購買 鋁錠 等 價值 五千萬 美元 以上 的 原物料 後 再 轉 由 香港 運往 大陸 轉手 圖利,43,有關(69607) 今年(10836) 四月(14996) 底(37174) 爆發(11071) 黨營(437) 事業(32957) 裕台(1) 貿易(16952) 部經理(Unknown) 劉振憶(Unknown) 涉嫌(2037) 與(968432) 其(307905) 弟(3543) 劉振強(1) 勾結(1961) 廠商(8879) 以(547785) 偽造(1809) 信用狀(98) 詐騙(890) 裕台(1) 自(59676) 北韓(612) 購買(14998) 鋁錠(7) 等(327380) 價值(58784) 五千萬(653) 美元(27307) 以上(36569) 的(16029838) 原物料(97) 後(422857) 再(326207) 轉(20108) 由(208604) 香港(46937) 運往(770) 大陸(27031) 轉手(500) 圖利(399),"{'High': 35, 'Low': 8}","{'第4級': 3, '第1級': 4, 'Unknown': 16, '第3*級': 4, '第5級': 5, '第4*級': 5, '第7級': 2, '第6級': 3, '第1*級': 1}",6,Y,Y,N,Y
調查單位認為劉氏兄弟涉嫌背信以及偽造有價證券，已將劉振憶移送台北地檢署偵辦，其弟劉振強則潛逃國外。,調查 單位 認為 劉氏 兄弟 涉嫌 背信 以及 偽造 有價證券 已 將 劉振憶 移送 台北 地檢署 偵辦 其 弟 劉振強 則 潛逃 國外,23,調查(34821) 單位(23148) 認為(192030) 劉氏(938) 兄弟(28517) 涉嫌(2037) 背信(423) 以及(155624) 偽造(1809) 有價證券(643) 已(215610) 將(448374) 劉振憶(Unknown) 移送(325) 台北(22242) 地檢署(52) 偵辦(354) 其(307905) 弟(3543) 劉振強(1) 則(254096) 潛逃(567) 國外(8646),"{'High': 20, 'Low': 3}","{'第4*級': 1, '第5級': 4, '第2級': 1, 'Unknown': 9, '第3級': 2, '第7級': 1, '第6級': 3, '第1級': 1, '第4級': 1}",4,Y,Y,N,Y
劉泰英表示，四月底發生裕台與北韓貿易帳目出現問題之事後，已經將高層主管全面撤換，並追究前裕台貿易部經理劉振憶和相關人士之法律責任，另外也委託港台貿易負責人馬愛珍尋求北韓對應管道進行處理。,劉泰英 表示 四月 底 發生 裕台 與 北韓 貿易 帳目 出現 問題 之 事 後 已經 將 高層 主管 全面 撤換 並 追究 前 裕台 貿易 部經理 劉振憶 和 相關 人士 之 法律 責任 另外 也 委託 港 台 貿易 負責人 馬愛珍 尋求 北韓 對應 管道 進行 處理,48,劉泰英(30) 表示(74452) 四月(14996) 底(37174) 發生(129211) 裕台(1) 與(968432) 北韓(612) 貿易(16952) 帳目(541) 出現(124694) 問題(280782) 之(875481) 事(385949) 後(422857) 已經(245160) 將(448374) 高層(6030) 主管(23448) 全面(10364) 撤換(446) 並(442790) 追究(2812) 前(272709) 裕台(1) 貿易(16952) 部經理(Unknown) 劉振憶(Unknown) 和(1338337) 相關(41599) 人士(27666) 之(875481) 法律(27914) 責任(29747) 另外(48233) 也(1590760) 委託(4647) 港(8553) 台(29325) 貿易(16952) 負責人(3840) 馬愛珍(Unknown) 尋求(14747) 北韓(612) 對應(5497) 管道(7455) 進行(100298) 處理(61797),"{'Low': 6, 'High': 42}","{'Unknown': 12, '第4*級': 9, '第3*級': 2, '第3級': 2, '第7級': 1, '第4級': 2, '第1級': 4, '第5級': 10, '第1*級': 1, '第2級': 2, '第6級': 3}",5,Y,Y,N,Y
裕台與北韓的貿易模式多維持「以物易物」的方式，由我方提供稻米等食糧，交換北韓的鋁錠或鋼鐵等貨品。,裕台 與 北韓 的 貿易 模式 多 維持 以物易物 的 方式 由 我方 提供 稻米 等 食糧 交換 北韓 的 鋁錠 或 鋼鐵 等 貨品,25,裕台(1) 與(968432) 北韓(612) 的(16029838) 貿易(16952) 模式(35179) 多(318992) 維持(31284) 以物易物(Unknown) 的(16029838) 方式(133407) 由(208604) 我方(2486) 提供(73097) 稻米(1447) 等(327380) 食糧(668) 交換(11543) 北韓(612) 的(16029838) 鋁錠(7) 或(478077) 鋼鐵(2695) 等(327380) 貨品(1235),"{'Low': 3, 'High': 22}","{'Unknown': 8, '第4*級': 5, '第1級': 4, '第6級': 1, '第5級': 1, '第7級': 2, '第3*級': 2, '第4級': 1, '第3級': 1}",1,Y,Y,N,Y
而這次北韓交付的貨品一度還傳出因為水災有所延宕，不過事後發現該批貨品已如數運往香港後，再被轉往大陸。,而 這 次 北韓 交付 的 貨品 一度 還 傳出 因為 水災 有所 延宕 不過 事 後 發現 該 批 貨品 已 如數 運往 香港 後 再 被 轉往 大陸,30,而(937923) 這(2114032) 次(331701) 北韓(612) 交付(1533) 的(16029838) 貨品(1235) 一度(5292) 還(625086) 傳出(4421) 因為(425061) 水災(1025) 有所(14564) 延宕(686) 不過(186226) 事(385949) 後(422857) 發現(175233) 該(148369) 批(22121) 貨品(1235) 已(215610) 如數(261) 運往(770) 香港(46937) 後(422857) 再(326207) 被(540683) 轉往(1086) 大陸(27031),{'High': 30},"{'第5級': 3, '第1級': 4, '第2級': 4, 'Unknown': 9, '第6級': 3, '第1*級': 3, '第7級': 1, '第4*級': 1, '第3級': 1, '第3*級': 1}",0,Y,Y,N,N
不過，北韓方面一直希望劉泰英能夠親赴北韓處理相關事宜，然劉泰英的身分實屬敏感，且北韓的一舉一動也受到南韓、中共甚至美國的高度關注。,不過 北韓 方面 一直 希望 劉泰英 能夠 親赴 北韓 處理 相關 事宜 然 劉泰英 的 身分 實 屬 敏感 且 北韓 的 一舉一動 也 受到 南韓 中共 甚至 美國 的 高度 關注,32,不過(186226) 北韓(612) 方面(75079) 一直(119877) 希望(119975) 劉泰英(30) 能夠(96422) 親赴(322) 北韓(612) 處理(61797) 相關(41599) 事宜(3374) 然(6771) 劉泰英(30) 的(16029838) 身分(22196) 實(17029) 屬(26012) 敏感(12359) 且(67015) 北韓(612) 的(16029838) 一舉一動(1577) 也(1590760) 受到(66513) 南韓(2210) 中共(19399) 甚至(122502) 美國(148299) 的(16029838) 高度(20229) 關注(11722),"{'High': 30, 'Low': 2}","{'第2級': 3, 'Unknown': 12, '第3*級': 1, '第4*級': 4, '第6級': 2, '第1級': 5, '第5級': 3, '第3級': 1, '第4級': 1}",3,Y,Y,N,Y
劉泰英表示，若是赴北韓能夠將事情解決倒還好，不過因為牽涉國際外交，例如美國必須維護台海安全的前提，去北韓與否也必須尊重美國的看法。,劉泰英 表示 若是 赴 北韓 能夠 將 事情 解決 倒 還好 不過 因為 牽涉 國際 外交 例如 美國 必須 維護 台海 安全 的 前提 去 北韓 與否 也 必須 尊重 美國 的 看法,33,劉泰英(30) 表示(74452) 若是(17210) 赴(12878) 北韓(612) 能夠(96422) 將(448374) 事情(112079) 解決(55725) 倒(40381) 還好(6789) 不過(186226) 因為(425061) 牽涉(1915) 國際(40846) 外交(8916) 例如(72240) 美國(148299) 必須(170592) 維護(8695) 台海(587) 安全(35338) 的(16029838) 前提(7134) 去(479993) 北韓(612) 與否(4610) 也(1590760) 必須(170592) 尊重(18394) 美國(148299) 的(16029838) 看法(30115),"{'Low': 1, 'High': 32}","{'Unknown': 7, '第4*級': 2, '第6級': 3, '第5級': 4, '第2級': 2, '第4級': 2, '第3級': 4, '第1*級': 1, '第3*級': 2, '第1級': 6}",1,Y,Y,N,Y
去北韓與否也必須尊重美國的看法。,去 北韓 與否 也 必須 尊重 美國 的 看法,9,去(479993) 北韓(612) 與否(4610) 也(1590760) 必須(170592) 尊重(18394) 美國(148299) 的(16029838) 看法(30115),{'High': 9},"{'第1級': 4, 'Unknown': 2, '第3級': 1, '第5級': 1, '第3*級': 1}",0,Y,N,N,N
經過一天的折衝，中共有關方面與林滴娟家屬就是否解剖林滴娟遺體部分，仍無進展，也未取得共識。,經過 一 天 的 折衝 中共 有關 方面 與 林滴娟 家屬 就 是否 解剖 林滴娟 遺體 部分 仍 無 進展 也 未 取得 共識,24,經過(64617) 一(3701681) 天(330413) 的(16029838) 折衝(349) 中共(19399) 有關(69607) 方面(75079) 與(968432) 林滴娟(Unknown) 家屬(4509) 就(1737544) 是否(78907) 解剖(1967) 林滴娟(Unknown) 遺體(2196) 部分(82518) 仍(92056) 無(157858) 進展(8629) 也(1590760) 未(101927) 取得(25649) 共識(6750),"{'High': 22, 'Low': 2}","{'第2級': 2, '第1級': 5, 'Unknown': 4, '第4級': 2, '第3*級': 1, '第4*級': 1, '第5級': 6, '第7級': 1, '第6級': 2}",2,Y,Y,N,Y
大陸方面表示，暫時不會強行解剖，但解剖勢在必行，也準備繼續與林滴娟家屬懇談溝通；而林滴娟家屬對於林滴娟遇害感到無奈，林父已傾向接受最後被解剖的可能事實，遺體接運返台的行程也將因此延後。,大陸 方面 表示 暫時 不會 強行 解剖 但 解剖 勢在必行 也 準備 繼續 與 林滴娟 家屬 懇談 溝通 而 林滴娟 家屬 對於 林滴娟 遇害 感到 無奈 林 父 已 傾向 接受 最後 被 解剖 的 可能 事實 遺體 接運 返台 的 行程 也 將 因此 延後,46,大陸(27031) 方面(75079) 表示(74452) 暫時(14976) 不會(173045) 強行(2494) 解剖(1967) 但(597124) 解剖(1967) 勢在必行(291) 也(1590760) 準備(64901) 繼續(80649) 與(968432) 林滴娟(Unknown) 家屬(4509) 懇談(163) 溝通(31533) 而(937923) 林滴娟(Unknown) 家屬(4509) 對於(99570) 林滴娟(Unknown) 遇害(1177) 感到(74094) 無奈(8144) 林(10268) 父(12251) 已(215610) 傾向(14029) 接受(84729) 最後(142102) 被(540683) 解剖(1967) 的(16029838) 可能(271025) 事實(84995) 遺體(2196) 接運(38) 返台(650) 的(16029838) 行程(5276) 也(1590760) 將(448374) 因此(184606) 延後(1230),"{'High': 42, 'Low': 4}","{'第3*級': 2, '第4*級': 5, 'Unknown': 9, '第6級': 5, '第7級': 3, '第2級': 4, '第1級': 5, '第4級': 5, '第5級': 7, '第3級': 1}",4,Y,Y,N,Y
有關是否解剖林滴娟遺體部分，大陸方面經過多次溝通後，認為仍要經由解剖才能得到答案，林家很不諒解。,有關 是否 解剖 林滴娟 遺體 部分 大陸 方面 經過 多 次 溝通 後 認為 仍 要 經由 解剖 才 能 得到 答案 林家 很 不 諒解,26,有關(69607) 是否(78907) 解剖(1967) 林滴娟(Unknown) 遺體(2196) 部分(82518) 大陸(27031) 方面(75079) 經過(64617) 多(318992) 次(331701) 溝通(31533) 後(422857) 認為(192030) 仍(92056) 要(851264) 經由(14759) 解剖(1967) 才(394539) 能(582260) 得到(84614) 答案(29628) 林家(1030) 很(715675) 不(2282521) 諒解(2165),"{'High': 25, 'Low': 1}","{'第4級': 3, '第5級': 2, '第7級': 2, 'Unknown': 2, '第6級': 2, '第2級': 5, '第3*級': 4, '第1級': 5, '第1*級': 1}",1,Y,N,N,Y
透過鞍山市法友會會長王玉琴的說明後，林滴娟的父親以後段路程仍須中方全力協助，在顧全大局下，雖然極度的不願意，但對解剖有心理準備，他表示，將會在適當時機，表達對此事的立場。,透過 鞍山市 法友會 會長 王玉琴 的 說明 後 林滴娟 的 父親 以 後段 路程 仍 須 中方 全力 協助 在 顧全 大局 下 雖然 極度 的 不 願意 但 對 解剖 有 心理 準備 他 表示 將 會 在 適當 時機 表達 對 此 事 的 立場,47,透過(63117) 鞍山市(13) 法友會(Unknown) 會長(3381) 王玉琴(Unknown) 的(16029838) 說明(52918) 後(422857) 林滴娟(Unknown) 的(16029838) 父親(86472) 以(547785) 後段(423) 路程(2648) 仍(92056) 須(17260) 中方(1618) 全力(4329) 協助(28701) 在(3284238) 顧全(464) 大局(1976) 下(329549) 雖然(152988) 極度(6497) 的(16029838) 不(2282521) 願意(48894) 但(597124) 對(897964) 解剖(1967) 有(2217079) 心理(59538) 準備(64901) 他(2487930) 表示(74452) 將(448374) 會(1014977) 在(3284238) 適當(17983) 時機(11280) 表達(34582) 對(897964) 此(288458) 事(385949) 的(16029838) 立場(17198),"{'High': 43, 'Low': 4}","{'第5級': 7, 'Unknown': 9, '第1級': 10, '第4級': 2, '第3級': 2, '第6級': 3, '第4*級': 4, '第1*級': 5, '第2級': 4, '第7級': 1}",4,Y,Y,N,Y
對於解剖以求確知林滴娟死因真相的問題，遼寧省級公安主任法醫師專程工商時報駐鎮海城，與家屬代表台灣的律師意外頻傳台商中時晚報高宗良溝通，無法取得家屬的同意，溝通協商由原訂的上午九時開始就無法順利進行，直到晚上七時卅分，中方由鞍山市法友會會長王玉琴公開說明，強調解剖的理由後，導致林滴娟家屬退讓。,對於 解剖 以 求 確知 林滴娟 死因 真相 的 問題 遼寧 省級 公安 主任 法醫師 專程 工商時報 駐 鎮海城 與 家屬 代表 台灣 的 律師 意外 頻傳 台商 中時晚報 高宗良 溝通 無法 取得 家屬 的 同意 溝通 協商 由 原訂 的 上午 九時 開始 就 無法 順利 進行 直到 晚上 七時 卅分 中方 由 鞍山市 法友會 會長 王玉琴 公開 說明 強調 解剖 的 理由 後 導致 林滴娟 家屬 退讓,69,對於(99570) 解剖(1967) 以(547785) 求(30359) 確知(1094) 林滴娟(Unknown) 死因(1427) 真相(13952) 的(16029838) 問題(280782) 遼寧(1427) 省級(508) 公安(962) 主任(13859) 法醫師(Unknown) 專程(1372) 工商時報(227) 駐(9170) 鎮海城(3) 與(968432) 家屬(4509) 代表(58333) 台灣(130718) 的(16029838) 律師(16602) 意外(21631) 頻傳(294) 台商(903) 中時晚報(259) 高宗良(Unknown) 溝通(31533) 無法(150606) 取得(25649) 家屬(4509) 的(16029838) 同意(30620) 溝通(31533) 協商(2919) 由(208604) 原訂(311) 的(16029838) 上午(6241) 九時(372) 開始(245562) 就(1737544) 無法(150606) 順利(17708) 進行(100298) 直到(41624) 晚上(42206) 七時(275) 卅分(29) 中方(1618) 由(208604) 鞍山市(13) 法友會(Unknown) 會長(3381) 王玉琴(Unknown) 公開(19118) 說明(52918) 強調(36095) 解剖(1967) 的(16029838) 理由(32460) 後(422857) 導致(30222) 林滴娟(Unknown) 家屬(4509) 退讓(1176),"{'High': 60, 'Low': 9}","{'第5級': 11, '第7級': 2, '第4*級': 6, 'Unknown': 23, '第1級': 11, '第4級': 9, '第6級': 5, '第3級': 1, '第2級': 1}",10,Y,N,N,Y
