sentence,sentence_preprocessed,sentence_length,word_freq,high_low_freq,word_level,long_word_count,is_complete_sentence,is_complete_context,is_blacklist,is_greylist
范振宗因不具激進意識型態，也不會對若干敏感政治問題主動表態，或以抗爭方式凸顯問題，行政院政務委員吳伯雄即曾讚譽范振宗不做無謂的意識型態抗爭，民進黨內死忠黨員則或嫌范振宗太不夠味道，但事實上范振宗既不具激進的意識型態，當然不做意識抗爭，更不願因主動對政治敏感事件發言不慎，而得罪當道或同黨同志。,范振宗 因 不 具 激進 意識 型態 也 不會 對 若干 敏感 政治 問題 主動 表態 或 以 抗爭 方式 凸顯 問題 行政院 政務 委員 吳伯雄 即 曾 讚譽 范振宗 不 做 無謂 的 意識 型態 抗爭 民進黨 內 死忠 黨員 則 或 嫌 范振宗 太 不 夠 味道 但 事實 上 范振宗 既 不 具 激進 的 意識 型態 當然 不 做 意識 抗爭 更 不 願 因 主動 對 政治 敏感 事件 發言 不慎 而 得罪 當道 或 同 黨 同志,83,范振宗(10) 因(119364) 不(2282521) 具(41661) 激進(3197) 意識(49648) 型態(12319) 也(1590760) 不會(173045) 對(897964) 若干(7105) 敏感(12359) 政治(79504) 問題(280782) 主動(18624) 表態(1714) 或(478077) 以(547785) 抗爭(3194) 方式(133407) 凸顯(2676) 問題(280782) 行政院(4347) 政務(2792) 委員(10662) 吳伯雄(62) 即(110826) 曾(132981) 讚譽(844) 范振宗(10) 不(2282521) 做(411649) 無謂(1506) 的(16029838) 意識(49648) 型態(12319) 抗爭(3194) 民進黨(2844) 內(183051) 死忠(196) 黨員(2182) 則(254096) 或(478077) 嫌(7613) 范振宗(10) 太(181732) 不(2282521) 夠(49042) 味道(14200) 但(597124) 事實(84995) 上(1233218) 范振宗(10) 既(43838) 不(2282521) 具(41661) 激進(3197) 的(16029838) 意識(49648) 型態(12319) 當然(113971) 不(2282521) 做(411649) 意識(49648) 抗爭(3194) 更(361676) 不(2282521) 願(30213) 因(119364) 主動(18624) 對(897964) 政治(79504) 敏感(12359) 事件(59059) 發言(5623) 不慎(1590) 而(937923) 得罪(3898) 當道(537) 或(478077) 同(102917) 黨(23312) 同志(7372),"{'Low': 5, 'High': 78}","{'Unknown': 18, '第1級': 17, '第6級': 16, '第5級': 15, '第4級': 4, '第4*級': 3, '第3級': 4, '第7級': 2, '第1*級': 1, '第2級': 3}",7,Y,Y,N,Y
但是范振宗以其所具的傳統農家保守作風，卻仍然不能免於捲入地方派系的糾紛，縣府一級主管曾對地方建設受困於派系因素，公開挑明了講，單位主管成為派系紛爭的夾心餅干，左右為難。,但是 范振宗 以 其 所 具 的 傳統 農家 保守 作風 卻 仍然 不能 免於 捲入 地方 派系 的 糾紛 縣府 一 級 主管 曾 對 地方 建設 受困 於 派系 因素 公開 挑明 了 講 單位 主管 成為 派系 紛爭 的 夾心 餅干 左右為難,45,但是(247988) 范振宗(10) 以(547785) 其(307905) 所(527327) 具(41661) 的(16029838) 傳統(60517) 農家(2130) 保守(6702) 作風(4966) 卻(333007) 仍然(46200) 不能(162852) 免於(3101) 捲入(2706) 地方(139164) 派系(1834) 的(16029838) 糾紛(2814) 縣府(572) 一(3701681) 級(11106) 主管(23448) 曾(132981) 對(897964) 地方(139164) 建設(11627) 受困(627) 於(327210) 派系(1834) 因素(34409) 公開(19118) 挑明(323) 了(3199291) 講(70027) 單位(23148) 主管(23448) 成為(143834) 派系(1834) 紛爭(2234) 的(16029838) 夾心(205) 餅干(46) 左右為難(518),"{'High': 43, 'Low': 2}","{'第2級': 3, 'Unknown': 8, '第5級': 8, '第6級': 10, '第1級': 5, '第3級': 1, '第4級': 4, '第1*級': 2, '第4*級': 4}",2,Y,Y,N,Y
但熟悉官場運作，並且擅於使用官場語言的范振宗，並不認為自己無法擺平派系問題。,但 熟悉 官場 運作 並且 擅於 使用 官場 語言 的 范振宗 並 不 認為 自己 無法 擺平 派系 問題,19,但(597124) 熟悉(20265) 官場(4333) 運作(23209) 並且(60996) 擅於(976) 使用(99640) 官場(4333) 語言(49871) 的(16029838) 范振宗(10) 並(442790) 不(2282521) 認為(192030) 自己(744739) 無法(150606) 擺平(630) 派系(1834) 問題(280782),"{'High': 18, 'Low': 1}","{'第2級': 3, '第4*級': 2, '第6級': 4, '第4級': 2, '第7級': 1, '第1級': 3, 'Unknown': 2, '第1*級': 1, '第5級': 1}",1,Y,Y,N,Y
范振宗的當選憑藉，並非來自民進黨內的支持，他也不願過於凸顯自己的民進黨籍身份，對於黨內事務的參與程度遠遜於地方上的紅白事，游離於民進黨邊緣的他，如果不能遊走在地方派系之間，保持平衡，退不退出民進黨對他爭取連任，並不具實質意義。,范振宗 的 當選 憑藉 並 非 來自 民進黨 內 的 支持 他 也 不 願 過於 凸顯 自己 的 民進黨籍 身份 對於 黨 內 事務 的 參與 程度 遠 遜於 地方 上 的 紅 白 事 游離 於 民進黨 邊緣 的 他 如果 不能 遊走 在 地方 派系 之間 保持 平衡 退不退出 民進黨 對 他 爭取 連任 並 不 具 實質 意義,62,范振宗(10) 的(16029838) 當選(3469) 憑藉(3142) 並(442790) 非(112415) 來自(41811) 民進黨(2844) 內(183051) 的(16029838) 支持(42489) 他(2487930) 也(1590760) 不(2282521) 願(30213) 過於(10507) 凸顯(2676) 自己(744739) 的(16029838) 民進黨籍(45) 身份(6435) 對於(99570) 黨(23312) 內(183051) 事務(12270) 的(16029838) 參與(40595) 程度(43988) 遠(57546) 遜於(369) 地方(139164) 上(1233218) 的(16029838) 紅(34717) 白(50836) 事(385949) 游離(673) 於(327210) 民進黨(2844) 邊緣(10706) 的(16029838) 他(2487930) 如果(322121) 不能(162852) 遊走(1459) 在(3284238) 地方(139164) 派系(1834) 之間(117932) 保持(39415) 平衡(18456) 退不退出(Unknown) 民進黨(2844) 對(897964) 他(2487930) 爭取(9666) 連任(1161) 並(442790) 不(2282521) 具(41661) 實質(7958) 意義(71714),"{'Low': 3, 'High': 59}","{'Unknown': 10, '第1級': 14, '第5級': 11, '第6級': 7, '第4*級': 4, '第4級': 3, '第3級': 2, '第1*級': 7, '第3*級': 1, '第2級': 2, '第7級': 1}",6,Y,Y,N,Y
苗栗縣都市發展計畫，由國立成功大學都市計畫研究所規劃完成，首次規劃的發展藍圖，經苗栗縣政府及各有關業務單位進行交換意見後，認為多處不切實際。,苗栗縣 都市 發展 計畫 由 國立 成功 大學 都市 計畫 研究所 規劃 完成 首 次 規劃 的 發展 藍圖 經 苗栗縣 政府 及 各 有關 業務 單位 進行 交換 意見 後 認為 多 處 不切實際,35,苗栗縣(424) 都市(9548) 發展(117494) 計畫(54820) 由(208604) 國立(5098) 成功(80266) 大學(83893) 都市(9548) 計畫(54820) 研究所(12287) 規劃(14663) 完成(60471) 首(44848) 次(331701) 規劃(14663) 的(16029838) 發展(117494) 藍圖(2053) 經(38471) 苗栗縣(424) 政府(92663) 及(304586) 各(243023) 有關(69607) 業務(15620) 單位(23148) 進行(100298) 交換(11543) 意見(34740) 後(422857) 認為(192030) 多(318992) 處(84410) 不切實際(1852),{'High': 35},"{'Unknown': 4, '第4級': 8, '第2級': 5, '第4*級': 4, '第5級': 4, '第3*級': 2, '第1級': 4, '第6級': 4}",4,Y,Y,N,N
成功大學都市計畫研究所，已經根據縣府等有關單位提出的意見，作適當的修正，並且將於近期內再度集會研討。,成功 大學 都市 計畫 研究所 已經 根據 縣府 等 有關 單位 提出 的 意見 作 適當 的 修正 並且 將 於 近期 內 再度 集會 研討,26,成功(80266) 大學(83893) 都市(9548) 計畫(54820) 研究所(12287) 已經(245160) 根據(51908) 縣府(572) 等(327380) 有關(69607) 單位(23148) 提出(63073) 的(16029838) 意見(34740) 作(78184) 適當(17983) 的(16029838) 修正(8173) 並且(60996) 將(448374) 於(327210) 近期(1640) 內(183051) 再度(22234) 集會(2539) 研討(1052),{'High': 26},"{'第3*級': 3, '第1級': 3, '第4級': 4, '第2級': 2, '第4*級': 2, 'Unknown': 5, '第5級': 5, '第3級': 1, '第6級': 1}",1,Y,Y,N,N
苗栗縣都市發展計畫，在執行的過程中，面臨很多的困難，甚至發生難以執行的情形，究其原因不外兩點，其一是苗栗縣都市發展現況，存在著很多的缺失，其二是現行都市計畫的法令不周延。,苗栗縣 都市 發展 計畫 在 執行 的 過程 中 面臨 很多 的 困難 甚至 發生 難以 執行 的 情形 究 其 原因 不外 兩 點 其 一 是 苗栗縣 都市 發展 現況 存在 著 很多 的 缺失 其 二 是 現行 都市 計畫 的 法令 不 周延,47,苗栗縣(424) 都市(9548) 發展(117494) 計畫(54820) 在(3284238) 執行(25364) 的(16029838) 過程(87889) 中(1011729) 面臨(16531) 很多(113128) 的(16029838) 困難(37504) 甚至(122502) 發生(129211) 難以(30294) 執行(25364) 的(16029838) 情形(35199) 究(2093) 其(307905) 原因(67404) 不外(1038) 兩(526190) 點(118735) 其(307905) 一(3701681) 是(4642407) 苗栗縣(424) 都市(9548) 發展(117494) 現況(2710) 存在(75197) 著(1004687) 很多(113128) 的(16029838) 缺失(3102) 其(307905) 二(152494) 是(4642407) 現行(1947) 都市(9548) 計畫(54820) 的(16029838) 法令(3996) 不(2282521) 周延(501),{'High': 47},"{'Unknown': 7, '第4級': 5, '第2級': 2, '第1*級': 1, '第5級': 7, '第1級': 12, '第3*級': 3, '第4*級': 1, '第3級': 1, '第6級': 7, '第7級': 1}",2,Y,N,N,N
成功大學都市計畫研究所初步(首次)規劃的苗栗縣都市發展計畫，由苗栗縣政府及有關單位研商後提供多點改進意見，該所已作綜合研究，並且匯集各界的意見修改完成，將於近期內再度舉行研討會研討，使苗栗縣都市發展計畫早日定案。,成功 大學 都市 計畫 研究所 初步 首 次 規劃 的 苗栗縣 都市 發展 計畫 由 苗栗縣 政府 及 有關 單位 研商 後 提供 多 點 改進 意見 該 所 已 作 綜合 研究 並且 匯集 各界 的 意見 修改 完成 將 於 近期 內 再度 舉行 研討會 研討 使 苗栗縣 都市 發展 計畫 早日 定案,55,成功(80266) 大學(83893) 都市(9548) 計畫(54820) 研究所(12287) 初步(3730) 首(44848) 次(331701) 規劃(14663) 的(16029838) 苗栗縣(424) 都市(9548) 發展(117494) 計畫(54820) 由(208604) 苗栗縣(424) 政府(92663) 及(304586) 有關(69607) 單位(23148) 研商(188) 後(422857) 提供(73097) 多(318992) 點(118735) 改進(6433) 意見(34740) 該(148369) 所(527327) 已(215610) 作(78184) 綜合(8011) 研究(182500) 並且(60996) 匯集(1360) 各界(2155) 的(16029838) 意見(34740) 修改(6592) 完成(60471) 將(448374) 於(327210) 近期(1640) 內(183051) 再度(22234) 舉行(17660) 研討會(5588) 研討(1052) 使(197544) 苗栗縣(424) 都市(9548) 發展(117494) 計畫(54820) 早日(2235) 定案(714),{'High': 55},"{'第3*級': 3, '第1級': 6, '第4級': 10, '第2級': 5, '第5級': 11, '第4*級': 5, '第6級': 1, 'Unknown': 9, '第3級': 3, '第7級': 2}",5,Y,Y,N,N
二名年輕少女劉春蘭。,二 名 年輕 少女 劉春蘭,5,二(152494) 名(136287) 年輕(48853) 少女(9457) 劉春蘭(Unknown),"{'High': 4, 'Low': 1}","{'第1級': 1, '第2級': 2, '第4*級': 1, 'Unknown': 1}",1,Y,N,N,Y
邱美枝，前天下午和晚上，皆因意外車禍不幸死亡，其家屬哀痛逾恆，值得年輕朋友引以為鑑。,邱美枝 前天 下午 和 晚上 皆 因 意外 車禍 不幸 死亡 其 家屬 哀痛 逾恆 值得 年輕 朋友 引以為鑑,19,邱美枝(Unknown) 前天(1256) 下午(20045) 和(1338337) 晚上(42206) 皆(45736) 因(119364) 意外(21631) 車禍(3541) 不幸(17433) 死亡(34520) 其(307905) 家屬(4509) 哀痛(658) 逾恆(31) 值得(34362) 年輕(48853) 朋友(101331) 引以為鑑(29),"{'Low': 3, 'High': 16}","{'Unknown': 5, '第1*級': 1, '第1級': 3, '第5級': 2, '第4級': 3, '第4*級': 2, '第6級': 1, '第7級': 1, '第2級': 1}",2,Y,Y,N,Y
劉春蘭(廿三歲。,劉春蘭 廿三 歲,3,劉春蘭(Unknown) 廿三(165) 歲(130085),"{'Low': 1, 'High': 2}","{'Unknown': 2, '第1級': 1}",1,N,N,N,Y
苗栗市人)是在廿日下午四點卅五分，搭乘朋友謝碧鳳所騎三二七0四五七號輕機車，行經龜山大橋頭時，不慎與由魏招輝所駕駛的0六三二0二三號大貨車擦撞，大貨車後輪輾過死者頭部，致劉女當場死亡，慘不忍睹。,苗栗市人 是 在 廿日 下午 四點 卅五分 搭乘 朋友 謝碧鳳 所 騎 三二七0四五七 號 輕機車 行經 龜山 大 橋頭 時 不慎 與 由 魏招輝 所 駕駛 的 0六三二0二三 號 大 貨車 擦撞 大 貨車 後 輪 輾過 死者 頭部 致 劉女 當場 死亡 慘不忍睹,44,苗栗市人(Unknown) 是(4642407) 在(3284238) 廿日(126) 下午(20045) 四點(1971) 卅五分(5) 搭乘(4116) 朋友(101331) 謝碧鳳(Unknown) 所(527327) 騎(20953) 三二七0四五七(Unknown) 號(26108) 輕機車(Unknown) 行經(1016) 龜山(302) 大(525780) 橋頭(801) 時(623734) 不慎(1590) 與(968432) 由(208604) 魏招輝(Unknown) 所(527327) 駕駛(4727) 的(16029838) 0六三二0二三(Unknown) 號(26108) 大(525780) 貨車(2205) 擦撞(168) 大(525780) 貨車(2205) 後(422857) 輪(7476) 輾過(307) 死者(6643) 頭部(5436) 致(11578) 劉女(2) 當場(6478) 死亡(34520) 慘不忍睹(700),"{'Low': 8, 'High': 36}","{'Unknown': 19, '第1級': 8, '第1*級': 1, '第5級': 6, '第2級': 3, '第3*級': 1, '第4*級': 3, '第6級': 2, '第7級': 1}",8,Y,N,N,Y
另一死者邱美枝(十七歲。,另 一 死者 邱美枝 十七 歲,6,另(138369) 一(3701681) 死者(6643) 邱美枝(Unknown) 十七(7310) 歲(130085),"{'High': 5, 'Low': 1}","{'第3級': 1, '第1級': 2, '第6級': 1, 'Unknown': 2}",1,N,N,N,Y
公館鄉人)則是在前天晚上九點十分，搭乘其兄邱富濱所騎三八三九五九八號重機車，經苗市中山路一0七0號前，因車速太快，後輪突然爆胎，致二人人仰馬翻，死者頭部嚴重受創，經送大千醫院急救，回天乏術，當天晚上，一點十分死亡。,公館鄉人 則 是 在 前天 晚上 九點 十分 搭乘 其 兄 邱富濱 所 騎 三八三九五九八 號 重機車 經 苗市 中山路 一0七0號 前 因 車速 太 快 後 輪 突然 爆胎 致 二 人 人仰馬翻 死者 頭部 嚴重 受創 經 送 大千 醫院 急救 回天乏術 當天 晚上 一點 十分 死亡,49,公館鄉人(Unknown) 則(254096) 是(4642407) 在(3284238) 前天(1256) 晚上(42206) 九點(2467) 十分(63196) 搭乘(4116) 其(307905) 兄(6617) 邱富濱(Unknown) 所(527327) 騎(20953) 三八三九五九八(Unknown) 號(26108) 重機車(3) 經(38471) 苗市(Unknown) 中山路(656) 一0七0號(Unknown) 前(272709) 因(119364) 車速(516) 太(181732) 快(116207) 後(422857) 輪(7476) 突然(69636) 爆胎(154) 致(11578) 二(152494) 人(1550512) 人仰馬翻(209) 死者(6643) 頭部(5436) 嚴重(39284) 受創(544) 經(38471) 送(32804) 大千(253) 醫院(30938) 急救(1323) 回天乏術(160) 當天(11728) 晚上(42206) 一點(90745) 十分(63196) 死亡(34520),"{'Low': 6, 'High': 43}","{'Unknown': 18, '第5級': 4, '第1級': 8, '第1*級': 4, '第4級': 3, '第6級': 3, '第4*級': 3, '第2級': 4, '第3*級': 1, '第7級': 1}",8,Y,Y,N,Y
二名死者家屬接獲噩耗，趕抵現場痛不欲生。,二 名 死者 家屬 接獲 噩耗 趕抵 現場 痛不欲生,9,二(152494) 名(136287) 死者(6643) 家屬(4509) 接獲(1016) 噩耗(633) 趕抵(27) 現場(15949) 痛不欲生(435),"{'High': 8, 'Low': 1}","{'第1級': 1, '第2級': 1, '第6級': 2, '第5級': 1, '第7級': 2, 'Unknown': 1, '第4*級': 1}",1,Y,N,N,N
而警方也呼籲年輕男女騎車，宜小心謹慎切勿逞一時之快，以免給自己及家人帶來不幸。,而 警方 也 呼籲 年輕 男女 騎車 宜 小心 謹慎 切勿 逞 一時 之 快 以免 給 自己 及 家人 帶來 不幸,22,而(937923) 警方(8008) 也(1590760) 呼籲(3515) 年輕(48853) 男女(14723) 騎車(1473) 宜(7123) 小心(24226) 謹慎(10119) 切勿(848) 逞(943) 一時(19906) 之(875481) 快(116207) 以免(8342) 給(240485) 自己(744739) 及(304586) 家人(30861) 帶來(40305) 不幸(17433),{'High': 22},"{'第5級': 5, 'Unknown': 4, '第1級': 2, '第6級': 1, '第2級': 2, '第7級': 2, '第4*級': 2, '第1*級': 3, '第3*級': 1}",0,Y,Y,N,N
一名卅七歲的莊姓婦人，昨天上午氣沖沖的跑到苗栗分局刑事組向警方提出告訴，她女兒被一名曾姓男子強姦，警方定近日內傳訊這名男子到案說明。,一 名 卅七 歲 的 莊姓 婦人 昨天 上午 氣沖沖 的 跑到 苗栗 分局 刑事組 向 警方 提出 告訴 她 女兒 被 一 名 曾姓 男子 強姦 警方 定 近日 內 傳訊 這 名 男子 到案 說明,37,一(3701681) 名(136287) 卅七(37) 歲(130085) 的(16029838) 莊姓(4) 婦人(6962) 昨天(12735) 上午(6241) 氣沖沖(429) 的(16029838) 跑到(12489) 苗栗(976) 分局(510) 刑事組(83) 向(231672) 警方(8008) 提出(63073) 告訴(122898) 她(1052913) 女兒(46072) 被(540683) 一(3701681) 名(136287) 曾姓(9) 男子(17448) 強姦(982) 警方(8008) 定(18743) 近日(1497) 內(183051) 傳訊(627) 這(2114032) 名(136287) 男子(17448) 到案(122) 說明(52918),"{'High': 33, 'Low': 4}","{'第1級': 10, '第2級': 5, 'Unknown': 16, '第5級': 1, '第4*級': 2, '第7級': 1, '第3級': 1, '第4級': 1}",2,Y,N,N,Y
莊婦說，她十七歲的女兒，本月七日離家出走，被曾姓男子帶回銅鑼住了三天，直到十日她才會同警方去帶回女兒。,莊婦 說 她 十七 歲 的 女兒 本 月 七日 離家 出走 被 曾姓 男子 帶回 銅鑼 住 了 三 天 直到 十日 她 才 會同 警方 去 帶回 女兒,30,莊婦(Unknown) 說(1285247) 她(1052913) 十七(7310) 歲(130085) 的(16029838) 女兒(46072) 本(197156) 月(148997) 七日(3736) 離家(4244) 出走(2669) 被(540683) 曾姓(9) 男子(17448) 帶回(6256) 銅鑼(370) 住(69815) 了(3199291) 三(313861) 天(330413) 直到(41624) 十日(3391) 她(1052913) 才(394539) 會同(1413) 警方(8008) 去(479993) 帶回(6256) 女兒(46072),"{'Low': 2, 'High': 28}","{'Unknown': 11, '第1級': 12, '第5級': 1, '第2級': 2, '第4*級': 2, '第1*級': 1, '第7級': 1}",0,Y,N,N,Y
莊姓婦人又說，她女兒回家後，行為怪異，經她逼問才說被曾姓男子強暴，她聽了後半天說不出話來，因此決定提出告訴，希望警方代她討回公道。,莊姓 婦人 又 說 她 女兒 回家 後 行為 怪異 經 她 逼 問 才 說 被 曾姓 男子 強暴 她 聽 了 後 半 天 說 不 出 話 來 因此 決定 提出 告訴 希望 警方 代 她 討回 公道,41,莊姓(4) 婦人(6962) 又(535555) 說(1285247) 她(1052913) 女兒(46072) 回家(35375) 後(422857) 行為(97450) 怪異(4550) 經(38471) 她(1052913) 逼(11503) 問(165473) 才(394539) 說(1285247) 被(540683) 曾姓(9) 男子(17448) 強暴(2518) 她(1052913) 聽(138052) 了(3199291) 後(422857) 半(80813) 天(330413) 說(1285247) 不(2282521) 出(84457) 話(148020) 來(742183) 因此(184606) 決定(101837) 提出(63073) 告訴(122898) 希望(119975) 警方(8008) 代(39507) 她(1052913) 討回(449) 公道(1568),"{'Low': 2, 'High': 39}","{'Unknown': 10, '第5級': 3, '第1*級': 2, '第1級': 17, '第6級': 1, '第2級': 4, '第4*級': 2, '第4級': 1, '第7級': 1}",0,Y,Y,N,Y
由於莊姓婦人的女兒尚未成年，因此承辦員警表示，不論雙方是否出於自願，如莊姓婦人所言屬實，曾姓男子皆須負擔刑責，因此警方已在昨天下午發出傳票，要曾姓男子近日內到案說明詳情。,由於 莊姓 婦人 的 女兒 尚未 成年 因此 承辦 員警 表示 不論 雙方 是否 出於 自願 如 莊姓 婦人 所 言 屬實 曾姓 男子 皆 須 負擔 刑責 因此 警方 已 在 昨天 下午 發出 傳票 要 曾姓 男子 近日 內 到案 說明 詳情,44,由於(88111) 莊姓(4) 婦人(6962) 的(16029838) 女兒(46072) 尚未(16593) 成年(5565) 因此(184606) 承辦(842) 員警(673) 表示(74452) 不論(28127) 雙方(22984) 是否(78907) 出於(9877) 自願(4020) 如(195069) 莊姓(4) 婦人(6962) 所(527327) 言(97691) 屬實(929) 曾姓(9) 男子(17448) 皆(45736) 須(17260) 負擔(10490) 刑責(177) 因此(184606) 警方(8008) 已(215610) 在(3284238) 昨天(12735) 下午(20045) 發出(29993) 傳票(226) 要(851264) 曾姓(9) 男子(17448) 近日(1497) 內(183051) 到案(122) 說明(52918) 詳情(1065),"{'High': 40, 'Low': 4}","{'第4*級': 9, 'Unknown': 13, '第5級': 6, '第1級': 5, '第7級': 2, '第4級': 2, '第6級': 2, '第2級': 1, '第3級': 3, '第1*級': 1}",0,Y,Y,N,Y
新竹科學園區管理局副局長童兆勤，昨天應邀到新竹縣府與縣長范振宗及部分贊成征地案業主當面商談，范振宗決定於下個月再擇期召開說明會，邀集贊成征地案業主與用地單位討論征地細節事宜。,新竹 科學園區 管理局 副局長 童兆勤 昨天 應邀到 新竹 縣府 與 縣長 范振宗 及 部分 贊成 征地案 業主 當面 商談 范振宗 決定 於 下 個 月 再 擇期 召開 說明會 邀集 贊成 征地案 業主 與 用地 單位 討論 征 地 細節 事宜,41,新竹(2736) 科學園區(301) 管理局(1619) 副局長(595) 童兆勤(Unknown) 昨天(12735) 應邀到(204) 新竹(2736) 縣府(572) 與(968432) 縣長(2523) 范振宗(10) 及(304586) 部分(82518) 贊成(5686) 征地案(Unknown) 業主(887) 當面(2903) 商談(830) 范振宗(10) 決定(101837) 於(327210) 下(329549) 個(2296574) 月(148997) 再(326207) 擇期(67) 召開(5858) 說明會(324) 邀集(426) 贊成(5686) 征地案(Unknown) 業主(887) 與(968432) 用地(917) 單位(23148) 討論(59041) 征(6506) 地(754998) 細節(15031) 事宜(3374),"{'High': 35, 'Low': 6}","{'Unknown': 21, '第1級': 3, '第4*級': 2, '第5級': 6, '第2級': 2, '第7級': 1, '第1*級': 2, '第6級': 3, '第3*級': 1}",10,Y,Y,N,Y
范振宗以科學園區征地案受阻，為任內一大憾事，並積極尋求再度征地機會，昨天邀請部分贊成征地業主與用地單位園區管理局官員當面對談。,范振宗 以 科學園區 征地案 受阻 為 任內 一 大 憾事 並 積極 尋求 再度 征 地 機會 昨天 邀請 部分 贊成 征 地 業主 與 用地 單位 園區 管理 局 官員 當面 對談,33,范振宗(10) 以(547785) 科學園區(301) 征地案(Unknown) 受阻(810) 為(761341) 任內(1319) 一(3701681) 大(525780) 憾事(373) 並(442790) 積極(24247) 尋求(14747) 再度(22234) 征(6506) 地(754998) 機會(81244) 昨天(12735) 邀請(14342) 部分(82518) 贊成(5686) 征(6506) 地(754998) 業主(887) 與(968432) 用地(917) 單位(23148) 園區(2040) 管理(54484) 局(7737) 官員(31382) 當面(2903) 對談(2137),"{'Low': 2, 'High': 31}","{'Unknown': 14, '第5級': 7, '第7級': 1, '第1級': 3, '第4*級': 5, '第2級': 2, '第4級': 1}",3,Y,Y,N,Y
范振宗說，目前連署願意被征收的面積已達二百多公頃，贊成的業主六百多人，雖然尚未達總面積的百分之八十，但有關征收的細節部分，可以儘早討論。,范振宗 說 目前 連署 願意 被 征收 的 面積 已 達 二百多 公頃 贊成 的 業主 六百多 人 雖然 尚未 達 總面積 的 百分之八十 但 有關 征收 的 細節 部分 可以 儘 早 討論,34,范振宗(10) 說(1285247) 目前(48695) 連署(271) 願意(48894) 被(540683) 征收(36) 的(16029838) 面積(6281) 已(215610) 達(25383) 二百多(673) 公頃(1142) 贊成(5686) 的(16029838) 業主(887) 六百多(307) 人(1550512) 雖然(152988) 尚未(16593) 達(25383) 總面積(332) 的(16029838) 百分之八十(951) 但(597124) 有關(69607) 征收(36) 的(16029838) 細節(15031) 部分(82518) 可以(560531) 儘(1226) 早(62038) 討論(59041),"{'Low': 3, 'High': 31}","{'Unknown': 11, '第1級': 8, '第4級': 2, '第6級': 2, '第2級': 5, '第5級': 3, '第3級': 1, '第7級': 1, '第3*級': 1}",5,Y,Y,N,Y
童兆勤在會談後表示，園區目前成長率尚有百分之十以上，以長遠眼光來看，確有需要再征收用地，但有關再征收的細節部分，還要由縣府召集業主再談。,童兆勤 在 會談 後 表示 園區 目前 成長率 尚 有 百分之十 以上 以 長遠 眼光 來 看 確 有 需要 再 征收 用地 但 有關 再 征收 的 細節 部分 還 要 由 縣府 召集 業主 再 談,38,童兆勤(Unknown) 在(3284238) 會談(3062) 後(422857) 表示(74452) 園區(2040) 目前(48695) 成長率(1362) 尚(26113) 有(2217079) 百分之十(1192) 以上(36569) 以(547785) 長遠(2941) 眼光(13910) 來(742183) 看(444691) 確(6567) 有(2217079) 需要(166793) 再(326207) 征收(36) 用地(917) 但(597124) 有關(69607) 再(326207) 征收(36) 的(16029838) 細節(15031) 部分(82518) 還(625086) 要(851264) 由(208604) 縣府(572) 召集(4315) 業主(887) 再(326207) 談(44043),"{'Low': 3, 'High': 35}","{'Unknown': 12, '第1*級': 4, '第6級': 3, '第1級': 6, '第4*級': 3, '第4級': 2, '第3*級': 2, '第5級': 3, '第2級': 3}",3,Y,Y,N,Y
反對征地的業主呂源貴則表示，獎勵投資條例的實施期限將屆滿，如果另以促進產業升級條例征地，必須再另起爐灶，但屆時反對業主仍將抗爭到底。,反對 征 地 的 業主 呂源貴 則 表示 獎勵 投資 條例 的 實施 期限 將 屆滿 如果 另 以 促進 產業 升級 條例 征 地 必須 再 另 起 爐灶 但 屆時 反對 業主 仍 將 抗爭 到 底,39,反對(26810) 征(6506) 地(754998) 的(16029838) 業主(887) 呂源貴(Unknown) 則(254096) 表示(74452) 獎勵(5345) 投資(38191) 條例(3394) 的(16029838) 實施(11851) 期限(3403) 將(448374) 屆滿(422) 如果(322121) 另(138369) 以(547785) 促進(10265) 產業(29756) 升級(1962) 條例(3394) 征(6506) 地(754998) 必須(170592) 再(326207) 另(138369) 起(96746) 爐灶(703) 但(597124) 屆時(2382) 反對(26810) 業主(887) 仍(92056) 將(448374) 抗爭(3194) 到(546906) 底(37174),"{'High': 38, 'Low': 1}","{'第4級': 3, 'Unknown': 8, '第1級': 3, '第5級': 7, '第4*級': 3, '第6級': 6, '第2級': 2, '第3級': 3, '第1*級': 1, '第3*級': 2, '第7級': 1}",1,Y,Y,N,Y
