sentence,sentence_preprocessed,sentence_length,word_freq,high_low_freq,word_level,long_word_count,is_complete_sentence,is_complete_context,is_blacklist,is_greylist
當波紋小灰蝶在覓食時，會不停的擺動後翅膀，讓一些想要捕食牠們的鳥類，誤以為後翅膀上的黑點是眼睛，而那對尾巴是觸角。,當 波紋 小 灰 蝶 在 覓食 時 會 不停 的 擺動 後 翅膀 讓 一些 想要 捕食 牠們 的 鳥類 誤以為 後 翅膀 上 的 黑 點 是 眼睛 而 那 對 尾巴 是 觸角,36,當(294625) 波紋(432) 小(318835) 灰(6994) 蝶(1643) 在(3284238) 覓食(1544) 時(623734) 會(1014977) 不停(20176) 的(16029838) 擺動(2088) 後(422857) 翅膀(7381) 讓(526314) 一些(156929) 想要(63278) 捕食(711) 牠們(28803) 的(16029838) 鳥類(2600) 誤以為(2491) 後(422857) 翅膀(7381) 上(1233218) 的(16029838) 黑(37780) 點(118735) 是(4642407) 眼睛(65022) 而(937923) 那(754138) 對(897964) 尾巴(6147) 是(4642407) 觸角(1492),{'High': 36},"{'Unknown': 10, '第1級': 12, '第5級': 5, '第1*級': 5, '第7級': 1, '第3*級': 2, '第2級': 1}",1,Y,Y,N,N
所以，在被捕食的時候，就算牠們被鳥類啄破後翅膀，仍然可以乘機逃命。,所以 在 被 捕食 的 時候 就算 牠們 被 鳥類 啄破 後 翅膀 仍然 可以 乘機 逃命,17,所以(239080) 在(3284238) 被(540683) 捕食(711) 的(16029838) 時候(199970) 就算(28034) 牠們(28803) 被(540683) 鳥類(2600) 啄破(31) 後(422857) 翅膀(7381) 仍然(46200) 可以(560531) 乘機(2132) 逃命(1508),"{'High': 16, 'Low': 1}","{'第1*級': 2, '第2級': 2, 'Unknown': 4, '第1級': 4, '第4*級': 1, '第5級': 1, '第4級': 1, '第6級': 2}",0,Y,Y,N,N
圖說：波紋小灰蝶正伸出吸管，在馬櫻丹花上吸蜜。,圖說 波紋 小 灰 蝶 正 伸出 吸管 在 馬櫻丹 花 上 吸 蜜,14,圖說(1053) 波紋(432) 小(318835) 灰(6994) 蝶(1643) 正(179334) 伸出(10389) 吸管(632) 在(3284238) 馬櫻丹(29) 花(72593) 上(1233218) 吸(8398) 蜜(2898),"{'High': 13, 'Low': 1}","{'Unknown': 8, '第1級': 2, '第5級': 1, '第3*級': 1, '第1*級': 1, '第4*級': 1}",1,Y,N,N,N
波紋小灰蝶幼蟲的顏色，和牠們所吃的植物花朵相似，藉著這種保護色來躲避天敵。,波紋 小 灰 蝶 幼蟲 的 顏色 和 牠們 所 吃 的 植物 花朵 相似 藉著 這 種 保護色 來 躲避 天敵,22,波紋(432) 小(318835) 灰(6994) 蝶(1643) 幼蟲(4765) 的(16029838) 顏色(19941) 和(1338337) 牠們(28803) 所(527327) 吃(141660) 的(16029838) 植物(19121) 花朵(5011) 相似(11921) 藉著(9285) 這(2114032) 種(701563) 保護色(235) 來(742183) 躲避(2699) 天敵(551),{'High': 22},"{'Unknown': 9, '第1級': 6, '第5級': 3, '第2級': 2, '第6級': 2}",1,Y,N,N,N
幽浮來了.哇一群幽浮！,幽浮 來 了 哇 一 群 幽浮,7,幽浮(301) 來(742183) 了(3199291) 哇(7634) 一(3701681) 群(39283) 幽浮(301),{'High': 7},"{'Unknown': 3, '第1級': 2, '第3級': 1, '第4級': 1}",0,Y,N,N,N
文水手.雷達會測出幽浮，但有時也會因為電波的混亂反射，而在螢幕上出現實際上沒有的影像，所以，一般在確認幽浮時，都必須經過雷達和肉眼的雙重證實。,文 水手 雷達 會 測出 幽浮 但 有時 也 會 因為 電波 的 混亂 反射 而 在 螢幕 上 出現 實際 上 沒有 的 影像 所以 一般 在 確認 幽浮 時 都 必須 經過 雷達 和 肉眼 的 雙重 證實,40,文(28958) 水手(3379) 雷達(947) 會(1014977) 測出(439) 幽浮(301) 但(597124) 有時(47894) 也(1590760) 會(1014977) 因為(425061) 電波(1290) 的(16029838) 混亂(11764) 反射(3520) 而(937923) 在(3284238) 螢幕(6582) 上(1233218) 出現(124694) 實際(52755) 上(1233218) 沒有(594280) 的(16029838) 影像(22328) 所以(239080) 一般(80732) 在(3284238) 確認(11862) 幽浮(301) 時(623734) 都(1125846) 必須(170592) 經過(64617) 雷達(947) 和(1338337) 肉眼(1562) 的(16029838) 雙重(4706) 證實(10978),{'High': 40},"{'第4級': 2, '第6級': 3, '第7級': 3, '第1*級': 7, 'Unknown': 5, '第2級': 2, '第1級': 8, '第5級': 5, '第4*級': 2, '第3*級': 2, '第3級': 1}",0,Y,Y,N,N
西元1952年7月的華盛頓事件就是這類事件中最有名，也最令人驚嘆的。,西元 1952年 7月 的 華盛頓 事件 就 是 這 類 事件 中 最 有名 也 最 令 人 驚嘆 的,20,西元(19393) 1952年(234) 7月(4) 的(16029838) 華盛頓(6683) 事件(59059) 就(1737544) 是(4642407) 這(2114032) 類(58191) 事件(59059) 中(1011729) 最(421680) 有名(8977) 也(1590760) 最(421680) 令(128742) 人(1550512) 驚嘆(1528) 的(16029838),"{'High': 19, 'Low': 1}","{'第4*級': 1, 'Unknown': 4, '第1級': 7, '第5級': 3, '第3*級': 1, '第1*級': 2, '第2*級': 1, '第6級': 1}",2,Y,N,N,N
在7月19日上午11點40分，華盛頓國際機場管制塔的雷達，測出華盛頓上空有5架幽浮，而附近的空軍基地也表示，在同一位置上看到了3個不明物體。,在 7月 19日 上午 11點 40分 華盛頓 國際 機場 管制塔 的 雷達 測出 華盛頓 上空 有 5 架 幽浮 而 附近 的 空軍 基地 也 表示 在 同 一 位置 上 看到 了 3 個 不明 物體,37,在(3284238) 7月(4) 19日(20) 上午(6241) 11點(7) 40分(1) 華盛頓(6683) 國際(40846) 機場(7570) 管制塔(5) 的(16029838) 雷達(947) 測出(439) 華盛頓(6683) 上空(2760) 有(2217079) 5(33754) 架(13400) 幽浮(301) 而(937923) 附近(32204) 的(16029838) 空軍(3734) 基地(6653) 也(1590760) 表示(74452) 在(3284238) 同(102917) 一(3701681) 位置(32151) 上(1233218) 看到(159419) 了(3199291) 3(51223) 個(2296574) 不明(6635) 物體(10303),"{'High': 32, 'Low': 5}","{'第1*級': 4, 'Unknown': 13, '第1級': 8, '第4級': 2, '第2*級': 1, '第7級': 1, '第6級': 2, '第5級': 4, '第4*級': 2}",6,Y,Y,N,N
這些物體最初以時速約200300公里的速度緩慢移動，但後來，其中一架卻突然以奇快無比的速度飛向北方，據估計它的速度約高達11700公里。,這些 物體 最初 以 時速 約 200300 公里 的 速度 緩慢 移動 但 後來 其中 一 架 卻 突然 以 奇 快 無比 的 速度 飛 向 北方 據 估計 它 的 速度 約 高達 11700 公里,37,這些(315113) 物體(10303) 最初(13367) 以(547785) 時速(1960) 約(47731) 200300(Unknown) 公里(16646) 的(16029838) 速度(26646) 緩慢(7289) 移動(16739) 但(597124) 後來(95618) 其中(95627) 一(3701681) 架(13400) 卻(333007) 突然(69636) 以(547785) 奇(11637) 快(116207) 無比(9025) 的(16029838) 速度(26646) 飛(20449) 向(231672) 北方(9626) 據(24392) 估計(7162) 它(316854) 的(16029838) 速度(26646) 約(47731) 高達(7931) 11700(1) 公里(16646),"{'High': 35, 'Low': 2}","{'Unknown': 6, '第5級': 6, '第4*級': 3, '第3*級': 6, '第4級': 5, '第1級': 4, '第2級': 3, '第1*級': 2, '第6級': 1, '第2*級': 1}",2,Y,Y,N,N
另外，一個空軍基地的管制塔和附近客機上的機員和旅客，也都目擊了這群幽浮，其中一架幽浮還曾追趕客機，等到黎明時分，空軍終於命令飛機起飛迎擊，但是，這群幽浮早已經消失無蹤了。,另外 一 個 空軍 基地 的 管制塔 和 附近 客機 上 的 機員 和 旅客 也 都 目擊 了 這 群 幽浮 其中 一 架 幽浮 還 曾 追趕 客機 等到 黎明 時分 空軍 終於 命令 飛機 起飛 迎擊 但是 這 群 幽浮 早 已經 消失 無蹤 了,48,另外(48233) 一(3701681) 個(2296574) 空軍(3734) 基地(6653) 的(16029838) 管制塔(5) 和(1338337) 附近(32204) 客機(542) 上(1233218) 的(16029838) 機員(74) 和(1338337) 旅客(3355) 也(1590760) 都(1125846) 目擊(2192) 了(3199291) 這(2114032) 群(39283) 幽浮(301) 其中(95627) 一(3701681) 架(13400) 幽浮(301) 還(625086) 曾(132981) 追趕(3298) 客機(542) 等到(21150) 黎明(3711) 時分(4315) 空軍(3734) 終於(59622) 命令(19874) 飛機(18598) 起飛(3036) 迎擊(658) 但是(247988) 這(2114032) 群(39283) 幽浮(301) 早(62038) 已經(245160) 消失(30223) 無蹤(1194) 了(3199291),"{'High': 46, 'Low': 2}","{'第3級': 1, '第1級': 11, '第6級': 6, '第5級': 1, 'Unknown': 15, '第1*級': 2, '第4級': 6, '第3*級': 2, '第4*級': 2, '第2級': 2}",1,Y,Y,N,N
幽浮再度造訪了華盛頓上空，這次的時間是選在夜晚9點半。,幽浮 再度 造訪 了 華盛頓 上空 這 次 的 時間 是 選 在 夜晚 9點半,15,幽浮(301) 再度(22234) 造訪(3905) 了(3199291) 華盛頓(6683) 上空(2760) 這(2114032) 次(331701) 的(16029838) 時間(213595) 是(4642407) 選(17378) 在(3284238) 夜晚(9758) 9點半(Unknown),"{'High': 14, 'Low': 1}","{'Unknown': 4, '第5級': 1, '第6級': 2, '第1級': 4, '第2級': 1, '第3級': 1, '第1*級': 1, '第3*級': 1}",2,Y,N,N,N
午夜2點40分在確定周圍的客機都已經離去後，兩架F94型的噴射戰鬥機起飛迎擊幽浮。,午夜 2點 40分 在 確定 周圍 的 客機 都 已經 離去 後 兩 架 F94型 的 噴射 戰鬥機 起飛 迎擊 幽浮,21,午夜(2647) 2點(15) 40分(1) 在(3284238) 確定(40181) 周圍(15078) 的(16029838) 客機(542) 都(1125846) 已經(245160) 離去(8931) 後(422857) 兩(526190) 架(13400) F94型(Unknown) 的(16029838) 噴射(900) 戰鬥機(841) 起飛(3036) 迎擊(658) 幽浮(301),"{'High': 18, 'Low': 3}","{'第5級': 1, 'Unknown': 8, '第1*級': 1, '第4級': 3, '第4*級': 1, '第1級': 5, '第2級': 1, '第7級': 1}",3,Y,N,N,N
但是，經驗中每當戰鬥機靠近，幽浮的影像便會從雷達的螢幕上消失，而飛機在附近盤旋了20分鐘後，一離開，幽浮就又出現了。,但是 經驗 中 每 當 戰鬥機 靠近 幽浮 的 影像 便 會 從 雷達 的 螢幕 上 消失 而 飛機 在 附近 盤旋 了 20 分鐘 後 一 離開 幽浮 就 又 出現 了,34,但是(247988) 經驗(86997) 中(1011729) 每(333357) 當(294625) 戰鬥機(841) 靠近(12300) 幽浮(301) 的(16029838) 影像(22328) 便(220860) 會(1014977) 從(496546) 雷達(947) 的(16029838) 螢幕(6582) 上(1233218) 消失(30223) 而(937923) 飛機(18598) 在(3284238) 附近(32204) 盤旋(2460) 了(3199291) 20(14081) 分鐘(52479) 後(422857) 一(3701681) 離開(71748) 幽浮(301) 就(1737544) 又(535555) 出現(124694) 了(3199291),{'High': 34},"{'第2級': 3, 'Unknown': 8, '第1*級': 8, '第4級': 2, '第1級': 6, '第4*級': 2, '第6級': 2, '第7級': 1, '第5級': 2}",1,Y,Y,N,N
所以，這次，兩架飛機分成兩路，自南北方向朝該地區飛去。,所以 這 次 兩 架 飛機 分成 兩 路 自 南北 方向 朝 該 地區 飛去,16,所以(239080) 這(2114032) 次(331701) 兩(526190) 架(13400) 飛機(18598) 分成(7720) 兩(526190) 路(74635) 自(59676) 南北(4305) 方向(39560) 朝(59301) 該(148369) 地區(40339) 飛去(1432),{'High': 16},"{'第1*級': 2, '第1級': 4, '第2級': 1, '第4級': 2, 'Unknown': 4, '第5級': 1, '第3*級': 1, '第4*級': 1}",0,Y,Y,N,N
終於，自北方飛去的飛機飛進了幽浮群中，這現象不僅被雷達測出，飛行員本身也看見了圍繞在周圍的幽浮，因而發出駭人的叫聲。,終於 自 北方 飛去 的 飛機 飛進 了 幽浮群 中 這 現象 不僅 被 雷達 測出 飛行員 本身 也 看見 了 圍繞 在 周圍 的 幽浮 因而 發出 駭人 的 叫聲,31,終於(59622) 自(59676) 北方(9626) 飛去(1432) 的(16029838) 飛機(18598) 飛進(647) 了(3199291) 幽浮群(Unknown) 中(1011729) 這(2114032) 現象(47383) 不僅(43138) 被(540683) 雷達(947) 測出(439) 飛行員(2091) 本身(44138) 也(1590760) 看見(56420) 了(3199291) 圍繞(5686) 在(3284238) 周圍(15078) 的(16029838) 幽浮(301) 因而(29060) 發出(29993) 駭人(1170) 的(16029838) 叫聲(3938),"{'High': 30, 'Low': 1}","{'第4級': 1, '第5級': 4, 'Unknown': 12, '第1級': 5, '第1*級': 3, '第4*級': 3, '第2級': 1, '第7級': 2}",2,Y,Y,N,N
前後不過才1020秒的時間，幽浮便自動解除了包圍，並在盤旋華盛頓四周後，在黎明時飛離。,前後 不過 才 1020 秒 的 時間 幽浮 便 自動 解除 了 包圍 並 在 盤旋 華盛頓 四周 後 在 黎明 時 飛離,23,前後(12443) 不過(186226) 才(394539) 1020(15) 秒(12995) 的(16029838) 時間(213595) 幽浮(301) 便(220860) 自動(11661) 解除(6448) 了(3199291) 包圍(7840) 並(442790) 在(3284238) 盤旋(2460) 華盛頓(6683) 四周(14209) 後(422857) 在(3284238) 黎明(3711) 時(623734) 飛離(332),"{'High': 22, 'Low': 1}","{'第5級': 3, '第2級': 2, 'Unknown': 5, '第4級': 2, '第1級': 3, '第6級': 3, '第4*級': 2, '第1*級': 2, '第3*級': 1}",2,Y,Y,N,N
這一次事件，經過報導後，便引起很大的震撼，美國政府甚至還為此召開記者會，解釋這只不過是因為溫度不同的空氣層，反射了城市的光和雷達波，而形成類似海市蜃樓的幻象，雖然，這項聲明一時遏止了人心的騷動，但是據後來美國空軍幽浮研究部的調查指出：事件發生當晚，根本就沒有會影響雷達的氣溫逆轉層。,這 一 次 事件 經過 報導 後 便 引起 很 大 的 震撼 美國 政府 甚至 還 為 此 召開 記者會 解釋 這 只 不過 是 因為 溫度 不同 的 空氣層 反射 了 城市 的 光 和 雷達波 而 形成 類似 海市蜃樓 的 幻象 雖然 這 項 聲明 一時 遏止 了 人心 的 騷動 但是 據 後來 美國 空軍 幽浮 研究 部 的 調查 指出 事件 發生 當晚 根本 就 沒有 會 影響 雷達 的 氣溫 逆轉層,77,這(2114032) 一(3701681) 次(331701) 事件(59059) 經過(64617) 報導(27311) 後(422857) 便(220860) 引起(36729) 很(715675) 大(525780) 的(16029838) 震撼(4583) 美國(148299) 政府(92663) 甚至(122502) 還(625086) 為(761341) 此(288458) 召開(5858) 記者會(1649) 解釋(59761) 這(2114032) 只(436725) 不過(186226) 是(4642407) 因為(425061) 溫度(6882) 不同(159432) 的(16029838) 空氣層(16) 反射(3520) 了(3199291) 城市(32018) 的(16029838) 光(42738) 和(1338337) 雷達波(6) 而(937923) 形成(47486) 類似(29985) 海市蜃樓(283) 的(16029838) 幻象(1729) 雖然(152988) 這(2114032) 項(88887) 聲明(5271) 一時(19906) 遏止(799) 了(3199291) 人心(11229) 的(16029838) 騷動(3791) 但是(247988) 據(24392) 後來(95618) 美國(148299) 空軍(3734) 幽浮(301) 研究(182500) 部(71567) 的(16029838) 調查(34821) 指出(38456) 事件(59059) 發生(129211) 當晚(3170) 根本(66330) 就(1737544) 沒有(594280) 會(1014977) 影響(95840) 雷達(947) 的(16029838) 氣溫(2355) 逆轉層(Unknown),"{'High': 74, 'Low': 3}","{'第1級': 19, '第2級': 7, '第5級': 8, '第6級': 8, '第4*級': 6, '第4級': 4, 'Unknown': 14, '第1*級': 3, '第3級': 5, '第3*級': 1, '第7級': 2}",5,Y,Y,N,N
這件幽浮事件就更引人注目了。,這 件 幽浮 事件 就 更 引人注目 了,8,這(2114032) 件(139257) 幽浮(301) 事件(59059) 就(1737544) 更(361676) 引人注目(1775) 了(3199291),{'High': 8},"{'第1級': 2, '第1*級': 1, 'Unknown': 3, '第5級': 1, '第6級': 1}",1,Y,N,N,N
在花朵上尋找，終於發現三隻和花朵的顏色相同的小灰蝶幼蟲，我想應該就是牠們了，我小心的取下牠們，帶回家飼養。,在 花朵 上 尋找 終於 發現 三 隻 和 花朵 的 顏色 相同 的 小 灰 蝶 幼蟲 我 想 應該 就 是 牠們 了 我 小心 的 取下 牠們 帶回 家 飼養,33,在(3284238) 花朵(5011) 上(1233218) 尋找(28381) 終於(59622) 發現(175233) 三(313861) 隻(93136) 和(1338337) 花朵(5011) 的(16029838) 顏色(19941) 相同(33311) 的(16029838) 小(318835) 灰(6994) 蝶(1643) 幼蟲(4765) 我(3033032) 想(449884) 應該(165478) 就(1737544) 是(4642407) 牠們(28803) 了(3199291) 我(3033032) 小心(24226) 的(16029838) 取下(2131) 牠們(28803) 帶回(6256) 家(236822) 飼養(2110),{'High': 33},"{'第1*級': 2, '第5級': 4, '第1級': 12, '第4級': 2, '第2級': 4, 'Unknown': 8, '第6級': 1}",0,Y,N,N,N
這三隻幼蟲經過我飼育而羽化後，才證明牠們的確是波紋小灰蝶幼蟲，為了躲避天敵，所以，幼蟲的顏色和所產附的花朵顏色很像，得仔細觀察，才能看出來呢！,這 三 隻 幼蟲 經過 我 飼育 而 羽化 後 才 證明 牠們 的確 是 波紋 小 灰 蝶 幼蟲 為 了 躲避 天敵 所以 幼蟲 的 顏色 和 所 產附 的 花朵 顏色 很 像 得 仔細 觀察 才 能 看出來 呢,43,這(2114032) 三(313861) 隻(93136) 幼蟲(4765) 經過(64617) 我(3033032) 飼育(148) 而(937923) 羽化(270) 後(422857) 才(394539) 證明(32919) 牠們(28803) 的確(33471) 是(4642407) 波紋(432) 小(318835) 灰(6994) 蝶(1643) 幼蟲(4765) 為(761341) 了(3199291) 躲避(2699) 天敵(551) 所以(239080) 幼蟲(4765) 的(16029838) 顏色(19941) 和(1338337) 所(527327) 產附(Unknown) 的(16029838) 花朵(5011) 顏色(19941) 很(715675) 像(289494) 得(573721) 仔細(27626) 觀察(44358) 才(394539) 能(582260) 看出來(2248) 呢(204566),"{'High': 42, 'Low': 1}","{'第1級': 10, '第2級': 7, 'Unknown': 14, '第5級': 4, '第4級': 1, '第4*級': 2, '第6級': 2, '第1*級': 3}",1,Y,Y,N,N
波紋小灰蝶主要分布在本省平地到低海拔(Na山區山區，常見到牠們在花叢間吸蜜。,波紋 小 灰 蝶 主要 分布 在 本 省 平地 到 低海拔Na山區 山區 常 見到 牠們 在 花叢 間 吸 蜜,21,波紋(432) 小(318835) 灰(6994) 蝶(1643) 主要(78757) 分布(5163) 在(3284238) 本(197156) 省(17570) 平地(2528) 到(546906) 低海拔Na山區(Unknown) 山區(4460) 常(86207) 見到(30619) 牠們(28803) 在(3284238) 花叢(688) 間(115638) 吸(8398) 蜜(2898),"{'High': 20, 'Low': 1}","{'Unknown': 8, '第1級': 3, '第5級': 1, '第4級': 3, '第6級': 1, '第1*級': 3, '第7級': 1, '第4*級': 1}",1,Y,N,N,N
另外，雄蝶也很喜歡在潮溼的地面或山壁上吸水。,另外 雄 蝶 也 很 喜歡 在 潮溼 的 地面 或 山壁 上 吸水,14,另外(48233) 雄(5376) 蝶(1643) 也(1590760) 很(715675) 喜歡(113753) 在(3284238) 潮溼(728) 的(16029838) 地面(12348) 或(478077) 山壁(684) 上(1233218) 吸水(310),{'High': 14},"{'第3級': 2, '第5級': 1, 'Unknown': 4, '第1級': 5, '第1*級': 1, '第4級': 1}",0,Y,Y,N,N
當波紋小灰蝶在覓食時，會不停的擺動後翅膀，讓一些想要捕食牠們的鳥類，誤以為後翅膀上的黑點是眼睛，而那對尾巴是觸角。,當 波紋 小 灰 蝶 在 覓食 時 會 不停 的 擺動 後 翅膀 讓 一些 想要 捕食 牠們 的 鳥類 誤以為 後 翅膀 上 的 黑 點 是 眼睛 而 那 對 尾巴 是 觸角,36,當(294625) 波紋(432) 小(318835) 灰(6994) 蝶(1643) 在(3284238) 覓食(1544) 時(623734) 會(1014977) 不停(20176) 的(16029838) 擺動(2088) 後(422857) 翅膀(7381) 讓(526314) 一些(156929) 想要(63278) 捕食(711) 牠們(28803) 的(16029838) 鳥類(2600) 誤以為(2491) 後(422857) 翅膀(7381) 上(1233218) 的(16029838) 黑(37780) 點(118735) 是(4642407) 眼睛(65022) 而(937923) 那(754138) 對(897964) 尾巴(6147) 是(4642407) 觸角(1492),{'High': 36},"{'Unknown': 10, '第1級': 12, '第5級': 5, '第1*級': 5, '第7級': 1, '第3*級': 2, '第2級': 1}",1,Y,Y,N,N
所以，在被捕食的時候，就算牠們被鳥類啄破後翅膀，仍然可以乘機逃命。,所以 在 被 捕食 的 時候 就算 牠們 被 鳥類 啄破 後 翅膀 仍然 可以 乘機 逃命,17,所以(239080) 在(3284238) 被(540683) 捕食(711) 的(16029838) 時候(199970) 就算(28034) 牠們(28803) 被(540683) 鳥類(2600) 啄破(31) 後(422857) 翅膀(7381) 仍然(46200) 可以(560531) 乘機(2132) 逃命(1508),"{'High': 16, 'Low': 1}","{'第1*級': 2, '第2級': 2, 'Unknown': 4, '第1級': 4, '第4*級': 1, '第5級': 1, '第4級': 1, '第6級': 2}",0,Y,Y,N,N
圖說：波紋小灰蝶正伸出吸管，在馬櫻丹花上吸蜜。,圖說 波紋 小 灰 蝶 正 伸出 吸管 在 馬櫻丹 花 上 吸 蜜,14,圖說(1053) 波紋(432) 小(318835) 灰(6994) 蝶(1643) 正(179334) 伸出(10389) 吸管(632) 在(3284238) 馬櫻丹(29) 花(72593) 上(1233218) 吸(8398) 蜜(2898),"{'High': 13, 'Low': 1}","{'Unknown': 8, '第1級': 2, '第5級': 1, '第3*級': 1, '第1*級': 1, '第4*級': 1}",1,Y,N,N,N
波紋小灰蝶幼蟲的顏色，和牠們所吃的植物花朵相似，藉著這種保護色來躲避天敵。,波紋 小 灰 蝶 幼蟲 的 顏色 和 牠們 所 吃 的 植物 花朵 相似 藉著 這 種 保護色 來 躲避 天敵,22,波紋(432) 小(318835) 灰(6994) 蝶(1643) 幼蟲(4765) 的(16029838) 顏色(19941) 和(1338337) 牠們(28803) 所(527327) 吃(141660) 的(16029838) 植物(19121) 花朵(5011) 相似(11921) 藉著(9285) 這(2114032) 種(701563) 保護色(235) 來(742183) 躲避(2699) 天敵(551),{'High': 22},"{'Unknown': 9, '第1級': 6, '第5級': 3, '第2級': 2, '第6級': 2}",1,Y,N,N,N
雷射傳真機‧圖片提供‧光電工業研究所.〔本報訊〕電腦上的資料列印出來時，可以同時影印、傳真、印表、文件掃瞄，哇！,雷射 傳真機 圖片 提供 光電 工業 研究所 本報訊 電腦 上 的 資料 列印出來 時 可以 同時 影印 傳真 印表 文件 掃瞄 哇,22,雷射(1567) 傳真機(322) 圖片(4811) 提供(73097) 光電(437) 工業(20144) 研究所(12287) 本報訊(16) 電腦(38528) 上(1233218) 的(16029838) 資料(52866) 列印出來(164) 時(623734) 可以(560531) 同時(115305) 影印(1108) 傳真(1024) 印表(12) 文件(14057) 掃瞄(672) 哇(7634),"{'High': 20, 'Low': 2}","{'第6級': 1, 'Unknown': 8, '第4*級': 3, '第4級': 2, '第1*級': 1, '第1級': 3, '第3級': 2, '第3*級': 2}",4,Y,N,N,N
一機四用的雷射傳真機，國人已經可以自製，而且預計明年元月就可以大量生產上市了。,一 機 四 用 的 雷射 傳真機 國人 已經 可以 自製 而且 預計 明年 元月 就 可以 大量 生產 上市 了,21,一(3701681) 機(4726) 四(141667) 用(377038) 的(16029838) 雷射(1567) 傳真機(322) 國人(4275) 已經(245160) 可以(560531) 自製(1854) 而且(180402) 預計(2295) 明年(3059) 元月(856) 就(1737544) 可以(560531) 大量(28414) 生產(36079) 上市(7933) 了(3199291),{'High': 21},"{'第1級': 7, 'Unknown': 6, '第6級': 1, '第2級': 1, '第3級': 1, '第5級': 2, '第1*級': 1, '第4*級': 2}",1,Y,Y,N,N
由工研院光電工業研究所開發的雷射傳真機，結合了數位影印、印表、普通紙傳真、文件掃描等4種功能，相當於將4種機器合成一體，做各種資訊傳遞時，更加方便了。,由 工研院 光電 工業 研究所 開發 的 雷射 傳真機 結合 了 數位 影印 印表 普通 紙 傳真 文件 掃描 等 4 種 功能 相當於 將 4 種 機器 合成 一體 做 各 種 資訊 傳遞 時 更加 方便 了,39,由(208604) 工研院(829) 光電(437) 工業(20144) 研究所(12287) 開發(19196) 的(16029838) 雷射(1567) 傳真機(322) 結合(22408) 了(3199291) 數位(6297) 影印(1108) 印表(12) 普通(12529) 紙(23590) 傳真(1024) 文件(14057) 掃描(2479) 等(327380) 4(36054) 種(701563) 功能(38600) 相當於(6270) 將(448374) 4(36054) 種(701563) 機器(16652) 合成(4445) 一體(5603) 做(411649) 各(243023) 種(701563) 資訊(37848) 傳遞(6590) 時(623734) 更加(27604) 方便(14172) 了(3199291),"{'High': 38, 'Low': 1}","{'第4*級': 4, 'Unknown': 13, '第4級': 6, '第5級': 5, '第1級': 2, '第6級': 4, '第1*級': 2, '第3*級': 2, '第2級': 1}",4,Y,Y,N,N
這部傳真機可以和個人電腦連線，變成印表機，或是將文件掃瞄，輸入電腦。,這 部 傳真機 可以 和 個人 電腦 連線 變成 印表機 或是 將 文件 掃瞄 輸入 電腦,16,這(2114032) 部(71567) 傳真機(322) 可以(560531) 和(1338337) 個人(76253) 電腦(38528) 連線(1404) 變成(73009) 印表機(536) 或是(75906) 將(448374) 文件(14057) 掃瞄(672) 輸入(4777) 電腦(38528),{'High': 16},"{'第1級': 2, '第2級': 2, 'Unknown': 4, '第4級': 2, '第1*級': 2, '第5級': 2, '第4*級': 1, '第6級': 1}",2,Y,Y,N,N
而且，除了多種放大、縮小影印功能外，它最特別的是傳真功能，而且，只要使用普通紙張就可以接收傳真，不像傳統的傳真機，必須買昂貴的熱感應紙來接收。,而且 除了 多 種 放大 縮小 影印 功能 外 它 最 特別 的 是 傳真 功能 而且 只要 使用 普通 紙張 就 可以 接收 傳真 不 像 傳統 的 傳真機 必須 買 昂貴 的 熱 感應 紙 來 接收,39,而且(180402) 除了(75964) 多(318992) 種(701563) 放大(3383) 縮小(3774) 影印(1108) 功能(38600) 外(109310) 它(316854) 最(421680) 特別(91212) 的(16029838) 是(4642407) 傳真(1024) 功能(38600) 而且(180402) 只要(99140) 使用(99640) 普通(12529) 紙張(2943) 就(1737544) 可以(560531) 接收(5670) 傳真(1024) 不(2282521) 像(289494) 傳統(60517) 的(16029838) 傳真機(322) 必須(170592) 買(59736) 昂貴(4262) 的(16029838) 熱(19720) 感應(2514) 紙(23590) 來(742183) 接收(5670),{'High': 39},"{'第3級': 5, '第3*級': 1, '第1級': 12, 'Unknown': 2, '第6級': 2, '第5級': 5, '第4級': 5, '第1*級': 4, '第2級': 1, '第4*級': 2}",1,Y,Y,N,N
這麼好用的機器，價格只比一般傳真機高一些，所以，希望這部物美價廉的傳真機能大量生產，造福大眾。,這麼 好用 的 機器 價格 只 比 一般 傳真機 高 一些 所以 希望 這 部 物美價廉 的 傳真機 能 大量 生產 造福 大眾,23,這麼(116973) 好用(1593) 的(16029838) 機器(16652) 價格(21121) 只(436725) 比(170486) 一般(80732) 傳真機(322) 高(128858) 一些(156929) 所以(239080) 希望(119975) 這(2114032) 部(71567) 物美價廉(236) 的(16029838) 傳真機(322) 能(582260) 大量(28414) 生產(36079) 造福(1109) 大眾(22411),{'High': 23},"{'第2級': 3, 'Unknown': 4, '第1級': 4, '第4級': 2, '第1*級': 5, '第3*級': 1, '第4*級': 2, '第7級': 1, '第5級': 1}",3,Y,Y,N,N
幽浮來了.哇一群幽浮！,幽浮 來 了 哇 一 群 幽浮,7,幽浮(301) 來(742183) 了(3199291) 哇(7634) 一(3701681) 群(39283) 幽浮(301),{'High': 7},"{'Unknown': 3, '第1級': 2, '第3級': 1, '第4級': 1}",0,Y,N,N,N
