sentence,sentence_preprocessed,sentence_length,word_freq,high_low_freq,word_level,long_word_count,is_complete_sentence,is_complete_context,is_blacklist,is_greylist
醫院希望社會大眾能共同發揮愛心，擴大服務層面，使老吾老以及人之老。,醫院 希望 社會 大眾 能 共同 發揮 愛心 擴大 服務 層面 使 老 吾 老 以 及 人 之 老,20,醫院(30938) 希望(119975) 社會(176660) 大眾(22411) 能(582260) 共同(36636) 發揮(23985) 愛心(3575) 擴大(12352) 服務(38055) 層面(14492) 使(197544) 老(75373) 吾(12349) 老(75373) 以(547785) 及(304586) 人(1550512) 之(875481) 老(75373),{'High': 20},"{'第2級': 2, '第3*級': 1, '第5級': 7, '第1*級': 1, '第4級': 2, '第3級': 1, '第6級': 2, '第1級': 4}",0,Y,Y,N,N
幼吾幼以及人之幼的精神能徹底發揮。,幼 吾 幼 以 及 人 之 幼 的 精神 能 徹底 發揮,13,幼(3065) 吾(12349) 幼(3065) 以(547785) 及(304586) 人(1550512) 之(875481) 幼(3065) 的(16029838) 精神(79222) 能(582260) 徹底(17782) 發揮(23985),{'High': 13},"{'Unknown': 3, '第6級': 1, '第5級': 5, '第1級': 2, '第3*級': 1, '第1*級': 1}",0,Y,Y,N,N
台灣雖然是一個充滿富裕和高度享受的社會，然而還是有一群人孤獨的活在黑暗的角落，這些年老無依的孤苦老人或是露宿街頭的流浪漢，在平時人們大都避之唯恐不及。,台灣 雖然 是 一 個 充滿 富裕 和 高度 享受 的 社會 然而 還是 有 一 群 人 孤獨 的 活 在 黑暗 的 角落 這些 年老 無依 的 孤苦 老人 或是 露宿 街頭 的 流浪漢 在 平時 人們 大都 避 之 唯恐 不及,44,台灣(130718) 雖然(152988) 是(4642407) 一(3701681) 個(2296574) 充滿(43990) 富裕(4910) 和(1338337) 高度(20229) 享受(21312) 的(16029838) 社會(176660) 然而(94482) 還是(155231) 有(2217079) 一(3701681) 群(39283) 人(1550512) 孤獨(8251) 的(16029838) 活(49727) 在(3284238) 黑暗(16430) 的(16029838) 角落(11104) 這些(315113) 年老(3020) 無依(472) 的(16029838) 孤苦(399) 老人(23906) 或是(75906) 露宿(464) 街頭(6382) 的(16029838) 流浪漢(1374) 在(3284238) 平時(9449) 人們(77778) 大都(6626) 避(5865) 之(875481) 唯恐(1396) 不及(5271),{'High': 44},"{'第1級': 12, '第2級': 3, '第4*級': 3, '第5級': 6, 'Unknown': 7, '第4級': 4, '第3*級': 1, '第1*級': 3, '第7級': 3, '第6級': 2}",1,Y,Y,N,N
因此不少流浪漢就這樣以無助的眼神，瑟縮在路旁，直到斷氣為止。,因此 不少 流浪漢 就 這樣 以 無助 的 眼神 瑟縮 在 路 旁 直到 斷氣 為止,16,因此(184606) 不少(35256) 流浪漢(1374) 就(1737544) 這樣(288344) 以(547785) 無助(4402) 的(16029838) 眼神(15149) 瑟縮(314) 在(3284238) 路(74635) 旁(39478) 直到(41624) 斷氣(738) 為止(17781),{'High': 16},"{'第4*級': 2, 'Unknown': 2, '第6級': 1, '第1級': 3, '第3級': 1, '第5級': 4, '第1*級': 2, '第7級': 1}",1,Y,Y,N,N
而有幸被送往醫院者，更對如何負擔醫療費感到困擾。,而 有幸 被 送往 醫院 者 更 對 如何 負擔 醫療費 感到 困擾,13,而(937923) 有幸(1998) 被(540683) 送往(1811) 醫院(30938) 者(423504) 更(361676) 對(897964) 如何(148068) 負擔(10490) 醫療費(133) 感到(74094) 困擾(11106),{'High': 13},"{'第5級': 4, '第6級': 1, '第2級': 2, 'Unknown': 4, '第1級': 1, '第4級': 1}",1,Y,Y,N,N
有鑑於此，彰化基督教醫院社工部努力地去發掘幫助這些被社會遺忘的一群人。,有鑑於此 彰化 基督教 醫院 社工部 努力 地 去 發掘 幫助 這些 被 社會 遺忘 的 一 群 人,18,有鑑於此(400) 彰化(2603) 基督教(7981) 醫院(30938) 社工部(2) 努力(62566) 地(754998) 去(479993) 發掘(4961) 幫助(62744) 這些(315113) 被(540683) 社會(176660) 遺忘(5223) 的(16029838) 一(3701681) 群(39283) 人(1550512),"{'High': 17, 'Low': 1}","{'第7級': 1, 'Unknown': 4, '第5級': 2, '第2級': 4, '第1級': 4, '第6級': 1, '第3*級': 1, '第4級': 1}",3,Y,N,N,Y
根據統計，從去年十一月至今年十月為止，整整一年中，免費處理路倒者醫療急救。,根據 統計 從 去年 十一月 至 今年 十月 為止 整整 一 年 中 免費 處理 路 倒 者 醫療 急救,20,根據(51908) 統計(9580) 從(496546) 去年(9462) 十一月(12863) 至(101530) 今年(10836) 十月(15556) 為止(17781) 整整(5096) 一(3701681) 年(514736) 中(1011729) 免費(6101) 處理(61797) 路(74635) 倒(40381) 者(423504) 醫療(13958) 急救(1323),{'High': 20},"{'第4*級': 2, '第5級': 6, '第1*級': 1, '第1級': 5, 'Unknown': 5, '第4級': 1}",1,Y,Y,N,N
孤苦老人住院看護。,孤苦 老人 住院 看護,4,孤苦(399) 老人(23906) 住院(3930) 看護(1525),{'High': 4},"{'第7級': 1, '第2級': 1, '第4*級': 1, 'Unknown': 1}",0,Y,N,N,N
生病的流浪漢等，計有卅八宗個案，花費金額為四十六萬五千五百廿五元。,生病 的 流浪漢 等 計有 卅八 宗 個案 花費 金額 為 四十六萬五千五百廿五 元,13,生病(11191) 的(16029838) 流浪漢(1374) 等(327380) 計有(799) 卅八(33) 宗(5046) 個案(12690) 花費(6058) 金額(5087) 為(761341) 四十六萬五千五百廿五(Unknown) 元(60807),"{'High': 11, 'Low': 2}","{'第1*級': 1, '第1級': 2, '第6級': 4, '第3*級': 1, 'Unknown': 4, '第4*級': 1}",2,Y,Y,N,N
目前彰基為了能擴大服務層面，讓所有需要醫療幫助的孤苦民眾，都能得到妥善照顧，因此成立孤苦殘病基金，希望民眾不要吝於付出自己的愛心，期能透過您的關懷和您的愛，讓這群可憐人能得到重生。,目前 彰基 為 了 能 擴大 服務 層面 讓 所有 需要 醫療 幫助 的 孤苦 民眾 都 能 得到 妥善 照顧 因此 成立 孤苦殘病 基金 希望 民眾 不要 吝於 付出 自己 的 愛心 期 能 透過 您 的 關懷 和 您 的 愛 讓 這 群 可憐人 能 得到 重生,50,目前(48695) 彰基(17) 為(761341) 了(3199291) 能(582260) 擴大(12352) 服務(38055) 層面(14492) 讓(526314) 所有(146771) 需要(166793) 醫療(13958) 幫助(62744) 的(16029838) 孤苦(399) 民眾(17097) 都(1125846) 能(582260) 得到(84614) 妥善(2547) 照顧(29251) 因此(184606) 成立(28506) 孤苦殘病(Unknown) 基金(10265) 希望(119975) 民眾(17097) 不要(101931) 吝於(342) 付出(14854) 自己(744739) 的(16029838) 愛心(3575) 期(14058) 能(582260) 透過(63117) 您(78094) 的(16029838) 關懷(8683) 和(1338337) 您(78094) 的(16029838) 愛(124337) 讓(526314) 這(2114032) 群(39283) 可憐人(290) 能(582260) 得到(84614) 重生(1757),"{'High': 48, 'Low': 2}","{'第4級': 3, 'Unknown': 10, '第1*級': 5, '第5級': 5, '第3級': 2, '第6級': 2, '第2級': 6, '第1級': 9, '第7級': 1, '第4*級': 5, '第3*級': 2}",2,Y,Y,N,Y
福興鄉同安村。,福興鄉 同安村,2,福興鄉(5) 同安村(Unknown),{'Low': 2},{'Unknown': 2},2,N,N,N,N
秀厝村被劃為蔬菜栽培專業區，依原則由鄉農會興建一蔬菜集貨場，辦理蔬菜交易，但福興鄉公所由於對鄉農會未及時回饋地方，相當感冒，昨發公文給縣府，要求改由鄉公所負責集貨場興建。,秀厝村 被 劃為 蔬菜 栽培 專業區 依 原則 由 鄉 農會 興建 一 蔬菜 集貨場 辦理 蔬菜 交易 但 福興鄉 公所 由於 對 鄉 農會 未 及時 回饋 地方 相當 感冒 昨 發 公文 給 縣府 要求 改由 鄉公所 負責 集貨場 興建,42,秀厝村(Unknown) 被(540683) 劃為(258) 蔬菜(7827) 栽培(2024) 專業區(28) 依(37519) 原則(31148) 由(208604) 鄉(5809) 農會(494) 興建(5688) 一(3701681) 蔬菜(7827) 集貨場(4) 辦理(7225) 蔬菜(7827) 交易(16930) 但(597124) 福興鄉(5) 公所(392) 由於(88111) 對(897964) 鄉(5809) 農會(494) 未(101927) 及時(6624) 回饋(6468) 地方(139164) 相當(66293) 感冒(5948) 昨(531) 發(22092) 公文(1974) 給(240485) 縣府(572) 要求(71192) 改由(783) 鄉公所(322) 負責(37090) 集貨場(4) 興建(5688),"{'Low': 5, 'High': 37}","{'Unknown': 14, '第2級': 2, '第4級': 4, '第6級': 3, '第4*級': 4, '第5級': 7, '第1級': 3, '第1*級': 2, '第3級': 1, '第7級': 1, '第3*級': 1}",6,Y,Y,N,N
管理事宜，不讓鄉農會專美於前。,管理 事宜 不 讓 鄉 農會 專美於前,7,管理(54484) 事宜(3374) 不(2282521) 讓(526314) 鄉(5809) 農會(494) 專美於前(77),"{'High': 6, 'Low': 1}","{'第4*級': 1, '第6級': 1, '第1級': 1, '第2級': 1, '第5級': 1, 'Unknown': 2}",1,Y,N,N,N
福興鄉公所農業課指出，雖然此舉明知不可為，但鄉代會對於鄉農會未回饋公所一部垃圾車一事，仍耿耿於懷，該課即依要求，奉命行事，希望能爭取到集貨場的興辦權利。,福興鄉 公所 農業課 指出 雖然 此 舉 明知 不可 為 但 鄉代會 對於 鄉 農會 未 回饋 公所 一 部 垃圾車 一 事 仍 耿耿於懷 該 課 即 依 要求 奉命 行事 希望 能 爭取到 集貨場 的 興辦 權利,39,福興鄉(5) 公所(392) 農業課(5) 指出(38456) 雖然(152988) 此(288458) 舉(21400) 明知(2616) 不可(50808) 為(761341) 但(597124) 鄉代會(2) 對於(99570) 鄉(5809) 農會(494) 未(101927) 回饋(6468) 公所(392) 一(3701681) 部(71567) 垃圾車(260) 一(3701681) 事(385949) 仍(92056) 耿耿於懷(811) 該(148369) 課(14124) 即(110826) 依(37519) 要求(71192) 奉命(3036) 行事(8100) 希望(119975) 能(582260) 爭取到(1028) 集貨場(4) 的(16029838) 興辦(425) 權利(15625),"{'Low': 4, 'High': 35}","{'Unknown': 14, '第2級': 4, '第5級': 4, '第4級': 3, '第6級': 5, '第1級': 3, '第1*級': 3, '第7級': 1, '第4*級': 1, '第3*級': 1}",7,Y,Y,N,N
農業課說，同安。,農業課 說 同安,3,農業課(5) 說(1285247) 同安(278),"{'Low': 1, 'High': 2}","{'Unknown': 2, '第1級': 1}",1,Y,N,N,N
秀厝村的蔬菜集貨場須在八十年七月前完成，但鄉農會至今未覓得興建地點，這是公所向上爭取興辦的理由之一。,秀厝村 的 蔬菜 集貨場 須 在 八十年 七月 前 完成 但 鄉 農會 至今 未 覓得 興建 地點 這 是 公所 向 上 爭取 興辦 的 理由 之 一,29,秀厝村(Unknown) 的(16029838) 蔬菜(7827) 集貨場(4) 須(17260) 在(3284238) 八十年(373) 七月(15511) 前(272709) 完成(60471) 但(597124) 鄉(5809) 農會(494) 至今(14540) 未(101927) 覓得(302) 興建(5688) 地點(16808) 這(2114032) 是(4642407) 公所(392) 向(231672) 上(1233218) 爭取(9666) 興辦(425) 的(16029838) 理由(32460) 之(875481) 一(3701681),"{'Low': 2, 'High': 27}","{'Unknown': 9, '第1級': 7, '第4級': 2, '第3級': 1, '第1*級': 1, '第4*級': 1, '第2級': 2, '第5級': 5, '第3*級': 1}",3,Y,Y,N,N
不過，農業課評估說，完成一座蔬菜集貨場，包括建物和停車場，約需三百坪土地，以每坪興建費用四萬元計算，需經費一千二百萬元，對公所將是一項重大考驗。,不過 農業課 評估 說 完成 一 座 蔬菜 集貨場 包括 建物 和 停車場 約 需 三百 坪 土地 以 每 坪 興建 費用 四萬 元 計算 需 經費 一千二百萬 元 對 公所 將 是 一 項 重大 考驗,38,不過(186226) 農業課(5) 評估(16292) 說(1285247) 完成(60471) 一(3701681) 座(49959) 蔬菜(7827) 集貨場(4) 包括(74410) 建物(2481) 和(1338337) 停車場(2735) 約(47731) 需(27999) 三百(6433) 坪(2297) 土地(32151) 以(547785) 每(333357) 坪(2297) 興建(5688) 費用(10652) 四萬(1414) 元(60807) 計算(14712) 需(27999) 經費(7039) 一千二百萬(108) 元(60807) 對(897964) 公所(392) 將(448374) 是(4642407) 一(3701681) 項(88887) 重大(19228) 考驗(6900),"{'High': 36, 'Low': 2}","{'第2級': 3, 'Unknown': 8, '第5級': 9, '第1級': 7, '第4*級': 2, '第3*級': 3, '第4級': 4, '第3級': 1, '第1*級': 1}",4,Y,Y,N,N
但鄉代會主席莊圳良強調，先向上爭取到集貨場興辦權後，其它問題再作研究。,但 鄉代會 主席 莊圳良 強調 先 向 上 爭取到 集貨場 興辦權 後 其它 問題 再 作 研究,17,但(597124) 鄉代會(2) 主席(9526) 莊圳良(Unknown) 強調(36095) 先(136649) 向(231672) 上(1233218) 爭取到(1028) 集貨場(4) 興辦權(Unknown) 後(422857) 其它(3339) 問題(280782) 再(326207) 作(78184) 研究(182500),"{'High': 13, 'Low': 4}","{'第2級': 3, 'Unknown': 6, '第5級': 2, '第1*級': 2, '第1級': 3, '第3級': 1}",5,Y,Y,N,Y
鄉公所強調，集貨場的興建，農林廳只補助二百五十萬元，雖然公所財源短絀，但與鄉代會有志一同，不想讓鄉農會專美於前。,鄉公所 強調 集貨場 的 興建 農林廳 只 補助 二百五十萬 元 雖然 公所 財源 短絀 但 與 鄉代會 有志一同 不 想 讓 鄉 農會 專美於前,24,鄉公所(322) 強調(36095) 集貨場(4) 的(16029838) 興建(5688) 農林廳(69) 只(436725) 補助(2843) 二百五十萬(148) 元(60807) 雖然(152988) 公所(392) 財源(859) 短絀(82) 但(597124) 與(968432) 鄉代會(2) 有志一同(160) 不(2282521) 想(449884) 讓(526314) 鄉(5809) 農會(494) 專美於前(77),"{'High': 19, 'Low': 5}","{'Unknown': 10, '第5級': 3, '第1級': 4, '第1*級': 1, '第6級': 1, '第2級': 3, '第7級': 1, '第4*級': 1}",7,Y,Y,N,N
取締安非他命的腳步是不是太遲了？,取締 安非他命 的 腳步 是 不 是 太 遲 了,10,取締(1152) 安非他命(486) 的(16029838) 腳步(12300) 是(4642407) 不(2282521) 是(4642407) 太(181732) 遲(7499) 了(3199291),{'High': 10},"{'第6級': 2, 'Unknown': 2, '第1級': 5, '第4*級': 1}",1,Y,N,N,N
不只是社會人士有如此觀點，連不少警方人士都慨嘆錯失良機，因為他們早在二。,不只 是 社會 人士 有 如此 觀點 連 不少 警方 人士 都 慨嘆 錯失 良機 因為 他們 早 在 二,20,不只(20841) 是(4642407) 社會(176660) 人士(27666) 有(2217079) 如此(133083) 觀點(38495) 連(91153) 不少(35256) 警方(8008) 人士(27666) 都(1125846) 慨嘆(368) 錯失(1658) 良機(1613) 因為(425061) 他們(716752) 早(62038) 在(3284238) 二(152494),{'High': 20},"{'Unknown': 4, '第1級': 6, '第3*級': 2, '第5級': 4, '第6級': 1, '第7級': 1, '第1*級': 2}",0,Y,Y,N,N
三年前就發現安非他命有氾濫趨勢，奈何提出建議都無下文。,三 年 前 就 發現 安非他命 有 氾濫 趨勢 奈何 提出 建議 都 無 下文,15,三(313861) 年(514736) 前(272709) 就(1737544) 發現(175233) 安非他命(486) 有(2217079) 氾濫(1418) 趨勢(9872) 奈何(1782) 提出(63073) 建議(45709) 都(1125846) 無(157858) 下文(1755),{'High': 15},"{'第1級': 6, '第2級': 1, 'Unknown': 2, '第6級': 3, '第7級': 1, '第3*級': 1, '第5級': 1}",1,Y,N,N,N
不過目前既已制定刑責，倒也是亡羊補牢猶未晚矣。,不過 目前 既已 制定 刑責 倒 也 是 亡羊補牢 猶 未 晚 矣,13,不過(186226) 目前(48695) 既已(1329) 制定(6634) 刑責(177) 倒(40381) 也(1590760) 是(4642407) 亡羊補牢(236) 猶(8753) 未(101927) 晚(24931) 矣(16205),{'High': 13},"{'第2級': 1, '第4級': 1, 'Unknown': 5, '第5級': 2, '第1級': 2, '第1*級': 1, '第7級': 1}",1,Y,Y,N,N
據一位高階警官指出，安非他命的存在問題，社會人士可能在最近這一段時間內，才感受到它的震撼力，然而他在二。,據 一 位 高階 警官 指出 安非他命 的 存在 問題 社會 人士 可能 在 最近 這 一 段 時間 內 才 感受到 它 的 震撼力 然而 他 在 二,29,據(24392) 一(3701681) 位(284809) 高階(4030) 警官(6330) 指出(38456) 安非他命(486) 的(16029838) 存在(75197) 問題(280782) 社會(176660) 人士(27666) 可能(271025) 在(3284238) 最近(30174) 這(2114032) 一(3701681) 段(95980) 時間(213595) 內(183051) 才(394539) 感受到(14394) 它(316854) 的(16029838) 震撼力(320) 然而(94482) 他(2487930) 在(3284238) 二(152494),{'High': 29},"{'第4*級': 1, '第1級': 11, '第5級': 4, '第6級': 1, 'Unknown': 4, '第3*級': 1, '第1*級': 3, '第2級': 2, '第4級': 1, '第3級': 1}",3,Y,Y,N,N
三年前，從破獲的人犯或不法場所中，就發現安非他命出現的頻率十分高，然而因為當時吸食和擁有者不必負擔刑責，因此不良份子都有恃無恐。,三 年 前 從 破獲 的 人犯 或 不法 場所 中 就 發現 安非他命 出現 的 頻率 十分 高 然而 因為 當時 吸食 和 擁有 者 不必 負擔 刑責 因此 不良 份子 都 有恃無恐,34,三(313861) 年(514736) 前(272709) 從(496546) 破獲(230) 的(16029838) 人犯(507) 或(478077) 不法(1309) 場所(8263) 中(1011729) 就(1737544) 發現(175233) 安非他命(486) 出現(124694) 的(16029838) 頻率(6400) 十分(63196) 高(128858) 然而(94482) 因為(425061) 當時(126214) 吸食(1214) 和(1338337) 擁有(55809) 者(423504) 不必(29161) 負擔(10490) 刑責(177) 因此(184606) 不良(10094) 份子(9420) 都(1125846) 有恃無恐(219),{'High': 34},"{'第1級': 8, '第1*級': 2, '第7級': 1, 'Unknown': 9, '第3級': 2, '第6級': 2, '第5級': 5, '第2級': 1, '第4級': 2, '第3*級': 1, '第4*級': 1}",2,Y,Y,N,N
有鑑於此，他曾數度向上級提出建議，希望反映給立法機關，讓安非他命列入麻醉藥品管理條例中，以求收到遏止作用。,有鑑於此 他 曾 數 度 向 上級 提出 建議 希望 反映給 立法 機關 讓 安非他命 列入 麻醉 藥品 管理 條例 中 以 求 收到 遏止 作用,26,有鑑於此(400) 他(2487930) 曾(132981) 數(38654) 度(25018) 向(231672) 上級(2841) 提出(63073) 建議(45709) 希望(119975) 反映給(33) 立法(3759) 機關(11955) 讓(526314) 安非他命(486) 列入(3205) 麻醉(1844) 藥品(2129) 管理(54484) 條例(3394) 中(1011729) 以(547785) 求(30359) 收到(12466) 遏止(799) 作用(37837),"{'High': 25, 'Low': 1}","{'第7級': 2, '第1級': 1, '第4級': 1, '第3*級': 2, '第3級': 1, '第2級': 3, '第6級': 6, 'Unknown': 6, '第4*級': 2, '第5級': 2}",3,Y,Y,N,N
然而這些未雨綢繆的建議案送出後，都如同石沈大海未獲重視，如果早一年立法，相信絕不會有目前氾濫成災的慘況。,然而 這些 未雨綢繆 的 建議案 送出 後 都 如同 石沈大海 未 獲 重視 如果 早 一 年 立法 相信 絕不 會 有 目前 氾濫成災 的 慘況,26,然而(94482) 這些(315113) 未雨綢繆(499) 的(16029838) 建議案(75) 送出(1514) 後(422857) 都(1125846) 如同(24070) 石沈大海(25) 未(101927) 獲(11610) 重視(23501) 如果(322121) 早(62038) 一(3701681) 年(514736) 立法(3759) 相信(82200) 絕不(21445) 會(1014977) 有(2217079) 目前(48695) 氾濫成災(153) 的(16029838) 慘況(179),"{'High': 24, 'Low': 2}","{'第5級': 4, 'Unknown': 7, '第7級': 1, '第1級': 8, '第4級': 2, '第2級': 2, '第6級': 1, '第1*級': 1}",4,Y,Y,N,N
另有基層員警也認為有關單位的取締動作確實太遲了些，甚至以前上級曾以正式公文指明吸食安非他命不列入一般刑案，因此在無績效的情形下，員警也懶得抓，致使不少青少年在吸食無罪的心態下，陷於不可自拔，有關單位實難辭其咎。,另 有 基層 員警 也 認為 有關 單位 的 取締 動作 確實 太 遲 了 些 甚至 以前 上級 曾 以 正式 公文 指明 吸食 安非他命 不 列入 一般 刑案 因此 在 無 績效 的 情形 下 員警 也 懶得 抓 致使 不少 青少年 在 吸食 無罪 的 心態 下 陷於 不可 自拔 有關 單位 實 難辭其咎,57,另(138369) 有(2217079) 基層(3093) 員警(673) 也(1590760) 認為(192030) 有關(69607) 單位(23148) 的(16029838) 取締(1152) 動作(43506) 確實(36977) 太(181732) 遲(7499) 了(3199291) 些(159879) 甚至(122502) 以前(59453) 上級(2841) 曾(132981) 以(547785) 正式(23229) 公文(1974) 指明(885) 吸食(1214) 安非他命(486) 不(2282521) 列入(3205) 一般(80732) 刑案(282) 因此(184606) 在(3284238) 無(157858) 績效(6013) 的(16029838) 情形(35199) 下(329549) 員警(673) 也(1590760) 懶得(2017) 抓(21151) 致使(2775) 不少(35256) 青少年(16159) 在(3284238) 吸食(1214) 無罪(1896) 的(16029838) 心態(12966) 下(329549) 陷於(2587) 不可(50808) 自拔(1457) 有關(69607) 單位(23148) 實(17029) 難辭其咎(173),{'High': 57},"{'第3級': 1, '第1級': 8, '第6級': 9, 'Unknown': 12, '第2級': 1, '第4級': 5, '第5級': 6, '第4*級': 3, '第1*級': 5, '第3*級': 4, '第7級': 3}",3,Y,Y,N,N
雖然這些執法人員對執行的時機大發牢騷，不過也對終於列入禁藥頗感欣慰，因為從他們近一個月來所獲得的線索上，確有人因此望安非他命而卻步，不敢再輕易嚐試了。,雖然 這些 執法 人員 對 執行 的 時機 大發 牢騷 不過 也 對 終於 列入 禁藥 頗 感 欣慰 因為 從 他們 近 一 個 月 來 所 獲得 的 線索 上 確 有 人 因此 望 安非他命 而 卻步 不 敢 再 輕易 嚐試 了,46,雖然(152988) 這些(315113) 執法(2193) 人員(49261) 對(897964) 執行(25364) 的(16029838) 時機(11280) 大發(1829) 牢騷(1044) 不過(186226) 也(1590760) 對(897964) 終於(59622) 列入(3205) 禁藥(167) 頗(22266) 感(10485) 欣慰(2121) 因為(425061) 從(496546) 他們(716752) 近(43555) 一(3701681) 個(2296574) 月(148997) 來(742183) 所(527327) 獲得(54809) 的(16029838) 線索(9554) 上(1233218) 確(6567) 有(2217079) 人(1550512) 因此(184606) 望(32727) 安非他命(486) 而(937923) 卻步(413) 不(2282521) 敢(65700) 再(326207) 輕易(10800) 嚐試(184) 了(3199291),{'High': 46},"{'第2級': 5, 'Unknown': 9, '第6級': 7, '第5級': 5, '第1級': 14, '第4級': 1, '第1*級': 3, '第4*級': 1, '第7級': 1}",1,Y,Y,N,N
省農林廳長孫明賢表示，政府將從明年度起，實施地區農業發展方案，按照各地土壤品質，輔導農民種植作物。,省 農林廳長 孫明賢 表示 政府 將 從 明年度 起 實施 地區 農業 發展 方案 按照 各 地 土壤 品質 輔導 農民 種植 作物,23,省(17570) 農林廳長(6) 孫明賢(3) 表示(74452) 政府(92663) 將(448374) 從(496546) 明年度(26) 起(96746) 實施(11851) 地區(40339) 農業(9412) 發展(117494) 方案(14354) 按照(15014) 各(243023) 地(754998) 土壤(3461) 品質(19388) 輔導(5767) 農民(15488) 種植(3944) 作物(2124),"{'High': 20, 'Low': 3}","{'第4級': 6, 'Unknown': 5, '第4*級': 1, '第5級': 3, '第1*級': 1, '第3*級': 1, '第6級': 4, '第2級': 1, '第7級': 1}",3,Y,N,N,Y
此方案主要目的，在提高農產品的品質開拓國外市場，並建立高價位農產品特性。,此 方案 主要 目的 在 提高 農產品 的 品質 開拓 國外 市場 並 建立 高價位 農產品 特性,17,此(288458) 方案(14354) 主要(78757) 目的(45226) 在(3284238) 提高(19797) 農產品(1182) 的(16029838) 品質(19388) 開拓(3638) 國外(8646) 市場(65023) 並(442790) 建立(52946) 高價位(189) 農產品(1182) 特性(12673),{'High': 17},"{'第5級': 2, '第6級': 2, '第4級': 3, '第3*級': 1, '第1*級': 1, '第4*級': 3, 'Unknown': 3, '第1級': 1, '第2級': 1}",3,Y,Y,N,N
孫明賢是在昨日彰化縣農民運動大會上做上述說明，並希望農民能全力配合。,孫明賢 是 在 昨日 彰化縣 農民 運動 大會 上 做 上述 說明 並 希望 農民 能 全力 配合,18,孫明賢(3) 是(4642407) 在(3284238) 昨日(2036) 彰化縣(742) 農民(15488) 運動(63153) 大會(7830) 上(1233218) 做(411649) 上述(18640) 說明(52918) 並(442790) 希望(119975) 農民(15488) 能(582260) 全力(4329) 配合(17173),"{'Low': 1, 'High': 17}","{'Unknown': 3, '第1級': 3, '第1*級': 3, '第5級': 5, '第4級': 1, '第4*級': 2, '第2級': 1}",2,Y,Y,N,Y
他說，彰化的農業在全省中名列前茅，不但天時。,他 說 彰化 的 農業 在 全 省 中 名列前茅 不但 天時,12,他(2487930) 說(1285247) 彰化(2603) 的(16029838) 農業(9412) 在(3284238) 全(178642) 省(17570) 中(1011729) 名列前茅(495) 不但(40359) 天時(911),{'High': 12},"{'第1級': 3, 'Unknown': 4, '第1*級': 1, '第2級': 1, '第4級': 1, '第7級': 1, '第3級': 1}",1,Y,Y,N,N
地利。,地利,1,地利(931),{'High': 1},{'第6級': 1},0,N,N,N,N
人和，主要還是全縣農友不斷在技術上研究創新，所以發展精緻農業等成果比其他縣市好，這項成果應繼續保持。,人和 主要 還是 全 縣 農友 不斷 在 技術 上 研究 創新 所以 發展 精緻 農業 等 成果 比 其他 縣市 好 這 項 成果 應 繼續 保持,28,人和(925) 主要(78757) 還是(155231) 全(178642) 縣(9693) 農友(92) 不斷(68526) 在(3284238) 技術(47691) 上(1233218) 研究(182500) 創新(20456) 所以(239080) 發展(117494) 精緻(5073) 農業(9412) 等(327380) 成果(16253) 比(170486) 其他(189445) 縣市(1349) 好(448428) 這(2114032) 項(88887) 成果(16253) 應(82417) 繼續(80649) 保持(39415),"{'High': 27, 'Low': 1}","{'第7級': 1, '第4級': 5, '第1*級': 4, '第2級': 2, '第5級': 2, 'Unknown': 5, '第1級': 2, '第3級': 1, '第4*級': 4, '第6級': 1, '第3*級': 1}",0,Y,Y,N,N
