sentence,sentence_preprocessed,sentence_length,word_freq,high_low_freq,word_level,long_word_count,is_complete_sentence,is_complete_context,is_blacklist,is_greylist
目前短管的映像管主要以十七吋和十九吋為主，由於映像管前後的距離縮短，因此可以節省放置的空間。,目前 短管 的 映像管 主要 以 十七 吋 和 十九 吋 為主 由於 映像管 前後 的 距離 縮短 因此 可以 節省 放置 的 空間,24,目前(48695) 短管(8) 的(16029838) 映像管(133) 主要(78757) 以(547785) 十七(7310) 吋(3441) 和(1338337) 十九(5778) 吋(3441) 為主(12900) 由於(88111) 映像管(133) 前後(12443) 的(16029838) 距離(27644) 縮短(2698) 因此(184606) 可以(560531) 節省(3777) 放置(3585) 的(16029838) 空間(52519),"{'High': 23, 'Low': 1}","{'第4級': 4, 'Unknown': 7, '第1級': 4, '第5級': 5, '第4*級': 2, '第6級': 2}",2,Y,Y,N,N
若以相對比較的角度來看，十七吋的短管長度約和正常的十四吋映像管相當，而十九吋短管的長度則可和十七吋相當，約較正常十九吋的映像管減少四公分的長度。,若 以 相對 比較 的 角度 來 看 十七 吋 的 短管 長度 約 和 正常 的 十四 吋 映像管 相當 而 十九 吋 短管 的 長度 則 可 和 十七 吋 相當 約 較 正常 十九 吋 的 映像管 減少 四 公分 的 長度,45,若(92766) 以(547785) 相對(20694) 比較(112212) 的(16029838) 角度(26690) 來(742183) 看(444691) 十七(7310) 吋(3441) 的(16029838) 短管(8) 長度(4857) 約(47731) 和(1338337) 正常(28865) 的(16029838) 十四(9837) 吋(3441) 映像管(133) 相當(66293) 而(937923) 十九(5778) 吋(3441) 短管(8) 的(16029838) 長度(4857) 則(254096) 可(307359) 和(1338337) 十七(7310) 吋(3441) 相當(66293) 約(47731) 較(78424) 正常(28865) 十九(5778) 吋(3441) 的(16029838) 映像管(133) 減少(22815) 四(141667) 公分(9876) 的(16029838) 長度(4857),"{'High': 43, 'Low': 2}","{'Unknown': 16, '第5級': 10, '第2級': 2, '第1級': 8, '第3*級': 4, '第3級': 2, '第4*級': 1, '第4級': 2}",2,Y,Y,N,N
不過在技術上有二項難處，其一是由於距離縮減，因此電子槍投射的角度較大，是在設計上較為困難之處。,不過 在 技術 上 有 二 項 難處 其一 是 由於 距離 縮減 因此 電子槍 投射 的 角度 較 大 是 在 設計 上 較為 困難 之 處,28,不過(186226) 在(3284238) 技術(47691) 上(1233218) 有(2217079) 二(152494) 項(88887) 難處(710) 其一(5) 是(4642407) 由於(88111) 距離(27644) 縮減(1141) 因此(184606) 電子槍(12) 投射(2912) 的(16029838) 角度(26690) 較(78424) 大(525780) 是(4642407) 在(3284238) 設計(59326) 上(1233218) 較為(8058) 困難(37504) 之(875481) 處(84410),"{'High': 26, 'Low': 2}","{'第2級': 2, '第1*級': 2, '第4級': 2, '第1級': 8, '第5級': 3, '第7級': 2, 'Unknown': 4, '第4*級': 3, '第6級': 1, '第3*級': 1}",1,Y,Y,N,N
另外，則是初期的短管映像管，當監視器廠進行電路板設計時，必須花費較大的電力，因此雖然短管在二、三年前即已問世，但卻一直難為監視器採用的原因之一，不過目前這項問題，大多數的廠商均已克服。,另外 則 是 初期 的 短管 映像管 當 監視器廠 進行 電路板 設計 時 必須 花費 較 大 的 電力 因此 雖然 短管 在 二 三 年 前 即已 問世 但 卻 一直 難 為 監視器 採用 的 原因 之 一 不過 目前 這 項 問題 大多數 的 廠商 均 已 克服,51,另外(48233) 則(254096) 是(4642407) 初期(11598) 的(16029838) 短管(8) 映像管(133) 當(294625) 監視器廠(Unknown) 進行(100298) 電路板(162) 設計(59326) 時(623734) 必須(170592) 花費(6058) 較(78424) 大(525780) 的(16029838) 電力(3339) 因此(184606) 雖然(152988) 短管(8) 在(3284238) 二(152494) 三(313861) 年(514736) 前(272709) 即已(1407) 問世(2916) 但(597124) 卻(333007) 一直(119877) 難(75701) 為(761341) 監視器(708) 採用(20582) 的(16029838) 原因(67404) 之(875481) 一(3701681) 不過(186226) 目前(48695) 這(2114032) 項(88887) 問題(280782) 大多數(21212) 的(16029838) 廠商(8879) 均(27783) 已(215610) 克服(10803),"{'High': 48, 'Low': 3}","{'第3級': 3, '第5級': 6, '第1級': 13, 'Unknown': 13, '第4*級': 4, '第3*級': 2, '第2級': 5, '第1*級': 1, '第6級': 2, '第4級': 2}",5,Y,Y,N,N
桂宏鋼鐵大肆併購廢鋼回收商，累積家數達十九家之多，併購行動仍在持續進行中，造成國內廢鋼行情，本月內一度攀升至每公噸新台幣四千五百元的高峰，引起同業震撼，豐興鋼鐵起身對抗後，廢鋼價格每公噸遽跌五百元，市場火藥味濃厚。,桂宏 鋼鐵 大肆 併購 廢鋼 回收商 累積 家數 達 十九 家 之多 併購 行動 仍 在 持續 進行 中 造成 國內 廢鋼 行情 本 月 內 一度 攀升 至 每 公噸 新台幣 四千五百 元 的 高峰 引起 同業 震撼 豐興 鋼鐵 起身 對抗 後 廢鋼 價格 每 公噸 遽跌 五百 元 市場 火藥味 濃厚,54,桂宏(3) 鋼鐵(2695) 大肆(3010) 併購(894) 廢鋼(9) 回收商(7) 累積(13742) 家數(232) 達(25383) 十九(5778) 家(236822) 之多(171) 併購(894) 行動(69326) 仍(92056) 在(3284238) 持續(33796) 進行(100298) 中(1011729) 造成(63141) 國內(17537) 廢鋼(9) 行情(2386) 本(197156) 月(148997) 內(183051) 一度(5292) 攀升(1224) 至(101530) 每(333357) 公噸(719) 新台幣(1741) 四千五百(185) 元(60807) 的(16029838) 高峰(2712) 引起(36729) 同業(2212) 震撼(4583) 豐興(39) 鋼鐵(2695) 起身(9057) 對抗(13125) 後(422857) 廢鋼(9) 價格(21121) 每(333357) 公噸(719) 遽跌(Unknown) 五百(7028) 元(60807) 市場(65023) 火藥味(227) 濃厚(3668),"{'Low': 7, 'High': 47}","{'Unknown': 21, '第7級': 2, '第5級': 6, '第1級': 7, '第4級': 4, '第1*級': 3, '第4*級': 3, '第6級': 6, '第3級': 1, '第2級': 1}",4,Y,N,N,Y
龍慶鋼鐵總經理謝進南表示，桂宏大手筆收購中、北部廢鋼回收商，造成國內廢鋼行情一路狂飆，每公噸一度飆到新台幣四千五百元，打亂市場價格，引起北、中部鋼筋廠，包括東和、豐興及威致等廠的疑慮，抵制桂宏廢鋼回收商的價格，短短二個星期內，國內廢鋼拉回每公噸四千元，遽跌五百元。,龍慶 鋼鐵 總經理 謝進南 表示 桂宏 大手筆 收購 中 北部 廢鋼 回收商 造成 國內 廢鋼 行情 一路 狂飆 每 公噸 一度 飆到 新台幣 四千五百 元 打亂 市場 價格 引起 北 中部 鋼筋廠 包括 東和 豐興 及 威致 等 廠 的 疑慮 抵制 桂宏 廢鋼 回收商 的 價格 短短 二 個 星期 內 國內 廢鋼 拉回 每 公噸 四千 元 遽跌 五百 元,62,龍慶(2) 鋼鐵(2695) 總經理(6256) 謝進南(Unknown) 表示(74452) 桂宏(3) 大手筆(448) 收購(4301) 中(1011729) 北部(5380) 廢鋼(9) 回收商(7) 造成(63141) 國內(17537) 廢鋼(9) 行情(2386) 一路(14840) 狂飆(552) 每(333357) 公噸(719) 一度(5292) 飆到(125) 新台幣(1741) 四千五百(185) 元(60807) 打亂(907) 市場(65023) 價格(21121) 引起(36729) 北(20351) 中部(3282) 鋼筋廠(Unknown) 包括(74410) 東和(24) 豐興(39) 及(304586) 威致(Unknown) 等(327380) 廠(4599) 的(16029838) 疑慮(3628) 抵制(1728) 桂宏(3) 廢鋼(9) 回收商(7) 的(16029838) 價格(21121) 短短(6774) 二(152494) 個(2296574) 星期(20299) 內(183051) 國內(17537) 廢鋼(9) 拉回(1229) 每(333357) 公噸(719) 四千(1675) 元(60807) 遽跌(Unknown) 五百(7028) 元(60807),"{'Low': 15, 'High': 47}","{'Unknown': 29, '第4*級': 3, '第7級': 2, '第6級': 6, '第2*級': 1, '第4級': 5, '第1*級': 3, '第1級': 7, '第2級': 2, '第3*級': 2, '第5級': 1, '第3級': 1}",8,Y,Y,N,Y
謝進南表示，桂宏炒高國內廢鋼行情，沒有持續多久，即被壓到四千元的價位，除了國內幾家大廠打壓外，也受到國際行情下挫的影響，目前國際廢鋼價格已跌到每公噸一一二美元，換算成新台幣也不過近四千元，廠商可棄國貨，改買國外貨品，因此，國內廢鋼調漲行動在短時間內即宣告失敗。,謝進南 表示 桂宏 炒高 國內 廢鋼 行情 沒有 持續 多久 即 被 壓到 四千 元 的 價位 除了 國內 幾 家 大廠 打壓 外 也 受到 國際 行情 下挫 的 影響 目前 國際 廢鋼 價格 已 跌到 每 公噸 一一二 美元 換算成 新台幣 也 不過 近 四千 元 廠商 可 棄 國貨 改 買 國外 貨品 因此 國內 廢鋼 調漲 行動 在 短時間 內 即 宣告 失敗,67,謝進南(Unknown) 表示(74452) 桂宏(3) 炒高(Unknown) 國內(17537) 廢鋼(9) 行情(2386) 沒有(594280) 持續(33796) 多久(4774) 即(110826) 被(540683) 壓到(516) 四千(1675) 元(60807) 的(16029838) 價位(840) 除了(75964) 國內(17537) 幾(229415) 家(236822) 大廠(142) 打壓(1373) 外(109310) 也(1590760) 受到(66513) 國際(40846) 行情(2386) 下挫(124) 的(16029838) 影響(95840) 目前(48695) 國際(40846) 廢鋼(9) 價格(21121) 已(215610) 跌到(930) 每(333357) 公噸(719) 一一二(77) 美元(27307) 換算成(339) 新台幣(1741) 也(1590760) 不過(186226) 近(43555) 四千(1675) 元(60807) 廠商(8879) 可(307359) 棄(6769) 國貨(196) 改(12785) 買(59736) 國外(8646) 貨品(1235) 因此(184606) 國內(17537) 廢鋼(9) 調漲(146) 行動(69326) 在(3284238) 短時間(Unknown) 內(183051) 即(110826) 宣告(4605) 失敗(32551),"{'Low': 8, 'High': 59}","{'Unknown': 20, '第4*級': 4, '第4級': 12, '第6級': 5, '第1級': 11, '第1*級': 3, '第2級': 3, '第7級': 2, '第3*級': 2, '第3級': 3, '第5級': 2}",5,Y,Y,N,Y
豐興鋼鐵公司表示，國內廢鋼出現如此巨大的變化，主因在於國內六月進入限電時期，多家電爐煉鋼廠配合限電政策減產，廢鋼用料並不多，同時國內市況不佳，競爭激烈，加上國際廢鋼價格下挫，行情沒有飆漲的理由。,豐興 鋼鐵 公司 表示 國內 廢鋼 出現 如此 巨大 的 變化 主因 在於 國內 六月 進入 限電 時期 多 家 電爐 煉鋼廠 配合 限電 政策 減產 廢鋼 用料 並 不 多 同時 國內 市況 不佳 競爭 激烈 加上 國際 廢鋼 價格 下挫 行情 沒有 飆漲 的 理由,47,豐興(39) 鋼鐵(2695) 公司(168500) 表示(74452) 國內(17537) 廢鋼(9) 出現(124694) 如此(133083) 巨大(22154) 的(16029838) 變化(42502) 主因(1927) 在於(37953) 國內(17537) 六月(14880) 進入(66885) 限電(23) 時期(47839) 多(318992) 家(236822) 電爐(155) 煉鋼廠(53) 配合(17173) 限電(23) 政策(30965) 減產(149) 廢鋼(9) 用料(277) 並(442790) 不(2282521) 多(318992) 同時(115305) 國內(17537) 市況(100) 不佳(4940) 競爭(30766) 激烈(11890) 加上(38121) 國際(40846) 廢鋼(9) 價格(21121) 下挫(124) 行情(2386) 沒有(594280) 飆漲(283) 的(16029838) 理由(32460),"{'Low': 8, 'High': 39}","{'Unknown': 17, '第2級': 1, '第4*級': 5, '第4級': 11, '第5級': 2, '第1級': 7, '第6級': 2, '第3*級': 1, '第3級': 1}",1,Y,Y,N,Y
桂宏公司表示，收購廢鋼回收商，主要為穩固用料來源，減低原料成本，收集的廢鋼不但可供應桂宏本身的需要，也可供應桂裕煉鋼產線之用，提升桂宏集團的市場競爭力。,桂宏 公司 表示 收購 廢鋼 回收商 主要 為 穩固 用料 來源 減低 原料 成本 收集 的 廢鋼 不但 可 供應 桂宏 本身 的 需要 也 可 供應 桂裕 煉鋼 產線 之 用 提升 桂宏 集團 的 市場 競爭力,38,桂宏(3) 公司(168500) 表示(74452) 收購(4301) 廢鋼(9) 回收商(7) 主要(78757) 為(761341) 穩固(2985) 用料(277) 來源(18177) 減低(3367) 原料(4385) 成本(20612) 收集(6739) 的(16029838) 廢鋼(9) 不但(40359) 可(307359) 供應(8826) 桂宏(3) 本身(44138) 的(16029838) 需要(166793) 也(1590760) 可(307359) 供應(8826) 桂裕(3) 煉鋼(242) 產線(20) 之(875481) 用(377038) 提升(17122) 桂宏(3) 集團(20609) 的(16029838) 市場(65023) 競爭力(3957),"{'Low': 8, 'High': 30}","{'Unknown': 12, '第2級': 3, '第4*級': 5, '第6級': 3, '第4級': 1, '第5級': 8, '第1級': 5, '第3級': 1}",2,Y,Y,N,Y
桂宏表示，前陣子廢鋼價格上揚，完全是因為市場的供需問題，絕不是公司刻意炒作，最近因需求減緩，廢鋼行情跌回原點，由此可看出，市場需求才是左右價格的最主要因素。,桂宏 表示 前 陣子 廢鋼 價格 上揚 完全 是 因為 市場 的 供需 問題 絕 不 是 公司 刻意 炒作 最近 因 需求 減緩 廢鋼 行情 跌回 原點 由 此 可 看出 市場 需求 才 是 左右 價格 的 最 主要 因素,42,桂宏(3) 表示(74452) 前(272709) 陣子(1017) 廢鋼(9) 價格(21121) 上揚(1069) 完全(115744) 是(4642407) 因為(425061) 市場(65023) 的(16029838) 供需(803) 問題(280782) 絕(6651) 不(2282521) 是(4642407) 公司(168500) 刻意(11267) 炒作(872) 最近(30174) 因(119364) 需求(29061) 減緩(1808) 廢鋼(9) 行情(2386) 跌回(118) 原點(1105) 由(208604) 此(288458) 可(307359) 看出(19532) 市場(65023) 需求(29061) 才(394539) 是(4642407) 左右(33714) 價格(21121) 的(16029838) 最(421680) 主要(78757) 因素(34409),"{'Low': 3, 'High': 39}","{'Unknown': 9, '第4*級': 4, '第1級': 8, '第4級': 4, '第6級': 5, '第3*級': 2, '第1*級': 2, '第2級': 5, '第5級': 3}",0,Y,Y,N,Y
雖然馬來西亞、新加坡及中國大陸等地區的競相拉攏，但在我國穩定的經濟發展環境，以及完整的航太技術能量的吸引下，加拿大世界航空重繞線()公司，已決定尋求我相關廠商合資，在台成立航空級發電機重繞線專業廠，承接涵括台灣及亞洲地區的維修業務，並發展成為亞太地區航空重繞線維修中心。,雖然 馬來西亞 新加坡 及 中國 大陸 等 地區 的 競相 拉攏 但 在 我國 穩定 的 經濟 發展 環境 以及 完整 的 航太 技術 能量 的 吸引 下 加拿大 世界 航空 重繞線 公司 已 決定 尋求 我 相關 廠商 合資 在 台 成立 航空級 發電機 重繞線 專業廠 承接 涵括 台灣 及 亞洲 地區 的 維修 業務 並 發展 成為 亞太 地區 航空 重繞線 維修 中心,65,雖然(152988) 馬來西亞(2504) 新加坡(5228) 及(304586) 中國(214840) 大陸(27031) 等(327380) 地區(40339) 的(16029838) 競相(912) 拉攏(1327) 但(597124) 在(3284238) 我國(7225) 穩定(19878) 的(16029838) 經濟(83046) 發展(117494) 環境(71054) 以及(155624) 完整(19201) 的(16029838) 航太(442) 技術(47691) 能量(30785) 的(16029838) 吸引(20619) 下(329549) 加拿大(5370) 世界(165235) 航空(4707) 重繞線(Unknown) 公司(168500) 已(215610) 決定(101837) 尋求(14747) 我(3033032) 相關(41599) 廠商(8879) 合資(2017) 在(3284238) 台(29325) 成立(28506) 航空級(3) 發電機(596) 重繞線(Unknown) 專業廠(5) 承接(1121) 涵括(410) 台灣(130718) 及(304586) 亞洲(13256) 地區(40339) 的(16029838) 維修(2016) 業務(15620) 並(442790) 發展(117494) 成為(143834) 亞太(1426) 地區(40339) 航空(4707) 重繞線(Unknown) 維修(2016) 中心(46076),"{'High': 60, 'Low': 5}","{'第2級': 6, '第5級': 11, '第1級': 8, '第3*級': 3, '第4級': 9, '第7級': 3, '第1*級': 3, 'Unknown': 11, '第4*級': 6, '第3級': 3, '第6級': 2}",9,Y,Y,N,N
世界航空重繞線公司總經理大衛‧瑞哈利()，係應經濟部航太工業發展推動小組主任祝如竹的引介而來，近日在台已與漢翔航空工業、東元電機、長安科技、中興電工、亞洲航空及加拿大商宏利人壽等六家廠商，完成設立專業重繞線廠合資計畫的初步洽商，且將儘速敲定在台合資夥伴。,世界 航空 重繞線 公司 總經理 大衛瑞哈利 係 應 經濟部 航太 工業 發展 推動 小組 主任 祝如竹 的 引介 而 來 近日 在 台 已 與 漢翔 航空 工業 東元 電機 長安 科技 中興 電工 亞洲 航空 及 加拿大商 宏利 人壽 等 六家 廠商 完成 設立 專業 重繞線廠 合資 計畫 的 初步 洽商 且 將 儘速 敲定 在 台 合資 夥伴,60,世界(165235) 航空(4707) 重繞線(Unknown) 公司(168500) 總經理(6256) 大衛瑞哈利(Unknown) 係(9477) 應(82417) 經濟部(1640) 航太(442) 工業(20144) 發展(117494) 推動(14867) 小組(12825) 主任(13859) 祝如竹(Unknown) 的(16029838) 引介(925) 而(937923) 來(742183) 近日(1497) 在(3284238) 台(29325) 已(215610) 與(968432) 漢翔(11) 航空(4707) 工業(20144) 東元(542) 電機(1107) 長安(8025) 科技(30630) 中興(1532) 電工(249) 亞洲(13256) 航空(4707) 及(304586) 加拿大商(2) 宏利(81) 人壽(1015) 等(327380) 六家(9) 廠商(8879) 完成(60471) 設立(12114) 專業(33030) 重繞線廠(Unknown) 合資(2017) 計畫(54820) 的(16029838) 初步(3730) 洽商(168) 且(67015) 將(448374) 儘速(438) 敲定(522) 在(3284238) 台(29325) 合資(2017) 夥伴(9434),"{'High': 52, 'Low': 8}","{'第2級': 5, '第5級': 11, 'Unknown': 22, '第6級': 2, '第4級': 4, '第4*級': 3, '第1級': 3, '第7級': 4, '第1*級': 2, '第3級': 2, '第3*級': 2}",7,Y,Y,N,Y
據了解，世界航空重繞線公司的在台合資案，全案預計投資金額為五百萬美元(約合新台幣一億七千萬元)，未來合資比例、技術移轉等相關問題，將進一步洽商後敲定。,據了解 世界 航空 重繞線 公司 的 在 台 合資案 全案 預計 投資 金額 為 五百萬 美元 約 合 新台幣 一億七千萬 元 未來 合資 比例 技術 移轉 等 相關 問題 將 進一步 洽商 後 敲定,34,據了解(263) 世界(165235) 航空(4707) 重繞線(Unknown) 公司(168500) 的(16029838) 在(3284238) 台(29325) 合資案(25) 全案(Unknown) 預計(2295) 投資(38191) 金額(5087) 為(761341) 五百萬(982) 美元(27307) 約(47731) 合(11142) 新台幣(1741) 一億七千萬(13) 元(60807) 未來(54445) 合資(2017) 比例(13747) 技術(47691) 移轉(2907) 等(327380) 相關(41599) 問題(280782) 將(448374) 進一步(25130) 洽商(168) 後(422857) 敲定(522),"{'High': 30, 'Low': 4}","{'Unknown': 9, '第2級': 3, '第5級': 5, '第1級': 4, '第1*級': 1, '第4*級': 3, '第6級': 2, '第4級': 4, '第3*級': 2, '第7級': 1}",7,Y,Y,N,N
根據航太小組的資料顯示，全世界僅有十家廠商擁有航太級發電機重繞線技術，其中，更只有四家擁有完整的技術能量。,根據 航太 小組 的 資料 顯示 全 世界 僅有 十 家 廠商 擁有 航太級 發電機 重繞線 技術 其中 更 只有 四 家 擁有 完整 的 技術 能量,27,根據(51908) 航太(442) 小組(12825) 的(16029838) 資料(52866) 顯示(32718) 全(178642) 世界(165235) 僅有(4494) 十(77415) 家(236822) 廠商(8879) 擁有(55809) 航太級(1) 發電機(596) 重繞線(Unknown) 技術(47691) 其中(95627) 更(361676) 只有(43745) 四(141667) 家(236822) 擁有(55809) 完整(19201) 的(16029838) 技術(47691) 能量(30785),"{'High': 25, 'Low': 2}","{'第4*級': 2, 'Unknown': 6, '第5級': 6, '第1級': 6, '第3級': 1, '第2級': 2, '第6級': 1, '第4級': 2, '第3*級': 1}",3,Y,N,N,N
而世界航空重繞線公司名列四大廠家之一，亦為美國聯邦航空總署(FAA)及加拿大航空總署JAA認證合格的專業工廠，在加拿大、美國、西班牙三國設有專業廠，包括以色列最大航太維修IAI在內，全球擁有百家以上的航太維修廠商客戶。,而 世界 航空 重繞線 公司 名列 四 大 廠家 之 一 亦 為 美國 聯邦 航空 總署 FAA 及 加拿大 航空 總署 JAA 認證 合格 的 專業 工廠 在 加拿大 美國 西班牙 三 國 設有 專業廠 包括 以色列 最 大 航太 維修 IAI 在 內 全球 擁有 百 家 以上 的 航太 維修 廠商 客戶,55,而(937923) 世界(165235) 航空(4707) 重繞線(Unknown) 公司(168500) 名列(1222) 四(141667) 大(525780) 廠家(415) 之(875481) 一(3701681) 亦(68507) 為(761341) 美國(148299) 聯邦(6246) 航空(4707) 總署(1056) FAA(26) 及(304586) 加拿大(5370) 航空(4707) 總署(1056) JAA(Unknown) 認證(1248) 合格(1728) 的(16029838) 專業(33030) 工廠(16192) 在(3284238) 加拿大(5370) 美國(148299) 西班牙(7097) 三(313861) 國(73377) 設有(3503) 專業廠(5) 包括(74410) 以色列(3589) 最(421680) 大(525780) 航太(442) 維修(2016) IAI(Unknown) 在(3284238) 內(183051) 全球(21104) 擁有(55809) 百(24843) 家(236822) 以上(36569) 的(16029838) 航太(442) 維修(2016) 廠商(8879) 客戶(19413),"{'High': 50, 'Low': 5}","{'第5級': 8, '第2級': 2, 'Unknown': 11, '第1級': 12, '第6級': 5, '第7級': 4, '第4級': 5, '第1*級': 3, '第4*級': 2, '第3*級': 2, '第3級': 1}",9,Y,Y,N,N
航太小組也表示，目前我國及日本、大陸及東南亞等地區的飛機發電機繞線維修或換新，皆須送交美國飛機製造原廠，再轉回世界航空重繞線等公司處理，流程大致耗時三個月左右。,航太 小組 也 表示 目前 我國 及 日本 大陸 及 東南亞 等 地區 的 飛機 發電機 繞線 維修 或 換新 皆 須 送交 美國 飛機 製造 原廠 再 轉回 世界 航空 重繞線 等 公司 處理 流程 大致 耗時 三 個 月 左右,42,航太(442) 小組(12825) 也(1590760) 表示(74452) 目前(48695) 我國(7225) 及(304586) 日本(105587) 大陸(27031) 及(304586) 東南亞(3600) 等(327380) 地區(40339) 的(16029838) 飛機(18598) 發電機(596) 繞線(11) 維修(2016) 或(478077) 換新(374) 皆(45736) 須(17260) 送交(587) 美國(148299) 飛機(18598) 製造(28512) 原廠(Unknown) 再(326207) 轉回(965) 世界(165235) 航空(4707) 重繞線(Unknown) 等(327380) 公司(168500) 處理(61797) 流程(6227) 大致(7165) 耗時(715) 三(313861) 個(2296574) 月(148997) 左右(33714),"{'High': 39, 'Low': 3}","{'Unknown': 11, '第5級': 7, '第1級': 7, '第4*級': 3, '第4級': 2, '第3*級': 4, '第1*級': 3, '第6級': 1, '第3級': 2, '第2級': 2}",3,Y,Y,N,N
而我國軍機、民機對航空用發電機重繞線的需求量甚大，以往我國部份廠商雖具備相關技術能量，惟均非航太級，致發動機、啟發機、激勵器等翻修工作都無法執行，常常以報廢或購置新件或外運修理。,而 我國 軍機 民機 對 航空用 發電機 重繞線 的 需求量 甚 大 以往 我國 部份 廠商 雖 具備 相關 技術 能量 惟 均 非 航太級 致 發動機 啟發機 激勵器 等 翻修 工作 都 無法 執行 常常 以 報廢 或 購置 新 件 或 外運 修理,45,而(937923) 我國(7225) 軍機(2403) 民機(Unknown) 對(897964) 航空用(Unknown) 發電機(596) 重繞線(Unknown) 的(16029838) 需求量(754) 甚(21590) 大(525780) 以往(9935) 我國(7225) 部份(11022) 廠商(8879) 雖(48164) 具備(13398) 相關(41599) 技術(47691) 能量(30785) 惟(5714) 均(27783) 非(112415) 航太級(1) 致(11578) 發動機(552) 啟發機(Unknown) 激勵器(Unknown) 等(327380) 翻修(332) 工作(220164) 都(1125846) 無法(150606) 執行(25364) 常常(38706) 以(547785) 報廢(248) 或(478077) 購置(777) 新(212453) 件(139257) 或(478077) 外運(22) 修理(3230),"{'High': 38, 'Low': 7}","{'第5級': 9, 'Unknown': 15, '第1級': 6, '第6級': 4, '第2級': 2, '第4*級': 1, '第4級': 2, '第3*級': 1, '第1*級': 2, '第3級': 2, '第7級': 1}",8,Y,Y,N,N
此次該公司的在台合資計畫，帶給我國進入航太級重繞線利基市場的大好機會。,此 次 該 公司 的 在 台 合資 計畫 帶給 我國 進入 航太級 重 繞線 利基 市場 的 大好 機會,20,此(288458) 次(331701) 該(148369) 公司(168500) 的(16029838) 在(3284238) 台(29325) 合資(2017) 計畫(54820) 帶給(9682) 我國(7225) 進入(66885) 航太級(1) 重(31331) 繞線(11) 利基(554) 市場(65023) 的(16029838) 大好(2194) 機會(81244),"{'High': 18, 'Low': 2}","{'第5級': 1, '第2級': 6, '第4*級': 1, '第1級': 2, '第1*級': 1, 'Unknown': 8, '第4級': 1}",1,Y,N,N,N
花一、二百萬元裝潢，除了提升自己的生活品質與舒適性，更希望得到眾人的欽羨與肯定。,花 一 二百萬 元 裝潢 除了 提升 自己 的 生活 品質 與 舒適性 更 希望 得到 眾人 的 欽羨 與 肯定,21,花(72593) 一(3701681) 二百萬(557) 元(60807) 裝潢(2051) 除了(75964) 提升(17122) 自己(744739) 的(16029838) 生活(213189) 品質(19388) 與(968432) 舒適性(44) 更(361676) 希望(119975) 得到(84614) 眾人(18671) 的(16029838) 欽羨(202) 與(968432) 肯定(34303),"{'High': 20, 'Low': 1}","{'Unknown': 5, '第1級': 4, '第6級': 2, '第3*級': 2, '第1*級': 1, '第3級': 1, '第4級': 1, '第4*級': 3, '第2級': 1, '第5級': 1}",2,Y,Y,N,N
