sentence,sentence_preprocessed,sentence_length,word_freq,high_low_freq,word_level,long_word_count,is_complete_sentence,is_complete_context,is_blacklist,is_greylist
常在很多寢室門上見到的海報，也被亮著「請勿打擾」、「用功中」的告示牌搶去了風采，也有一些人，明白地在告示牌上列出幾點至幾點請勿打擾，尤更細心者，還將寢室內每個人的情形列在門上，讓訪客決定是否擇日再訪，也可避免一再應門之擾。,常 在 很多 寢室 門 上 見到 的 海報 也 被 亮 著 請 勿 打擾 用功 中 的 告示牌 搶去 了 風采 也 有 一些 人 明白 地 在 告示牌 上 列出 幾點 至 幾點 請 勿 打擾 尤 更 細心 者 還 將 寢室 內 每 個 人 的 情形 列 在 門 上 讓 訪客 決定 是否 擇 日 再 訪 也 可 避免 一再 應門 之 擾,71,常(86207) 在(3284238) 很多(113128) 寢室(1419) 門(78834) 上(1233218) 見到(30619) 的(16029838) 海報(3744) 也(1590760) 被(540683) 亮(12013) 著(1004687) 請(120629) 勿(6163) 打擾(3608) 用功(3114) 中(1011729) 的(16029838) 告示牌(371) 搶去(399) 了(3199291) 風采(1106) 也(1590760) 有(2217079) 一些(156929) 人(1550512) 明白(50011) 地(754998) 在(3284238) 告示牌(371) 上(1233218) 列出(5283) 幾點(300) 至(101530) 幾點(300) 請(120629) 勿(6163) 打擾(3608) 尤(6281) 更(361676) 細心(4187) 者(423504) 還(625086) 將(448374) 寢室(1419) 內(183051) 每(333357) 個(2296574) 人(1550512) 的(16029838) 情形(35199) 列(10857) 在(3284238) 門(78834) 上(1233218) 讓(526314) 訪客(2825) 決定(101837) 是否(78907) 擇(3011) 日(94041) 再(326207) 訪(8839) 也(1590760) 可(307359) 避免(33211) 一再(12315) 應門(270) 之(875481) 擾(904),{'High': 71},"{'第1*級': 9, 'Unknown': 21, '第1級': 16, '第4級': 4, '第4*級': 4, '第2級': 3, '第5級': 7, '第6級': 3, '第2*級': 1, '第7級': 1, '第3級': 1, '第3*級': 1}",2,Y,Y,N,N
台灣大學機械學系楊勝竹說，期末考期間常會看到大家行色匆匆，也會看到不少「臭臉」，他還表示，一到期末考，同學間的聯繫比平日更密切，除了平日較少歸巢的同學在此時都回來唸書，為了借筆記，也增加了彼此接觸的機會。,台灣 大學 機械 學系 楊勝竹 說 期末考 期間 常 會 看到 大家 行色匆匆 也 會 看到 不少 臭臉 他 還 表示 一 到 期末考 同學 間 的 聯繫 比 平日 更 密切 除了 平日 較少 歸 巢 的 同學 在 此 時 都 回來 唸書 為了 借 筆記 也 增加 了 彼此 接觸 的 機會,55,台灣(130718) 大學(83893) 機械(7968) 學系(2258) 楊勝竹(Unknown) 說(1285247) 期末考(346) 期間(32981) 常(86207) 會(1014977) 看到(159419) 大家(109692) 行色匆匆(115) 也(1590760) 會(1014977) 看到(159419) 不少(35256) 臭臉(17) 他(2487930) 還(625086) 表示(74452) 一(3701681) 到(546906) 期末考(346) 同學(30250) 間(115638) 的(16029838) 聯繫(12186) 比(170486) 平日(6274) 更(361676) 密切(10538) 除了(75964) 平日(6274) 較少(3571) 歸(16865) 巢(4387) 的(16029838) 同學(30250) 在(3284238) 此(288458) 時(623734) 都(1125846) 回來(45286) 唸書(2080) 為了(Unknown) 借(14644) 筆記(8154) 也(1590760) 增加(48296) 了(3199291) 彼此(39449) 接觸(22727) 的(16029838) 機會(81244),"{'High': 52, 'Low': 3}","{'第1級': 15, '第6級': 3, 'Unknown': 14, '第4*級': 3, '第1*級': 7, '第5級': 4, '第4級': 4, '第3*級': 2, '第2*級': 2, '第2級': 1}",4,Y,N,N,Y
政大女生宿舍地下室的交誼廳，更常見到有人以檯燈、坐墊或書佔位子，整夜燈火通明亦是一大特色；但在台大男生宿舍方面，楊勝竹卻表示，看電視的人數不減反增，這可能是因大家壓力太大，極需紓解的緣故。,政大 女生 宿舍 地下室 的 交誼廳 更 常 見到 有 人 以 檯燈 坐墊 或 書 佔 位子 整 夜 燈火 通明 亦 是 一 大 特色 但 在 台大 男生 宿舍 方面 楊勝竹 卻 表示 看 電視 的 人數 不 減 反 增 這 可能 是 因 大家 壓力 太 大 極 需 紓解 的 緣故,57,政大(1475) 女生(11889) 宿舍(4509) 地下室(2877) 的(16029838) 交誼廳(263) 更(361676) 常(86207) 見到(30619) 有(2217079) 人(1550512) 以(547785) 檯燈(456) 坐墊(515) 或(478077) 書(174356) 佔(11252) 位子(3921) 整(105785) 夜(31283) 燈火(2411) 通明(698) 亦(68507) 是(4642407) 一(3701681) 大(525780) 特色(16060) 但(597124) 在(3284238) 台大(3363) 男生(10314) 宿舍(4509) 方面(75079) 楊勝竹(Unknown) 卻(333007) 表示(74452) 看(444691) 電視(41289) 的(16029838) 人數(11834) 不(2282521) 減(5855) 反(44292) 增(4086) 這(2114032) 可能(271025) 是(4642407) 因(119364) 大家(109692) 壓力(40408) 太(181732) 大(525780) 極(61390) 需(27999) 紓解(1786) 的(16029838) 緣故(7005),"{'High': 56, 'Low': 1}","{'Unknown': 9, '第2*級': 4, '第4*級': 3, '第1級': 16, '第1*級': 3, '第4級': 6, '第5級': 4, '第3級': 2, '第3*級': 5, '第7級': 1, '第6級': 2, '第2級': 2}",3,Y,Y,N,Y
【記者劉翠芬台北報導】：不同的科系所面臨的期末考的壓力各有不同，學生的應變方式也各有不同。,記者 劉翠芬 台北 報導 不同 的 科系 所 面臨 的 期末考 的 壓力 各 有 不同 學生 的 應變 方式 也 各 有 不同,24,記者(23855) 劉翠芬(Unknown) 台北(22242) 報導(27311) 不同(159432) 的(16029838) 科系(1361) 所(527327) 面臨(16531) 的(16029838) 期末考(346) 的(16029838) 壓力(40408) 各(243023) 有(2217079) 不同(159432) 學生(115846) 的(16029838) 應變(2348) 方式(133407) 也(1590760) 各(243023) 有(2217079) 不同(159432),"{'High': 23, 'Low': 1}","{'第4級': 2, 'Unknown': 3, '第5級': 2, '第3級': 3, '第1級': 8, '第4*級': 2, '第2級': 3, '第6級': 1}",2,Y,N,N,Y
陽明醫學院學生王亮人說，他是屬於平時不努力，臨時抱佛腳的學生。,陽明 醫學院 學生 王亮人 說 他 是 屬於 平時 不 努力 臨時 抱佛腳 的 學生,15,陽明(1185) 醫學院(3732) 學生(115846) 王亮人(Unknown) 說(1285247) 他(2487930) 是(4642407) 屬於(39478) 平時(9449) 不(2282521) 努力(62566) 臨時(7386) 抱佛腳(187) 的(16029838) 學生(115846),"{'High': 14, 'Low': 1}","{'Unknown': 4, '第1級': 7, '第5級': 2, '第4級': 1, '第2級': 1}",3,Y,N,N,Y
一到期末，寢室燈火通明到早晨的情況，已是稀鬆平常的事，同學個個埋頭苦幹，甚至「面露殺機」，。,一 到 期末 寢室 燈火 通明 到 早晨 的 情況 已 是 稀鬆 平常 的 事 同學 個個 埋頭苦幹 甚至 面 露 殺機,23,一(3701681) 到(546906) 期末(384) 寢室(1419) 燈火(2411) 通明(698) 到(546906) 早晨(9117) 的(16029838) 情況(92301) 已(215610) 是(4642407) 稀鬆(671) 平常(17549) 的(16029838) 事(385949) 同學(30250) 個個(5022) 埋頭苦幹(405) 甚至(122502) 面(39563) 露(9521) 殺機(390),{'High': 23},"{'第1級': 7, 'Unknown': 3, '第5級': 2, '第7級': 4, '第4*級': 3, '第4級': 1, '第3級': 1, '第2級': 1, '第1*級': 1}",1,Y,N,N,N
王亮人通常靠意志力熬夜，一旦想到若被二一就要去當兵的命運及關心自己的前途，他就會以此為支撐他繼續讀書的理由。,王亮人 通常 靠 意志力 熬夜 一旦 想到 若 被 二一 就 要 去 當兵 的 命運 及 關心 自己 的 前途 他 就 會 以 此 為 支撐 他 繼續 讀書 的 理由,33,王亮人(Unknown) 通常(56445) 靠(51323) 意志力(2411) 熬夜(1021) 一旦(37557) 想到(48955) 若(92766) 被(540683) 二一(298) 就(1737544) 要(851264) 去(479993) 當兵(1688) 的(16029838) 命運(20184) 及(304586) 關心(22258) 自己(744739) 的(16029838) 前途(6267) 他(2487930) 就(1737544) 會(1014977) 以(547785) 此(288458) 為(761341) 支撐(6335) 他(2487930) 繼續(80649) 讀書(19269) 的(16029838) 理由(32460),"{'Low': 1, 'High': 32}","{'Unknown': 6, '第4級': 4, '第4*級': 2, '第5級': 6, '第2級': 1, '第1級': 9, '第3級': 2, '第1*級': 2, '第6級': 1}",2,Y,Y,N,Y
另一方面，就醫學系二年級的課程而言，解剖學與有機化學占了很大的比例，若這兩課不幸被當，就難逃被二一的命運。,另一方面 就 醫學系 二年級 的 課程 而言 解剖學 與 有機化學 占 了 很 大 的 比例 若 這 兩 課 不幸 被 當 就 難逃 被 二一 的 命運,29,另一方面(15696) 就(1737544) 醫學系(354) 二年級(1797) 的(16029838) 課程(30183) 而言(Unknown) 解剖學(711) 與(968432) 有機化學(70) 占(14546) 了(3199291) 很(715675) 大(525780) 的(16029838) 比例(13747) 若(92766) 這(2114032) 兩(526190) 課(14124) 不幸(17433) 被(540683) 當(294625) 就(1737544) 難逃(1429) 被(540683) 二一(298) 的(16029838) 命運(20184),"{'High': 27, 'Low': 2}","{'Unknown': 11, '第1級': 9, '第4級': 1, '第4*級': 3, '第5級': 2, '第1*級': 1, '第2級': 2}",5,Y,Y,N,N
陽明醫學院每逢考季，晚上會開放兩間教室做為自習的地方，有的學生會帶自己的男女朋友一起看書，為的是互相督促。,陽明 醫學院 每逢 考季 晚上 會 開放 兩 間 教室 做為 自習 的 地方 有的 學生會 帶 自己 的 男女 朋友 一起 看書 為 的 是 互相 督促,28,陽明(1185) 醫學院(3732) 每逢(2021) 考季(10) 晚上(42206) 會(1014977) 開放(17546) 兩(526190) 間(115638) 教室(16437) 做為(19421) 自習(235) 的(16029838) 地方(139164) 有的(31553) 學生會(1015) 帶(105786) 自己(744739) 的(16029838) 男女(14723) 朋友(101331) 一起(79297) 看書(1344) 為(761341) 的(16029838) 是(4642407) 互相(23967) 督促(1317),"{'High': 27, 'Low': 1}","{'Unknown': 11, '第1級': 9, '第1*級': 4, '第4級': 2, '第2級': 1, '第7級': 1}",2,Y,N,N,Y
該校醫學系與護理系有一項特別的傳統，考試前一天晚上，學長、學妹之間會互送宵夜。,該 校 醫學系 與 護理系 有 一 項 特別 的 傳統 考試 前 一 天 晚上 學長 學妹 之間 會 互 送 宵夜,23,該(148369) 校(14484) 醫學系(354) 與(968432) 護理系(26) 有(2217079) 一(3701681) 項(88887) 特別(91212) 的(16029838) 傳統(60517) 考試(12696) 前(272709) 一(3701681) 天(330413) 晚上(42206) 學長(1859) 學妹(317) 之間(117932) 會(1014977) 互(2999) 送(32804) 宵夜(279),"{'High': 22, 'Low': 1}","{'第4*級': 2, 'Unknown': 6, '第1級': 7, '第5級': 1, '第2級': 2, '第3級': 1, '第1*級': 2, '第4級': 2}",2,Y,Y,N,N
王亮人說，期中考時他收到八份宵夜，因忙於吃這些這些宵夜，而失去不少讀書的時間。,王亮人 說 期中考 時 他 收到 八 份 宵夜 因 忙 於 吃 這些 這些 宵夜 而 失去 不少 讀書 的 時間,22,王亮人(Unknown) 說(1285247) 期中考(135) 時(623734) 他(2487930) 收到(12466) 八(54961) 份(53198) 宵夜(279) 因(119364) 忙(26342) 於(327210) 吃(141660) 這些(315113) 這些(315113) 宵夜(279) 而(937923) 失去(39949) 不少(35256) 讀書(19269) 的(16029838) 時間(213595),"{'Low': 1, 'High': 21}","{'Unknown': 7, '第1級': 6, '第3*級': 1, '第2級': 1, '第4級': 2, '第1*級': 1, '第5級': 3, '第3級': 1}",2,Y,Y,N,Y
政治大學英語系二年級學生李蕙蘭說，就該系的課程而言，二年級的必修課比一年級少很多，所以今年似乎不如以前忙碌，且與任課老師有很大的關係，有的學生準備期末考特別輕鬆，有的就沒有那麼幸運了。,政治 大學 英語系 二年級 學生 李蕙蘭 說 就 該 系 的 課程 而言 二年級 的 必修課 比 一年級 少 很多 所以 今年 似乎 不如 以前 忙碌 且 與 任課 老師 有 很 大 的 關係 有的 學生 準備 期末考 特別 輕鬆 有的 就 沒有 那麼 幸運 了,47,政治(79504) 大學(83893) 英語系(171) 二年級(1797) 學生(115846) 李蕙蘭(1) 說(1285247) 就(1737544) 該(148369) 系(4304) 的(16029838) 課程(30183) 而言(Unknown) 二年級(1797) 的(16029838) 必修課(207) 比(170486) 一年級(2113) 少(50762) 很多(113128) 所以(239080) 今年(10836) 似乎(85481) 不如(21722) 以前(59453) 忙碌(6666) 且(67015) 與(968432) 任課(95) 老師(88888) 有(2217079) 很(715675) 大(525780) 的(16029838) 關係(162883) 有的(31553) 學生(115846) 準備(64901) 期末考(346) 特別(91212) 輕鬆(17407) 有的(31553) 就(1737544) 沒有(594280) 那麼(127785) 幸運(10134) 了(3199291),"{'High': 44, 'Low': 3}","{'第4級': 5, '第1級': 16, 'Unknown': 11, '第4*級': 2, '第1*級': 3, '第5級': 2, '第3級': 3, '第2級': 5}",7,Y,Y,N,Y
李蕙蘭認為，熬夜很傷神，且未必有效，所以她一向在考試前定讀書計畫，而不必趕夜車而熬夜。,李蕙蘭 認為 熬夜 很 傷神 且 未必 有效 所以 她 一向 在 考試 前 定 讀書 計畫 而 不必 趕 夜車 而 熬夜,23,李蕙蘭(1) 認為(192030) 熬夜(1021) 很(715675) 傷神(212) 且(67015) 未必(8393) 有效(30667) 所以(239080) 她(1052913) 一向(14985) 在(3284238) 考試(12696) 前(272709) 定(18743) 讀書(19269) 計畫(54820) 而(937923) 不必(29161) 趕(6168) 夜車(273) 而(937923) 熬夜(1021),"{'Low': 1, 'High': 22}","{'Unknown': 5, '第2級': 2, '第4*級': 4, '第1級': 3, '第3級': 3, '第5級': 3, '第1*級': 3}",1,Y,Y,N,Y
一份調查報告顯示，台北市民認為國家未來發展應該以維持秩序、經濟成長等方向為主，比較不重視建立人性化社會、保護言論自由等目標。,一 份 調查 報告 顯示 台北 市民 認為 國家 未來 發展 應該 以 維持 秩序 經濟 成長 等 方向 為主 比較 不 重視 建立 人性化 社會 保護 言論 自由 等 目標,31,一(3701681) 份(53198) 調查(34821) 報告(37237) 顯示(32718) 台北(22242) 市民(6158) 認為(192030) 國家(109166) 未來(54445) 發展(117494) 應該(165478) 以(547785) 維持(31284) 秩序(13855) 經濟(83046) 成長(42450) 等(327380) 方向(39560) 為主(12900) 比較(112212) 不(2282521) 重視(23501) 建立(52946) 人性化(786) 社會(176660) 保護(32573) 言論(6961) 自由(56360) 等(327380) 目標(62638),{'High': 31},"{'第1級': 2, '第2級': 3, '第4*級': 1, '第3級': 1, '第5級': 7, 'Unknown': 3, '第1*級': 2, '第4級': 6, '第3*級': 6}",1,Y,Y,N,N
學者指出，「物質主義」的價值仍然左右台北市民的選擇。,學者 指出 物質 主義 的 價值 仍然 左右 台北 市民 的 選擇,12,學者(28981) 指出(38456) 物質(26384) 主義(82852) 的(16029838) 價值(58784) 仍然(46200) 左右(33714) 台北(22242) 市民(6158) 的(16029838) 選擇(75178),{'High': 12},"{'第4*級': 2, 'Unknown': 2, '第5級': 3, '第1級': 2, '第4級': 1, '第3*級': 2}",0,Y,N,N,N
中央研究院民族學研究所研究員張茂桂調查台北市民對國家不同發展方向的意見，結果發現在一千零九十三個有效樣本中，百分之二十三點九強調維持國家秩序，其次是維持高度經濟成長與確保強大國防，這三項合計就占了全部有效樣本的百分之五十三點二(見附表)。,中央 研究院 民族學 研究所 研究員 張茂桂 調查 台北 市民 對 國家 不同 發展 方向 的 意見 結果 發現 在 一千零九十三 個 有效 樣本 中 百分之二十三點九 強調 維持 國家 秩序 其次 是 維持 高度 經濟 成長 與 確保 強大 國防 這 三 項 合計 就 占 了 全部 有效 樣本 的 百分之五十三點二 見 附表,53,中央(46180) 研究院(5082) 民族學(497) 研究所(12287) 研究員(2609) 張茂桂(26) 調查(34821) 台北(22242) 市民(6158) 對(897964) 國家(109166) 不同(159432) 發展(117494) 方向(39560) 的(16029838) 意見(34740) 結果(114008) 發現(175233) 在(3284238) 一千零九十三(4) 個(2296574) 有效(30667) 樣本(3796) 中(1011729) 百分之二十三點九(1) 強調(36095) 維持(31284) 國家(109166) 秩序(13855) 其次(8985) 是(4642407) 維持(31284) 高度(20229) 經濟(83046) 成長(42450) 與(968432) 確保(9107) 強大(13908) 國防(2717) 這(2114032) 三(313861) 項(88887) 合計(1554) 就(1737544) 占(14546) 了(3199291) 全部(34039) 有效(30667) 樣本(3796) 的(16029838) 百分之五十三點二(Unknown) 見(179113) 附表(193),"{'High': 49, 'Low': 4}","{'第5級': 11, 'Unknown': 14, '第4級': 4, '第4*級': 3, '第1級': 8, '第1*級': 4, '第3級': 1, '第3*級': 3, '第2級': 2, '第6級': 3}",8,Y,Y,N,Y
相比之下，一些屬於理想性、抽象層次較高的方向，例如：讓人民對重大政策有更大的影響力、朝向一個理想重於金錢的社會等，受重視的程度甚至不如穩定物價。,相比 之下 一些 屬於 理想性 抽象 層次 較 高 的 方向 例如 讓 人民 對 重大 政策 有 更 大 的 影響力 朝向 一 個 理想 重於 金錢 的 社會 等 受 重視 的 程度 甚至 不如 穩定 物價,39,相比(8604) 之下(34606) 一些(156929) 屬於(39478) 理想性(141) 抽象(9662) 層次(13487) 較(78424) 高(128858) 的(16029838) 方向(39560) 例如(72240) 讓(526314) 人民(36441) 對(897964) 重大(19228) 政策(30965) 有(2217079) 更(361676) 大(525780) 的(16029838) 影響力(11472) 朝向(4160) 一(3701681) 個(2296574) 理想(27021) 重於(845) 金錢(13136) 的(16029838) 社會(176660) 等(327380) 受(109982) 重視(23501) 的(16029838) 程度(43988) 甚至(122502) 不如(21722) 穩定(19878) 物價(3507),{'High': 39},"{'第5級': 4, 'Unknown': 6, '第1*級': 1, '第6級': 1, '第2級': 2, '第1級': 10, '第3*級': 5, '第4*級': 7, '第4級': 3}",2,Y,Y,N,N
張茂桂認為，這種結果充分反映現階段的台北市民對生理和物質安全的需求大於社會和自我實現的需求，也就是說，台北市仍然是個「物質主義」掛帥的都市。,張茂桂 認為 這 種 結果 充分 反映 現階段 的 台北 市民 對 生理 和 物質 安全 的 需求 大於 社會 和 自我 實現 的 需求 也就是說 台北市 仍然 是 個 物質 主義 掛帥 的 都市,35,張茂桂(26) 認為(192030) 這(2114032) 種(701563) 結果(114008) 充分(18210) 反映(14525) 現階段(1083) 的(16029838) 台北(22242) 市民(6158) 對(897964) 生理(11511) 和(1338337) 物質(26384) 安全(35338) 的(16029838) 需求(29061) 大於(3228) 社會(176660) 和(1338337) 自我(74037) 實現(21995) 的(16029838) 需求(29061) 也就是說(13068) 台北市(4393) 仍然(46200) 是(4642407) 個(2296574) 物質(26384) 主義(82852) 掛帥(724) 的(16029838) 都市(9548),"{'Low': 1, 'High': 34}","{'Unknown': 9, '第2級': 1, '第1級': 8, '第3*級': 2, '第5級': 9, '第3級': 1, '第4級': 3, '第4*級': 1, '第7級': 1}",4,Y,Y,N,Y
他解釋，物質主義是一種重視生理、物質需求的價值觀，例如：強大國防、打擊犯罪、國家秩序、穩定經濟、經濟成長等都直接和生理、物質的需求有關；愈先進的國家，因為生活水準愈高，愈重視心靈層次的需求，所以愈少追求物質主義的價值，但是台北市作為全台灣生活水準最高的城市，卻被物質主義左右，值得市民自我反省。,他 解釋 物質 主義 是 一 種 重視 生理 物質 需求 的 價值觀 例如 強大 國防 打擊 犯罪 國家 秩序 穩定 經濟 經濟 成長 等 都 直接 和 生理 物質 的 需求 有關 愈 先進 的 國家 因為 生活 水準 愈 高 愈 重視 心靈 層次 的 需求 所以 愈 少 追求 物質 主義 的 價值 但是 台北市 作為 全 台灣 生活 水準 最 高 的 城市 卻 被 物質 主義 左右 值得 市民 自我 反省,76,他(2487930) 解釋(59761) 物質(26384) 主義(82852) 是(4642407) 一(3701681) 種(701563) 重視(23501) 生理(11511) 物質(26384) 需求(29061) 的(16029838) 價值觀(8964) 例如(72240) 強大(13908) 國防(2717) 打擊(11256) 犯罪(11684) 國家(109166) 秩序(13855) 穩定(19878) 經濟(83046) 經濟(83046) 成長(42450) 等(327380) 都(1125846) 直接(54798) 和(1338337) 生理(11511) 物質(26384) 的(16029838) 需求(29061) 有關(69607) 愈(40793) 先進(6427) 的(16029838) 國家(109166) 因為(425061) 生活(213189) 水準(9940) 愈(40793) 高(128858) 愈(40793) 重視(23501) 心靈(37927) 層次(13487) 的(16029838) 需求(29061) 所以(239080) 愈(40793) 少(50762) 追求(29080) 物質(26384) 主義(82852) 的(16029838) 價值(58784) 但是(247988) 台北市(4393) 作為(58009) 全(178642) 台灣(130718) 生活(213189) 水準(9940) 最(421680) 高(128858) 的(16029838) 城市(32018) 卻(333007) 被(540683) 物質(26384) 主義(82852) 左右(33714) 值得(34362) 市民(6158) 自我(74037) 反省(6482),{'High': 76},"{'第1級': 14, '第4級': 12, '第5級': 20, 'Unknown': 3, '第3*級': 3, '第4*級': 5, '第6級': 7, '第1*級': 5, '第3級': 4, '第2級': 3}",2,Y,Y,N,N
東吳大學政治系副教授游盈隆指出，這種現象可能是因為台灣雖然高度發展經濟，但卻忽略建立社會福利制度，所以每個人必須先保護自己，比較無法顧及心理層次的需求；此外，台灣長期一直在中共的威脅下求生存，有很高的不安全感，所以就算是台北市民，也很重視生理和物質的安全。,東吳 大學 政治系 副教授 游盈隆 指出 這 種 現象 可能 是 因為 台灣 雖然 高度 發展 經濟 但 卻 忽略 建立 社會 福利 制度 所以 每 個 人 必須 先 保護 自己 比較 無法 顧及 心理 層次 的 需求 此外 台灣 長期 一直 在 中共 的 威脅 下 求 生存 有 很 高 的 不安全感 所以 就算 是 台北 市民 也 很 重視 生理 和 物質 的 安全,68,東吳(3279) 大學(83893) 政治系(220) 副教授(953) 游盈隆(8) 指出(38456) 這(2114032) 種(701563) 現象(47383) 可能(271025) 是(4642407) 因為(425061) 台灣(130718) 雖然(152988) 高度(20229) 發展(117494) 經濟(83046) 但(597124) 卻(333007) 忽略(13056) 建立(52946) 社會(176660) 福利(4311) 制度(37973) 所以(239080) 每(333357) 個(2296574) 人(1550512) 必須(170592) 先(136649) 保護(32573) 自己(744739) 比較(112212) 無法(150606) 顧及(2000) 心理(59538) 層次(13487) 的(16029838) 需求(29061) 此外(30247) 台灣(130718) 長期(28592) 一直(119877) 在(3284238) 中共(19399) 的(16029838) 威脅(18259) 下(329549) 求(30359) 生存(17765) 有(2217079) 很(715675) 高(128858) 的(16029838) 不安全感(Unknown) 所以(239080) 就算(28034) 是(4642407) 台北(22242) 市民(6158) 也(1590760) 很(715675) 重視(23501) 生理(11511) 和(1338337) 物質(26384) 的(16029838) 安全(35338),"{'High': 66, 'Low': 2}","{'Unknown': 12, '第1級': 18, '第4*級': 4, '第1*級': 8, '第2級': 4, '第4級': 5, '第5級': 10, '第3*級': 2, '第6級': 3, '第3級': 2}",4,Y,Y,N,Y
張茂桂抽樣的對象是一九九一年六月以前設籍台北市、二十歲以上的市民，問卷調查的時間是一九九三年八月到九月，用實地面訪的方式，樣本數共一千五百六十二份。,張茂桂 抽樣 的 對象 是 一九九一年 六月 以前 設籍 台北市 二十 歲 以上 的 市民 問卷 調查 的 時間 是 一九九三年 八月 到 九月 用 實地 面訪 的 方式 樣本數 共 一千五百六十二 份,33,張茂桂(26) 抽樣(542) 的(16029838) 對象(28123) 是(4642407) 一九九一年(2183) 六月(14880) 以前(59453) 設籍(60) 台北市(4393) 二十(32739) 歲(130085) 以上(36569) 的(16029838) 市民(6158) 問卷(3188) 調查(34821) 的(16029838) 時間(213595) 是(4642407) 一九九三年(2119) 八月(15534) 到(546906) 九月(15070) 用(377038) 實地(2450) 面訪(25) 的(16029838) 方式(133407) 樣本數(78) 共(32138) 一千五百六十二(2) 份(53198),"{'Low': 5, 'High': 28}","{'Unknown': 12, '第6級': 3, '第1級': 10, '第4級': 1, '第1*級': 2, '第3*級': 1, '第5級': 1, '第4*級': 2, '第2級': 1}",6,Y,Y,N,Y
這份調查報告的題目是〈物質主義與政黨選擇台北市之案例〉，發表在近日的台灣政治學會第一屆年會上。,這 份 調查 報告 的 題目 是 物質 主義 與 政黨 選擇 台北市 之 案例 發表 在 近日 的 台灣 政治 學會 第一 屆 年會 上,26,這(2114032) 份(53198) 調查(34821) 報告(37237) 的(16029838) 題目(8510) 是(4642407) 物質(26384) 主義(82852) 與(968432) 政黨(4138) 選擇(75178) 台北市(4393) 之(875481) 案例(9938) 發表(25858) 在(3284238) 近日(1497) 的(16029838) 台灣(130718) 政治(79504) 學會(25720) 第一(172544) 屆(10220) 年會(822) 上(1233218),{'High': 26},"{'第1級': 6, '第2級': 2, '第4*級': 4, '第3級': 1, '第3*級': 2, '第5級': 5, '第6級': 1, 'Unknown': 3, '第1*級': 1, '第4級': 1}",1,Y,Y,N,N
清華大學、交通大學和省立新竹醫院將在明年元月試辦家庭醫師制度，以教員及其眷屬為對象，若成效不錯，再擴及學生。,清華 大學 交通 大學 和 省立 新竹 醫院 將 在 明年 元月 試辦 家庭 醫師 制度 以 教員 及 其 眷屬 為 對象 若 成效 不錯 再 擴及 學生,29,清華(2203) 大學(83893) 交通(11639) 大學(83893) 和(1338337) 省立(705) 新竹(2736) 醫院(30938) 將(448374) 在(3284238) 明年(3059) 元月(856) 試辦(327) 家庭(60608) 醫師(30062) 制度(37973) 以(547785) 教員(935) 及(304586) 其(307905) 眷屬(785) 為(761341) 對象(28123) 若(92766) 成效(4889) 不錯(23297) 再(326207) 擴及(636) 學生(115846),{'High': 29},"{'Unknown': 10, '第1級': 4, '第3級': 1, '第2級': 2, '第5級': 4, '第1*級': 4, '第4級': 2, '第6級': 1, '第7級': 1}",0,Y,Y,N,Y
