sentence,sentence_preprocessed,sentence_length,word_freq,high_low_freq,word_level,long_word_count,is_complete_sentence,is_complete_context,is_blacklist,is_greylist
楊光友等，是一部融合教育與娛樂之宣導影片，放映時間約五十分鐘。,楊光友 等 是 一 部 融合 教育 與 娛樂 之 宣導 影片 放映 時間 約 五十 分鐘,17,楊光友(Unknown) 等(327380) 是(4642407) 一(3701681) 部(71567) 融合(6722) 教育(71554) 與(968432) 娛樂(8783) 之(875481) 宣導(1111) 影片(33145) 放映(3543) 時間(213595) 約(47731) 五十(17500) 分鐘(52479),"{'Low': 1, 'High': 16}","{'Unknown': 2, '第3*級': 2, '第1級': 3, '第2級': 1, '第5級': 3, '第3級': 1, '第4*級': 1, '第7級': 2, '第4級': 1, '第1*級': 1}",1,Y,Y,N,Y
而各單位應積極準備佈置會場以便放映，縣府則將在十二月廿日下午二時卅分於四樓會議室放映，供員工觀賞。,而 各 單位 應 積極 準備 佈置 會場 以便 放映 縣府 則 將 在 十二月 廿日 下午 二時 卅分 於 四樓 會議室 放映 供 員工 觀賞,26,而(937923) 各(243023) 單位(23148) 應(82417) 積極(24247) 準備(64901) 佈置(1812) 會場(3419) 以便(13160) 放映(3543) 縣府(572) 則(254096) 將(448374) 在(3284238) 十二月(13715) 廿日(126) 下午(20045) 二時(354) 卅分(29) 於(327210) 四樓(650) 會議室(1811) 放映(3543) 供(17109) 員工(31766) 觀賞(5617),"{'High': 25, 'Low': 1}","{'第5級': 7, '第2級': 2, 'Unknown': 10, '第4*級': 1, '第6級': 1, '第7級': 2, '第1*級': 1, '第1級': 1, '第4級': 1}",2,Y,Y,N,N
縣府各單位主管於接獲人事室的該項通告後，因不明劇情而多感嘆說，連省府也了解高雄縣政府的公僕難為。,縣府 各 單位 主管 於 接獲 人事室 的 該 項 通告 後 因 不明 劇情 而 多 感嘆 說 連 省府 也 了解 高雄縣 政府 的 公僕 難為,28,縣府(572) 各(243023) 單位(23148) 主管(23448) 於(327210) 接獲(1016) 人事室(81) 的(16029838) 該(148369) 項(88887) 通告(639) 後(422857) 因(119364) 不明(6635) 劇情(5815) 而(937923) 多(318992) 感嘆(2843) 說(1285247) 連(91153) 省府(372) 也(1590760) 了解(82970) 高雄縣(866) 政府(92663) 的(16029838) 公僕(220) 難為(643),"{'High': 27, 'Low': 1}","{'Unknown': 7, '第2級': 1, '第5級': 6, '第4*級': 2, '第6級': 2, '第1級': 6, '第3*級': 2, '第4級': 1, '第7級': 1}",2,Y,Y,N,N
不願具名的某九職等主管說，縣府值此人心惶惶之時，購買聰明鬼與大傻瓜影片供縣府員工欣賞，莫非有某種層面的意義存在，該片豈可不看。,不 願 具名 的 某 九 職等 主管 說 縣府 值 此 人心惶惶 之 時 購買 聰明 鬼 與 大 傻瓜 影片 供 縣府 員工 欣賞 莫非 有 某 種 層面 的 意義 存在 該 片 豈可 不 看,39,不(2282521) 願(30213) 具名(447) 的(16029838) 某(119862) 九(34506) 職等(99) 主管(23448) 說(1285247) 縣府(572) 值(6859) 此(288458) 人心惶惶(572) 之(875481) 時(623734) 購買(14998) 聰明(27161) 鬼(17921) 與(968432) 大(525780) 傻瓜(3017) 影片(33145) 供(17109) 縣府(572) 員工(31766) 欣賞(17817) 莫非(2217) 有(2217079) 某(119862) 種(701563) 層面(14492) 的(16029838) 意義(71714) 存在(75197) 該(148369) 片(71870) 豈可(881) 不(2282521) 看(444691),"{'High': 38, 'Low': 1}","{'第1級': 8, '第5級': 8, 'Unknown': 8, '第4*級': 5, '第7級': 2, '第3*級': 1, '第4級': 3, '第2*級': 1, '第6級': 2, '第2級': 1}",1,Y,Y,N,N
但主秘柯達盛及人事室主任林一成則鄭重表示，聰明鬼與大傻瓜影片供員工欣賞，純是娛樂性質，但求員工安心觀賞。,但 主秘 柯達盛 及 人事室 主任 林一成 則 鄭重 表示 聰明 鬼 與 大 傻瓜 影片 供 員工 欣賞 純 是 娛樂 性質 但 求 員工 安心 觀賞,28,但(597124) 主秘(21) 柯達盛(Unknown) 及(304586) 人事室(81) 主任(13859) 林一成(2) 則(254096) 鄭重(1865) 表示(74452) 聰明(27161) 鬼(17921) 與(968432) 大(525780) 傻瓜(3017) 影片(33145) 供(17109) 員工(31766) 欣賞(17817) 純(8773) 是(4642407) 娛樂(8783) 性質(11550) 但(597124) 求(30359) 員工(31766) 安心(6114) 觀賞(5617),"{'High': 24, 'Low': 4}","{'第2級': 2, 'Unknown': 5, '第5級': 8, '第4級': 4, '第7級': 1, '第4*級': 5, '第2*級': 1, '第1級': 2}",3,Y,Y,N,Y
日本過期食品傾銷國內，不法的代理商又雪上加霜的以假製造日期矇騙顧客，造成消費上的一大震撼，經國內日前掀起一片不滿聲音後，由於傳言部份逾期食品傾銷東部，引起衛生單位注意，昨台東縣衛生局對準台東大型超市進行檢查。,日本 過期 食品 傾銷 國內 不法 的 代理商 又 雪上加霜 的 以 假 製造 日期 矇騙 顧客 造成 消費 上 的 一 大 震撼 經 國內 日前 掀起 一 片 不滿 聲音 後 由於 傳言 部份 逾期 食品 傾銷 東部 引起 衛生 單位 注意 昨 台東縣 衛生局 對準 台東 大型 超市 進行 檢查,53,日本(105587) 過期(607) 食品(11311) 傾銷(236) 國內(17537) 不法(1309) 的(16029838) 代理商(795) 又(535555) 雪上加霜(688) 的(16029838) 以(547785) 假(18056) 製造(28512) 日期(6537) 矇騙(407) 顧客(25096) 造成(63141) 消費(10821) 上(1233218) 的(16029838) 一(3701681) 大(525780) 震撼(4583) 經(38471) 國內(17537) 日前(1738) 掀起(3479) 一(3701681) 片(71870) 不滿(12145) 聲音(85694) 後(422857) 由於(88111) 傳言(2299) 部份(11022) 逾期(373) 食品(11311) 傾銷(236) 東部(3597) 引起(36729) 衛生(6348) 單位(23148) 注意(49591) 昨(531) 台東縣(438) 衛生局(198) 對準(2444) 台東(2086) 大型(12588) 超市(2748) 進行(100298) 檢查(21295),{'High': 53},"{'第1級': 9, '第4級': 6, 'Unknown': 17, '第6級': 4, '第1*級': 1, '第5級': 6, '第4*級': 4, '第7級': 1, '第2級': 4, '第2*級': 1}",4,Y,Y,N,N
逾期的日本食品，經消費者文教基金會在日前對國內消費者提出警告，呼籲消費者在選購日本食品時，應詳查製造日期，使用期限。,逾期 的 日本 食品 經 消費者 文教 基金會 在 日前 對 國內 消費者 提出 警告 呼籲 消費者 在 選購 日本 食品 時 應 詳查 製造 日期 使用 期限,28,逾期(373) 的(16029838) 日本(105587) 食品(11311) 經(38471) 消費者(15236) 文教(1353) 基金會(7844) 在(3284238) 日前(1738) 對(897964) 國內(17537) 消費者(15236) 提出(63073) 警告(11012) 呼籲(3515) 消費者(15236) 在(3284238) 選購(915) 日本(105587) 食品(11311) 時(623734) 應(82417) 詳查(98) 製造(28512) 日期(6537) 使用(99640) 期限(3403),"{'High': 27, 'Low': 1}","{'Unknown': 9, '第1級': 4, '第5級': 5, '第7級': 2, '第1*級': 2, '第4級': 3, '第6級': 1, '第3*級': 1, '第4*級': 1}",4,Y,N,N,N
由於許多不肖代理商或經銷商以偽造的製造日期或標示，粘貼於原廠製造日期上，且又不標示代理商名稱及使用期限，使得不少消費者無法辨識。,由於 許多 不肖 代理商 或 經銷商 以 偽造 的 製造 日期 或 標示 粘貼 於 原 廠 製造 日期 上 且 又 不 標示 代理商 名稱 及 使用 期限 使得 不少 消費者 無法 辨識,34,由於(88111) 許多(159791) 不肖(928) 代理商(795) 或(478077) 經銷商(1679) 以(547785) 偽造(1809) 的(16029838) 製造(28512) 日期(6537) 或(478077) 標示(4576) 粘貼(31) 於(327210) 原(33852) 廠(4599) 製造(28512) 日期(6537) 上(1233218) 且(67015) 又(535555) 不(2282521) 標示(4576) 代理商(795) 名稱(11922) 及(304586) 使用(99640) 期限(3403) 使得(30960) 不少(35256) 消費者(15236) 無法(150606) 辨識(4831),"{'High': 33, 'Low': 1}","{'第4*級': 4, '第3*級': 1, '第7級': 1, 'Unknown': 7, '第3級': 3, '第5級': 8, '第6級': 3, '第1級': 3, '第4級': 3, '第1*級': 1}",4,Y,Y,N,N
縣內大型超市均為縣農會或地區農會所開設，美其名是農產自製自銷，節省承銷成本，但賣場內卻絕大部份是非農產食品或用品，似已逾越本意。,縣 內 大型 超市 均 為 縣 農會 或 地區 農會 所 開設 美其名 是 農產 自製 自銷 節省 承銷 成本 但 賣場 內 卻 絕大部份 是 非 農產 食品 或 用品 似 已 逾越 本意,36,縣(9693) 內(183051) 大型(12588) 超市(2748) 均(27783) 為(761341) 縣(9693) 農會(494) 或(478077) 地區(40339) 農會(494) 所(527327) 開設(3274) 美其名(313) 是(4642407) 農產(272) 自製(1854) 自銷(89) 節省(3777) 承銷(194) 成本(20612) 但(597124) 賣場(1206) 內(183051) 卻(333007) 絕大部份(269) 是(4642407) 非(112415) 農產(272) 食品(11311) 或(478077) 用品(4495) 似(17655) 已(215610) 逾越(779) 本意(1756),"{'High': 35, 'Low': 1}","{'第5級': 6, '第3級': 5, 'Unknown': 14, '第2*級': 1, '第6級': 3, '第4級': 2, '第2級': 2, '第1級': 2, '第7級': 1}",2,Y,Y,N,N
而就因賣場大，流量高，因此過期食品傾銷至此，如果消費大眾未注意，根本無法認清楚販賣的食品是否過期。,而 就 因 賣場 大 流量 高 因此 過期 食品 傾銷至 此 如果 消費 大眾 未 注意 根本 無法 認 清楚 販賣 的 食品 是否 過期,26,而(937923) 就(1737544) 因(119364) 賣場(1206) 大(525780) 流量(1498) 高(128858) 因此(184606) 過期(607) 食品(11311) 傾銷至(Unknown) 此(288458) 如果(322121) 消費(10821) 大眾(22411) 未(101927) 注意(49591) 根本(66330) 無法(150606) 認(5129) 清楚(76185) 販賣(3252) 的(16029838) 食品(11311) 是否(78907) 過期(607),"{'High': 25, 'Low': 1}","{'第5級': 8, '第1級': 4, 'Unknown': 7, '第4*級': 2, '第4級': 2, '第2級': 3}",1,Y,Y,N,N
為了針對大賣場容易因魚目混珠，使過期食品輕易的矇混過關，昨台東縣衛生局人員前往超市檢查可疑食品十數樣，並一一採樣。,為 了 針對 大 賣場 容易 因 魚目混珠 使 過期 食品 輕易 的 矇混 過關 昨 台東縣 衛生局 人員 前往 超市 檢查 可疑 食品 十數 樣 並 一一 採樣,29,為(761341) 了(3199291) 針對(23174) 大(525780) 賣場(1206) 容易(80831) 因(119364) 魚目混珠(136) 使(197544) 過期(607) 食品(11311) 輕易(10800) 的(16029838) 矇混(143) 過關(1379) 昨(531) 台東縣(438) 衛生局(198) 人員(49261) 前往(27321) 超市(2748) 檢查(21295) 可疑(2779) 食品(11311) 十數(787) 樣(31330) 並(442790) 一一(11524) 採樣(207),{'High': 29},"{'Unknown': 14, '第6級': 4, '第1級': 3, '第5級': 3, '第4級': 2, '第2*級': 1, '第3級': 1, '第4*級': 1}",3,Y,Y,N,N
衛生局說，如果明知所販賣之食品已過期，但仍予販賣，很顯然的已涉及現行食品衛生管理辦法之規定，需負刑事或民事責任。,衛生局 說 如果 明知 所 販賣 之 食品 已 過期 但 仍 予 販賣 很 顯然 的 已 涉及 現行 食品 衛生 管理 辦法 之 規定 需 負 刑事 或 民事 責任,32,衛生局(198) 說(1285247) 如果(322121) 明知(2616) 所(527327) 販賣(3252) 之(875481) 食品(11311) 已(215610) 過期(607) 但(597124) 仍(92056) 予(6046) 販賣(3252) 很(715675) 顯然(34133) 的(16029838) 已(215610) 涉及(9123) 現行(1947) 食品(11311) 衛生(6348) 管理(54484) 辦法(43280) 之(875481) 規定(24592) 需(27999) 負(7238) 刑事(1807) 或(478077) 民事(642) 責任(29747),{'High': 32},"{'Unknown': 5, '第1級': 3, '第2級': 5, '第6級': 4, '第5級': 7, '第3級': 3, '第4級': 4, '第4*級': 1}",1,Y,Y,N,N
衛生局人員並指出，如過期食品包裝上有代理商之名稱地址，將自行與代理商聯絡，但如標示不明，且未有代理商名稱，則將由農會自行提出說明。,衛生局 人員 並 指出 如 過期 食品 包裝 上 有 代理商 之 名稱 地址 將 自行 與 代理商 聯絡 但 如 標示 不明 且 未 有 代理商 名稱 則 將 由 農會 自行 提出 說明,35,衛生局(198) 人員(49261) 並(442790) 指出(38456) 如(195069) 過期(607) 食品(11311) 包裝(5682) 上(1233218) 有(2217079) 代理商(795) 之(875481) 名稱(11922) 地址(5736) 將(448374) 自行(9833) 與(968432) 代理商(795) 聯絡(7975) 但(597124) 如(195069) 標示(4576) 不明(6635) 且(67015) 未(101927) 有(2217079) 代理商(795) 名稱(11922) 則(254096) 將(448374) 由(208604) 農會(494) 自行(9833) 提出(63073) 說明(52918),{'High': 35},"{'Unknown': 10, '第5級': 10, '第4*級': 5, '第4級': 3, '第1級': 3, '第2*級': 1, '第2級': 1, '第6級': 1, '第3級': 1}",4,Y,Y,N,N
據悉，昨衛局的這項檢查中，除針對逾期的日本食品外，尚針對由台東產地自行製造，銷往日本而遭日本打回票，乾脆在過期後，傾銷台東市場的包裝農特產品。,據悉 昨 衛局 的 這 項 檢查 中 除 針對 逾期 的 日本 食品 外 尚 針對 由 台東 產地 自行 製造 銷 往 日本 而 遭 日本 打回票 乾脆 在 過期 後 傾銷 台東 市場 的 包裝 農 特產品,40,據悉(283) 昨(531) 衛局(Unknown) 的(16029838) 這(2114032) 項(88887) 檢查(21295) 中(1011729) 除(15929) 針對(23174) 逾期(373) 的(16029838) 日本(105587) 食品(11311) 外(109310) 尚(26113) 針對(23174) 由(208604) 台東(2086) 產地(1056) 自行(9833) 製造(28512) 銷(1155) 往(95775) 日本(105587) 而(937923) 遭(18764) 日本(105587) 打回票(76) 乾脆(8079) 在(3284238) 過期(607) 後(422857) 傾銷(236) 台東(2086) 市場(65023) 的(16029838) 包裝(5682) 農(2381) 特產品(60),"{'High': 37, 'Low': 3}","{'第7級': 2, 'Unknown': 12, '第1級': 9, '第5級': 6, '第4級': 2, '第3*級': 1, '第6級': 3, '第4*級': 2, '第2級': 2, '第1*級': 1}",2,Y,Y,N,N
由市區的民生等九個派出所各自繪製的打擊犯罪宣導車，張貼五顏六色的標語海報，寫著打擊犯罪，人人有責等語，在省立屏工樂隊的導引下，加上義警單位出動的十三部車及扶輪社會員們的鼎力支持配合，卅餘部的打擊犯罪宣傳車一部部地緊跟著，在市區內廣播繞行，好不熱鬧。,由 市區 的 民生 等 九 個 派出所 各自 繪製 的 打擊 犯罪 宣導車 張貼 五顏六色 的 標語 海報 寫 著 打擊 犯罪 人人 有 責 等 語 在 省立 屏工 樂隊 的 導引 下 加上 義警 單位 出動 的 十三 部 車 及 扶輪社 會員 們 的 鼎力 支持 配合 卅餘 部 的 打擊 犯罪 宣傳車 一部部 地 緊跟 著 在 市區 內 廣播 繞行 好不 熱鬧,68,由(208604) 市區(3749) 的(16029838) 民生(2666) 等(327380) 九(34506) 個(2296574) 派出所(646) 各自(14976) 繪製(2306) 的(16029838) 打擊(11256) 犯罪(11684) 宣導車(Unknown) 張貼(1179) 五顏六色(702) 的(16029838) 標語(1776) 海報(3744) 寫(113933) 著(1004687) 打擊(11256) 犯罪(11684) 人人(12728) 有(2217079) 責(2713) 等(327380) 語(13797) 在(3284238) 省立(705) 屏工(Unknown) 樂隊(1811) 的(16029838) 導引(2160) 下(329549) 加上(38121) 義警(13) 單位(23148) 出動(2136) 的(16029838) 十三(9810) 部(71567) 車(47590) 及(304586) 扶輪社(212) 會員(5850) 們(140794) 的(16029838) 鼎力(404) 支持(42489) 配合(17173) 卅餘(21) 部(71567) 的(16029838) 打擊(11256) 犯罪(11684) 宣傳車(62) 一部部(13) 地(754998) 緊跟(1810) 著(1004687) 在(3284238) 市區(3749) 內(183051) 廣播(9358) 繞行(581) 好不(795) 熱鬧(6537),"{'High': 62, 'Low': 6}","{'第4*級': 7, '第3*級': 5, '第1級': 13, '第6級': 6, 'Unknown': 19, '第5級': 8, '第2級': 3, '第1*級': 3, '第3級': 2, '第4級': 1, '第7級': 1}",6,Y,Y,N,N
昨日下午，除了警分局的打擊犯罪宣導車外，另亦有民間慶典的鑼鼓車陣遊行，一時間，市區的交通頗為熱鬧擁擠。,昨日 下午 除了 警分局 的 打擊 犯罪 宣導車 外 另 亦 有 民間 慶典 的 鑼鼓 車陣 遊行 一時 間 市區 的 交通 頗為 熱鬧 擁擠,26,昨日(2036) 下午(20045) 除了(75964) 警分局(5) 的(16029838) 打擊(11256) 犯罪(11684) 宣導車(Unknown) 外(109310) 另(138369) 亦(68507) 有(2217079) 民間(16236) 慶典(1885) 的(16029838) 鑼鼓(409) 車陣(369) 遊行(3347) 一時(19906) 間(115638) 市區(3749) 的(16029838) 交通(11639) 頗為(6100) 熱鬧(6537) 擁擠(3026),"{'High': 24, 'Low': 2}","{'第5級': 3, '第1級': 6, '第3*級': 3, 'Unknown': 6, '第4*級': 3, '第3級': 2, '第6級': 3}",2,Y,Y,N,N
屏東警分局在此次的預防犯罪宣導中，除了派員對學生演講宣導外，針對安非他命的毒侵校園氾濫情形，都會再集合老師們做安非他命的展示與吸食講解，每每引來老師們的好奇圍觀，一窺安公子的致命吸引力。,屏東 警分局 在 此 次 的 預防 犯罪 宣導 中 除了 派員 對 學生 演講 宣導 外 針對 安非他命 的 毒 侵 校園 氾濫 情形 都 會 再 集合 老師 們 做 安非他命 的 展示 與 吸食 講解 每每 引來 老師 們 的 好奇 圍觀 一 窺 安公子 的 致命 吸引力,51,屏東(1874) 警分局(5) 在(3284238) 此(288458) 次(331701) 的(16029838) 預防(8608) 犯罪(11684) 宣導(1111) 中(1011729) 除了(75964) 派員(584) 對(897964) 學生(115846) 演講(16050) 宣導(1111) 外(109310) 針對(23174) 安非他命(486) 的(16029838) 毒(9683) 侵(2156) 校園(7406) 氾濫(1418) 情形(35199) 都(1125846) 會(1014977) 再(326207) 集合(4751) 老師(88888) 們(140794) 做(411649) 安非他命(486) 的(16029838) 展示(9373) 與(968432) 吸食(1214) 講解(1841) 每每(2357) 引來(2555) 老師(88888) 們(140794) 的(16029838) 好奇(13958) 圍觀(1491) 一(3701681) 窺(1764) 安公子(31) 的(16029838) 致命(4827) 吸引力(5086),"{'High': 49, 'Low': 2}","{'Unknown': 11, '第1*級': 3, '第5級': 6, '第2級': 1, '第1級': 15, '第4*級': 3, '第7級': 2, '第3*級': 2, '第4級': 2, '第6級': 5, '第3級': 1}",5,Y,Y,N,N
昨日上午八時，警分局刑事組長吳安文及幹員林榮棟應邀至轄境的大同國中，進行預防犯罪的宣導活動，特別是針對各界全力掃蕩的安非他命，由吳組長以實際案例，向學生做警民合作。,昨日 上午 八時 警分局 刑事組長 吳安文 及 幹員 林榮棟 應邀至 轄境 的 大同 國中 進行 預防 犯罪 的 宣導 活動 特別 是 針對 各界 全 力 掃蕩 的 安非他命 由 吳 組長 以 實際 案例 向 學生 做 警 民 合作,41,昨日(2036) 上午(6241) 八時(307) 警分局(5) 刑事組長(33) 吳安文(Unknown) 及(304586) 幹員(231) 林榮棟(Unknown) 應邀至(23) 轄境(105) 的(16029838) 大同(2367) 國中(5108) 進行(100298) 預防(8608) 犯罪(11684) 的(16029838) 宣導(1111) 活動(85743) 特別(91212) 是(4642407) 針對(23174) 各界(2155) 全(178642) 力(13779) 掃蕩(748) 的(16029838) 安非他命(486) 由(208604) 吳(8226) 組長(1727) 以(547785) 實際(52755) 案例(9938) 向(231672) 學生(115846) 做(411649) 警(964) 民(8043) 合作(35908),"{'High': 36, 'Low': 5}","{'第5級': 6, '第1級': 7, 'Unknown': 15, '第7級': 3, '第4級': 1, '第4*級': 3, '第2級': 4, '第6級': 1, '第3*級': 1}",6,Y,Y,N,Y
打擊犯罪宣導，並要人人做到勇於檢舉犯罪，請即撥一一0與警連繫。,打擊 犯罪 宣導 並 要 人人 做到 勇於 檢舉 犯罪 請 即 撥 一一0 與 警 連繫,17,打擊(11256) 犯罪(11684) 宣導(1111) 並(442790) 要(851264) 人人(12728) 做到(19894) 勇於(3436) 檢舉(904) 犯罪(11684) 請(120629) 即(110826) 撥(4728) 一一0(Unknown) 與(968432) 警(964) 連繫(1825),"{'High': 16, 'Low': 1}","{'第5級': 3, '第4*級': 4, '第7級': 2, '第1級': 2, 'Unknown': 3, '第3*級': 1, '第6級': 2}",1,Y,Y,N,Y
吳組長並告訴同學們有關非法持有及吸食安非他命的量刑，讓大家有所警愓防範。,吳 組長 並 告訴 同學 們 有關 非法 持有 及 吸食 安非他命 的 量刑 讓 大家 有 所 警愓 防範,20,吳(8226) 組長(1727) 並(442790) 告訴(122898) 同學(30250) 們(140794) 有關(69607) 非法(3229) 持有(4356) 及(304586) 吸食(1214) 安非他命(486) 的(16029838) 量刑(152) 讓(526314) 大家(109692) 有(2217079) 所(527327) 警愓(29) 防範(2852),"{'High': 19, 'Low': 1}","{'Unknown': 7, '第4*級': 1, '第1級': 5, '第4級': 1, '第5級': 2, '第6級': 2, '第2級': 2}",1,Y,Y,N,Y
由台南縣記者公會主辦的模特兒攝影比賽，昨天上午假玉井鄉龍目井觀光農場舉行，一時吸引了大批愛好攝影的人士，在場攝取自認為最美的鏡頭，場面熱烈。,由 台南縣 記者 公會 主辦 的 模特兒 攝影 比賽 昨天 上午 假 玉井鄉 龍目井 觀光 農場 舉行 一時 吸引 了 大 批 愛好 攝影 的 人士 在場 攝取 自認為 最 美 的 鏡頭 場面 熱烈,35,由(208604) 台南縣(404) 記者(23855) 公會(2322) 主辦(2897) 的(16029838) 模特兒(3012) 攝影(12899) 比賽(20220) 昨天(12735) 上午(6241) 假(18056) 玉井鄉(5) 龍目井(3) 觀光(4478) 農場(4915) 舉行(17660) 一時(19906) 吸引(20619) 了(3199291) 大(525780) 批(22121) 愛好(4209) 攝影(12899) 的(16029838) 人士(27666) 在場(7726) 攝取(4975) 自認為(2006) 最(421680) 美(53380) 的(16029838) 鏡頭(17952) 場面(8744) 熱烈(5597),"{'High': 33, 'Low': 2}","{'第4*級': 2, 'Unknown': 7, '第4級': 5, '第5級': 10, '第1級': 6, '第2級': 1, '第6級': 2, '第1*級': 2}",5,Y,N,N,N
攝影比賽中有數十名專業的模特兒，無懼風寒，穿著新潮的泳裝，在青山綠水間，搔首弄姿，美女與美景相映成趣，供人拍照。,攝影 比賽 中 有 數十 名 專業 的 模特兒 無 懼 風寒 穿著 新潮 的 泳裝 在 青山綠水 間 搔首弄姿 美女 與 美景 相映成趣 供 人 拍照,27,攝影(12899) 比賽(20220) 中(1011729) 有(2217079) 數十(9385) 名(136287) 專業(33030) 的(16029838) 模特兒(3012) 無(157858) 懼(2216) 風寒(650) 穿著(11114) 新潮(686) 的(16029838) 泳裝(252) 在(3284238) 青山綠水(123) 間(115638) 搔首弄姿(114) 美女(6496) 與(968432) 美景(2063) 相映成趣(101) 供(17109) 人(1550512) 拍照(2914),{'High': 27},"{'第5級': 5, '第2級': 2, 'Unknown': 10, '第1級': 4, '第4級': 1, '第7級': 2, '第1*級': 1, '第4*級': 1, '第3級': 1}",4,Y,Y,N,N
據農場指出，模特兒泳裝攝影比賽，年年舉辦，每一名模特兒都年輕貌美，表現得落落大方，而且，每次的模特兒都是新面孔。,據 農場 指出 模特兒 泳裝 攝影 比賽 年年 舉辦 每 一 名 模特兒 都 年輕 貌美 表現 得 落落大方 而且 每 次 的 模特兒 都 是 新 面孔,28,據(24392) 農場(4915) 指出(38456) 模特兒(3012) 泳裝(252) 攝影(12899) 比賽(20220) 年年(2228) 舉辦(12070) 每(333357) 一(3701681) 名(136287) 模特兒(3012) 都(1125846) 年輕(48853) 貌美(869) 表現(67272) 得(573721) 落落大方(Unknown) 而且(180402) 每(333357) 次(331701) 的(16029838) 模特兒(3012) 都(1125846) 是(4642407) 新(212453) 面孔(4093),"{'High': 27, 'Low': 1}","{'第4*級': 1, '第5級': 5, 'Unknown': 6, '第2級': 4, '第4級': 2, '第1*級': 2, '第1級': 6, '第3級': 1, '第6級': 1}",4,Y,Y,N,N
昨天的比賽，以農場的愛之湖。,昨天 的 比賽 以 農場 的 愛 之 湖,9,昨天(12735) 的(16029838) 比賽(20220) 以(547785) 農場(4915) 的(16029838) 愛(124337) 之(875481) 湖(8772),{'High': 9},"{'第1級': 4, '第2級': 1, '第5級': 3, '第4*級': 1}",0,Y,N,N,N
木屋。,木屋,1,木屋(2137),{'High': 1},{'Unknown': 1},0,N,N,N,N
蒙古包等遊覽據點為背景，讓愛好此道的朋友大顯身手。,蒙古包 等 遊覽 據點 為 背景 讓 愛好 此 道 的 朋友 大顯身手,13,蒙古包(162) 等(327380) 遊覽(1311) 據點(2750) 為(761341) 背景(23264) 讓(526314) 愛好(4209) 此(288458) 道(141723) 的(16029838) 朋友(101331) 大顯身手(313),{'High': 13},"{'Unknown': 4, '第3*級': 1, '第5級': 2, '第6級': 1, '第4*級': 1, '第2級': 1, '第4級': 1, '第1級': 2}",2,Y,Y,N,N
比賽由台南縣縣長李雅樵揭幕。,比賽 由 台南縣 縣長 李雅樵 揭幕,6,比賽(20220) 由(208604) 台南縣(404) 縣長(2523) 李雅樵(9) 揭幕(272),"{'High': 5, 'Low': 1}","{'第2級': 1, '第4*級': 1, 'Unknown': 3, '第6級': 1}",2,Y,N,N,Y
不滿台東分局刑事幹員於酒後打人，又藉故冠上妨害公務與毀損罪名，青年陳國平家屬昨具狀向議會陳情，引起一陣騷動。,不滿 台東 分局 刑事 幹員 於 酒 後 打 人 又 藉故 冠上 妨害 公務 與 毀損 罪名 青年 陳國平 家屬 昨 具狀 向 議會 陳情 引起 一 陣 騷動,30,不滿(12145) 台東(2086) 分局(510) 刑事(1807) 幹員(231) 於(327210) 酒(46479) 後(422857) 打(76962) 人(1550512) 又(535555) 藉故(444) 冠上(789) 妨害(646) 公務(1506) 與(968432) 毀損(605) 罪名(4024) 青年(18436) 陳國平(10) 家屬(4509) 昨(531) 具狀(30) 向(231672) 議會(3467) 陳情(493) 引起(36729) 一(3701681) 陣(26383) 騷動(3791),"{'High': 28, 'Low': 2}","{'第5級': 3, 'Unknown': 9, '第6級': 5, '第1*級': 2, '第1級': 4, '第7級': 2, '第4*級': 3, '第2級': 1, '第4級': 1}",1,Y,Y,N,Y
台東分局昨指出，陳某胡說八道，並無挨打情事，只有幹員被打。,台東 分局 昨 指出 陳某 胡說八道 並 無 挨打 情事 只有 幹員 被 打,14,台東(2086) 分局(510) 昨(531) 指出(38456) 陳某(68) 胡說八道(1544) 並(442790) 無(157858) 挨打(1077) 情事(1210) 只有(43745) 幹員(231) 被(540683) 打(76962),"{'High': 13, 'Low': 1}","{'Unknown': 7, '第6級': 1, '第4*級': 1, '第5級': 2, '第7級': 1, '第2級': 1, '第1級': 1}",1,Y,Y,N,Y
兩方說詞不一，事態已有擴大之勢。,兩 方 說詞 不一 事態 已 有 擴大 之 勢,10,兩(526190) 方(33724) 說詞(1314) 不一(3317) 事態(1997) 已(215610) 有(2217079) 擴大(12352) 之(875481) 勢(7403),{'High': 10},"{'第1級': 2, '第3*級': 1, '第7級': 2, 'Unknown': 2, '第3級': 1, '第5級': 2}",0,Y,N,N,N
