left_word,target_word,right_word,context
是,難得,孔融,見到 好吃 的 東西 都 是 挑 最 大 的 只有 你 是 挑 最 小 的 真 是 難得 孔融 從 籃子 裡 拿出 一 個 梨 來 媽 我 要 這 一 個 母親 你 拿去
是,難得,真,梨 來 媽 我 要 這 一 個 母親 你 拿去 吧 孔融 走出 書房 父親 點頭 真 是 難得 真 是 難得 轉 過 頭 融兒 母親 笑 出去 玩兒 了 父親 很 高興 這麼 小 的
是,難得,轉,我 要 這 一 個 母親 你 拿去 吧 孔融 走出 書房 父親 點頭 真 是 難得 真 是 難得 轉 過 頭 融兒 母親 笑 出去 玩兒 了 父親 很 高興 這麼 小 的 孩子 就 知道
是,難免,的,問 李 先生 難道 你 從來 不 生氣 嗎 他 回答 說 遇到 不 順心 的 事情 生氣 是 難免 的 但是 你 只要 多 替 別人 想想 氣 就 消 了 我 總 覺得 隨便 對 人
上,總是,笑咪咪,淘氣 我 的 功課 一天天 進步 也 喜歡 跟 同學 在一起 老師 每 次 見 了 我 臉 上 總是 笑咪咪 謝謝 老師 的 關心 謝謝 老師 的 教導 老師 對 我 的 恩惠 不 知道 怎麼 報答
