left_word,target_word,right_word,context
玩,難得,以,但 覺得 十分 新鮮 對於 這 次 出國 演出 的 機會 林希哲 表示 以前 都 是 出國 去 玩 難得 以 代表團 的 身分 出國 表演 他 希望 透過 學術 交流 了解 日本 打擊樂 的 環境 及 發展
相當,難得,的,壓力 很 大 不過 這 次 日本 之 行 將 順道 拜訪 世界 知名 的 木琴家 安倍圭子 是 相當 難得 的 經驗 由 文化 大學 主辦 的 第十二 屆 全國 大專 創作 歌謠 比賽 元月 一日 到 二十日
表示,的確,是,董事 辜振甫 的 兒子 同時 也 是 校友 的 辜仲諒 也 現場 表演 十 球 體育組 老師 皆 表示 的確 是 職業級 的 但 可惜 的 是 當天 的 比賽 並 沒有 如願 出現 一 桿 進 洞
配售,的確,是,是 糾彈 財政部長 國有 財產 局長 違法 出售 國土 然而 政大 校長 鄭丁旺 認為 目前 化南 新村 的 配售 的確 是 依法 行事 即使 修改 法令 因為 法律 不 溯 既往 化南 新村 決定 配售 的 事實 也
仍然,難免,會,承擔 技術 侵權 之 無限 責任 因為 獨立 研究 之 技術 縱使 經過 事 前 之 專利 檢索 仍然 難免 會 有 侵害 他人 專利權 之 情形 發生 因此 本 院 原則上 1不 保證 使用 本 院 之
時,總是,以為,那 時候 叫作 超人力霸王 是 高永 童年 時 曾 臨摹 過 的 對象 高永 回憶起 剛 進 大學 時 總是 以為 自己 已 遠離 令 他 痴狂 的 漫畫 而 走上 司法 的 路 他 表示 當時 真的
能,有助於,溝通,學期 則 上 兩性 關係 個案 輔導 與 諮商 技巧 是 希望 加強 導師 對 學生 的 了解 能 有助於 溝通 上課 採 自願 方式 導師 可 自行 決定 是否 上課 這 學期 報名 上課 的 老師 有
且,有助於,變化,應 等高 或 垂直 的 視平線 或 輪廓線 利用 景物 和 靜物 的 突出 部分 間隔成 高低 錯落 且 有助於 變化 的 線條 如此一來 他 改變 並且 豐富 了 我們 習慣性 的 視覺 世界 使 我們 的 視野
