left_word,target_word,right_word,context
是,難得,的,充滿 希望 菲哥 對 蕭 大 美女 也 能 出書 更 是 讚不絕口 直 誇 她 內外 兼修 是 難得 的 世紀 美女 曾 以 西螺 七 崁 紅遍 全 台 的 老牌 台語 諧星 武拉運 難得 為了
武拉運,難得,為了,兼修 是 難得 的 世紀 美女 曾 以 西螺 七 崁 紅遍 全 台 的 老牌 台語 諧星 武拉運 難得 為了 金門 電影 再度 露面 告訴 大家 金門 電影 金 好看 信樂團 及 林曉培 張惠妹 秀蘭瑪雅 不約而同 都
一半,的確,是,活 海鮮 價格 貴 得 嚇人 的 香港 海鮮 餐廳 心 裏 想 的 和 實際 情況 對 一半 的確 是 香港 餐廳 但 不光 賣 活 海鮮 除了 火鍋 以外 還 有 天下 第一 炒 與 天下
價格,的確,不,賣 活 海鮮 除了 火鍋 以外 還 有 天下 第一 炒 與 天下 第一 撈 熱炒 與 甜點 價格 的確 不 便宜 若要 吃到 上述 的 三 大 美食 每 人 平均 要 花 1200 元 可是 當
酒吧,總是,充斥,句點 但 沙瓦托利 無限 的 悲傷 才 正 要 開始 每 年 的 九 十月 峇里島 的 夜間 酒吧 總是 充斥 著 英 美 澳 和 其他 歐洲 觀光客 其中 澳洲 橄欖 球員 經常 選擇 峇里島 做 他們
母親,總是,一,連 惟一 的 兒子 也 讓 父母 撫養 從來 不 知道 什麼 叫做 負責任 每 次 這 位 母親 總是 一 把 鼻涕 一 把 眼淚 怨天尤人 的 談 這 個 兒子 但 除此之外 她 也 不 知道
情,總是,讓,這 對 父母親 乾脆 不要 再 管 了 一 人 做 事 一 人 當 但 骨肉 之 情 總是 讓 這 對 父母親 一而再再而三 地 軟化 下來 而 他們 的 兒子 當然 就 更 肆無忌憚 地 揮霍
綠茶,有助於,婦女,口服 避孕藥 體能 活動 和 家族 卵巢癌 的 病史 等等 結果 顯示 每 天 喝 茶 尤其 是 綠茶 有助於 婦女 預防 卵巢癌 這 項 研究 發現 增加 喝茶量 而且 多 年 喝 茶 的 婦女 罹患 卵巢癌
