left_word,target_word,right_word,context
把握住,難得,的,獨立 製片 鍾愛 一 世 情 中 作家 女友 角色 的 第一 人選 意外 懷孕 無法 演出 齊薇格 把握住 難得 的 接替 機會 結果 不僅 在 1996年 日舞 影展 讓 影評 們 對 這 張 新面孔 刮目相看 不但
喜劇片,難得,一,演出 博得 觀眾 和 影評人 的 掌聲 電影 上映 時 也 佳評 如 潮 賣出 了 一般 文藝 喜劇片 難得 一 見 的 好 票房 同時 還 獲得 2002年 奧斯卡 最佳 女 主角 的 提名 而 此時 的
學校,畢竟,是,成大 MP3 台大 抓到 通緝犯 等 事件 都 是 發生 在 宿舍 裡面 顯然 宿舍 管理 有待 加強 學校 畢竟 是 教育 單位 但 處理 類似 問題 僅只 表達 立場 鋒頭 一 過 就 如 船 過 水
個性,畢竟,芭蕾,於 以 芭蕾 優雅 演出 的 卡門 方式 西班牙舞 的 卡門 更 能 深切 的 呈現出 卡門 的 個性 畢竟 芭蕾 舞鞋 限制 了 在 舞蹈 中 採用 西班牙式 技巧 因此 若 論 芭蕾舞 的 卡門 與 西班牙舞
努力,畢竟,藝術,從中 我 卻 學習到 堅實 的 舞蹈 歷程 別人 的 批評 只 能 讓 我 知道 必須 更加 努力 畢竟 藝術 是 無止盡 的 追求 真善美 1985年 劉鳳學 教授 任 國立 藝專 舞蹈科 主任 她 是 一 位
徒然,畢竟,獅藝,大力 推廣 的 大家 對 獅藝 是 什麼 也 未 搞清 時 舉辦 什麼 表演 比賽 也 是 徒然 畢竟 獅藝 除了 有 娛樂性 之外 還 有 很 的 欣賞 價值 獅子 傳入 後 已 融入 中國 的
政策,的確,是,可以 免稅 退稅 誘因 吸引 國際 友人 前來 台灣 基本 上 對 外國 觀光客 採取 購物 免稅 優待 政策 的確 是 一 項 實惠 而且 深具 號召力 的 做法 一 水 之 隔 的 香港 就是 以 購物
說,的確,有,人 想成 是 賺錢 的 工作 財團 法人 台灣 兒童 及 家庭 扶助 基金會 台北縣 分事務所 主任 尤清梅 說 的確 有 人 要求 擔任 寄養 家庭 以 貼補 家用 不過 只要 是 這 種 心態 基金會 一概 不
不明,的確,風,過世 遭逢 不幸 有 學者 指出 在 侯孝賢 早期 的 新 電影 當中 父親 形象 一向 十分 隱晦 不明 的確 風 片 阿清 的 父親 被 球 打傷 而 神志 不清 影片 末尾 終於 病逝 童 片 阿孝咕
發展,的確,具有,是 一 篇 相當 出色 的 科幻 小說 有 足以 服人 的 電腦 科技 常識 電腦 的 潛在 發展 的確 具有 小說 中 描述 的 可能性 只是 2013 時間 太 近 了 不易 取信 有 身手 不凡 的
震盪,難免,但,大跌 18158 點 收 483358 點 市場 認為 美 伊 戰事 一觸即發 已 導致 買盤 觀望 行情 短期 震盪 難免 但 祗要 戰爭 一 開打 反倒 是 有 可能 出現 利空出盡 的 利多 解讀 近日 美股 動態 是
中,總是,不,學生 的 投票 活動 等 才 是 學校 責無旁貸 的 功能 長期 以來 交通 事故 在 新聞 報導 中 總是 不 缺席 高雄 捷運 正 如火如荼 進行 施工 可 預見 交通 黑暗期 的 到來 而 年節 將 近
主角,總是,在外,再 加上 母親 忙於 家務 疏於 管教 似乎 導致 風 片 和 童 片 的 劇 中 男 主角 總是 在外 耍 流氓 打架 鬧事 而 這 是否 也 是 侯孝賢 年輕 時 的 寫照 而 這 是否
論述,總是,離不開,前衛 的 看法 後現代 主義 一 詞 的 使用 以 1934年 弗奧尼斯 FOnis 西班牙 作家 為先 其後 一些 論述 總是 離不開 比 現代 更 現代 比 前衛 更 前衛 的 思考 模式 正 如 英國 後現代 評論家 詹克斯
他們,總是,皺,欣賞 佛拉明歌 雖然 不 太 懂 可是 那 種 氣氛 非常 喜歡 但 有 一 個 疑問 為什麼 他們 總是 皺 著 眉頭 跳 得 彷彿 很 痛苦 仙女 顰眉蹙額 並 不 代表 著 愁慮 痛苦 比方說 夫妻
平常,總是,嘮叨,再 創造 的 全程 參與 是 我 舞蹈 生涯 中 甜美 的 收穫 我 的 老公 團長 徐進豐 平常 總是 嘮叨 埋怨 入錯 行 我 可 不 而且 還要 繼續 走下去 無論 世事 如何 變化 對 舞蹈 的
他們,總是,輕輕巧巧,深怕 他們 下 一 個 轉彎 下 一 個 路口 就 會 被 兇惡 的 車潮 吞噬 然而 他們 總是 輕輕巧巧 若無其事 地 滑過 了 這 個 場景 代表 了 成人 世界 與 青少年 的 交會 也 是
卻,總是,不,去 反而 為 火熱 的 激情 燃燒 是 寤昧 之 際 冷不防 噬咬 的 心魔 是 亟欲 出走 卻 總是 不 知 頻頻 召喚 回頭 的 鄉愁 若 說 鋼琴 是 迢遠 的 父 之 名 交響樂 卻
也,有助於,增加,運用 對於 一向 對 我國 友好 國家 不妨 主動 伸出 友誼 的 手 不僅 可以 廣為 招徠 觀光客 也 有助於 增加 台灣 的 國際 能見度 再者 採取 金額 補助 做法 鼓勵 國際 會議 在 台 召開 也 很
是,有助於,股市,水準 停泊 在 貨幣 市場 資金 高達 2兆 美金 SampP 500 大盤 市值 近 30 價值 與 資金面 是 有助於 股市 表現 本 週 經濟 數據 包括 12月份 耐久財 訂單 個人 支出 與 所得 1月份 消費者 信心 與
應,有助於,推升,跡象 市場 焦點 再度 轉向 較 具 防禦性 的 債券 資產 短期 內 防禦 資產 的 需求 增加 應 有助於 推升 政府 債券 價格 可 有效 地 規避 股市 的 波動 風險 不過 中長期 而言 美 伊 戰爭
步,有助於,整體,宋 兩 人 應 儘速 會面 就算 一 次 不能 談攏 但 至少 是 整合 的 重要 一 步 有助於 整體 氣勢 的 提升 而 王金平 也 認為 應 儘快 在 三月 間 確定 一 組 人選 由
