left_word,target_word,right_word,context
的,難得,經驗,周 起 前進 海外 比莉 與 徐華鳳 這 兩 天 陸續 前往 澳門 享受 在 外國 被 整 的 難得 經驗 比莉 首次 到 澳門 被 整 到 當街 下跪 求情 徐華鳳 則 被 翁虹 耍 大牌 修理
裝置,畢竟,有,人體 臨床 試驗 可能 還要 等上 很 長 一 段 時間 甚至 十 年 以上 在 腦部 植入 裝置 畢竟 有 其 風險 甚或 後遺症 要 獲得 聯邦 食品 暨 藥物 管理局 FDA 核准 並非 易 事 美國
人,的確,很,主動 要 戒酒 鄧氏 夫妻 的 恩愛 溢於言表 一來一往 之間 就 像 是 小 夫妻 劉雪華 說 兩 人 的確 很 浪漫 直到 現在 還 能 每 天 聊 上 四 五 個 鐘頭 是 真正 的 談
隔閡感,的確,值得,可是 被 小燕姐 稱做 葉楓姐 的 葉楓 卻 是 架子 全 無 親切 平易近人 化解 時間 帶來 的 隔閡感 的確 值得 現在 的 藝人 好好 學習 六年級生 以後 的 新新人類 可能 不 知道 葉楓 是 誰 卻 可能
快樂,的確,葉楓,葉楓 說 我 啊 一 談戀愛 就 要 結婚 全心全意 但 相互 不要 有 壓力 不然 在一起 不 快樂 的確 葉楓 這些 年 晚睡 晚起 但 臉 上 皮膚 光滑 鮮少 皺紋 除了 睡飽 讓 自己 常 保
還是,難免,有所,在 國際 大 小 影展 上 奪 獎 獲得 國際 影壇 的 重視 只是 在 挑選 代表作 時 還是 難免 有所 遺憾 包括 侯孝賢 導演 的 威尼斯 影展 金獅獎 名作 悲情 城市 柯一正 的 我 愛 瑪莉 張毅
他,總是,會,陪 我 一起 度過 真的 很 感激 他 翁虹 說 辛隆 是 一 個 很 風趣 的 人 他 總是 會 帶給 朋友 們 快樂 對於 翁虹 的 表白 一向 嘻嘻哈哈 帶過 感情 話題 的 辛隆 依舊 用
辦事處,有助於,掌握,還 需 待 國銀 大陸 辦事處 運作 一 段 時間 才 知道 至少 初期 國銀 在 大陸 設立 辦事處 有助於 掌握 台商 動態 落實 徵信 工作 避免 債留台灣 這 點 是 正面 的 反對 開放 八 吋 晶圓
將,有助於,將,投資 產值 以 每 年 一五 的 幅度 成長 再 加上 我國 高科技 人才 不足 八 吋 外移 將 有助於 將 人才 轉入 十二 吋 廠 我們 認為 整體 上 並 不會 造成 負面 影響 她 並 說
